title,score,upv_ratio,id,url,comms_num,created,body
‘Hypocrites and greenwash’: Greta Thunberg blasts leaders over climate crisis,289,0.98,jqvk2r,https://www.theguardian.com/environment/2020/nov/09/hypocrites-and-greenwash-greta-thunberg-climate-crisis,9,2020-11-9,
2020 looks like the year US renewables first out-produce coal | Eco Planet News,288,0.99,gliqbj,https://ecoplanetnews.com/2020/05/15/2020-looks-like-the-year-us-renewables-first-out-produce-coal/,0,2020-5-18,
Amazon threatens to fire employees for campaigning against climate change,289,0.98,emb4wl,https://www.independent.co.uk/news/world/americas/amazon-employees-climate-change-campaign-jeff-bezos-staff-workers-a9269031.html,21,2020-1-9,
"The warming Arctic permafrost may be releasing more nitrous oxide, a potent greenhouse gas, than previously thought",289,0.98,dy30vz,https://news.harvard.edu/gazette/story/2019/06/harvard-chemist-permafrost-n2o-levels-12-times-higher-than-expected/,27,2019-11-18,
"If Emissions Continue, India Could See 1 Million Heat Deaths a Year",292,0.98,dr2dc3,https://www.scientificamerican.com/article/if-emissions-continue-india-could-see-1-million-heat-deaths-a-year/?,31,2019-11-4,
Travellers shun plane travel as 'flight shame' movement grows,286,0.94,bx0ve8,http://www.traveller.com.au/get-a-train-travellers-shun-plane-travel-as-flight-shame-movement-grows-h1f2qh,77,2019-6-5,
Canada's last intact ice shelf broke off. It took our research station with it,285,1.0,jax49e,https://www.theguardian.com/us-news/2020/oct/14/canadas-last-intact-ice-shelf-broke-off-it-took-our-research-station-with-it,7,2020-10-14,
"Gas Companies Are Abandoning Their Wells, Leaving Them to Leak Methane Forever",287,0.99,iuk3hm,https://www.bloomberg.com/news/features/2020-09-17/abandoned-gas-wells-are-left-to-spew-methane-for-eternity?srnd=premium,23,2020-9-17,
Scientists confirm dramatic melting of Greenland ice sheet | Climate change,289,0.99,g208zu,https://www.theguardian.com/science/2020/apr/15/scientists-confirm-dramatic-melting-greenland-ice-sheet,17,2020-4-16,
New Documents Show How Trump Interior Official Pushed Climate Misinformation into Federal Reports,290,0.99,fdmu7w,https://www.desmogblog.com/2020/03/04/new-york-times-climate-misinformation-indur-goklany-interior-heartland,12,2020-3-5,
'Greta Thunberg effect' blamed for surprise Austrian election result,290,0.97,dbkruk,https://www.smh.com.au/world/europe/greta-thunberg-effect-blamed-for-surprise-austrian-election-result-20190930-p52w86.html,21,2019-10-1,
When Alexandria Ocasio-Cortez met Greta Thunberg: 'Hope is contagious' | Environment,289,0.97,c6wzcc,https://www.theguardian.com/environment/2019/jun/29/alexandria-ocasio-cortez-met-greta-thunberg-hope-contagious-climate,5,2019-6-29,
Climate Protest in Canada today. This guy got arrested for mischief after using chalk on the walk way there.,290,0.99,bslxi3,https://i.redd.it/ed11wx1sz7031.jpg,14,2019-5-25,
Alexandria Ocasio-Cortez on Twitter: @JayInslee’s climate plan is the most serious + comprehensive one to address our crisis in the 2020 field,286,0.97,bqqq10,https://twitter.com/AOC/status/1129856374605832193,12,2019-5-20,
"35 000 Belgian High School students skipped school to urge the Belgian government to adopt solid and effective climate change policies. Third week in a row of skipping school (first week: 3000 students, second week: 12 500 students, now 35 000 students) #YouthForClimate",290,0.99,aje6qo,https://v.redd.it/j2dhmcw0ycc21,2,2019-1-25,
The Vatican urges Catholics to stop investing in fossil fuels and in businesses detrimental to the environment,287,0.99,hee43m,https://www.reddit.com/r/climate/comments/hee43m/the_vatican_urges_catholics_to_stop_investing_in/,12,2020-6-23,"https://pvbuzz.com/vatican-catholics-stop-investing-fossil-fuels/

The calls were contained in a 225-page manual for church leaders and workers."
Trump Withholding $823 Million for Clean Energy,283,0.98,ezhbiy,https://www.bloomberg.com/news/articles/2020-02-05/trump-withholding-823-million-for-clean-energy-democrats-say,15,2020-2-6,
BREAKING: Extinction Rebellion London warehouse raided by cops,288,0.98,ddpa2y,https://freedomnews.org.uk/breaking-extinction-rebellion-london-warehouse-raided-by-cops/,38,2019-10-6,
The US election is a vote on climate change for the whole world,284,0.96,jmf33u,https://www.cnn.com/2020/11/01/world/us-election-climate-crisis-intl-dst-hnk/index.html,9,2020-11-2,
"Edison invented the lightbulb by the glow of his candles, and the Wright brothers travelled to Kitty Hawk by wagon. To face the challenges presented by the climate crisis, we need to do the same: using the tools of today, not tomorrow.",285,0.97,em5cxd,https://finnshewell.com/news-notes/2019/using-old-tools-to-create-new-systems,28,2020-1-9,
"Big Oil Is in Trouble. Its Plan: Flood Africa With Plastic. Faced with plunging profits and a climate crisis that threatens fossil fuels, the industry is demanding a trade deal that weakens Kenya’s rules on plastics and on imports of American trash.",280,1.0,ijg2pt,https://www.nytimes.com/2020/08/30/climate/oil-kenya-africa-plastics-trade.html,9,2020-8-31,
"Climate Requires All Hands on Deck. Yes, Even Wall Street.",284,0.98,hxusp2,https://medium.com/unculture/climate-change-requires-all-hands-on-deck-7588b08ab2c4?source=friends_link&sk=9450760b74c3e2d87bca03bb2ad71591,27,2020-7-26,
"Yes, the Climate Crisis May Wipe out Six Billion People -- Creator of the ‘ecological footprint’ on life and death in a world 4 C hotter.",280,0.94,ecluyk,https://thetyee.ca/Analysis/2019/09/18/Climate-Crisis-Wipe-Out/,31,2019-12-19,
Why The Climate Movement Must Unite Behind The Black Lives Matter Movement,282,0.89,hd7tps,https://www.theelders.org/news/why-climate-movement-must-unite-behind-black-lives-matter-movement,29,2020-6-21,
"Mick Jagger Condemns Trump Administration’s Climate Change Stance: “The U.S. should be the world leader in environmental control but now it has decided to go the other way,” singer says at Venice Film Festival’s Burnt Orange Heresy premiere",283,0.96,d1cs71,https://www.rollingstone.com/music/music-news/mick-jagger-trump-climate-change-venice-881402/,5,2019-9-9,
Climate demonstration in Paris today (24/05),283,0.99,bsfzc2,https://i.redd.it/4x86oyc8e5031.jpg,12,2019-5-24,
"One of the biggest climate change stories hardly anyone is talking about -- what's happening to plankton, the stuff that produces half of our oxygen.",287,0.99,bkyaix,https://www.youtube.com/watch?v=cQ-vrAxOg0c&fbclid=IwAR31sClZG0_E7FpteNQiMBLh8vVud4WxGsPvmB_BporAaWThPcyBwhzYIrY,8,2019-5-5,
"Earth breaks September heat record, may reach warmest year- Earth has had 44 straight Septembers where it has been warmer than the 20th century average and 429 straight months without a cooler than normal month, according to NOAA. The hottest seven Septembers on record have been the last seven.",283,0.98,jbms8e,https://apnews.com/article/science-climate-climate-change-5282059feae2661424d7ff3fd5ad4044?utm_campaign=Hot%20News&utm_medium=email&_hsmi=97476954&_hsenc=p2ANqtz-9I-iFRzsWDyF_ijn-2T8Pu0pXfT8SqAYBRGXy6QRKDuXjL5GmAMR38bjmbTJI4SsxjimvIF7I8EXYRZW2ldWltQdfCFA&utm_content=97476954&utm_source=hs_email,7,2020-10-15,
"Sorry, Climate Change Hasn’t Gone Away Just Because Of COVID-19",282,0.97,fwcl59,https://www.forbes.com/sites/lauratenenbaum/2020/04/06/sorry-climate-change-hasnt-gone-away-just-because-of-covid-19/#1c3a35f54e7b,21,2020-4-7,
"White House likely to pursue federal aid for fossil fuel companies hit by oil shock, coronavirus downturn instead of supporting workers in any kind of meaningful way",281,0.99,fgic6e,https://www.washingtonpost.com/business/2020/03/10/trump-oil-bailout/,23,2020-3-11,
Jane Fonda plans climate change civil disobedience on the Capitol steps,284,0.96,dgf2fw,https://www.washingtonpost.com/climate-environment/jane-fonda-plans-climate-change-civil-disobedience-on-the-capitol-steps/2019/10/10/c7cd534e-eab1-11e9-9306-47cb0324fd44_story.html,17,2019-10-11,
A Brief History of CO2 Emissions,277,0.99,g8v84s,https://v.redd.it/dmsyrkvc0bv41,16,2020-4-27,
Warmest Oceans on Record Could Set Off a Year of Extreme Weather,282,0.98,g3zwrn,https://www.bloomberg.com/news/articles/2020-04-18/warmest-oceans-on-record-could-set-off-a-year-of-extreme-weather,19,2020-4-19,
New Zealand passes historic zero carbon bill with near unanimous bipartisan support,280,0.99,dy8h5k,https://reneweconomy.com.au/new-zealand-passes-historic-zero-carbon-bill-with-near-unanimous-bipartisan-support-33500/,4,2019-11-19,
Alexandria Ocasio-Cortez to Rally for Green New Deal in Washington,278,0.94,blqbg0,https://www.nytimes.com/2019/05/06/us/politics/aoc-green-new-deal.html?rref=collection%2Fsectioncollection%2Fclimate&action=click&contentCollection=climate&region=stream&module=stream_unit&version=latest&contentPlacement=2&pgtype=sectionfront,16,2019-5-7,
Insurance increasingly unaffordable as climate change brings more disasters,277,0.99,ik9in3,https://www.marketplace.org/2020/08/31/insurance-increasingly-unaffordable-as-climate-change-brings-more-disasters/,33,2020-9-1,
"This is the reality of climate change. Some of the 3,000 dead Grey-headed Flying-foxes (threatened species) killed by heat stress in Kangaroo Valley last weekend",280,0.98,ez763y,https://twitter.com/BRINK_1936/status/1224449528385851401,10,2020-2-5,
"Zimbabwe, Victoria Falls dries to a trickle after worst drought in a century. One of southern Africa’s biggest tourist attractions has seen an unprecedented decline this dry season, fuelling climate change fears",280,0.98,e79p5m,https://www.theguardian.com/world/2019/dec/07/victoria-falls-dries-to-a-trickle-after-worst-drought-in-a-century,9,2019-12-7,
Americans have never been known to run from a battle. Until climate change.,283,0.98,bn3m8r,https://www.newsweek.com/climate-change-climate-emergency-usa-run-battle-1422047,21,2019-5-11,
"As the seas rise, Republicans will deserve all the blame their grandchildren assign them",281,0.96,bdg4oe,https://www.washingtonpost.com/opinions/as-the-seas-rise-republicans-will-deserve-all-the-blame-their-grandchildren-assign-them/2019/04/12/de26f7ec-5c88-11e9-842d-7d3ed7eb3957_story.html?utm_term=.1ab8dee78d8b,19,2019-4-15,
Bold climate action could add $26 trillion to world economy: study,278,0.98,bd2snb,https://phys.org/news/2018-09-climate-action-trillion-world-economy.html,19,2019-4-14,
Progressives say dire climate reports point to need for ‘Green New Deal',277,0.98,a1rxvv,https://thehill.com/policy/energy-environment/419014-progressives-say-dire-climate-reports-point-to-need-for-green-new,17,2018-11-30,
A Democrat Ran on Climate Change in a Republican Stronghold—and Won. Sean Casten's win in Illinois 6th Congressional District is a lesson for the Democratic Party.,280,0.97,9wet9i,https://newrepublic.com/article/152176/democrat-ran-climate-change-republican-strongholdand-won,9,2018-11-12,
Days with both extreme heat and extreme air pollution are becoming more common – which can't be a good thing for global health,278,1.0,hg6hfs,http://theconversation.com/days-with-both-extreme-heat-and-extreme-air-pollution-are-becoming-more-common-which-cant-be-a-good-thing-for-global-health-139957,4,2020-6-26,
The global climate strike has started!,280,0.99,d6lhez,https://i.imgur.com/RSUJs9k.png,7,2019-9-20,
"Trump disbanded it, but climate change panel regroups to release its report",276,0.97,b9qfru,https://edition-m.cnn.com/2019/04/04/us/climate-change-panel-continues-scn/index.html?utm_campaign=Carbon%20Brief%20Daily%20Briefing&utm_medium=email&utm_source=Revue%20newsletter,38,2019-4-5,
"6,000 Climate Activists Block 5 London Bridges, Demand Urgent Action",276,0.98,9yhmfo,https://www.ecowatch.com/climate-change-activists-london-2620658243.html,11,2018-11-19,
Jeff Bezos and the Golden Age of Climate Hypocrisy,279,0.99,jes6ue,https://newrepublic.com/article/159795/jeff-bezos-golden-age-climate-hypocrisy,20,2020-10-20,
Homes of wealthy Americans have carbon footprints 25% higher than lower-income residences,274,0.98,hv2cnk,https://phys.org/news/2020-07-homes-wealthy-americans-carbon-footprints.html,19,2020-7-21,
"Meat consumption must drop by 90% to avert climate crisis, report warns",277,0.94,ahaa08,https://www.irishtimes.com/business/agribusiness-and-food/meat-consumption-must-drop-by-90-to-avert-climate-crisis-report-warns-1.3760363,95,2019-1-18,
'What could I have done?' The scientist who predicted the bushfire emergency four decades ago | Australia news,277,0.98,dxjrg0,https://www.theguardian.com/australia-news/2019/nov/17/what-could-i-have-done-the-scientist-who-predicted-the-bushfire-emergency-four-decades-ago,6,2019-11-17,
Court Blocks Trump’s Plan to Ease Bird Protections on Oil Lands | Eco Planet News,277,0.99,dvx4yu,https://ecoplanetnews.com/2019/11/13/court-blocks-trumps-plan-to-ease-bird-protections-on-oil-lands/,5,2019-11-14,
Greta Thunberg Can’t Do This Alone: How To Join The Fight Against Climate Change,277,0.98,d93jqh,https://www.refinery29.com/en-us/2019/09/8467683/how-to-help-climate-change-greta-thunberg,12,2019-9-25,
"99.9999 percent chance we're the cause of global warming, study says",277,0.98,avdyfc,https://www.usatoday.com/story/news/nation/2019/02/26/global-warming-99-9999-percent-chance-humans-cause/2994043002/,20,2019-2-27,
"8 percent of Americans recently changed their minds on climate. A majority of Republicans now think that climate change is happening, and caused by human activity.",275,0.98,agrvu6,https://grist.org/article/8-percent-of-americans-recently-changed-their-minds-on-climate-what-gives/,29,2019-1-17,
"Maryland ranks as the #1 state for emissions reduction, with Idaho falling in last place",277,0.99,i3jznf,https://grist.org/climate/which-states-are-making-the-most-progress-on-emissions-not-the-ones-you-think/,6,2020-8-4,
Millions Marched for Climate. Here's What's Next.,274,0.98,dag004,https://thenewclimate.com/2019/09/28/millions-marched-for-climate-heres-whats-next/,6,2019-9-28,
Attenborough climate show a 'call to arms',273,0.97,bfnzjh,https://www.bbc.com/news/entertainment-arts-47988337,28,2019-4-21,
"Massive Fruit bat die off in Australia. They are ""the canary in the coal mine for climate change ... because they tend to live in closer proximity to human settlements than other wild creatures, a deadly event like this is more obvious to humans.",275,0.98,ainmmn,https://www.popularmechanics.com/science/animals/a25953660/spectacled-fruit-bat-killed-heat-wave/,14,2019-1-22,
"‘We Need to Hear These Poor Trees Scream’: Unchecked Global Warming Means Big Trouble for Forests | New studies show drought and heat waves will cause massive die-offs, killing most trees alive today.",271,0.98,g8zz4c,https://insideclimatenews.org/news/24042020/forest-trees-climate-change-deforestation?utm_campaign=Hot%20News&utm_source=hs_email&utm_medium=email&utm_content=86999495&_hsenc=p2ANqtz-91Bx3k49AmtMPcSdBuk0A1fBhduiQO4LJAxyOWmXBzj7SXxDkGZuUmd5vqUMGtJvOSQEyc32NL2XLAADkMp62Wgo4OCg&_hsmi=86999495,11,2020-4-27,
The best thing you can do to stop climate change is to vote against Republicans,275,0.92,a11akt,https://www.vox.com/2018/11/27/18112540/what-can-we-do-to-stop-climate-change,109,2018-11-28,
"Bill Gates issued a stark warning for the world: 'As awful as this pandemic is, climate change could be worse'",270,0.99,i49m5d,https://www.businessinsider.com/bill-gates-coronavirus-warning-climate-change-worse-than-covid-2020-8,12,2020-8-6,
"Insects quietly becoming extinct, and why we should be worried | Saturday Star",273,0.98,exlv6i,https://www.iol.co.za/saturday-star/news/insects-quietly-becoming-extinct-and-why-we-should-be-worried-41867552,9,2020-2-2,
Climate Change Is Here. So Why Don't More People Give a Shit?,271,0.97,broxyc,https://www.thestranger.com/slog/2019/05/21/40264616/climate-change-is-here-so-why-dont-more-people-give-a-shit,51,2019-5-22,
"America landed a man on the moon. Climate change calls for the same bold, can-do spirit. | The Green New Deal is the first step in meeting the climate challenge, and yes, the devil is in the details. We need to start working on this now.",274,0.96,ati0u2,https://www.usatoday.com/story/opinion/2019/02/22/climate-change-green-new-deal-moon-landing-boldness-maloney-column/2926398002/,17,2019-2-22,
"ExxonMobil’s alleged role in spreading misinformation about climate change will be scrutinised by the European Union for the first time, in a move welcomed by campaigners.",275,0.98,a74yhf,https://www.theguardian.com/business/2018/dec/17/meps-to-scrutinise-exxonmobil-alleged-role-in-climate-change-misinformation,3,2018-12-18,
Chevron Is Trying to Crush a Prominent Climate Lawyer—and Maybe the World,272,0.99,i7xj9p,https://earther.gizmodo.com/chevron-is-trying-to-crush-a-prominent-climate-lawyer-a-1844685508,7,2020-8-12,
Billions projected to suffer nearly unlivable heat in 2070,272,0.96,gdqg1d,https://phys.org/news/2020-05-billions-unlivable.html,47,2020-5-5,
NASA: Amazon rainforest is drying out and is vulnerable to wildfires,271,0.99,dshfwx,https://metro.co.uk/2019/11/06/amazon-rainforest-drying-vulnerable-cataclysmic-wildfires-nasa-reveals-11051252/,12,2019-11-6,
"Idaho lawmakers hold 1st climate change hearing — and no one argued about its existence, causes",271,0.97,azu3t3,https://www.idahostatesman.com/news/local/news-columns-blogs/letters-from-the-west/article227214509.html,9,2019-3-11,
Nearly Two Billion Dollars Spent on Anti-Climate Science Legislative Lobbying 2000 to 2016,272,0.98,a8mosi,https://climatediscovery.org/nearly-two-billion-dollars-spent-on-anti-climate-science-legislative-lobbying-2000-to-2016/,6,2018-12-23,
"These Zombies Threaten the Whole Planet: Canada's oil patch has nearly 100,000 suspended wells, neither active nor capped, and they're a worrying source of planet-warming methane.",275,0.99,jkzrwy,https://www.nytimes.com/2020/10/30/climate/oil-wells-leak-canada.html?,9,2020-10-31,
The amount of fires in Brazil is even higher now than they were in 2019,273,0.99,i5bikc,https://i.redd.it/sbg9ys8q6kf51.jpg,37,2020-8-7,
U.S. renewable energy consumption surpasses coal for the first time in over 130 years,268,0.99,gt2p5x,https://www.eia.gov/todayinenergy/detail.php?id=43895&src=email,10,2020-5-30,
Greenland's Massive Ice Melt Wasn't Supposed to Happen Until 2070,272,0.98,d4vqsh,https://www.forbes.com/sites/scottsnowden/2019/08/16/greenlands-massive-ice-melt-wasnt-supposed-to-happen-until-2070/#6690975f4894,20,2019-9-16,
Climate change: Warming world will be 'devastating' for frozen peatlands - BBC News,268,0.98,i7e4yj,https://www.bbc.co.uk/news/science-environment-53726487,8,2020-8-11,
"Unchecked Global Warming Could Collapse Whole Ecosystems, Maybe Within 10 Years: A new study shows that as rising heat drives some key species extinct, it will affect other species, as well, in a domino effect.",272,0.98,fy3msv,https://insideclimatenews.org/news/07042020/global-warming-ecosystem-biodiversity-rising-heat-species,14,2020-4-10,
A plague of locusts has descended on East Africa. Climate change may be to blame.,273,0.98,fbtm9y,https://www.nationalgeographic.com/science/2020/02/locust-plague-climate-science-east-africa/,9,2020-3-1,
Environmental group calls on the government to save the Great Barrier Reef,271,0.99,cyaeow,https://therising.co/2019/08/31/environmental-group-calls-on-the-government-to-save-the-great-barrier-reef/,8,2019-9-1,
"In response to the over 1000% increase in downloads, the tree-planting search engine Ecosia wants to plant an additional 2 million trees in Brazil!",274,0.99,cwl7jm,https://blog.ecosia.org/1-2-million-trees-for-brazil/,8,2019-8-28,
Ocasio-Cortez’s righteous — and accurate — anger about poverty and the environment,271,0.95,b6ierh,https://www.washingtonpost.com/politics/2019/03/27/ocasio-cortezs-righteous-accurate-anger-about-poverty-environment/?utm_term=.0e7c81328bf0,36,2019-3-28,
The world is paying a high price for cheap clothes,268,0.98,gcz6vr,https://www.cnn.com/2020/05/03/business/cheap-clothing-fast-fashion-climate-change-intl/index.html,9,2020-5-4,
Climate Change Made 2019 The Warmest Year On Record for Europe. The continent is heating at a faster rate than the global average.,268,0.98,g7okk1,https://www.forbes.com/sites/emanuelabarbiroglio/2020/04/25/climate-change-made-2019-the-warmest-year-on-record/,0,2020-4-25,
‘Fossil Fuel Companies Knew’: Honolulu Files Lawsuit Over Climate Impacts,272,1.0,fg6l5o,https://www.desmogblog.com/2020/03/09/fossil-fuel-companies-knew-honolulu-hawaii-lawsuit-climate-impacts,4,2020-3-10,
"Climate change now detectable from any single day of weather at global scale: The fingerprint of climate change is detected from any single day in the observed global record since early 2012, and since 1999 on the basis of a year of data.",269,0.99,ej3x3d,https://www.nature.com/articles/s41558-019-0666-7,13,2020-1-3,
Thousands forced to take refuge on Australian beach as deadly wildfires close in. Fires like this are made more likely by global warming,268,0.99,ei65jw,https://www.washingtonpost.com/weather/2019/12/31/australia-fires-mallacoota-beach/,9,2020-1-1,
States Sue Trump Administration Over EPA’s New ‘Dirty Power’ Rule,269,0.98,cq99os,https://www.bloomberg.com/news/articles/2019-08-13/trump-team-is-sued-by-states-over-epa-s-new-dirty-power-rule,6,2019-8-14,
Bernie Sanders talking to kids about climate change in 1987,267,0.95,aua0xr,https://twitter.com/People4Bernie/status/1099155658924974081,1,2019-2-25,
First active leak of sea-bed methane discovered in Antarctica,271,0.98,hwfxfz,https://www.theguardian.com/environment/2020/jul/22/first-active-leak-of-sea-bed-methane-discovered-in-antarctica,14,2020-7-23,
"Over the past year, Americans have become more likely to say that climate change is real, and that it is happening now. People didn't become more inclined to say that they expect to be affected personally",269,0.99,is410n,https://twitter.com/KHayhoe/status/1304843729765834753,11,2020-9-14,
California’s budget cuts include canceling billions in climate change spending,265,0.98,gl97cb,https://ktla.com/news/california/californias-budget-cuts-include-cancelling-billions-in-climate-change-spending/,27,2020-5-17,
"Cars reached record fuel efficiency, EPA data shows, just in time for a Trump rollback",267,0.99,fewauh,http://www.marketwatch.com/story/cars-reached-record-fuel-efficiency-epa-data-shows-just-in-time-for-a-trump-rollback-2020-03-03,8,2020-3-7,
Former Exxon Scientists Tell Congress of Oil Giant’s Climate Research Before It Turned to Denial,267,0.99,dmf7v7,https://insideclimatenews.org/news/23102019/exxon-scientists-climate-research-testify-congess-denial,5,2019-10-24,
This is pretty much the truth,269,0.94,bz9tiu,https://i.redd.it/w24qnk9uso331.jpg,15,2019-6-11,
California Gov. Brown says we must go to war against climate change,267,0.98,abn8hm,https://www.earth.com/news/california-gov-brown-war-climate-change/,35,2019-1-2,
Climate sceptics say they should have right to 'mislead public' because of free speech,267,0.98,a2no6i,https://www.independent.co.uk/environment/climate-change-sceptic-mislead-pulbic-inaccurate-statements-free-speech-plea-mps-a7657951.html,35,2018-12-3,
"Hi, I am living in Kobe, Japan, We are petitioning our local government to declare Climate Emergency, the overwhelming mood of local Japanese is that they can do nothing about climate change so they ignore it. We hope to change this change this. Please sign our petition (English)",264,0.98,famdbh,https://www.reddit.com/r/climate/comments/famdbh/hi_i_am_living_in_kobe_japan_we_are_petitioning/,18,2020-2-28,"Click the link below to sign. (English version)

[https://www.change.org/p/kobe-city-japan-declare-a-climate-emergency?lang=en-GB](https://www.change.org/p/kobe-city-japan-declare-a-climate-emergency?lang=en-GB) 

We really appreciate any signatures, although Japan has comitted to ""net zero"" carbon emissions by 2050, the reality of life here is very far from this aspiration. In Kobe city alone, planning permission has been granted for the expansion of a huge coal power plant which is due to run for 30 years. We hope that a declaration of Climate Emergency will make our government focus policies towards greener energy and inspire other local governments to do so too.

Thank you for your time."
"Fake Science Is a Real Danger: I once thought these scientists were being paranoid. Then I learned about the tobacco, pesticide, and climate disinformation industry targeting their research and reputations.",266,0.99,f6edur,https://www.drillednews.com/post/fake-science-is-a-real-danger,12,2020-2-20,
NPR to expand climate reporting,263,1.0,esc7r4,https://www.npr.org/sections/publiceditor/2020/01/17/797250970/update-nprs-climate-coverage-team-expanding,7,2020-1-22,
Agriculture Department buries studies showing dangers of climate change: The Trump administration has stopped promoting government-funded research into how higher temperatures can damage crops and pose health risks.,266,0.98,c4dt37,https://www.politico.com/story/2019/06/23/agriculture-department-climate-change-1376413,8,2019-6-24,
Watching the Great Barrier Reef die first hand. This is a short 3min film I made over 5 years of working up on the Barrier Reef. It’s insane how bad this has become,264,0.99,c334dm,https://www.youtube.com/watch?v=gW789yyt7q0,25,2019-6-21,
Democratic presidential candidates are talking about climate because it is now the top issue for registered Democrats,264,0.98,bj9tro,https://thehill.com/policy/energy-environment/441344-climate-change-is-the-top-issue-for-registered-democratic-voters,19,2019-5-1,
"German politicians express relief, hope for climate cooperation after Biden win",267,0.98,jqvaec,https://www.cleanenergywire.org/news/german-politicians-express-relief-hope-climate-cooperation-after-biden-win,11,2020-11-9,
