title,score,upv_ratio,id,url,comms_num,created,body
Study Warns Carbon-Saturated Oceans Headed Toward Tipping Point That Could Unleash Mass Extinction Event,361,0.98,cbu88f,https://www.commondreams.org/news/2019/07/09/completely-terrifying-study-warns-carbon-saturated-oceans-headed-toward-tipping?fbclid=IwAR0Y1dPu0AqQI3iM-5Qin_aluo4MHD1dU7_dzQIcAZdcZr1B7LMyjnIn4YI,21,2019-7-11,
"We have too many fossil-fuel power plants to meet climate goals: 'To limit warming to 1.5°C., not only should no new fossil-fuel-using infrastructure be built, ever again, some existing power plants need to shut down early - and yet today many new power plants are under construction or planned.'",359,0.99,ca7pvr,https://www.nationalgeographic.com/environment/2019/07/we-have-too-many-fossil-fuel-power-plants-to-meet-climate-goals/?cmpid=org=ngp::mc=social::src=reddit::cmp=editorial::add=rt20190702env-toomanyfossilfuelplants::rid=,24,2019-7-7,
"How Did We Get From Earth Day To Trump? | Fifty years after the first Earth Day, the connection between the environment and human health has never been more obvious.",366,0.98,g60n0t,https://www.huffpost.com/entry/earth-day-50-trump_n_5e99e63ec5b6ff41590c0037?utm_campaign=Hot%20News&utm_source=hs_email&utm_medium=email&utm_content=86670995&_hsenc=p2ANqtz-__UCAN1lWZ7loJz7tqWLAbUsjMMvuM92q3ulfE5A7b1BmGRWsjObFnPce3cCUoxllHNCVV1rnEenZmCvSlbkwWkinQYw&_hsmi=86670995,19,2020-4-22,
Think This Pandemic Is Bad? We Have Another Crisis Coming: Addressing climate change is a big-enough idea to revive the economy.,360,0.98,g21s41,https://www.nytimes.com/2020/04/15/opinion/climate-change-covid-economy.html,19,2020-4-16,
"110 years of Australian climate, colour coded ranging from blue (3° below average) to brown (3° above average)",369,0.99,emlu6n,https://i.redd.it/yf0vyrohpv941.jpg,40,2020-1-10,
Boris Johnson was replaced by a melting ice sculpture after refusing to take part in a televised climate change debate,361,0.98,e385lf,https://www.businessinsider.com/video-boris-johnson-replaced-by-ice-sculpture-at-climate-debate-2019-11,6,2019-11-29,
Those Damn Youngsters Won’t Shut Up About Climate Change. That’s A Good Thing.,368,0.98,aln5u0,https://cleantechnica.com/2019/01/30/those-damn-youngsters-wont-shut-up-about-climate-change-thats-a-good-thing/,34,2019-1-31,
It Hit 80 Degrees F in the Arctic this Week,358,0.99,gp6t82,https://earther.gizmodo.com/it-hit-80-degrees-in-the-arctic-this-week-1843606717,34,2020-5-23,
We scientists must rise up to prevent the climate crisis. Words aren’t enough.,361,0.98,d0ibo2,https://www.theguardian.com/commentisfree/2019/sep/06/scientists-climate-crisis-activism-extinction-rebellion,16,2019-9-6,
Greta's World: How one Swedish teenager armed with a homemade sign ignited a crusade and became the leader of a movement,360,0.92,fsjdip,https://www.rollingstone.com/politics/politics-features/greta-thunberg-climate-crisis-cover-965949/,17,2020-4-1,
"Australia’s climate stance is inflicting criminal damage on humanity: The government opts for conflict rather than change, while suppressing details on the implications of its climate inaction",362,0.99,cli3cc,https://www.theguardian.com/commentisfree/2019/aug/03/australias-climate-stance-is-inflicting-criminal-damage-on-humanity,20,2019-8-3,
Trees Are Growing Fast and Dying Young Due to Climate Change,360,0.99,j5amr7,https://www.smithsonianmag.com/smart-news/trees-are-growing-fast-and-dying-young-due-climate-change-180975819/,15,2020-10-5,
The Federal Reserve Is Accelerating the Climate Crisis: Bailing out money-losing fossil fuel companies is not sound economic policy.,363,0.99,gbm9d8,https://newrepublic.com/article/157555/federal-reserve-accelerating-climate-crisis,17,2020-5-2,
US Navy quietly shut down climate change task force,357,0.98,cpe995,https://www.eenews.net/stories/1060877355,26,2019-8-12,
Climate emergency: global action is ‘way off track’ says UN head,358,0.99,fglbel,https://www.theguardian.com/environment/2020/mar/10/climate-emergency-global-action-way-off-track-says-un-head-coronavirus,12,2020-3-11,
Center for Biological Diversity Action Fund - Environmental Voter Guide,354,0.93,f8mjs3,https://i.redd.it/f68dloxn5ti41.png,62,2020-2-24,
'The Law Is on Our Side': Extinction Rebellion Celebrates Dropped Charges Against 105 Climate Activists,357,0.99,e2qm6b,https://www.commondreams.org/news/2019/11/27/law-our-side-extinction-rebellion-celebrates-dropped-charges-against-105-climate,2,2019-11-28,
"Heat to smash records every year across vast swathes of Earth. If emissions continue to rise, more than half the planet will regularly see monthly temperature records broken.",358,0.98,c2howg,https://www.nature.com/articles/d41586-019-01891-3,23,2019-6-19,
"We need big-picture climate stories, now. Americans are losing interest in the climate crisis. Newspapers have a responsibility to wake them up.",353,0.99,ifrr3n,https://heated.world/p/we-need-big-picture-climate-stories,24,2020-8-25,
We need major air conditioner innovation to keep us cool without warming the planet,357,0.98,hswp0e,https://www.fastcompany.com/90528822/we-need-major-air-conditioner-innovation-to-keep-us-cool-without-warming-the-planet,57,2020-7-17,
Six Portuguese youth file 'unprecedented' climate lawsuit against 33 countries,355,0.99,imnliy,https://www.climatechangenews.com/2020/09/03/six-portuguese-youth-file-unprecedented-climate-lawsuit-33-countries/,8,2020-9-5,
Smog-Free Skies Allow Germany to Break Record for Solar Power,357,0.99,g5e47m,https://www.bloomberg.com/news/articles/2020-04-20/smog-free-skies-allow-germany-to-break-record-for-solar-power,18,2020-4-21,
Democrats to offer $760B infrastructure plan with big climate theme,353,0.98,evmzpo,https://www.politico.com/news/2020/01/28/infrastructure-house-budget-climate-108396?utm_campaign=Hot%20News&utm_source=hs_email&utm_medium=email&utm_content=82587394&_hsenc=p2ANqtz-_rgjzd_q8JpFgaONpK_sZh2naWDHcUWZhC4rJl4q-ga5NGfgQvhaOO7PzHO3lAU8wxYUjNQJqKVwKVZPvIf--T4uItog&_hsmi=82587394,21,2020-1-29,
A Major but Little-Known Supporter of Climate Denial: Freight Railroads. Why did railroads invest millions in climate-science denial? Perhaps because coal makes up almost one of every three tons of American rail freight.,353,0.99,ebg3kt,https://www.theatlantic.com/science/archive/2019/12/freight-railroads-funded-climate-denial-decades/603559/,16,2019-12-16,
Take Action,356,0.97,djpntc,https://i.redd.it/q20wwf3npbt31.jpg,28,2019-10-19,
"Treat climate change like the crisis it is, says journalism professor",355,0.99,ccjmlb,https://www.cbc.ca/radio/thesundayedition/the-sunday-edition-for-july-7-2019-1.5198309/treat-climate-change-like-the-crisis-it-is-says-journalism-professor-1.5198311,14,2019-7-13,
You are alive at just the right moment to change everything,354,0.98,hwj9je,https://thecorrespondent.com/607/you-are-alive-at-just-the-right-moment-to-change-everything/80358689873-333eca96,21,2020-7-24,
It’s already getting too hot and humid in some places for humans to survive: Extreme conditions are happening more often than scientists previously thought,355,0.99,gfykbo,https://www.theverge.com/21252174/heat-humidity-human-survival-climate-change-science-advances,16,2020-5-9,
Democrats say coronavirus stimulus should not bail out fossil fuel companies,356,0.99,g2eibf,https://thehill.com/policy/energy-environment/492991-democrats-say-coronavirus-stimulus-should-not-bail-out-fossil-fuel?utm_campaign=Hot%20News&utm_source=hs_email&utm_medium=email&utm_content=86388136&_hsenc=p2ANqtz-9pgem_eFcoz7d-Z8HbzYiiABYTO0cpsBIbMKZS1STOeXkPEz3AxTEB7Z1Ln_E-Xs2mXQgpOkMHyAm6s9slsNGNk4p7dg&_hsmi=86388136,8,2020-4-16,
'Everyone Should Mobilize': Climate Leaders Urge Massive Turnout for Global Climate Strikes,358,0.99,ci6sgs,https://www.commondreams.org/news/2019/07/24/everyone-should-mobilize-climate-leaders-urge-massive-turnout-global-climate-strikes?cd-origin=rss&utm_term=AO&utm_campaign=Daily%20Newsletter&utm_content=email&utm_source=Daily%20Newsletter&utm_medium=Email,11,2019-7-27,
"The big problem with climate 'realism' | If you study the conclusions of climate science even cursorily, the truth is that we have procrastinated so long that we pretty much have to go full-tilt at everything with a decent chance of getting emissions down.",350,0.98,axlj6z,https://theweek.com/articles/826608/big-problem-climate-realism,43,2019-3-5,
Melting Antarctic Snow Is Revealing The Preserved Remains of 800-Year-Old Penguins,349,0.99,j4xli4,https://www.sciencealert.com/melting-antarctica-snow-is-revealing-the-remains-of-800-year-old-penguins,11,2020-10-4,
Alaska is getting wetter. That's bad news for permafrost and the climate,353,0.99,hxiaqk,https://phys.org/news/2020-07-alaska-wetter-bad-news-permafrost.html,3,2020-7-25,
"More than half of Americans (56%) understand that most scientists think global warming is happening, roughly a ~20% improvement from a decade ago",348,0.98,gpq28u,https://climatecommunication.yale.edu/wp-content/uploads/2020/05/climate-change-american-mind-april-2020b.pdf,42,2020-5-24,
Greta Thunberg responds to Meat Loaf's climate denial comments in the classiest way possible,359,0.94,ekv3s2,https://mashable.com/article/greta-thunberg-meat-loaf-response/?utm_source=feedburner&utm_medium=feed&utm_campaign=Feed%3A+Mashable+%28Mashable%29,36,2020-1-6,
The new science fossil fuel companies fear- Researchers can now link weather events to emissions – and to the companies responsible. A string of lawsuits is about to give “attribution science” a real-life test.,350,0.99,dliedr,https://www.politico.com/agenda/story/2019/10/22/attribution-science-fossil-fuels-climate-change-001290,3,2019-10-22,
"""Why is it so hard to believe that thousands of young people from all around the world have been simultaneously inspired and have followed each other's lead with no other motive but the single shared goal of staying alive on our dying planet?' - Eric Holthaus",354,0.98,arfba7,https://twitter.com/EricHolthaus/status/1096918804645453825?s=19,12,2019-2-17,
Canada's last intact Arctic ice shelf has collapsed,350,0.99,i5lr12,https://www.cbsnews.com/news/canada-last-intact-arctic-milne-ice-shelf-collapse-climate-change/,20,2020-8-8,
Climate Voters Still Want More from Biden,355,0.97,flcjgs,https://www.nytimes.com/2020/03/19/climate/climate-voters-biden.html,36,2020-3-20,
"'Something Big Is Shifting': As Georgetown Announces Fossil Fuel Divestment, Students Across US Demand Their Schools Follow Suit",349,0.99,f0s4vj,https://www.commondreams.org/news/2020/02/08/something-big-shifting-georgetown-announces-fossil-fuel-divestment-students-across,2,2020-2-8,
"Climate change has gotten so bad that Bill Nye called us ""idiots"" and told us to ""grow the f*ck up""",355,0.97,boacnf,https://twitter.com/juninovii/status/1128008189390278656?s=19,65,2019-5-14,
"Despite CA Governor Newsom's exclamations on social media that climate change is real, 2,691 permits have been issued for oil and gas wells in CA in 2020 so far. That is a 190% increase from his first 6 months in office in 2019.",346,0.98,ivia2r,https://apnews.com/d04910d29539d39e24eaa725bcf4545f,28,2020-9-19,
New Jersey – A First State in the US to add Climate Change Education Across State Learning Standards,348,0.99,h0panp,https://climatemusing.wordpress.com/2020/06/10/new-jersey-a-first-state-in-the-us-to-add-climate-change-education-across-state-learning-standards/,3,2020-6-11,
"After protests, Britain's parliament declares climate change 'emergency'",346,0.98,bjul9s,http://news.trust.org/item/20190501204422-nndyq/,12,2019-5-2,
Michael Bloomberg goes from funding a campaign to end coal use to funding one to end all fossil fuel use,344,0.98,axza09,https://www.bloomberg.com/opinion/articles/2019-03-05/our-highest-office-my-deepest-obligation,14,2019-3-6,
100 companies cause 71% of global emissions,348,0.96,jnpyse,https://i.redd.it/7vtu7qrbnzw51.jpg,18,2020-11-4,
You just lived through the warmest decade on record – and it's only going to get hotter,346,0.98,e5p7ou,https://www.usatoday.com/story/news/nation/2019/12/03/climate-change-warmest-decade-record/2595133001/,15,2019-12-4,
Climate Change Became a Debate Question Because You Asked for It,350,0.99,j6u7sx,https://www.sierraclub.org/sierra/climate-change-became-presidential-debate-question-because-you-asked-for-it-donald-trump-joe-biden,6,2020-10-8,
Experts say new climate data shows how close world already is to breaching 1.5C Paris agreement pledge,348,0.99,hnts4z,https://www.theguardian.com/environment/2020/jul/09/global-temperatures-likely-to-hit-at-least-1c-warming-for-next-five-years,18,2020-7-9,
Who to Blame for Australia's Bullshit Approach to Climate Change - Look these coal lobbyists in the eye. Remember their names.,342,0.98,eq0i99,https://www.vice.com/en_us/article/dygvjy/who-to-blame-for-australia-coal-mining-lobbyists-fires-bushfires-bullshit-approach-to-climate-change?utm_campaign=Hot%20News&utm_source=hs_email&utm_medium=email&utm_content=82071724&_hsenc=p2ANqtz--C77Ea2icjHmz7vKPIRRhCno1S5tkfb728RteF8S6yk5cWoqXEQP42uK5l5oA4BFfQ8BAjCGuJSVb6WIgmVdZLsxu0uA&_hsmi=82071724,13,2020-1-17,
“Shame On You!” Protesters Interrupt Trump Admin Promoting Coal & Fossil Fuels at U.N. Climate Talks,350,0.97,a56d3j,https://www.democracynow.org/2018/12/10/shame_on_you_protesters_interrupt_trump,9,2018-12-11,
"In 72 hours it’s gone from Alexandria Ocasio-Cortez is crazy for asking Dems to take a global apocalypse seriously, to Dems stampeding to support climate action. It’s almost as if a legislator having the guts to do the right thing can pressure other legislators to also do the right thing...",350,0.98,9xullg,https://twitter.com/davidsirota/status/1063550588485435393,10,2018-11-17,
15 states will follow California’s push to electrify trucks and buses; A big step forward in reducing harmful emissions from diesel engines,350,0.99,hs9n80,https://www.theverge.com/2020/7/14/21324552/electric-trucks-buses-clean-air-zero-emissions-states,8,2020-7-16,
Australia is burning. The Arctic is melting. Yet Trump keeps gutting climate change regulations. | Eco Planet News,349,0.97,en61pl,https://ecoplanetnews.com/2020/01/11/australia-is-burning-the-arctic-is-melting-yet-trump-keeps-gutting-climate-change-regulations/,26,2020-1-11,
The curse of ‘both-sidesism’: How climate denial skewed media coverage for 30 years,346,0.99,hztcof,https://grist.org/climate/the-curse-of-both-sidesism-how-climate-denial-skewed-media-coverage-for-30-years/,7,2020-7-29,
Michael Mann: Australia could become so hot and dry that the country’s residents could become climate refugees,343,0.99,ep5b92,https://thenewdaily.com.au/life/science/environment/2020/01/15/australians-climate-refugees/,36,2020-1-16,
Supreme Court lets lawsuit by climate scientist continue against conservative outlets,349,0.99,e1l0bx,https://www.washingtonpost.com/politics/courts_law/supreme-court-lets-lawsuit-by-climate-scientist-continue-against-conservative-outlets/2019/11/25/710ce7a6-0f94-11ea-bf62-eadd5d11f559_story.html,5,2019-11-26,
Portugal ends coal burning two years ahead of schedule,343,0.99,hsp3y8,https://www.climatechangenews.com/2020/07/15/portugal-ends-coal-burning-two-years-ahead-schedule/,14,2020-7-17,
The affluent are consuming the planet to death - study,350,0.99,hf2h4b,http://londongreenleft.blogspot.com/2020/06/the-affluent-are-consuming-planet-to.html,35,2020-6-24,
"Temperature spike: Earth ties record high heat May reading- The last seven Mays, from 2014 to 2020, have been the seven warmest Mays on record.",346,0.99,h9ft52,https://apnews.com/f13f12d4cefc96ee942f1e1de774eee9?utm_campaign=Hot%20News&utm_medium=email&_hsmi=89531294&_hsenc=p2ANqtz-8Zqjg8TK6rD40iWBNXK5c3WfQLfrV_--_3vcYcL0NhLqC4nnRxVbhAK9WduayLZHuHKMtet1TQVdybj38hy5vn9se2OA&utm_content=89531294&utm_source=hs_email,14,2020-6-15,
'Historic' Move Could Force Chevron To Be Transparent About Climate Lobbying,350,0.99,gssuyi,https://www.huffpost.com/entry/chevron-climate-historic-vote-lobbying-gas_n_5ecfe031c5b67a41ee02df8f?utm_campaign=Hot%20News&utm_medium=email&_hsmi=88687841&_hsenc=p2ANqtz-9NCjzXUUj5RpuAyvqf6n4sFSGXHwPDHtWbmckVA34D1QTJ5BvPAgztiTvGNLvlLgv3S-ZmfH2ZgXOhHjl02D0M1_l-Nw&utm_content=88687841&utm_source=hs_email,5,2020-5-29,
"In Only 160 Years, Humans Wrecked the Earth's Climate: For 11,500 years, atmospheric carbon dioxide (CO2) concentrations hovered around 280 ppm--since the Industrial Revolution, this level has been rising continuously, reaching 410 ppm in 2018",341,0.98,btf3ms,https://crooksandliars.com/2019/05/just-160-years-humans-wrecked-earths,20,2019-5-27,
"Trump advisers foresee big energy moves in second term. A second term would mean a more aggressive dismantling of environmental policy and an expansion of the fossil fuel industry. First, though, he has to win. Environmental groups have called him the worst president for the environment in history.",345,0.98,ha458w,https://www.eenews.net/stories/1063355055,19,2020-6-16,
Media 'impartiality' on climate change is ethically misguided and downright dangerous,345,0.98,ewstw2,https://phys.org/news/2020-01-media-impartiality-climate-ethically-misguided.html,12,2020-2-1,
"'You have not seen anything yet,' climate activist Greta says ahead of Davos",349,0.97,eq6jbh,https://www.reuters.com/article/us-climate-change-protests/you-have-not-seen-anything-yet-climate-activist-greta-says-ahead-of-davos-idUSKBN1ZG1UG,28,2020-1-18,
Michelle Obama sends Greta Thunberg message of support after Trump tweet. Former first lady told climate activist ‘don’t let anyone dim your light’ after Trump said teen had an ‘anger management problem’,344,0.93,ea5ohj,https://www.theguardian.com/environment/2019/dec/13/michelle-obama-greta-thunberg-message-support-trump,7,2019-12-13,
'People are dying': how the climate crisis has sparked an exodus to the US,346,0.99,cj9wd0,https://www.theguardian.com/global-development/2019/jul/29/guatemala-climate-crisis-migration-drought-famine,50,2019-7-29,
Downing Street has the nerve to call the schoolchildren’s climate strike “truancy” but when climate change is debated for the first time in two years just 10 MPs sat on government benches,343,0.98,aw0yds,https://www.theguardian.com/politics/2019/feb/28/mps-debate-climate-after-school-strike-but-only-a-handful-turn-up?CMP=share_btn_tw,10,2019-3-1,
"Sanders Rips Trump for Lacking 'Courage' to Confront Fossil Fuel Industry After President Bragged About Oil Boom - ""President Trump is turning his back on the children of America and on future generations, and dooming them to live in a planet increasingly unhealthy and uninhabitable.""",340,0.97,ezly2t,https://www.commondreams.org/news/2020/02/05/sanders-rips-trump-lacking-courage-confront-fossil-fuel-industry-after-president,7,2020-2-6,
The average age of people alive today is 30 years. Our world has been warmer than last century’s average for 415 consecutive months — 34.5 years now. Most people alive today have never experienced a “normal” planet Earth. We are in a climate emergency.,343,0.98,cqv55c,https://twitter.com/EricHolthaus/status/1162042569162973191,8,2019-8-16,
"Alaska: temperatures rival Miami amid 'unprecedented' heatwave Anchorage’s weather station recorded 90F on Thursday, breaking the previous record high of 85F",342,0.99,c9sk7v,https://www.theguardian.com/us-news/2019/jul/05/alaska-heatwave-record-temperatures?CMP=Share_iOSApp_Other,20,2019-7-6,
Fossil Fuels’ United Front Is Crumbling; State politics show the coal industry is fighting a losing battle against its former allies.,345,0.99,hyt47w,https://newrepublic.com/article/158624/fossil-fuels-united-front-crumbling,6,2020-7-27,
This year's US election will impact climate policy: do more than vote,338,0.99,had2n0,https://www.reddit.com/r/climate/comments/had2n0/this_years_us_election_will_impact_climate_policy/,67,2020-6-17,"The Trump administration seems dedicated to [maximizing environmental damage](https://www.nytimes.com/interactive/2020/climate/trump-environment-rollbacks.html), while Biden has made [specific promises to start the process of decarbonization](https://joebiden.com/climate/).  Judges appointed by Trump will block any kind of environmental action for decades to come, while Biden appointees are likely to be amenable to the decarbonization we need.  The makeup of the Senate similarly will impact what legislation we can actually pass.

Here's what you need to do:

[Double-check your registration before election day](https://iwillvote.com/).  If you can take advantage of early voting, do so.  If you've already got a mail-in ballot, return it as soon as possible, preferably via a county-provided ballot drop-box.

Campaigns don't magically happen.  They need people power.  [Volunteer](https://www.mobilize.us/joebiden/).   Volunteer [full time between now and election day if you can](https://go.joebiden.com/page/s/late-help-gotv-with-biden-for-president).  

The Biden campaign also also needs money, which pays the salaries of organizers and to run ads.     You can [give whatever amount feels right for you to the Biden Victory Fund](https://act.joebiden.com/BVFraiser?attr=100839588).
 
The balance of power in the Senate is going to have a huge impact - it will decide whether we can pass decarbonization legislation, or whether we'll be limited to executive regulatory actions, which can easily be rolled back by the next President.  Pick a close senate race and get involved.  Some good choices are [Iowa](https://greenfieldforiowa.com/), [one of the Georgia races](https://electjon.com/), and [North Carolina](https://www.calfornc.com/)."
"Alaska’s Sea Ice Completely Melted for First Time in Recorded History: ‘That means there was no sea ice whatsoever within 150 miles of its shores, according to the National Weather Services'",344,0.98,czmayf,https://truthout.org/articles/alaskas-sea-ice-completely-melted-for-first-time-in-recorded-history/,43,2019-9-4,
Climate Point: Trump can't recall his own environmental stance in debate,340,0.99,j4e9j0,https://circlearound.com/post/climate-point-trump-cant-recall-his-own-environmental-stance-in-debate,11,2020-10-3,
Amazon Employees Are Demanding Climate Action. The Company Is Silencing Them.,343,0.97,eyk0ec,https://therising.co/2020/02/03/amazon-sustainability-silencing-employees-climate-action/,3,2020-2-4,
These U.N. Climate Scientists Think They Can Halt Global Warming for $300 Billion,334,0.98,dmhclw,https://time.com/5709100/halt-climate-change-300-billion/,29,2019-10-24,
Germany closing coal plants,337,0.99,dgvvbj,https://www.livekindly.co/germany-closing-84-coal-plants-save-planet/,48,2019-10-12,
The U.S. military is terrified of climate change. It's done more damage than Iranian missiles.,338,0.98,iwj6np,https://www.nbcnews.com/think/opinion/u-s-military-terrified-climate-change-it-s-done-more-ncna1240484,19,2020-9-21,
"Farms Can’t Stop Climate Change; U.S. senators, McDonald's, Microsoft, and the agribusiness lobby are pushing the dangerous myth that carbon storage in American farmland will stave off climate catastrophe.",336,0.99,i5yl0e,https://newrepublic.com/article/158833/agribusiness-farms-microsoft-mcdonalds-carbon-climate-change,27,2020-8-8,
Extreme rising seas could wipe out assets worth $14 trillion by 2100,338,0.99,i0slnn,https://www.newscientist.com/article/2250270-extreme-rising-seas-could-wipe-out-assets-worth-14-trillion-by-2100/?utm_campaign=RSS%7CNSNS&utm_source=NSNS&utm_medium=RSS&utm_content=news,16,2020-7-31,
Congress Investigates How Marathon Petroleum and Koch Network Influenced Clean Cars Rollbacks,336,1.0,gujt3c,https://www.desmogblog.com/2020/05/29/congress-investigation-marathon-koch-oil-clean-car-rollbacks?utm_campaign=Carbon%20Brief%20Daily%20Briefing&utm_medium=email&utm_source=Revue%20newsletter,4,2020-6-1,
Scientists just discovered a massive new vulnerability in the Antarctic ice sheet- Denman Glacier is retreating into the deepest undersea valley in all of Antarctica. Nearly 5 feet of sea level rise are at stake.,338,0.98,fopr99,https://www.washingtonpost.com/climate-environment/2020/03/23/denman-glacier-climate-change/?_hsenc=p2ANqtz--8BcNdcac_ciPIdeNQTKGUgug_MijXr0v7DR2fS2vD9QyT12pUCxBZoDlDsLJ5RPhyaslr76Xabfv2Cphq6hVZv6pLNQ&_hsmi=85232421&utm_campaign=Hot%20News&utm_content=85232421&utm_medium=email&utm_source=hs_email,11,2020-3-25,
Big oil is the new big tobacco - and Congress must use its power to investigate,344,0.97,erv0e9,https://www.theguardian.com/commentisfree/2020/jan/20/big-oil-congress-climate-change?utm_campaign=Hot%20News&utm_source=hs_email&utm_medium=email&utm_content=82216889&_hsenc=p2ANqtz---We4KL3PwQZFa0uMZvEyko1bEUfYQaB2gbXAShbtKpkiUyg9_7IliLe19PNtBiWITtUFepX6P8LtWxyIwN4wtIKSN3Q&_hsmi=82216889,30,2020-1-21,
March 1990 was the hottest month ever recorded at the time. It shattered all previous records. 58 of the last 60 months have been hotter than March 1990.,339,0.99,e6gyuy,https://www.reddit.com/r/climate/comments/e6gyuy/march_1990_was_the_hottest_month_ever_recorded_at/,18,2019-12-5,
Sen. Bernie Sanders: Increased Focus On Climate Change Is The Difference Between 2016 and 2020,344,0.98,enjtcj,https://youtu.be/7LfHe7zNpSk,22,2020-1-12,
"This is What The Sixth Mass Extinction Looks Like. And Here's Why You Should Care. Unhealthy ecosystems jeopardize our ability to meet our most basic needs: Water, food, medicine, clean air. There is no one on the planet this doesn’t impact. And loss of biodiversity hurts the poorest the most.",339,0.99,jbnypk,https://therealnews.com/this-is-what-sixth-mass-extinction-looks-like-and-heres-why-you-should-care,5,2020-10-15,
"Should climate groups boycott Facebook? Nearly 1,000 advertisers have joined the campaign to rein in Facebook's racism and disinformation. But most climate groups are not yet on board.",331,0.98,hmub3u,https://heated.world/p/should-climate-groups-boycott-facebook,24,2020-7-7,
