title,score,upv_ratio,id,url,comms_num,created,body
"Leaked Trump Budget Would Slash EPA's Climate, Environment Spending",6781,0.82,6c8r6w,https://insideclimatenews.org/news/19052017/leaked-donald-trump-budget-EPA-climate-clean-energy-environment,317,2017-5-20,
Dear President-Elect Trump: Climate change is not a hoax. Please consider this: It’s raining near the North Pole.,2936,0.89,5c692k,http://blogs.discovermagazine.com/imageo/2016/11/09/dear-president-elect-trump-climate-change-is-not-a-hoax/,298,2016-11-10,
"A climate change report published in 2008 in Australia stated that if nothing if done, the country would have major fire disasters in 2020. It’s amazing how they predicted it. What sucks is that they were right...",2019,0.99,ekb3qa,https://i.redd.it/0zceuk36nx841.jpg,75,2020-1-5,
Listen to us,1282,0.97,ctfev4,https://imgur.com/KQL2ukh.jpg,60,2019-8-21,
Biden victory to trigger US return to Paris Agreement and fresh wave of climate action,1267,0.98,jpu3hu,https://www.businessgreen.com/news/4022930/biden-victory-trigger-us-return-paris-agreement-fresh-wave-climate-action,49,2020-11-8,
All References to Climate Change Have Been Deleted From the White House Website,1171,0.78,5p5b7d,https://motherboard.vice.com/read/all-references-to-climate-change-have-been-deleted-from-the-white-house-website,103,2017-1-21,
Appropriate for this unusually warm Christmas,1074,0.98,efi4zk,https://i.redd.it/2axvttdczs641.jpg,12,2019-12-26,
"‘How Dare You!': Greta Thunberg Rages at 'Fairytales of Eternal Economic Growth' at UN Climate Summit: ""Entire ecosytems are collapsing. We are at the beginning of a mass extinction and all you can talk about is money.""",1065,0.96,d89cai,https://www.commondreams.org/news/2019/09/23/how-dare-you-greta-thunberg-rages-fairytales-eternal-economic-growth-un-climate,66,2019-9-24,
Legality vs Morality,1053,0.96,da4693,https://i.redd.it/d4kqt5jpf6p31.png,39,2019-9-28,
"McDonald’s, Burger King and KFC source beef and soy from Brazil, furthering the intentional burn-down of the Amazon, despite their promise to stop deforestation",994,0.99,d8o7hy,https://www.greenpeace.org/international/story/24341/reasons-mcdonalds-burger-king-kfc-must-speak-up-amazon-fires/,57,2019-9-24,
Biden commits to banning fossil fuel lobbyists and executives from his White House transition team,995,0.98,j38e9z,https://www.forbes.com/sites/andrewsolender/2020/09/30/biden-transition-institutes-strict-ethics-rules-to-avoid-conflicts-contrast-with-trump/#292089e454bb,54,2020-10-1,
Shutdown due to Coronavirus May save more lives by preventing pollution than by preventing infections,985,0.98,fgwx7c,https://www.forbes.com/sites/jeffmcmahon/2020/03/11/coronavirus-lockdown-may-save-more-lives-from-pollution-and-climate-than-from-virus/,35,2020-3-11,
This is my message to the western world – your civilisation is killing life on Earth | Amazon rainforest,985,0.97,j9odc4,https://www.theguardian.com/commentisfree/2020/oct/12/western-worldyour-civilisation-killing-life-on-earth-indigenous-amazon-planet,93,2020-10-12,
"Amy Coney Barrett on climate change: ""I would not say I have firm views on it.” | Anyone who doesn't have an opinion on the most consequential issue of our time isn't qualified to evaluate factual evidence.",969,0.96,jb44ni,https://thephoenix.substack.com/p/amy-coney-barrett-on-climate-change,53,2020-10-15,
Goldman Sachs released a 34-page analysis of the impact of climate change. And the results are terrifying.,969,0.97,df8w4s,http://markets.businessinsider.com/news/stocks/goldman-sachs-just-released-a-34-page-analysis-of-the-impact-of-climate-change-and-the-results-are-terrifying-1028552494,119,2019-10-9,
"Bill Gates thinks the 1% should foot the bill for renewable energy, and he's offering the first $2B.",950,0.97,ggy9ha,https://vegnum.com/bill-gates-thinks-that-the-1-should-foot-the-bill-to-combat-climate-change/,44,2020-5-10,
Petition for the BBC to broadcast daily objective information on the climate crisis from the IPCC similarly to how COVID19 updates were.,944,0.99,hj9fvx,http://chng.it/HvHLX4QH,38,2020-7-1,
"Greta Thunberg Chides Amy Coney Barrett For Her Weak Stance On Climate Change The teenage activist argued that like gravity, climate change was a fact of life — not something to have “views” on.",925,0.97,jc8n9p,https://www.huffpost.com/entry/greta-thunberg-amy-coney-barrett-climate-change_n_5f886661c5b6c4bb547394de,16,2020-10-16,
Joe Biden calls climate change the ‘number one issue facing humanity’,901,0.98,jhs26e,https://www.cnbc.com/2020/10/24/joe-biden-climate-change-is-number-one-issue-facing-humanity.html,95,2020-10-25,
That wasn’t very cash money,895,0.98,bra1b3,https://i.redd.it/ueltbndy9kz21.jpg,18,2019-5-21,
Ban Brazil from the FIFA World Cup until Bolsonaro does something to fight Amazon fires.,892,0.96,cv7f5p,https://www.change.org/p/fifa-ban-brazil-from-the-fifa-world-cup-until-bolsonaro-does-something-to-fight-amazon-fires?utm_source=share&utm_medium=ios_app,60,2019-8-25,
Our Civilization is LITERALLY being Destroyed by the Greedy 1%.,888,0.97,eioad2,https://i.redd.it/zynw2kzzl8841.png,73,2020-1-2,
Idk if it was posted,851,0.95,dp7ioo,https://i.redd.it/0fb63x6fvov31.png,122,2019-10-30,
"For the first time in 12 years, climate change was included as a question in the presidential debate",837,0.99,j2l75f,https://www.cnn.com/videos/politics/2020/09/30/climate-change-first-debate-full-video-2020-dbx-vpx.cnn,62,2020-9-30,
When the oil companies accidentally admit their plans.,829,0.98,d7dlj6,https://i.redd.it/6tva16thhzn31.jpg,8,2019-9-22,
Everything is fine.,833,0.98,gmt7kj,https://i.redd.it/mce0byrhcrz41.jpg,23,2020-5-20,
New Jersey becomes first state to incorporate climate change in K-12 curriculum,812,0.99,gwh4jk,https://www.northjersey.com/story/news/environment/2020/06/03/nj-becomes-first-state-require-climate-change-k-12-curriculum/3136671001/?utm_campaign=Hot%20News&utm_medium=email&_hsmi=88976093&_hsenc=p2ANqtz--sSokTlXqyc85jj7nkuB9LHG4dQcN696ucjStwTLOq5h5lDpVSCi7sn3CD4yRw0hg9lds6AGGtZi8GRQEZb8V7DO-yIw&utm_content=88976093&utm_source=hs_email,20,2020-6-4,
"A fire tornado in the US. A green new deal is too expensive though, right?",807,0.97,irhoo5,https://v.redd.it/mccfzr0idrm51,54,2020-9-13,
"Scientists endorse mass civil disobedience to force climate action. More than 300 scientists have endorsed a civil disobedience campaign aimed at forcing governments to take rapid action to tackle climate change, warning that failure could inflict “incalculable human suffering.”",805,0.98,dhfogx,https://af.reuters.com/article/worldNews/idAFKBN1WS01F?feedType=RSS&feedName=worldNews&utm_source=feedburner&utm_medium=feed&utm_campaign=Feed%3A+reuters%2FAFRICAWorldNews+%28News+%2F+AFRICA+%2F+World+News%29&&rpc=401,47,2019-10-14,
The last time a presidential debate moderator asked about climate change was in 2008,788,0.99,j1ydmy,https://grist.org/politics/its-been-12-years-since-presidential-debate-moderators-asked-about-climate-change/,31,2020-9-29,
"In the US, large numbers of women have decided that they will not date climate deniers",778,0.96,erfe2x,https://heated.world/p/the-climate-is-changing-dating,89,2020-1-21,
Trump is aggressively pushing his anti-environment agenda amid a pandemic. It’s inexcusable.,759,0.98,ftmpwz,https://www.washingtonpost.com/opinions/2020/04/01/trump-is-aggressively-pushing-his-anti-environment-agenda-amid-pandemic-its-inexcusable/?_hsenc=p2ANqtz-8v6JzXAU0PUFE6-LNFkSWzH9Tw5nTlfyblPyfm4E6SSTOlrZzLXpKfwLixE4Z9GWtNEccGQ-G6SoPgHfQdg8L7CivpqA&_hsmi=85644359&utm_campaign=Hot%20News&utm_content=85644359&utm_medium=email&utm_source=hs_email,27,2020-4-2,
"Climate experts agree: ""Steve Mnuchin should go back to college"" — not Greta Thunberg. Mnuchin needs to ""develop an understanding of the environmental threats posed by his economic policies,"" while ""Greta Thunberg's remarks on climate science have been accurate.""",761,0.97,etaqa4,https://www.salon.com/2020/01/23/climate-experts-agree-steve-mnuchin-should-go-back-to-college--not-greta-thunberg/,56,2020-1-24,
The lifestyles of the 42 million richest people are emitting more greenhouse gases than the poorest 3.8 billion people,747,0.99,d1ryar,https://www.nature.com/articles/s41558-019-0402-3.epdf?shared_access_token=7OPeT83SpqkdK7TJh8Yra9RgN0jAjWel9jnR3ZoTv0NgXOyro3PW5-YFOp4drdu9crvYlL8Kf1-UbdyVKRxNBAuaBNpX6G8ddPkQda-O8IHjl0V95DxApFTR_pOg3hux2NQH6YnjvA6Y2scuZx0ZAnouQyAj5-OV-vjrs6HVGzU%3D,58,2019-9-9,
A quick reminder that Brazil is still burning,740,0.99,ek0t02,https://i.redd.it/lolh3pvo7t841.png,31,2020-1-5,
Glass half full!,739,0.98,chxm0n,https://i.redd.it/0rknmif9gkc31.png,9,2019-7-26,
"Instead of spending $1.5 trillion on weapons to kill one other, let us unite against the common enemy that is climate change.",741,0.98,cfyy2t,https://twitter.com/BernieSanders/status/1152727386586263554,46,2019-7-21,
Climate change protest in Cologne - They are standing on ice blocks,739,0.98,caqbzh,https://i.redd.it/ggc9mtfe15931.jpg,46,2019-7-9,
"""we are going to win, pass a Green New Deal, and criminally prosecute the fossil fuel executives who destroyed the planet"" -Bernie Sanders",734,0.96,eesy46,https://twitter.com/BernieSanders/status/1207452527974912003,50,2019-12-24,
"Billionaire David Koch, a key supporter of the climate change denial industry, is dead.",722,0.99,cuf45v,https://www.kwch.com/content/news/Billionaire-David-Koch-dies-at-age-79-557984761.html?ref=761,57,2019-8-23,
Teen climate change activist Greta Thunberg endorses Biden,724,0.94,j8m5oi,https://thehill.com/homenews/campaign/520473-teen-climate-change-activist-greta-thunberg-endorses-biden,112,2020-10-10,
"Greta Thunberg calls for climate action in Canada's oil heartland: ‘We're not doing this because it's fun or because we have a special interest in the climate or because we want to become politicians when we grow up. We're doing this because our future is at stake,""",714,0.96,dkgko3,https://www.dw.com/en/greta-thunberg-calls-for-climate-action-in-canadas-oil-heartland/a-50896065,33,2019-10-20,
"16-year-old climate activist Greta Thunberg says meeting with Trump would be a ""waste"": ""Why should I waste time talking to him when he, of course, is not going to listen to me?""",717,0.96,cpvz9j,https://www.cbsnews.com/news/greta-thunberg-trump-16-year-old-climate-activist-says-meeting-with-president-would-be-a-waste/,22,2019-8-14,
Climate protest in Amsterdam tonight,705,0.98,e3k871,https://i.imgur.com/RvKrjFb.jpg,10,2019-11-30,
"House Democrats Demand Climate Be a ""Centerpiece"" Of The 2020 Presidential Debates",702,0.99,imzf8k,https://www.motherjones.com/environment/2020/09/house-democrats-demand-climate-be-a-centerpiece-of-the-2020-presidential-debates/,54,2020-9-5,
"S. Fred Singer, who first worked to convince the public that cigarette smoke didn't cause cancer, and who had a second career using the same PR tactics to aid the fossil fuels industry in climate denial, has died at age 95",704,0.99,fzx8iu,https://www.nytimes.com/2020/04/11/climate/s-fred-singer-dead.html,65,2020-4-12,
"To Critics Who Say Climate Action Is 'Too Expensive,' Greta Thunberg Responds: 'If We Can Save the Banks, We Can Save the World'",700,0.97,d283sc,https://www.commondreams.org/news/2019/09/10/critics-who-say-climate-action-too-expensive-greta-thunberg-responds-if-we-can-save,28,2019-9-10,
Online protest for climate action! Stay safe,697,0.97,fm11du,https://i.redd.it/e0ybsdjhpvn41.png,32,2020-3-21,
I’m a black climate scientist. Racism derails our efforts to save the planet.,695,0.96,gvtbyq,https://www.washingtonpost.com/outlook/2020/06/03/im-black-climate-scientist-racism-derails-our-efforts-save-planet/?_hsenc=p2ANqtz--jDkLz6huOM0R_hiTfv0UY1ZFg9fxzghjShGe3qB4N90B5pZskGJHgC6gNMm6n-yNbW4u-ve6n1Sl2S6qyLaDM_fgnJg&_hsmi=88904924&utm_campaign=Hot%20News&utm_content=88904924&utm_medium=email&utm_source=hs_email,18,2020-6-3,
Republicans have no plan for the climate crisis; The GOP will never be part of the climate solution. The RNC offers definitive proof.,695,0.97,igyy4i,https://heated.world/p/republicans-have-no-plan-for-the?token=eyJ1c2VyX2lkIjozNjY5MTM0LCJwb3N0X2lkIjo4OTY5NjYsIl8iOiIzWmF4VyIsImlhdCI6MTU5ODQ0ODk3NywiZXhwIjoxNTk4NDUyNTc3LCJpc3MiOiJwdWItMjQ3MyIsInN1YiI6InBvc3QtcmVhY3Rpb24ifQ.h2yTEcmjjoUvw-U8A8LxM9W32voshHqKZYxsqRdCEOU,64,2020-8-26,
This guy protesting at the climate Strike in NYC,697,0.99,d74u04,https://i.redd.it/clnv70xtyun31.jpg,8,2019-9-21,
"Editorial: Climate change is just as real as COVID-19. Now's the last, best chance for our government to treat it that way",686,0.98,fnjkeq,https://www.latimes.com/opinion/story/2020-03-23/trump-climate-change-coronavirus-covid-19?utm_campaign=Hot%20News&utm_source=hs_email&utm_medium=email&utm_content=85105997&_hsenc=p2ANqtz-_hwNz4stY8w2j9Car1pU3r8VQLg0xc-3bBGxvjrT_zZrYGCcihW0PFlw-sYmSa4FjQUx2sIK2WiVtW_ty8jd98UTGKug&_hsmi=85105997,36,2020-3-23,
"A second Trump term would be 'game over' for the climate, says top scientist | US elections 2020",685,0.97,j3tqcz,https://www.theguardian.com/us-news/2020/oct/02/donald-trump-climate-change-michael-mann-interview,52,2020-10-2,
Prevent another four years of nightmares by voting blue next fall.,684,0.96,dtni69,https://i.redd.it/pgk0qwognjx31.png,41,2019-11-9,
Politicians blew off Gen Z’s climate goals. The coronavirus shows we can act fast.,676,0.98,fpwuq2,https://www.washingtonpost.com/outlook/politicians-blew-off-gen-zs-climate-goals-the-pandemic-shows-we-can-act-fast/2020/03/26/01281a30-6edc-11ea-b148-e4ce3fbd85b5_story.html,29,2020-3-27,
We must save our environment...,683,0.98,ghhx92,https://i.redd.it/t6xu0eirs2y41.jpg,5,2020-5-11,
"At Last, Joe Biden Leaned Into Climate; Polls overwhelmingly show President Trump’s climate denial is his greatest weakness. At the final debate, the Democrat seized on the issue.",672,0.98,jggilc,https://www.huffpost.com/entry/biden-trump-debate-climate_n_5f920b38c5b695a32fb1b53a?jm4,41,2020-10-23,
"What are the first things caused by global warming non-scientific people will start to notice, which will have a real negative impact on their lives?",676,1.0,az25ki,https://www.reddit.com/r/climate/comments/az25ki/what_are_the_first_things_caused_by_global/,258,2019-3-9,"I'm looking for things that are news-worthy, and could really start to attract the attention of citizens and the media.

For example, news about the fauna and other rise in average temperature don't have a negative impact on people's live because they might not be science-litterate, and it might not change how they eat and consume.

What are the first events or of the most obvious signs that people will notice that are caused by global warming?

PS: my question was both removed in /r/askscience and /r/explainlikeimfive

I'm looking for an realist, scientific, ""alarmist"" but not paranoiac ""doom and gloom"" answer. I've heard nobody can really answer how human society will answer to problems and where it's going to result in crisis, since there are butterfly effects."
"Montreal, today. 500k people, 27% of Montreal's population!",664,0.99,da9ngu,https://i.redd.it/fsdhch5um8p31.jpg,12,2019-9-28,
Greta Thunberg trolls Trump with callback to his 'anger management' tweet,665,0.95,jorg7u,https://thehill.com/blogs/blog-briefing-room/news/524674-greta-thunberg-trolls-trump-with-callback-to-his-anger,44,2020-11-6,
Anyone else be like this?,657,0.97,ciyh2f,https://i.redd.it/7qkcwz5su2d31.jpg,27,2019-7-29,
"Climate Change protest in Melbourne, Australia",660,0.99,d6ri2t,https://v.redd.it/a45bz9u6dpn31,19,2019-9-20,
A strong majority of Americans (73%) now support a carbon tax,660,0.98,hl5jg1,https://www.pewresearch.org/science/2020/06/23/two-thirds-of-americans-think-government-should-do-more-on-climate/ps_2020-06-23_government-and-climate_00-05/,26,2020-7-4,
Amy Coney Barrett refuses to tell Kamala Harris if she thinks climate change is happening,655,0.98,jbn8iz,https://www.theguardian.com/us-news/2020/oct/15/amy-coney-barrett-refuses-to-tell-kamala-harris-if-she-thinks-climate-change-is-happening,29,2020-10-15,
"Suddenly Telecommuting, Virtual Conferences, and Reduced Airtravel aren't impossible?",651,0.98,fidw9n,https://i.redd.it/k5dt5364vkm41.jpg,30,2020-3-14,
"Elizabeth Warren on Tuesday released a plan to address climate change by transitioning the nation to 100 percent clean energy in a decade, pledging to adopt a key goal of Jay Inslee and calling on the rest of the primary field to do the same.",658,0.91,czg6e2,https://www.bostonglobe.com/news/politics/2019/09/03/elizabeth-warren-releases-climate-change-plan-move-percent-clean-energy-years/ShRh3e3SZUDnimQv1E5jcM/story.html,147,2019-9-4,
"Bernie: ""I've got seven grandchildren, I've got four great kids - And I think we have a moral responsibility to make sure that the country and the planet we leave our kids and our grandchildren is a planet that is healthy and is habitable. I cannot think of anything more important than that.""",651,0.97,euwpbw,https://www.instagram.com/tv/B7z0XAVoODu/,33,2020-1-28,
"Bernie Sanders, Alexandria Ocasio-Cortez To Propose Bill To Declare Climate Emergency",649,0.98,cb0kn0,https://www.huffpost.com/entry/bernie-aoc-climate_n_5d23af9ce4b07e698c3f9495,5,2019-7-9,
Nearly 40 Democratic senators call for climate change questions in debates,647,1.0,izixjp,https://thehill.com/policy/energy-environment/517874-nearly-40-democratic-senators-urge-climate-change-questions-in?utm_campaign=Hot%20News&utm_medium=email&_hsmi=96037270&_hsenc=p2ANqtz-9K177G6R07G-OJPoYVjwi4M3N7GVHP4lpVP2er58DRK71iF9qvFyQ6o8CbmjLcuczYLJaGVVIi_Ebtpk0g-yc727w28A&utm_content=96037270&utm_source=hs_email,21,2020-9-25,
It’s Time to Try Fossil-Fuel Executives for Crimes Against Humanity,649,0.98,cxua2m,https://jacobinmag.com/2019/02/fossil-fuels-climate-change-crimes-against-humanity,61,2019-8-31,
Climate change got more attention this election cycle than ever before,654,0.98,jqxr8b,https://www.axios.com/climate-change-2020-election-2825a7f8-971e-4eb0-88e7-ff42bf6b2c94.html,17,2020-11-9,
Biden campaign adopts carbon-free power by 2035 in $2T environment plan,647,0.99,hr4115,https://thehill.com/policy/energy-environment/507212-biden-campaign-adopts-carbon-free-power-by-2035-in-2t-environment,43,2020-7-14,
Biden calls climate change one of America's four major crises,648,0.98,ie3f1m,https://thehill.com/policy/energy-environment/513105-biden-calls-climate-change-one-of-americas-four-major-crises,36,2020-8-22,
"More Than 70 Science and Climate Journalists Challenge Supreme Court Nomination of Amy Coney Barrett - “Judge Coney Barrett has displayed a profound inability to understand the ecological crisis of our times, and in so doing she enables it.”",639,0.97,jie9gn,https://www.rollingstone.com/politics/political-commentary/amy-coney-barrett-climate-journalists-challenge-supreme-court-nomination-1080453/?_hsmi=98243177&_hsenc=p2ANqtz-8uHvO-9K9ufU80Hdn_Ya6sIikpHijA8Z3k6lUy53k8hpZawe4AdJ9Lra_gFIC9Z27MNUVX4h8hjwJvOzHwV7OeNgM2-Q,47,2020-10-26,
UK health professions call for climate tax on meat,645,0.98,jogjh8,https://www.theguardian.com/environment/2020/nov/04/uk-health-professions-call-for-climate-tax-on-meat,18,2020-11-5,
They knew.,637,0.98,bowkpf,https://i.redd.it/6uj5xv3wxcy21.jpg,90,2019-5-15,
Global warming - 1912,642,0.99,by2scv,https://i.redd.it/yci5k6jni1331.jpg,31,2019-6-8,
Why is this a politicized so severely in the U.S.?,640,0.97,iu7mye,https://i.redd.it/ok9wx1hiiln51.jpg,70,2020-9-17,
"Spain Drafts a New Climate Law That Would Ban All Fossil Fuel Projects . If passed, it would reduce its national emissions by 23% from 1990 levels. These are some huge numbers as the law is forecasting almost 300k new jobs every year. This could be a new green deal climate activists are hoping for.",640,0.99,gpx62l,https://climatemusing.wordpress.com/2020/05/24/spain-drafts-new-climate-law-that-would-ban-all-fossil-fuel-projects-and-promote-renewable-energy/,13,2020-5-25,
"The Analogy Between Covid-19 and Climate Change Is Eerily Precise- First deny the problem, then say the solution is too expensive? The playbook here is all too familiar.",637,0.99,fpbhk9,https://www.wired.com/story/the-analogy-between-covid-19-and-climate-change-is-eerily-precise/?utm_campaign=Hot%20News&utm_source=hs_email&utm_medium=email&utm_content=85298678&_hsenc=p2ANqtz-8n2EN_XZCRMO0lnOjidL-XqOTo0O60qGOkzV_gTqx9BNhT9UDVjvitj0sUhPnU91neSSiR9esirwpOiY9f__8-ftmxSw&_hsmi=85298678,20,2020-3-26,
"Greta Thunberg's Online Attackers Reveal a Grim Pattern | The 17-year-old climate activist is the frequent target of virtual vitriol. Turns out, women politicians are often harassed in the same ways.",635,0.95,fhgb26,https://www.wired.com/story/greta-thunberg-online-harassment/?utm_campaign=Hot%20News&utm_source=hs_email&utm_medium=email&utm_content=84640402&_hsenc=p2ANqtz-9k2o5PjJAym3BFG1fQwdzG4DpKaJAQkavaRZ9WXaenzKVgPgfbt5Ham04RqV8hurkF6r_i7tOBD8lUHyf0_ZaXPjSUPA&_hsmi=84640402,27,2020-3-12,
'What we should do as individuals is to use the power of democracy to make our voices heard and to make sure that the people in power cannot continue to ignore this.' - Greta Thunberg,634,0.98,d46d76,https://i.redd.it/rnhy9kpwrkm31.png,48,2019-9-14,
Air pollution is much worse than we thought: Ditching fossil fuels would pay for itself through clean air alone.,630,0.99,i8fls6,https://www.vox.com/platform/amp/energy-and-environment/2020/8/12/21361498/climate-change-air-pollution-us-india-china-deaths,14,2020-8-12,
"Ecosia is a green internet search engine that uses 80% of revenue (after operational costs) to fund tree-planting projects. If Ecosia were to become as big as Google, the projected impact would be staggering: enough trees to capture 15% of global CO2 emissions.",628,0.98,djgqs1,https://greenstarsproject.org/2019/10/12/green-search-engine-ecosia/,29,2019-10-18,
I Need You to Care That Our Country Is on Fire,630,0.99,iq3c35,https://www.nytimes.com/2020/09/09/opinion/california-fires.html?searchResultPosition=1&utm_campaign=Hot%20News&utm_medium=email&_hsmi=94967756&_hsenc=p2ANqtz-9r7J1ocQTDveBiAqixzmOAHkBLnD-a0RZLfXkD3Go5hMwZ70HaxuWyONNIUt17ftQ1nojxYeNsEfSgxHZE0JUkrDo16w&utm_content=94967756&utm_source=hs_email,37,2020-9-10,
Congratulations to Ecosia!,624,0.99,ho0gju,https://v.redd.it/023vgqro1t951,22,2020-7-9,
"We, the peoples of the Amazon, are full of fear. Soon you will be too. You destroy our lands, poison the planet and sow death, because you are lost. And soon it will be too late to change - Raoni Metuktire, chief of the indigenous Brazilian Kayapó people",628,0.99,cyr9sw,https://www.theguardian.com/commentisfree/2019/sep/02/amazon-destruction-earth-brazilian-kayapo-people,22,2019-9-3,
Coronavirus Shows Us Rapid Global Response To Climate Change Is Possible,619,0.98,fkp76x,https://www.teenvogue.com/story/coronavirus-response-climate-crisis?utm_campaign=Hot%20News&utm_source=hs_email&utm_medium=email&utm_content=84897805&_hsenc=p2ANqtz-_WP-V5XaXo4oB0yedArbRUCAbZuFMovHke-5nmwM--z2YgLFPjDT9MpmXrikGhzF9Ltrp5hoJw0bDxuKziGcjh5Ea-WQ&_hsmi=84897805,32,2020-3-18,
The future has arrived. These explosive fires are our climate change wakeup call | Environment,621,0.98,iqobt8,https://www.theguardian.com/environment/2020/sep/11/the-future-has-arrived-these-explosive-fires-are-our-climate-change-wakeup-call,49,2020-9-11,
What do you guys think?,617,0.96,bcijhf,https://i.imgur.com/kFInuf2.jpg,112,2019-4-13,
"Greta Thunberg Tells Congress: 'We don't want to be heard, we want the science to be heard'⁠—gets applause",614,0.98,d5xsnm,https://www.newsweek.com/greta-thunberg-tells-congress-science-applause-1459858,4,2019-9-18,
I'm a scientist. Under Trump I lost my job for refusing to hide climate crisis facts,610,0.97,chnjqg,https://www.theguardian.com/commentisfree/2019/jul/25/trump-administration-climate-crisis-denying-scientist?__twitter_impression=true,23,2019-7-25,
"Climate change: 12 years to save the planet? Make that 18 months. If the 45% carbon cut target by 2030 is to be met, then the plans really need to be on the table by the end of 2020.",603,0.98,ch5676,https://www.bbc.com/news/science-environment-48964736,79,2019-7-24,
Trump’s “Sharpiegate” grudge may have cost NOAA’s acting chief scientist his job. The scientist who defended forecasters against political pressure during Hurricane Dorian was told to step down for reinforcing scientific integrity,605,0.99,jlhl1c,https://www.vox.com/2020/10/31/21540150/noaa-trump-hurricane-sharpiegate-science-zeta-dorian,16,2020-10-31,
15 states sue Trump administration over plan to open Arctic refuge to drilling,602,0.99,ipos0k,https://thehill.com/policy/energy-environment/515692-15-states-sue-trump-administration-over-plan-to-open-arctic-refuge,12,2020-9-10,
Climate models have been correct for literally 40 years,603,0.98,e60xtd,https://heated.world/p/climate-models-have-been-correct,33,2019-12-4,
The BREATHE Act would defund police — and fund environmental justice,599,0.96,hooiqu,https://grist.org/justice/the-breathe-act-would-defund-police-and-fund-environmental-justice/?utm_campaign=Hot%20News&utm_medium=email&_hsmi=91137445&_hsenc=p2ANqtz-9uJFNXnqmeQrm3xDkQ5LH5-euod-i_76gNsitF7oRG4Ibo9DkZQ0mniEb1FD7R2RLMY7T_3qUUzgwhx4P8ElDnrp5IRg&utm_content=91137445&utm_source=hs_email,32,2020-7-10,
"I like making those simple ""info sheet"" that can easily be distributed. Here is another. Feel free to criticize!",600,0.98,eh5spo,https://i.imgur.com/gK0ENJ4.png,66,2019-12-29,
Biden administration expected to emphasize climate science over lunar exploration at NASA,594,0.98,jr3pjb,https://spacenews.com/biden-administration-expected-to-emphasize-climate-science-over-lunar-exploration-at-nasa/,66,2020-11-10,
Kids around the world are striking again for the climate. They aren’t giving up.,597,0.97,daikme,https://www.vox.com/2019/9/26/20885295/greta-thunberg-climate-strike,41,2019-9-29,
