title,score,upv_ratio,id,url,comms_num,created,body
BBC launches year-long climate change special called Our Planet Matters,502,0.99,epho5c,https://www.bbc.co.uk/news/world-51104776,19,2020-1-16,
"“Addressing climate change” is the #1 issue for 14% of voters in the 2020 election, poll finds",504,0.98,el1n4z,https://therising.co/2020/01/06/addressing-climate-change-important-in-2020-elections/,30,2020-1-7,
Majority believe US government is doing 'too little' to fight climate change: study,499,0.99,e1yxff,https://thehill.com/policy/energy-environment/471912-majority-believe-us-government-is-doing-too-little-to-fight-climate,19,2019-11-26,
"Biden’s climate plan is putting clean energy jobs first, placing the US on the path to reach net-zero emissions in the electric sector by 2035.",503,0.97,i01rc6,https://www.theguardian.com/us-news/2020/jul/29/joe-biden-climate-jobs-plan-gamble,29,2020-7-29,
Republicans Lawmakers In Oregon Have Stopped Showing Up To Work To Avoid Voting On A Climate Bill,500,0.99,fdds2d,https://www.buzzfeednews.com/article/zahrahirji/oregon-republicans-climate-walk-out-2020,38,2020-3-4,
"Andrew Cuomo Rejects Controversial Gas Pipeline, Handing Climate Activists A Victory",497,0.98,gm0say,https://www.huffpost.com/entry/cuomo-williams-pipeline_n_5ebdbe5dc5b6c9c1874157a6?utm_campaign=Hot%20News&utm_source=hs_email&utm_medium=email&utm_content=88076686&_hsenc=p2ANqtz-9m_oYheTrM54iWrpFg7VYJl58fHJ3Psz2zm9x-ANtvILaAMjKdLcKX0CmGyoyub61uWFW11XcjQDZ3xcX7iMS8VV_lxQ&_hsmi=88076686,11,2020-5-18,
EU parliament votes for 60% greenhouse gas emissions cut by 2030,500,0.99,j7ch44,https://www.theguardian.com/world/2020/oct/08/eu-parliament-votes-carbon-greenhouse-gas-emissions-reduction-2030,19,2020-10-8,
World-wide governments are 'misleading' us on climate: Greta Thunberg,495,0.97,e95voh,https://www.sbs.com.au/news/world-wide-governments-are-misleading-us-on-climate-greta-thunberg,40,2019-12-11,
"A Science Group Is Offering $100,000 To Host A Democratic Climate Change Debate Despite A DNC Ban",497,0.99,c5psdk,https://www.buzzfeednews.com/article/danvergano/democratic-climate-debate-314,10,2019-6-26,
"Among 20 of the most powerful people in US government environment jobs, most have ties to the fossil fuel industry or have fought against the regulations they now are supposed to enforce.",497,0.99,eolinm,https://www.nytimes.com/interactive/2020/01/14/climate/fossil-fuel-industry-environmental-policy.html,13,2020-1-14,
"Greta Thunberg says Friday climate strike will go on for ""as long as it takes"" to stir world leaders into action",495,0.95,dh68qd,https://www.newsweek.com/greta-thunberg-friday-climate-strike-world-leaders-1464823,42,2019-10-13,
You can't save the climate by going vegan. Corporate polluters must be held accountable.,495,0.95,bwagpq,https://www.usatoday.com/story/opinion/2019/06/03/climate-change-requires-collective-action-more-than-single-acts-column/1275965001/,143,2019-6-3,
"Leonardo DiCaprio calls out Trump, world leaders on climate change",493,0.97,dbaivb,https://thehill.com/blogs/blog-briefing-room/news/463598-leonardo-dicaprio-calls-out-trump-world-leaders-on-climate,41,2019-9-30,
Climate change isn’t just about extreme weather. Entire ecosystems are collapsing.,493,0.99,dsata5,https://www.washingtonpost.com/opinions/2019/10/31/life-earth-is-groaning-under-weight-humanity-do-we-hear-it/?fbclid=IwAR0qM_LfvA0MJzVFMtzAT-W10MUjXTvV7Oy53d9DLfePEOnitIuo0XUV_DI,21,2019-11-6,
"Applause at Global Summit as Ocasio-Cortez Calls Climate Crisis 'Consequence of Our Unsustainable Way of Life': ""Because it is unsustainable to organize our society as we have, centered on prioritizing personal gain and profit over any and all human or planetary considerations.""",493,0.97,dgmnmr,https://www.commondreams.org/news/2019/10/11/applause-global-summit-ocasio-cortez-calls-climate-crisis-consequence-our,40,2019-10-12,
My poster design for the Global Climate Strike. Feel free to use and share!,490,0.98,d6565z,https://i.redd.it/mtpb8zr2ofn31.png,3,2019-9-19,
"99% of Green New Deal Co-Sponsors Won Their Races This Cycle: Analysis. ""Saying progressive policies held Democrats back from expanding their House majority/taking the Senate just doesn't hold water with data available so far.""",490,0.95,jrwe43,https://www.commondreams.org/news/2020/11/09/99-green-new-deal-co-sponsors-won-their-races-cycle-analysis,29,2020-11-11,
"An urgent message to Kentucky’s Democratic Party. We’re trying to get them to vote YES on a climate debate, so please retweet for visibility if you can. Our future could very well depend on this vote. Thank you 💚💙🌎☀️",488,0.98,csydkv,https://twitter.com/kydemgrassroots/status/1163550545589800960?s=21,7,2019-8-20,
Climate change answer disqualifies Barrett for Supreme Court,490,0.9,jebn54,https://chicago.suntimes.com/2020/10/19/21523180/amy-coney-barrett-climate-change-answer-supreme-court,22,2020-10-20,
"Greta Thunberg, Not Donald Trump, is the True Leader of the Free World",494,0.84,d92eec,https://www.newsweek.com/greta-thunberg-donald-trump-true-leadership-climate-change-free-world-1461147,50,2019-9-25,
Science based news article in NZ paper from 1912 about CO2 emissions,488,0.99,ht7hl3,https://i.redd.it/8vxqewluhib51.jpg,9,2020-7-18,
Scientists endorse mass civil disobedience to force climate action,486,0.98,di7ubf,https://www.reuters.com/article/us-climate-change-scientists/scientists-endorse-mass-civil-disobedience-to-force-climate-action-idUSKBN1WS01K,8,2019-10-15,
"As Biden Embraces More Ambitious Climate Plan, Fossil Fuel Execs Donate to Trump 'With Greater Zeal' Than in 2016. Executives and lobbyists are pouring money into the coffers of Trump's reelection campaign in the hopes of keeping an outspoken and dedicated ally of dirty energy in the White House.",491,0.99,i484nn,https://www.ecowatch.com/biden-trump-fossil-fuels-climate-crisis-2646883888.html?rebelltitem=1#rebelltitem1,20,2020-8-6,
"If Jeff Bezos really wants to fight the climate crisis, he should just pay his taxes",484,0.89,ffuvph,https://www.theguardian.com/commentisfree/2020/mar/09/jeff-bezos-climate-crisis-taxes-california?utm_campaign=Hot%20News&utm_source=hs_email&utm_medium=email&utm_content=84447690&_hsenc=p2ANqtz-87dpeq79niS976dRODCheEr68mPnqeI17TEcgBBoozeKbBZ39m0bygBf0caUUSqN8bfIt3Zon2Uwo2TzmMOwALFJAmAQ&_hsmi=84447690,43,2020-3-9,
Ocasio-Cortez reads entire Green New Deal into congressional record,485,0.98,face76,https://thehill.com/policy/energy-environment/484838-aoc-reads-entire-green-new-deal-into-congressional-record?utm_campaign=Hot%20News&utm_source=hs_email&utm_medium=email&utm_content=83974534&_hsenc=p2ANqtz--KG7oRPwvTM4anz12aQfJehHZDgTI061BhpcIl3HbNZiz9bS1U3BHgNGnfp-7dWP6F5d5X-VJKJ3sACqLiAALWPpTuCA&_hsmi=83974534,3,2020-2-27,
Global death rate from rising temperatures projected to surpass the current death rate of all infectious diseases combined,477,0.99,i9ldyu,http://www.impactlab.org/news-insights/global-death-rate-from-rising-temperatures/,57,2020-8-14,
September was world's 'hottest on record',479,0.99,j6qp01,https://www.bbc.com/news/science-environment-54442782,30,2020-10-7,
Legislation aims to block fossil fuel companies from receiving coronavirus aid,476,0.98,gej727,https://thehill.com/policy/energy-environment/496263-legislation-aims-to-preclude-fossil-fuel-companies-from-receiving?utm_campaign=Hot%20News&utm_medium=email&_hsmi=87495117&_hsenc=p2ANqtz--NP_GCIkhP9KlmNCOr7I3U4TzEuNEuBmarxU6QpD3AHIs-NyM1UXQFJDRQPYtibyy8_-vV&utm_content=87495117&utm_source=hs_email,9,2020-5-6,
Greta Is Right: Study Shows Individual Lifestyle Change Boosts Systemic Climate Action,478,0.95,dzoppz,https://www.forbes.com/sites/jeffmcmahon/2019/11/19/greta-is-right-study-shows-individual-climate-action-boosts-systemic-change/,66,2019-11-22,
Humanity has eight years to get climate crisis under control – and Trump's plan won't fix it. Donald Trump presented a fantasy world in which fossil fuels are ‘very clean’ but realpolitik tempers Biden’s climate crisis stance,476,0.97,jh75ad,https://www.theguardian.com/us-news/2020/oct/23/joe-biden-transition-from-oil-industry-rowing-back,88,2020-10-24,
Could Biden Name an Indigenous Secretary of the Interior? Environmental Groups are Hoping He Will.,475,0.98,jgmnfc,https://insideclimatenews.org/news/21102020/joe-biden-indigenous-secretary-interior-environmental-groups?utm_campaign=Hot%20News&utm_medium=email&_hsmi=98099340&_hsenc=p2ANqtz-_Qzz1GpOUdyughfXaXkkqFh3F62edhQw5wc91lyd5OCZOAYOpfAjJcmErL_LloRwtVi-Q1iYWkbFIE0sL7QTnKlDdwyw&utm_content=98099340&utm_source=hs_email,17,2020-10-23,
"Climate change isn’t a debate. It’s already here, whether deniers like it or not.",482,0.97,dcqryx,https://www.kentucky.com/opinion/op-ed/article235740627.html,44,2019-10-3,
"Greta Thunberg has hit back at adults who “choose to spend their time mocking and threatening teenagers and children for promoting science”, suggesting they “must simply feel so threatened”.",475,0.95,d9qunk,https://www.independent.co.uk/environment/greta-thunberg-trump-latest-threat-climate-change-un-summit-speech-a9121111.html?,44,2019-9-27,
'Joker' star Phoenix takes aim at climate apathy with film about dying Earth,477,0.99,f0tz9d,https://uk.reuters.com/article/us-climate-change-film-phoenix/joker-star-phoenix-takes-aim-at-climate-apathy-with-film-about-dying-earth-idUKKBN2001YM,49,2020-2-9,
"'No jobs on a dead planet', warns world's top union leader",475,0.99,c1vw10,https://www.smh.com.au/politics/federal/no-jobs-on-a-dead-planet-warns-world-s-top-union-leader-20190617-p51yia.html,16,2019-6-18,
Jeff Bezos commits $10 billion to fight climate change,476,0.93,f5dltx,https://www.theverge.com/2020/2/17/21141132/jeff-bezos-earth-fund-ten-billion-climate-change,152,2020-2-18,
Younger Canadians show a clear commitment to climate change as their top issue,476,0.99,cwa6mu,http://angusreid.org/election-2019-issues/,16,2019-8-28,
"The Trump administration takes climate denial to new heights: Fifty or 100 years from now, we may well say that President Trump’s concerted effort to exacerbate climate change — and that’s precisely what it is — was the single worst thing he did in a presidency full of horrors.",473,0.98,bu6eyb,https://www.washingtonpost.com/opinions/2019/05/28/trump-administration-takes-climate-denial-new-heights/,25,2019-5-29,
We've run out of elections to waste – this is the last chance to make a difference on climate change,469,0.97,boiupl,https://www.theguardian.com/commentisfree/2019/may/14/weve-run-out-of-elections-to-waste-this-is-the-last-chance-to-make-a-difference-on-climate-change,39,2019-5-14,
Momentum is growing to fight climate change by pricing carbon,468,0.98,d7plp0,https://thehill.com/opinion/energy-environment/462300-momentum-is-growing-to-fight-climate-change-by-pricing-carbon?fbclid=IwAR3-U9Z48mvFUjQnktbatImhywVFpofEGONOdWtMfRba7gNGSH5wQSnItAQ,18,2019-9-22,
UN: World could hit 1.5-degree warming threshold by 2024,471,1.0,hpc6oj,https://apnews.com/40c53c57860109143a9ed44393dab3c3,59,2020-7-11,
Decades of Science Denial Related to Climate Change has Led to Denial of the Coronavirus Pandemic,468,0.98,fxs2kq,https://insideclimatenews.org/news/08042020/science-denial-coronavirus-covid-climate-change?utm_campaign=Hot%20News&utm_source=hs_email&utm_medium=email&utm_content=86077977&_hsenc=p2ANqtz--0BVnTm1QHoAPeE6aJJxBma9V5AIR6VJe4gfwF9T4nbhv_RM5eTdr1VNmdNvAdFT6f6_aYa0p0YvI1nZUpF5tFtCC6rQ&_hsmi=86077977,34,2020-4-9,
"July confirmed as hottest month recorded: July was the hottest month on record, with global temperatures exceeding the previous record set in July 2016 when the world was in the throes of one of the strongest El Niño events on record.",471,0.99,cmam62,https://www.cnn.com/2019/08/05/world/hottest-july-on-record-climate-sci-intl/index.html,13,2019-8-5,
"Facebook creates fact-checking exemption for climate deniers: decided to allow its staffers to overrule the climate scientists and make any climate disinformation ineligible for fact-checking by deeming it ""opinion""",472,0.98,hgtli8,https://popular.info/p/facebook-creates-fact-checking-exemption,40,2020-6-27,
Coronavirus pandemic leading to huge drop in air pollution,464,1.0,fu7azz,https://www.theguardian.com/environment/2020/mar/23/coronavirus-pandemic-leading-to-huge-drop-in-air-pollution,22,2020-4-3,
'Young People Are Correct to Be Outraged': Seattle City Council Urges Public Schools to Let Students Join Global Climate Strike On Sept. 20,470,0.99,d5h9d0,https://www.commondreams.org/news/2019/09/17/young-people-are-correct-be-outraged-seattle-city-council-urges-public-schools-let,24,2019-9-17,
What winter? Earth just had its second-warmest December-February on record,468,0.99,fjkifh,https://www.usatoday.com/story/news/world/2020/03/13/climate-change-earth-had-second-warmest-winter-record/5043841002/?utm_campaign=Hot%20News&utm_source=hs_email&utm_medium=email&utm_content=84776497&_hsenc=p2ANqtz-_nVZvBoUnXL0K3rHB-oN2gdRgqL7pufKLKQ_CNZy5ip6DGWZ-e9GebhUQ-71PU4FZ2jAlcFp2ESky_iTf_vNnDLH05tg&_hsmi=84776497,28,2020-3-16,
Every Group Except Older Republicans Is Concerned About Climate Change,464,0.98,d7yuhn,https://www.huffingtonpost.ca/entry/climate-change-poll_us_5d87ab74e4b0849d472adbb3,32,2019-9-23,
"Greta Thunberg is right: Economically and politically, early ambition is better.",466,0.98,de4kcc,https://www.vox.com/energy-and-environment/2019/10/4/20896541/greta-thunberg-panic-carbon-tax-price,26,2019-10-6,
We may have just seen the world's highest recorded temperature ever. Has that sunk in? | Climate change,465,0.99,ickiz6,https://www.theguardian.com/environment/2020/aug/19/highest-recorded-temperature-ever-death-valley,44,2020-8-19,
"Death Valley soars to 130 degrees, potentially Earth’s highest temperature since at least 1931",464,0.99,ib5ntf,https://www.washingtonpost.com/weather/2020/08/16/death-valley-heat-record/,56,2020-8-17,
Bee population & honey production in Pakistan get a huge boost as Billion Tree Project trees mature,458,0.99,hnez00,https://news.trust.org/item/20200707041422-vekhw/,6,2020-7-8,
Greta Thunberg: Climate change 'as urgent' as coronavirus,465,0.96,hdzthn,https://www.bbc.com/news/science-environment-53100800,29,2020-6-23,
Bernie Sanders' economic adviser says Australia's bushfires are a climate change 'wake-up call',465,0.97,elep0o,https://www.theguardian.com/australia-news/2020/jan/08/bernie-sanders-economic-adviser-says-australias-bushfires-are-a-climate-change-wake-up-call,14,2020-1-8,
The White House Blocked My Report on Climate Change and National Security: Politics intruded on science and intelligence. That’s why I quit my job as an analyst for the State Department.,464,0.99,cjru5u,https://www.nytimes.com/2019/07/30/opinion/trump-climate-change.html,7,2019-7-30,
"1 The Whole World Is on the Ballot: As American democracy teeters, so does the fate of our burning planet.",460,0.98,jj5pqa,https://newrepublic.com/article/159958/vote-election-2020-climate,19,2020-10-28,
I can't believe this sub isn't blowing up right now..,456,0.98,c0hgbr,https://www.reddit.com/r/climate/comments/c0hgbr/i_cant_believe_this_sub_isnt_blowing_up_right_now/,116,2019-6-14,"...with everything going on in the world in the last few years.  The record-breaking heatwaves, wildfires, flooding, etc.  It's super depressing how unpopular this sub is."
Devolution of Borneo rain forest by u/8HcT,461,0.99,f1dq94,https://i.redd.it/apaagqjpayf41.jpg,23,2020-2-10,
The US government claims I'm a 'domestic terrorist'. Am I? | I shut down an oil pipeline as part of a peaceful protest. The government thinks this is violent extremism,459,0.97,ew643a,https://www.theguardian.com/commentisfree/2020/jan/30/oil-pipeline-protest-us-domestic-terrorism?utm_campaign=Hot%20News&utm_source=hs_email&utm_medium=email&utm_content=82653227&_hsenc=p2ANqtz--0MFspJKKBQrbP6TckscimCxt5lIsHKT0n1DbzUuLv47HGO72ZZ4cOjlzI9743hYBmOjpPfh0FtcW9_4Q_Pidi_3Xshw&_hsmi=82653227,57,2020-1-30,
”Save the coral reefs” message on airplane ???,460,0.98,f0ayq0,https://i.redd.it/m4w1txgjeif41.jpg,69,2020-2-7,
"Nearly 11,000 lightning bolts strike California, igniting hundreds of fires in a state facing multiple crises",458,1.0,idae6m,https://edition.cnn.com/2020/08/20/us/california-lightning-fires/index.html,13,2020-8-20,
"Two Weeks After Amazon Made Its 'Climate Pledge,' It Joined Big Oil for Its 'Accelerate Production 4.0' Event",461,0.99,dgf5x2,https://gizmodo.com/two-weeks-after-amazon-made-its-climate-pledge-it-join-1838944337,17,2019-10-11,
"Sir John Houghton, who was recognised for his work on climate change, has died of suspected Covid-19",457,0.98,g4pfid,https://www.bbc.co.uk/news/amp/uk-wales-52325374,5,2020-4-20,
The numbers add up to one simple fact: Trump does not care about the environment.,460,0.99,d3qbgt,https://i.redd.it/vpfirb7jjdm31.png,28,2019-9-13,
Earth just had its 400th straight warmer-than-average month thanks to global warming,460,0.99,ca9c51,http://www.usatoday.com/story/news/world/2018/05/17/global-warming-april-400th-consecutive-warm-month/618484002/,23,2019-7-8,
"No matter how many times you arrest Jane Fonda, she is going to look fabulous.",459,0.98,dqu62a,https://i.redd.it/uo942czgodw31.jpg,58,2019-11-3,
the rich are disproportionately responsible for consumption-sector emissions *and* that the vast majority of their emissions are related to transportation and travel,455,0.98,fk6bdb,https://www.nature.com/articles/s41560-020-0579-8,33,2020-3-17,
Climate change will hit economy harder than COVID-19 lockdowns: report,456,0.99,jnxgwz,https://www.moneymag.com.au/climate-change-worse-for-economy-than-covid-19,15,2020-11-4,
Himalayas visible for first time in 30 years as pollution levels in India drop,453,1.0,g2zwb3,https://www.sbs.com.au/language/english/audio/himalayas-visible-for-first-time-in-30-years-as-pollution-levels-in-india-drop,8,2020-4-17,
Climate group endorses both Sanders and Warren,451,0.98,fck21i,https://thehill.com/campaign-issues/energy-and-environment/485499-climate-group-dual-endorses-sanders-and-warren,62,2020-3-3,
National climate emergency declared by Canada's House of Commons,452,0.99,c22zbp,https://globalnews.ca/news/5401586/canada-national-climate-emergency/amp/?__twitter_impression=true,42,2019-6-18,
A Tale of Two Amazons,456,0.99,jaeury,https://i.redd.it/dk7vavl3kvs51.jpg,29,2020-10-13,
Four more years of Donald Trump could 'delay global emissions cuts by 10 years’,449,0.97,gs2x2z,https://www.carbonbrief.org/four-more-years-of-donald-trump-could-delay-global-emissions-cuts-by-10-years,36,2020-5-28,
Shame on CNN and the New York Times for ignoring the climate crisis,451,0.97,dj6eyk,https://www.theguardian.com/commentisfree/2019/oct/16/shame-on-cnn-and-the-new-york-times-moderators-for-ignoring-the-climate-crisis?utm_campaign=Carbon%20Brief%20Daily%20Briefing&utm_medium=email&utm_source=Revue%20newsletter,31,2019-10-17,
Attacks on Greta Thunberg Are About More Than Anti-Environmentalism,450,0.97,davlpm,https://www.desmogblog.com/2019/09/15/attacks-greta-thunberg-right-wing-free-market-network?,61,2019-9-29,
"What do Covid-19 and climate change have in common? The intensive meat industry, excessive travel, population growth, and economic inequality. We need to become more serious about ethical consumerism.",446,0.98,i20a5o,https://greenstarsproject.org/2020/04/08/coronavirus-save-the-planet-ethical-consumerism-climate-change/,29,2020-8-2,
15-year-old Alexandria Villaseñor watched the deadliest fire in California's history burn through entire towns. Now she's leading a 'battle cry' for global action on climate change.,452,0.98,igkj6i,https://www.insider.com/the-doers-teenager-alexandria-villaseor-fighting-climate-change-2020-8,12,2020-8-26,
"If We Bail Out Airlines, It Better Come With Climate Rules",450,0.98,fn7sjf,https://www.huffpost.com/entry/airline-bailout-climate-rules_n_5e73df84c5b63c3b648d435f,14,2020-3-23,
A Record Number of Americans Now Say Climate Change Is a Top Priority. So Now What?,443,0.99,ej0da8,https://www.motherjones.com/environment/2019/12/new-poll-reveals-more-us-voters-than-ever-worry-about-climate-change/,79,2020-1-3,
"Greta Thunberg declined a climate award because the world needs more action, fewer awards",445,0.96,dp6di5,https://www-m.cnn.com/2019/10/29/world/greta-thunberg-nordic-award-decline-trnd/index.html,25,2019-10-30,
"The Corona-Reset might grant us an unprecedented chance to take action against climate change. Took me a while to compile the 20+ sources. For better understanding, you may wanna read Part I and II as well.",447,0.98,g8bou3,https://besserwiz.art/2020/04/20/the-corona-reset-part-iii-might-it-even-save-humanity/,24,2020-4-26,
the environmental impact of a beef patty vs a plant based patty from Beyond Meat,446,0.97,i435q4,https://i.redd.it/flkswn5rz5f51.jpg,56,2020-8-5,
Africa can become a renewable energy superpower – if climate deniers are kept at bay; Nigel Lawson’s thinktank is pushing dirty energy on the continent with the greatest capacity for creating clean fuel,439,0.99,humsgm,https://www.theguardian.com/global-development/2020/jul/20/africa-can-become-a-renewable-energy-superpower-if-climate-deniers-are-kept-at-bay,6,2020-7-20,
'She's a phenomenon': Climate activist Greta Thunberg sailing into stiff winds in U.S. | CBC News,446,0.96,crl01a,https://www.cbc.ca/news/world/greta-thunberg-atlantic-voyage-united-states-1.5249604?cmp=newsletter-news-digests-canada-and-world-morning,28,2019-8-17,
We knew it 107 years ago: Coal Consumption Affecting Climate,444,0.99,cql257,https://i.redd.it/iay5mutszgg31.jpg,21,2019-8-15,
"Ice sheets melting at 'worst-case scenario rate', research warns | Science & Tech News",441,0.99,ikjj9n,https://news.sky.com/story/ice-sheets-melting-at-worst-case-scenario-rate-research-warns-12060834,14,2020-9-1,
"The unholy alliance of covid-19, nationalism, and climate change- When the pandemic wanes, a poorer, more divided world will still face the rapidly rising threat of global warming.",443,0.98,g0iljp,https://www.technologyreview.com/2020/04/10/998969/the-unholy-alliance-of-covid-19-nationalism-and-climate-change/?utm_campaign=Hot%20News&utm_source=hs_email&utm_medium=email&utm_content=86194162&_hsenc=p2ANqtz--6dNt9K0H6kWoKWugNx4UemzP4TNSutXHK-KXV0OOunjEWbWGqgD6mj1jEjbBbCD7ZhgA0OeaT6xNNttF_OxIQYy3l2A&_hsmi=86194162,13,2020-4-13,
"Laura is Katrina on fossil fuel steroids; A hurricane stronger than Katrina, aimed directly at the U.S. petrochemical hub during a climate crisis and pandemic, as Donald Trump vies for re-election. What could go wrong?",438,0.97,ihmmpc,https://heated.world/p/laura-is-katrina-on-fossil-fuel-steroids,39,2020-8-27,
A Major Coal Company Went Bust. Its Bankruptcy Filing Shows That It Was Funding Climate Change Denialism.,438,0.99,bprl1v,https://theintercept.com/2019/05/16/coal-industry-climate-change-denial-cloud-peak-energy/,23,2019-5-17,
Opinion: Trump's push to expand Arctic drilling is dangerous and foolhardy,440,0.99,ic0eti,https://www.latimes.com/opinion/story/2020-08-17/trump-arctic-drilling-dangerous-foolhardy-anwr?utm_campaign=Hot%20News&utm_medium=email&_hsmi=93438561&_hsenc=p2ANqtz-_1NTNB5c09o1UJ-r6r2Ec9C9Grydwxd-WZJQJkxEx25bdFCsVEruuKP0W5QUxqADRfYOyozY3-o9AL5w_WWYL7qCwi4Q&utm_content=93438561&utm_source=hs_email,22,2020-8-18,
Louisiana tribes file complaint with United Nations over U.S. inaction on climate change,437,0.99,eq0r4y,https://www.nola.com/news/article_c63ee390-3754-11ea-8c6f-57f94fd14a5a.html?utm_campaign=Hot%20News&utm_source=hs_email&utm_medium=email&utm_content=82071724&_hsenc=p2ANqtz--C77Ea2icjHmz7vKPIRRhCno1S5tkfb728RteF8S6yk5cWoqXEQP42uK5l5oA4BFfQ8BAjCGuJSVb6WIgmVdZLsxu0uA&_hsmi=82071724,6,2020-1-17,
The big polluters’ masterstroke was to blame the climate crisis on you and me,440,0.98,dfliaj,https://www.theguardian.com/commentisfree/2019/oct/09/polluters-climate-crisis-fossil-fuel,59,2019-10-10,
"'We Will Sue,' Vow Green Groups After Trump Guts Nation's Key Environmental Law",439,0.99,hry79y,https://www.commondreams.org/news/2020/07/15/we-will-sue-vow-green-groups-after-trump-guts-nations-key-environmental-law,18,2020-7-16,
Exxon has misled Americans on climate change for decades. Here’s how to fight back,437,0.98,dlymdc,https://www.theguardian.com/commentisfree/2019/oct/23/exxon-climate-change-fossil-fuels-disinformation,12,2019-10-23,
Thunberg is right. Congress is ignoring science – and that includes Democrats,435,0.97,d6hpri,https://www.theguardian.com/commentisfree/2019/sep/19/greta-is-right-congress-is-ignoring-science-and-that-includes-democrats,39,2019-9-20,
"Pressed on Climate Views and Ties to Shell Oil, Barrett Once Again Calls Established Climate Science 'Controversial'. Barrett again followed the standard script of climate denialists.",428,0.98,jfwjlq,https://www.commondreams.org/news/2020/10/21/pressed-climate-views-and-ties-shell-oil-barrett-once-again-calls-established,17,2020-10-22,
"Since taking office Trump has set-off on an extensive effort to deregulate and weaken climate and environmental protection, while promoting fossil fuels. Here's what a second term spells for the climate and energy agenda.",435,0.97,ieo6xd,https://www.theglobalcurrent.com/home/whats-left-to-destroy,13,2020-8-23,
Revealed: US listed climate activist group as ‘extremists’ alongside mass killers,433,0.99,eo4o3r,https://www.theguardian.com/environment/2020/jan/13/us-listed-climate-activist-group-extremists?utm_campaign=Hot%20News&utm_source=hs_email&utm_medium=email&utm_content=81813817&_hsenc=p2ANqtz--EhhO9RHEaV7HkCVoOsp9Owogp3snE3MlsPG6ElGWSKnGrjwTTVN35Tb0J8qXa_enDFWpxQKYGslQ5fZ58k6WpkgpYoQ&_hsmi=81813817,46,2020-1-13,
