title,score,upv_ratio,id,url,comms_num,created,body
Goldman Sachs thinks the US recovery is running into trouble,634,0.98,hm81y5,https://www.cnn.com/2020/07/06/investing/premarket-stocks-trading/index.html,98,2020-7-6,
"Some 837,000 Americans filed jobless claims last week as pandemic layoffs continue",638,0.98,j3gzpq,https://abcnews.go.com/Business/837000-americans-filed-jobless-claims-week-pandemic-layoffs/story?id=73354550,50,2020-10-2,
"Europe's Economy was Hit Hard Too, But Jobs Didn't Disappear Like in the U.S.",635,0.98,g6o7hu,https://www.npr.org/2020/04/23/838085670/europes-economy-was-hit-hard-too-but-jobs-didn-t-disappear-like-in-the-u-s,102,2020-4-23,
'It hasn't benefited us a dime': Georgia steelworkers' verdict on Trump tariffs | US news,636,0.91,9w3cns,https://www.theguardian.com/us-news/2018/nov/11/trump-tariffs-georgia-steel-trenton-economy,46,2018-11-11,
"As Trump disparages immigrants, Midwest dairy farmers build bridges to Mexico. ‘One of the things I hear so often from the current president is, ‘They’re not sending us their best.' I’ve been to those villages where our guys are from — and they sent us their best,’ says farm owner John Rosenow",637,0.92,9qp090,https://www.wisconsinwatch.org/2018/10/as-trump-disparages-immigrants-midwest-dairy-farmers-build-bridges-to-mexico/,47,2018-10-23,
"US stock market is worth 1.8x US GDP. Too big to fail, the stock market gets bailed out by the Fed, which creates trillions of dollars out of thin air and gives it out at practically 0% interest rate. This fake free market leads to huge inequality, since the Top 1% own 45% of the stocks.",633,0.95,ieufgb,https://i.redd.it/m45axgyqkni51.jpg,136,2020-8-23,
The naked lie that Republicans are the party of ‘fiscally responsibility’ has been completely demolished – Alternet.org,634,0.9,egvz5z,https://www.alternet.org/2019/12/the-naked-lie-that-republicans-are-the-party-of-fiscally-responsibility-has-been-completely-demolished/,78,2019-12-29,
From Chile to Lebanon: Working class offensive sweeps the globe,633,0.98,dmy8vi,https://www.wsws.org/en/articles/2019/10/25/pers-o25.html,51,2019-10-25,
The White House promised '70 percent' of the tax cut would go to workers. It didn't.,632,0.91,8uomu6,https://www.nbcnews.com/business/economy/what-did-corporate-america-do-tax-break-buy-record-amounts-n886621,108,2018-6-29,
U.S. jobless rate has already broken Great Depression records — and most media missed it: Media ran with the official jobless rate of 14.7% — even though the government admits it's really much higher,629,0.98,gke99e,https://www.salon.com/2020/05/15/us-jobless-rate-has-already-broken-great-depression-records--and-most-media-missed-it_partner/,43,2020-5-16,
The US actually created fewer jobs in 2018 and 2019 than we thought,628,0.92,f1qqim,https://www.businessinsider.com/the-us-actually-created-fewer-jobs-labor-data-hiring-2019-8,52,2020-2-10,
"Iran dumps dollar for yuan - Iran officially adopts the Renminbi as main foreign exchange currency, has traded with Swiss companies without using SWIFT or the US Dollar.",626,0.99,j7p9m7,https://www.asiatimesfinancial.com/news/iran-dumps-dollar-for-yuan,202,2020-10-9,
"$25,000 CASH BONUSES FOR ESSENTIAL WORKERS FACES UPHILL BATTLE WITH REPUBLICANS",629,0.92,g86miv,https://www.newsweek.com/25000-cash-bonuses-essential-workers-faces-uphill-battle-republicans-1500134,255,2020-4-26,
Hong Kong’s Rich Are Preparing for a Worst-Case Scenario,631,0.98,h8ta3b,https://www.bloomberg.com/news/articles/2020-06-13/hong-kong-s-rich-are-preparing-for-a-worst-case-scenario,52,2020-6-14,
Existing U.S. home sales fall to lowest levels since 2010,626,0.98,hm4q9x,https://www.sgvtribune.com/2020/06/22/existing-u-s-home-sales-fall-to-lowest-levels-since-2010/,88,2020-7-6,
'I had no choice': Sex for rent rises with coronavirus poverty,622,0.96,gpg3ks,https://news.trust.org/item/20200521173329-h428n/,188,2020-5-24,
Millennials Didn’t Kill the Economy. The Economy Killed Millennials.,625,0.95,a3owrt,https://www.theatlantic.com/ideas/archive/2018/12/stop-blaming-millennials-killing-economy/577408/,107,2018-12-6,
"Six months after launching operations with $2B, Streaming service, Quibi, is shutting down",625,0.99,jgcxv7,https://mazech.com/2020/10/six-months-after-launching-operations-with-2b-streaming-service-quibi-is-shutting-down/,109,2020-10-23,
"Yes, some US small business owners actually support the $600 weekly benefit",618,0.94,i6k0vo,https://www.theguardian.com/business/2020/aug/09/us-unemployment-benefits-small-business-owners,65,2020-8-9,
A National Evictions Cliff is Coming. America's Failing Legal System Will Make it Worse.,621,0.96,hsl7pk,https://theappeal.org/eviction-cliff-coronavirus-pandemic-legal-representation/,150,2020-7-17,
"World's billionaires became 20% richer in 2017, report reveals",619,0.94,9rkr1p,https://www.theguardian.com/news/2018/oct/26/worlds-billionaires-became-20-richer-in-2017-report-reveals,109,2018-10-26,
"Warren Buffett: If a bank needs a government bailout, the CEO and spouse should lose 'net worth'",616,0.97,bqiyue,https://www.cnbc.com/amp/2019/05/04/warren-buffett-if-a-bank-needs-a-government-bailout-the-ceo-and-spouse-should-lose-net-worth.html?__twitter_impression=true,76,2019-5-20,
How the baby boomers — not millennials — screwed America,620,0.9,9s7ocz,https://www.vox.com/2017/12/20/16772670/baby-boomers-millennials-congress-debt,99,2018-10-29,
Facebook Needs Trump Even More Than Trump Needs Facebook,619,0.94,iv45dd,https://www.bloomberg.com/news/features/2020-09-17/facebook-and-mark-zuckerberg-need-trump-even-more-than-trump-needs-facebook,58,2020-9-18,
IEA: Coronavirus 'accelerating closure' of ageing fossil-fuelled power plants,621,0.99,gt1jrh,https://www.carbonbrief.org/iea-coronavirus-accelerating-closure-of-ageing-fossil-fuelled-power-plants?,12,2020-5-30,
A top economist says the $4 trillion federal deficit isn't the problem — it's how we're spending the money,614,0.96,hkiyad,https://www.businessinsider.com/4-trillion-federal-deficit-isnt-problem-its-how-were-spending-2020-7,46,2020-7-3,
"Once we can work from anywhere, does the world need Silicon Valley?",621,0.97,gyyyxy,https://www.fastcompany.com/90511454/once-we-can-work-from-anywhere-does-the-world-need-silicon-valley,86,2020-6-8,
"House Democrats prepare new $2.4 trillion stimulus plan with unemployment aid, direct payments",615,0.96,izhdup,https://www.cnbc.com/2020/09/24/coronavirus-stimulus-democrats-prepare-new-relief-bill.html,201,2020-9-25,
"Richard Branson believes the key to success is a three-day workweek. With today's cutting-edge technology, he believes there is no reason people can't work less hours and be equally — if not more — effective.",622,0.96,ab462j,https://www.cnbc.com/2018/09/12/richard-branson-believes-the-key-to-success-is-a-three-day-workweek.html,57,2018-12-31,
Senate Democrats push to extend enhanced unemployment benefit until jobless rates fall,613,0.97,hrf39o,https://www.cnbc.com/2020/07/01/coronavirus-stimulus-democrats-try-to-extend-unemployment-benefits.html,84,2020-7-15,
Fragile safety net leaves U.S. economy vulnerable to coronavirus hit,612,0.97,ffbohw,https://www.reuters.com/article/us-health-coronavirus-usa-economy-analys/fragile-safety-net-leaves-u-s-economy-vulnerable-to-coronavirus-hit-idUSKBN20R2IM,82,2020-3-8,
"Los Angeles, Atlanta Among Cities Joining Coalition To Test Universal Basic Income",613,0.98,hiej82,https://www.forbes.com/sites/rachelsandler/2020/06/29/los-angeles-6-other-cities-join-coalition-to-pilot-universal-basic-income/amp/,53,2020-6-30,
Richest 1% of Americans Close to Surpassing Wealth of Middle Class,614,0.97,du0beo,https://www.bloomberg.com/news/articles/2019-11-09/one-percenters-close-to-surpassing-wealth-of-u-s-middle-class,151,2019-11-10,
Two Charts Show Trump's Job Gains Are Just A Continuation From Obama's Presidency,609,0.88,9t0gn1,https://www.forbes.com/sites/chuckjones/2018/10/30/two-charts-show-trumps-job-gains-are-just-a-continuation-from-obamas-presidency/,76,2018-11-1,
"5 Major Banks Exposed for Moving Trillions for Mobsters, Onecoin Ponzi, and Drug Cartels",613,0.98,ix3ugs,https://news.bitcoin.com/5-major-banks-exposed-for-moving-trillions-for-mobsters-onecoin-and-drug-cartels/,81,2020-9-22,
Bernie Sanders: America is 'owned and controlled by a small number of multi-billionaires' [United States of America],611,0.93,a5omf4,https://www.cnbc.com/2018/12/12/bernie-sanders-america-is-controlled-by-a-few-multi-billionaires.html,70,2018-12-13,
Canada to retaliate 'dollar for dollar' after U.S. slaps 10% tariff on aluminum,614,0.97,i6ht6l,https://www.msn.com/en-ca/news/canada/us-slaps-10-tariff-on-aluminum-imports-from-canada/ar-BB17EW5t,53,2020-8-9,
Bayer-Monsanto pleads guilty to illegal Hawaii pesticide spraying on island of Maui: agreed to pay $10.2 million in criminal fines and other payments for the methyl parathion spraying and for illegally storing hazardous waste,608,0.98,e6zd5l,https://www.reuters.com/article/us-bayer-monsanto-plea-hawaii/bayers-monsanto-pleads-guilty-to-illegal-hawaii-pesticide-spraying-idUSKBN1XW21N,66,2019-12-6,
"Wisconsin Gets Wise to Foxconn's Grift, Blocks New Subsidies: Donald Trump and Paul Ryan's once-heralded Foxconn factory deal in Wisconsin quickly devolved into farce",605,0.98,jg0zhm,https://www.techdirt.com/articles/20201013/06253345487/wisconsin-gets-wise-to-foxconns-grift-blocks-new-subsidies.shtml,45,2020-10-22,
Murica,604,0.82,htgkto,https://i.redd.it/9h2v1hu88mb51.png,63,2020-7-18,
"Amazon--and 56 Other Corporations--Took Your Tax Dollars: They claim to hate socialism if it means Medicare for All, but they sure as hell love socialism when it's welfare for them.",610,0.91,bfcldn,https://www.commondreams.org/views/2019/04/19/amazon-and-56-other-corporations-took-your-tax-dollars,56,2019-4-20,
Monopolies cost Americans $300 a month. We're no longer the land of free markets,606,0.97,dzx2xv,https://www.theguardian.com/commentisfree/2019/nov/13/america-was-once-the-land-of-free-markets-now-theyre-becoming-a-myth,81,2019-11-22,
American taxpayers paid over $90 billion more under Trump tax law,599,0.94,bwpkoz,https://finance.yahoo.com/news/american-taxpayers-paid-nearly-100-billion-more-to-irs-under-trump-tax-law-194900782.html,145,2019-6-4,
"GE freezing pensions for 20,000 employees",602,0.98,deilb0,https://www.marketwatch.com/story/ge-freezing-pensions-for-20000-employees-2019-10-07,87,2019-10-7,
"‘Call it fate, call it karma’ — Why the coronavirus is merely ‘the final kick into the abyss’ for the U.S. economy",598,0.89,gqeq4x,https://www.marketwatch.com/story/call-it-fate-call-it-karma-why-the-coronavirus-is-merely-the-final-kick-into-the-abyss-for-the-us-economy-2020-05-19?link=TD_nypost_articles.7c7e0f416376f79f&utm_source=nypost_articles.7c7e0f416376f79f&utm_campaign=circular&utm_medium=MARKETWATCH,125,2020-5-26,
Worried about Coronavirus? Tell Trump to reverse cuts to critical US agencies,600,0.89,fawqo0,https://thehill.com/blogs/congress-blog/healthcare/483320-worried-about-coronavirus-tell-trump-to-reverse-cuts-to,98,2020-2-28,
"Many organic farmers 'didn’t notice the trade war': While Trump's trade war with China has dominated conversation among farmers using GMO and pesticides, organic farmers have had the luxury of focusing on other things",598,0.96,f1al0g,https://bangordailynews.com/2020/02/06/news/nation/why-many-organic-farmers-didnt-notice-the-trade-war/,40,2020-2-10,
"Tech companies that pay $0 in federal income taxes: Amazon, GM, Delta, etc.",604,0.93,e1eybu,https://www.businessinsider.com/tech-companies-dont-pay-federal-income-taxes-amazon-gm-2019-11,172,2019-11-25,
World’s largest economy in free fall,597,0.89,he8o6v,"https://independentaustralia.net/politics/politics-display/worlds-largest-economy-in-free-fall,14019#.XvFDYRRnu2k.reddit",100,2020-6-23,
Analysis | Trump vowed to eliminate the debt in 8 years. He’s on track to leave it at least 50 percent higher.,598,0.93,b2j07x,https://www.washingtonpost.com/business/2019/03/12/trump-vowed-eliminate-debt-years-hes-track-leave-it-least-percent-higher/,91,2019-3-18,
Fed chair says this is the worst economy in history,601,0.95,gamcqy,https://www.cnn.com/us/live-news/us-coronavirus-update-04-29-20/h_20ffee0c7ad410075e8110c32442527c,126,2020-4-30,
"Trump Economy Lags Clinton's, Obama's, Reagan's and Even Carter's",597,0.89,akpj2f,https://www.bloomberg.com/view/articles/2019-01-28/trump-economy-lags-clinton-s-obama-s-reagan-s-and-even-carter-s,78,2019-1-29,
70% of Americans say they are struggling financially,599,0.97,dwjvcq,https://www.cbsnews.com/news/70-americans-are-struggling-financially/,169,2019-11-15,
Federal Reserve's $3 trillion virus rescue inflates market bubbles,596,0.99,ig3uz0,https://www.reuters.com/article/us-health-coronavirus-federalreserve-mar/federal-reserves-3-trillion-virus-rescue-inflates-market-bubbles-idUSKCN24E13G,67,2020-8-25,
"Mitch McConnell Calls for Social Security, Medicare, Medicaid Cuts After Passing Tax Cuts, Massive Defense Spending",595,0.96,9oxbxe,https://www.newsweek.com/deficit-budget-tax-plan-social-security-medicaid-medicare-entitlement-1172941,89,2018-10-17,
Private jet company founded by Trump donor gets $27 million in Coronavirus bailout,600,0.93,gkmxwl,https://www.cnbc.com/2020/05/14/private-jet-company-owned-by-trump-donor-gets-27-million-bailout.html,61,2020-5-16,
"One $1,200 stimulus check won’t cut it. Give Americans $2,000 a month tax-free to fire up the economy",596,0.91,g7dxdu,https://www.marketwatch.com/story/one-1200-stimulus-check-wont-cut-it-give-americans-2000-a-month-to-fire-up-the-economy-2020-04-20,73,2020-4-25,
The Mormon Church Amassed $100 Billion. It Was the Best-Kept Secret in the Investment World. - WSJ,590,0.97,f0re2x,https://www.wsj.com/articles/the-mormon-church-amassed-100-billion-it-was-the-best-kept-secret-in-the-investment-world-11581138011,103,2020-2-8,
The GOP Tax Cut Trickle Down Has Arrived: Worker Bonuses Went Up One Penny in 2018,590,0.94,bv0cvw,http://labor411.org/411-blog/the-gop-tax-cut-trickle-down-has-arrived-worker-bonuses-went-up-one-penny-in-2018/,83,2019-5-31,
BlackRock: The US labor market will recover more slowly than expected,587,0.99,gsqj3k,http://www.economo.co.uk/blackrock-the-us-labor-market-will-recover-more-slowly-than-expected/,73,2020-5-29,
COVID-19 U.S. employment shocks likely larger than Great Depression,593,0.97,g72gph,https://phys.org/news/2020-04-covid-employment-larger-great-depression.html,54,2020-4-24,
America’s educational system is an ‘aristocracy posing as a meritocracy’,591,0.97,bp0sbv,https://www.marketwatch.com/story/americas-educational-system-is-an-aristocracy-posing-as-a-meritocracy-2019-05-15,64,2019-5-16,
"Marijuana Legalization In Texas Would Generate Billions In Tax Revenue, New Economic Analysis Shows",588,0.98,jfeinp,https://www.marijuanamoment.net/marijuana-legalization-in-texas-would-generate-billions-in-tax-revenue-new-economic-analysis-shows/,37,2020-10-21,
"Under investigation for its response to COVID-19 pandemic, Carnival announces plans to resume cruises in August",590,0.97,ge52fe,https://www.theweek.com/speedreads/912732/under-investigation-response-covid19-pandemic-carnival-announces-plans-resume-cruises-august,81,2020-5-6,
"When Medical Debt Collectors Decide Who Gets Arrested. Welcome to Coffeyville, Kansas, where the judge has no law degree, debt collectors get a cut of the bail, and Americans are watching their lives — and liberty — disappear in the pursuit of medical debt collection.",581,0.99,divatr,https://features.propublica.org/medical-debt/when-medical-debt-collectors-decide-who-gets-arrested-coffeyville-kansas/,96,2019-10-17,
Whopping 62 percent of jobs don't support middle-class life after accounting for cost of living.,590,0.95,9so8uh,https://www.usatoday.com/story/money/2018/10/30/jobs-62-percent-fall-short-middle-class-standard-us/1809629002/,80,2018-10-30,
"The Dirtiest Secret in Finance, Investing Skill Doesn't Exist",587,0.96,iev8x6,https://medium.com/@jrb585/the-dirtiest-secret-in-finance-investing-skill-doesnt-exist-bca087e918f9,74,2020-8-23,
"Coronavirus: Thai king flees country with 20 women, isolates at a luxury hotel in Germany with them",583,0.91,frlhoz,https://www.mazechmedia.com/2020/03/coronavirus-thai-king-flees-country-with-20-women-isolates-at-a-luxury-hotel-in-germany-with-them/,96,2020-3-30,
The top 400 income holders (billionaires) pay an effective tax rate of 23%. While it is 25-30% for the working and middle classes. America’s tax system is now technically regressive.,580,0.96,dpcgee,https://thenextrecession.wordpress.com/2019/10/30/tax-justice-now/,47,2019-10-31,
"As Deficit Explodes, GOP Demands Emergency Tax Cut for the Rich",583,0.95,cjtgev,https://www.vanityfair.com/news/2019/07/republicans-capital-gains-tax-cut,203,2019-7-30,
The One Percent Have Gotten $21 Trillion Richer Since 1989. The Bottom 50% Have Gotten Poorer.,583,0.94,c4k6sj,http://nymag.com/intelligencer/2019/06/the-fed-just-released-a-damning-indictment-of-capitalism.html,145,2019-6-24,
"Companies struggling to fill jobs 'should try paying more,' Fed's Kashkari says",580,0.98,9wxq6z,https://www.cnbc.com/2018/11/13/firms-trying-to-fill-jobs-should-try-paying-more-feds-kashkari-says.html,62,2018-11-14,
"Walmart is hiring 900 truck drivers, raises salary to almost $90K",582,0.98,amrsje,https://www.wjhl.com/local/walmart-is-hiring-900-truck-drivers-raises-salary-to-almost-90k/1723751180,98,2019-2-4,
Members of Congress took small-business loans — and the full extent is unknown,580,0.98,hc6qpt,https://politi.co/2N1G3rB,24,2020-6-20,
Trump Wants Small Farmers to Clear Out for the Big Guys,579,0.95,dryh0q,https://www.truthdig.com/articles/trump-wants-small-farmers-to-clear-out-for-the-big-guys/,76,2019-11-5,
"Trump’s trade war has killed 300,000 jobs",583,0.91,d36azt,https://finance.yahoo.com/news/trumps-trade-war-has-killed-300000-jobs-194717808.html?guccounter=1,83,2019-9-12,
$100 billion: That’s the amount that U.S. credit card debt fell from February to June.,578,0.99,i7ulsm,https://marker.medium.com/why-credit-card-debt-is-shrinking-by-the-numbers-b2a0c7e1494e,103,2020-8-12,
Governments are paying companies to move their manufacturing out of China,576,0.98,g6wc2n,https://qz.com/1843977/governments-are-paying-companies-to-move-production-out-of-china/,74,2020-4-24,
U.S. National Debt Is On Its Way To A Record $27 Trillion,570,0.97,hqo4er,https://www.thecryptoassociate.com/u-s-national-debt-is-on-its-way-to-a-record-27-trillion/,86,2020-7-14,
"$2,000 Per Person Plus $2,000 Per Child: Monthly Economic Crisis Support Act Would Send Payments To Over 90% Of Americans",574,0.96,gfvflj,https://www.forbes.com/sites/jimwang/2020/05/08/2000-per-person-and-2000-per-child-monthly-economic-crisis-support-act-would-send-payments-to-over-90-of-americans/#7e110cdd3977,197,2020-5-8,
America's richest 400 families now pay a lower tax rate than the middle class,569,0.97,dftalk,https://www.cbsnews.com/news/americas-richest-400-families-pay-a-lower-tax-rate-than-the-middle-class/,101,2019-10-10,
Appeals court: Trump must turn over taxes to prosecutor,574,0.97,j6w3v2,https://apnews.com/ab8f19ba2b8d311f547bd6f443ed7b92,25,2020-10-8,
Germany enters official recession,571,0.97,dmjydz,https://www.thisismoney.co.uk/money/markets/article-7597465/Germany-tumbles-recession-global-trade-tensions-worries-Brexit-toll.html,156,2019-10-25,
NASA paid Musk millions to make sure his employees don't smoke pot [United States of America],572,0.97,dio75g,https://www.politico.com/news/2019/10/16/nasa-musk-weed-048099,148,2019-10-16,
U.S. dollar trading at its worst level in more than two years,568,0.97,icbddl,https://cryptoprice.ng/blog/u-s-dollar-trading-at-its-worst-level-in-more-than-two-years,72,2020-8-19,
"Unemployment rate won't recover for the next decade, CBO projects",570,0.96,hly2t2,https://www.cnn.com/2020/07/02/economy/congressional-budget-office-projections-economy/index.html,77,2020-7-6,
Some 42% Of Jobs Lost In Pandemic Are Gone For Good,569,0.86,gl7733,https://www.forbes.com/sites/kenrapoza/2020/05/15/some-42-of-jobs-lost-in-pandemic-are-gone-for-good/#1b3076ea50ab,96,2020-5-17,
"Forty dead, now 40 laid off – the untold stories of crisis in a New York City Nursing home",573,0.98,jl1msu,https://mazech.com/2020/10/forty-dead-now-40-laid-off-the-untold-stories-of-crisis-in-a-new-york-city-nursing-home/,35,2020-10-31,
J. Crew Files for Bankruptcy in Virus’s First Big Retail Casualty,574,0.98,gd952k,https://www.nytimes.com/2020/05/03/business/j-crew-bankruptcy-coronavirus.html,64,2020-5-4,
Deutsche Bank Tells Court It Has Trump-Related Tax Returns Sought by Congress,570,0.97,cwl08j,https://www.wsj.com/articles/deutsche-bank-tells-court-it-has-trump-tax-returns-sought-by-congress-11566946669,50,2019-8-28,
"What can the U.S. learn from New Zealand, Singapore and South Korea? Dr. Fauci says Americans can do more to battle COVID-19",571,0.95,ieffm2,http://rplg.co/e452a040,68,2020-8-22,
"The Unemployment Rate Is Falling, But More People Are Losing Their Jobs Permanently",564,0.97,hk6pue,https://fivethirtyeight.com/features/the-unemployment-rate-is-falling-but-more-people-are-losing-their-jobs-permanently/,29,2020-7-3,
"Elon Musk said he sourced 1,255 ventilators from China and shipped them to Los Angeles as US worries about a shortage in the face of coronavirus",568,0.96,fo26io,https://www.reddit.com/user/Fatherthinger/comments/fo25g8/elon_musk_says_he_shipped_1255_ventilators_to_la/,57,2020-3-24,
US Postal Service to increase prices in 2021,564,0.94,j930wq,https://www.blackhillsfox.com/2020/10/10/usps-to-increase-prices-in-2021/,118,2020-10-11,
Top economist: US coronavirus response is like 'third world' country,563,0.94,g6m5fs,https://www.theguardian.com/business/2020/apr/22/top-economist-us-coronavirus-response-like-third-world-country-joseph-stiglitz-donald-trump,85,2020-4-23,
Trump’s budget would add at least $7.9T to the debt in ten years,566,0.95,b06tj8,https://reason.com/blog/2019/03/11/trumps-budget-would-add-to-the-deficit,105,2019-3-12,
U.S. cruises toward record-breaking debt on Trump's watch,568,0.93,9mh341,https://www.politico.com/story/2018/06/26/cbo-federal-deficit-break-records-651929,121,2018-10-9,
"'Not just a low-wage recession': White-collar workers feel coronavirus squeeze: ""The drop in overall employment that white-collar industries have seen in five months is already on par with or worse than the hits they took during the Great Recession."" [United States of America]",563,0.99,iff9lw,https://www.politico.com/news/2020/08/23/white-collar-unemployment-coronavirus-400130,47,2020-8-24,
Airbnb hosts are planning to sell off their properties because of the pandemic,564,0.99,gqmphv,https://www.cnn.com/2020/05/25/tech/airbnb-hosts/index.html,88,2020-5-26,
"Bernie Sanders: ""The Boomer generation needed just 306 hours of minimum wage work to pay for four years of public college. Millennials need 4,459. The economy today is rigged against working people and young people. That is what we are going to change.""",567,0.94,bgxk98,https://twitter.com/BernieSanders/status/1121058539634593794,187,2019-4-25,
"US GDP collapses, the Federal Reserve tries to save the economy",558,0.9,ii9esy,https://www.financedrops.com/us-gdp-collapses-the-federal-reserve-tries-to-save-the-us-economy/,148,2020-8-28,
GM commits $3 billion to build electric and autonomous vehicles in Michigan,566,0.98,ev7dsj,https://techcrunch.com/2020/01/27/gm-commits-3-billion-to-build-electric-and-autonomous-vehicles-in-michigan/,77,2020-1-29,
"Clorox disinfectant wipes won’t be fully in stock until summer, CEO warns",566,0.98,ggizdi,https://www.wbaltv.com/article/clorox-wipes-out-of-stock-until-summer/32423008,38,2020-5-10,
"John Bolton was fired, and the price of oil instantly fell",567,0.98,d2d0fl,https://www.cnn.com/2019/09/10/investing/john-bolton-oil-prices/index.html,110,2019-9-11,
Workers going unpaid during the shutdown owe $438 million in rent and mortgage payments this month,561,0.96,ahjvhn,https://www.cnbc.com/2019/01/15/federal-workers-who-arent-being-paid-owe-438-million-for-housing.html,56,2019-1-19,
HUD to extend foreclosure ban protecting 8.1 million people until 2021,556,0.98,icl4vb,https://www.politico.com/news/2020/08/18/hud-foreclosure-evictions-ban-397960,53,2020-8-19,
US is expected to report a record-breaking economic plunge,559,0.97,i0cmcx,https://abcnews.go.com/US/wireStory/us-expected-report-record-breaking-economic-plunge-72053702,60,2020-7-30,
"Unbelievable stupidity: Stocks plunge, coronavirus spreads and President Trump tweets image of himself playing a fiddle",556,0.92,fg6xjk,https://www.marketwatch.com/story/stocks-plunge-coronavirus-spreads-and-trump-retweets-image-of-himself-playing-a-fiddle-with-an-ominous-message-2020-03-08?,105,2020-3-10,
Face it: Apple may never again produce anything as important as the iPhone,556,0.89,ectpp6,https://www.theverge.com/2019/12/17/21026112/apple-tim-cook-iphone-watch-tv-decade-blockbusters-walt-mossberg,103,2019-12-19,
"Less Local News Means Less Democracy. When local journalism declines, so does government transparency and civic engagement",552,0.99,dhyrgx,https://niemanreports.org/articles/less-local-news-means-less-democracy/,17,2019-10-15,
Alexandria Ocasio-Cortez Suggested a 70% Tax Rate on the Rich--5 Famous Economists Say it Could Work,561,0.81,aeibg1,http://time.com/money/5496760/ocasio-cortez-tax-rate-economists/,237,2019-1-10,
Mass Protests Across The U.S. Have No Impact On Stocks—What Gives?,554,0.98,gvvvy0,https://www.forbes.com/sites/sergeiklebnikov/2020/06/02/why-stocks-are-rallying-amid-widespread-protests/#51a9769d7e8b,93,2020-6-3,
