title,score,upv_ratio,id,url,comms_num,created,body
"The typical full-time salary in America would be $102,000 if wages had kept up with growth — but the economy has failed 90% of workers",447,0.96,iws5e9,https://www.businessinsider.com/median-us-worker-salaries-could-have-been-102000-without-inequality-2020-9,82,2020-9-21,
Alexandria Ocasio-Cortez: “We should be excited about automation”,445,0.9,azge27,https://www.fastcompany.com/90314386/alexandria-ocasio-cortez-we-should-be-excited-about-automation,178,2019-3-10,
"Trump signs order that could punish social media companies for how they police content, drawing criticism and doubts of legality",446,0.96,gse2tn,https://www.washingtonpost.com/technology/2020/05/28/trump-social-media-executive-order/,58,2020-5-29,
"NYC Rental Market Pushed to Breaking Point by Tenant Debts. Stopgap measures are keeping renters in their apartments, even as their bills stack up.",437,0.99,hnuy71,https://www.bloomberg.com/news/articles/2020-07-08/coronavirus-moves-nyc-affordable-housing-crisis-to-breaking-point,75,2020-7-9,
Brace yourselves...,437,0.9,a99ie7,https://i.redd.it/59ejylhuba621.jpg,32,2018-12-25,
Why do we spend more on the military than the next 11 nations combined?,441,0.91,hgoiws,https://i.redd.it/ffgdj1rh6a751.jpg,169,2020-6-27,
US income inequality jumps to highest level ever recorded,444,0.96,dabubj,https://www.insider.com/income-inequality-reached-highest-level-ever-recorded-in-2018-2019-9,124,2019-9-28,
Amazon Will Pay $0 in Taxes on Multi-Billion Dollar Profits,434,0.78,c4v46j,https://www.breitbart.com/tech/2019/06/21/amazon-will-pay-0-in-taxes-on-multi-billion-dollar-profits/,158,2019-6-25,
An eviction and foreclosure crisis is looming,436,0.97,hudnrq,https://www.salon.com/2020/07/19/an-eviction-and-foreclosure-crisis-is-looming/,98,2020-7-20,
"'Over our dead bodies:' Lindsey Graham vows Congress won't extend additional $600 coronavirus-related unemployment benefits, as U.S. death toll crosses the 60,000 mark",440,0.98,gb8rkl,https://www.businessinsider.com/lindsey-graham-congress-coronavirus-unemployment-benefit-over-our-dead-bodies-2020-4,107,2020-5-1,
Monetary Policy Is the Root Cause of the Millennials’ Struggle,439,0.94,czzdp4,https://www.cassandracapital.net/post/monetary-policy-is-the-root-cause-of-the-millennials-struggle,144,2019-9-5,
"Global car sales hit the brakes, mass layoffs by Nissan and Ford",443,0.98,ezc59g,https://www.wheelsjoint.com/global-car-sales-hit-the-brakes-mass-layoffs-by-nissan-and-ford/,128,2020-2-6,
The Next Recession Will Destroy Millennials,442,0.92,cw4zs4,https://www.theatlantic.com/ideas/archive/2019/08/millennials-are-screwed-recession/596728/,195,2019-8-27,
Trump's 'economic illiteracy' caused the US-China trade war,434,0.89,blw9rd,https://www.cnbc.com/2019/03/23/trumps-economic-illiteracy-caused-us-china-trade-war-columbia-prof.html,103,2019-5-8,
"United Airlines CEO: ""We expect to fly fewer people during the entire month of May than we did on a single day in May 2019.""",437,0.99,g2mwgi,https://apnews.com/679369e65e28b36264798eca731801d3,43,2020-4-17,
China no longer top trading partner of U.S. | Replaced by Mexico & Canada,435,0.97,clxm30,https://www.thehindu.com/news/international/china-no-longer-top-trading-partner-of-us/article28804825.ece,51,2019-8-4,
"Trump could have stabilized markets more had he not muzzled the grown-up in the room, Dr Fauci",439,0.89,fbghh8,https://www.thebipartisanpress.com/politics/trump-coronavirus-bungling-part-deux-the-fatal-blow/,37,2020-3-1,
"Coronavirus doesn't take a vacation, neither should Congress on relief for the unemployed",433,0.99,id8ilf,https://www.usatoday.com/story/opinion/todaysdebate/2020/08/19/coronavirus-unemployment-relief-congress-get-back-work-editorials-debates/5603886002/,56,2020-8-20,
Don’t Be Shocked If Trump’s Economy Goes the Way of Bush’s,432,0.9,e9gbhz,https://www.bloomberg.com/opinion/articles/2019-05-03/trump-s-economy-could-mimic-george-w-bush-s,65,2019-12-12,
Nation's Biggest Christian Retail Chain Set to Close All 170 Stores [United States of America],440,0.96,b80yj1,https://www.beliefnet.com/columnists/news/2019/03/nations-biggest-christian-retail-chain-set-close-170-stores.php,116,2019-4-1,
Valuing human life adds value to the economy,433,0.95,grch0s,https://bluenotes.anz.com/posts/2020/05/andrew-cornell-column-covid19-reopening-economy?adobe_mc=MCMID%3D91931573662167745648708078606479228630%7CMCORGID%3D67A216D751E567B20A490D4C%2540AdobeOrg%7CTS%3D1590548400,53,2020-5-27,
Disney's profit plunged 91% last quarter as its parks closed their doors,432,0.98,geb4n5,https://www.cnn.com/2020/05/05/media/disney-earnings-q2-2020-coronavirus/index.html,64,2020-5-6,
"How Aldi, a brutally efficient grocery chain, is beating Walmart on low prices",433,0.98,bpsofl,https://www.cnn.com/interactive/2019/05/business/aldi-walmart-low-food-prices/index.html,95,2019-5-17,
US Taxpayers Have Been Funding Big Business’s Wars for 233 Years,433,0.9,aiuef6,https://truthout.org/articles/us-taxpayers-have-been-funding-big-businesss-wars-for-233-years/,45,2019-1-23,
"Cuba prepares for 'profound transformation' of its monetary system, urges calm",432,0.98,jatb35,https://www.nbcnews.com/news/latino/cuba-prepares-profound-transformation-its-monetary-system-urges-calm-n1243173,50,2020-10-14,
"As more colleges stay online, students demand tuition cuts [United States of America]",436,0.99,ietrd7,https://apnews.com/b33f36db3569ea43ff9126a45ae5afd7,42,2020-8-23,
"The IMF identifies the $5,200,000,000,000 that we spend every year on fossil fuel subsidies",435,0.96,boryvi,https://citizensclimatelobby.uk/2019/05/the-imf-on-fossil-fuel-subsidies/,30,2019-5-15,
U.S. economy lost at least $6 billion to government shutdown,430,0.96,ajvprr,https://www.reuters.com/article/us-usa-shutdown-s-p/u-s-economy-lost-at-least-6-billion-to-government-shutdown-sp-idUSKCN1PJ2MU?feedType=RSS&feedName=businessNews&utm_source=feedburner&utm_medium=feed&utm_campaign=Feed%3A+reuters%2FbusinessNews+%28Business+News%29,87,2019-1-26,
"Harley-Davidson will be ‘taxed like never before’ if production moved overseas, Trump threatens on Twitter",434,0.96,8u0zba,http://business.financialpost.com/transportation/autos/trump-threatens-harley-with-big-tax-on-bikes-imported-to-u-s,136,2018-6-26,
"One in Ten Amazon Workers In Ohio Uses Food Stamps To Survive ""This is despite the fact that, since 2014, the state has given Amazon over $125 million in subsidies to expand""",432,0.93,89obpg,https://corpwatch.org/article/one-ten-amazon-workers-ohio-uses-food-stamps-survive,239,2018-4-4,
Workers plan to walk off the job in nationwide Strike for Black Lives,428,0.94,hq1mvd,https://www.cnn.com/2020/07/12/business/strike-for-black-lives-union-wages/index.html,52,2020-7-13,
The Fed is increasingly moving away from the idea of a V-shaped recovery,434,0.98,ghlbiu,http://www.economo.co.uk/the-fed-is-increasingly-moving-away-from-the-idea-of-a-v-shaped-recovery/,89,2020-5-11,
The US Economic System Doesn’t Just Allow Poverty -- It Generates Poverty,431,0.9,df293p,https://truthout.org/audio/the-us-economic-system-doesnt-just-allow-poverty-it-generates-poverty/,153,2019-10-9,
Nearly two-thirds say they've seen no increase in take-home pay from Republican tax cuts,428,0.92,9su09k,https://thehill.com/blogs/blog-briefing-room/news/410814-nearly-two-thirds-say-theyve-seen-no-increase-in-take-home-pay,100,2018-10-31,
How Trump Has Betrayed the Working Class,429,0.83,efapqn,https://www.commondreams.org/views/2019/12/24/how-trump-has-betrayed-working-class,197,2019-12-25,
A blow to Washington… China to invest $280 billion in Iranian sectors targeted by sanctions,429,0.96,d1d9d2,https://www.middleeastmonitor.com/20190907-a-blow-to-washington-china-to-invest-280-billion-in-iranian-sectors-targeted-by-sanctions/,50,2019-9-9,
Billionaires Are Not Self-Made.,422,0.8,i4t2h8,https://medium.com/discourse/billionaires-are-not-self-made-803b0d0a4a48,175,2020-8-6,
US unemployment hasn't looked this bad since the 1930s,426,0.99,gcy8tk,https://www.cnn.com/2020/05/03/investing/stocks-week-ahead/index.html,40,2020-5-4,
Oil Plunges After Saudi Arabia Announces Yemen Ceasefire,427,0.97,da1ma6,https://oilprice.com/Energy/Oil-Prices/Oil-Plunges-After-Saudi-Arabia-Announces-Yemen-Ceasefire.html,64,2019-9-27,
You Call It the Gig Economy. California Calls It ‘Feudalism.’,427,0.96,d3iitf,https://www.nytimes.com/2019/09/12/opinion/california-gig-economy-bill-ab5.html,132,2019-9-13,
"In a Shutdown, IRS Will Take Your Money, but Give No Refunds",420,0.95,acnx5c,https://www.wsj.com/articles/in-a-shutdown-irs-will-take-your-money-but-give-no-refunds-11546462112,54,2019-1-5,
"Student Loan Watchdog Quits, Says Administration 'Turned Its Back' On Borrowers",423,0.95,9azi0q,https://www.npr.org/2018/08/27/642199524/student-loan-watchdog-quits-blames-trump-administration,30,2018-8-28,
"EU puts Cayman Islands, others on tax blacklist",420,0.98,f5sady,https://abcnews.go.com/International/wireStory/eu-adds-jurisdictions-blacklist-tax-havens-69042200,44,2020-2-18,
Uber lays off 435 employees after it reported a $5.2 billion quarterly loss.,422,0.98,d2s342,https://www.usatoday.com/story/tech/talkingtech/2019/09/10/uber-lays-off-435-employees-after-record-5-2-billion-quarterly-loss/2279602001/,134,2019-9-11,
Saudi Arabia fund dumped nearly all of its Tesla shares in the fourth quarter before the rally,422,0.97,ez6x9j,https://www.reddit.com/user/Fatherthinger/comments/ez6wwn/saudi_arabia_fund_dumped_nearly_all_of_its_tesla/,26,2020-2-5,
Facebook Staff Urged to Snitch on Zuckerberg Over Election Disinformation,421,0.99,jg4bm6,https://www.vice.com/en/article/5dpzmn/facebook-staff-urged-to-snitch-on-zuckerberg-over-election-disinformation,8,2020-10-23,
One third of the U.S. economy is jammed into just 31 counties. L.A. is the biggest,421,0.97,edi0sd,https://www.latimes.com/business/story/2019-12-19/los-angeles-largest-economy,35,2019-12-21,
S&P 500 Buybacks Now Outpace All R&D Spending in the US - the 500 largest companies in the US are now spending 33% more on their stock buyback programs than the entire country is investing in R&D,417,0.99,e97w1q,https://thesoundingline.com/sp-500-buybacks-now-outpace-all-rd-spending-in-the-us/,67,2019-12-11,
Average tax refund down 8% so far this season,421,0.91,ap47g4,https://www.cnn.com/2019/02/09/politics/tax-code-early-returns-data/index.html,257,2019-2-10,
US companies forked over a record amount of tariffs in October ($6.2 billion!) because of Trump's trade war,420,0.96,a4xnyw,https://www.investing.com/news/economy-news/us-companies-forked-over-a-record-amount-of-tariffs-in-october-62-billion-because-of-trump039s-trade-war-1716713,97,2018-12-11,
The top 1% own 48% of all global personal wealth; 10% own 85%,419,0.95,a30p93,https://thenextrecession.wordpress.com/2018/12/04/the-top-1-own-48-of-all-global-personal-wealth-10-own-85/,138,2018-12-4,
Trump is Running the US Gov't Like His Businesses and It's a Disaster,427,0.82,9gk8yp,https://www.thefinancialcourier.com/2018/09/trump-is-running-the-us-govt-like-his-businesses-and-its-a-disaster/,188,2018-9-17,
Rental Market Faces $726M Hit as Pandemic Drives Gen Z Back Home,421,0.98,h87u64,https://timesofsandiego.com/business/2020/06/12/rental-market-faces-726-million-hit-as-gen-z-driven-back-home-by-pandemic/,69,2020-6-13,
"To Lower Costs, Trump to Force Hospitals to Reveal Price of Care",421,0.96,dxcg6w,https://www.nytimes.com/2019/11/15/health/list-hospital-prices-trump.html?smid=nytcore-ios-share,116,2019-11-17,
"99% of Canadians who Finish High School, Work Full time, and don’t have children until a committed relationship stay out of poverty",419,0.92,be45rm,https://www.fraserinstitute.org/sites/default/files/causes-of-poverty.pdf,88,2019-4-17,
"The wealth of America's three richest families grew by 6,000% since 1982",418,0.92,9uifhj,https://www.theguardian.com/commentisfree/2018/oct/31/us-wealthiest-families-dynasties-governed-by-rich,72,2018-11-6,
'Medicare for all' could save businesses trillions of dollars,419,0.87,96zekc,https://finance.yahoo.com/news/medicare-save-businesses-trillions-dollars-190500400.html,138,2018-8-13,
"America could lose 1 million jobs in March, former Trump adviser warns",418,0.97,fjxd83,https://edition.cnn.com/2020/03/16/business/economy-coronavirus-1-million-jobs-kevin-hassett/index.html,116,2020-3-17,
What it's like trying to rent a place,415,0.9,fa6igb,https://i.redd.it/t1qdlnhj7kf41.jpg,169,2020-2-27,
Inequality Illustrated,420,0.83,egqnyu,https://i.redd.it/9z8bm3a7og641.jpg,311,2019-12-28,
Middle-class families getting priced out of new American cars,418,0.97,e0m383,https://www.cbsnews.com/video/middle-class-families-getting-priced-out-of-new-american-cars/,218,2019-11-24,
"Global economy would save up to $160 trillion by shifting to renewables, electric cars",422,0.96,bqvjf0,https://thinkprogress.org/renewable-energy-electric-vehicles-climate-cost-4eb542fa68fe/?edf=988,28,2019-5-20,
"Billionaire Ray Dalio: A.I. is widening the wealth gap, ‘national emergency should be declared’",414,0.9,8zane0,https://www.cnbc.com/2018/07/06/bridgewaters-dalio-posts-on-ai-wealth-gap-capitalism-on-facebook.html?__source=Facebook%7Cmain,84,2018-7-16,
Congress has doubled the amount you can borrow from your 401(k)/IRA,418,0.97,fws4av,https://www.marketwatch.com/story/congress-has-doubled-the-amount-you-can-borrow-from-your-401k-but-theres-a-hidden-danger-2020-04-06,52,2020-4-8,
Monsanto Could Soon Be Facing Dozens Of Lawsuits in Hawaii Over Pesticide: Massive damage awards in previous cases are triggering a new onslaught against the chemical corporation,422,0.99,cxmu3k,https://www.civilbeat.org/2019/08/monsanto-could-soon-be-facing-dozens-of-lawsuits-in-hawaii-over-pesticide/,54,2019-8-31,
"Monsanto 'bullied scientists' and hid weedkiller cancer risk, lawyer tells court | Business",417,0.94,8xo40r,https://www.theguardian.com/business/2018/jul/09/monsanto-trial-roundup-weedkiller-cancer-dewayne-johnson,121,2018-7-10,
Global trends - BP to sell headquarters in shift to work at home,418,0.99,ijw0m0,https://www.straitstimes.com/business/property/bp-to-sell-london-headquarters-as-work-style-shifts-says-report,53,2020-8-31,
"Coronavirus pandemic creates America's first female recession amid child care, unemployment woes",415,0.85,i8cahd,https://www.usatoday.com/story/news/politics/elections/2020/08/03/coronavirus-pandemic-sets-women-back-amid-unemployment-child-care-crisis/5573123002/,135,2020-8-12,
Student debt may inch the US towards the next crisis,411,0.94,aevx4y,https://www.dw.com/en/student-debt-may-inch-us-toward-next-financial-crisis/a-46985713,84,2019-1-11,
'I see no way out': Living paycheck to paycheck is disturbingly common,416,0.95,aaunnp,http://www.philly.com/jobs/labor/i-see-no-way-out-living-paycheck-paycheck-is-disturbingly-common-20181228.html,166,2018-12-30,
"When Seattle raised its minimum wage to $15/hr, an oft quote study declared it would cost jobs and devastate micro economies. That didn't happen in fact, employment in food services and drinking establishments has soared. Now the authors of that study are scrambling to explain why.",413,0.91,aaroev,https://www.bloomberg.com/tosv2.html?vid=&uuid=edbd5730-0bd1-11e9-a22a-6f5cedfbdb10&url=L29waW5pb24vYXJ0aWNsZXMvMjAxOC0xMC0yNC93aGF0LW1pbmltdW0td2FnZS1mb2VzLWdvdC13cm9uZy1hYm91dC1zZWF0dGxl,92,2018-12-30,
Republican convention to forgo party platform in favor of blanket support for Trump’s agenda,414,0.95,ifpc7o,http://rplg.co/5486d300,74,2020-8-24,
Federal Reserve predicts slow recovery with unemployment at 9.3 percent by end of 2020,418,0.98,h0yrdo,https://www.washingtonpost.com/business/2020/06/10/fed-forecasts-economy/,35,2020-6-11,
"U.S. income inequality at highest level in 50 years, growing gap in heartland",412,0.96,d9nw4z,https://www.nbcnews.com/news/us-news/u-s-income-inequality-highest-level-50-years-economic-gap-n1058956?cid=sm_npd_nn_tw_ma,77,2019-9-27,
"Trump Freezes Billions In Obamacare Payments, Outraging Insurers",414,0.86,8x4z8h,https://www.zerohedge.com/news/2018-07-08/trump-freezes-billions-obamacare-payments-outraging-insurers,206,2018-7-9,
First Fed audit reveals $16 Trillion in secret loans to bail out American and foreign banks.,419,0.94,lagjf,http://sanders.senate.gov/newsroom/news/?id=9e2a4ea8-6e73-4be2-a753-62060dcbb3c3,43,2011-10-13,
"If Trump calls for TikTok to do business in US directly from US (including: have US investors hold a majority stake, save data on servers that are in the US, have its proprietary algorithms under direct control of US authorities basically) - why shouldn't the EU demand the same from US tech firms?",415,0.93,iwcaco,https://www.reddit.com/r/economy/comments/iwcaco/if_trump_calls_for_tiktok_to_do_business_in_us/,133,2020-9-20,"I do sympathise with US politics when it considers TikTok to be a potential threat to national security which should therefore be regulated. After all, it's known how social media can be used to spread fake news and meddle with elections.

However, how is TikToks's business modell in the US different from US tech firms' business model in Europe (and, indeed, in the US itself)?

It is stated that TikTok has the potential to become a threat to national security. However, US social media have already proven that they are a threat by not being able to control the spread of fake news and by meddling with elections, both in Europe (Brexit comes to mind) and in the US itself. For a lot of reasons, social medias' influence in Europe (and basically in the US itself) could be considered negative and threatening.

Unless there's something that I can't see, I'd say that a double standard is being applied.

US corporations have US politics in their pockets and they use their influence to push their own agenda which doesn't have the American people's best interest in mind.

Democracy is dead since the 70's when fiat currencies moved off the gold standard."
"Xi Jinping and Donald Trump agree to trade truce, removal of tariffs",415,0.97,a291fk,https://www.scmp.com/news/china/diplomacy/article/2175984/xi-jinping-says-cooperation-best-choice-both-sides-dinner?fbclid=IwAR3mlw3jIB_hRuPJOiwm39HKDNd0evm9UqcAxyyTFiJ-rQ2KCWw-xu5qPck,65,2018-12-2,
The Fed - Fertilizing the Rich Man's Field with the Sweat of the Poor Man's Brow,409,0.93,ijoytb,http://www.the92ers.com/blog/fed-fertilizing-rich-mans-field-sweat-poor-mans-brow,62,2020-8-31,
"Strategist 'at a loss' over emergency Fed cut, says lack of rationale fed market panic",409,0.99,fd19ft,https://finance.yahoo.com/news/vincent-reinhart-on-fed-emergency-rate-cut-202144802.html,72,2020-3-4,
Amazon Web Services brought in more money than McDonald’s in 2018,411,0.97,ame2ke,https://qz.com/1539546/amazon-web-services-brought-in-more-money-than-mcdonalds-in-2018/,32,2019-2-2,
The average American worker takes less vacation time than a medieval peasant,418,0.9,914t7u,http://uk.businessinsider.com/american-worker-less-vacation-medieval-peasant-2016-11?r=US&IR=T&utm_source=reddit.com,43,2018-7-23,
Pelosi and Mnuchin reach agreement to keep government funded until December 11,413,0.95,iy2ncy,https://www.cnn.com/2020/09/22/politics/government-funding-deal-reached/index.html,79,2020-9-23,
Airbus to pay record £3bn in fines for 'endemic' corruption,416,0.98,ex69qs,https://www.theguardian.com/business/2020/jan/31/airbus-to-pay-record-3bn-in-fines-for-endemic-corruption,46,2020-2-1,
"Trump’s steel tariffs cost U.S. consumers $900,000 for every job created, experts say",411,0.93,bm4ag3,https://www.washingtonpost.com/business/2019/05/07/trumps-steel-tariffs-cost-us-consumers-every-job-created-experts-say/?noredirect=on&utm_term=.6c24c8c4b156,43,2019-5-8,
Anti-Laundering Bill Targeting Shell Companies Stalled in Senate,416,0.99,iazd3y,https://www.mintpressnews.com/key-anti-laundering-bill-stalled-senate-big-banks-caught-cooking-books/270378/,16,2020-8-17,
"Jobless claims: Another 898,000 Americans filed new unemployment claims last week",408,0.99,jbmpah,https://finance.yahoo.com/news/jobless-claims-coronavirus-unemployment-week-ended-october-10-2020-183353138.html,33,2020-10-15,
New Jersey's millionaires tax will increase taxes collected by the state for those earning between $1 million and $5 million to 10.75 per cent from the current 8.97 per cent.,407,0.97,ixlyo7,https://www.cbc.ca/news/business/new-tax-on-the-rich-in-new-jersey-may-give-provincial-governments-something-to-think-about-1.5730028,52,2020-9-22,
"Coronavirus stimulus checks will come within three weeks, Mnuchin says",411,0.96,fpbv4j,https://www.cnbc.com/2020/03/26/coronavirus-stimulus-checks-will-come-within-three-weeks-mnuchin-says.html,152,2020-3-26,
Analysis | The unluckiest generation in U.S. history,410,0.96,gt1h61,https://www.washingtonpost.com/business/2020/05/27/millennial-recession-covid/,83,2020-5-30,
A new study found that Trump's trade war could take a gigantic bite out of the US economy,411,0.92,a145gw,https://www.businessinsider.in/A-new-study-found-that-Trumps-trade-war-could-take-a-gigantic-bite-out-of-the-US-economy/articleshow/66834561.cms,83,2018-11-28,
"Iceland: 93% voted against repayment of the debt.  The IMF froze its loan.  The revolution (though not televised in the west), would not be intimidated. With the support of a furious citizenry, the government launched civil and penal investigations into those responsible for the financial crisis.",410,0.85,jspux,http://sacsis.org.za/site/article/728.1,56,2011-8-24,
Amazon expands grocery business beyond Whole Foods with first Fresh store in Los Angeles,405,0.97,iirz14,https://www.cnbc.com/2020/08/27/amazon-expands-beyond-whole-foods-with-fresh-grocery-store-chain.html,56,2020-8-29,
"Report: 13,000 of Chicago's homeless in 2017 had jobs",409,0.97,ceg0zr,https://abc7chicago.com/5382925/,45,2019-7-18,
Chobani Yogurt announces it will pay off all of Rhode Island Warwick School District's lunch debt,412,0.99,bne6mq,https://www.dailykos.com/story/2019/5/9/1856583/-Chobani-Yogurt-announces-it-will-pay-off-all-of-Rhode-Island-district-s-school-lunch-debt,41,2019-5-12,
Turkey is now a haven for terrorists and an enabler of terrorism,410,0.81,eepryt,https://nypost.com/2019/09/23/turkey-is-now-a-haven-for-terrorists-and-an-enabler-of-terrorism/,45,2019-12-24,
Germany has provided more than 50% of EU state aid to deal with the coronavirus crisis,410,0.99,gmhb5u,http://www.economo.co.uk/germany-has-provided-more-than-50-of-eu-state-aid-to-deal-with-the-coronavirus-crisis/,37,2020-5-19,
"American workers, the engine powering the world's most potent economy, are dying faster than any other wealthy country. That is seriousy damaging U.S. Businesses",404,0.96,ep82s6,http://www.usatoday.com/story/news/nation/2019/11/26/us-life-expectancy-downward-spiral-study/4303700002/,112,2020-1-16,
"MIT took Epstein’s money knowing of his past, report finds - Financial Times",410,0.92,en4p8f,https://www.ft.com/content/7b2ae5ba-33f4-11ea-a329-0bcf87a328f2,37,2020-1-11,
The US deficit topped $1 trillion. The year's not even over yet,407,0.97,d3v6fq,https://www.cnn.com/2019/09/12/business/us-federal-deficit-august/index.html,75,2019-9-14,
"Workers barely benefited from Trump’s sweeping tax cut, investigation shows",403,0.9,bj35k6,https://www.theguardian.com/us-news/2019/apr/30/trump-tax-cut-law-investigation-worker-benefits?CMP=Share_iOSApp_Other,77,2019-4-30,
Setting a maximum wage for CEOs would be good for everyone,402,0.82,9ilhd9,https://www.wolfcast.co.uk/all/2018/9/22/setting-a-maximum-wage-for-ceos-would-be-good-for-everyone,96,2018-9-25,
Billionaire Brexiteer Sir Jim Ratcliffe to relocate to Monaco in bid to ‘save £4bn in tax’,403,0.96,arsjzk,https://www.independent.co.uk/news/uk/home-news/jim-ratcliffe-monaco-tax-avoidance-billionaire-ineos-john-mcdonnell-a8783626.html,74,2019-2-18,
"Owners near Foxconn say they were misled. Now their homes are gone. Homeowners near the Foxconn facility say they sold their homes for road widenings that were either abandoned, embellished — or never planned",405,0.97,cz7gor,https://www.wisconsinwatch.org/2019/09/owners-near-foxconn-say-they-were-misled-now-their-homes-are-gone/,40,2019-9-4,
More Than 275 Financial Firms Are Moving A Combined $1.2 Trillion In Assets And Funds From Britain To The European Union In Readiness For Brexit,401,0.97,azshb5,https://stockmarketnews.today/2019/03/11/more-than-275-financial-firms-are-moving-a-combined-1-2-trillion-in-assets-and-funds-from-britain-to-the-european-union-in-readiness-for-brexit/,33,2019-3-11,
Tax Cuts and Laissez Faire policies simply do not work. Just ask Kansas,404,0.9,aq4y98,https://thehill.com/opinion/finance/418768-kansas-voters-render-final-verdict-on-failed-tax-cut-experiment?amp,55,2019-2-13,
"Report: billionaire Sackler family, accused of encouraging the opioid epidemic, secretly owns a second drug company",405,0.98,9efo4i,https://www.newsweek.com/sackler-family-oxycontin-rhodes-pharma-1112988,28,2018-9-10,
CNBC's Jim Cramer: 'I'm Now Nervous' After Fed Rate Cut,406,0.89,fcxfng,https://www.mediaite.com/news/im-now-nervous-cnbcs-jim-cramer-predicts-feds-drastic-rate-cut-will-stoke-investor-fear-over-coronavirus/,82,2020-3-4,
US Economic Performance Under Trump is Unchanged From Under Obama,406,0.86,e7x4qy,https://citizentruth.org/us-economic-performance-under-trump-is-unchanged-from-under-obama/,113,2019-12-9,
New Reporting Exposes Rampant Fraud Plaguing Stimulus Program,404,0.88,js94gi,https://fee.org/articles/new-reporting-exposes-rampant-fraud-plaguing-congress-s-stimulus-program/,18,2020-11-11,
