title,score,upv_ratio,id,url,comms_num,created,body
"Jeff Bezos could give every Amazon employee $105,000 and still be as rich as he was before the pandemic. If that doesn't convince you we need a wealth tax, I'm not sure what will.",24568,0.82,itdsi3,https://twitter.com/RBReich/status/1305921198291779584,2203,2020-9-16,
AOC Wants To Work With Republicans To Legalize Marijuana And End War On Drugs,6806,0.95,jewend,https://www.marijuanamoment.net/aoc-wants-to-work-with-republicans-to-legalize-marijuana-and-end-war-on-drugs/,477,2020-10-21,
"Trump will borrow whopping $4.4 trillion this year. That’s $50,000 per family of four. But the same family will get only $1,200! Almost all the new debt goes to bailout corporations, banks & Wall Street",5104,0.94,gdl9br,https://home.treasury.gov/news/press-releases/sm997,424,2020-5-5,
Decades ago corporate taxes provided 33% of the public treasury; today they provide 11%. Not coincidentally that was when America had a thriving middle class. Tax policies favoring the corporate elite has been and continues to be the primary driver of income inequality.,3837,0.97,jhyym4,https://twitter.com/marwilliamson/status/1320363594656133120,201,2020-10-26,
More than 93% of U.S. college students say tuition should be lowered if classes are online,3541,0.98,i1dzb8,https://www.cnbc.com/2020/07/27/93percent-of-college-students-say-tuition-should-be-cut-for-online-classes.html,265,2020-8-1,
"Australia's richest person, mining magnate Gina Rinehart, has been revealed as a $4.5 million donor of a rightwing thinktank that promotes climate science skepticism",3199,0.96,ekv8bh,https://www.theguardian.com/business/2018/jul/21/gina-rinehart-company-revealed-as-45m-donor-to-climate-sceptic-thinktank,324,2020-1-6,
The US stock market has now wiped out the entire $11.5 trillion of value it gained since Trump's 2016 election victory,3112,0.95,fhp5bv,https://markets.businessinsider.com/news/stocks/stock-market-outlook-2016-trump-win-gains-erased-coronavirus-risks-2020-3-1028991585,409,2020-3-13,
"More than 700 leading economists, including 7 Nobel winners, urge US voters to reject Trump, a 'selfish and reckless' president",2992,0.91,jgnovy,https://www.businessinsider.com/trump-election-day-economists-biden-economy-growth-gdp-2020-10,319,2020-10-23,
US coronavirus 'bailout' scam is $6 trillion giveaway to Wall St,2614,0.97,hp9arj,https://moderaterebels.com/transcript-us-coronavirus-bailout-michael-hudson/,338,2020-7-11,
"Yale student sues university claiming online courses were inferior, seeks tuition refund, class action status",2595,0.98,i42zxi,https://www.courant.com/coronavirus/hc-news-coronavirus-student-sues-yale-20200804-eyr4lbjs2nhz7lapjgvrtnyyea-story.html,220,2020-8-5,
"In 11 of the 18 years that were examined by The Times, Trump paid $0 in federal income taxes.",2443,0.96,j1au3x,https://www.businessinsider.com/trump-tax-returns-new-york-times-summary-shocking-revelations-2020-9,419,2020-9-28,
The U.N. says 18.5 million Americans are in ‘extreme poverty.’,2366,0.97,j73o92,https://www.washingtonpost.com/news/wonk/wp/2018/06/25/trump-team-rebukes-u-n-saying-it-overestimates-extreme-poverty-in-america-by-18-million-people/,261,2020-10-8,
"AT&T promised 7,000 new jobs to get tax break—it cut 23,000 jobs instead | Ars Technica",2233,0.98,fdw4v8,https://arstechnica.com/tech-policy/2019/05/att-promised-7000-new-jobs-to-get-tax-break-it-cut-23000-jobs-instead/,137,2020-3-5,
"Trump's claim that he created the ""greatest economy in the history of the U.S."" is a hoax. More jobs were created in the last three years of Obama's presidency than were created under the first three years of the Trump presidency.",2209,0.91,j30zsz,https://www.snopes.com/fact-check/obama-created-more-jobs-trump/,188,2020-10-1,
Study shows that you're more likely to be successful if you're born dumb and rich than poor and smart,2198,0.95,hcj313,https://www.theatlantic.com/business/archive/2013/12/would-you-rather-be-born-smart-or-rich/281828/,197,2020-6-20,
U.S. Ranked Worst for Workers’ Rights Among Major Economies - Bloomberg,2175,0.97,iodmo8,https://www.bloomberg.com/news/articles/2020-06-18/u-s-ranked-worst-for-workers-rights-among-major-economies,184,2020-9-8,
"Nearly 20,000 Amazon workers contracted coronavirus, while Jeff Bezos continues to deny paid sick leave and hazard pay to his workforce. How did Mr. Bezos, the wealthiest man alive, do during this pandemic? He increased his wealth by $85 billion since March. Truly disgusting.",2149,0.93,j425g3,https://twitter.com/SenSanders/status/1312117845640138752,304,2020-10-3,
"Tesla forced all workers to take a 10 percent pay cut from mid-April until July. In the same period, Tesla stock skyrocketed and CEO Elon Musk’s net worth quadrupled from $25 billion to over $100 billion. Musk is a modern-day robber baron.",2108,0.89,ioxg7l,https://twitter.com/RBReich/status/1303189563188244480,282,2020-9-9,
"“America is Disneyland”. 10% of Disneyland's employees are actually homeless, many more are on food stamps, and 75% struggle to make ends meet.",2042,0.97,iriqfl,https://www.sott.net/article/379539-America-is-Disneyland,248,2020-9-13,
78% percent of Americans said they’d be willing to pay more for products if they are not made in China,2019,0.97,gn8dmg,https://www.bloomberg.com/news/articles/2020-05-17/what-do-americans-think-of-made-in-china-polling-latest?utm_source=twitter&utm_medium=social&cmpid=socialflow-twitter-business&utm_campaign=socialflow-organic&utm_content=business,226,2020-5-20,
"Former Wells Fargo CEO John Stumpf banned for life from banking, ordered to pay $17.5M",1934,0.99,fktkz4,https://mazech.com/2020/01/former-wells-fargo-ceo-john-stumpf-banned-for-life-from-banking-ordered-to-pay-17-5m/,82,2020-3-19,
"Lancet study finds U.S. has, by far, the world’s most-overpriced medical care - despite this, it has lower quality medical care than virtually all other industrialized nations.",1906,0.97,ikxyg3,https://theduran.com/lancet-study-finds-u-s-has-by-far-the-worlds-most-overpriced-medical-care/,289,2020-9-2,
"Amid America's #COVID19 disaster, I must come clean about a lie I spread as a health insurance exec: We spent big $$ to push the idea that Canada's single-payer system was awful & the U.S. system much better. It was a lie & the nations' COVID responses prove it. The truth: (1/6)",1877,0.96,hh0gpf,https://twitter.com/wendellpotter/status/1276158510955401216,161,2020-6-28,
"Taxes Paid by Billionaires Decreased 79 Percent Since 1980, as Percentage of Their Wealth",1872,0.97,g34o0r,https://inequality.org/great-divide/billionaire-wealth-tax/,131,2020-4-17,
Exclusive: U.S. taxpayers' virus relief went to firms that avoided U.S. taxes,1811,0.98,gt99go,https://www.reuters.com/article/us-health-coronavirus-companies-tax-excl/exclusive-u-s-taxpayers-virus-relief-went-to-firms-that-avoided-u-s-tax-idUSKBN2341ZE?,84,2020-5-30,
Mexico Bans Bayer-Monsanto's Roundup Herbicide,1801,0.99,hvue96,https://theheartysoul.com/mexico-bans-roundup-herbicide/?utm_source=GASAN&fbclid=IwAR07mvzlTNNRqL_HKfxRD1dMonoy35ZabQeFNykvbd7vvObFGYqSVBXcouo,165,2020-7-22,
"GOP senators sold off their stocks ahead of coronavirus economic crash, reports say",1790,0.97,flpj6p,https://www.usatoday.com/story/news/politics/2020/03/19/reports-burr-loeffler-sold-stocks-ahead-coronavirus-marketcrash/2882006001/,182,2020-3-20,
Japan auto companies triple Mexican pay rather than move to US - Nikkei Asian Review,1787,0.99,hhgjbv,https://asia.nikkei.com/Business/Automobiles/Japan-auto-companies-triple-Mexican-pay-rather-than-move-to-US,95,2020-6-28,
'Shareholders come last': Billionaire entrepreneur Mark Cuban says CEOs should prioritize employees and their families in coronavirus crisis,1774,0.98,fqvn34,https://markets.businessinsider.com/news/stocks/mark-cuban-to-ceos-shareholders-come-last-amid-coronavirus-pandemic-2020-3-1029041805,91,2020-3-29,
Germany has rejected Trump’s offer to return Russia to the G-7,1766,0.98,hys32w,http://www.economo.co.uk/germany-has-rejected-trumps-offer-to-return-russia-to-the-g-7/,119,2020-7-27,
"Sturgis Motorcycle Rally is Now Linked to More Than 250,000 Coronavirus Cases--public health cost of the super-spreading event is near $12 billion",1751,0.9,ipgz2q,https://www.motherjones.com/coronavirus-updates/2020/09/sturgis-motorcycle-rally-is-now-linked-to-more-than-250000-coronavirus-cases/,309,2020-9-9,
Every $1 increase in minimum wage decreases suicide rate by up to 6%,1735,0.93,elu6h7,https://www.zmescience.com/science/minimum-wage-suicide-link-04233/,147,2020-1-8,
"San Francisco voters approve taxes on CEOs, big businesses",1720,0.97,joii44,https://apnews.com/article/business-virus-outbreak-san-francisco-9dbf9e764220830dcfabeed96b45a63d,191,2020-11-5,
"Mexican president vows to bail out the poor, not big companies, in coronavirus response",1705,0.95,fo2vbc,https://www.reuters.com/article/us-health-coronavirus-mexico-president/mexican-president-vows-to-bail-out-the-poor-not-big-companies-in-coronavirus-response-idUSKBN21B0DL,70,2020-3-24,
"Rwanda is banning all US imports of second hand clothing & launching a country-wide ""Made in Rwanda"" initiative",1700,0.99,dd7yp0,https://qz.com/africa/1624510/the-made-in-rwanda-policy-is-boosting-kigalis-fashion-sector/,159,2019-10-4,
"OSHA Tells Employers Not To Worry About Reporting COVID-19 Hospitalizations Anymore, Eliminating Information About Workplace Clusters",1695,0.98,jc9gv0,https://www.huffpost.com/entry/osha-covid-19-hospitalizations_n_5f889a28c5b6e9e76fbb6db7,124,2020-10-16,
"On 9/11 in 1973, the US staged a coup in Chile and overthrew the democratically elected and popular socialist leader, Allende. He was replaced by Pinochet, a brutal right-wing dictator. If you wonder why the US doesn’t have progressive policies, just look at the foreign policy",1697,0.86,iqs10y,https://adst.org/2013/09/chiles-coup-against-salvador-allende-and-the-truth-behind-missing/,271,2020-9-11,
"A huge fleet of Chinese fishing boats is approaching the Galapagos Islands, prompting a swift response from the Ecuadorian navy. ""We will work in a regional position to defend and protect the Exclusive Economic Zone around the Galápagos Marine Reserve.."" Ecuador President Moreno said.",1695,0.99,i0kyjx,https://www.9news.com.au/world/china-fishing-fleet-nearing-ecuador-waters-galapagos-islands/3206e00d-4a17-45d7-80b9-548759d4a5e8,141,2020-7-30,
"Ten of the world's largest banks, including JPMorgan Chase and Bank of America, have been sued for allegedly conspiring over nearly 14 years to rig prices in the $9.6 trillion U.S. corporate bond market, costing ordinary investors billions of dollars.",1684,0.99,g6cl6r,https://www.reuters.com/article/us-banks-lawsuit-bonds-idUSKCN22336F,123,2020-4-23,
"The typical US worker can no longer afford a family on a year's salary, showing the dire state of America's middle class",1678,0.97,fbyhf8,https://www.businessinsider.com/america-middle-class-living-expenses-family-of-four-2020-2?fbclid=IwAR3Ghin33K11H2i6M_qhFg4JbtKUuhOV_U0EZgPWioo2JupFq2fGLdZrs9U,262,2020-3-2,
"""We're all in this together""",1664,0.96,gnuqsh,https://i.redd.it/wj7vjwaom3051.jpg,241,2020-5-21,
Bernie Sanders says Criminal CEOs must be jailed and he will use the Justice Department to go after them,1642,0.96,et5zud,https://theintercept.com/2019/10/23/bernie-sanders-sherman-antitrust-act-monopolies/,176,2020-1-24,
"Andrew Yang Proposes $2,000 Monthly Stimulus, Warns Many Jobs Are ‘Gone for Good’",1641,0.95,g7drtg,https://observer.com/2020/04/us-retail-march-decline-covid19-andrew-yang-ubi-proposal/,229,2020-4-25,
"Pelosi endorses $2,000 every month to everybody in next $2 trillion COVID-19 response bill",1627,0.97,gfnvp2,https://www.dailykos.com/stories/2020/5/7/1943352/-House-Democrats-prepare-another-2-trillion-in-COVID-19-aid-that-could-actually-really-help-people,460,2020-5-8,
"""In unusual deal, U.S. Treasury to acquire 30 percent of trucking company in exchange for $700 million loan."" Said company is worth only $120 million however.",1617,0.99,hjd1je,https://www.washingtonpost.com/business/2020/07/01/treasury-loan-yrc-worldwide-cares-act/,219,2020-7-1,
"Trump promised to eliminate the deficit in eight years. So far, he has increased it by 68%",1589,0.96,dfimer,https://www.newsweek.com/trump-deficit-debt-cbo-data-obama-1463802,136,2019-10-9,
"Whole Foods employees across the US plan on calling in sick on Tuesday to demand paid leave for workers as the coronavirus spreads, and they're joining the ranks of 'essential' workers going on strike",1582,0.98,fs0xxj,https://www.businessinsider.com/whole-foods-employees-to-strike-tuesday-due-to-coronavirus-concerns-2020-3,156,2020-3-31,
Mark Zuckerberg claimed Facebook makes a 'relatively small' amount from political advertising--it has made $2.2 billion from political ads since mid-2018,1576,0.94,jjv1z6,https://www.businessinsider.com/zuckerberg-facebook-political-ad-revenue-2020-10,148,2020-10-29,
"With classroom time reduced, U.S. college students demand tuition cuts",1551,0.99,j0qmdf,https://www.reuters.com/article/BigStory12/idUSKBN26I0FU,150,2020-9-27,
"S&P 500 companies spent $7 trillion on buybacks and dividends and “been rewarded’ by coronavirus bailouts, says Social Capital CEO",1541,0.98,g8f3as,https://www.marketwatch.com/story/sp-500-companies-spent-7-trillion-on-buybacks-and-dividends-and-been-rewarded-by-coronavirus-bailouts-says-social-capital-ceo-2020-04-22,179,2020-4-26,
"A federal program promised small businesses up to $2 million in loans. Now it's maxing out at $15,000.",1522,0.97,fz7wyb,https://theweek.com/speedreads/908081/federal-program-promised-small-businesses-2-million-loans-now-maxing-15000,191,2020-4-11,
China Threatens Australia With Economic Damage for Investigating COVID-19,1509,0.97,gejl2s,https://nationalfile.com/china-threatens-australia-with-economic-damage-for-investigating-covid-19/,196,2020-5-6,
"Fed chair Powell says more stimulus is ""absolutely essential"" to economic recovery",1493,0.98,jp3dx1,https://www.newsweek.com/fed-chair-powell-says-more-stimulus-absolutely-essential-economic-recovery-1545308,174,2020-11-6,
"'Some may even die, I don't know': Former Wells Fargo CEO wants people to go back to work and 'see what happens'",1496,0.95,fqkx70,https://www.businessinsider.com/richard-kovacevich-former-wells-fargo-ceo-work-die-coronavirus-pandemic-2020-3,192,2020-3-28,
Big Companies Are Starting to Swallow the World,1487,0.97,j5iuck,https://www.nytimes.com/2020/09/30/business/big-companies-are-starting-to-swallow-the-world.html,198,2020-10-5,
"Chamath Palihapitiya: Give Americans stimulus money directly, don't waste it on zombie companies",1485,0.99,iu9cq3,https://www.cnbc.com/amp/2020/09/15/chamath-palihapitiya-on-coronavirus-stimulus-give-americans-the-money-.html,89,2020-9-17,
"23,000 households reported income over $10 million last year. The IRS audited seven.",1474,0.97,jr6cjr,https://www.latimes.com/business/story/2020-11-02/wealthiest-americans-irs-audits,188,2020-11-10,
"America's Social Unrest Is About to Get Much Worse, Congress Fears: ""Police reform may quell some of the distress. But there's about to be a massive drop-off in help for the unemployed. And that's when things may explode."" [United States of America]",1426,0.97,h9kolu,https://www.thedailybeast.com/americas-social-unrest-is-about-to-get-much-worse-congress-fears,174,2020-6-16,
Mark Zuckerberg said Facebook makes a 'relatively small' amount from political ads. The company has made $2.2 billion from political ads within 2 years,1423,0.91,jo8u6c,https://mazech.com/2020/10/mark-zuckerberg-said-facebook-makes-a-relatively-small-amount-from-political-ads-the-company-has-made-2-2-billion-from-political-ads-within-2-years/,171,2020-11-5,
It has started: Spain decides permanent UBI for its citizens,1427,0.9,gu03cx,https://twitter.com/failedevolution/status/1267099167366811648,178,2020-5-31,
"NY Times: Trump paid $750 in US income taxes in 2016, 2017",1406,0.96,j12o4d,https://apnews.com/article/archive-personal-taxes-donald-trump-f0e2af5f9f99de9d30dc6b9097121188,224,2020-9-28,
The World's 25 Richest Billionaires Have Gained Nearly $255 Billion In Just Two Months,1405,0.9,gxo0x4,https://www.forbes.com/sites/jonathanponciano/2020/05/22/billionaires-zuckerberg-bezos/,166,2020-6-6,
"Imagine if We Paid for Food like We Do Healthcare, Hint: it would be a dystopian disaster.",1386,0.94,h0annf,https://fee.org/articles/imagine-if-we-paid-for-food-like-we-do-healthcare/?fbclid=IwAR2v92jXXrPP9nV2DXRFSc816D9MHtnWW_RXfGh1V92XRrPEQJ-yZsNfmjA,251,2020-6-10,
Nearly 900 workers at Tyson meat plant in Indiana test positive for coronavirus,1382,0.99,gb8zqz,https://thehill.com/homenews/news/495564-nearly-900-workers-at-tyson-meat-plant-in-indiana-test-positive-for-coronavirus,148,2020-5-1,
"House Democrats propose $2,000 a month payment to Americans until economy recovers from coronavirus",1382,0.97,g27z88,https://www.mazechmedia.com/2020/04/house-democrats-propose-2000-a-month-payment-to-americans-until-economy-recovers-from-coronavirus/,330,2020-4-16,
Federal judge strikes down Trump's cuts on food stamps for unemployed - and some may be able to eat again,1372,0.97,jdwkur,https://thehill.com/regulation/court-battles/521629-federal-judge-strikes-down-trumps-cuts-on-food-stamps-for-unemployed,236,2020-10-19,
The 8 Biggest Corporate Welfare Recipients in America: The data also shows that roughly 75% of $110 billion in disclosed subsidy dollars have gone to 965 big companies.,1368,0.99,j1xsmi,https://www.cheatsheet.com/money-career/high-on-the-hog-the-top-8-corporate-welfare-recipients.html,98,2020-9-29,
Almost 90 percent of NYC bars and restaurants couldn’t pay August rent,1362,0.99,ixhxt0,https://nypost.com/2020/09/21/almost-90-percent-of-nyc-bars-and-restaurants-couldnt-pay-august-rent/,283,2020-9-22,
'Extremely Alarming': Coronavirus Stimulus Law Allows the Federal Reserve to Hold Secret Meetings on Corporate Bailouts,1361,0.97,fy1w1i,https://www.commondreams.org/news/2020/04/09/extremely-alarming-coronavirus-stimulus-law-allows-federal-reserve-hold-secret,153,2020-4-10,
"Treasury sent more than 1 million coronavirus stimulus payments to dead people, congressional watchdog finds",1342,0.98,hfq0nh,https://www.washingtonpost.com/us-policy/2020/06/25/irs-stimulus-checks-dead-people-gao/,109,2020-6-26,
Do you think we will have economic-related protests in the near-future if enough people don't quickly replace their income? America is facing civil unrest that transcends race,1347,0.97,gw7skk,https://medium.com/@justinhonse/america-is-facing-civil-unrest-that-transcends-race-d809187193e0,248,2020-6-4,
"Walmart to raise wages, paying staff up to $30 per hour",1332,0.96,ive9uj,https://www.wrdw.com/2020/09/18/walmart-to-raise-wages-paying-staff-up-to-30-per-hour/,267,2020-9-19,
“The Top 1% of Americans Have Taken $50 Trillion From the Bottom 90%—And That's Made the U.S. Less Secure.” Reverse-Robin Hood is celebrated in the USA.,1328,0.96,isvs0d,https://time.com/5888024/50-trillion-income-inequality-america/,211,2020-9-15,
"San Francisco apartment rents fall 31%, the biggest drop in the US",1321,0.98,jb6qqd,https://thestreetjournal.org/2020/10/san-francisco-apartment-rents-fall-up-to-31-the-biggest-drop-in-the-us/,155,2020-10-15,
"Whoever Paul Field is, he hit the nail on the head",1312,0.95,i6rbbc,https://i.redd.it/fycktpt5c1g51.png,196,2020-8-10,
The World Bank predicts the worst global recession since World War II,1304,0.98,gzkt4w,http://www.economo.co.uk/the-world-bank-predicts-the-worst-global-recession-since-world-war-ii/,143,2020-6-9,
Economic Forecast: Biden Plan Will Create 7 Million More Jobs Than Trump,1303,0.87,izl2vc,https://nymag.com/intelligencer/2020/09/economist-biden-plan-creates-7-million-more-jobs-than-trump.html?fbclid=IwAR3px3O3HZuMnFG-lbdesM9GrSIETDbL_6aEDna3tCpPCxEa2KnO0QGQOF4,206,2020-9-25,
"Goldman Sachs CEO David Solomon Received A 20% Raise To $27.5 Million, While The Market, Economy And Job Market Crashed",1297,0.96,fnk8y1,https://www.forbes.com/sites/jackkelly/2020/03/23/goldman-sachs-ceo-david-solomon-received-a-20-raise-to-275-million-while-the-market-economy-and-job-market-crashed/#1af4d92928a4,146,2020-3-23,
Boris Johnson's government is reportedly furious with China and believes it could have 40 times more coronavirus cases than it claims,1288,0.96,fr64tr,https://www.businessinsider.com/coronavirus-boris-johnsons-government-reportedly-furious-with-china-2020-3,259,2020-3-29,
The Stock Market Is Not the Economy,1274,0.98,iy387c,https://tcf.org/content/commentary/stock-market-not-economy/,125,2020-9-23,
The Botched Response to Coronavirus is an Historic Disgrace | This larger economic failure of the West is going to have lasting consequences — fast. There is now going to be a Coronavirus Depression.,1279,0.89,fzz7jr,https://eand.co/how-the-west-bungled-coronavirus-778b730cbad3,239,2020-4-12,
"Instacart is hiring 300,000 additional grocery shoppers, who will get paid sick leave if quarantined",1273,0.98,fory31,https://www.engadget.com/2020-03-23-instacart-hiring-300-000-full-time-grocery-shoppers.html,47,2020-3-25,
One in seven Orlando Disney employees will be laid off by New Year's Eve,1272,0.98,jnbbbf,https://www.orlandoweekly.com/Blogs/archives/2020/11/02/one-in-seven-orlando-disney-employees-will-have-been-laid-off-by-new-years-eve,49,2020-11-3,
Company With Ties To Trump Receives Millions From Small Business Loan Program,1267,0.93,g5ghir,https://www.npr.org/2020/04/20/839455480/company-with-ties-to-trump-receives-millions-from-small-business-loan-program,109,2020-4-21,
"3 USDA meat inspectors dead, about 145 diagnosed with COVID-19",1253,0.98,ghpzz6,https://www.cbsnews.com/news/coronavirus-usda-meat-inspectors-3-dead-covid-19/,149,2020-5-11,
'I'm Still Unemployed': Millions In Dire Situation As Savings Start To Run Out,1250,0.99,jctqzh,https://www.npr.org/2020/10/17/924682991/i-m-still-unemployed-millions-in-dire-situation-as-savings-start-to-run-out,244,2020-10-17,
It couldn't happen to a 'nicer' guy: Elon Musk In Hot Water After Tesla Employees Test Positive For Coronavirus,1251,0.93,h8whzm,https://www.ibtimes.com/elon-musk-hot-water-after-tesla-employees-test-positive-coronavirus-2991158,110,2020-6-15,
"Former Wells Fargo CEO wants Americans back to work next month: 'Some may even die, I don't know'",1245,0.94,fu76s3,https://www.rawstory.com/2020/03/former-wells-fargo-ceo-wants-americans-back-to-work-next-month-some-may-even-die-i-dont-know/,264,2020-4-3,
Why Republicans and others concerned about the economy have reason to celebrate Biden in the White House,1234,0.92,jpwu6g,https://theconversation.com/why-republicans-and-others-concerned-about-the-economy-have-reason-to-celebrate-biden-in-the-white-house-149145,135,2020-11-8,
McConnell Calls for Smaller Stimulus After Pfizer Vaccine Data,1237,0.92,jrkjy2,https://www.newsmax.com/finance/streettalk/mcconnell-smaller-stimulus-pfizer/2020/11/09/id/996204/,270,2020-11-10,
Millions poised to lose unemployment benefits in 'enormous cliff' at year's end,1238,0.98,jj0dtq,https://www.cnbc.com/2020/10/27/unemployment-benefits-will-end-for-millions-without-more-stimulus.html,268,2020-10-27,
So many people are calling suicide hotline because they were laid off due to pandemic,1226,0.97,flxdz1,https://newest-websites.com/people-are-calling-suicide-hotline-because-they-were-laid-off-due-to-pandemic/,136,2020-3-20,
Entrepreneurs don’t have a special gene for risk—they come from families with money,1228,0.92,f5b8sl,https://qz.com/455109/entrepreneurs-dont-have-a-special-gene-for-risk-they-come-from-families-with-money/,194,2020-2-18,
"'Absolute Robbery': Gilead Announces $3,120 Price Tag for Covid-19 Drug Developed With $70 Million in Taxpayer Support",1214,0.98,hixivh,https://www.commondreams.org/news/2020/06/29/absolute-robbery-gilead-announces-3120-price-tag-covid-19-drug-developed-70-million,128,2020-7-1,
"So many people are filing for unemployment, it's crashing government websites",1216,0.99,flae6o,https://www.cbsnews.com/news/coronavirus-unemployment-claims-crash-websites/,86,2020-3-19,
Data Shows the US Economy Was Collapsing 5 Months Before the Coronavirus Outbreak,1209,0.82,gcrwsk,https://news.bitcoin.com/data-shows-the-us-economy-was-collapsing-5-months-before-the-coronavirus-outbreak/,146,2020-5-3,
The US Spends More Than $80 Billion a Year Incarcerating 2.3 Million People,1209,0.98,jhkgoc,https://www.commondreams.org/views/2020/10/21/us-spends-more-80-billion-year-incarcerating-23-million-people,157,2020-10-25,
"Calls Grow to Break Up Facebook, Amazon for 'Mob-Like' Behavior, Monopoly Power",1203,0.97,i4i15l,https://www.democracynow.org/2020/8/5/scott_galloway_big_tech,70,2020-8-6,
A majority of young adults in the U.S. live with their parents for the first time since the Great Depression,1201,0.98,imiol2,https://www.pewresearch.org/fact-tank/2020/09/04/a-majority-of-young-adults-in-the-u-s-live-with-their-parents-for-the-first-time-since-the-great-depression/,180,2020-9-5,
"When American Airlines announced raises for its pilots and attendants, the market punished it with a 5.2% share price drop. Analysts explained: “This is frustrating. Labor is being paid first again. Shareholders get leftovers. We are troubled by AAL’s wealth transfer to its labor groups.”",1201,0.98,gk0xg6,https://ponderwall.com/index.php/2018/08/10/apple-trillion-value-not-mean-biggest/,250,2020-5-15,
"At 'Shock Doctrine Press Conference,' Trump Bails Out Oil Industry, Not US Families, as Coronavirus Crisis Intensifies",1191,0.94,fj71t3,https://www.commondreams.org/news/2020/03/13/shock-doctrine-press-conference-trump-bails-out-oil-industry-not-us-families,87,2020-3-16,
