title,score,upv_ratio,id,url,comms_num,created,body
"I refuse to tolerate a system that lets billionaires add $792,000,000,000 to their wealth during a pandemic but doesn’t raise the $7.25 minimum wage for over a decade.",952,0.92,ip4a1z,https://twitter.com/RBReich/status/1303403482368675846,162,2020-9-9,
"If Worker Pay Had Kept Pace With Productivity Gains Since 1968, Today's Minimum Wage Would Be $24 an Hour",951,0.95,esgj2v,https://www.commondreams.org/views/2020/01/21/if-worker-pay-had-kept-pace-productivity-gains-1968-todays-minimum-wage-would-be-24,273,2020-1-23,
Rihanna donates $5 million to coronavirus relief through her Clara Lionel foundation,952,0.94,fmocax,https://www.mazechmedia.com/2020/03/rihanna-donates-5-million-to-coronavirus-relief-through-her-clara-lionel-foundation/,44,2020-3-22,
Millenials with a white-collar job never knew they needed trade unions. This pandemic might change that.,952,0.93,goqp7h,https://link.medium.com/lev88lJbH6,186,2020-5-23,
"New York's 420,000 wealthiest residents fled the city in two months",949,0.97,gktl3a,https://www.dailymail.co.uk/news/article-8323377/New-Yorks-420-000-wealthiest-residents-fled-city-two-months-new-smartphone-data-shows.html,144,2020-5-16,
More businesses were lost in the last 3 months than all of the Great Recession,949,0.98,i9kenf,https://www.axios.com/small-businesses-lost-coronavirus-recession-minorities-22a03253-156f-4397-829d-067940d00300.html,50,2020-8-14,
The European economy will recover faster from the crisis than the US,948,0.96,hy9t8q,http://www.financesherald.com/the-european-economy-will-recover-faster-from-the-crisis-than-the-us/,83,2020-7-27,
"Each gun homicide in one California city costs taxpayers $2.3 million, study says",943,0.95,guq7zo,https://www.mercurynews.com/2020/06/01/each-gun-homicide-in-san-bernardino-costs-taxpayers-2-3-million-study-says/,120,2020-6-2,
CEOs Say America is Running Out of Meat--While Shipping Ever More Pork Overseas: US companies have exported a third of the pork they’ve produced in 2020,940,0.96,gjmt1k,https://www.motherjones.com/food/2020/05/packing-execs-say-america-is-running-out-of-meat-while-shipping-ever-more-pork-overseas/,87,2020-5-14,
"Dow spikes nearly 1,600 points as vaccine news, Biden victory rev up markets",932,0.96,jr04xa,https://www.washingtonpost.com/business/2020/11/09/stocks-markets-biden-trump-coronavirus/,112,2020-11-9,
"Nobel Prize-winning economist: Trump is ""wrong"" to claim his economic policies help the middle-class",931,0.91,eyahk3,https://www.salon.com/2020/02/02/nobel-prize-winning-economist-trump-is-wrong-to-claim-his-economic-policies-help-the-middle-class_partner/,95,2020-2-4,
Why our government mostly helps people who need it the least — even during a crisis,931,0.94,htt2oq,https://www.salon.com/2020/07/17/why-our-government-mostly-helps-people-who-need-it-the-least--even-during-a-crisis_partner/,114,2020-7-19,
'Tax cuts are his answer for everything.' Trump's desired coronavirus payroll tax cuts met with pushback amid debate over stimulus package.,926,0.96,fgwy8h,https://www.newsweek.com/trumps-desired-coronavirus-payroll-tax-cuts-met-pushback-amid-debate-over-stimulus-package-1491573,177,2020-3-11,
"HEROES Act Proposal - $1,200 Stimulus Check For Individuals And Up To $6,000 For Families",925,0.93,giz62c,https://www.forbes.com/sites/ryanguina/2020/05/12/heroes-act-1200-stimulus-check/#215fda6a4ace,376,2020-5-13,
It's morally repulsive how large corporations are exploiting this crisis. Workers will suffer,924,0.96,fnafli,https://www.theguardian.com/commentisfree/2020/mar/22/large-corporations-exploiting-coronavirus-crisis,59,2020-3-23,
Switching to a Plant-Based Diet Will Create 19 Million More Jobs,922,0.9,i33t9a,https://thebeet.com/by-shifting-to-a-plant-based-diet-we-can-create-19-million-new-jobs-study-finds/,213,2020-8-4,
Second Wave Of Layoffs Is Coming As Lockdowns Persist,915,0.97,ihikmq,https://www.forbes.com/sites/kenrapoza/2020/08/04/a-second-wave-of-layoffs-is-coming-as-lockdowns-persist/#1faeaa263814,144,2020-8-27,
"Trump claims Ivanka ""created 14 million jobs"" but only 5.5 million jobs have been created during his presidency",916,0.94,dvssgx,https://www.newsweek.com/trump-ivanka-14-million-jobs-1471309,221,2019-11-13,
Warren Buffett's Berkshire Hathaway bought back a record $9 billion in stock in the third quarter,912,0.99,jqd8nf,https://www.cnbc.com/2020/11/07/berkshire-hathaway-earnings-q3-2020html.html,80,2020-11-8,
Donald Trump’s incentives have no potential to accelerate the US economic recovery,912,0.91,i733rd,http://www.economo.co.uk/donald-trumps-incentives-have-no-potential-to-accelerate-the-us-economic-recovery/,125,2020-8-10,
"Jeff Bezos gained $40 billion in wealth this year while his workers sleep in tents outside warehouses,pee in bottles, fall asleep while standing, ohh and get subsidized with food stamps and Medicaid...",913,0.9,8porw5,http://time.com/money/5301812/jeff-bezos-net-worth-2018-amazon-worker-salary/?utm_source=reddit.com,188,2018-6-9,
CONFIRMED : Billionaire Philantropist Bill Gates lied. Bill Gates met with Jeffrey Epstein several times after Epstein was sentenced for pedophilia (New York Times),908,0.9,e0pn4d,https://www.nytimes.com/2019/10/12/business/jeffrey-epstein-bill-gates.html,146,2019-11-24,
"Trump finds himself in an uncertain position: caught between advisers urging him to calm a country in the grips of a pandemic, economic uncertainty and civil unrest and those who want him to lean into aggressive tactics that almost certainly would further inflame a nation on edge.",909,0.97,h80liy,https://www.nbcnews.com/news/amp/ncna1230941?__twitter_impression=true,130,2020-6-13,
Trump's attempt to buy a coronavirus vaccine shows why big pharma needs to change | Diarmaid McDonald,908,0.96,fjuu96,https://www.theguardian.com/commentisfree/2020/mar/16/trump-coronavirus-vaccine-big-pharma-president-drugs-industry-profit,41,2020-3-17,
'Don't Be Fooled': Economists Warn Against Deceptive Trump Spin on New GDP Figures,911,0.93,jkkg90,https://www.commondreams.org/news/2020/10/28/dont-be-fooled-economists-warn-against-deceptive-trump-spin-new-gdp-figures?c,148,2020-10-30,
"Small business, not Wall Street, gives a real picture of the American economy",907,0.99,hj8s9n,http://www.economo.co.uk/small-business-not-wall-street-gives-a-real-picture-of-the-american-economy/,84,2020-7-1,
Port workers and longshoremen hold nine-minute work stoppage to honor George Floyd. Unions demand “justice and fundamental change” in wake of Minneapolis man’s death at hands of police.,905,0.97,h104qs,https://www.dcvelocity.com/articles/46266-port-workers-and-longshoremen-hold-nine-minute-work-stoppage-to-honor-george-floyd,11,2020-6-11,
Biden-voting counties equal 70% of America’s economy. What does this mean for the nation’s political-economic divide?,904,0.97,jrubn2,https://www.brookings.edu/blog/the-avenue/2020/11/09/biden-voting-counties-equal-70-of-americas-economy-what-does-this-mean-for-the-nations-political-economic-divide/,155,2020-11-11,
"A Study found Americans overestimate social mobility in their country - Americans are more likely than the British, Swedish, French or Italians to believe someone poor can become rich. They don't realize they have a worse social mobility rate than all of them",898,0.96,ee5pq1,https://www.economist.com/graphic-detail/2018/02/14/americans-overestimate-social-mobility-in-their-country,142,2019-12-22,
84% of CFOs say US stocks are overvalued,899,0.98,ihxtqf,https://www.msn.com/en-us/money/savingandinvesting/84-of-cfos-say-us-stocks-are-overvalued/ar-BB18qrPk?ocid=msedgntp,135,2020-8-28,
Landlords lining up to evict hundreds of Tampa Bay tenants once moratorium expires,898,0.97,gppcnn,https://www.tampabay.com/news/health/2020/05/23/landlords-lining-up-to-evict-hundreds-of-tampa-bay-tenants-once-moratorium-expires/,244,2020-5-24,
'Smash-and-Grab Economics': Trump White House Weighing Tax Cut for Rich Investors as Workers and Small Businesses Struggle,893,0.94,fwb7u8,https://www.commondreams.org/news/2020/04/06/smash-and-grab-economics-trump-white-house-weighing-tax-cut-rich-investors-workers?utm_campaign=shareaholic&utm_medium=referral&utm_source=reddit,58,2020-4-7,
Coronavirus wipes out $1.7 trillion in US stock market value in two days,898,0.97,f9sfma,https://www.cnbc.com/2020/02/25/coronavirus-wipes-out-1point7-trillion-in-us-stock-market-value-in-two-days.html,174,2020-2-26,
"As big corporations say ‘black lives matter,’ their track records raise skepticism",897,0.97,h8kwmi,https://www.washingtonpost.com/business/2020/06/13/after-years-marginalizing-black-employees-customers-corporate-america-says-black-lives-matter/,51,2020-6-14,
Trump says U.S. economic recovery is faster than any other country's — but China has roared ahead,894,0.94,j6pcl3,https://www.nbcnews.com/business/economy/trump-says-u-s-economic-recovery-faster-any-other-nation-n1242361,139,2020-10-7,
Nearly 900 workers at a Tyson Foods plant in Indiana test positive for Covid-19,896,0.98,gc334o,https://www.nbcnews.com/news/us-news/nearly-900-workers-tyson-foods-plant-indiana-test-positive-coronavirus-n1197776,132,2020-5-2,
The US debt is now projected to be larger than the US economy,899,0.97,j7x4ag,https://edition.cnn.com/2020/10/08/economy/deficit-debt-pandemic-cbo/index.html,449,2020-10-9,
“Jaw-dropping corruption”: Mnuchin refuses to disclose which businesses got taxpayer-backed bailouts,892,0.98,h7q3ce,https://www.salon.com/2020/06/12/jaw-dropping-corruption-mnuchin-refuses-to-disclose-which-businesses-got-taxpayer-backed-bailouts/,55,2020-6-13,
Twitter tells employees they can work from home permanently,892,0.98,gif90y,https://www.businessinsider.com/twitter-tells-employees-they-can-work-from-home-permanently-2020-5,127,2020-5-13,
"Jobless claims: Another 884,000 Americans filed new unemployment claims last week",892,0.97,iq2pd9,https://finance.yahoo.com/news/jobless-claims-coronavirus-unemployment-week-ended-september-5-2020-165121299.html,210,2020-9-10,
Student Loan 'Bubble' Bursting,889,0.91,is12bo,https://newest-websites.com/student-loan-bubble-bursting/,298,2020-9-14,
US car sales just had their worst quarter since the Great Recession,883,0.99,hllilo,https://www.cnn.com/2020/07/01/business/car-sales-coronavirus-covid-19/index.html,182,2020-7-5,
Don’t Be Fooled By Official Unemployment Rate Of 14.7%; The Real Figure Is Even Scarier,882,0.95,gh2m2r,https://www.forbes.com/sites/shaharziv/2020/05/10/dont-be-fooled-by-official-unemployment-rate-of-147-the-real-figure-is-even-scarier/#39c4a8ed55dd,266,2020-5-10,
"One Good/Great Thing: Trump's Businesses Won't Get To Use Coronavirus Stimulus Funds, Democrats Say",886,0.94,forfai,https://www.ibtimes.com/trumps-businesses-wont-get-use-coronavirus-stimulus-funds-democrats-say-2946507,75,2020-3-25,
"With Canada and Mexico borders closed, Americans are trapped in their own healthcare system",888,0.95,ijwlw5,https://www.cnn.com/2020/08/31/americas/canada-mexico-borders-insulin-intl/index.html,127,2020-8-31,
Around 1.3 million people filed for first-time unemployment benefits last week,877,0.98,ho2c1m,https://www.nbcnews.com/business/economy/around-1-3-million-people-filed-first-time-unemployment-benefits-n1233280,50,2020-7-9,
National Debt,876,0.9,hv7fe7,https://i.redd.it/dtwld90hq7c51.png,274,2020-7-21,
Workers plan to walk off the job in nationwide Strike for Black Lives,880,0.93,hqnzbe,https://www.cnn.com/2020/07/12/business/strike-for-black-lives-union-wages/index.html,197,2020-7-14,
Trump’s Economy Was Never So Great,872,0.89,jh7cwc,https://www.nytimes.com/2020/10/23/opinion/trump-economy.html,160,2020-10-24,
"Rent is Unaffordable in Every Single State in America: Safe and affordable housing is increasingly out of reach for low-income renters, according to a new report",865,0.95,hrm6vo,https://www.huffpost.com/entry/affordable-housing-coronavirus-rent-evictions_n_5f0ccf72c5b6310dc157414b,152,2020-7-15,
U.S. National Debt Is On Its Way To A Record $27 Trillion,865,0.96,huwrfo,https://www.thecryptoassociate.com/u-s-national-debt-is-on-its-way-to-a-record-27-trillion/,248,2020-7-21,
China Is Now the World's Largest Economy. We Shouldn't Be Shocked.,864,0.93,jbxeow,https://nationalinterest.org/feature/china-now-worlds-largest-economy-we-shouldnt-be-shocked-170719,233,2020-10-16,
Not Made in China Is Global Tech's Next Big Trend,865,0.97,fsycbo,https://www.bloomberg.com/news/articles/2020-03-31/supply-chains-latest-not-made-in-china-is-tech-s-next-move,84,2020-4-1,
Bailouts,866,0.95,hu0vyx,https://i.redd.it/folhtvg9ktb51.png,70,2020-7-19,
Nearly half of American adults are now unemployed,860,0.91,hiekwl,https://www.msn.com/en-us/money/markets/nearly-half-of-american-adults-are-now-unemployed/ar-BB167gf0,161,2020-6-30,
Another study shows Gender Pay Gap is really just a Gender Choice Gap,865,0.94,9zzn7f,https://scholar.harvard.edu/bolotnyy/publications/why-do-women-earn-less-men-evidence-bus-and-train-operators-job-market-paper,482,2018-11-25,
Converting America’s Faded Retail Structures Into Livable Space.,861,0.99,hl2jy6,https://www.city-journal.org/housing-creation-from-empty-retail-spaces,83,2020-7-4,
Police unions become target of labor activists who see them as blocking reform [United States of America],868,0.98,hapujh,https://www.latimes.com/politics/story/2020-06-15/police-unions-george-floyd-reform,47,2020-6-17,
These ‘We Build the Wall’ donors say they aren’t victims of fraud: ‘I hope I get to donate again’,860,0.95,ieg21r,http://rplg.co/3293adc0,197,2020-8-22,
Donald Trump And The Fed Are Destroying The U.S. Dollar,860,0.91,frjl95,https://www.forbes.com/sites/billybambrough/2020/03/28/donald-trump-and-the-fed-are-destroying-the-us-dollar,190,2020-3-30,
Coronavirus update: Health experts express alarm at CDC change in testing guidelines that exclude asymptomatic patients,861,0.97,ih0psv,http://rplg.co/e7f3f450,52,2020-8-26,
Analyst anticipates 'worst' financial crisis since 1929 amid fears of a global recession,858,0.96,fmcx1n,https://www.reddit.com/user/Fatherthinger/comments/fmcwj6/analyst_anticipates_worst_financial_crisis_since/,135,2020-3-21,
"Will America tear itself apart? The Supreme Court, 2020 elections and a looming constitutional crisis",856,0.95,jmfugq,https://www.ft.com/content/b159bce5-83e7-4f8e-ab0d-4123660ab539,219,2020-11-2,
"College students could be leaving up to $5,000 in coronavirus stimulus money on the table - as of late-April only 1% had actually been distributed, partially because students may have been unaware they were eligible.",856,0.98,hio6n7,https://finance.yahoo.com/news/college-students-could-be-leaving-up-to-5000-in-coronavirus-stimulus-money-on-the-table-110808246.html,60,2020-6-30,
"Brace for the ‘deepest recession on record,’ says BofA analysts, as jobless claims surge to 6.6 million",855,0.97,fuwdc0,https://www.marketwatch.com/story/brace-for-the-deepest-recession-on-record-says-bofa-analysts-as-jobless-claims-surge-to-66-million-2020-04-02,287,2020-4-5,
Mega-Rich Urged to Unleash $121 Billion for Desperate Charities [United States of America],848,0.97,h7osvp,https://www.bloomberg.com/news/articles/2020-06-12/mega-rich-urged-to-unleash-121-billion-for-desperate-charities,73,2020-6-13,
"In 2016, 40% of all Americans made less than the 1968 minimum wage, adjusted for inflation. With the pandemic as an excuse, wages will be pushed down again. Pretty much half of USA gets screwed, and the other half defends the predatory system.",853,0.96,imj136,https://www.forbes.com/sites/timworstall/2016/02/07/ludicrous-economic-numbers-40-of-americans-make-less-than-the-1968-minimum-wage/,256,2020-9-5,
A shocking 42% of all U.S. workers make less than $15 per hour,843,0.94,cu255l,https://fortune.com/2015/04/13/who-makes-15-per-hour/,277,2019-8-23,
"Billionaires Want People Back At Work, Even If It Kills Them - Hurting the economy 'could be worse than losing a few more people,' Paychex founder Tom Golisano told Bloomberg",851,0.94,fs9e1s,https://www.huffpost.com/entry/billionaires-workers-coronavirus_n_5e7b92f0c5b62a1870d68b11,121,2020-3-31,
"Americans on shaky ground financially, speaking out more on racism, poll finds",850,0.95,jblcw6,https://www.marketplace.org/2020/10/15/americans-on-shaky-ground-financially-speaking-out-more-on-racism-covid-19-pandemic/,116,2020-10-15,
"Fast-food restaurants can’t find workers even amid historic unemployment — Since service-sector jobs now mean a higher chance of infection, even higher pay isn't coaxing workers into the kitchen.",847,0.98,ik4uo7,https://www.centralmaine.com/2020/08/31/fast-food-restaurants-cant-find-workers-even-amid-historic-unemployment/,95,2020-9-1,
The extra $600 Americans receive in weekly unemployment benefits ends in July — how that could cost the U.S. more jobs,840,0.97,haq08o,https://www.marketwatch.com/story/ending-the-extra-600-a-month-americans-are-getting-in-unemployment-benefits-could-cost-the-us-more-jobs-some-economists-say-2020-05-28?mod=home-page,149,2020-6-17,
"Bill Gates, second richest person in the world: My $109 billion net worth shows the economy is not fair",846,0.93,ek01t9,https://www.cnbc.com/2020/01/03/bill-gates-americas-tax-system-is-not-fair.html,183,2020-1-5,
Third Major Transfer From the Middle Class to the Wealthy,838,0.96,g9o6uj,https://www.thestreet.com/mishtalk/economics/third-major-transfer-from-the-middle-class-to-the-wealthy,179,2020-4-28,
US national debt has increased $2 trillion since Trump took office,842,0.94,acvyi9,https://www.independent.co.uk/news/world/americas/us-politics/us-national-debt-2-trillion-donald-trump-presidency-deficit-treasury-congressional-budget-office-a8710546.html,206,2019-1-6,
Turns Out Mass Death Is Bad For The Economy,831,0.96,hvtbbe,https://www.huffpost.com/entry/coronavirus-mass-death-economy_n_5f175df7c5b615860bb8fc07,113,2020-7-22,
"US Dept of Justice indicts 6 people: $100,000 in bribes helped fraudulent Amazon sellers earn $100 million",830,0.99,ivvgba,https://arstechnica.com/tech-policy/2020/09/doj-amazon-workers-took-bribes-to-reinstate-sellers-of-dangerous-products/,22,2020-9-20,
Hunger after COVID-19 could kill more people in 2020 than the virus itself,838,0.97,ikjr76,http://www.economo.co.uk/hunger-after-covid-19-could-kill-more-people-in-2020-than-the-virus-itself/,160,2020-9-1,
No students. No graduation. ‘Total devastation’ in college towns during coronavirus pandemic,835,0.97,gleh37,https://www.usatoday.com/story/news/education/2020/05/15/coronavirus-unemployment-2020-college-graduation-economy/5205202002/,124,2020-5-17,
"$2,000 Per Person Plus $2,000 Per Child: Monthly Economic Crisis Support Act Would Send Payments To Over 90% Of Americans",835,0.88,gi25hm,https://www.forbes.com/sites/jimwang/2020/05/08/2000-per-person-and-2000-per-child-monthly-economic-crisis-support-act-would-send-payments-to-over-90-of-americans/#2ccd31df3977,405,2020-5-12,
30% of Americans missed their housing payments in June,832,0.98,haxwhe,https://www.cnbc.com/2020/06/16/30percent-of-americans-missed-their-housing-payments-in-june.html,153,2020-6-18,
Amazon-owned Whole Foods’ decision to drop health benefits for hundreds of part-time workers reveals how promises to workers like CEO Jeff Bezos’ recent pledge are worthless,832,0.98,d55zh4,https://www.businessinsider.com/whole-foods-healthcare-amazon-ceo-jeff-bezos-promises-business-roundtable-2019-9?utm_content=buffer4f58d&utm_medium=social&utm_source=facebook.com&utm_campaign=buffer-food&fbclid=IwAR29FL-HkD95osjS5UnaYPr1da1fizAZC3n0ce1Ls8jbgJxsa4gsMG-pn0A?utm_source=twitter&utm_medium=referral&utm_content=topbar&utm_term=desktop&referrer=twitter,75,2019-9-17,
Millennials are the biggest - but poorest - generation,831,0.98,hd3zdr,https://www.cbsnews.com/news/millennials-have-just-3-of-us-wealth-boomers-at-their-age-had-21/,257,2020-6-21,
"18% of U.S. workers have lost jobs or hours since coronavirus hit, poll finds",830,0.96,fkdpjk,https://www.latimes.com/business/story/2020-03-17/coronavirus-layoffs-work-hours-jobs,103,2020-3-18,
"Seattle man, 70, receives a $1.1MILLION hospital bill for coronavirus treatment featuring nearly 3,000 itemized charges",834,0.96,h8qxah,https://www.dailymail.co.uk/news/article-8417781/Seattle-man-70-receives-1-1MILLION-hospital-bill-coronavirus-treatment.html,120,2020-6-14,
Almost 30 Million in U.S. Didn't Have Enough to Eat Last Week [United States of America],822,0.96,i0kyf8,https://www.bloomberg.com/news/articles/2020-07-29/almost-30-million-in-u-s-didn-t-have-enough-to-eat-last-week,144,2020-7-30,
"Pennsylvania man shoots girlfriend, kills himself after losing job due to coronavirus",826,0.94,ftc4kq,https://www.mazechmedia.com/2020/04/pennsylvania-man-shoots-girlfriend-kills-himself-after-losing-job-due-to-coronavirus/,247,2020-4-2,
"With coronavirus and locust plague, ‘nature is sending us a message,’ says UN environment head",822,0.93,fpsus1,https://www.marketwatch.com/story/with-coronavirus-and-locust-plague-nature-is-sending-us-a-message-says-un-environment-head-2020-03-25,61,2020-3-27,
"Trump Team Hoping The Public Doesn't Notice, As 5th ""Goldman Guy"" To Be Handed Top Position",821,0.89,5thrmo,http://monetarywatch.com/2017/02/trump-team-hoping-public-doesnt-notice-5th-goldman-guy-appointed/?doing_wp_cron=1486849796.4573309421539306640625,33,2017-2-12,
The US stock market could be headed for a lost decade,823,0.92,jm2n5v,https://www.reddit.com/user/Fatherthinger/comments/jm2kie/the_us_stock_market_could_be_headed_for_a_lost/,125,2020-11-1,
"Hertz, JC Penney and 20 More Major Companies Going Bankrupt in 2020",822,0.99,hs72j7,https://finance.yahoo.com/news/hertz-jc-penney-20-more-161549244.html,114,2020-7-16,
‘Scary Time’ for American Middle Class as Office Jobs Disappear,815,0.98,g5zd2g,https://www.bloomberg.com/news/articles/2020-04-22/-scary-time-for-american-middle-class-as-office-jobs-disappear,306,2020-4-22,
"The world's 2,153 billionaires are richer than 4.6 billion people combined, Oxfam says",814,0.93,erdzf3,https://markets.businessinsider.com/news/stocks/2153-billionaires-richer-than-4-6-billion-people-combined-oxfam-2020-1-1028829249,344,2020-1-20,
D'ow,815,0.98,fju8oc,https://i.redd.it/0t6605d774n41.jpg,32,2020-3-17,
"Jeff Bezos’ Whole Foods slashes medical benefits for nearly 2,000 part-time workers",813,0.91,h97zr5,https://www.wsws.org/en/articles/2019/10/03/amaz-o03.html,94,2020-6-15,
Real wage growth has slowed tremendously under Trump compared to Obama: study,811,0.91,fbgsf8,https://www.salon.com/2020/02/29/real-wage-growth-has-slowed-tremendously-under-trump-compared-to-obama-study/,61,2020-3-1,
Coronavirus: China considers 'complete ban' on wildlife trade,812,0.98,f8npe5,https://www.straitstimes.com/asia/east-asia/coronavirus-china-considers-complete-ban-on-wildlife-trade,99,2020-2-24,
Coca-Cola will discontinue more than 200 drinks due to the COVID-19 crisis The Coronavirus pandemic reached one of the most powerful companies: Coca-Cola,808,0.98,jjlnzh,https://money2y.com/coca-cola-will-discontinue-more-than-200-drinks-due-to-the-covid-19-crisis/,192,2020-10-28,
"The Fed Is Offering $100 Billion a Day in Emergency Loans to Unnamed Banks, and Congress Is Not Curious Enough to Hold a Hearing",813,0.93,dba7dv,https://cutt.ly/Ier789n,76,2019-9-30,
Dow sinks almost 900 points amid surging COVID-19 cases,807,0.99,jije5v,https://www.upi.com/Top_News/US/2020/10/26/Dow-sinks-almost-900-points-amid-surging-COVID-19-cases/9331603730482/,83,2020-10-27,
Millennials will pay the price for their parents’ luck and self-indulgence,802,0.95,im1re1,https://financialpost.com/opinion/millennials-will-pay-the-price-for-their-parents-luck-and-self-indulgence,266,2020-9-4,
Goldman Sachs bets against the dollar as economies reopen,804,0.98,gui2wk,https://www.cnbc.com/2020/06/01/goldman-sachs-bets-against-the-dollar-as-economies-reopen.html,104,2020-6-1,
"What 60 Minutes Missed: 44 Percent of U.S. Workers Earn $18,000 Per Year",806,0.92,e8azun,https://www.thestranger.com/slog/2019/12/03/42166145/what-60-minutes-missed-44-of-us-workers-earn-18000-per-year,208,2019-12-9,
Coronavirus is the ultimate proof that the world can no longer afford to ignore tax havens,798,0.96,fooase,https://www.eureporter.co/economy/banking-2/2020/03/24/we-cant-afford-tax-havens-in-the-age-of-coronavirus/,34,2020-3-25,
"Jobless claims: Another 881,000 Americans filed new unemployment claims last week, as new counting method takes effect",796,0.99,ilsmcm,https://finance.yahoo.com/news/jobless-claims-coronavirus-unemployment-week-ended-august-29-2020-202214668.html,93,2020-9-3,
"Column: If coronavirus sweeps America, blame our brutal work and healthcare culture",795,0.93,fblqow,https://www.latimes.com/business/story/2020-02-29/coronavirus-sick-days-health-insurance,98,2020-3-1,
End to US unemployment protections could fuel wave of despair and suicides,797,0.96,i8ywtn,https://www.theguardian.com/us-news/2020/aug/13/covid-19-coronavirus-mental-health-unemployment,191,2020-8-13,
"“No lines, no crowds”: Germans stay home as stores reopen",800,0.99,g6p71h,https://www.reuters.com/article/us-health-coronavirus-germany-shops-idUSKCN2242AG,153,2020-4-23,
U.S. Treasury Will Borrow A Record $3 Trillion This Quarter As Stimulus Spending Soars,789,0.98,hzd243,https://www.forbes.com/sites/sarahhansen/2020/05/04/the-us-treasury-will-borrow-a-record-3-trillion-this-quarter-as-stimulus-spending-soars/#6ae12ed45306,181,2020-7-28,
Reopening the Economy Is a Death Sentence for Workers,787,0.82,gye4sv,https://ips-dc.org/reopening-the-economy-is-a-death-sentence-for-workers/?,214,2020-6-7,
Virus surge makes US weak link in global economic recovery,795,0.94,i7rp3v,https://apnews.com/07e84915d417309fd4b4593bdb2cb90f,30,2020-8-11,
