title,score,upv_ratio,id,url,comms_num,created,body
There will be more job postings in solar than in oil by year end,7,1.0,4gds8p,http://fortune.com/2016/04/20/solar-oil-jobs-indeed/,0,2016-4-25,
A fully transparent solar cell that could make every window and screen a power source,7,1.0,3ocdqd,http://www.offgridquest.com/extra/a-fully-transparent-solar-cell-that-coul,1,2015-10-12,
"Duke Energy plant reports coal-ash spill of undetermined quantity at retired Dan River plant in Eden, N.C. The Charlotte Observer reports that neither the company nor the state is responding to media requests.",7,0.83,1wxho5,http://www.charlotteobserver.com/2014/02/03/4661193/duke-energy-plant-reports-coal.html#.UvAP27SkIYJ,0,2014-2-4,
How to green the world's deserts and reverse climate change | Allan Savory,5,0.79,977qbb,https://www.youtube.com/watch?v=vpTHi7O66pI,3,2018-8-14,
Why is the collapse of the Gulf Stream barely spoken of?,6,0.88,5ypgnt,https://www.reddit.com/r/Enviroment/comments/5ypgnt/why_is_the_collapse_of_the_gulf_stream_barely/,0,2017-3-11,"I read [this](http://www.planetextinction.com/planet_extinction_gulfstream.htm) article, stating that Europe could become like a Siberian tundra if GS were to collapse. As a European, this sounds terrifying. If global temperature increase by 3 degrees, according to the article, probability of a collapse is 50%. 

Do you think this is a serious issue that deserve more attention in media? Should we be worried?"
Monsanto: The Company that Owns the World’s Food Supply - YouTube,5,0.69,5yea8r,https://www.youtube.com/watch?v=KAZmHIiN8VI,1,2017-3-9,
"Climate change impact on Australia may be irreversible, five-yearly report says",7,1.0,5xw1b5,https://www.theguardian.com/environment/2017/mar/07/climate-change-impact-australia-may-be-irreversible-report?CMP=twt_a-environment_b-gdneco,0,2017-3-7,
Bill Gates is backing a waterless toilet,6,1.0,4bmjek,https://konstruktor.com/Article/view/1001,1,2016-3-23,
Power struggle : The antinucllear campaign,6,1.0,3qnmja,http://www.nature.com/news/power-struggle-1.18645?WT.ec_id=NATURE-20151029&spMailingID=49884916&spUserID=Njk3NjE5NzEwMzgS1&spJobID=783976831&spReportId=NzgzOTc2ODMxS0,0,2015-10-29,
Carbon emissions are acidifying the ocean so quickly that the seafloor is disintegrating.,5,1.0,9ttz93,https://motherboard.vice.com/en_us/article/d3qaek/the-seafloor-is-dissolving-because-climate-change?fbclid=IwAR2KlkP4MeakBnBeZkMSO_Q-ZVBRp1ZPMWz2EIJCI6J8fKStRSyX_gIM0-w,1,2018-11-3,
"Ex-Nasa scientist: 30 years on, world is failing 'miserably’ to address climate change | Environment",5,0.78,8sdlmh,https://www.theguardian.com/environment/2018/jun/19/james-hansen-nasa-scientist-climate-change-warning,0,2018-6-20,
Five of the world's biggest environmental problems,3,0.72,7h8qnm,https://www.reddit.com/r/Enviroment/comments/7h8qnm/five_of_the_worlds_biggest_environmental_problems/,0,2017-12-3,"
YOUR PICKS: TOP ENVIRONMENT STORIES OF 20161. Clash in German forest as red line is crossed2. Should animals have 'human' rights?3. Berlin: Vegan capital of the world?4. Trump prepares to dismantle US environmental law5. Self-driving cars may end gasoline era6. Saving Canada's only desert7. Dangers lurking in the permafrost8. Five of the world's biggest environmental problems9. Why we should be mourning the death of the Great Barrier Reef10. Do animals mourn their dead?
These five megatrends present major global threats for planet Earth - problems that must be solved if the world is to remain a supportive habitat for humans and other species. DW looks at causes and possible solutions.
 Smog in Singapore (Reuters)
1. Air pollution and climate change.
Problem: Overloading of the atmosphere and of ocean waters with carbon. Atmospheric CO2 absorbs and re-emits infrared-wavelength radiation, leading to warmer air, soils, and ocean surface waters - which is good: The planet would be frozen solid without this.
Unfortunately, there's now too much carbon in the air. Burning of fossil fuels, deforestation for agriculture, and industrial activities have pushed up atmospheric CO2 concentrations from 280 parts per million (ppm) 200 years ago, to about 400 ppm today. That's an unprecedented rise, in both size and speed. The result: climate disruption.
Carbon overloading is only one form of air pollution caused by burning coal, oil, gas and wood. The World Health Organization recently estimated that one in nine deaths in 2012 were attributable to diseases caused by carcinogens and other poisons in polluted air.
 Australien Meeresschutzgebiet Great Barrier Reef Korallenbleiche (imago/blickwinkel)
Ocean life is suffering a triple whammy: overfishing, pollution and warming waters due to climate change
Solutions: Replace fossil fuels with renewable energy. Reforestation. Reduce emissions from agriculture. Change industrial processes.
The good news is that clean energy is abundant - it just needs to be harvested. Many say a 100 percent renewable-energy future is feasible with existing technology now.
But the bad news is that even though renewable energy infrastructure - solar panels, wind turbines, energy storage and distribution systems - are already widespread, and getting cheaper and more efficient all the time, experts say we're not applying them quickly enough to prevent catastrophic climate disruption. Barriers in policy and finance remain to be overcome.
2. Deforestation.
Problem: Species-rich wild forests are being destroyed, especially in the tropics, often to make way for cattle ranching, soybean or palm oil plantations, or other agricultural monocultures.
 Forest fire on Sumatra (picture-alliance/dpa)
Destruction of forests has impacts for biodiversity and the climate
Today, about 30 percent of the planet's land area is covered by forests - which is about half as much as before agriculture got started around 11,000 years ago. About 7.3 million hectares (18 million acres) of forest are destroyed each year, mostly in the tropics. Tropical forests used to cover about 15 percent of the planet's land area; they're now down to 6 or 7 percent. Much of this remainder has been degraded by  logging or burning.
Not only do natural forests act as biodiversity reserves, they are also carbon sinks, keeping carbon out of the atmosphere and oceans.
Solutions: Conserve of what's left of natural forests, and restore degraded areas by replanting with native tree species. This requires strong governance - but many tropical countries are still developing, with increasing populations, uneven rule-of-law, and widespread cronyism and bribery when it comes to allocating land use.
3. Species extinction.
Problem: On land, wild animals are being hunted to extinction for bushmeat, ivory, or ""medicinal"" products. At sea, huge industrial fishing boats equipped with bottom-trawling or purse-seine nets clean out entire fish populations. The loss and destruction of habitat are also major factors contributing to a wave of extinction - unprecedented in that it is caused by a single species: humans. The IUCN's Red List of threatened and endangered species continues to grow.
 Dead rhinoceros in African park (picture-alliance/dpa/S. Fayad)
Rhinos are killed for their horn, which some people falsely believe has medicinal properties
Not only do species inherently deserve to exist, they also provide products and ""services"" essential to human survival. Think bees and their pollinating prowess - necessary for growing food.
Solutions: Concerted efforts need to be made to prevent further loss of biodiversity. Protecting and restoring habitats is one side of this - protecting against poaching and wildlife trade is another. This should be done in partnership with locals, so that wildlife conservation is in their social and economic interest.
4. Soil degradation.
Problem: Overgrazing, monoculture planting, erosion, soil compaction, overexposure to pollutants, land-use conversion - there's a long list of ways that soils are being damaged. About 12 million hectares of farmland a year get seriously degraded, according to UN estimates.
Solutions: A wide range of soil conservation and restoration techniques exist, from no-till agriculture to crop rotation to water-retention through terrace-building. Given that food security depends on keeping soils in good condition, we're likely master this challenge in the long run. Whether this will be done in a way equitable to all people around the globe, remains an open question.
 Terrace agriculture in Yunnan, China (picture-alliance/ZUMAPRESS.com)
Terraces like these in China retain water and can help re-green degraded landscapes
5. Overpopulation.
Problem: Human population continues to grow rapidly worldwide. Humanity entered the 20th century with 1.6 billion people; right now, we're about 7.5 billion. Estimates put us at nearly 10 billion by 2050. Growing global populations, combined with growing affluence, is putting ever greater pressure on essential natural resources, like water. Most of the growth is happening on the African continent, and in southern and eastern Asia.
Solutions: Experience has shown that when women are empowered to control their own reproduction, and gain access to education and basic social services, the average number of births per woman drops precipitously.
Done right, networked aid systems could bring women out of extreme poverty, even in countries where state-level governance remains abysmal.
 Burundi farmworkers (picture-alliance/Ton Koene)
Empowerment of African and Asian women is pivotal to global sustainability
DW RECOMMENDS

Being 'prepared for surprises' - climate change increases hurricane impact in unexpected ways
Hurricane Matthew has moved on, but people from Haiti to the US are still dealing with its deadly effects. DW asked an expert whether climate change is making these storms more dangerous - and what we can do to prepare. (10.10.2016)  
Ever considered buying a forest?
The idea of buying a forest sounds about as realistic as buying an island, but the Remscheid-based project 'Wald 2.0' gives everyone the chance to have a bit of their own woodland. All for the common good.   (10.10.2016)  
CITES conference ends with push against wildlife trafficking
The World Wildlife Conference has wrapped up in Johannesburg with delegates tightening rules on the trafficking of species including sharks, pangolins and parrots. The meeting has been described as a ""game changer."" (05.10.2016)  
US federal authorities list first bee species as endangered
Seven types of Hawaiian native bees are now facing possible extinction, US wildlife authorities say. Another bee found in the continental US is also being considered for protection. (01.10.2016)  
Report: Global warming to surpass dangerous levels despite Paris accord
Climate scientists have called on governments to 'double or triple' their efforts under the Paris agreement. The closer to the threshold of 2 degrees, the more severe the consequences, they warn. (29.09.2016)  
WHO: Nine of 10 people breathe bad air
The World Health Organization has released a new report showing that nearly everywhere people live, the air is polluted beyond safe levels. Polluted air doesn't just smell bad - it's unhealthy, even life-threatening. (27.09.2016)  
Palm oil versus paradise in Papua
On Indonesia's eastern islands, the last wild forests are being clear-cut and replaced with oil palm plantations. Although the product is practically indispensible, green groups say virgin land needn't be cleared for it. (01.09.2016)  
World Population Day: investing in women
The world's population is growing at the expense of women's health. With nearly one in five women already mothers by their 18th birthday, the UN has made women's rights the focus of this year's World Population Day. (11.07.2016)  
A world with less water
Water scarcity has long been a problem. But climate change, a growing global population and economic growth are putting the natural resource under even more stress. (09.06.2016)  
Loss of fertile soils a food security risk
Massive amounts of fertile agricultural land are lost every year. Yet we depend on such topsoil as the basis for feeding the world. So, what needs to be done to assure healthy soils and thus food security? (21.04.2015)  
'Yes we can' switch to 100 percent renewable energy
European Union environment ministers are discussing implementation of the Paris Agreement on Friday (04.03.) A timely transition out of fossil fuels is doable, says Alexander Ochs from Worldwatch. That is, if we act now. (04.03.2016)  "
Keystone pipeline spill blamed on damage from its construction,5,0.86,7ge1dm,http://thehill.com/policy/energy-environment/362311-keystone-pipeline-spill-blamed-on-damage-from-its-construction,0,2017-11-29,
"Citing The Bible, The EPA Just Changed Its Rules For Science Advisors: Referencing the Book of Joshua, EPA head Scott Pruitt announced sweeping changes to the agency's science advisory boards, opening the door to more input from the business world.",5,1.0,79zryq,https://www.buzzfeed.com/zahrahirji/epa-pruitt-new-science-advisors?utm_term=.dl9K5wJGB#.kg3OeK5kZ,0,2017-11-1,
Rabbi Confirms Catastrophic Super Comet Nibiru Could Be Heading for Earth,4,0.84,6gh430,https://www.youtube.com/attribution_link?a=9qTNkbCuOZA&u=%2Fwatch%3Fv%3DavbmH70LqcQ%26feature%3Dshare,0,2017-6-11,
Michigan House may ban bits in soaps that hurt Great Lakes,6,1.0,3ohjn1,http://www.freep.com/story/news/politics/2015/10/12/michigan-house-looks-banning-microbeads/73508700/,0,2015-10-13,
S.C. regulator 'surprised' Duke hasn't removed coal ash yet,5,1.0,2hu5m6,http://www.greenvilleonline.com/story/news/local/2014/09/25/sc-regulator-surprised-duke-removed-coal-ash-yet/16208473/,0,2014-9-30,
Twitchers flocking to see rare bird saw it killed by wind turbine,5,0.86,1h6jv9,http://www.telegraph.co.uk/earth/environment/10146081/Twitchers-flocking-to-see-rare-bird-saw-it-killed-by-wind-turbine.html,0,2013-6-27,
Oops! Did you mean: /r/environment/,4,0.83,11r1mi,http://www.reddit.com/r/environment/,0,2012-10-19,
r/Enviroment needs moderators and is currently available for request,2,0.67,dzc7p0,https://www.reddit.com/r/Enviroment/comments/dzc7p0/renviroment_needs_moderators_and_is_currently/,0,2019-11-21,"If you're interested and willing to moderate and grow this community, 		please go to r/redditrequest, where you can submit a request to take 		over the community. Be sure to [read through the faq](https://www.reddit.com/r/redditrequest/wiki/faq) 		for r/redditrequest before submitting."
Court quotes Dr. Seuss' The Lorax in Atlantic Coast Pipeline decision,5,1.0,a6mviv,https://www.usatoday.com/story/news/nation/2018/12/15/court-quotes-dr-seuss-lorax-atlantic-coast-pipeline-decision/2322143002/?fbclid=IwAR24cQlhCmU7y6py7x3pgN25wmL2BvSf66qAJsx_BLLFc5dUiMGCT9ZErp0,0,2018-12-16,
"To Get Back at G.M., Trump Threatens to Punish Any American Who Buys an Electric Car",3,0.81,a1hryc,https://www.vanityfair.com/news/2018/11/trump-general-motors-subsidies-threat,5,2018-11-29,
Plastic-Choked Seas: Marcella Hansch Wants to Save the Ocean - SPIEGEL ONLINE - International,5,1.0,83ebf2,http://www.spiegel.de/international/world/plastic-choked-seas-marcella-hansch-wants-to-save-the-ocean-a-1193548.html,0,2018-3-10,
Trump's Budget Will Destroy National Parks,4,1.0,800mpo,https://www.outsideonline.com/2281851/trumps-budget-will-destroy-national-parks,1,2018-2-25,
"Honest question, how is anti-enviromentalism even a thing?",4,0.84,7rx5ln,https://www.reddit.com/r/Enviroment/comments/7rx5ln/honest_question_how_is_antienviromentalism_even_a/,2,2018-1-21,"I know this post might seem like a rant against Americans, but I don't intend it to be. However, in light of the comments and videos I've been seeing in the last decade, and the brazenly denialist statements by the current POTUS, I've got to ask this.

How is anti-enviromentalism even a thing? And why it seems to be a very American phenomenon? Let me explain a few things.

I live in Slovakia. It is an European country, but not one of the ""treehugger"" ones. It's a country that only finished the leaded gasoline phaseout in 1994, where unrenovated factories used to poison the air just 2 decades ago, where many cars are quite old, and where most people don't exactly go out of their way to be ""green"". Yet, we have no denier movements of the sort I see in the US.

Sure, most people in Slovakia are not enviromentalists. Man who can afford it buy fast cars, those who cannot are often stuck with 20 year old ones, and our recycling rates are some of the lowest in the EU. Still, our goverment signed all the enviromental protocols despite being very corrupt otherwise (but there was no ""debate"" or ""controversy"" about signing them at all), people, even lovers of fast cars, prefer good fuel efficiency (with our average income, it is a must, not optional), The difference is, everyone I ever talked to about this here at least agrees that protecting the nature is a good thing, and that humans ARE destroying nature, even the people eith the worst enviromental habits here admit that  It seems to me that Americans don't only want the excessive resource usage that is their prime luxury, they want to FEEL GOOD about it too? If someone likes vintage cars that spew unfiltered exhaust here, they like vintage cars. They don't vote for politicians who say that any damage to the enviroment is a myth, they don't lick the boots of sleazy oil companies, they don't listen to jackasses saying stuff like ""it is cold today, checkmate you global warming believing fools"". Of course, there are a lot of people who believe conspiracy theories here, often really harebrained ones, but noone thinks that enviromental damage is a myth. My grandfather saw a whole forest die after a hydrofluoric acid plant was built in it 1950s, anyone who claims humans do no harm to the enviroment is either mentally defective, or a really well paid corporate shill.

The reason why I care, as you may say that it doesn't matter as Slovak or other people damage the enviroment regardless of their opinions, is that an individually enviromentably irresponsible person may pollute the enviroment, but will not hinder the attempts to save it, and may even support them. On the other hand, people who are deniers and want to desperately justify their habits (as opposed to shrugging and saying, duh, of course my car pollutes the air), will vote in denier politicians, say how banning lead and CFCs lead to ""job loss"" (forgetting that unregulated CFCs would destroy the ozone layer completely by 2065, with the subsequent UVC flux destroying all multicellular land life on Earth and returning us to Archean radiation conditions), because of course the jobs of ""hard American man"" are more important than the survival of multicellular life on Earth.

This is connected to an excessive focus on climate change, forgetting that even if their ridiculous theories were true, there are other still countless enviromental problems.

So, how do legally sane adults believe that humanity does not damage the enviroment because ""God will sort it out,"", while doing things like ""rolling coal"" (intentionally modifying your diesel to produce horrible black smoke) and reminescence about the good old smell of leaded gasoline? Do those people care about their children and their future at all?

To be honest, lying about the enviroment because a sleazy corporation pays you should be a crime. It endangers society in the same or even worse way than bribery does. CFCs could have eventually flooded Earth with radiation that you would normally expect on Mars and we know well how good is that for life. Leaded gasoline has made our collective IQ several points lower and the men making it often suffered poisoning to the point they hallucinated butterflies. I don't think we should be ""tolerant"" here, I guess if deniers had they way, the sudden wave of cancer and famine that would arrive after more than a century of CFCs would be all due to ""random variation"" and ""the ozone layer randomly switches off"" and other obvious lies."
Saving turtles 🐢 'n fish 🐟,4,1.0,6p4y1q,https://i.redd.it/jyexvf1sofbz.jpg,0,2017-7-24,
Plant some trees!!!,5,1.0,61tdrf,https://www.ecosia.org/,0,2017-3-28,
The West’s coal giant is going down,4,0.76,5u1q60,http://www.hcn.org/articles/the-wests-coal-giant-is-going-down,0,2017-2-15,
U.S. government scientists go 'rogue' in defiance of Trump,4,1.0,5qeh7z,http://www.reuters.com/article/us-usa-trump-resist-idUSKBN15A0DI,1,2017-1-27,
EPA fears 'unprecedented disaster' for environment over Scott Pruitt pick,4,1.0,5hczyn,https://www.theguardian.com/environment/2016/dec/08/epa-scott-pruitt-disaster-environment-senate-democrats,1,2016-12-9,
Half a Kilometer of Ice Gone in Just 7 Years — West Antarctica’s Smith Glacier Points To Nightmare Melt Scenario,3,0.81,59olae,https://robertscribbler.com/2016/10/26/half-a-kilometer-of-ice-gone-in-just-7-years-west-antarctics-smith-glacier-points-to-nightmare-melt-scenario/,0,2016-10-27,
Louisiana Floods Are already Called 'the Worst Natural Disaster' Since Superstorm Sandy,6,0.86,4ycjgb,http://www.theatlantic.com/politics/archive/2016/08/america-is-ignoring-another-natural-disaster-near-the-gulf/496355/,0,2016-8-18,
18 Green Techs that Just Might Save the Planet,4,0.84,4wqan9,http://urika.co/18-green-techs/,1,2016-8-8,
Boats killing manatees in Florida at record pace,5,1.0,4vi6ly,http://www.orlandosentinel.com/news/environment/os-ap-boats-killing-manatees-florida-20160731-story.html,0,2016-8-1,
"Arctic Research Center Switches To Seawater for Heating, Dumps Fossil Fuels",2,0.63,4jckve,http://www.trueactivist.com/arctic-research-center-switches-to-seawater-for-heating-dumps-fossil-fuels/,0,2016-5-15,
"EPA: VW cheated on Audi, Porsche diesel SUVs, too",5,1.0,3r92zq,http://www.freep.com/story/money/cars/2015/11/02/epa-diesel-suv-volkswagen-audi-porsche/75044132/,0,2015-11-3,
New Limit for Smog-Causing Emissions Isn’t as Strict as Many Had Expected,5,1.0,3nb6i8,http://www.nytimes.com/2015/10/02/us/politics/epa-to-unveil-new-limit-for-smog-causing-ozone-emissions.html?_r=0,0,2015-10-3,
Das Auto Fraud,4,0.84,3m42ys,http://currentoffence.com/2015/09/23/das-auto-fraud-how-does-volkswagens-apology-compare-with-those-other-scandals/,0,2015-9-24,
The Ant and the Grasshopper - Cartoon by Clay Bennett,3,0.81,3g0mto,http://editorialcartoonists.com/cartoon/display.cfm/143912/,0,2015-8-6,
Chimpanzees found to drink alcoholic plant sap in wild,4,1.0,39a7qv,http://www.bbc.com/news/science-environment-33050939,0,2015-6-10,
"Fossil fuels subsidised by $10m a minute, says IMF | Environment",4,0.75,36m11u,http://www.theguardian.com/environment/2015/may/18/fossil-fuel-companies-getting-10m-a-minute-in-subsidies-says-imf,0,2015-5-20,
That's how you can utilize your old computer,4,1.0,2fxcnq,http://i.imgur.com/BKQ8Pr9.jpg,0,2014-9-10,
Las Vegas titanium plant to pay record $13.8 million for contamination,5,1.0,25k59r,http://www.reviewjournal.com/news/henderson-titanium-plant-pay-record-138-million-contamination,0,2014-5-15,
"Consensus now > 99.9%... About that consensus on global warming: 9136 agree, 1 disagrees.",4,1.0,1v2fn7,http://blogs.scientificamerican.com/the-curious-wavefunction/2014/01/10/about-that-consensus-on-global-warming-9136-agree-one-disagrees/,1,2014-1-13,
