title,score,upv_ratio,id,url,comms_num,created,body
Ban Mylar Ballons!,1,1.0,83nlis,https://www.youtube.com/attribution_link?a=rlxhQs6tKZc&u=%2Fwatch%3Fv%3D3WzQT8qBroc%26feature%3Dshare,0,2018-3-12,
Impacts of Pollution in China,1,1.0,827swb,https://i.redd.it/r8a85vfvgzj01.png,1,2018-3-6,
Zero for Effort: Environmental Scorecard Flunks California Congressmembers,1,0.67,81mas1,https://capitalandmain.com/zero-effort-environmental-scorecard-flunks-california-congressmembers-0227,1,2018-3-3,
"Oil Was Central in Decision to Shrink Bears Ears Monument, Emails Show",1,1.0,81fh9q,https://mobile.nytimes.com/2018/03/02/climate/bears-ears-national-monument.html?referer=https://t.co/n4QKz8YR8l?amp=1,0,2018-3-3,
Qualified Tree Felling Services Johannesburg,1,0.67,7lmvbt,https://www.youtube.com/attribution_link?a=NsTUBtaDDYA&u=%2Fwatch%3Fv%3DQoxxDSpSXWQ%26feature%3Dshare,0,2017-12-23,
Cool Earth | Working to halt rainforest destruction,1,1.0,7adpo3,https://www.coolearth.org/,0,2017-11-3,
Vegetation Management Plans Services,1,1.0,774swz,http://www.andenviro.com.au/our-services/vegetation-management-plans/,0,2017-10-18,
Bushfire Threat Assessments,1,1.0,75fr60,http://www.andenviro.com.au/our-services/bushfire-threat-assessments-and-planning/,0,2017-10-10,
Shade balls,1,1.0,74ztnx,http://www.t-rexmag.com/2017/10/shade-balls.html,0,2017-10-8,
The hi-res future of anti-pollution tech | Google,1,1.0,72k9lr,https://www.google.com/about/stories/future-of-anti-pollution-tech/,0,2017-9-26,
Ambientalist leadership,1,1.0,713rg3,https://www.reddit.com/r/Enviroment/comments/713rg3/ambientalist_leadership/,0,2017-9-19,"I have a class where I have to write a brief text about an ambientalist leader, can you guys give me some examples?"
How to pack medical waste box properly,1,1.0,6z64qa,http://www.securewaste.net/medical-waste-blog/view/3328/virginia-packing-medical-waste-box,0,2017-9-10,
You for the environment with your money. Here's how to make a difference investing.,1,0.67,6jnku0,https://www.phxplan.com/socially-responsible-investments/,0,2017-6-27,
Toronto city authorities open ‘cooling centres’ amid soaring temperature,1,1.0,6gysf0,http://bdnews24.com/environment/2017/06/13/toronto-city-authorities-open-cooling-centres-amid-soaring-temperature,0,2017-6-13,
The Green Ambassador Eco Broker in ECO Real Estate provides Environmental Education information about The Earth Needs You to Re-Connect.,1,1.0,6gyawz,http://thegreenambassador.org/2017/04/01/the-earth-needs-you-to-re-connect/,0,2017-6-13,
How To Determine If Your Company Should Be Investing In Solar Power,1,1.0,6grcug,http://solarbay.com.au/determine-company-invest-solar/,0,2017-6-12,
The Benefits Of Solar Power,1,1.0,6gr8ie,http://solarbay.com.au/reasons-invest-solar-power-2/,0,2017-6-12,
Dubai set for world’s cheapest night-time solar power | The National,1,1.0,6fdqkx,http://www.thenational.ae/business/energy/20170605/dubai-set-for-worlds-cheapest-night-time-solar-power,1,2017-6-5,
"Tax plastic drinking straws, firm says - BBC News",1,1.0,6ctgje,http://www.bbc.co.uk/news/uk-40002668,0,2017-5-23,
Biological Assessments - Anderson Environmental,1,1.0,69dtbf,https://andenviro.com/our-services/biological-assessments/,0,2017-5-5,
Phase 1 and Phase 2 Environmental Site Assessments - Anderson Environmental,1,1.0,68l4y4,https://andenviro.com/our-services/phase-1-and-phase-2-environmental-site-assessments/,0,2017-5-1,
Wildfire Protection and Planning - Anderson Environmental,1,1.0,688qco,https://andenviro.ca/our-services/wildfire-protection-planning/,0,2017-4-29,
Thùng rác inox giá rẻ,1,1.0,6752b0,http://www.thungracviet.com/danh-muc/thung-rac-inox,0,2017-4-24,
Health and Environmental Justice,1,1.0,63gwse,https://www.reddit.com/r/Enviroment/comments/63gwse/health_and_environmental_justice/,10,2017-4-5,"I am currently taking a Women and Gender studies class called ""Gender and Diversity in STEM"" and we are currently discussing the ideas of health and environmental justice. The basic idea around health is that we should not just focus on health equality, but also health equity. Sometimes members of socially disadvantaged groups may need support to achieve their health goals. 
Environmental injustice is defined as the the racial discrimination in environmental policy making and the enforcement of regulations and laws; the deliberate targeting of people of color communities for toxic and hazardous waste facilities; the official sanctioning of the life-threatening presence of poisons and pollutants in our communities.
Below are two links, the first to a TED talk we watched about ""greening the ghetto,"" detailing a woman's fight for environmental justice in the South Bronx, and the second link is to a case study on the intersection of health and environmental justice in Louisiana.
https://www.ted.com/talks/majora_carter_s_tale_of_urban_renewal#t-960911
http://www.msnbc.com/interactives/geography-of-poverty/se.html

Do you agree that the color of your skin, your education level, your income and socio-economic status, gender, and sexual orientation have an effect on your health and environmental justice?"
Affordable Rubbish & Waste Removal,1,1.0,633txe,https://goodbyejunk.com.au/affordable-rubbish-waste-removal/,0,2017-4-3,
Discovery of Florida panther kittens near Everglades buoys hope for the endangered cats,1,1.0,632w5r,http://www.latimes.com/nation/la-na-florida-panther-20170401-story.htmlen,0,2017-4-3,
"Climate Progress, With or Without Trump",1,1.0,62mq2v,https://www.nytimes.com/2017/03/31/opinion/climate-progress-with-or-without-trump.html,0,2017-4-1,
"DELIVERING PEOPLE, PACKAGES, AND PROMISES OF A GREENER TODAY",1,1.0,62kyeq,https://www.reddit.com/r/Enviroment/comments/62kyeq/delivering_people_packages_and_promises_of_a/,0,2017-3-31,"In today’s world, it has become important for both individuals and companies to work to do their bit for preserving the environment and look at the way that reduces carbon footprint. Worldwide, there is focus and attention to, along with widespread awareness of the impact on our world. There is an increased enlightenment and realization that we each must do our bit to contribute to helping the environment and reducing the negative impact to it. DOT is a one of a kind Green Mobility solutions providing [green bike taxi service](http://gowithdot.com/) for individuals, corporate and events to be able to contribute to the betterment of the environment through a reduction in their carbon footprint. DOT's green logistics are popular across all metro stations where they are operational, and they are great for first and last mile connectivity. 

DOT follows a PPP Model and by this, the organization means: it Promises to Deliver People and Packages on Green Modes of Transportation comprising [environment friendly](http://gowithdot.com/) electric vehicles. DOT connects people from metro or bus stations to their destination through ebikes. DOT's delivery solution is rapidly being adopted by many businesses that choose to go green by replacing existing vehicles used in delivery with sustainable electric vehicles operated by DOT. With Delhi/NCR’s air quality having been found to have deadly PM2.5 levels that are 10 times higher than the safety limit prescribed by the World Health Organisation (WHO), and four times higher than even the Indian safety limits in a recent air monitoring survey, DOT’s first initiative has been piloted in the National Capital Region (NCR). This one of a kind go green project, the DOT green bike taxi service offers customers and corporate clients effective, pocket-friendly and environmental safe [green logistics](http://gowithdot.com/) to deliver people, packages, and promises. Through this project, the aim is to help its citizens make Delhi/NCR a better place to live, by helping to reduce the now alarming pollution levels in the city and thereby bettering the air quality in the city. The need for sustainable, reliable, consistent, comfortable, efficient and cost-effective transport options for last mile connectivity and the need for efficiency in reaching the desired destination safely, within a prescribed, reasonable time frame is a problem area that DOT addresses. The newly introduced e-bikes are the perfect antidote for Delhi’s challenges. Combined with transport solutions which are easier on the environment and work to reduce carbon emissions, DOT’s transport solutions are both smart and efficient alternate solutions which help to make the city a healthier place to live in. The added focus on ethics and standards of service are ensured by the end to end processes within DOT which focus on necessary background checks for selected drivers for e-bikes, along with necessary training, and regular checks, with added security measures like GPS devices installed in the e-bikes.

It’s time global warming is taken seriously and we do our part in ensuring that the future generations have a greener world to live in. Becoming [environment friendly](http://gowithdot.com/) is the only way forward, and DOT is your ideal partner. 
"
The Dark Legacy of China’s Drive for Global Resources,1,1.0,62efmh,http://e360.yale.edu/features/the-dark-legacy-of-chinas-drive-for-global-resources,0,2017-3-30,
Burn away that 100 kg Bio waste in An our with this super high performance incinerator only costing 15000$,1,0.66,62cw6v,https://www.youtube.com/watch?v=yusptwmVN1A&t=222s,0,2017-3-30,
House Science Committee Calls on Alt-Science to Drive Policy,1,1.0,62ayy5,https://www.scientificamerican.com/article/house-science-committee-calls-on-alt-science-to-drive-policy/,0,2017-3-30,
We Don't Know The Environmental Effects Of Junking Half A Million Volkswagen Diesels,1,1.0,626j9d,http://jalopnik.com/we-dont-know-the-environmental-effects-of-junking-half-1793622815,0,2017-3-29,
Terrorism? The true poison of our time is pollution.,1,1.0,61zs68,http://weedworldsnwine.blogspot.co.uk/,0,2017-3-28,
"10,000 years ago? That was climate change. Today? Not so much",1,0.54,61yzxk,http://www.bostonglobe.com/opinion/letters/2017/03/26/years-ago-that-was-climate-change-today-not-much/0YaEcY9qxaFIDFb5omFEbL/story.html#comments,1,2017-3-28,
18 Million U.S. Citizens Exposed to Lead-Contaminated Water Systems,1,1.0,61an41,http://therealnews.com/t2/index.php?option=com_content&task=view&id=31&Itemid=74&jumival=18728,0,2017-3-25,
We really don't know clouds at all,1,1.0,60tw6s,http://www.dw.com/en/we-really-dont-know-clouds-at-all/a-38052668,0,2017-3-22,
Electrifying the Northern Transcon?,1,1.0,5xxd9i,http://trn.trains.com/news/news-wire/2017/02/28-electrifying-the-northern-transcon,0,2017-3-7,
How to Reduce your Carbon Foot Print while On the Internet.,1,0.67,5pttdt,https://www.youtube.com/watch?v=hyyeO6TUjpw&list=PL8TC5LCUPfittvtLGO799e3XFc3JYFHhh&index=6,0,2017-1-24,
Join the Model Green Socialist Party!,1,1.0,5mvbo3,https://www.reddit.com/r/Enviroment/comments/5mvbo3/join_the_model_green_socialist_party/,0,2017-1-9,"/r/ModelUSGov is a simulation of the United States Government, complete with different political parties. One such party, the Green-Socialist Party (a non-sectarian political party with an ecological focus), is looking for new members and needs your support to help us keep the lights on. The simulation is complete with six state governments, Congress, the Presidency, and judiciaries at both levels; there's room for everyone to participate!
If you are interested in becoming a member, comment that you'd like to join (https://www.reddit.com/r/Enviroment/submit?selftext=true)[in this thread]
Talk to you soon.
In Solidarity."
The Chesapeake Bay Watershed,1,1.0,5gwinb,http://earthobservatory.nasa.gov/Features/Chesapeake/?src=eoa-features,0,2016-12-7,
The first bullet point is contradicted with every other bullet point to follow!,1,0.67,5fqs3n,https://www.donaldjtrump.com/policies/energy/,0,2016-12-1,
Care about social and environmental effects? If you’d like to help retailers become more aware of these issues please take this short 2 minute survey. Your thoughts are really important to us and many others!,1,1.0,5btvf1,https://carlota17.typeform.com/to/Ug0g7e,0,2016-11-8,
Fort Custer prepares for climate change,1,1.0,59j2nh,http://www.battlecreekenquirer.com/story/news/local/2016/10/25/fort-custer-prepares-climate-change/92733194/,0,2016-10-27,
Create an Environment for Success,1,1.0,58s4v8,http://caleblaieski.blogspot.com/2016/10/the-environment-of-success.html,0,2016-10-22,
Growing food with seawater and solar power,1,0.67,58otm2,http://www.aljazeera.com/indepth/features/2016/10/growing-food-seawater-solar-power-161019174224231.html,0,2016-10-22,
The National Park Service Turns 100 Today,1,1.0,4zix6z,http://www.popsci.com/national-park-service-turns-100-today,0,2016-8-25,
The West Closure Complex Protects 3 Parishes In New Orleans From Flooding,1,1.0,4zdxlr,http://www.creedla.com/west-closure-complex-protects-3-parishes-new-orleans-flooding/,0,2016-8-25,
Blower Machine hand made,1,1.0,4ytbbd,https://www.youtube.com/watch?v=FTKT0UqE7wg,0,2016-8-21,
The ripple effects of shellfish fisheries,1,1.0,4szsmx,http://conservationmagazine.org/2016/07/ripple-effects-shellfish-fisheries/,0,2016-7-15,
South West Surveys,1,1.0,4pxxus,http://www.southwestsurveys.co.uk/,0,2016-6-26,
‘Environmental breakdown’: Florida Bay hit with huge seagrass die-off,1,0.58,4gtb72,https://www.rt.com/usa/341197-florida-bay-hit-dying-seagrass/,0,2016-4-28,
Future Grains,1,1.0,4cwlny,https://www.nasa.gov/offices/oct/feature/future-grains,0,2016-4-2,
Even Biggest Mine in Cheapest U.S. Coal Region Is Suffering,1,1.0,4cu31j,http://www.bloomberg.com/news/articles/2016-03-31/even-biggest-mine-in-cheapest-region-is-victim-of-coal-collapse,0,2016-4-1,
Louisiana's Disappearing Coast Takes Ancient History With It,1,1.0,48ftgi,http://wwno.org/post/louisianas-disappearing-coast-takes-ancient-history-it,0,2016-3-1,
"The convenience of Ecommerce, and the waste that ensues",1,1.0,4685sj,http://www.nytimes.com/2016/02/16/science/recycling-cardboard-online-shopping-environment.html?mwrsm=Reddit,0,2016-2-17,
Calls to protect Scotland's pregnant beavers,1,1.0,43j2wn,http://www.bbc.com/news/science-environment-35453483,0,2016-1-31,
Pretty much the truth,1,1.0,43h490,https://www.linkedin.com/pulse/canada-leave-ground-let-others-profit-jeff-houck,0,2016-1-31,
"How would you help your local watershed in a feasible, but creative manner?",1,1.0,40hcln,https://www.reddit.com/r/Enviroment/comments/40hcln/how_would_you_help_your_local_watershed_in_a/,0,2016-1-11,
Not what you expect of a beach in Hawaii - times they are a changing,1,1.0,3zs3ts,http://ecogreenlove.com/2016/01/06/plastic-pacificocean/,0,2016-1-7,
Acid rain damage still visible in Krkonoše National Park,1,1.0,3yrrm6,http://i.imgur.com/Hoq1j1f.jpg,0,2015-12-30,
Can Anything Live Forever?,1,1.0,3ap24d,http://www.bbc.com/earth/story/20150622-can-anything-live-forever,0,2015-6-22,
What Bill Nye Got Wrong in His About-Face on GMOs,3,0.6,38rix5,http://civileats.com/2015/06/03/what-bill-nye-got-wrong-in-his-about-face-on-gmos/,0,2015-6-6,
Community Service Vlog ( Mysterious Bird? ),1,1.0,35w3dr,https://www.youtube.com/attribution_link?a=kjs4e6IAKr4&u=%2Fwatch%3Fv%3Dg-uIDCoSF_4%26feature%3Dshare,0,2015-5-14,
What is Cradle to Cradle?,1,1.0,35neyd,https://www.youtube.com/watch?v=fP8PRA-OajU,0,2015-5-12,
Survey for my Environmental Science class.,1,1.0,35mi67,https://docs.google.com/forms/d/16NiKaPzXKL6wbWF8cLsqZG8hJ3zjVem3YJ-0o-Bde8s/viewform?usp=send_form,0,2015-5-12,
EARTH DAY SONG by Pete Seeger and Oscar the Grouch!,1,1.0,33jbct,https://www.reddit.com/r/Enviroment/comments/33jbct/earth_day_song_by_pete_seeger_and_oscar_the_grouch/,0,2015-4-23,"EARTH DAY
Please sing this song and pass it on to everyone you know. Garbage, written by Bill Steele is one of the most important songs about the environment. It has been recorded twice by Pete Seeger. Here is Pete singing it with the help of Oscar the Grouch.
https://soundcloud.com/thefirstrainbow/garbage-by-bill-steele-sung-by"
Solving the Four Corners Mystery: Probes Map Methane 'Hot Spot',1,1.0,324gvt,http://www.livescience.com/50439-solving-methane-hot-spot-mystery.html,0,2015-4-10,
California regulators fine PG&E a record $1.6 billion for San Bruno blast,1,0.6,320zww,http://www.latimes.com/business/la-fi-puc-fine-20150409-story.html,0,2015-4-10,
Is Global Collapse Imminent? An Updated Comparison of The Limits to Growth with Historical Data,1,0.6,31lwr1,http://sustainable.unimelb.edu.au/sites/default/files/docs/MSSI-ResearchPaper-4_Turner_2014.pdf,0,2015-4-6,
Damnation- a documentary highlighting the failed eniromental/political. Worth a watch.,1,1.0,31ebq7,http://www.aftenposten.no/webtv/#!/video/100360/dokumentar-damnation,0,2015-4-4,
Gillibrand Amdt. No. 48 - Rejected (35/63) To modify the definition of underground injection. (X-Post from r/SenateRollCallVotes),1,0.67,30cho3,http://www.senate.gov/legislative/LIS/roll_call_lists/roll_call_vote_cfm.cfm?congress=114&session=1&vote=00041,0,2015-3-26,
Don't Drill NC - Not The Answer,1,1.0,2ywt00,http://jana-murray.com/dont-drill-nc-not-the-answer/,0,2015-3-13,
Turning e waste into art,1,1.0,2xc7i7,http://free-computer-recycling.blogin.com.au/turning-e-waste-into-art/,0,2015-2-27,
"An Art Teacher’s Assignment: Promote Creative Ethical and Fair Trade Products on Life, Health and Style Show",1,0.67,2sd0jk,http://www.sustainable-life-with-lisa.com/blog/an-art-teachers-assignment-promote-creative-ethical-and-fair-trade-products-on-life-health-and-style-show,1,2015-1-14,
READY FOR MY CLOSE UP: SPREADING THE WORD ABOUT ETHICAL SHOPPING AND FAIR TRADE PRODUCTS,1,0.67,2s8r10,http://thegreenseahorse.com/ethical-shopping-and-fair-trade-products/,1,2015-1-13,
Dangers of fracking.,1,0.66,2rn6c2,https://www.reddit.com/r/Enviroment/comments/2rn6c2/dangers_of_fracking/,0,2015-1-8,"After a great deal of research I am left awfully puzzled on the dangers of fracking. After watching all the documentaries and reading a handful of articles I can find and trying to see both sides I'm left being very confused. I can see a lot of dangers obviously, but how dangerous is it really? How accurate are movies like gassland and fracknation? I've watched both documentaries and I don't know which one is more accurate. I feel like most things I read are anti fracking and may be a little biased, but I am not sure what these people who are against fracking have to lose besides home values and their health ect. Which would honestly lead to a better conclusion than energy companies that have millions to lose. At the same time fracknation seems to have no money from energy companies (from the little research I have done) and the journalist may just be doing it for attention (although almost all of the people interviewed in the film stand to lose money if fracking is ceased), but it has honestly left me not knowing what to think. So i guess my question is where can I find the best information on the dangers and exactly how much damage has been done by fracking? "
Republicans plan 'Keystone Blitz',1,1.0,2r8hhm,http://thehill.com/policy/energy-environment/228407-gop-prepares-keystone-blitz,0,2015-1-4,
Lima Talks Leave Some Upset,1,0.66,2pc09h,http://news.islandcrisis.net/2014/12/lima-climate-talks-receives-mixed-reviews/,1,2014-12-15,
"Geoengineering, A Clear And Present Danger on the Outer Banks, NC",1,0.66,2oseni,http://jana-murray.com/geoengineering-clear-present-danger-outer-bank-nc/,0,2014-12-10,
Can China Turn Carbon Capture into a Water Feature?,1,1.0,2o8isx,http://spectrum.ieee.org/energywise/green-tech/clean-coal/can-china-turn-carbon-capture-into-a-water-feature/?utm_source=energywise&utm_medium=email&utm_campaign=120314,0,2014-12-4,
"In the desert near Joshua Tree National Park, a debate over the future of an old iron mine is intensifying",1,0.6,2mx5oq,http://www.desertsun.com/story/news/environment/2014/11/20/eagle-mountain-mine-joshua-tree-future/70013970/,0,2014-11-21,
Obama Puts Australia's Climate-Denying Prime Minister on the Spot,1,1.0,2mkiym,http://www.newrepublic.com/article/120292/2014-g20-summit-obama-challenges-abbott-climate-change,0,2014-11-18,
"Clean consciousness, dirty digging. Are E-cars environmentally friendly?",1,0.66,2mdup6,http://utrikesperspektiv.se/?p=764,0,2014-11-15,
A research essay on GMOs and Organics,1,0.6,2gizp2,http://agreatbigmudpuddle.blogspot.ca/2014/08/a-wonderful-story-gmos.html,0,2014-9-16,
Join TweetStorm & Social Media Storm for the Whales in the Faroe Islands!,1,0.6,2bii46,https://www.reddit.com/r/Enviroment/comments/2bii46/join_tweetstorm_social_media_storm_for_the_whales/,1,2014-7-24,"Join https://www.facebook.com/events/1394874837404069/?ref_dashboard_filter=upcoming

This is a GLOBAL movement!

Thanks!"
N.D. Pipeline Leaks 1 Million Gallons of Saltwater Into Lake That Provides Drinking Water For American Indian Reservation,1,1.0,2abtzl,http://www.huffingtonpost.com/2014/07/10/nd-pipeline-leaks_n_5573114.html?utm_hp_ref=green,0,2014-7-10,
Solar Panel System – Riverside County & Los Angeles,1,1.0,26i7ui,http://bestsolarsavings.com/,0,2014-5-26,
How will the Keystone XL pipeline affect our farmers and farmland?,1,0.66,252l7p,http://www.farmaid.org/site/apps/nlnet/content2.aspx?c=qlI5IhNVJsE&b=2723877&ct=13932403&notoc=1&msource=apr14news,0,2014-5-9,
Latest ENSO report for April,1,0.56,22rvlz,https://www.reddit.com/r/Enviroment/comments/22rvlz/latest_enso_report_for_april/,0,2014-4-11,http://www.cpc.ncep.noaa.gov/products/analysis_monitoring/enso_advisory/ensodisc.html
BBC News - Megadams: Battle on the Brahmaputra,1,1.0,210b6s,http://www.bbc.com/news/world-asia-india-26663820,0,2014-3-22,
Report: DC’s green-approved buildings using more energy,1,0.57,1ziolb,http://dailycaller.com/2014/03/02/report-dcs-green-approved-buildings-using-more-energy/,0,2014-3-4,
US Trade Rep can't figure out if Trans-Pacific Partnership will protect the environment,1,1.0,1zcsvt,http://boingboing.net/2014/03/01/us-trade-rep-cant-figure-out.html#more-290027,1,2014-3-3,
Cape Town’s First Eco Film Festival!,1,1.0,1yivll,http://www.sustainable.co.za/blog/2014/02/cape-towns-first-eco-film-festival/?utm_source=rss&utm_medium=rss&utm_campaign=cape-towns-first-eco-film-festival,0,2014-2-21,
hilarious video about the impending doom of the great barrier reef.,1,1.0,1ybv4c,https://www.youtube.com/watch?v=x53Rf0Aq1X0#t=238,0,2014-2-19,
Sustainability Consultants and Adviser,1,1.0,1xsmnb,http://www.impactsustainability.com.au/,0,2014-2-13,
Spain adopts policies that HURT wind and other renewable energy sources,1,1.0,1x5taa,https://www.reddit.com/r/Enviroment/comments/1x5taa/spain_adopts_policies_that_hurt_wind_and_other/,0,2014-2-6,"The Portuguese Renewable Energy Association (APREN) put out a note in its website… it explains Spain will move forward with its plans to eliminate all subsidies to wind parks built before 2004; but the problem is in the case of Spain it will affect 8,440MW out of the 22,800MW installed base – or 37% of its capacity. In addition to that, those wind parks built after 2004 or the remainder of the wind installed capacity – will see a 50% cut on subsidies. The wind energy association explained those firms affected by the new policy will have to deal with financial difficulties associated with a sudden lower cash flow and, in addition to that, will have to be forced to depreciate their assets a lot faster. In other words if we increase depreciation, net profit will fall…so it is a double whammy: cut in revenue and increase in depreciation. The note mentioned wind, solar will not be the only ones affected, as the new rules will be extended to 14 waste management plants, to  1,000 micro-hydro facilities, to 63 biomass plants and 127 biogas plants as well.
It is difficult to imagine any scenario where the odds could be so much against renewables as this outcome. It is important for governments to understand they need to create a stable environment where businesses can plan and operate… in addition to that, governments should not renege on their promises either for that generates unnecessary uncertainty in those markets. It is important for us to understand the accelerated depreciation and cut in cash flow will be a severe punch on those firm’s financials: investors – which include pension funds – have an expectation of return and will not be pleased with this sudden change; it will also be more difficult for utilities to invest in Wind – or other renewables for that matter – for fear the government will yet again change its mind and renege on something else. Governments cannot treat private enterprise as a punching bag… private firms are needed in order to conduct applied research and they take all of the risk on R&D investing, so they do perform an important role in society and the deployment of clean energies. 
We need to use social media to voice our discontent with Spain’s policies… if the wave catches on, we might see similar policies in Europe and elsewhere – which hurts the interests of those who believe we should be working faster to reduce carbon emissions; if anything, Spain’s policies are doing the opposite. 
Link: http://phoenixeconomist.blogspot.com/2014/02/spain-cuts-subsidies-to-wind-other.html "
Source: Duke Energy spill still happening as of this evening,1,1.0,1wxz7q,http://coalashchronicles.tumblr.com/post/75536812952/source-duke-energy-spill-still-happening-as-of-this,0,2014-2-4,
"Danville, VA, water treatment officials say they've cleaned up Duke Energy's coal ash spill in Eden, NC",1,1.0,1wxu0l,http://danville-va.gov/CivicAlerts.aspx?AID=1508,0,2014-2-4,
Vince Cable doesn't want you to know your biscuits story,1,1.0,1vyyr4,http://www.youtube.com/attribution_link?a=Hpp2L3lBzpE&u=%2Fwatch%3Fv%3D3KC6xqJXmgU%26feature%3Dshare,0,2014-1-24,
