title,score,upv_ratio,id,url,comms_num,created,body
I heard reddit members together can change the world! Any chance you can help me get votes to replace all plastic bags with recycled ones? Please help if you can - all I need is for you to hit the vote button,4,0.84,1qdzne,https://www.reddit.com/r/Enviroment/comments/1qdzne/i_heard_reddit_members_together_can_change_the/,1,2013-11-12,"http://www.avivacommunityfund.org/ideas/acf18717
https://www.facebook.com/ZEROPlasticBags?ref=br_tf


Simply put, plastic pollution is a killer. Plastic bags from the grocery are responsible for everything from ugly litter to the death of wildlife. There is a simple yet effective way to completely eradicate all these harmful plastic bags.
Description
Recyclable bags is a great way to reduce these devastating numbers but the fact is, we often forget to carry our recyclable bags to the supermarkets. Then as human beings we don’t mind paying that mere 5 cents to get a plastic bag or even go to a store where they will provide us with bags to carry our products home. Such small every day subconscious behaviors are devastatingly contributing to long-term global warming effects and other natural disasters.

We can drastically change these statistics through a simple yet effective way of substituting these harmful plastic bags with 100% cotton meshed, natural and compostable bags. It may sound unconventional but a number of countries have followed this route including South Africa, Kenya, Uganda and Bangladesh.

Aviva’s Community fund will help us start a sustainable environment project to dramatically reduce plastic bags in Penticton and the surrounding Okanagan community. It will provide businesses and communities to an alternative option and provide a creative solution to reduce their impact on the environment.

Aviva’s community fund will help with the initial purchase and distribution of these 100% ecofriendly bags to all retail outlets, whereby encouraging the consumer to choose these ecofriendly bags instead of plastic bags. This step will also provide an avenue to educate both staff and the general public through informative brochures and posters. A lot of people will be curious about it at first, and when they find out what it’s for, they will be excited to become a part of it. When consumers opt to pay for a shopping bag, they will be given a choice to either purchase a plastic bag, or go with a 100% cotton bag for 0.15 cents. The price for the 100% ecofriendly bag could be lowered even further if a grocery store is willing to match the customer donations for each 0.5 cents. Perhaps this option will help shift the mindset of retail stores to eventually convert to a 100% free from plastic shopping bags.

This type of exposure, thanks to Aviva’s funds, can and will help us achieve a strategic alliance with retailers in order to attain a common goal of working towards a plastic free environment and sustaining our environment. It will help us to partner with Greener Footprints to work with retailers and the community to establish plastic bag free towns across Canada. This will create publicity for the town and the concept at a local, provincial, and a national level. Thanks to Aviva we can take that one important step of choosing to become a completely plastic bag free Canada. "
More bad bee news: Bees' foraging for flowers 'hampered by diesel exhaust,6,0.76,1npvzv,http://www.bbc.co.uk/news/24364637,0,2013-10-4,
Has anyone read this book? What are your thoughts about them?,4,1.0,1fztx5,https://www.reddit.com/r/Enviroment/comments/1fztx5/has_anyone_read_this_book_what_are_your_thoughts/,0,2013-6-10,"http://www.amazon.com/Energy-Myths-Realities-Bringing-Science/product-reviews/0844743283/ref=dp_top_cm_cr_acr_txt?ie=UTF8&showViewpoints=1

http://www.goodreads.com/book/show/853851.The_Deep_Hot_Biosphere"
Trying to reduce my use of single use plastic.,5,1.0,1eeetr,https://www.reddit.com/r/Enviroment/comments/1eeetr/trying_to_reduce_my_use_of_single_use_plastic/,1,2013-5-16,"I recently watched a doc about the major environmental downsides of plastic. I want to try to reduce my use of single use plastics. I'm already do small obvious things like no bottled water and no straws but I want reduce or stop using plastic bags. I don't want to buy some $30 hemp bag either. How did people pack lunches before plastic bags? Butcher or wax paper? IF it is that, is there a trick to folding it so the contents don't fall out?"
This guy is a hero for Earth Day. He deserves some attention!,3,0.81,1culg5,http://www.youtube.com/user/RealWorldGreen,0,2013-4-22,
Prime Minister’s Office Tries to Silence Pipeline Critics; Labels Environmental Group“Enemy of the Government of Canada” and “Enemy of the people of Canada,3,0.81,1ccee8,http://www.scribd.com/doc/79228736/Whistleblower-s-Open-Letter-to-Canadians,0,2013-4-15,
Earth Hour 2013,5,1.0,1at4p2,http://www.pla.net.nz/2013/03/earth-hour-2013/,1,2013-3-23,
How YOU Can Easily Plant Some New Trees!,3,1.0,a03nvl,https://trybe.one/how-you-can-easily-plant-some-new-trees/,0,2018-11-25,
"P&O cruise ship dumped 27,000 litres of waste on Great Barrier Reef, Senate hears",3,1.0,9qbr67,https://www.theguardian.com/environment/2018/oct/22/po-cruise-ship-dumped-27000-litres-of-waste-on-great-barrier-reef-senate-hears,0,2018-10-22,
Enviroment poem. Kinda needed to share my friends work with someone who cares.,3,1.0,804pxs,https://www.instagram.com/p/Bfn05mQDxVa/?taken-by=lupinpoetry,0,2018-2-25,
The hidden plastic in our dinner?,3,0.81,7z6vjf,https://medium.com/@dhruvboruah/the-hidden-plastic-in-our-dinner-6eee42cf991,0,2018-2-22,
Global Energy Perspective 2018 - By Sustainable Brands.com,3,0.81,7xjj2e,http://blog-turismo-sustentabilidade.blogspot.com/2018/02/global-energy-perspective-2018.html,0,2018-2-15,
A Powerful Mix of Solar and Batteries Is Beating Natural Gas,3,0.81,7x7b7d,https://www.bloomberg.com/news/articles/2018-02-12/a-powerful-mix-of-solar-and-batteries-is-beating-natural-gas,0,2018-2-13,
Memphis is currently fighting to keep the TVA from using drinking water from the aquifer for a power plant. Here is a link to some information about what the dangers are and what is being done.,3,0.81,7wufej,http://protectouraquifer.org,0,2018-2-12,
Most of the EPA's pollution estimates are unreliable. So why is everyone still using them?,3,0.81,7woxic,https://www.publicintegrity.org/2018/01/29/21492/most-epas-pollution-estimates-are-unreliable-so-why-everyone-still-using-them,0,2018-2-11,
Pictures of the year: Environment,3,1.0,7n3fau,https://www.reuters.com/news/picture/pictures-of-the-year-environment-idUSRTX3KPA8,0,2017-12-31,
Trump has announced his decision to effectively eliminate Bears Ears and vast portions of Grand Staircase-Escalante national monuments,3,1.0,7hjwao,https://wilderness.org/blog/trump-paves-way-miningdrilling-effectively-eliminates-bears-ears-and-deeply-cuts-grand-staircase,1,2017-12-5,
A new report says more needs to be done to protect the Great Lakes,3,1.0,7gdopi,http://michiganradio.org/post/new-report-says-more-needs-be-done-protect-great-lakes,0,2017-11-29,
"Special Report: Revolt at Trump’s Pro-Coal, Pro-Nuclear & Pro-Gas Panel Rocks U.N. Climate Summit",3,1.0,7cwxfn,https://www.democracynow.org/2017/11/14/special_report_revolt_at_trumps_pro,0,2017-11-15,
EPA head met with a mining CEO -- and then pushed forward a controversial mining project,3,1.0,71wik5,http://www.cnn.com/2017/09/22/politics/pebble-epa-bristol-bay-invs/index.html,0,2017-9-23,
Want to improve your working and living conditions? Start thinking about green buildings,3,1.0,708y10,http://blog.lightinus.com/get-the-most-out-of-green-building-design-with-smart-solar-street-lights,0,2017-9-15,
Stephen Hawking warns humans will have to leave Earth in another 100 years to survive,3,0.72,691aow,https://www.yahoo.com/news/stephen-hawking-warns-humans-leave-114313402.html,1,2017-5-4,
Donald Trump's first 100 days have been an incredible success...For climate change deniers,3,1.0,68llva,http://www.motherjones.com/environment/2017/04/trumps-real-success-his-first-100-days,0,2017-5-1,
Earth belongs to all mankind equally; let's not destroy it: Ayatollah Khamenei,3,0.8,671f8s,http://english.khamenei.ir/news/4773/Earth-belongs-to-all-mankind-equally-let-s-not-destroy-it-Ayatollah,0,2017-4-23,
"World is home to '60,000 tree species' - BBC News",3,1.0,63kw8d,http://www.bbc.com/news/science-environment-39492977,0,2017-4-5,
"Fewer than 1 percent of papers published in scientific journals follow the scientific method, according to research by Wharton School professor and forecasting expert J. Scott Armstrong.",3,0.62,62artc,http://www.breitbart.com/tech/2017/03/29/j-scott-armstrong-fraction-1-papers-scientific-journals-follow-scientific-method/,0,2017-3-30,
EU leads attacks on Trump's rollback of Obama climate policy,3,1.0,625cft,https://www.theguardian.com/environment/2017/mar/28/climate-change-eu-leader-trump-executive-order,0,2017-3-29,
"There's an algae bloom the size of Mexico in the Arabian Sea right now, and it's not good",3,1.0,61l1ht,http://www.sciencealert.com/there-s-an-algae-bloom-the-size-of-mexico-in-the-arabian-sea-right-now-and-it-s-not-a-good-sign,1,2017-3-26,
What is with the lack of public discussion on the health and environmental dangers caused by emamectin in Scottish lochs?,3,1.0,5z05mg,https://www.reddit.com/r/Enviroment/comments/5z05mg/what_is_with_the_lack_of_public_discussion_on_the/,0,2017-3-13,"Over the last month or so there have been issues brought to public attention by the Sunday herald regarding pesticides (mainly emamectin)  used in aquaculture in Scotland which have contaminated 45 lochs, being harmful to human health and the environment alike.
What is with the lack of public discussion on the health and environmental dangers caused by emamectin in Scottish lochs?
as a second question where is the industry's response to these issues?

Relevant articles:
http://www.heraldscotland.com/news/15134408.Crackdown_on_fish_farm_pesticides_after_Sunday_Herald_investigation/

http://www.heraldscotland.com/news/15118242.Revealed__Scandal_of_45_Scottish_lochs_trashed_by_pollution/"
GOP chairman seeks $50M to transfer federal land,3,1.0,5ybuzg,http://thehill.com/policy/energy-environment/322537-gop-chairman-seeks-50m-to-transfer-federal-land,1,2017-3-9,
California Environmental Assessment – Serving California,3,1.0,5y6vsq,https://andenviro.com/about-us/,0,2017-3-8,
"A surge in strandings of dolphins, other marine mammals on Cape Cod",3,1.0,5xvwlt,http://abcnews.go.com/US/surge-strandings-dolphins-marine-mammals-cape-cod/story?id=45908105,0,2017-3-7,
Cold Adaption [If you want to lower your heating indoors],3,1.0,5hphg7,http://addicted2cold.com/wp-content/uploads/2016/02/Cold-Adaption.pdf,0,2016-12-11,
The Most Dangerous Place on Earth to Be an Environmentalist,3,1.0,5g0s0g,http://www.outsideonline.com/2136786/most-dangerous-place-earth-be-environmentalist?utm_source=dispatch&utm_medium=newsletter&utm_campaign=12012016&spMailingID=27217338&spUserID=MTI1MDYwNDA5NzA4S0&spJobID=940164671&spReportId=OTQwMTY0NjcxS0,0,2016-12-2,
Trump and his stance on climate change.,4,1.0,5crtmc,https://www.reddit.com/r/Enviroment/comments/5crtmc/trump_and_his_stance_on_climate_change/,1,2016-11-14,"The main things I'm worried about the Trump vote are the implications on climate change. What do you think Trump will do? And, if he continues to deny it and its effects, what can we do to help save our world?"
US scientists find new way to convert CO2 to green fuel,3,0.81,592c0c,http://www.aljazeera.com/news/2016/10/scientists-find-convert-c02-green-fuel-161020204550567.html,2,2016-10-24,
Trump ‘Completely Rethinks’ U.S. Energy Policy By Doubling Down On Fossil Fuels,3,0.63,4x34tq,https://thinkprogress.org/trump-energy-policy-bcfb0573222b#.3i27oil2q,0,2016-8-11,
Plastic waste dumped in UK seas 'carried to Arctic within two years',3,1.0,4rcgtk,https://www.theguardian.com/environment/2016/jul/05/plastic-waste-dumped-in-uk-seas-carried-to-arctic-within-two-years,0,2016-7-5,
Mysterious 'Zombie bee' scourge reaches southern US,3,0.71,4pnx2b,http://hosted.ap.org/dynamic/stories/U/US_ZOMBIE_BEES?SITE=AP&SECTION=HOME&TEMPLATE=DEFAULT&CTIME=2016-06-23-13-46-5,0,2016-6-25,
"The ash tree is likely to be wiped out in Europe, according to the largest-ever survey of the species.",3,0.71,4bl6tm,http://www.bbc.com/news/science-environment-35876621,0,2016-3-23,
What The Candidates Say About Climate Change,3,1.0,47d01c,http://hereandnow.wbur.org/2016/02/23/candidates-views-on-climate-change,0,2016-2-24,
Energy subsidies paid four times more for fossil fuels than renewable sources.,3,1.0,3vhcpm,http://www.economist.com/blogs/economist-explains/2015/07/economist-explains-19,0,2015-12-5,
What's fueling the rise of coccolithophores in the oceans?,3,1.0,3uwtor,http://www.csmonitor.com/Science/2015/1128/What-s-fueling-the-rise-of-coccolithophores-in-the-oceans,0,2015-12-1,
Global warming will progress faster than what was previously believed. The reason is that greenhouse gas emissions that arise naturally are also affected by increased temperatures. This has been confirmed in a new study that measures natural methane emissions.,3,1.0,3ukbfq,http://www.sciencedaily.com/releases/2015/11/151126104037.htm,0,2015-11-28,
Do you think about the source of wood when you buy furniture?,3,1.0,3ubqw8,https://www.ewhomefurniture.co.uk/fsc/,0,2015-11-26,
Brazil's greatest ecological disaster is happening right now.,3,0.81,3t130v,https://www.facebook.com/manuelzozoiaca/videos/934130626656555/,1,2015-11-16,
"""Bill Nye's Global Meltdown"" on National Geographic Explorer",3,1.0,3syobs,https://www.youtube.com/watch?v=ra1M7XyyIDA,0,2015-11-16,
"Legendary surfer, environmental activist and musician: Rob Machado Interview at The Belly Up in San Diego",3,1.0,3sbo0s,https://soundcloud.com/belly-up/episode-022-rob-machado?in=belly-up/sets/podcast-episodes,0,2015-11-11,
"New EPA report warns of potential large-scale lead releases in Flint, Michigan, water",3,1.0,3rmngs,http://www.mlive.com/news/flint/index.ssf/2015/11/new_epa_report_warns_of_potent.html,0,2015-11-5,
"New invasive insect found in Michigan, damages crops",3,1.0,3npjtf,http://www.mlive.com/weather/index.ssf/2015/10/new_invasive_insect_found_in_m.html#incart_river_home,0,2015-10-6,
Senators urge NASA to continue monitoring Lake Erie,3,1.0,3nmqon,http://www.freep.com/story/news/politics/2015/10/05/senators-urge-nasa-continue-monitoring-lake-erie/73397776/,0,2015-10-6,
Rating System for Companies,3,1.0,3c4ctf,https://www.reddit.com/r/Enviroment/comments/3c4ctf/rating_system_for_companies/,0,2015-7-5,"I got this Idea now for a while and because I am still struggling with it if it is a good one I wanted to share it to get some feedback of you guys.
So basically it is a Platform like Tripadvisor or your local Pizza app where User can rate a company.
But instead of rating their products, you are rating the working conditions, the processes/raw materials they use, their emission and so on.
Companies with better conditions could be examples and they will make profit from having a greener image, because its good advertising! They could share their knowledge to other companies which maybe don't even know that there is a better way of producing. 
It's in my head now for a while and I couldn't find anything similar on the internet, maybe you know a website?
"
Information on activism.,3,1.0,37slg9,https://www.reddit.com/r/Enviroment/comments/37slg9/information_on_activism/,0,2015-5-30,"I've been searching online for information on how to get started in a career in environmental activism. Most of the groups and job boards I come across seem too be looking for college graduates.  My main question is how would other people who feel just as passionate about the movement get involved.

I understand that anyone can protest or petition. And I've already changed may aspects of my life. But I'm looking for info on how to work with an organization or start my own? How would I deal with cost and logistics? How do I get my message to a wider audience? I would like to leave my current dead end job and work in activism full time. "
"(X-Post from SenateRollCallVotes) Bernie Sanders tried ""to establish a deficit-neutral reserve fund to recognize that climate change is real and caused by human activity and that Congress needs to take action to cut carbon pollution,"" but Congress Rejected it.",3,1.0,30br3w,http://www.senate.gov/legislative/LIS/roll_call_lists/roll_call_vote_cfm.cfm?congress=114&session=1&vote=00089,1,2015-3-26,
Hey guys! I am doing a project on green energy and I was wondering if you could complete a quick survey for me,3,1.0,2ymh3f,https://www.surveymonkey.com/s/89SWGMF,1,2015-3-11,
Second crude pipeline spill in Montana wreaks havoc on Yellowstone River,3,0.8,2t9bqk,http://america.aljazeera.com/articles/2015/1/21/oil-pipeline-burst.html,0,2015-1-22,
Court ruling reduces BP's oil spill fines by billions of dollars,3,0.8,2sosq2,http://thinkprogress.org/climate/2015/01/16/3612393/judge-rules-on-bp-oil-spill-size/?utm_source=email&utm_medium=cptop3&utm_campaign=cptop3&elq=~~eloqua..type--emailfield..syntax--recipientid~~&elqCampaignId=~~eloqua..type--campaign..campaignid--0..fieldname--id~~,0,2015-1-17,
Find out why recycling is important for the planet and your future.,3,1.0,2sdnt3,http://www.metalrecyclinghouston.com/why-is-recycling-helpful-to-the-environment/,0,2015-1-14,
Community Passes Resolution Banning Neonicotinoids [pesticide that kills honey bees and may be related to hike collapse],3,1.0,24z53o,http://www.beyondpesticides.org/dailynewsblog/?p=12881,0,2014-5-8,
NASA- Climate Change in the U.S.,3,1.0,24wtxa,http://climate.nasa.gov/system/documents/file_attachments/NCA3_Climate_Change_Impacts_in_the_United_States_LowRes.pdf,0,2014-5-7,
Saving Water,3,1.0,24hftr,https://www.youtube.com/watch?v=Vt7hIk_jZww,0,2014-5-2,
North American snow cover at 3rd-highest level on record,3,0.81,1zolqa,http://www.usatoday.com/story/weather/2014/03/05/north-america-snow-cover/6089667/,0,2014-3-6,
Trees are your Friends,3,1.0,1ygbjs,http://www.youtube.com/attribution_link?a=8Gu5RUMI5bg&u=%2Fwatch%3Fv%3DuNZUFIFS9q4%26feature%3Dshare,0,2014-2-21,
The Environmental Disaster That is the Gold Industry - The mining industry has had a devastating impact on ecosystems worldwide. Is there any hope in sight?,3,0.71,1y27ek,http://www.smithsonianmag.com/science-nature/environmental-disaster-gold-industry-180949762/,0,2014-2-16,
Human Extinction Without a Squeak?,3,1.0,1ku6bx,http://www.exposingthetruth.co/human-extinction-without-a-squeak/#axzz2cdwnAY1V,0,2013-8-22,
Bernie Krause: The voice of the natural world,3,1.0,1iiczj,http://www.youtube.com/watch?v=uTbA-mxo858,0,2013-7-18,
"Sustainability must be at core of development, says EU | Global development",3,1.0,1ieami,http://www.guardian.co.uk/global-development/2013/jul/12/sustainability-core-development-eu,0,2013-7-16,
That @$%#! lynx is back!,3,1.0,1ia0tc,http://www.guardian.co.uk/environment/2013/jul/14/spain-iberian-lynx-extinction,0,2013-7-14,
Mercury Levels in Michigan Fish National Wildlife Federation Scientists,3,1.0,1i5n3e,http://www.youtube.com/watch?v=WQIg-T7fX6Y&feature=share,0,2013-7-12,
Oslo’s Burning Issue: It Needs U.S. Garbage to Power Itself,3,1.0,1dp05y,http://www.takepart.com/article/2013/05/01/energy-from-waste-alternative-energy-sources-oslo-norway?cmpid=tpenviro-eml-2013-5-04-norway,0,2013-5-5,
You Can Drive Clean! Here are 10 Tips from the Detailing Knights…,3,1.0,1blgog,http://www.detailingknights.com/drive-clean-tips/,0,2013-4-4,
Sewage plants struggle to treat wastewater produced by fracking operations. Water from natural gas production still contains high levels of contaminants after going through the water treatment plants. /crosspost from Science,3,1.0,1amc1j,http://cen.acs.org/articles/91/web/2013/03/Sewage-Plants-Struggle-Treat-Wastewater.html,0,2013-3-20,
The End of Growth (Jeff Rubin and David Suzuki),3,1.0,1adant,http://www.cbc.ca/ideas/episodes/2013/03/13/the-end-of-growth/,1,2013-3-16,
Oh you frackers!,3,1.0,19gt11,http://www.environmentamerica.org/news/nce/nc-senate-votes-lift-fracking-moratorium,1,2013-3-1,
'Not a Mistake': NASA in Disbelief over Rate of Melting Ice | Greenland ice sheet melted at unprecedented rate during July,3,1.0,x6x3v,http://www.commondreams.org/headline/2012/07/25-0,1,2012-7-26,
Trump administration approves seismic tests that could harm thousands of Atlantic dolphins and whales,2,1.0,a2nxg6,https://www.washingtonpost.com/energy-environment/2018/11/30/trump-administration-approves-seismic-tests-that-could-harm-many-thousands-atlantic-dolphins-whales,0,2018-12-3,
Is this taking endangered species things too far? taking private land because maybe it could be with some modification br turned into labd that woukd support an endangered frog?,2,1.0,a19j2x,https://nyti.ms/2DNzpSg?smid=nytcore-ios-share,1,2018-11-29,
Soluzioni semplici e innovative per ridurre le emissioni di CO2,2,1.0,a03z9p,https://trybe.one/soluzioni-semplici-e-innovative-per-ridurre-le-emissioni-di-co2/,0,2018-11-25,
Smoke Makes Victims,2,1.0,9zslmk,https://www.reddit.com/r/Enviroment/comments/9zslmk/smoke_makes_victims/,0,2018-11-24, [https://trybe.one/smoke-makes-victims/](https://trybe.one/smoke-makes-victims/) 
I’m 14 and I got deployed in Belgium and it’s just sad to see the US ruin their environment,2,0.67,9wno1c,https://www.reddit.com/r/Enviroment/comments/9wno1c/im_14_and_i_got_deployed_in_belgium_and_its_just/,1,2018-11-13,
Nitrogen Oxides can NOx you out! (And everyone else on this planet...),2,1.0,8j8kp5,http://www.gcesystems.com/nox/,0,2018-5-14,
What our kids think.,2,1.0,8h32qi,https://youtu.be/Tg90aFwN-Ew,0,2018-5-5,
Lignite mining: Greece’s dirty secret - in pictures,2,0.75,86zhsb,https://www.theguardian.com/environment/2018/mar/23/lignite-mining-greeces-dirty-secret-in-pictures,0,2018-3-25,
Trump signs resolution to permit dumping mining waste into waterways,2,1.0,82j9sk,https://www.washingtonpost.com/videonational/president-trump-signs-resolution-to-permit-mining-waste-dumping-in-waterways/2017/02/21/cde426aa-f84b-11e6-aa1e-5f735ee31334_video.html?utm_term=.0881cb956504,0,2018-3-7,
Corals are dissolving away,2,1.0,804tin,https://www.reddit.com/r/Enviroment/comments/804tin/corals_are_dissolving_away/,0,2018-2-25,
"My friend just launched this website. How can he get more sales? Thanks, Reddit!!!",2,0.76,7ytr39,https://rootblue.org/,0,2018-2-20,
Forest Gardens for Closing the Global Carbon Cycle,2,0.76,7x3irc,https://www.biochar-journal.org/en/ct/88-Forest-Gardens-for-Closing-the-Global-Carbon-Cycle-,0,2018-2-13,
Texas wildlife refuge could become fierce battleground over Trump's proposed border wall,2,1.0,7wh5fq,https://a.msn.com/r/2/BBIVzuE?m=en-us,0,2018-2-10,
STP Manufacturer India,2,1.0,7w34e1,http://www.ssenggcorp.com/,0,2018-2-8,
Meet the Trash Pirates who environmentally restore music festival venues,2,0.76,7onuio,https://www.youtube.com/watch?v=TXCh4as7zDk,0,2018-1-7,
Imagining the Jellyfish Apocalypse,2,1.0,7icv9w,https://www.theatlantic.com/magazine/archive/2018/01/listening-to-jellyfish/546542/,0,2017-12-8,
Russia confirms 'extremely high' readings of radioactive pollution,2,1.0,7ecr47,https://phys.org/news/2017-11-russia-extremely-high-radioactive-pollution.html,0,2017-11-21,
Paleo food Mexico,2,1.0,7c7p4y,https://www.reddit.com/r/Enviroment/comments/7c7p4y/paleo_food_mexico/,0,2017-11-11,"At organic now, you can find paleo bread in low price. Our toast up like regular bread has an amazing taste, curbs appetite and best of all product is deliver the customer.  This bread provides the protein and fiber to your body which needs to satisfy hunger while helping your body to perform at its peak."
How toxic is your car exhaust,2,1.0,78091g,http://www.bbc.co.uk/news/resources/idt-sh/how_toxic_is_your_car_exhaust,0,2017-10-22,
Companys that work with NGO´s,2,1.0,74gfmr,https://www.reddit.com/r/Enviroment/comments/74gfmr/companys_that_work_with_ngos/,2,2017-10-5,"Anyone looking for a watch that makes a bit more sense than a Rolex???
I am a part of a start-up where we partner with NGO´s all over the world to make high-quality watches that donate money to good causes.

All our watches have a unique serial number on its back. Once you get a Nordgreen watch, you can donate ""some of the watch"" to a good cause with the number. Go to the www.nordgreen.com website and choose between:

- Fight deforestation and preserve 200sqm of rainforest Central America.
- Provide two months of clean drinking water to a child in the Central African Republic.
- Give two months of education to a child in India.

What do you guys think about the idea, design and is it something you would consider buying? Suggestions to improvements are also welcome! I would love to hear your opinions.

As a thank you I can share my personal employee link so you can get a $30 gift card to our shop when we go live.
https://nordgreen.com/r/1/OLIVER1"
If something doesn't change soon billions will die of starvation.,2,1.0,6m2oy8,https://www.youtube.com/watch?v=QkPBam3qO34&ab_channel=VICE,0,2017-7-9,
"Air pollution more harmful to children in cars than outside, warns top scientist | Environment",2,1.0,6gsayd,https://www.theguardian.com/environment/2017/jun/12/children-risk-air-pollution-cars-former-uk-chief-scientist-warns,2,2017-6-12,
5 Ways To Save On Your Power Bill,2,1.0,6gra1u,http://solarbay.com.au/ways-save-power-bill/,0,2017-6-12,
Climate Change Survey,2,1.0,6beq8h,https://docs.google.com/a/mcpsmd.net/forms/d/1AfeMrisYVqED5EsKRDCeRCexMkfk_RB9B1SoZfBdgDA/edit#responses,1,2017-5-16,
Trump executive order aims to allow Arctic drilling - BBC News,2,1.0,689qlo,http://www.bbc.com/news/world-us-canada-39753223,0,2017-4-29,
