title,score,upv_ratio,id,url,comms_num,created,body
Preview of the May 8th Seattle Protest of Chase Banks (to block KXL),2,1.0,686xo4,https://m.youtube.com/watch?v=81DSUubmeVo,0,2017-4-29,
"Long-term fate of tropical forests may not be as dire as believed, says CU Boulder study",2,1.0,684l5j,https://scienmag.com/long-term-fate-of-tropical-forests-may-not-be-as-dire-as-believed-says-cu-boulder-study/,0,2017-4-29,
A Message From the End of the World,2,1.0,63gj7v,https://www.nytimes.com/2017/03/31/opinion/a-message-from-the-end-of-the-world.html,0,2017-4-5,
Tidal Turbine Maker Bids to Turn U.K. Into a Green Saudi Arabia,2,1.0,635cgs,https://www.bloomberg.com/news/articles/2017-04-03/tidal-turbine-maker-bids-to-turn-u-k-into-a-green-saudi-arabia,0,2017-4-3,
"At a congressional hearing on climate science today, 3 climate deniers and 1 mainstream climate scientist present",2,1.0,62bnmy,http://www.motherjones.com/environment/2017/03/michael-mann-lamar-smith-house-science-committee,0,2017-3-30,
"Humans Produce So Much Junk, We Are Creating a New Geological Layer",2,1.0,626n4t,http://www.slate.com/articles/technology/future_tense/2017/03/humans_are_creating_a_new_geological_layer_of_technofossils.html,0,2017-3-29,
Cycle freight: why the bike is good for moving more than people | Environment,2,1.0,626189,https://www.theguardian.com/environment/bike-blog/2017/mar/29/cycle-freight-why-the-bike-is-good-for-moving-more-than-people,0,2017-3-29,
Trump is on a rampage to endanger the planet. Now it’s up to us to save it.,2,1.0,624e2l,https://www.washingtonpost.com/opinions/trump-is-on-a-rampage-to-endanger-the-planet-now-its-up-to-us-to-save-it/2017/03/28/62790e5a-13d3-11e7-ada0-1489b735b3a3_story.html,0,2017-3-29,
"Maryland Fracking Ban To Become Law, With Nationwide Implications",2,1.0,621fiy,http://www.thebaynet.com/articles/0317/maryland-fracking-ban-to-become-law-with-nationwide-implications.html,0,2017-3-29,
"The owner of an underwater pipeline leaking processed natural gas will temporarily shut down the gas production that feeds the line. The pipeline is leaking an estimated 193,000 to 215,000 cubic feet of gas a day into Alaska's Cook Inlet, which contains endangered beluga whales",2,0.75,61hg8a,http://www.startribune.com/owner-of-leaking-alaska-pipeline-to-halt-natural-gas-flow/417092073/,0,2017-3-26,
MUST WATCH On Bacteria Crisis Across America,2,1.0,61g2zh,https://www.youtube.com/attribution_link?a=3mFTPZpCLb4&u=%2Fwatch%3Fv%3DemGKyGObb80%26feature%3Dshare,0,2017-3-25,
solid waste management - an easy introduction,2,1.0,5z6kbl,https://www.youtube.com/attribution_link?a=MkkgD1OoxKE&u=%2Fwatch%3Fv%3DlDrIGTnTuBI%26feature%3Dshare,0,2017-3-14,
Facts about Rubbish and Rubbish Removal that you probably didn’t know!,2,1.0,5ye53m,https://goodbyejunk.com.au/facts-about-rubbish-and-rubbish-removal-that-you-probably-didnt-know/,0,2017-3-9,
Australia's 'extreme' summer a sign of things to come: researchers,2,1.0,5y6l0k,http://www.reuters.com/article/us-australia-heatwave-climatechange-idUSKBN16F0LX,0,2017-3-8,
Anderson Environmental – Proudly Serving All of Alberta,2,1.0,5xy9cu,https://andenviro.ca/about-us/,0,2017-3-7,
Poachers kill rare giant elephant in Kenya,2,1.0,5xxuvu,https://www.yahoo.com/news/poachers-kill-rare-giant-elephant-kenya-152539665.html,1,2017-3-7,
"I want to call my senators about repealing the Endangered Species Act, but I'm not sure how.",2,0.76,5um7ga,https://www.reddit.com/r/Enviroment/comments/5um7ga/i_want_to_call_my_senators_about_repealing_the/,2,2017-2-17,"I apologize if this has been answered before, or for any formatting errors, as I am new to Reddit. Like the title says, I am deeply concerned for the protections of our endangered species and animals in general, and I'd like to voice my opinion to whoever I may need to, I'm just not sure what to say or who to say it to. I live in Georgia, so I'm assuming I would speak with my senators Johnny Isakson and David Perdue, but what do I say when I call them? Or is it already too late? Any advice would be appreciated! "
The secret trade in baby chimps,2,1.0,5r6yh9,http://www.bbc.co.uk/news/resources/idt-5e8c4bac-c236-4cd9-bacc-db96d733f6cf,0,2017-1-31,
Want to know what you all think about climate change!!,2,0.76,5r4bkl,https://www.surveymonkey.com/r/2VWWDJ5,0,2017-1-31,
Have we learned the lessons from the history of London fogs?,2,1.0,5qwkth,https://www.theguardian.com/environment/2017/jan/29/london-fog-air-pollution-history-christine-corton,0,2017-1-30,
The 10 species most at risk from climate change,2,0.76,5ovbzb,https://www.theguardian.com/environment/2017/jan/19/critical-10-species-at-risk-climate-change-endangered-world,0,2017-1-19,
U.S. EPA Accuses Fiat Chrysler of Excess Diesel Emssions,2,1.0,5nkohl,http://fortune.com/2017/01/12/fiat-chrysler-diesel-emissions-epa/,0,2017-1-13,
Arctic ice melt could trigger uncontrollable climate change at global level,2,0.67,5eu145,https://www.theguardian.com/environment/2016/nov/25/arctic-ice-melt-trigger-uncontrollable-climate-change-global-level,0,2016-11-25,
"Web Comic for enviromental news, what's happening in the world?",2,1.0,4x59y1,https://www.reddit.com/r/Enviroment/comments/4x59y1/web_comic_for_enviromental_news_whats_happening/,0,2016-8-11,"Hey i wanna draw a comic about enviromental issues and  corporate rape on our home, do you know what's happening in the world right now?

are the chinese cutting forest in guatemala?

canadians mining dirty ores in Romania, curroption on deforestation there too.

But i wanted to know every issue happening now(sources too please!), and make it an online comic with true content.

i'll also talk about trangenics, bigdata, borders, ilegal imigrants, those kind of things.

"
China's urban air quality improves in first half: ministry,2,0.76,4tdjiy,http://www.reuters.com/article/us-china-environment-pollution-idUSKCN0ZX098,0,2016-7-18,
The Ice Fields of Patagonia,2,1.0,4785xe,http://www.nasa.gov/image-feature/the-ice-fields-of-patagonia,0,2016-2-24,
I made this images for enviromental awareness. Do you think they could work?,2,1.0,44l9lg,http://imgur.com/gallery/p2afD,0,2016-2-7,
The Seabin Project - In-Water Automated Marina Rubbish Collector,2,1.0,3xt83m,http://www.seabinproject.com/,0,2015-12-22,
AUA this Monday with the Carnegie Endowment for International Peace on the implications of the COP21 agreement on /r/geopolitics,2,1.0,3wp0q3,http://imgur.com/BpuqiFU,1,2015-12-14,
Clean Energy,2,1.0,3vyz4p,https://www.youtube.com/watch?v=9sBGsLhI01g,1,2015-12-9,
1st week of COP21 in Paris: what has happened so far?,2,1.0,3vs3pp,http://unitedexplanations.org/english/2015/12/07/1st-week-of-cop21-in-paris-what-has-happened-so-far/,0,2015-12-7,
Green Fire Engineered Reclamation | Waste To Wealth,2,1.0,3u5o1t,http://greenfireeng.com/?p=278#.VlUOUOqLNWQ.reddit,0,2015-11-25,
Solar Power Systems,2,1.0,3t54n9,http://www.solarwide.com.au/about/the-solarwide-advantage,0,2015-11-17,
Luke Lamb Sarasota,2,0.75,3lf8e9,https://www.reddit.com/r/Enviroment/comments/3lf8e9/luke_lamb_sarasota/,0,2015-9-18,"His interest in the affairs of the Gulf Coast has given Luke Lamb the inspiration to pursue everything he can involving its waters. When he is not operating his forestry equipment dealership, Tree Frog Equipment LLC, he is out on the waters, boating across the oceans and looking for more. "
Golar kickstarter campain,2,1.0,3aeq4z,https://www.reddit.com/r/Enviroment/comments/3aeq4z/golar_kickstarter_campain/,0,2015-6-19,"Recently found it and backed. Anyone interested? Do you have any thoughts?

https://www.kickstarter.com/projects/1510072781/golar-the-fully-portable-solar-panel-on-the-go
"
Reddit: Anyone with a holistic (economic + other) cost analysis of Trees vs. Digital for a unit of books?,2,1.0,3ad3sl,https://www.reddit.com/r/Enviroment/comments/3ad3sl/reddit_anyone_with_a_holistic_economic_other_cost/,0,2015-6-19,"Wonder if someone has done any analysis... Cost would include every direct & indirect cost:     
- for trees, cost of growing, maintenance, ENVIRONMENTAL, shipping, paper production, etc.     
- for digital, cost of display, computer production, data transfers, power production, etc     
Assuming that the benefits are similar, ie, both are equally readable."
UPDATE 1-BP executive acquitted of lying about Gulf of Mexico oil spill,2,1.0,38qvsb,http://in.reuters.com/article/2015/06/05/usa-court-bp-idINL1N0YR1NA20150605,0,2015-6-6,
Bureau of Land Management has plans to tear up Joshua Tree to install over 10k miles of Off-roading trails. Please help us spread the word and sign this quick petition to save our desert.,2,1.0,38an5p,http://action.biologicaldiversity.org/p/dia/action3/common/public/?action_KEY=17317,0,2015-6-3,
WELCOMING 2015: A GREENER MINDSET AND HEALTHIER LIFESTYLE,2,0.75,2rp2x3,http://thegreenseahorse.com/welcoming-2015-a-greener-mindset-and-healthier-lifestyle/,1,2015-1-8,
Breaking Party Ranks on EPA Science Vote [good breakdown of who voted to change EPA advisory board rules.],2,1.0,2orrcf,https://www.opensecrets.org/news/2014/11/breaking-party-ranks-on-epa-science-vote/,0,2014-12-10,
Half the worlds wildlife lost since 1970.,2,0.75,2i6osf,http://www.livescience.com/48086-half-wildlife-lost-since-1970.html,1,2014-10-3,
Re-Wilding,2,1.0,2gvd0d,http://thepilgrimsdigress.com/2014/09/19/re-wilding/,0,2014-9-20,
"Documentary Shamans Of The Amazon 2002 Dmt, Ayahuasca, Mckenna",2,1.0,2gfnn7,http://www.youtube.com/attribution_link?a=bwy7x5aZN6A&u=%2Fwatch%3Fv%3DCa1TGqODjzM%26feature%3Dshare,1,2014-9-15,
The Archdruid On Americas Future Enviroment And Climate,2,0.76,2dtakw,http://thearchdruidreport.blogspot.com/2014/08/dark-age-america-bitter-legacy.html,1,2014-8-18,
"Study: Species disappearing 10x faster than before humans. Species of plants and animals are becoming extinct at least 1,000 times faster than they did before humans arrived on the scene, and the world is on the brink of a sixth great extinction, a new study says. /from science",2,0.75,26w5q7,http://www.postbulletin.com/news/politics/study-species-disappearing-far-faster-than-before/article_deac8a71-da45-51a2-933e-cc634130dde9.html,0,2014-5-31,
The Study Of Water Well Drilling Apparatus,2,1.0,259z57,https://www.reddit.com/r/Enviroment/comments/259z57/the_study_of_water_well_drilling_apparatus/,0,2014-5-11,"Patrick Briody & Sons Ltd, was established in the late 1950’s by Patrick Briody.At the time the drilling method used in Ireland was primarily cable tool percussion and the client base was generally private domestic water wells."
What You Can Do At Home - Climate Change,2,1.0,23nl3f,http://www.epa.gov/climatechange/wycd/home.html,0,2014-4-22,
"Some metallic toys and low-cost jewelry present health risks for young children, study shows",2,0.76,1zpzka,http://www.polymtl.ca/carrefour/en/article.php?no=4360,1,2014-3-6,
"A ""major enigma"" has been cracked in atmospheric chemistry, revealing the details of a negative feedback mechanism which could ""actually limit climate change from reaching such levels that it could become really a problem in the world"".",2,0.75,1zeinm,http://www.theregister.co.uk/2014/02/27/natural_pine_aerosols_could_prevent_climate_change_really_being_a_problem/,1,2014-3-3,
"The Ultimate Guide to Shutting Down Climate Trolls - Next time someone tells you that snowy weather means global warming isn't real, you'll know exactly how to respond.",2,0.67,1y2a0n,http://www.alternet.org/environment/ultimate-guide-shutting-down-climate-trolls?paging=off&current_page=1#bookmark,1,2014-2-16,
Environmental Groups Call for Immediate Disclosure of Magnitude of Coal Ash Disaster -- Southern Alliance for Clean Energy,2,1.0,1wxr6d,http://www.cleanenergy.org/environmental-groups-call-for-immediate-disclosure-of-magnitude-of-coal-ash-disaster/,0,2014-2-4,
"I am Michael Brune, executive director of the Sierra Club. The environment chapter of a dangerous trade deal was just leaked by WikiLeaks. AMA! : IAmA",2,1.0,1vdlkn,http://www.reddit.com/r/IAmA/comments/1vdjpg/i_am_michael_brune_executive_director_of_the/,0,2014-1-17,
White House asks the people not to believe the arguments which say that the recent Polar vertex of cold weather disproves global warming. Do you agree with White House explanation?,2,0.75,1usdw6,http://www.youtube.com/watch?v=IHJQhKQIZYg,1,2014-1-9,
"Petition Oil & Gas Companies Would Impose $5,000 Fee for Protesting Drilling Projects",2,0.76,1s83yo,https://petitions.whitehouse.gov/petition/oil-gas-companies-would-impose-5000-fee-protesting-drilling-projects/bX3XpX5q,0,2013-12-6,
House passes bill to encourage onshore energy production,2,1.0,1rh8fn,https://www.reddit.com/r/Enviroment/comments/1rh8fn/house_passes_bill_to_encourage_onshore_energy/,0,2013-11-26,"[http://www.pennenergy.com/articles/pennenergy/2013/11/house-passes-bill-to-encourage-onshore-energy-production.html](http://www.pennenergy.com/articles/pennenergy/2013/11/house-passes-bill-to-encourage-onshore-energy-production.html)

Wednesday, the House of Representatives passed H.R. 1965, the Federal Lands and Energy Security Act of 2013, with a bipartisan vote of 228-192. This package of bills would protect and expand onshore [American energy production](http://kenzieduncan.blogspot.com/2013/01/asia-global-energy-review-14-trillion.html) and create new American jobs by streamlining government red-tape and regulations. Also, this legislation would establish an efficient and effective process to responsibly produce both renewable and conventional energy on our federal lands as part of a true all-of-the-above approach American energy production.

“For far too long the Obama Administration has deliberately blocked increased energy exploration and development in America, causing both oil and natural gas production on federal land to decline since President Obama took office. The real growth in American energy production is happening on state and private lands and this bill would bring that growth to federal lands,” said Natural Resources Committee Chairman Doc Hastings (WA-04). “This legislation unleashes America’s energy potential on federal lands by streamlining the federal permitting process and opening up proven energy reserves to increased energy production in places like the National Petroleum Reserve-Alaska. The passage of this legislation today is an important step forward to increase much-needed energy production in America that will create jobs, grow the economy, and make energy more affordable for hardworking American families.”

H.R. 1965, the Federal Lands Jobs and Energy Security Act of 2013, includes the following five Natural Resources bills:
Federal Lands Jobs and Energy Security Act (Lamborn CO-05) - This bill would reform the leasing process for onshore oil and natural gas projects on federal lands to eliminate unnecessary delays; reform the process for energy permitting, once a lease is in hand, to encourage the timely development of our federal resources; ensure funds are available for efficient wind and solar permitting; and set clear rules for the development of U.S. oil shale resources.

Planning for American Energy Act (Tipton, CO-03) - This bill would establish common sense steps to create an all-of-the-above American energy plan for using federal lands to meet our Nation’s energy needs.

National Petroleum Reserve Alaska Access Act (Hastings, WA-04) - This bill would cut through bureaucratic red tape to unlock the full potential of energy resources in the National Petroleum Reserve-Alaska (NPR-A) by ensuring that oil and natural gas are developed and transported in a timely and efficient manner.

BLM Live Internet Auctions Act (Johnson, OH-06) - This bill would give the Secretary of the Interior the authority to conduct internet-based auctions for onshore leases to ensure the best return to the Federal taxpayer, reduce fraud, and secure the leasing process.

Native American Energy Act (Young, AK-At Large) - This bill would streamline burdensome and duplicative government regulations and remove the barriers erected by the Obama Administration that are blocking Indian tribes from developing energy resources on their own land and creating new jobs."
Taking Root Tree Planting Campaign,2,1.0,1mv00y,https://www.reddit.com/r/Enviroment/comments/1mv00y/taking_root_tree_planting_campaign/,0,2013-9-22,"The Taking Root campaign is currently in 4th place for a $50,000 grant, and whether you live in Cincinnati or not, it's affects will be felt by everyone in the Midwest.

Within a few years, the Ash family of trees (which represents roughly 10% of all the trees in Ohio) will be extinct, and literally nothing can prevent it. This project will help replace some of what has been lost.
I am asking that you take a few minutes to click the link below and vote for the Taking Roots Campaign. Voting ends on the 27th, so please vote now and make a lasting difference in Ohio’s horticultural future.

Thank you


http://bigideacincinnati.com/entries/1080"
Nation-to-nation peer pressure may be best hope for global climate deal,2,0.62,1mpk50,http://www.nbcnews.com/science/nation-nation-peer-pressure-may-be-best-hope-global-climate-4B11190183,0,2013-9-19,
"Got bees, anyone?",2,1.0,1kto15,http://www.mscheevious.com/daily-mischief/a-life-in-which-i-come-to-terms-with-bees/,1,2013-8-22,
Parnell must do right thing for Alaska's salmon habitat,2,1.0,1k57l5,http://www.alaskadispatch.com/article/20130810/parnell-must-do-right-thing-alaskas-salmon-habitat,0,2013-8-11,
World Water Day: A reminder that the U.S. is running out of fresh water,2,1.0,1at75b,http://shr.tn/62UV,0,2013-3-23,
"Judge Rules In Favor Of Journalists, Unseals Fracking Court Records",2,1.0,1aqb1t,http://earthjustice.org/news/press/2013/judge-rules-in-favor-of-journalists-unseals-fracking-court-records,0,2013-3-21,
"An Algerian project to touch a beautiful region , I need you guys",2,1.0,19pv2u,https://www.reddit.com/r/Enviroment/comments/19pv2u/an_algerian_project_to_touch_a_beautiful_region_i/,0,2013-3-6,"Hi,


I need you guys to sign a petition on this site that will help save the region from an oil related project.


I will appreciate your help , and I thank everyone that will take the time to sign it.


Petition and more informations about the project :
http://www.avaaz.org/fr/petition/Non_au_projet_de_complexe_petrochimique_a_Guerbes_Sanhadja_SkikdaAlgerie


Thank you , this will take a little bit of your time , but it might help save an entire PLACE from being wrecked and ruined.

"
Floating Islands: one Answer to Nutrient Pollution along the Upper Mississippi,2,0.76,18ov16,http://green.blogs.nytimes.com/2013/02/15/floating-islands-to-the-rescue/,0,2013-2-17,
"Fish is dying in Midwest rivers, lakes and streams.Linked to hot, dry summer. The climate change happens faster than anyone predicted. ",2,0.57,xs0xo,http://news.yahoo.com/thousands-fish-die-midwest-streams-heat-183228110.html,8,2012-8-7,
How to solve the energy crisis.,2,0.76,pv5ha,http://i41.tinypic.com/2nsumfc.png,1,2012-2-18,
Environmentally Concious Educational Children's Toy Survey,1,1.0,9s42y1,https://www.reddit.com/r/Enviroment/comments/9s42y1/environmentally_concious_educational_childrens/,0,2018-10-28,"Hi!  

This semester I am working with a team of students to develop a new product for the children's educational toy industry. We have created a survey to better understand our target market and their preferences. If you could please take 5 minutes to complete this survey and pass it along to anyone who is a current parent, grandparent, aunt, or uncle, it would be greatly appreciated! I have included the link below.  

r/https://bostonu.qualtrics.com/jfe/form/SV_6D7wBWNTcyCcvB3  

Please let me know if you run into any issues, thank you!"
The Peoples Walk For Wildlife #PeoplesWalkforWildlife,1,0.67,9riinh,https://www.youtube.com/watch?v=w7N14yGMJNI,0,2018-10-26,
"California, New Mexico sue over Trump methane pollution rollback",1,0.67,9h9xbo,https://thehill.com/policy/energy-environment/407383-california-new-mexico-sue-over-trump-methane-pollution-rollback,0,2018-9-20,
Scientists have assembled research exposing industry denial of disappearing caribou,1,1.0,8urugb,https://www.nationalobserver.com/2018/06/27/news/scientific-study-shows-logging-industry-disinformation-caribou-uses-climate-denial,0,2018-6-29,
Wyoming plan to spend up to $22.5 million in public funds to expand a coal mine even as its owner appears headed for bankruptcy and a key customer prepares to curtail consumption.,1,1.0,8j4ryb,http://www.gillettenewsrecord.com/news/wyoming/article_b22d9053-0c58-5c4c-98b1-431e647dae45.html,0,2018-5-14,
The Hazards of Invasive Species,1,1.0,8ii2ga,https://www.youtube.com/watch?v=4hkWzfZrhBQ&t=10s,0,2018-5-11,
International standards consultant Mongolia,1,1.0,8h2kao,http://sustainability.net.au/wp-content/uploads/2016/08/POL_Environment-and-Community-Policy-2016.pdf,0,2018-5-5,
What is 'In Commerce' on Vimeo,1,1.0,8epqbe,https://vimeo.com/261801409,0,2018-4-25,
"Visualizing Every Species In Danger of Extinction, And The Reason Why",1,1.0,8bm70g,https://public.tableau.com/views/species_under_threat_SWD_Apr_2018/species_under_threat?:embed=y&:display_count=yes,0,2018-4-12,
"Visualizing Every Species In Danger of Extinction, And The Reason Why",1,1.0,8blwk8,https://public.tableau.com/views/species_under_threat_SWD_Apr_2018/species_under_threat?:embed=y&:display_count=yes,0,2018-4-12,
Future 'ocean cities' need green engineering above and below the waterline,1,0.66,87c164,https://theconversation.com/future-ocean-cities-need-green-engineering-above-and-below-the-waterline-93843?utm_medium=email&utm_campaign=Latest%20from%20The%20Conversation%20for%20March%2027%202018%20-%2097878477&utm_content=Latest%20from%20The%20Conversation%20for%20March%2027%202018%20-%2097878477+CID_f62eeb81b46dd63a57631e98bad9acff&utm_source=campaign_monitor&utm_term=Future%20ocean%20cities%20need%20green%20engineering%20above%20and%20below%20the%20waterline,0,2018-3-27,
Saving Earth from Harmful Effects of the Global Warming,1,1.0,876ti4,http://www.articleted.com/article/11434/2758/Saving-Earth-from-Harmful-Effects-of-the-Global-Warming,2,2018-3-26,
Help save the world in under one minute!,1,0.67,83q7ul,https://www.reddit.com/r/Enviroment/comments/83q7ul/help_save_the_world_in_under_one_minute/,0,2018-3-12,"I hope I am not wrong for posting this here. Please let me know before you kick me from the subreddit. I just wanted to share a great opportunity for anyone that purchases ANYTHING online to help save the environment and offset global warming. If I break the rules it is because this is a FREE and PASSIVE way to save the earth in under one (1) minute of effort. 

TL;DR Signing up, in only one minute,  connects users to a platform that uses 66% of  commissions from 3500+ business partners to support Reforestation and Protection Projects, Methane Capture at Landfills, and Renewable Energy Technology installations. AT NO COST TO USERS! Link is at the bottom of the page.

Full disclosure I am a Student Sustainability Coordinator at my University. I am also serving as a Brand Ambassador for Ucapture on my Campus. It is important to say that the carbon offsets generated by user activity are recorded under the name of the school that referred the user to our platform. This is why I posted a personalized link. With your help, my university can offset a meaningful portion of our carbon footprint without blowing the sustainability budget. Our goal is to offset 30% of our 100,000 metric ton annual carbon footprint.

Ucapture is a FREE google browser extension that activates automatically on any given partner’s website. If you sign up now an email will be sent when extensions are back up and running on Firefox and Safari. There is also an iPhone app, but the extension is the best because it is passive. 

 If the businesses are a partner then they pay a commission on your purchase, at no cost to you! Ucapture uses two-thirds of commissions earned to fund carbon offset projects. Currently Ucapture averages eight pounds of carbon offset per dollar spent with our partners. Take Expedia an average person’s foot print from a flight is about 1000lbs of CO2. If bought as a Ucapture partner, avg ticket price $110, Ucapture can offset 800-1200lbs annually for the length of the project (8-15yrs). So one plane ticket could offset 10,000lbs over the projects life!  Most of the time it offsets the entire flight, but even if you don’t fly that is still less than $10 of online spending a MONTH
Some partners don’t even have a large carbon footprint, so the offset is higher. These projects are certified for the carbon offset by agencies like the Climate Action Reserve (CAR).

Ucapture has over 3,500 business partners such as Best Buy, Budget, Dish, Fandango, Groupon, and Walmart. With the amount and variety of partners it has never been easier to support projects such as reforestation, renewable energy technology, and methane capture at landfills (26X denser that CO2). It only takes one minute to take advantage of this platform and help slow global warming. The attached link will take you to the sign-up page. After signing up, install the browser extension in the upper right corner and you’re done! It really does only take one minute! 

The browser extension will also automatically pull up any applicable coupons for your purchase. Ucapture offers a way to push the cost of environmentalism back onto the corporations and businesses. I think Ucapture has alot of potential and the more poeple that use it the more change we can create. Please take one minute to save your wallet and save the Earth.

Sign-Up: www.ucapture.com/krisk

Over 380 tons offset in 700+ acre Arcata Forest Reserve

https://youtu.be/kFWarbIfkzI

Over 1,000 Tons Offset at Wolf Creek Landfill

https://www.ucapture.com/projects-items/wolf-creek-landfill/ "
