title,score,upv_ratio,id,url,comms_num,created,body
The NBA's poisoned China chalice,444,0.93,dfasop,https://www.reddit.com/r/geopolitics/comments/dfasop/the_nbas_poisoned_china_chalice/,237,2019-10-9,"# INTRODUCTION

There have been many articles talking about the rift between NBA and China. While, some might not consider this a worthy topic for this sub, but I think its very important, because of the following reasons

* Generated considerable media attention in both US and China
* Shows Chinese influence in corporate America
* A sign of deepening ideological rift between America and China

The article I will be looking at is from Sinocism  [**The NBA's poisoned China chalice**](https://sinocism.com/p/the-nbas-poisoned-china-chalice)

Now there are a lot of people who might not like me writing about this, as they didn't like the previous post  [Overview of China Influence and Interference Activities in Australia](https://www.reddit.com/r/geopolitics/comments/ddbfg7/overview_of_china_influence_and_interference/)

There was a post the other day titled [What is the maximum pressure the US can put on China short of war?](https://www.reddit.com/r/geopolitics/comments/dep6y9/what_is_the_maximum_pressure_the_us_can_put_on/) And some one wrote the following

>China understand this well, so it intentionally avoid escalate the  current struggle into ideological fight, which would cause a new cold  war. that's why it never put huge effort like RT of Russia. CGTN rarely  trash USA, most of the time it only promotes domestic development.

Is it really non-ideological? According to George Kennan's Long Telegram  which he sent as Charge d'Affair at American embassy in Moscow in 1946, the Soviet Union posed a threat to liberal democracy at Home (ie the US). This Long Telegram served as a basis for the US Containment policy of the Soviet Union.

>In summary, we have here a political force committed fanatically to the belief that with US there can be no permanent modus vivendi that it is desirable and necessary that the internal harmony of our society be disrupted, our traditional way of life be destroyed,

During the Cold War, the Soviet Union couldn't get an institution anywhere as influential as  the NBA to force an American to censor what he said so openly and blatantly, like how China pressured the NBA with regards to  Daryl Morey  Had this happened in the 1960s, the NBA would be investigated under [Foreign Agents Registration Act (FARA)](https://en.wikipedia.org/wiki/Foreign_Agents_Registration_Act) , and people would have been sent to jail.

There are many who consider this isn't geopolitics, it is OK with me. The Cold War was motivated by fear, and right now China is generating fear and anger in the US public This sort of incident will only stiffen the resolve of the China hawks in the US. The China doves will have even more difficult time persuading Congress that China isn't a threat.

# RELEVANT ARTICLES

There have been two recent incidents about Chinese interference in the US or involving US companies - [South Park](https://www.asiatimes.com/2019/10/article/south-park-sends-satirical-rocket-to-china/) and [Blizzard](https://www.vox.com/2019/10/8/20904433/blizzard-hong-kong-hearthstone-blitzchung). I am not going to spend any time discussing these incidents. Here are some relevant and serious articles about the NBA-China incident

[The NBA Is China’s Willing Tool](https://foreignpolicy.com/2019/10/07/us-businesses-like-the-nba-are-chinas-willing-tools/) (Foreign Policy)

[NBA vs. China: The Power Struggle Behind the Standoff](https://www.wsj.com/articles/nba-vs-china-the-power-struggle-behind-the-standoff-11570557671) (Wall Street Journal)

[The Foreign Agents Registration Act Is Broken](https://foreignpolicy.com/2019/07/22/the-foreign-agents-registration-act-is-broken/) (Foreign Policy). FARA is a piece of legislation that was introduced in 1938 to guard against Nazi influence in the US. After the 1966s, it had rarely been used.  [However, the DOJ has brought almsot as many FARA cases in the last 18 months as in the last 40 years](https://www.rollingstone.com/politics/politics-features/fara-law-explained-794340/). FARA as explained in the Foreign Policy article is nasty and far ranging legislation, one does not want to get caught in its cross hairs.

# SUMMARY

The incident started when Daryl Morey, the General Manager of Houston Rockets, a NBA team, wrote the following tweet, "" Fight for freedom, stand with Hong Kong "" than the commercial gates of hell for both the Rockets and NBA according to Sinocism.

The articles presents John Tsai, the owner of the  Brooklyn Nets  and Executive VP of Alibaba and those of Adam Silver, the NBA Commissioner.. This is what Adam Silver had to say,

>""There is no doubt, the economic impact is already clear,"" he said.  ""There have already been fairly dramatic consequences from that tweet,  and I have read some of the media suggesting that we are not supporting  Daryl Morey, but in fact we have.""  
>  
>""I think as a values-based  organization that I want to make it clear...that Daryl Morey is  supported in terms of his ability to exercise his freedom of  expression.""..  
>  
>""What I am supporting is his freedom of political expression in this situation,"" he said.  
>  
>""I  am also supporting Joe Tsai. I realize, as I said again, these are  complex issues they don't lend themselves easily to social media. I  can't ultimately run the NBA based on trying to satisfy everyone on  Twitter.""

The article makes the following points, it says the NBA as leverage in China, if it presents a united front. It could backfire, since there is bipartisan outrage in Congress regarding this issue.

In a broader context has long wanted to increase its ""international discourse power  国际话语权“ . It comes into forms 1) On the one hand it is launching, buying, co-opting and coercing  overseas media outlets. 2) On the other it uses the power of the Chinese  market to co-opt and coerce global businesses, their executives and  other elite voices.  This is what the Global Times had to say

>The biggest lesson which can be drawn from the matter is that entities  that value commercial interests must make their members speak  cautiously. Chinese consumers are not overly sensitive. Wherever it is,  touching a raw political nerve is extremely risky. Morey has neither the  IQ nor the EQ to talk about political topics. He will become an example  of clumsiness on some MBA courses.

The writer concludes by taking a quote from [The NBA Is China’s Willing Tool](https://foreignpolicy.com/2019/10/07/us-businesses-like-the-nba-are-chinas-willing-tools/) written by James Palmer

>It will take political power in the United States to [counter political power wielded by China](https://foreignpolicy.com/2018/10/11/if-the-u-s-doesnt-control-corporate-power-china-will/).  For U.S. companies to stop appeasing Chinese censorship, corporate  decision-makers are going to have to believe that the reputational and  political costs of doing so outweigh the damage done to their interests  in China.   But it will also need targeted effort from politicians [who say](https://twitter.com/tedcruz/status/1181030464661999616) they  care. That may mean dragging executives to testify about their  decision, forcing more public embarrassment. It may mean threatening the  government contracts and cozy tax breaks that firms often rely on.

# OPINION

To me its not about whether or not you agree with what Daryl Morey said, but whether the Chinese government can pressure a US organization to censor him. This gets into the area of foreign interference,

Unlike the author I think the NBA Commissioner is more worried about the fallout in the US than China. Professional sports in the US is regulated and depends on governments at various levels from municipal, state and federal. NBA is more susceptible to domestic political pressure than your average US company operating in China. Professional sports leagues in the US is socialist. So China's respond to ban the NBA in its entirety was the correct response from economic perspective, given revenue sharing in the NBA.

The NBA has faced bans in the past in China, the first was during the bombing of the Chinese embassy in Serbia, the second was in 2008 for comments made by some players. However, this time is different, not necessarily because its particularly bad, but because its occurring with the overall context of the Trade War and the current political climate in China.

The reason why I think this incident is different from telling the likes of Marriot not to list Taiwan as a separate country, because China was essentially telling the NBA to censor  Daryl Morey, thus restricting his First Amendment rights, which isn't a crime itself if   the entity pressuring the NBA isn't foreign.  Because a foreign government / entity is pressuring the NBA, this falls under FARA.  The NBA would have to register as a foreign agent."
Blackwater founder Erik Prince now a rising star in China,448,0.97,ae4ew1,https://www.washingtonpost.com/news/world/wp/2018/05/04/feature/a-warrior-goes-to-china-did-erik-prince-cross-a-line/,49,2019-1-9,
Germany urges France to turn its UN seat into EU one,447,0.96,a1a9lw,https://www.euractiv.com/section/global-europe/news/germany-urges-france-to-turn-its-un-seat-into-eu-one/,188,2018-11-29,
A foiled assassination plot in Denmark may have just cost Iran a partner against Trump,445,0.93,9ta4s3,https://www.washingtonpost.com/world/2018/10/31/foiled-assassination-plot-denmark-may-just-have-cost-iran-partner-against-trump/?noredirect=on&utm_term=.984421cc769c,104,2018-11-1,
Russia experienced a nuclear fuel reprocessing accident / release that they did not report to the world.,448,0.95,ckwq59,https://www.sciencedaily.com/releases/2019/07/190729151844.htm,92,2019-8-2,
Is Russia a growing threat or on its last hurrah?,450,0.94,ch8fae,https://www.reddit.com/r/geopolitics/comments/ch8fae/is_russia_a_growing_threat_or_on_its_last_hurrah/,236,2019-7-24,"I keep reading Russias economy is in shambles and its population cratering, and yet it seems to be more dangerous then ever. What do people who follow them closely think?"
"How the U.S. Government Misleads the Public on Afghanistan. Seventeen years into the war in Afghanistan, American officials routinely issue inflated assessments of progress that contradict what is actually happening there.",447,0.94,9eewza,https://www.nytimes.com/interactive/2018/09/08/world/asia/us-misleads-on-afghanistan.html,166,2018-9-10,
Huawei executive Meng Wanzhou to face extradition hearing,443,0.98,eri8g6,https://www.bbc.com/news/world-us-canada-51126901,62,2020-1-21,
Why Iraq's great rivers are dying - Vox,442,0.95,c89hig,https://youtu.be/_c7AuSQdvow,61,2019-7-2,
Kurdistan will become independent country sooner than later: Former US Ambassador,445,0.93,9tzs8x,http://www.kurdistan24.net/en/news/9dbbcbdc-a442-4fb4-8eb8-43795088535b,65,2018-11-4,
Beijing envoy warns EU against ‘disastrous’ curbs on China companies - Ambassador says bloc should remain open to investment or risk a backlash,443,0.96,ega0af,https://www.ft.com/content/2f16e950-2588-11ea-9a4f-963f0ec7e134,164,2019-12-27,
F.B.I. Bars Some China Scholars From Visiting U.S. Over Spying Fears,444,0.96,bdfhh7,https://www.nytimes.com/2019/04/14/world/asia/china-academics-fbi-visa-bans.html?partner=rss&emc=rss,72,2019-4-15,
"China Spied on African Union Through Headquarters Building It Constructed, According to French Newspaper",442,0.89,7uv0ui,https://www.theepochtimes.com/china-spied-on-african-union-through-headquarters-building-it-constructed-according-to-french-newspaper_2428856.html,57,2018-2-3,
"To counter Huawei, U.S. could take 'controlling stake' in Ericsson, Nokia: attorney general",442,0.96,f03kbm,https://www.reuters.com/article/us-usa-china-espionage/to-counter-huawei-u-s-could-take-controlling-stake-in-ericsson-nokia-attorney-general-idUSKBN2001DL,157,2020-2-7,
Iran will increase uranium enrichment to whatever levels it needs: Rouhani,440,0.97,c8lrqy,https://www.reuters.com/article/us-mideast-iran-usa-rouhani/iran-will-increase-uranium-enrichment-to-whatever-levels-it-needs-rouhani-idUSKCN1TY0WV,97,2019-7-3,
"Greece to purchase Drones from US, Israel",441,0.99,ecot80,https://www.aa.com.tr/en/world/greece-to-purchase-drones-from-us-israel/1677629,66,2019-12-19,
The Brexit-effect and The Myth of the dying European Union,436,0.92,c91av0,https://medium.com/@ravivanos/the-brexit-effect-and-the-myth-of-the-dying-european-union-dd180ed0cc52,232,2019-7-4,
Defense spending. How's the level of spending in your country? Is it higher/lower than expected? How is the state of your armed forces with regard to spending?,440,0.95,bt1c9i,https://i.redd.it/xw0wujez0g031.png,199,2019-5-26,
Kenya's Foreign Ministry publishes map that recognises independence of Somaliland,442,0.99,ctnhvb,https://twitter.com/SamRamani2/status/1164233455770755072,34,2019-8-22,
Trumpism Comes to Brazil: Bolsonaro Salutes the U.S. Flag—and Breaks With a Tradition of Independence,440,0.89,9sdsfj,https://www.foreignaffairs.com/articles/brazil/2018-10-28/trumpism-comes-brazil?gpp=xaem8IQa5NM11xR1FGvu2zpyYzVVanREUEtKV0ozK0JQNFZub1NuMWJmNzhEczJsYk0xNjZZZUxJbEUvK1ZWSGZVMlpwNGlVbmU3T3JRWnphOmJhMzJkYWZmOThjZTJlMTE3ZjIwY2JjMTVhY2VjZjIwYjNlZTYzMWQxOGZhZGIzNjEwMzE0OWE0OWIxMDJmNGI%3D,105,2018-10-29,
The opposite of Brexit: African Union launches an all-Africa passport,439,0.96,4r44lh,https://www.washingtonpost.com/news/monkey-cage/wp/2016/07/01/the-opposite-of-brexit-african-union-launches-an-all-africa-passport/,29,2016-7-4,
"US ends Cold War nuclear treaty, with aim of countering China",435,0.98,cl4kji,https://www.nytimes.com/2019/08/01/world/asia/inf-missile-treaty.html?smid=nytcore-ios-share,92,2019-8-2,
"A 'geopolitical recession' has arrived and the US-led world order is ending, Ian Bremmer says",437,0.9,9mxzhw,https://www.cnbc.com/2018/10/10/china-emerging-markets-are-rising-us-led-order-ending-ian-bremmer.html?__source=twitter%7Cmain,237,2018-10-10,
"Scientist Who Helped Connect Litvinenko's Murder To The Kremlin ""Assassinated"" In Britain",441,0.93,6iag1t,https://www.buzzfeed.com/janebradley/scientist-who-helped-connect-litvinenkos-murder-to-the,59,2017-6-20,
Erdogan says Turkey aims to settle 1 million refugees in Syria offensive area,439,0.98,e8m07x,https://www.reuters.com/article/us-syria-security-turkey/erdogan-says-turkey-aims-to-settle-1-million-refugees-in-syria-offensive-area-idUSKBN1YD27R,91,2019-12-10,
"US is closing in on Saudi Arabia to become the world’s top oil exporter, IEA says",440,0.99,d38eul,https://www.cnbc.com/2019/09/12/oil-us-closing-in-on-saudi-arabia-to-become-the-worlds-top-exporter-iea-says.html,87,2019-9-12,
India weighs retaliatory tariffs on US imports worth $10.6 billion,434,0.96,axorqm,https://www.livemint.com/politics/policy/india-weighs-retaliatory-tariffs-on-us-imports-worth-10-6-billion-1551806191988.html,138,2019-3-6,
What Is the End Game of Hong Kong? (Again),439,0.95,cpeqs5,https://www.reddit.com/r/geopolitics/comments/cpeqs5/what_is_the_end_game_of_hong_kong_again/,142,2019-8-13,"It seems this sub has reached a consensus that HK protesting would lead to nowhere and would not hurt CCP except for annoyance.  It is also unlikely that this would annoy CCP enough to call for a 6-4 style purging. 

My question is, what goal would the protestors like to achieve? Surely they don't think simply protesting in HK will make CCP bend? How could this logically deter the perceived erosion of political rights and freedom (IDK whether it is really the case)?  And what is their best course of action for HKers to actually retain their autonomy? Conversely, what is the CCP's goal in HK? There are serious inflammatory talks about military and rioting, defaming national flags/emblems within the controlled mainland media, which makes me wonder that if they don't want to resort to iron fists, why all this war-drumming?"
Yemeni rebels claim mass capture of Saudi troops,433,0.98,dapwap,https://www.bbc.com/news/world-middle-east-49866677,109,2019-9-29,
This Is the Moment That Decides the Future of the Middle East,434,0.95,d5krd3,https://foreignpolicy.com/2019/09/17/this-is-the-moment-that-decides-the-future-of-the-middle-east/,184,2019-9-18,
"Making Turkey Great Again | ""Erdogan has made a radical break with the Western foreign policy consensus - which had been the foundation of Turkey’s international relations strategy (...) As a result, he has left Turkey encircled by enemies, isolated from allies, and far from greatness""",432,0.94,aofota,https://www.washingtoninstitute.org/policy-analysis/view/making-turkey-great-again,76,2019-2-8,
Azerbaijan president says no end to military action until Armenia sets withdrawal timeline,435,0.97,j596in,https://www.mazainside.com/azerbaijan-no-end-to-military-action-until-armenia-sets-withdrawa/,113,2020-10-5,
The Simmering Karabakh Conflict starts to boil over,431,0.99,j1xdrw,https://encyclopediageopolitica.com/2020/09/27/the-simmering-karabakh-conflict-starts-to-boil-over/,85,2020-9-29,
Iran seizes another foreign tanker,430,0.96,clue2h,https://www.dw.com/en/iran-seizes-foreign-vessel-in-persian-gulf-reports/a-49884936,37,2019-8-4,
Chinese hi-tech researchers 'told not to travel to US unless it's essential',427,0.98,a5lg1v,https://www.scmp.com/news/china/diplomacy/article/2177703/chinese-hi-tech-researchers-told-not-travel-us-unless-its,70,2018-12-13,
The military draft is making a comeback in Europe,428,0.96,a2xgbw,https://www.washingtonpost.com/world/2018/10/19/military-draft-is-making-comeback-europe/?utm_term=.904c3c132b32,103,2018-12-4,
We're the ICIJ journalists behind the Panama Papers investigation (which we released two years ago today) We're here to answer your questions about the Panama Papers (and the Paradise Papers if you'd like).,426,0.97,89gvgm,https://www.reddit.com/r/IAmA/comments/89gtqn/were_the_icij_journalists_behind_the_panama/,21,2018-4-4,
Colombia to be NATO's first Latin American global partner,431,0.96,8mgicl,https://www.reuters.com/article/us-colombia-nato/colombia-to-be-natos-first-latin-american-global-partner-idUSKCN1IR0E8,96,2018-5-27,
What if Russia invaded Baltic states?,432,0.91,fsxwsk,https://youtu.be/nosu9L8eFHE,92,2020-4-1,
"Poland would support Scottish EU membership, says senior MEP",428,0.94,dawlu9,https://www.thenational.scot/news/17934225.poland-supports-scottish-eu-membership-brexit/,42,2019-9-29,
North and South Korea commit to 'era of no war',424,0.98,9h24is,https://www.cnn.com/2018/09/18/asia/north-korea-south-korea-summit-intl/index.html,81,2018-9-19,
"Trump wants to pull all U.S. troops out of Afghanistan by 2020 election, officials say",430,0.96,cljihn,https://www.nbcnews.com/news/military/trump-wants-pull-all-troops-out-afghanistan-2020-election-n1038651,188,2019-8-3,
"China’s press freedom crackdown poses a threat to int’l democracies, says media watchdog. The report condemned Chinese President Xi Jinping as an “enemy of democracy, universal values, human rights and press freedom.”",432,0.9,b5n78d,https://www.hongkongfp.com/2019/03/25/new-world-order-chinas-crackdown-press-freedom-poses-threat-intl-democracies-says-media-watchdog/,83,2019-3-26,
There’s No Path to Victory in Afghanistan. There Never Was.,434,0.93,9pvuz7,https://slate.com/news-and-politics/2018/10/afghanistan-war-end-negotiation-taliban-isis-al-qaida.html,136,2018-10-21,
"Joint statement issued by the United States, Bahrain & Israel",427,0.93,iqxhmx,https://i.redd.it/tvok89xllkm51.jpg,72,2020-9-12,
"55 Asia-Pacific countries including Pakistan, China endorse India’s bid for UNSC non-permanent seat",427,0.96,c5mjev,https://newsd.in/55-asia-pacific-countries-including-pakistan-china-endorse-india-bid-for-unsc-non-permanent/,53,2019-6-26,
"The United States has started to build cruise missiles, which have been banned since the Cold War",427,0.94,azzrad,https://www.businessinsider.com/the-us-starts-to-build-cruise-missiles-banned-since-cold-war-2019-3,108,2019-3-12,
China’s birthrate declines again in 2018,422,0.96,b9a8o3,http://www.asianews.it/news-en/Chinas-birthrate-decline-again-in-2018-46580.html,117,2019-4-4,
"Special Report: Phantom oil buyers in Russia, advice from Iran help Venezuela skirt sanctions",421,0.96,js83g9,https://www.reuters.com/article/us-venezuela-oil-exports-special-report/special-report-phantom-oil-buyers-in-russia-advice-from-iran-help-venezuela-skirt-sanctions-idUSKBN27Q295,25,2020-11-11,
"What benefit, other than national “face” does China have for bringing Hong Kong further in line with the mainland?",428,0.92,gtas4d,https://www.reddit.com/r/geopolitics/comments/gtas4d/what_benefit_other_than_national_face_does_china/,139,2020-5-30,"I understand the deep national embarrassment of Hong Kong and China, but HK has done so well being relatively “free” and “independent”. It’s one of the world’s largest financial hubs, particularly for the Asian region.

Is China willing to risk HK’s status as a financial hub in order to bring it in line? I can see many companies moving their HQs from HK to either Singapore/Seoul/Tokyo because of this."
Trump: Time to recognise Golan Heights as Israeli territory,427,0.92,b3un17,https://www.bbc.co.uk/news/world-middle-east-47657843,202,2019-3-22,
CNN: US report says rapidly modernizing Chinese military has set sights on Taiwan,425,0.93,agijm0,https://www.cnn.com/2019/01/15/politics/china-military-report/index.html,189,2019-1-16,
"Should Brexit lead to the dissolution of the United Kingdom, what would happen to the UK's seat on the UN Security Council? Would it go solely to England, or would there be an 'election' among the remaining four UNSC powers?",427,0.96,egtwuh,https://www.reddit.com/r/geopolitics/comments/egtwuh/should_brexit_lead_to_the_dissolution_of_the/,124,2019-12-29,
China's Tiananmen moment in Hong Kong,420,0.89,csyuj7,https://www.youtube.com/attribution_link?a=-WvJLLv-qIs&u=%2Fwatch%3Fv%3DyGTZkKAYsZw%26feature%3Dshare,76,2019-8-20,
China Threatens Trump Over F-16 Sale to Taiwan,418,0.95,cs18sb,https://www.usnews.com/news/world-report/articles/2019-08-16/china-threatens-trump-over-f-16-sale-to-taiwan,133,2019-8-18,
Most Germans think Europe can defend itself without U.S. help: poll,419,0.94,9182ak,https://www.reuters.com/article/us-germany-security-poll/most-germans-think-europe-can-defend-itself-without-u-s-help-poll-idUSKBN1KD1DB?utm_source=reddit.com,450,2018-7-23,
The Taliban’s Fight for Hearts and Minds: The militants’ new strategy is to out-govern the U.S.-backed administration in Kabul—and it’s working.,420,0.97,9mdwrh,https://foreignpolicy.com/2018/09/12/the-talibans-fight-for-hearts-and-minds-aghanistan/,58,2018-10-8,
"Rep. Adam Smith, Ranking Member of House Armed Services Committee, says stability should be the U.S’ main priority in Africa. US should work with local partners and build trust to develop transparency, rather than coming in with the military and saying, ""we’re going to fix everything""",418,0.96,95mxt7,https://www.americansecurityproject.org/event-recap-us-africa-security-relations/,72,2018-8-8,
Donald Trump wanted 'America First'. He got 'America alone'.,421,0.85,7q2y19,http://www.macleans.ca/politics/worldpolitics/donald-trump-wanted-america-first-he-got-america-alone/,207,2018-1-13,
Protesters set fire to U.S. Embassy in Honduras in second day of demonstrations,420,0.97,bvecqb,https://www.reuters.com/article/us-honduras-protests/protesters-set-fire-to-u-s-embassy-in-honduras-in-second-day-of-demonstrations-idUSKCN1T12PQ?feedType=RSS&feedName=worldNews&utm_source=feedburner&utm_medium=feed&utm_campaign=Feed%3A+Reuters%2FworldNews+%28Reuters+World+News%29&utm_source=reddit.com,53,2019-6-1,
Philippines President Duterte orders US forces out after 65 years: 'Do not treat us like a doormat',414,0.95,56m6yo,http://www.ibtimes.co.uk/philippines-president-duterte-orders-us-forces-out-after-65-years-do-not-treat-us-like-doormat-1585434,219,2016-10-9,
