title,score,upv_ratio,id,url,comms_num,created,body
BBC asks Chinese ambassador to the UK explanation regarding footage of prisoners being loaded onto trains.,13799,0.96,hu25hq,https://v.redd.it/p8rbzenvztb51,648,2020-7-19,
Trump Gives Stephen Bannon Access to National Security Council,3384,0.89,5qrthq,https://www.theatlantic.com/liveblogs/2017/01/todays-news-jan-28-2017/514826/14243/,183,2017-1-29,
Trump’s letter to Erdogan,3299,0.96,diy9m1,https://i.redd.it/6h7vwbkrtzs31.jpg,231,2019-10-17,
"India, Japan and Australia begin discussions on launching a trilateral 'Supply Chain Resilience Initiative' (SCRI) to reduce dependency on China.",2839,0.98,ickg4v,https://economictimes.indiatimes.com/news/economy/foreign-trade/india-japan-australia-supply-chain-in-the-works-to-counter-china/articleshow/77624852.cms,162,2020-8-19,
"""China is under US attack, but the world has no sympathy for us""-Dai Xu",2660,0.82,hv6bnn,https://www.reddit.com/r/geopolitics/comments/hv6bnn/china_is_under_us_attack_but_the_world_has_no/,778,2020-7-21,"Hi everyone! This is my first post in r/geopolitics

So glad to have found a community that shares my interests.

The URL links to a news article in Korean about a speech given by top Chinese military strategist Dai Xu. He is like the Chinese version of Bolton (was it John?.. anyways..).

This is the original article :   [https://news.joins.com/article/23828567](https://news.joins.com/article/23828567) 

I have taken the liberty to translate it to English, I am not native so please excuse any mistakes..:) Might be a bit long but I think it was a very interesting read.

&#x200B;

Here we go.

&#x200B;

China has been under unprecedented levels of attack on all sides by the US, giving rise to a sense of poignant regret that China has been misunderstanding the US. A speech regarding this issue given by Professor Dai Xu from China’s National Defense University has recently been gaining much attention from Chinese media.

Dai Xu is one of China’s most representative military hawk’s; he was chosen as one of the most influential figures in 2010 and is also widely known for being“one of Henan’s (Xu’s hometown) top three brains”.

While the United States is reviewing a travel ban on all CCP members and their family members to the US, Dai Xu’s speech on “four things that China overlooked and ten new perceptions about the United States” has been a popular topic among the Chinese.

The first thing Dai Xu claims that China has overlooked about the US is that China didn’t realize that America had so much resentment against them. According to Xu, President Donald Trump has not even a speck of goodwill for China and although he has been calling them a series of names including “trade terrorist”, “invader of the global economy”, “cheaters”, “thieves”, “rule breakers”, to the Chinese, America’s grudge feels like a punch out of the blue. While America says it will not idly stand by and ignore all of China’s evildoings, Xu adds that America is using all its resources to “demonize” China.

The second is that China did not know America’s tactics would be so ‘brutal’. Dai Xu said that China’s top government officials and professionals, himself included, did not expect an all-out attack from the US, without any wiggle room to even take a breath. US-China relations have been woven tightly over a long period of time which is why China thought that unless the US was out of their mind, it would not impose 20 billion tariffs on Chinese goods. However, America’s strong measures have taken China by surprise, highly exceeding its expectations.

The third is that while China is being beaten down by the US, not a single country has neither stood up at their defense nor even expressed a drop of sympathy. While numerous countries are against  America’s trade measures, none of them have spoken out against the US or stood next to China, the greatest victim of the trade war. Xu said that although China has been assisting many countries around the world and these countries have benefited much from China, none of them have stood up for them when most needed.

The fourth is that to fight China, America has built a unified front. Republicans and Democrats disagree over any and every issue except on that of measures and policies on China; on these they are completely united. What is most surprising, Xu says, is that no member of the US Congress has spoken in favor of China and because of these four issues, it is time for China to see the US from a different perspective.

10 new perspectives about the US according to Dai Xu

1. The US is a ‘real tiger’ not a ‘paper tiger’
2. Must not assume that the US will continue making mistakes
3. The US puts profit before ideology and value
4. Never say “We are number one”, “we are better” before the US
5. The US is indifferent about committing crimes against others
6. Must admit that the US is the world’s “big boss”
7. Do not mention “sharing information” before the US
8. The US is a master strategist: Do not become their enemy
9. Must not hope that the US elections will change the US’ national strategy
10. Must not naively think about fighting the US until the end

First, China must realize that the US is a ‘real tiger’ that devours, not a ‘paper tiger’. American politicians are neither gentlemen nor philanthropists but workers who are devoted and prepared to do anything for their nation and its voters.

Second, China must not assume that the US will continue making mistakes. The US is a country that will turn its national strategy around 180 degrees if it deems its strategy to be wrong. The US can change masks quicker than you turn a page in a book.

Third, The US puts profit before ideology and value. When making money from the Americans, China must be careful and quickly catch onto changes to their facial expressions. Make sure that the money is flowing both ways and not unilaterally toward China.

Fourth, never say “we are number one”, “we are better” before the US. Even if the thought crosses your mind, take it as a sign to take a step down and be more modest.

Fifth, the US is indifferent about committing crimes against others. Although the US has many allies, it will not go as far as to sacrifice its core interests just to maintain the alliance friendly.

Sixth, must admit that the US is the world’s “big boss”. Although it is difficult to accept, it is the reality. The US controls vast amounts of resources, much greater than those China does. The best possible scenario for China is to digest and absorb US technology. And even after absorbing American technology, China must not go around blabbering that it is their “innovation”.

Seventh, do not mention “sharing information” in front of the US. Intellectual property is very important in the US. If you ask to share this technology you will be stamped as a “thief”.

Eighth, the US is a master strategist. Things will become very difficult once you become an enemy of the US. America’s war against terrorism shows us that the US can and will pool all its resources together, follow you to the very end of the earth and then kill you.

Ninth, do not hope that the US elections will change the US’ national strategy. The “Make America Great Again” strategy will not change even if the president does.

Tenth, do not be naïve and think you will be able to fight the US until the end. Every action made by the US has a butterfly effect. The US has many allies and many partnerships around the globe. If the US imposes a 30 billion dollar tariff on China, this will have a ripple effect and blow up into 60 billion, even 90 billion dollars’ worth of effects.

This is the reason why the US is so strong. Dai Xu says, if China wants to take on the US, it must approach with reason and not rage, wisely and courageously."
"Germany refuses to turn a 'blind eye' to China, teams up with Australia",2329,0.96,jmj1i9,https://www.smh.com.au/world/asia/germany-refuses-to-turn-a-blind-eye-to-china-teams-up-with-australia-20201102-p56apf.html?utm_medium=Social&utm_source=Facebook&fbclid=IwAR2V-fcPDLSG918Sf98WYWuv4JRnSmPKN8oouWBfVgdnpgtBYPIVbLY8m9g#Echobox=1604297604,118,2020-11-2,
"[Reddit OC] The topologist's map of the world - a map showing international borders, and nothing else",2293,0.97,gyco91,https://i.imgur.com/qGVyb50.png,119,2020-6-7,
Japan PM Shinzo Abe set to announce resignation amid health concerns - report | World news,2197,0.99,ii1fhq,https://www.theguardian.com/world/2020/aug/28/shinzo-abe-to-publicly-address-concerns-about-his-health,90,2020-8-28,
U.S. to Expel Chinese Graduate Students With Ties to China’s Military Schools,2050,0.97,gs68n0,https://www.nytimes.com/2020/05/28/us/politics/china-hong-kong-trump-student-visas.html,166,2020-5-28,
"US seeks formal alliance similar to Nato with India, Japan and Austrailia",2037,0.97,ikdybx,https://www.scmp.com/news/china/article/3099642/us-seeks-formal-alliance-similar-nato-india-japan-and-australia-state?utm_term=Autofeed&utm_medium=Social&utm_content=article&utm_source=Twitter,552,2020-9-1,
Emirates supports Macron after controversy over Muhammad cartoons and criticizes Turkey's opportunism,1916,0.97,jn7ufk,https://atalayar.com/en/content/emirates-supports-macron-after-controversy-over-muhammad-cartoons-and-criticizes-turkeys,129,2020-11-3,
Armenia and Azerbaijan agreed to end the war,1760,0.98,jrcgni,https://www.aljazeera.com/news/2020/11/9/armenia-pm-says-signed-painful-deal-to-end-nagorno-karabakh-war,154,2020-11-10,
Taiwan calls for global coalition against China’s aggression as US official flies in,1743,0.95,iufk3x,https://www.theguardian.com/world/2020/sep/17/taiwan-calls-for-global-coalition-against-chinas-aggression-as-us-official-flies-in,159,2020-9-17,
"Saudi state media warns that any western sanctions against Saudi Arabia could result in oil price jumping to $200, or even the abandonment of the petro-dollar for the Chinese yuan",1741,0.95,9o2ubr,https://english.alarabiya.net/en/views/news/middle-east/2018/10/14/OPINION-US-sanctions-on-Riyadh-means-Washington-is-stabbing-itself.html,240,2018-10-14,
Bill in US Congress to recognize Tibet as independent country,1631,0.96,grawvi,https://timesofindia.indiatimes.com/world/us/bill-in-us-congress-to-recognize-tibet-as-independent-country/articleshow/76013185.cms,197,2020-5-27,
Iran says it 'unintentionally' shot down plane - BBC News,1621,0.98,en2k5w,https://www.bbc.com/news/amp/world-middle-east-51073621,387,2020-1-11,
Iran issues arrest warrant for Trump; asks Interpol to help,1581,0.94,hhxzuw,https://www.aljazeera.com/news/2020/06/iran-issues-arrest-warrant-trump-asks-interpol-200629104710662.html,109,2020-6-29,
"China joins U.N. human rights panel, will help pick experts on free speech, health, arbitrary detention",1592,0.95,fve7pn,https://unwatch.org/china-joins-u-n-human-rights-panel-will-help-pick-experts-on-free-speech-health-arbitrary-detention/,173,2020-4-5,
U.S base in Iraq currently coming under missile fire from Iran,1567,0.95,eljtlv,https://www.dailywire.com/news/breaking-multiple-missiles-from-iran-hit-air-base-in-iraq-housing-american-troops-reports-say,505,2020-1-8,
China is no longer a developing country and should face tougher trade obligations insists Australian Prime Minister,1542,0.97,d8kwck,https://www.abc.net.au/news/2019-09-24/scott-morrison-calls-for-trade-overhaul-of-wto-system/11541522,148,2019-9-24,
"German Chancellor Angela Merkel seems to see the historical writing on the wall. Her agreement to a €500 billion European recovery fund suggests that the COVID-19 pandemic has done what recent debt, refugee, and foreign-policy crises could not: inaugurate a new phase of the European project.",1528,0.97,gviw06,https://www.project-syndicate.org/commentary/eu-merkel-germany-for-closer-european-integration-by-harold-james-2020-06,159,2020-6-3,
EU: 'We don't recognise Lukashenko as legitimate president',1516,0.98,itp8ph,https://www.aljazeera.com/news/2020/09/eu-don-recognise-lukashenko-legitimate-president-200915114733368.html,51,2020-9-16,
China Limited the Mekong’s Flow. Other Countries Suffered a Drought.,1457,0.94,g0j2sb,https://www.nytimes.com/2020/04/13/world/asia/china-mekong-drought.html?searchResultPosition=3,131,2020-4-13,
"China's Baidu blanked out parts of its mapping platform, allowing for the discovery of 268 internment camps or prison complexes newly constructed since 2016.",1458,0.94,ihnj8f,https://www.buzzfeednews.com/article/alison_killing/satellite-images-investigation-xinjiang-detention-camps,130,2020-8-27,
US State Department Statement on today’s refusal to recognize any Chinese claims in the SCS or ECS,1446,0.96,hqlkoh,https://i.redd.it/i96hfazyaoa51.jpg,158,2020-7-14,
"Iraqi national TV announces assassination of Qassem Suleimani, head of Iran’s Quds Force",1450,0.97,ej7tgs,https://twitter.com/alarabiya_brk/status/1212902092538552320?s=21,293,2020-1-3,
Armenia says its fighter jet was 'shot down by Turkey',1445,0.98,j20ko3,https://www.bbc.com/news/world-europe-54345622,229,2020-9-29,
United States aid every year,1445,0.96,cwz94h,https://i.redd.it/4biimvbjadj31.jpg,347,2019-8-29,
"Lithuania, Poland and Ukraine form Lublin Triangle to cooperate against Russian aggression",1432,0.98,hzmn6r,https://www.lrt.lt/en/news-in-english/19/1201605/lithuania-poland-ukraine-form-lublin-triangle-to-cooperate-against-russian-aggression,146,2020-7-29,
"Chinese Propaganda Outlet Has Paid US Newspapers $19 Million For Advertising, Printing",1437,0.91,h109iu,https://dailycaller.com/2020/06/08/chinese-propaganda-china-daily-washington-post/,62,2020-6-11,
Foreign Policy: China has been committing forced sterilization against Uighurs,1427,0.94,hjy8mr,https://foreignpolicy.com/2020/07/01/china-documents-uighur-genocidal-sterilization-xinjiang/,180,2020-7-2,
Australia to build larger and more aggressive military to prepare for post-pandemic disorder,1407,0.98,hj0nmq,https://www.abc.net.au/news/2020-06-30/australia-unveils-10-year-defence-strategy/12408232,127,2020-7-1,
China Is Losing India: A Clash in the Himalayas Will Push New Delhi Toward Washington,1392,0.93,hdtuod,https://www.foreignaffairs.com/articles/china/2020-06-22/china-losing-india,199,2020-6-22,
U.S. Senate approves bill to pressure China over Uighur rights,1379,0.94,gk8253,https://www.reuters.com/article/us-usa-china-xinjiang-idUSKBN22Q3FK,104,2020-5-15,
China vows to stop UK granting Hongkongers residency,1377,0.97,hjr5yp,https://www.theguardian.com/world/2020/jul/02/china-could-prevent-hongkongers-moving-to-uk-says-dominic-raab,337,2020-7-2,
Europe Just Declared Independence From China,1381,0.9,inq3jy,https://www.bloomberg.com/opinion/articles/2020-09-05/europe-just-declared-independence-from-china,160,2020-9-7,
Recent tweet in Greek by French president regarding the Greek and Turkish tensions.,1367,0.97,i9n4zj,https://i.redd.it/2i2c51z5czg51.jpg,243,2020-8-14,
Belarus Turned Off the Internet. Its Citizens Hot-Wired It.,1364,0.98,ih7je3,https://gizmodo.com/belarus-turned-off-the-internet-its-citizens-hot-wired-1844853575,42,2020-8-27,
India could start formal trade talks with Taiwan soon as both see souring ties with China,1362,0.96,jfaukn,https://theprint.in/economy/india-could-start-formal-trade-talks-with-taiwan-soon-as-both-see-souring-ties-with-china/527273/,113,2020-10-21,
China to impose 80 per cent tariff on Australian barley for the next five years amid global push for coronavirus investigation,1344,0.96,gm3ke2,https://www.google.com/amp/s/amp.abc.net.au/article/12261108,261,2020-5-18,
Hong Kong citizens offered extended visas as Australia suspends extradition agreement,1325,0.97,hnwuyl,https://www.abc.net.au/news/2020-07-09/australia-hong-kong-china-extradition-and-visa-issues/12433332,117,2020-7-9,
UK suspends extradition treaty with Hong Kong,1321,0.97,huo62l,https://www.bbc.co.uk/news/uk-politics-53476811,57,2020-7-21,
"[META] This sub needs much stronger moderation. Anecdotally, I have seen a sharp decline in its quality of comments",1312,0.94,eq44g1,https://www.reddit.com/r/geopolitics/comments/eq44g1/meta_this_sub_needs_much_stronger_moderation/,294,2020-1-18,"**Case in point**

[https://www.reddit.com/r/geopolitics/comments/epwdpb/chinas\_birth\_rate\_falls\_to\_near\_60year\_low\_in\_2019/fend2fe/](https://www.reddit.com/r/geopolitics/comments/epwdpb/chinas_birth_rate_falls_to_near_60year_low_in_2019/fend2fe/)

>Given what we have seen of Chinas morality as a nation, are slave brides to match their 50 million male surplus an unthinkable option? Doesn't seem that far off from reeducation camps, live organ harvesting of political prisoners, etc.  
>  
>It would knock a few birds with one stone. Removes the danger of 50 million single males getting angry, it imports more working age people in the form of those brides, and it helps correct the future demographic issues. Seems like a big win if you're willing to throw human suffering and decency out the window.

**My observation**

Over the last years that I have followed this sub, I have observed a noticeable decline in the quality of the comments. It used to be much more rigorous and academic in its analysis of events.

The above comment that I linked is a great example of something that does not belong in this sub (r/news r/worldnews would be the far more appropriate subs).

The above comment is pure sarcasm, to express OP's contempt for Chinese government (which arguably rightly so). But this is not a virtue signaling sub. We didn't come here to read things that we can read everywhere else on reddit and on twitter. We didn't come here to rage about Trump and praise Obama.

We came here for analysis. Geopolitics goes beyond morality. It is about power, projection and compromise.

Yes, Morality is an important tool in the arsenals of geopoliticians. And an adversarial authoritarian government (China) is much more dangerous than an adversarial democratic nation. And your contempt for the CCP's lack of morals should be expressed in this format.

A constructive analysis would include that given the communist party has control over media and leeways in its ability to do things that would otherwise infeasible in other controls. What are the logical options that the communist party would undertake to handle the nation's declining birth rate?

A rubbish comment is exactly like above, it is the classical reddit virtue signaling at full display. The rubbish comment is not about slave brides as a feasible solution. It is about using it as an opportunity to list the crimes of the CCP. I mean, import 50 million slave brides? Even in Genghis Khan era, I don't know if it is feasible. You are just listing CCP's dirty laundry without an ounce of coherent analysis.

&#x200B;

**My recommendation**

We need much stronger moderation in this sub. It is not about limiting free speech. It is about maintaining the integrity and quality of the sub. Academic journals do not allow anyone to publish there. Because rigorous analysis, debates and opposing viewpoints can only flourish conditioned on removing low quality distraction and noise.

More concretely, comments that are borderline low quality can be downvoted by the sub, comments that obviously fall below a certain quality bar should be removed via moderation, and egregiously low quality comments like above should result in temporary banning of the member.

&#x200B;

&#x200B;

EDIT: Note to moderators, this is in no way a criticism of your volunteering work. I wholeheartedly appreciate and thank you for growing this wonderful community. It has given people like me (who is not a student of geopolitics and interested in it) to learn from people far smarter than me.

EDIT 2: Scrubbed my post because I used the f-bomb. I apologies. I should have better controls.

EDIT 3: I removed my examples. I wrote the examples as ""analysis"". But as u/weilim correctly pointed out, my comments relating to geopolitics are also low quality and do not belong in this sub. I removed it so not to distract the discussion about moderation of the sub.

I was trying to be sarcastic while forgetting that I was trying to argue for moderating away sarcasm. I was trying to advocate and provide an example of analysis but of course, I am not capable of such in depth analysis. I mean, with stronger moderation, someone like me should just stop commenting in this sub!

Linking to people who correctly called my examples out as being low quality. 

[https://www.reddit.com/r/geopolitics/comments/eq44g1/meta\_this\_sub\_needs\_much\_stronger\_moderation/feoaxwo/](https://www.reddit.com/r/geopolitics/comments/eq44g1/meta_this_sub_needs_much_stronger_moderation/feoaxwo/)

[https://www.reddit.com/r/geopolitics/comments/eq44g1/meta\_this\_sub\_needs\_much\_stronger\_moderation/feod6q1/](https://www.reddit.com/r/geopolitics/comments/eq44g1/meta_this_sub_needs_much_stronger_moderation/feod6q1/)"
Indian Buildup at Galwan captured by Chinese Commercial Satellites. img date: 19/06/2020,1309,0.96,hdbwe1,https://i.redd.it/89rxxjdt3b651.png,226,2020-6-22,
India plans to halt $2.8 billion import of power equipment from China,1289,0.96,hkj8t5,https://theprint.in/india/india-plans-to-halt-2-8-billion-import-of-power-equipment-from-china/454030/,116,2020-7-3,
"US Intel Report: Russia, China and Iran are all attempting to influence 2020 US Election",1277,0.95,i5p12m,https://www.google.com/amp/s/www.cnbc.com/amp/2020/08/07/us-intel-russia-trying-to-hurt-biden-but-china-iran-dont-want-trump.html,226,2020-8-8,
Saudi Arabia to stop funding mosques in foreign countries,1279,0.97,eur0br,https://www.middleeastmonitor.com/20200125-saudi-arabia-to-stop-funding-mosques-in-foreign-countries/,132,2020-1-28,
Top opposition candidate in Belarus' presidential vote has refused to concede her defeat and has fled the country amid protests and intense crackdown by police.,1269,0.98,i7ngp1,https://money.yahoo.com/lithuanian-fm-belarus-challenger-safe-064818984.html,66,2020-8-11,
Tusk says “under no condition” will the EU agree with the American suggestion to invite Russia into the G7,1274,0.96,cuxmze,https://v.redd.it/hghd5xif3gi31,188,2019-8-25,
Hong Kong elections: pro-Beijing camp left reeling from landslide defeat,1273,0.98,e1bdk0,https://www.scmp.com/news/hong-kong/politics/article/3039151/hong-kong-elections-tsunami-disaffection-washes-over-city,160,2019-11-25,
Turkey's birth rate drops below 2.0 for the first time in history. There is now not a single European country with a fertility rate above replacement level.,1262,0.98,ezem6a,https://www.dailysabah.com/turkey/2019/05/18/fertility-rate-continues-to-decrease-in-turkey-drops-to-199-in-2018,419,2020-2-6,
Unfavorable Views of China Reach Historic Highs in Many Countries,1247,0.96,j6jt9d,https://www.pewresearch.org/global/2020/10/06/unfavorable-views-of-china-reach-historic-highs-in-many-countries/,259,2020-10-7,
"Pompeo certifies Hong Kong is no longer autonomous from China, jeopardizing billions of dollars in trade",1242,0.95,grnblu,https://www.cnn.com/2020/05/27/politics/hong-kong-pompeo-certification/index.html,200,2020-5-28,
China braces for international backlash in a post-coronavirus world,1216,0.94,g8veg8,https://www.scmp.com/news/china/diplomacy/article/3081601/coronavirus-infects-china-us-relations-blame-game-over,164,2020-4-27,
UK Bans Huawei From 5G Networks in Major Policy U-Turn,1205,0.97,hrg7ub,https://www.caixinglobal.com/2020-07-14/uk-bans-huawei-from-5g-networks-in-major-policy-u-turn-101579923.html,105,2020-7-15,
Turkish buffer zone to extend 32 km into Syria,1195,0.99,dfh2cy,https://i.redd.it/v16k4fozoir31.png,243,2019-10-9,
Afghan conflict: US and Taliban sign deal to end 18-year war,1188,0.98,fbcrrc,https://www.bbc.com/news/world-asia-51689443,222,2020-2-29,
"I am Maj. (ret) John Spencer, Chair of Urban Warfare Studies at West Point's Modern War Institute. Ask Me Anything about Geopolitics and War.",1190,0.96,a9nu8j,https://www.reddit.com/r/geopolitics/comments/a9nu8j/i_am_maj_ret_john_spencer_chair_of_urban_warfare/,597,2018-12-26,"**Maj. (ret) John W. Spencer** serves as the Chair of Urban Warfare Studies at the [Modern War Institute](https://mwi.usma.edu) and Co-Director of the Urban Warfare Project. He previously served as the Strategic Planner and then Deputy Director of the Modern War Institute where he was instrumental in the design and formation of the institute.

He enlisted in the US Army in 1993 and retired in 2018. He began his service as an enlisted Soldier in the Infantry for eight years, reaching the rank of Sergeant First Class, before attending Officer Candidate School in 2001 where he was commissioned as a Second Lieutenant in the Infantry.

His assignments as an officer included two combat deployments to Iraq as both an Infantry Platoon Leader and Company Commander, as a Ranger Instructor with the Army’s Ranger School, a Joint Chief of Staff and Army Staff intern, and fellow with the Chief of Staff of the Army’s Strategic Studies Group.

----

**See his:**

* [lecture on urban warfare](https://www.youtube.com/watch?v=BIXK2IyVsE4)

* [MWI's podcasts](https://mwi.usma.edu/category/podcasts/)

* [analysis](https://mwi.usma.edu/category/commentary-analysis/) and [research](https://mwi.usma.edu/category/research/)

* and their Twitter accounts ([here](https://twitter.com/SpencerGuard) and [here](https://twitter.com/WarInstitute))

----

**He answered questions ON TAPE->>> [here](https://www.youtube.com/watch?v=RTBJu3zD_Kk)**"
U.N. Human Rights Council Overwhelmingly Supports China’s Crackdown On Hong Kong,1182,0.93,ho6g7c,https://www.foxnews.com/politics/at-un-human-rights-council-53-back-chinas-hong-kong-crackdown,340,2020-7-10,
