title,score,upv_ratio,id,url,comms_num,created,body
"The reign of the Ayatollahs in Iran could be at an end. What's likely, in your opinion to replace it?",556,0.95,e106pz,https://www.reddit.com/r/geopolitics/comments/e106pz/the_reign_of_the_ayatollahs_in_iran_could_be_at/,141,2019-11-24,"Iran is in a state of turmoil, riots in over a hundred cities.  The finance ministry being set on fire due to a reduction in subsidies for diesel and gas. 

The Internet has been effectively turned off (traffic is under 9% of the normal amounts). 

Inflation is over 40%, GDP is expected to fall by 9% this year.

Credible news organisations are quoting rumours that Iranian airlines are on standby to evacuate the countries leaders and their families.

And now the women are revolting over the forced wearing of the Hijab.  (Male) leaders are calling for a referendum on the issue but the women don't seem to want the men to have a say in it.

It could be a revolution that occurs in a few days or weeks or it could drag out for years.  Becoming an other Venezuela or Syria.

How do you think that it's likely to progress and could it be a fairly orderly hand over or will it descend into an other failed state?"
Russia offers Iran sanctions-free oil route to Turkey and Syria,551,0.98,cyzfys,https://www.thetimes.co.uk/article/8b6515e4-ca6e-11e9-b1f3-b9799171edee,71,2019-9-3,
Trump announces 25 percent tariff on Chinese technology,552,0.96,8rana5,https://www.reuters.com/article/us-usa-trade-china-trump-tech/trump-announces-25-percent-tariff-on-chinese-technology-idUSKBN1JB1I1,332,2018-6-15,
Why isn't there more reaction from countries in the face of the Interpol chief being abducted?,546,0.93,9xmvur,https://www.reddit.com/r/geopolitics/comments/9xmvur/why_isnt_there_more_reaction_from_countries_in/,255,2018-11-16,"It seems like a huge deal to me and the reaction from all countries around the world has been less than timide almost hushed up...

&#x200B;

[https://www.bbc.com/news/world-asia-45771813](https://www.bbc.com/news/world-asia-45771813)

&#x200B;

&#x200B;

Edit : It seems his wife and kids have just asked for asylum in France after receiving threats from China...  


[https://www.bbc.com/news/world-europe-46919289](https://www.bbc.com/news/world-europe-46919289)

&#x200B;"
New Caledonia Voting on Independence from France: Round Two,550,0.99,j4taae,https://www.polgeonow.com/2020/10/new-caledonia-independence-referendum-2020.html,74,2020-10-4,
The West's never ending quest to 'de-radicalise' dissent,553,0.88,ipgt41,https://www.aljazeera.com/indepth/opinion/west-quest-de-radicalise-dissent-200904120205142.html,138,2020-9-9,
U.S. to Withdraw From Major Nuclear Arms Treaty - Citing Russian Violations,548,0.97,agmzzh,https://www.haaretz.com/us-news/u-s-to-withdraw-from-major-nuclear-arms-treaty-citing-russian-violations-1.6848469,66,2019-1-17,
"5 more Chinese warships spotted in Philippine waters in July, August",550,0.92,cqc8yr,https://www.rappler.com/nation/237764-more-chinese-warships-spotted-philippine-waters-july-august-2019,69,2019-8-15,
Erdogan’s Ambitions Go Beyond Syria. He Says He Wants Nuclear Weapons.,547,0.95,dlfq97,https://www.nytimes.com/2019/10/20/world/middleeast/erdogan-turkey-nuclear-weapons-trump.html,86,2019-10-22,
"Armenia and Azerbaijan agree to ""prepare populations for peace""",548,0.98,agwk38,https://eurasianet.org/armenia-and-azerbaijan-agree-to-prepare-populations-for-peace,17,2019-1-17,
Military balance on the Korean peninsula,549,0.93,7v5pe6,https://i.redd.it/5wh9xhocs5e01.jpg,187,2018-2-4,
Former Prince Mohammed bin Nayef and two other members of the Royal Family detained in Saudi Arabia,541,0.97,feop0s,https://www.nytimes.com/2020/03/06/world/middleeast/saudi-royal-arrest.html?action=click&module=Top%20Stories&pgtype=Homepage,71,2020-3-7,
Swedish navy returns to vast underground HQ amid Russia fears,548,0.98,dbfjhw,https://www.theguardian.com/world/2019/sep/30/swedish-navy-returns-to-vast-underground-hq-amid-russia-fears,115,2019-10-1,
"1,366 Civilians killed in Afghanistan in the first 6 months of 2019",544,0.95,cjpizx,https://i.redd.it/mmsku2h4yed31.jpg,29,2019-7-30,
US to send troops to Saudi Arabia,542,0.98,d7424o,https://www.bbc.com/news/world-us-canada-49777672,143,2019-9-21,
Some thoughts on the evolving pro-Chinese presence in this subreddit [Meta],544,0.93,b2quz3,https://www.reddit.com/r/geopolitics/comments/b2quz3/some_thoughts_on_the_evolving_prochinese_presence/,309,2019-3-19,"By now I'm sure quite a few of us have read the Buzzfeed News article about Reddit and this subreddit in particular being a place where discourse has been increasingly ""pro-Chinese"". I've been part of this subreddit for about 3 years now, and for better or worse my area of interest (being Chinese geopolitics and China related military development) and my activity on this subreddit has given me some slight profile, where I now feel obliged to discuss this elephant in the room. I've contacted /u/dieyoufool3 regarding this post and he's given me the nod to make it. I don't want to step on the mod team's toes and I think they've done a good job of running the subreddit overall to allow a variety of different arguments compete and be reviewed on the basis of the logic and merit of the arguments themselves. This may end up being a bit of a long textpost, so I apologize for that.

*Edit: seeing as I'm receiving a few comments about this -- I do not necessarily endorse or agree with the contents of the full Buzzfeed News article. However I do think it is a useful springboard for talking about what some people in this subreddit and on Reddit overall have been complaining about. To make it clear, the extent of my opinion is that this subreddit is technically more ""pro-China"" i.e.: less ""anti-China"" than the rest of Reddit tends to be. I lay this out in one of the paragraphs in point 1, however I want to put it clearly out here so no one misses it.*

======

This subreddit is a public space where competing ideas exist, but that nature means it is possible for third parties to try and artificially alter the route and form of the community's discussion and debate without participating it in good faith or without constructively contributing. I see three main challenges for the mod team here (but also indeed for any subreddit or community):

1. Intent of the user
2. Boundaries of discourse
3. Brigading and vote manipulation

I've been ruminating about this China specific issue on this subreddit for a while now. Part of the reason is because I have definitely noticed this subreddit has having a larger amount of individuals who are ""pro-Chinese"" than most average/default subreddits on Reddit. Another part of the reason is because I myself have been accused of being a propagandist, a wumao, a shill or a troll in the past as well. I'm aware of at least one individual who has even followed me on this account and created a subreddit to commentate and mock my activity. So I think now is a good time to start talking about the China discourse here openly. To start off;

&#x200B;

**1, Intent of the user:**

* This refers to whether a user on the subreddit is a real person who is part of this ""community"" and is interested in constructively contributing to it, rather than someone ""outside"" of the community, such as bots (which are obviously not people) or foreign ""shills"" (where their posts and contributions are a result of being paid or incentivized to post things they themselves may not believe in). Obviously for any community, the desire is to only have real people who are interested in having a genuine discussion.
* I imagine the mod team may have some resources to be able to identify which users are bots and/or replica accounts. I'm not sure if this may include IP identification or if it is more primitive like simply checking the history of the user (e.g.: many low effort contributions from day old accounts).
* Unfortunately, I think it's much more difficult to identify ""shills"" because it is impossible to identify an individual who is being paid to post about a particular belief or argument versus an individual who does genuinely believe about said belief or argument. Some people may suggest one way of tracking such individuals is by looking through their history, and if their post and comment history only revolves around discussing a particular set of topics, it may be a useful indicator to identify a ""shill"". On first glance that is not illogical, however I also think there are more than a few people who have used dedicated accounts to talk about these issues because they are interested in it -- in fact this particular account I've been using for the last few years is one I deliberately created to only talk about China related geopolitics and PLA developments, because my main Reddit account is one I use to browse other lighter, less intense topics (obviously I leave the two accounts well segregated). My main Reddit account also has some comments where it may be possible for me to be doxxed, and I'm sure I don't need to explain my caution around how some of my posts or comments may be received by some individuals who could end up being genuinely hostile.
* It is very easy to call someone you disagree with a shill, or a troll, a bot or a wumao or a propagandist, or brainwashed. I avoid doing so, because when that card is pulled, it is essentially the equivalent of forfeiting the argument as well as suggesting that the other person across the screen you are debating with is not a genuine person with genuine opinions. In a place where the purpose is to have constructive discussion, dismissing a person's belief in their opinion as fabricated is among the most egregious and low effort statements one can make.
* Finally, I feel obliged to speculate about the noted higher prevalence of ""pro-Chinese"" users on this subreddit versus the rest of the website (though I certainly don't think that group of users is anywhere near a majority of the 140k people here). People have understandably been concerned if this subreddit might be targeted by Chinese govt influence groups. Based on my time in the subreddit as well as based on a few people who have contacted me in the past, I hypothesize the higher prevalence of ""pro-Chinese"" users here is a reflection of greater interest in ""geopolitical"" matters from the overseas Chinese community in contemporary times compared to the past.
* Some people may have guessed this in the past, but I do have Chinese heritage in me (I won't disclose if it's part, half or whole), and as someone living in a ""western nation"" I have of course observed the way in which news media and commentary have written about China within the last decade or more (often in a context of power trajectory and/or geopolitics). That environment that in turn has led me to be interested in China related geopolitics. I obviously do not speak for all individuals with Chinese heritage, but I've been contacted by a few on this account who have described a similar trajectory of interest. In short, I wonder if Chinese individuals of a certain era living in the English speaking world may be on average more interested in geopolitics than other demographic groups on average -- and on Reddit the cross section of that means there may be a higher proportion of /r/geopolitics users of a Chinese background than elsewhere on Reddit, relatively speaking. However this is merely a hypothesis and not any sort of watertight argument. It is also very possible that this subreddit do not have a greater proportion individuals of a Chinese background than the rest of Reddit, but it merely attracts individuals who have a certain way of thinking or a worldview that causes this subreddit to seem more pro-Chinese than the rest of Reddit.

&#x200B;

**2, Boundaries of discourse**

* The moderators are free to choose what the boundaries of discussion are on this subreddit, which I think is an authority we do respect. The complex problem that is posed to them, is where to set those boundaries.
* Obviously everyone would agree that things like advocating for violence or genocide or denying the occurrence of historical atrocities would very much be beyond the pale. Similarly, posts including offensive language and personal attacks are also not appropriate for a subreddit with standards.
* But there are obviously many other topics were a range of opinions exist and consensus does not exist. For China related topics (given the focus of this post), this may include interpretations of the Tiananmen protests in 1989, to the legitimacy of the CCP and the Chinese govt, to the nature of the Chinese economy, as well as some more recent heated issues like Chinese re-education efforts in Xinjiang and the social credit system in the country. On the larger scale, topics of debate like the nature of the international legal order, the balance of power of the UN, the fairness of international financial institutions, are various other contentious topics we've seen debated here.
* Individuals of differing backgrounds will have differing opinions about a range of topics. Our opinions and worldviews are a reflection of the way we were socialized by family, friends, media, history and education. To my understanding, I believe this subreddit is open to having opinions from a range of different backgrounds contribute so long as they remain within clear boundaries. I do not believe this subreddit is an ""echo chamber"" that only exclusively pushes a single nation or group's views on all issues. In my opinion this is a good thing, because to have proper discussion about geopolitics one cannot merely only hear what you yourself believe but also what to hear what other groups believe. I myself have learned a lot from a number of users in this subreddit from different backgrounds, including people whose opinions I initially may have disagreed with.
* However, I also appreciate that sometimes merely allowing the debate of certain topics leads to the normalization of certain discourses. Something that was previously seen as completely indefensible may, after some debate, be seen as perhaps not entirely unreasonable under a certain set of circumstances.
* Wherever the moderators choose to set the boundaries either now or in the future, it is an unenviable task.

&#x200B;

**3, Brigading and vote manipulation**

* We all know what brigading and vote manipulation means. I'm not sure if other places have ever coordinated to deliberately manipulate votes or alter contributions or comments here. If so, that is obviously undesirable. I'm not sure how easy it is for the moderators to track this behaviour, but it is somewhat related to the issues of user intent from point 1.
* The infamous case of Unidan also showed us how easy it is for a few alt accounts to alter the vote trajectory of certain comments and to make them obscure. As a matter of principle I do not downvote comments that I disagree with or comments that I am engaged in a debate with. However receiving downvoting due to genuine individuals who disagree with a particular comment also happens, and I imagine it is difficult to distinguish that versus coordinated vote manipulation.
* The votes of a post or comment tend to be perceived as reflecting the amount of support it has. This is inherently tied to whether the contributing upvotes or downvotes to a certain post is a reflection of outside vote manipulation or if it a reflection of the actual demographics of the genuine user base. Hypothetically, if there was a way to determine that the votes of a comment or post are the result of the genuine user base, then the question to be asked is how comfortable the moderator team is in having that proportion of their user base holding those views -- i.e.: tying back to point 2.

=====

Given this subreddit is meant to talk about geopolitics, it is almost impossible to talk about geopolitics without occasionally talking about China related geopolitical events. Naturally there will be debate that follows.

I appreciate that a good portion of this subreddit's userbase likely resides in the western, English speaking world (with a higher proportion from that demographic as part of Reddit's overall userbase). It is likely that many of the arguments made from users of a Chinese background, seem alien and perhaps even outrageous to the extent that they are perceived as being made from professional propagandists. I have no solution for those kind of concerns, and it is up to the moderator team or even Reddit admin to consider how much range of debate this subreddit should have for the complex and international topic that is geopolitics (not only China related topics but all topics in future).

But personally, in my time here I've found this subreddit to overwhelmingly be a place of genuine debate about genuine ideas from genuine people. I do my best to contribute constructively and to use language that is not overly emotive, and I think many people here do so as well. I hope this subreddit can remain so in the future."
Kim Says He’ll Give Up Weapons if U.S. Promises Not to Invade,537,0.96,8frkit,https://www.nytimes.com/2018/04/29/world/asia/north-korea-trump-nuclear.html,271,2018-4-29,
"Australia targeted by 'state-based' cyber attack, PM Morrison says",537,0.96,hbr77v,https://www.bbc.com/news/world-australia-46096768,80,2020-6-19,
Trump asks Japan to hike payments for U.S. troops to $8 billion: Foreign Policy,541,0.98,dx7hsm,https://www.reuters.com/article/us-japan-usa/trump-asked-tokyo-for-8-billion-to-keep-u-s-troops-in-japan-foreign-policy-idUSKBN1XQ06F?feedType=RSS&feedName=worldNews&utm_source=reddit.com&utm_medium=feed&utm_campaign=Feed%3A+Reuters%2FworldNews+%28Reuters+World+News%29,264,2019-11-16,
Emmanuel Macron warns Europe: NATO is brain-dead,540,0.97,dswxx5,https://www.economist.com/europe/2019/11/07/emmanuel-macron-warns-europe-nato-is-brain-dead,252,2019-11-7,
"Turkey and Libya signed a maritime border agreement despite not having actual borders. Greece called it a geographical absurdity, and Egypt is angry.",535,0.99,e3htnp,https://www.reddit.com/r/geopolitics/comments/e3htnp/turkey_and_libya_signed_a_maritime_border/,99,2019-11-30,"Turkey is being accused of geographical revisionism

This week, one of Libya's governments signed an agreement with Turkey to organise oil exploration in their shared border area.

Greece, Cyprus, and Egypt see it as Turkish encroachment on their EEZs and say there's no real border between the two countries.

[From Twitter. Image shows where Turkey\/Libyan border allegedly make contact. But seems both countries have ignored there is Crete in the way](https://preview.redd.it/b2q3pkmcun141.png?width=679&format=png&auto=webp&s=05d70dc6e56795e29e8f19381dbe637ae9fb711e)

Read more here

[https://www.alaraby.co.uk/english/news/2019/11/29/greece-cyprus-egypt-outraged-by-libyan-turkish-maritime-border-agreement](https://www.alaraby.co.uk/english/news/2019/11/29/greece-cyprus-egypt-outraged-by-libyan-turkish-maritime-border-agreement)"
China's Xi allowed to remain 'president for life' as term limits removed,538,0.95,83m5lm,http://www.bbc.com/news/world-asia-china-43361276,218,2018-3-11,
US quits UN human rights council,532,0.97,8sciz7,https://www.bbc.com/news/44537372,293,2018-6-20,
"President Abbas declares end to agreements with Israel, US; turns over responsibility on occupied lands to Israel.",536,0.97,gmy3hj,http://english.wafa.ps/page.aspx?id=59OHMya117154132029a59OHMy,47,2020-5-20,
"Northern Ireland does not support a United Ireland, according to new poll",535,0.92,f818o4,https://www.irishcentral.com/news/politics/northern-ireland-does-not-support-united-ireland-poll,102,2020-2-23,
EU to push Australia to clean up petrol standards as part of free trade deal,533,0.98,cyo1yg,https://www.theguardian.com/australia-news/2019/sep/02/eu-to-push-australia-to-clean-up-petrol-standards-as-part-of-free-trade-deal,20,2019-9-2,
Map: North Macedonia Joins NATO,530,0.98,fwct9q,https://www.polgeonow.com/2020/04/north-macedonia-joins-nato-members-map.html,99,2020-4-7,
"The More Things Change, The More They Stay the Same: How the UAE-Israel Agreement Could Upend the Middle East’s Status Quo",530,0.95,iq2wm1,https://www.crossfirekm.org/articles/the-more-things-change-the-more-they-stay-the-same-how-the-uae-israel-agreement-could-upend-the-middle-east-status-quo,64,2020-9-10,
How many 'sleeping tigers' are there right now?,530,0.98,fe6ao5,https://www.reddit.com/r/geopolitics/comments/fe6ao5/how_many_sleeping_tigers_are_there_right_now/,256,2020-3-6,"Napoleon said of China ""Let China sleep, for when she wakes she will shake the world.""

So China, before it 'woke up' and started some ABSURD economic growth, was sometimes called a sleeping tiger. Aka, a place with a massive potential to be a superpower once the worst of their problems were sorted out. 

Now they're kind of like the USA, utterly massive and with an industrial and manpower advantage over other countries on a scale that's absolutely silly. 

Are there other sleeping tigers out there? Obviously India, but they're half awake already, more of a sleep walking tiger you could say. 

Population of Indonesia is pretty crazy, are they a candidate? Perhaps Brazil?"
Afghans mark Soviet withdrawal as US negotiates its own exit,531,0.98,f4bxy6,https://apnews.com/910db1b3ed418e302ce0abdc62d9b870,71,2020-2-16,
US and Chinese Free Trade Agreements mapped,526,0.97,ctzbf0,https://i.redd.it/1f2lymctu0i31.png,16,2019-8-22,
The Top 5 military spenders in 2019; Nominal vs Adjusted For Purchasing Power Parity,529,0.92,gijtv7,https://i.redd.it/pcsyzmxr9ey41.png,111,2020-5-13,
"Mao Zedong meets Richard Nixon, February 21, 1972.",525,0.99,jg4ht8,https://www.documentcloud.org/documents/7002637-Mao-Zedong-Richard-Nixon-February-21-1972-Document.html#document/p4,58,2020-10-23,
Russian Government's Resignation,536,0.97,ep2lsd,https://www.reddit.com/r/geopolitics/comments/ep2lsd/russian_governments_resignation/,146,2020-1-15,"Reports of the Russian government's resignation are coming in, in what is a rather sudden and unexpected development. What is going on, and what effects could this potentially have on geopolitics?

 [https://www.independent.co.uk/news/world/europe/dmitry-medvedev-resign-russia-prime-minister-putin-quit-latest-a9284741.html](https://www.independent.co.uk/news/world/europe/dmitry-medvedev-resign-russia-prime-minister-putin-quit-latest-a9284741.html)"
Prime Minister of Pro-Russia Donetsk People's Republic has been assassinated in a cafe explosion - Russian Foreign Ministry blames Ukraine,528,0.96,9bv20w,https://apnews.com/9d8c45ae44a04615b4e3a6ef53f3eb72/Ukraine-separatists-report-death-of-leader-Zakharchenko,123,2018-9-1,
"The India-China Border Dispute: Origins, Implications & Future Prospects",533,0.97,j2mu7n,https://www.crossfirekm.org/articles/the-india-china-border-dispute-origins-implications-future-prospects,143,2020-9-30,
Why is South Africa in the G20?,529,0.96,if1t2k,https://www.reddit.com/r/geopolitics/comments/if1t2k/why_is_south_africa_in_the_g20/,162,2020-8-23,"Their economy is tiny (36th largest in the world and falling), they're basically non-existent geopolitically and they're not even the largest economy on Africa anymore. Surprisingly, I don't see any people questioning what they're doing in a club among the richest countries on the planet in the first place.

If the G20 wants at least one African country on board they should just replace them with Nigeria, otherwise Thailand or Switzerland would be good replacements as well."
7 countries responsible for 90% of the UN's Budget deficit of ~$1.4b,523,0.96,dhe3i9,https://www.hindustantimes.com/world-news/stalled-escalators-empty-water-coolers-at-un-as-budget-crunch-hits/story-bZtJwQzcjloyFY6HygUMdL.html?fbclid=IwAR3gLHhDz0Pahpl8-YNJTiqyVqx_0LB04MMhFubg8goB-RoqTMJMMvAOCQU,124,2019-10-14,
Colombia suggests alliance with Brazil's Bolsonaro to overthrow Venezuela's Maduro: report,531,0.96,9vl2sz,https://colombiareports.com/colombia-suggests-alliance-with-brazils-far-right-bolsonaro-to-overthrow-venezuelas-government-report/,23,2018-11-9,
Why Russia Is Biding Its Time on Nagorno-Karabakh,528,0.97,jaec0i,https://carnegie.ru/commentary/82933,34,2020-10-13,
Pressure mounts on India to call out China for Covid as it readies to take lead role at WHO.,526,0.91,gc33qn,https://theprint.in/diplomacy/pressure-mounts-on-india-to-call-out-china-for-covid-as-it-readies-to-take-lead-role-at-who/413153/?amp,52,2020-5-2,
"The Netherlands will not contribute more to EU Budget, PM says",526,0.97,f36e27,https://nltimes.nl/2020/02/06/netherlands-will-contribute-eu-budget-dutch-pm-says,205,2020-2-13,
A critical look at Chinese ‘debt-trap diplomacy’,529,0.96,ebsgrm,https://www.tandfonline.com/doi/full/10.1080/23792949.2019.1689828?tab=permissions&scroll=top,87,2019-12-17,
Humanitarian Crisis Unfolds In and Around Nagorny Karabakh,524,0.95,jc8pe4,https://www.chathamhouse.org/2020/10/humanitarian-crisis-unfolds-and-around-nagorny-karabakh,99,2020-10-16,
There’s No Containment Strategy for Climate Change,521,0.97,ikqs3q,https://warontherocks.com/2020/09/theres-no-containment-strategy-for-climate-change/,79,2020-9-2,
It looks like Iran is going to follow the Russian route with MH117 in fully denying any culpability for the plane crash. What are the geopolitical calculations behind this?,525,0.92,empc77,https://www.reddit.com/r/geopolitics/comments/empc77/it_looks_like_iran_is_going_to_follow_the_russian/,190,2020-1-10,
Russia's Urban Warfare Technology Developments,524,0.98,iv7n30,https://mwi.usma.edu/russias-urban-warfare-tech/,41,2020-9-18,
Egypt: Ethiopia rejecting 'fundamental issues' on Nile dam,525,0.99,hezlvq,https://apnews.com/e610f15fda86a450f0e528c49622fd25,309,2020-6-24,
