title,score,upv_ratio,id,url,comms_num,created,body
"Animal rights group offers $5,000 reward for information on who put 'Trump 2020' sticker on a bear",133,0.94,i4e9sw,https://www.cnn.com/2020/08/03/us/trump-bear-collar-trnd/index.html,11,2020-8-6,
Belgian Man Keeps Mysteriously Receiving Loads Of Pizza He Didn’t Order,137,0.96,gt781p,https://www.unilad.co.uk/food/oap-keeps-mysteriously-receiving-loads-of-pizza-he-didnt-order/?source=facebook,6,2020-5-30,
Obese American passenger forces Taiwanese flight attendant to wipe his butt on plane,137,0.92,aj2kmn,https://shanghai.ist/2019/01/22/obese-american-passenger-forces-taiwanese-flight-attendant-to-wipe-his-butt-on-plane/?fbclid=IwAR2HLVZa2Z2rcAKXt2ddKfx7YJgXo8bhodzF4022vy5AxKYxDHlJLoXffZM,56,2019-1-24,
Protesters chase Homeland Security secretary from Mexican restaurant,138,0.94,8sjqkg,https://nypost.com/2018/06/19/protesters-chase-homeland-security-secretary-from-mexican-restaurant/,23,2018-6-21,
Bolivian orchestra stranded at ‘haunted’ German castle surrounded by wolves,133,0.96,gpt86b,https://nypost.com/2020/05/23/bolivian-orchestra-stuck-at-german-castle-surrounded-by-wolves/,6,2020-5-25,
Zamboni driver wins first NHL game after being tapped as emergency goalie,135,0.96,f8ey6n,https://www.nbcnews.com/news/sports/zamboni-driver-wins-first-nhl-game-after-being-tapped-emergency-n1141371,4,2020-2-24,
Driverless Tesla Model 3 Pulled Over By Police For Failure To Stop,135,0.96,dd777s,https://insideevs.com/news/374412/video-tesla-model3-smart-summon-police/,11,2019-10-4,
"Bangladeshi woman with two wombs gives birth to twins, a month after delivering a boy",131,0.99,b67glt,http://www.newindianexpress.com/world/2019/mar/27/bangladeshi-woman-with-two-wombs-gives-birth-to-twins-a-month-after-delivering-a-boy-1956680.html,4,2019-3-28,
"Guy In Florida Loads Car With Frozen Iguanas, They Warm Up, Come Back To Life, Cause Car Accident",132,0.96,estaq1,https://www.whiskeyriff.com/2018/01/08/guy-in-florida-loads-car-with-frozen-iguanas-they-warm-up-come-back-to-life-cause-car-accident/,6,2020-1-23,
Gull steals weed stash as cops close in for arrest,131,0.98,ctz6am,https://theleafdesk.com/gull-steals-weed-stash-as-cops-close-in-for-arrest/,20,2019-8-22,
"It's so hot in Spain that manure self-ignited, sparking a 10,000-acre wildfire",135,0.96,c6sq34,https://www.cnn.com/2019/06/27/world/europe-heat-wave-spain-wildfire-intl/index.html?r=https%3A%2F%2Fwww.cnn.com%2F,15,2019-6-29,
Black man becomes president of neo-Nazi group he intends to destroy,134,0.94,awrs6u,https://www.cnn.com/2019/03/02/us/black-president-nazi-group/index.html?,4,2019-3-3,
College student finds man hiding in her closet and wearing her clothes,133,0.97,ang08v,https://www.yahoo.com/lifestyle/college-student-finds-man-hiding-closet-wearing-clothes-101154332.html,18,2019-2-6,
Skier missing from upstate NY mountain found alive and still wearing ski clothes in Sacramento.,130,0.97,7xe0p7,http://www.mynbc5.com/article/missing-whiteface-skier-found-in-california/17764938,17,2018-2-14,
"Murdered Baltimore Police Officer was set to testify in police Corruption case, shot with own gun.",137,0.99,7f191e,https://www.yahoo.com/gma/murdered-baltimore-cop-shot-own-gun-set-testify-074407852--abc-news-topstories.html,2,2017-11-24,
Donald Trump Jr.'s Bizarre Halloween 'Lesson' Backfires Spectacularly,131,0.85,7a33h7,https://www.yahoo.com/news/donald-trump-jr-apos-bizarre-023517376.html,23,2017-11-1,
Selfies have killed more people than sharks this year,134,0.95,3lxk0q,http://metro.co.uk/2015/09/22/selfies-have-killed-more-people-than-sharks-this-year-5402717/?,5,2015-9-22,
"Joe Biden more likely to survive next term than Trump, both likely to live past 85, new ""super-ager"" study finds",133,0.84,j5211j,https://www.newsweek.com/joe-biden-more-likely-survive-4-year-term-trump-super-ager-study-finds-1536219,10,2020-10-5,
Poachers shoot one of their own in Karnataka (India) forest mistaking him for wild animal,132,0.98,hapqqz,https://www.newindianexpress.com/states/karnataka/2020/jun/15/poachers-shoot-one-of-their-own-in-karnataka-forest-mistaking-him-for-wild-animal-2156892.html,8,2020-6-17,
Air Force finally retires 8-inch floppies from missile launch control system,132,0.97,djpw1v,https://arstechnica.com/information-technology/2019/10/air-force-finally-retires-8-inch-floppies-from-missile-launch-control-system/,11,2019-10-19,
Tennessee lawmaker Kerry Roberts calls for removal of higher education,134,0.95,d293nv,https://eu.tennessean.com/story/news/politics/2019/09/09/tennessee-lawmaker-kerry-roberts-calls-removal-higher-education/2269207001/,9,2019-9-10,
President Donald Trump taken on by unlikely foe: Badass park rangers,136,0.88,5qe2cw,https://www.theregister.co.uk/2017/01/25/trump_taken_on_by_park_rangers/,9,2017-1-27,
People are mocking the Oregon 'militia' on social media by calling them 'YallQaeda' and 'VanillaISIS',133,0.92,3zgarv,http://news.yahoo.com/people-mocking-oregon-militia-social-023318196.html?nf=1,24,2016-1-5,
"This Chinese cockroach farm houses a billion roaches, kept contained by a moat filled with hungry fish",131,0.98,ix2udw,https://www.abc.net.au/news/2020-09-19/inside-a-chinese-cockroach-farm/12672476,15,2020-9-21,
Lion cubs legs were Purposely Broken so he could not escape while tourists took selfies,134,0.86,h7kbmr,https://dailycolumn.com.au/lion-cub-used-as-photo-prop-for-tourists-had-its-hind-legs-intentionally-broken-by-abusers/,17,2020-6-12,
Conspiracy theorists burn 5G towers claiming link to virus,136,0.95,g5cr66,https://apnews.com/4ac3679b6f39e8bd2561c1c8eeafd855,12,2020-4-21,
"Stolen therapy goat found, reunited with depressed cow",132,0.97,eox4iu,https://www.newshub.co.nz/home/rural/2020/01/stolen-northland-therapy-goat-found-reunited-with-depressed-cow.html,12,2020-1-15,
Texas Man Faces 1 Year in Jail for Ice Cream-Licking Incident,132,0.97,cuo8w3,https://spectrumlocalnews.com/tx/san-antonio/news/2019/08/23/texas-man-faces-1-year-in-jail-for-ice-cream-licking-incident,40,2019-8-24,
Surfers are putting eyes on the bottom of their boards to freak out sharks and stop themselves getting attacked,135,0.98,csou24,https://www.insider.com/surfers-paint-eyes-surfboards-freak-out-sharks-2019-8,26,2019-8-20,
Man found hiding in bunker for 3 years to avoid prison,129,0.99,crb7td,https://www.cnn.com/2019/08/16/us/fugitive-hiding-bunker-wisconsin-trnd/index.html,12,2019-8-17,
"Husband and wife kept Chinese tourists as sex slaves in Portland homes, prosecutors say",131,0.94,a66lvu,https://bangordailynews.com/2018/12/13/news/portland/husband-and-wife-kept-chinese-tourists-as-sex-slaves-in-portland-homes-prosecutors-say/,14,2018-12-15,
"Pregnant single woman writes letter to Pope Francis asking for advice. Pope calls her cell phone, reassures her that she'll be fine, offers to list himself as the child's father",131,0.88,1luq9g,http://www.theamericanconservative.com/dreher/a-pope-who-knows-how-to-pope/,15,2013-9-6,
Hunter killed by elk in a clear case of self defense.,127,0.96,ijsz9c,https://katu.com/news/local/hunter-killed-by-elk-in-tillamook-county,16,2020-8-31,
"A man who wore a watermelon on his head while stealing from a convenience store has been arrested — The duo pulled up in a lifted 2006 black Toyota Tacoma pickup truck and entered a Sheetz store in Louisa, VA on May 5 while wearing carved out watermelons with holes cut out for their eyes.",131,0.95,gmcy3w,https://www.cnn.com/2020/05/18/us/watermelon-head-louisa-arrested-trnd/index.html,7,2020-5-19,
Woman Suffers Heart Attack Trying to Explain Math Problem to Son,130,0.98,dtf4or,https://www.odditycentral.com/news/woman-suffers-heart-attack-trying-to-explain-math-problem-to-son.html,3,2019-11-8,
"Indiana woman found dead with python wrapped around her neck, 140 snakes in 'reptile home,' police say",127,0.99,dpu5q8,https://www.msn.com/en-us/news/us/indiana-woman-found-dead-with-python-wrapped-around-her-neck-140-snakes-in-reptile-home-police-say/ar-AAJDNpm,10,2019-11-1,
Dad of three died in freak accident after wife locked him in steel shed to stop him drinking,133,0.97,d384p2,https://news.yahoo.com/husband-died-in-freak-accident-after-wife-locked-him-in-steel-shed-to-stop-him-drinking-091714066.html,25,2019-9-12,
Rabies Alert Issued at Disney World's Epcot Due to Feral Cat,131,0.98,ccphpi,https://time.com/5625816/disney-epcot-rabies-alert-feral-cat/,2,2019-7-13,
Suspect farts so loudly law enforcement was able to locate him hiding,133,0.99,cbd2nx,https://www.kshb.com/news/local-news/untimely-flatulence-leads-to-arrest-of-northland-criminal-hiding-from-law-enforcement,5,2019-7-10,
Germany just released an unspeakably ugly coin commemorating the currywurst,129,0.98,b270xi,https://qz.com/1523284/a-german-mint-just-released-a-coin-commemorating-70-years-of-currywurst-and-its-unspeakably-ugly/,20,2019-3-18,
"Little Girls Keep Finding Ancient Swords in Lakes: Thanks to climate change, what lies beneath is coming to the surface.",127,0.97,a83mvm,https://www.okwhatever.org/topics/things/swords-found-in-lakes-by-little-girls,25,2018-12-21,
"Ahem, Alex Jones Now Says Donald Trump Is Being Covertly Drugged",133,0.92,6zp78m,http://www.huffingtonpost.com/entry/ahem-alex-jones-now-says-donald-trump-is-being-covertly-drugged_us_59b7d93de4b031cc65cca681,15,2017-9-13,
Hacker deletes all of Soulja Boy's music videos from YouTube,134,0.96,1an7ej,http://www.3news.co.nz/Hacker-deletes-all-of-Soulja-Boys-music-videos/tabid/418/articleID/290987/Default.aspx,14,2013-3-20,
Parents adopted a 6-year-old Ukranian girl who turned out to be 22-year-old posing as a child,128,0.86,dbf9cs,https://www.dailymail.co.uk/news/article-7479061/Mom-claims-Ukrainian-daughter-9-adopted-really-22-year-old-dwarfism.html,20,2019-10-1,
Man goes into hospital for botox and leaves with circumcision after NHS blunder.,129,0.95,cmf35r,https://www.mirror.co.uk/news/uk-news/nhs-hospital-botox-circumcision-blunder-18830395,21,2019-8-6,
Woman is caught by her own security camera fire bombing her neighbors house.,128,0.97,c5w08q,https://www.ctvnews.ca/world/woman-s-own-security-camera-allegedly-captures-her-firebombing-neighbour-s-home-1.4483069,9,2019-6-27,
Primates with smaller genitalia compensate by being flashy and aggressive,132,0.95,bcl6q0,https://www.nydailynews.com/news/national/ny-primates-smaller-gonads-genitalia-compensate-20190410-3ydimpfjofdflpkuvrtj3fimx4-story.html,12,2019-4-13,
Native American Women Say Their Daughters Are Disappearing But No One is Taking Action,128,0.96,b3t095,https://www.wdsu.com/article/native-american-women-say-their-daughters-are-disappearing-but-no-one-is-taking-action/26767807,12,2019-3-22,
"Taylor Swift’s Lyrics Are Too Lame to Copyright, Judge Hilariously Rules",128,0.97,7xmbv4,https://www.thedailybeast.com/taylor-swifts-lyrics-are-too-lame-to-copyright-judge-rules?,9,2018-2-15,
Can We All Thank Him For Supplying Us With Our Daily Weird News?,130,0.89,1dgp9f,http://imgur.com/uRdf15M,10,2013-5-1,
Japan police: Heatstroke cause of death of woman found with scissors in head,129,0.98,ha1i28,https://www.tokyoreporter.com/japan/osaka-police-heatstroke-cause-of-death-of-woman-found-with-scissors-in-head/,7,2020-6-16,
Hells Angels Showed Up Too Drunk or Too Hungover to Participate in Own Anniversary Ride,125,0.97,bygsy3,https://www.newsweek.com/hells-angels-were-too-hungover-still-drunk-ride-out-marking-50th-anniversary-first-uk-branch-1442010,8,2019-6-9,
"A man at Outback pretends to get stood up on Valentine's Day, gets a free meal",129,0.97,aqywp6,https://www.foxnews.com/food-drink/man-at-outback-pretends-to-get-stood-up-on-valentines-day-gets-free-meal,15,2019-2-16,
Police: 75-year-old woman shot grandson for putting cup of tea on furniture,128,0.97,ag8a96,https://www.wxii12.com/article/police-75-year-old-woman-shot-grandson-for-putting-cup-of-tea-on-furniture/24068309,16,2019-1-15,
Satanists want to use Hobby Lobby decision to exempt women from anti-abortion laws.,127,0.95,2by65h,http://www.rawstory.com/rs/2014/07/28/satanists-want-to-use-hobby-lobby-decision-to-exempt-women-from-anti-abortion-laws/,19,2014-7-28,
Mind-controlling fungus makes zombie cicadas lure other cicadas to a zombie fate,124,0.97,i1bdee,https://www.livescience.com/zombie-cicadas-lure-victims.html,4,2020-8-1,
Tiger King zoo handed to rival Carole Baskin,128,0.93,gvopzk,https://www.bbc.com/news/entertainment-arts-52888484,30,2020-6-3,
"Wild boar discover and snort £17,000 of cocaine in Tuscan forest",126,0.99,dwxh5q,https://news.sky.com/story/wild-boar-discover-and-snort-17000-of-cocaine-in-tuscan-forest-11861940,10,2019-11-16,
"Ex-N.J. cop gets probation after admitting to groping at bar. And as always, now we the Hardworking Taxpayers will end up paying for a $1M lawsuit.",128,0.96,bxygjx,https://www.nj.com/news/2019/06/ex-nj-cop-gets-probation-after-admitting-to-groping-at-bar-victim-plans-1m-lawsuit.html,4,2019-6-8,
"Police told Native American woman to ""Quit Faking"" before she died in police custody. Family seeks justice while mainstream media overlooks Lakota woman's death",128,0.91,3ez30m,https://www.the-newshub.com/general/police-told-native-american-woman-to-quit-faking-before-she-died-in-police-custody,9,2015-7-29,
KFC suspends its 'finger lickin' good' slogan because of coronavirus,126,0.97,ifwvea,https://www.cnn.com/2020/08/24/business/kfc-slogan-coronavirus-trnd/index.html,9,2020-8-25,
"Popular Kansas restaurant accidentally misses 100,000th chicken fried steak ordered milestone",123,0.96,i1vkfs,https://www.kansas.com/entertainment/restaurants/dining-with-denise-neil/article244602802.html,14,2020-8-2,
Animal activist killed by pig transport truck,125,0.94,hcr2l7,https://vegworldmag.com/animal-activist-killed-by-pig-transport-truck-at-fearmans-slaughterhouse-in-burlington/,9,2020-6-21,
Her Mom Was Murdered by a Serial Killer — and She Was Adopted by the Killer’s Brother,126,0.96,dcr6a3,https://people.com/crime/heather-tiffany-robinson-adopted-by-brother-serial-killer/?cid=439576&did=439576-20191002&mid=25072934131&utm_campaign=true-crime_newsletter&utm_content=100219&utm_medium=email&utm_source=people.com,5,2019-10-3,
Chaos At Walmart As Woman Performs Karate While Son Strips Naked And Dog Steals Food,127,0.97,bd1tnf,https://glamourfame.com/chaos-at-walmart-woman-performs-karate-son-strips-naked-their-dog-steals-food,21,2019-4-14,
Chilean activist sets fire to $500M worth of student debt documents,127,0.99,4kj3g4,https://www.rt.com/news/159832-chilean-artist-burns-debt/,11,2016-5-22,
"White House petition reaches 100,000 signatures to deport Justin Bieber",124,0.87,1wjsbs,http://www.wtsp.com/rss/article/354741/58/White-House-petition-reaches-100000-signatures-to-deport-Justin-Bieber?utm_source=feedburner&utm_medium=feed&utm_campaign=Feed%3A+wtsp%2Fweird+%28WTSP.com+10+News+Weird+News%29,21,2014-1-30,
"Booze-fueled monkey goes crazy, killing one man and injuring 250 others",125,0.99,hcebj5,https://bgr.com/2020/06/19/alcoholic-monkey-india-kalua/,10,2020-6-20,
The body of a man who went missing 10 years ago was found behind a grocery store cooler,125,0.98,cgjq9r,https://www.cnn.com/2019/07/22/us/supermarket-missing-person-death-trnd/index.html,21,2019-7-23,
Mom attacks 7 year old son for being a bad shoplifting lookout,125,0.98,bgh14i,https://www.dailymail.co.uk/news/article-6948167/Arizona-mom-arrested-hitting-son-didnt-look-shoplifting-grandma-well.html,4,2019-4-23,
Yosemite National Park partially closes after visitors poop on road during government shutdown,126,0.96,abmebd,https://www.nydailynews.com/news/national/ny-news-yosemite-national-park-closes-poop-government-shutdown-20190101-story.html?,10,2019-1-2,
"Trump's EPA Pick Refuses To Recuse Himself From Lawsuits He Has Filed Against The Agency. If confirmed, Scott Pruitt would be in an unprecedented position: defender of the EPA against lawsuits he filed against it.",127,0.93,5ouipd,https://www.buzzfeed.com/dinograndoni/epa-pick-refuses-to-recuse-himself-from-lawsuits-he-has-file,20,2017-1-19,
MyPillow Guy Mike Lindell Shouts Out Unproven COVID-19 'Cure' To Trump,127,0.95,j3ztzf,https://www.huffpost.com/entry/my-pillow-guy-mike-lindell-donald-trump-oleandrin_n_5f76ff71c5b6dd94f1e91938,18,2020-10-3,
"3 members of New Jersey family, including 8-year-old girl, drown in swimming pool 20 days after moving in, officials say",123,0.93,hevxdp,https://ktla.com/news/nationworld/8-year-old-new-jersey-girl-drowns-in-swimming-pool-along-with-her-mother-and-her-grandfather-20-days-after-moving-in-officials-say/,21,2020-6-24,
"6 eBay Executives And Employees Charged With Sending Threats, Bloody Pig Mask To Natick Couple",129,0.97,h9mhqj,https://boston.cbslocal.com/2020/06/15/ebay-employees-arrested-u-s-attorney-andrew-lelling-cyberstalking/,6,2020-6-16,
"Amid panic-buying of toilet paper across Australia spurred by fears of a coronavirus pandemic, a semi-trailer carrying the now-precious commodity has burst into flames on a major Brisbane bridge.",123,0.96,fdvtay,https://www.brisbanetimes.com.au/national/queensland/semi-trailer-carrying-load-of-toilet-paper-catches-fire-on-gateway-bridge-20200305-p5470e.html,3,2020-3-5,
'Alien' Worm With Three Sexes Discovered in Hostile California Lake | Mysterious Universe,126,0.93,daubi8,https://mysteriousuniverse.org/2019/09/alien-worm-with-three-sexes-discovered-in-hostile-california-lake/,5,2019-9-29,
Unexplained 'gel like' substance with 'unusual color' found on Moon's dark side,124,0.94,cy47q3,https://www.dailystar.co.uk/news/weird-news/unexplained-gel-like-substance-unusual-19112236,13,2019-9-1,
Woman catches her mechanic using her car to run errands and ‘steals’ it back,126,0.97,bfum8x,https://www.nydailynews.com/news/national/ny-20190421-lu4bqz74djbxlonrzz6psdqdbi-story.html,7,2019-4-22,
'It's not okay': Victims share testimonies at hearing to ban dwarf tossing,126,0.93,am2iua,https://komonews.com/news/local/its-not-okay-victims-share-testimonies-at-hearing-to-ban-dwarf-tossing,32,2019-2-1,
‘Make better choices’: Endangered Hawaiian monk seals keep getting eels stuck up their noses and scientists want them to stop,123,0.97,a4004e,https://www.washingtonpost.com/nation/2018/12/07/make-better-choices-endangered-hawaiian-monk-seals-keep-getting-eels-stuck-up-their-noses-scientists-want-them-stop/?utm_term=.911b9ab40b31,11,2018-12-7,
Fox News Guest Defends Tear Gas Use On Migrants: You Can 'Put It On Your Nachos',128,0.88,a0llrw,https://www.huffingtonpost.com/entry/fox-news-tear-gas-migrants_us_5bfbf7d4e4b0eb6d93114862,65,2018-11-27,
Houston is requiring residents who were affected by Hurricane Harvey to certify that they do not boycott Israel in order to apply for grant money to rebuild their home or business.,125,0.97,77qs86,https://www.yahoo.com/news/houston-suburb-conditions-hurricane-relief-190514664.html,14,2017-10-21,
"Muhammad Ali’s son held up at airport again, on his way home from testifying about first detainment",125,0.95,5yrrn3,https://www.washingtonpost.com/news/early-lead/wp/2017/03/10/i-felt-just-like-i-felt-at-my-fathers-funeral-muhammad-alis-son-describes-airport-detainment/,5,2017-3-11,
A brain wrapped in aluminum foil washed up on Wisconsin beach..,125,0.97,iwhsdt,https://www.cnn.com/2020/09/20/us/brain-found-on-beach-wisconsin-trnd/index.html,25,2020-9-21,
"Nearly 20,000 teens in Georgia have received their driver’s licenses without a road test",121,0.95,ghxtca,https://4shp.com/nearly-20000-teens-in-georgia-have-received-their-drivers-licenses-without-a-road-test/,10,2020-5-12,
"Engineer intentionally crashes train near hospital ship Mercy, believing in weird coronavirus conspiracy, feds say",120,0.99,ftmzxm,https://www.washingtonpost.com/nation/2020/04/02/train-derails-usns-mercy-coronavirus/,30,2020-4-2,
Police in West Virginia say local raccoons aren't rabid — they're just drunk,126,0.98,ej103i,https://www.nydailynews.com/news/national/ny-news-raccoons-drunk-not-rabid-20181114-story.html,6,2020-1-3,
'Metal thieves' steal 56-tonne rail bridge in Russia,126,0.99,bx383n,https://www.independent.co.uk/news/world/europe/russia-bridge-theft-disappear-arctic-umba-river-rail-a8944971.html?utm_source=reddit.com,4,2019-6-5,
Police find stolen Perth Zoo tortoise seven years after it went missing,126,0.97,9ircnd,https://www.communitynews.com.au/southern-gazette/news/wa-police-find-stolen-perth-zoo-tortoise-seven-years-went-missing/,4,2018-9-25,
Drug tunnel ran from old KFC in Arizona to Mexico bedroom,124,0.99,99z4wn,https://www.bbc.co.uk/news/world-us-canada-45291978,15,2018-8-25,
Illinois man booked a prostitute – and she turned out to be his wife,123,0.93,6tvcxx,http://www.telegraphsun.com/elgin-illinois-man-booked-prostitute-turned-wife/,18,2017-8-16,
"Coronavirus-themed porn is going viral on streaming sites, with more than 100 videos from the bizarre genre popping up in recent days, according to a report.",120,0.94,fdlbmb,https://nypost.com/2020/03/04/coronavirus-themed-porn-is-going-viral/,14,2020-3-5,
Man whose farts 'can kill mosquitoes six metres away hired to create new repellent',120,0.95,e99yg5,https://www.mirror.co.uk/science/man-whose-farts-can-kill-21072676,7,2019-12-12,
Deep-Sea Octopus Enthralls Scientists With Otherworldy 'Show',123,0.99,d4nbhc,https://www.huffpost.com/entry/octopus-billowing-arms-video_n_5d7d22ffe4b03b5fc88494ab,6,2019-9-16,
"Donald Trump appears in front of fake seal with two-headed eagle, Google search blamed - Donald Trump's America",124,0.91,ci117w,https://www.abc.net.au/news/2019-07-26/donald-trump-doctored-presidential-seal-turning-point-usa/11348526,7,2019-7-26,
'We're anti-influencer': ice-cream truck makes Instagram 'stars' pay double | US news,125,0.94,c9dr88,https://www.theguardian.com/us-news/2019/jul/03/ice-cream-los-angeles-instagram-influencers,8,2019-7-5,
Woman attacks Burger King manager after being denied free fries in lovely state of Florida,121,0.96,buc7gk,https://www.wfla.com/news/florida/woman-attacks-burger-king-manager-after-being-denied-free-fries/2034392062,34,2019-5-29,
"Woman gets flu shot and then claims she can only walk backwards and develops Ohio accent, busted as a con",124,0.93,b1dor0,https://redd.it/b1d58y,12,2019-3-15,
Aide for antigay politician busted having car sex with 17-year-old boy he met on Grindr,121,0.95,86f6ys,https://www.queerty.com/aide-antigay-politician-busted-car-sex-underage-boy-met-grindr-20180322,15,2018-3-23,
A woman is stunned when her new driver's license came back with a picture of an empty chair,124,0.99,i8572y,https://edition.cnn.com/2020/08/11/cnn10/empty-chair-photo-id-trnd/index.html,7,2020-8-12,
Indian cops use giant ‘tongs’ to nab people breaking coronavirus lockdown,120,0.95,gacehk,https://nypost.com/2020/04/28/indian-cops-using-tongs-to-nab-people-breaking-coronavirus-lockdown/?utm_source=reddit.com,6,2020-4-30,
Nicaraguan president missing in action for nearly one month and counting,121,0.96,g091hk,https://www.reuters.com/article/us-nicaragua-ortega/nicaraguan-president-missing-in-action-for-nearly-one-month-and-counting-idUSKCN21S010,2,2020-4-13,
Family Claims Safford Police Officer Raped Jordan Marie Simms Before Her Death,123,0.93,egx7dn,https://discussglobal.com/safford-arizona-police-officer-raped-jordan-marie-simms/,8,2019-12-29,
"Owner of ""Pho King Good"" noodle shop says he's not in on joke",124,0.96,czl1ao,https://madison.com/wsj/entertainment/dining/restaurants/owner-of-pho-king-good-noodle-shop-says-he-s/article_4c5432ce-4dce-513f-a70a-9f221726b2b5.html,14,2019-9-4,
"Man Injects 18 'Doses' of Semen Into Arm to Cure Back Pain, Ends Up in Hospital.",124,0.97,ags1g5,https://gizmodo.com/man-injects-18-doses-of-semen-into-arm-to-cure-back-pai-1831817131,25,2019-1-17,
Maine man learns truth of his past: Nuns stole him as a baby from his mother in Ireland,122,0.99,8jbsal,http://www.sunjournal.com/maine-man-learns-truth-of-his-past-nuns-stole-him-as-a-baby-from-his-mother-in-ireland/,13,2018-5-14,
Texas bill would fine men $100 each time they masturbate.,122,0.94,87itf6,https://www.cnn.com/2017/03/13/health/abortion-texas-lawmaker-trnd/index.html?,52,2018-3-27,
Poultry Company Has a Live Chicken Running Its Twitter Account,124,0.98,3on325,http://munchies.vice.com/articles/this-poultry-company-has-a-live-chicken-running-its-twitter-account,6,2015-10-14,
Woman posts video of yellow water coming out of her faucet. The water company responds by suing her for defamation.,121,0.97,1pgswn,http://www.azfamily.com/home/Water-company-sues-customer-for-defamation-229623621.html,13,2013-10-29,
Police 'requested heat ray' for White House protest,119,0.96,iukg9g,https://www.bbc.com/news/world-us-canada-54187961,13,2020-9-17,
"Fox Sneaks Into UK Parliament, Poops Outside Politician’s Door | But the cunning creature could only outfox the cops for so long",119,0.98,f0yzq7,https://m.huffpost.com/us/entry/us_5e3e81a3c5b6b70887007700,4,2020-2-9,
Feral Hogs tear through 22000 worth of cocaine in Italy,123,0.93,eolgqb,https://happymag.tv/feral-hogs-tear-through-22000-worth-of-cocaine-in-italy/,12,2020-1-14,
British man nearly dies after parasite crawls into his penis and lays eggs,123,0.94,dyk05n,https://www.nzherald.co.nz/travel/news/article.cfm?c_id=7&objectid=12286196,14,2019-11-19,
"You Can Airbnb an Oscar Mayer Wienermobile This Summer, If That's Your Thing",121,0.98,cf6xhh,https://www.vice.com/en_us/article/d3nmej/you-can-airbnb-an-oscar-mayer-wienermobile-this-summer-if-thats-your-thing,5,2019-7-19,
'Oldest human aged 146' dies in Indonesia,117,0.92,bo1ymt,https://www.bbc.com/news/world-asia-39768321?fbclid=IwAR1AyoeGwZgC_S44PFba7sEtJzSBdqALFlsK-0nINDGvmgAkXnkdEMGSy8E,16,2019-5-13,
"Deputies surround burglar in Oregon home, find out suspect is Roomba trapped in bathroom",121,0.98,bbpvd9,https://katu.com/news/local/deputies-surround-burglar-in-oregon-home-find-out-suspect-is-roomba-trapped-in-bathroom,6,2019-4-11,
