title,score,upv_ratio,id,url,comms_num,created,body
Astrophysicist gets magnets stuck up nose while inventing coronavirus device,112,0.96,frmkd4,https://www.theguardian.com/australia-news/2020/mar/30/astrophysicist-gets-magnets-stuck-up-nose-while-inventing-coronavirus-device,12,2020-3-30,
Woman Is Reunited With Her Lost Dog After Seeing Her On A Beer Can,110,0.96,eza20e,https://www.sunnyskyz.com/good-news/3643/Woman-Is-Reunited-With-Her-Lost-Dog-After-Seeing-Her-On-A-Beer-Can,4,2020-2-5,
Man consumes nothing but beer for 6 weeks and loses 44 pounds,108,0.95,e374hw,https://www.thelaughclub.net/news/man-consumes-nothing-but-beer-for-6-weeks-and-loses-44-pounds/,13,2019-11-29,
Workers Scream As Mouse Launches Itself Into Deep Fryer At Texas Whataburger,111,0.92,cyqfzd,https://www.huffpost.com/entry/mouse-launches-into-deep-fryer-texas-whataburger_n_5d6c7cbee4b09bbc9ef11454,10,2019-9-2,
Spooky Old TV Show Features A Wall-Building Con Artist Named Trump,108,0.82,aexjyp,https://www.huffingtonpost.com/entry/trackdown-walter-trump_us_5c383e90e4b0c469d76cbfd3,6,2019-1-12,
Man accused of sexually assaulting beaver dying on road,107,0.98,9d67zt,https://nypost.com/2018/09/04/man-accused-of-sexually-assaulting-beaver-dying-on-road/,18,2018-9-5,
"Arkansas woman, 69, admits to fatally shooting husband, 65, 'because he wouldn't stop buying porn'",108,0.98,92up7r,http://www.dailymail.co.uk/news/article-6004177/Arkansas-woman-69-admits-fatally-shooting-husband-65-wouldnt-stop-buying-porn.html?ito=social-facebook,9,2018-7-29,
UFO ‘Expert’ Found Dead After ‘Vomiting Black Liquid’ Texted Mother Warning Days Before His Death...The ultimate NOTW,108,0.94,581hoy,http://ktla.com/2016/10/17/ufo-expert-found-vomiting-black-liquid-sent-warning-to-mom-before-his-death/,17,2016-10-18,
Skeleton strip club ignites fight between Richmond homeowner and HOA,113,0.95,jkf2lz,https://www.chron.com/homes/article/Houston-area-homeowner-s-front-yard-turns-into-15678155.php,12,2020-10-30,
Kentucky Man Forced Amazon Driver To Rake His Driveway At Gunpoint,112,0.97,bwhmtp,https://kegl.iheart.com/content/2019-05-25-kentucky-man-forced-amazon-driver-to-rake-his-driveway-at-gunpoint-police/,6,2019-6-4,
"Woman tried to trespass on CIA grounds while asking to speak to 'Agent Penis', police say.",108,0.96,blxigp,http://www.independent.co.uk/news/world/americas/cia-trespass-arrest-agent-penis-virginia-langley-police-jennifer-hernandez-a8902436.html,9,2019-5-8,
Daylight-saving time is deadly: Heart attacks and car crashes spike,111,0.94,ayzf3a,https://www.businessinsider.com/daylight-saving-time-is-deadly-2018-3,19,2019-3-9,
Crucified Ronald McDonald Sculpture Sparks Protests In Israel,108,0.94,agi2w8,https://www.huffingtonpost.com/entry/mcjesus-haifa-israel-protests_us_5c3dff71e4b01c93e00dc8a5,10,2019-1-16,
Australian man heard screaming ‘Why don’t you die?’ while killing spider prompts full police response,110,0.97,abymo9,https://www.google.com/amp/s/amp.theguardian.com/environment/2019/jan/02/australian-man-screaming-at-spider-why-dont-you-die-triggers-full-police-response,11,2019-1-3,
"After Bloodbath, The National Zoo's Naked Mole-Rats Finally Choose Their Queen",107,0.96,a74yo7,https://dcist.com/story/18/12/17/after-bloodbath-the-national-zoos-naked-mole-rats-finally-choose-their-queen/,7,2018-12-18,
Canada man legally changes gender for cheaper car insurance.,110,0.98,92fabo,https://www.timesnownews.com/the-buzz/article/alberta-man-changes-sex-to-get-cheaper-insurance-for-chevrolet-cruze/260562?utm_source=inshorts&utm_medium=referral&utm_campaign=fullarticle,17,2018-7-28,
Thousands sign petition to remove judge who sentenced blind child rapist to probation,106,0.96,7w9oen,https://www.yahoo.com/news/thousands-sign-petition-remove-judge-145958189.html,6,2018-2-9,
B.I.G.'s plastic crown sells at auction for almost $600K,110,0.95,itq4f9,https://edition.cnn.com/style/article/sothebys-hip-hop-auction/index.html,4,2020-9-16,
"'Moist wheat bread', 'old socks': Why scientists are bottling the smells of the Magna Carta, Iliad and Shakespeare for a whiff of history",110,0.97,hfeoyn,https://www.abc.net.au/news/2020-06-25/odour-of-history-smelling-magna-carta-shakespeare-iliad/12355958,3,2020-6-25,
"Semi carrying 55,000 pounds of cheese crashes in Milwaukee",105,0.94,fr7irz,https://www.nbc15.com/content/news/VIDEO-Semi-carrying-55K-pounds-of-cheese-crashes-in-Milwaukee-569195961.html,16,2020-3-29,
'It was the chance to say that we are alive': France hosted a record-breaking Smurf festival amid the escalating coronavirus epidemic,105,0.96,fh334u,https://www.businessinsider.com/france-landerneau-guinness-world-record-smurf-festival-coronavirus-outbreak-2020-3?IR=T,14,2020-3-12,
Woman addicted to eating baby powder wants others to know 'they are not alone',106,0.93,eld2dg,https://www.foxnews.com/health/woman-addicted-eating-baby-powder,30,2020-1-7,
Arizona Republican Allegedly Paid Two Boys $10 for Sex on Numerous Occasions,107,0.89,b7kc7l,https://lawandcrime.com/high-profile/arizona-republican-allegedly-paid-two-boys-10-for-sex-on-numerous-occasions/,15,2019-3-31,
"Roger, the ripped kangaroo and 'true icon,' has died",104,0.95,a4wj39,https://www.cnn.com/2018/12/10/australia/roger-kangaroo-obit-scli-intl/index.html,7,2018-12-10,
"Actor that appeared on 'Better Call Saul' and 'Longmire' admits to cutting off own arm, posing as war veteran",107,0.95,9t24vc,https://www.foxnews.com/entertainment/actor-that-appeared-on-better-call-saul-and-longmire-admits-to-cutting-off-own-arm-posing-as-war-veteran,16,2018-11-1,
London Finally Gets The Giant Sexy Jeff Goldblum Statue It Deserves,110,0.97,8zvw6k,https://secretldn.com/jeff-goldblum-statue/,5,2018-7-18,
"Dancing FBI agent who accidentally shot man in Denver bar allowed to carry his gun again, judge rules",106,0.95,8xtai8,https://www.denverpost.com/2018/07/10/dancing-fbi-agent-carrying-weapon/,23,2018-7-11,
New law: Kansas cops can't have sex during traffic stops,109,1.0,8j3537,http://www.kansas.com/news/politics-government/article210902319.html,8,2018-5-13,
GOP Leaders are Trying to Bribe An Alaska Senator to Repeal Obamacare—By Letting Her State Keep Obamacare,111,0.94,71oi5a,https://reason.com/blog/2017/09/21/gop-leaders-are-trying-to-bribe-an-alask,3,2017-9-22,
An airline tried to get a musician to check her 17th-century violin. A ‘wrestling match’ ensued.,109,0.98,6fslij,https://www.washingtonpost.com/news/dr-gridlock/wp/2017/06/06/an-airline-tried-to-get-a-musician-to-check-her-17th-century-violin-a-wrestling-match-ensued/,10,2017-6-7,
"Bazooka bubble gum sticks to its word, awards prize for contest entry submitted 59 years late",105,0.96,539o33,http://www.dallasnews.com/news/local-news/20160909-bazooka-bubble-gum-sticks-to-its-word-awards-prize-for-contest-entry-submitted-59-years-late.ece,5,2016-9-18,
"Woman says that police in Ferguson shot her in the head while she was leaving a rally for Michael Brown. Now, the bullet that doctors removed from her head has vanished, and police claim she was shot in a drive-by shooting.",110,0.88,2la1we,http://www.rawstory.com/rs/2014/11/ferguson-protester-no-one-can-find-the-bullet-police-say-they-didnt-fire-into-my-head/,8,2014-11-5,
Scientists Join Forces to Save Lake Titicaca Scrotum Frog,106,0.98,i0y54f,https://www.bbc.com/news/world-latin-america-53553636,8,2020-7-31,
Barcelona Opera Reopens With An Audience Of Plants,103,0.99,he8e8c,https://www.npr.org/sections/coronavirus-live-updates/2020/06/22/881943143/barcelona-opera-reopens-with-an-audience-of-plants,2,2020-6-23,
Arkansas woman murdered by same person who murdered her mother 23 years ago: Police. The daughter was killed in the same house where her mother was killed.,107,0.92,frgvnx,https://abcnews.go.com/US/arkansas-woman-murdered-person-murdered-mother-23-years/story?id=69854438,4,2020-3-30,
"Putting potatoes up your butt won’t cure hemorrhoids, doctors warn",109,0.95,falko6,https://nypost.com/2020/02/27/putting-potatoes-up-your-butt-wont-cure-hemorrhoids-doctors-warn,26,2020-2-28,
Russian President Vladimir Putin Has Windows XP Running on His Desktop,110,0.95,eeetu4,https://www.cybernog.com/2019/12/vladimir-putin-windows-xp.html,16,2019-12-23,
Norwegian horse girl: she is trot and gallops perfect on all fours,110,0.93,bqyw8b,https://www.afrinik.com/norwegian-horse-girl-trot-gallops-perfect-fours/,16,2019-5-21,
28-Year-Old Man Caught Having Sex With Cow in South Texas after illegally crossing the border,108,0.87,b3dkjt,https://foxnewssouthtexas.com/28-year-old-man-caught-having-sex-with-cow/,21,2019-3-20,
"Man's body found in hammock high in a tree, with helium tank and suicide hood over head",109,0.97,ai3m9v,http://www.peninsuladailynews.com/news/authorities-seek-to-identify-body-found-in-tree-at-fort-worden/,35,2019-1-21,
Interracial couple's garage has racist slur painted on it. The couple believes the police haven't done enough to arrest those responsible and won't remove it until they do their job. City responds by fining the couple.,108,0.92,5v7zq5,http://www.stamfordadvocate.com/local/article/NAACP-blasts-Stamford-s-response-to-racist-10945584.php,16,2017-2-21,
"That's one way to deal with a pervert. Flasher flees from the scene of his latest reveal when the woman tells him, ""that's a poor excuse for a willy.""",108,0.96,52ubdn,http://www.northdevonjournal.co.uk/westward-ho-flasher-andreas-murgellas-fled-after-being-belittled-by-woman-walker/story-29707549-detail/story.html#RmJoYc1AyOJOtYpH.99,3,2016-9-15,
8-year-old from Texas wins first in kids category for best mullet in U.S.,102,0.93,jpbhnv,https://www.kristv.com/news/national/8-year-old-from-texas-wins-first-in-kids-category-for-best-mullet-in-u-s,2,2020-11-7,
"Woman chased young boys with car before tasing 9-year-old, police say",109,0.98,jagg1o,https://www.deseret.com/utah/2020/10/8/21507687/woman-chased-boys-with-her-car-before-hitting-9-year-old-with-taser-police-say,10,2020-10-14,
Weird caterpillar uses its old heads to make an elaborate hat,102,0.98,hnk35x,https://www.newscientist.com/article/mg24632881-200-weird-caterpillar-uses-its-old-heads-to-make-an-elaborate-hat/?utm_source=NSDAY&utm_campaign=bc4bf09517-NSDAY_290620&utm_medium=email&utm_term=0_1254aaab7a-bc4bf09517-399440967&fbclid=IwAR3WVFZyCjsG84bwpa7rXssw3yKHqQ_qzcCzo11M6HTZrc6k-IEvRMCdEQQ,4,2020-7-9,
The Dutch government reportedly suggested single people find a 'sex buddy' for lockdown,109,0.97,glowx8,https://www.insider.com/single-people-should-find-sex-buddy-for-lockdown-dutch-guidance-2020-5,9,2020-5-18,
Doughnuts featuring Dr. Fauci's face are quickly becoming a nationwide hit,104,0.91,fpxtk8,https://www.cnn.com/2020/03/26/us/dr-fauci-doughnuts-trnd/index.html,5,2020-3-27,
Woman suing Target after finding chili and towels in Dyson vacuum box,108,0.97,e1z4y5,https://abc13.com/business/woman-suing-target-after-finding-chili-and-towels-in-vacuum-box/5718872/,8,2019-11-26,
Kentucky man charged with throwing Christmas ham at woman,105,0.95,a9qetg,https://www.wpsdlocal6.com/2018/12/26/kentucky-man-charged-with-throwing-christmas-ham-at-woman/,14,2018-12-27,
An African flamingo that escaped from a Kansas zoo in 2005 has been spotted in Texas,104,0.99,8u2kj7,https://www.chron.com/news/houston-texas/article/African-flamingo-Kansas-Zoo-Texas-escaped-13024458.php,5,2018-6-27,
Burger King Will Give Free Whoppers to People Dressed as Clowns on Halloween,108,0.99,78vku2,http://www.adweek.com/brand-marketing/burger-king-will-give-free-whoppers-to-people-dressed-as-clowns-on-halloween/,3,2017-10-26,
Texas Senator Shatters Table Trying to Silence Woman Testifying Against Anti-Abortion Bill,105,0.97,5uyyad,http://www.sacurrent.com/the-daily/archives/2017/02/16/texas-senator-shatters-table-trying-to-silence-woman-testifying-against-anti-abortion-bill,8,2017-2-20,
"Chinese boy, 12, found living in IKEA store 6 days after running away from home, he lived off free food samples inside the store and presumably slept on one of the retailer’s bedroom displays",104,0.98,2m3b6u,http://www.nydailynews.com/news/world/boy-found-living-ikea-store-6-days-disappeared-article-1.2007962,5,2014-11-13,
US Election 2020: Inside the Pennsylvania church where they pray next to their AR-15 rifles,103,0.9,jh7glf,https://news.sky.com/story/us-election-2020-inside-the-church-where-they-pray-next-to-their-ar-15-rifles-12112777,18,2020-10-24,
Screw Politics... PORN ACTOR Running For Office In FLORIDA,108,0.87,gzoifb,https://www.thedailyfodder.com/2020/06/screw-politics-porn-actor-running-for.html,14,2020-6-9,
"EXCLUSIVE AUDIO: Ohio woman calls 911, asks for firefighters cause her ""p***y is on fire""",106,0.93,ge3if7,https://96krock.com/2020/05/05/exclusive-audio-ohio-woman-calls-911-tells-them-her-py-is-on-fire/?fbclid=IwAR2FqwRbhu_9_S_cg37cskdQz1UkMoIQ1rUsxVCgM1qfm9qVLAe1qZ8TGNY,10,2020-5-6,
"Woman arrested after showing up naked at New Orleans airport, refusing to leave, cops say",105,0.96,fyn5kk,https://www.wftv.com/news/trending/naked-woman-arrested-after-showing-up-new-orleans-airport-refusing-leave-cops-say/3QEYUVAARJHIJDOM5IZ2GWG6WM/,12,2020-4-11,
Tiffany Alberts Sentenced To Seven Years For Putting Feces In Son's IV,109,0.97,ehvlk8,https://discussglobal.com/tiffany-alberts-sentenced-feces-sons-iv/,18,2019-12-31,
Arizona Boy Dead Following Attempted Exorcism by Father,102,0.99,dcblm4,https://www.singularfortean.com/news/2019/10/1/arizona-boy-dead-following-attempted-exorcism-by-father,10,2019-10-2,
"Va. woman arrested after hiding her mother’s corpse under blankets for 44 days, police say",106,0.96,ara80k,https://www.washingtonpost.com/local/public-safety/va-woman-arrested-after-hiding-her-mothers-corpse-under-blankets-for-44-days-police-say/2019/02/15/d90f81ba-3141-11e9-bf3c-f0ee4279a091_story.html?utm_term=.e5cf4b7de2a6,13,2019-2-17,
Dems Demand Info on Acting Attorney General’s “Masculine Toilet” Scam,108,0.94,9xwl1l,https://www.vanityfair.com/news/2018/11/democrats-demand-info-on-acting-attorney-general-matthew-whitaker-masculine-toilet-scam,10,2018-11-17,
"Full Circle: Man kills child in hit and run, then dies 40 years later while saving children from a hit and run driver.",104,0.97,8ohh4m,https://www.washingtonpost.com/news/morning-mix/wp/2018/06/04/a-car-crashed-into-a-little-league-game-the-brave-man-who-died-saving-kids-had-a-dark-secret/?utm_term=.ec707ac00e45,6,2018-6-4,
"According To Pornhub, The South Watches More Gay Porn Than Any Other Part Of The U.S",104,0.92,20a6t4,http://www.buzzfeed.com/ryanhatesthis/according-to-pornhub-the-south-watches-more-gay-porn-than-an,7,2014-3-13,
Two men with machetes break in to wrong home to execute a paid for sexual fantasy role play,104,0.97,gsmm1t,https://www.bbc.co.uk/news/amp/world-australia-52843846,6,2020-5-29,
Stolen car had homemade license plate written in crayon,102,0.96,eb1942,https://wsbt.com/news/local/isp-stolen-car-had-homemade-license-plate-written-in-crayon,2,2019-12-16,
"Someone Is Putting Tiny Cowboy Hats on Las Vegas Pigeons, And No One Knows Why or How",106,0.94,e9nsgr,https://www.odditycentral.com/news/someone-is-putting-tiny-cowboy-hats-on-las-vegas-pigeons-and-no-one-knows-why-or-how.html,13,2019-12-12,
Canadian Therapist Gives Up License After Satanists Expose Her 'Mind Control' Talks.,101,0.96,ds87ol,https://gizmodo.com/canadian-therapist-gives-up-license-after-satanists-exp-1839605239,3,2019-11-6,
A Brazilian gang leader dressed up as his 19-year-old daughter to escape from prison. It didn't work,103,0.95,cm6xcw,https://www.usatoday.com/story/news/world/2019/08/04/brazilian-gang-leader-dresses-up-daughter-foiled-prison-escape/1918111001/,10,2019-8-5,
32 Pounds Of Rat Meat Seized At Chicago O'Hare Airport,108,0.97,car32t,https://thehollywoodunlocked.com/32-pounds-of-rat-meat-seized-at-chicago-ohare-airport/,7,2019-7-9,
Man accused of dipping testicles in customer's salsa,108,0.97,avfm9z,https://www.kwtx.com/content/news/506432622.html,24,2019-2-28,
Fitness YouTuber Dies After Being Tased By Police As He Stabbed His Tinder Date,103,0.94,ab2vh5,https://www.huffingtonpost.com/entry/erich-stelzer-cohasset-tinder_us_5c2957cee4b08aaf7a91a87d?,18,2018-12-31,
California high school student reportedly passed out cookies made with grandmother’s ashes to fellow students,102,0.95,9oyzda,https://www.foxnews.com/us/california-student-reportedly-served-cookies-cooked-with-grandmas-ashes,9,2018-10-17,
Minnesota woman's obituary declares 'world is a better place without her',105,1.0,8osmgd,http://www.fox9.com/news/minnesota-woman-s-obituary-declares-world-is-a-better-place-without-her-,14,2018-6-6,
Cards Against Humanity bought a plot of land on the American-Mexican border.,101,0.94,7cymzh,http://mashable.com/2017/11/14/cards-against-humanity-saves-america-border-wall/,21,2017-11-15,
"Some Dude Connected An Amazon Echo to His Big Mouth Billy Bass. In Other News, Big Mouth Billy Bass Still Exists.",104,0.96,782vcy,https://www.mediaite.com/online/this-exists-some-dude-connected-an-amazon-echo-to-his-big-mouth-billy-bass/?,4,2017-10-23,
A belligerent man in a Trump hat was kicked off a flight as a crowd chanted: ‘Lock him up!’,103,0.91,6cq8tg,https://www.washingtonpost.com/news/dr-gridlock/wp/2017/05/22/a-belligerent-man-in-a-trump-hat-was-kicked-off-a-flight-as-a-crowd-chanted-lock-him-up/,0,2017-5-23,
"In what might be the most Russian story you'll read this month, pregnant woman gives birth in forest while officers fight off bears.",103,0.97,5bdh7m,http://www.outdoorhub.com/news/2016/06/24/pregnant-russian-woman-gives-birth-forest-officers-fight-off-bears/,3,2016-11-6,
Italian court rules divorced chef can pay child support in pizza,104,0.96,4n597d,http://www.foxnews.com/leisure/2016/06/03/italian-court-rules-chef-can-pay-child-support-in-pizza/,2,2016-6-8,
Director of the anonymous tipline Crime Stoppers thrown in jail ... for refusing to reveal the name and personal information of an anonymous tipster,104,1.0,20h9ag,http://www.wsvn.com/story/24977543/director-of-crime-stoppers-held-in-contempt-of-court,5,2014-3-15,
Man attempting to ‘resurrect’ grandmother accused of causing $30k in damages to Knoxville cemetery,101,0.94,j8acyw,https://www.wvlt.tv/2020/10/07/man-attempting-to-resurrect-grandmother-accused-of-causing-30k-in-damages-to-knoxville-cemetery/,10,2020-10-10,
"Kanye West urinates on Grammy Award, says Prince and Michael Jackson were victims of music industry",106,0.87,ivnzzm,https://www.nme.com/news/music/kanye-west-continues-master-recordings-rant-says-prince-and-michael-jackson-were-victims-of-music-industry-2754525,23,2020-9-19,
Dentist who extracted tooth on hoverboard sentenced to 12 years in prison,102,0.96,iulqzk,https://nypost.com/2020/09/16/dentist-who-extracted-tooth-on-hoverboard-gets-12-years/,8,2020-9-17,
Government official is caught having SEX with his secretary after accidentally joining Zoom meeting with his colleagues in the Philippines,104,0.96,ijhgqz,https://www.dailymail.co.uk/news/article-8669433/Government-boss-caught-having-SEX-secretary-accidentally-joining-Zoom-meetin,7,2020-8-31,
"Vanilla Ice Melts Under Pressure, Cancels Austin Gig: ‘I Didn’t Know that the Numbers Were So Crazy’<br /> — San Antonio Sentinel - News, Politics, Business, Lifestyle",107,0.94,hkcdt2,https://www.sasentinel.com/vanilla-ice-melts-under-pressure-cancels-austin-gig-i-didnt-know-that-the-numbers-were-so-crazy,10,2020-7-3,
Zoo might feed animals to each other to stay afloat during lockdown,104,0.95,g1kboo,https://nypost.com/2020/04/14/zoo-may-feed-animals-to-each-other-to-stay-afloat-during-lockdown/,15,2020-4-15,
Coronavirus hate attack: Woman in face mask allegedly assaulted by man who calls her 'diseased',102,0.93,ezonx2,https://www.nbcnews.com/news/us-news/coronavirus-hate-attack-woman-face-mask-allegedly-assaulted-man-who-n1130671,4,2020-2-6,
Kentucky judge accused of courthouse threesome is suspended,103,0.97,emb9or,https://www.nbcnews.com/news/crime-courts/kentucky-judge-accused-courthouse-threesome-suspended-n1112296,11,2020-1-9,
Drunk man calls Uber for injured goldfinch,106,0.95,cowpqh,https://www.independent.co.uk/news/world/americas/drunk-man-calls-uber-injured-goldfinch-bird-rescue-centre-beer-drive-a9052101.html,4,2019-8-11,
KFC starts selling fried chicken skin,104,0.95,c4wgmr,https://www.foxnews.com/food-drink/kfc-fried-chicken-skin,38,2019-6-25,
"Woman falls asleep on a flight and wakes in the pitch black, locked in an empty plane",101,0.98,c3vd75,https://www.independent.co.uk/travel/news-and-advice/woman-asleep-plane-locked-asleep-toronto-pearson-airport-quebec-a8970506.html,10,2019-6-23,
Hospitals Introduce 'Sperm Extractors' For Men Who Don't Want To Masturbate,103,0.95,bcdoqp,https://glamourfame.com/hospitals-introduce-sperm-extractors-men-who-dont-want-to-masturbate,25,2019-4-12,
The Man Who Liked the DMV Too Much: Employees Say Stalker Wouldn’t Stop Buying Pizzas,101,0.97,arm27l,https://lawandcrime.com/crime/the-man-who-liked-the-dmv-too-much-employees-say-stalker-wouldnt-stop-buying-pizzas/,3,2019-2-18,
"Ohio woman with full-face skull tattoo busted for shoplifting, drugs",102,0.95,a4ato0,https://www.dailymail.co.uk/news/article-6473655/Ohio-woman-face-skull-tattoo-busted-shoplifting-drugs.html,15,2018-12-8,
"Students find out they’re both having sex with teacher, tell wife: officials",103,0.97,9thhq6,https://nypost.com/2018/11/01/students-find-out-of-each-others-sexual-relationship-with-teacher-tell-his-wife-officials/,26,2018-11-2,
11-year-old girl dies by choking on a marshmallow at a birthday party. Family does the only reasonable thing to process their grief -- they file a wrongful death claim against the party hosts.,101,0.93,4secw5,http://www.heraldnews.com/news/20160711/family-files-wrongful-death-suit-following-death-of-11-year-old-somerset-girl,20,2016-7-12,
"Orlando shooter was a regular at the gay nightclub he attacked, used multiple gay dating apps.",103,0.86,4o1k8w,http://finance.yahoo.com/news/report-orlando-nightclub-shooter-visited-222620444.html,18,2016-6-14,
Pizza Hut Is Trolling Kanye West Mercilessly and It's Glorious,103,0.87,46eylb,http://www.business-standard.com/article/news-ians/pizza-hut-mocks-kanye-west-s-debt-rant-116021800118_1.html,6,2016-2-18,
FloridaWoman attempts to kidnap neighbor’s infant in the middle of the night,104,0.93,idyc8t,http://www.robbshow.com/index.php/2020/08/21/floridawoman-attempts-to-kidnap-neighbors-infant-in-the-middle-of-the-night/,9,2020-8-21,
The U.S.'s $13 Billion Aircraft Carrier Has a Toilet Problem,98,0.94,fpilcd,https://www.popularmechanics.com/military/navy-ships/a31929628/uss-ford-toilet/,9,2020-3-27,
"Iran ""Scaling Back"" on Terror Activities as Coronavirus Outbreak Cripples Islamic Revolutionary Guard Corps",102,0.89,fkizzn,https://legalinsurrection.com/2020/03/iran-scaling-back-on-terror-activities-as-coronavirus-outbreak-cripples-islamic-revolutionary-guard-corps/,8,2020-3-18,
Man arrested with 30 phones in cycling shorts after rock gig: Dutch police got to the bottom of mobile phone thefts at a rock concert when they found a man with 30 mobiles in his cycling shorts.,100,0.97,evchdt,https://www.bbc.com/news/world-europe-51279896,6,2020-1-29,
"$80,000 Worth of Wigs Stolen From a Miami Warehouse",105,0.97,d6gn13,https://miami.cbslocal.com/2019/09/17/wigs-valued-between-70k-80k-stolen-from-miami-gardens-warehouse/,11,2019-9-20,
Maine police decline to press charges against goat that chased woman down street,100,0.97,c6k3cr,https://www.wmtw.com/article/maine-police-decline-to-press-charges-against-goat-that-chased-woman-down-street/28207133,2,2019-6-28,
Health Officials Warn New Yorkers to Vaccinate Their Pets as Rabid Raccoons Appear in Manhattan,101,0.96,azi2cn,https://gizmodo.com/health-officials-warn-new-yorkers-to-vaccinate-their-pe-1833179199,1,2019-3-11,
Doctors warn women not to put parsley in vagina after magazine article promotes it,100,0.98,ah1n4u,https://www.independent.co.uk/life-style/parsley-vagina-why-start-periods-delay-hormones-tea-doctor-advice-a8733461.html,12,2019-1-18,
I met my boyfriend 12 years after giving birth to his child,103,0.94,ac4zus,http://www.bbc.co.uk/news/stories-46427960,8,2019-1-3,
Man sneaks bottle of vodka into music festival by burying it weeks before,103,0.92,7053hh,http://www.independent.co.uk/life-style/man-vodka-bottle-music-festival-sneak-new-york-electric-zoo-alex-diamond-bury-google-maps-a7944026.html,12,2017-9-15,
"Not just weird, but possibly cruel and unusual; Prince Edward Island police threaten to play non-stop Nickelback to drunk drivers.",103,0.97,5fjfuf,http://thechronicleherald.ca/world/1419869-prince-edward-island-police-force-threatens-to-play-nickelback-to-drunk-drivers?,14,2016-11-30,
Pastor Preaching Abstinence While Condoms Fall Out of His Bible; “Followers” Beat Him Into a Coma,99,0.91,2zgdmc,http://www.thedailytrends.net/2013/08/pastor-preaching-abstinence-while.html,11,2015-3-18,
91 year old man not evicted after donors raise enough money so he can buy his house back from a daughter who was trying to evict him.,101,0.99,1egk2w,http://www.heraldsun.com.au/realestate/news/donors-stop-janice-cottrills-plan-to-evict-dad-john-potter-91/story-fni0chbz-1226644874245,4,2013-5-17,
Domino's investigating after pizza delivery driver caught rubbing ice cream container on crotch,103,0.97,j5n997,https://www.foxnews.com/food-drink/dominos-uk-investigating-pizza-driver-caught,9,2020-10-6,
Food box deliveries to needy California seniors cut off because of USDA cheese rule,99,0.97,iqdpse,https://www.latimes.com/politics/story/2020-09-10/food-box-deliveries-to-needy-california-seniors-during-pandemic-cut-off-due-to-usda-cheese-rule,4,2020-9-11,
