title,score,upv_ratio,id,url,comms_num,created,body
Mum offered 'sexual favours' for fried chicken before racially abusing takeaway worker and spitting at police officer.,97,0.94,a22x75,https://www.manchestereveningnews.co.uk/news/greater-manchester-news/kelly-fielding-manchester-crown-court-15483878?,17,2018-12-1,
Man Finds $7.5 Million in Storage Unit bought from ‘Storage Wars’ Dan Dotson,92,0.89,a08xpf,https://hasanjasim.online/man-finds-7-5-million-in-storage-unit-bought-from-storage-wars-dan-dotson/,11,2018-11-25,
Woman survives six days in Outback drinking urine and car's washer fluid,92,0.96,9zde6x,https://metro.co.uk/2018/11/21/woman-survives-six-days-in-outback-drinking-urine-and-cars-washer-fluid-8161396/,22,2018-11-22,
"Oh, how the mighty fall -- Julian Assange told to tend to his cat and clean his bathroom if he wants internet access.",93,0.88,9os5bw,https://thehill.com/policy/international/411720-ecuador-to-assange-look-after-cat-clean-bathroom-if-you-want-internet,6,2018-10-17,
A Man Overdosed on an Erectile Dysfunction Drug and Now He Permanently Sees Red.,92,0.97,9kw94k,https://motherboard.vice.com/en_us/article/9k7n83/a-man-overdosed-on-an-erectile-dysfunction-drug-sildenafil-and-now-he-permanently-sees-red,8,2018-10-3,
Las Vegas is now completely powered by renewable energy,95,0.86,5jw0ky,http://www.independent.co.uk/news/world/americas/las-vegas-is-now-completely-powered-by-renewable-energy-a7491321.html,9,2016-12-23,
Donald Trumps Hollywood Walk Of Fame Star Demolished By Sledgehammers,94,0.89,59icjo,http://deadline.com/2016/10/donald-trump-hollywood-walk-of-fame-star-destroyed-vandals-1201842842/,21,2016-10-27,
"Don’t Plant Trees, Say Calgary Residents Who Fear Criminals Will Hide in Them.",94,0.96,51xzcw,http://motherboard.vice.com/read/dont-plant-trees-say-calgary-residents-who-fear-criminals-will-hide-in-them,8,2016-9-9,
Cemetery closing upsets families. Future interments not allowed; not even for those who bought plots. Families forbidden to visit graves.,94,0.98,4mib90,http://www.wfmz.com/news/news-regional-berks/families-upset-over-cemeterys-sale-closure/39890430?utm_source=fark&utm_medium=website&utm_content=link,18,2016-6-4,
Women's prison mass jail break after inmates in dominatrix gear handcuff male guards expecting 'mass orgy',98,0.96,441ja4,http://www.mirror.co.uk/news/world-news/womens-prison-mass-jail-break-5120591,11,2016-2-4,
Georgia woman mistakenly jailed for more than a month after cops confused dried Spaghetti-Os sauce on a spoon for meth,94,0.91,2jzf8t,http://www.nydailynews.com/news/national/ga-woman-jailed-cops-confused-spaghettios-meth-article-1.1957736,15,2014-10-22,
"Father decides to teach his son a lesson for driving off to buy cigarettes and reports the van stolen. Police shoot the son dead. In all fairness, he probably won't do it again.",95,0.86,1q3v42,http://www.dailymail.co.uk/news/article-2489533/Father-heartache-police-shoot-dead-son.html,18,2013-11-7,
Lance Armstrong books moved to fiction section in Australian library,93,0.94,16zqrw,http://www.nydailynews.com/sports/more-sports/lance-armstrong-books-moved-library-fiction-section-article-1.1243498,1,2013-1-21,
"Police claims 9-year-old child to be 22, accuses him of violence",93,0.91,fc4hv4,https://tbsnews.net/bangladesh/crime/police-claims-9-year-old-child-be-22-accuses-him-violence-50362,5,2020-3-2,
"Woman claims man kidnapped her, forced her to watch ‘Roots’ to ‘understand her racism’",93,0.92,f5oixx,https://www.wave3.com/2020/02/17/woman-claims-man-kidnapped-her-forced-her-watch-roots-understand-her-racism/,6,2020-2-18,
Woman found dead with 8-foot python coiled around neck in home filled with 140 snakes,91,0.95,dq65gx,https://www.fox4news.com/news/woman-found-dead-with-8-foot-python-coiled-around-neck-in-home-filled-with-140-snakes,10,2019-11-1,
"Dairy Queen burgers are not made of human meat, store confirms after feds swarm restaurant",92,0.97,cw8dn1,https://www.foxnews.com/food-drink/dairy-queen-burgers-human-meat-store-says,23,2019-8-28,
Nearly 4 tons of weed was discovered inside a shipment of jalapeños,90,0.94,cs7fu6,https://www.cnn.com/2019/08/18/us/marijuana-jalapeno-pepper-shipment-trnd/index.html,20,2019-8-19,
"The EU is facing Crimes Against Humanity charges for “murder, deportation, imprisonment, enslavement, torture, rape, persecution and other inhuman acts” of Libyan Refugees",94,0.89,bzeh8f,https://www.trtworld.com/perspectives/human-rights-lawyers-bring-case-against-eu-at-icc-over-migrant-deaths-27398,6,2019-6-12,
Big plastic cow vanishes from a steakhouse. Owners offer free food for its return.,90,0.96,bjahdy,https://www.sun-sentinel.com/news/florida/fl-ne-plastic-cow-stolen-florida-steak-house-20190429-story.html,6,2019-5-1,
Teacher Who Fed Puppy To Turtle In Front Of Students Found Not Guilty Of Animal Cruelty,89,0.88,acym4i,https://www.huffingtonpost.com/entry/idaho-science-teacher-puppy-turtle-verdict_us_5c27cdd6e4b08aaf7a910302,44,2019-1-6,
Quebec play about a man and his penis fined $500 over fake cigarette,93,0.92,a7bvos,https://www.cbc.ca/radio/asithappens/as-it-happens-thursday-edition-1.4944705/quebec-play-about-a-man-and-his-penis-fined-500-over-fake-cigarette-1.4944708?,5,2018-12-18,
This Woman Got 8 Years In Prison For Illegal Voting. Texas Is Showing No Mercy.,90,0.91,a253jx,https://www.huffingtonpost.com/entry/texas-voter-fraud-prison_us_5c01a9afe4b0a173c02305c1,45,2018-12-2,
Arizona boy didn’t want to clean his room – so he fatally shot grandmother before killing himself,95,0.94,9uhn0p,http://www.nydailynews.com/news/national/ny-news-arizona-boy-fatally-shoots-grandmother-himself-20181105-story.html,6,2018-11-6,
1.7 million chickens drown,92,0.96,9gzevv,https://www.wral.com/1-7-million-chickens-drown-as-nc-rivers-swollen-by-florence/17853299/,18,2018-9-19,
Company Is Offering ‘Fur-ternity Leave’ for New Pet Owners,93,0.91,99cns1,https://www.msn.com/en-ca/news/offbeat/company-is-offering-%e2%80%98fur-ternity-leave%e2%80%99-for-new-pet-owners/ar-BBMhrKZ,9,2018-8-22,
Couple find 23-year-old message hidden in their bathroom,91,0.87,8wbcjk,https://www.bbc.com/news/world-us-canada-44710704,3,2018-7-5,
New York Is Literally Running Out of Cheetos,94,0.97,8ltv87,http://www.grubstreet.com/2018/03/frito-lay-driver-shortage.html,7,2018-5-25,
N.J. to decide if weed should be taken off list of most dangerous drugs,92,0.98,80y138,http://www.nj.com/marijuana/2018/02/nj_to_review_how_marijuana_is_classified_under_sta.html,8,2018-3-1,
Five New Yorkers in wheelchairs are behind nearly 400 lawsuits brought against small businesses for lacking handicap access.,93,0.92,70pfda,http://nypost.com/2017/09/16/these-handicapped-new-yorkers-are-behind-hundreds-of-lawsuits/,13,2017-9-18,
US woman sues casino that 'offered dinner instead of $43m jackpot',91,0.88,6hlu4q,http://www.bbc.com/news/world-us-canada-40300062?ocid=socialflow_twitter,7,2017-6-16,
Model Paola Saulino who went on sex tour reveals she has pleasured 700 men in just three months,90,0.88,62zbz7,https://www.thesun.co.uk/news/3234038/paola-saulino-pompa-sex-tour/,27,2017-4-2,
"Prenda Law ""copyright troll"" attorneys arrested for putting porn videos on file sharing sites and then suing people who downloaded them",94,0.98,5iu8w2,http://arstechnica.com/tech-policy/2016/12/breaking-prenda-law-copyright-trolls-steele-and-hansmeier-arrested/,4,2016-12-17,
A man in France who inherited a house was amazed to discover gold hoard hidden all through it.,93,0.99,5ekos3,http://www.unexplained-mysteries.com/news/300987/heir-finds-37m-gold-hoard-hidden-in-house,6,2016-11-24,
This abandoned Disney water park has been rotting for 15 years in Florida,90,0.97,4zurcp,http://www.businessinsider.com/photos-of-the-abandoned-disney-river-country-water-park-2016-8/#river-country-in-orange-county-florida-waswalt-disney-worlds-firstwater-park-1,15,2016-8-27,
Miami attorney arrested as serial bank robbery suspect,91,0.96,jg16nd,https://www.tampabay.com/news/crime/2020/10/21/miami-attorney-arrested-as-serial-bank-robbery-suspect/,6,2020-10-22,
"This pro wrestler pooped himself mid-match, then turned it into the promo of the year",92,0.93,j09e0h,https://www.sbnation.com/wrestling/2020/9/25/21455906/pro-wrestler-pooped-himself-mid-match-promo-of-the-year,6,2020-9-27,
Diner 'spikes his own food with pubic hair' to try and get free meal,92,0.96,ilrqxw,https://metro.co.uk/2020/09/02/diner-spikes-his-own-food-with-pubic-hair-to-try-and-get-free-meal-13213743/,2,2020-9-3,
How coronavirus cripples the New York Mafia,95,0.93,frszgc,https://nypost.com/2020/03/29/how-coronavirus-cripples-the-new-york-mafia/,4,2020-3-30,
"5-Year-Old Saves Baby Sister From House Fire, Then Goes Back In To Save The Dog",94,0.87,f50yqh,https://www.sunnyskyz.com/good-news/3658/5-Year-Old-Saves-Baby-Sister-From-House-Fire-Then-Goes-Back-In-To-Save-The-Dog,3,2020-2-17,
Scientists are searching for a mirror universe. It could be sitting right in front of you.,96,0.94,f05g7r,https://www.nbcnews.com/mach/science/scientists-are-searching-mirror-universe-it-could-be-sitting-right-ncna1023206,17,2020-2-7,
Israel Folau says same-sex marriage and abortion caused Australia bushfires,93,0.92,dxw31a,https://uk.sports.yahoo.com/news/israel-folau-says-same-sex-104100148.html,20,2019-11-18,
Tom DeLonge's UFO research group partners with US Army,89,0.95,dk3cgs,https://futurism.com/the-byte/tom-delonge-ufo-research-us-army,7,2019-10-19,
The 'blob': zoo showcases slime mold with 720 sexes that can heal itself in minutes | World news,93,0.97,dj3u5h,https://www.theguardian.com/world/2019/oct/17/the-blob-zoo-unveils-baffling-new-organism-with-720-sexes,11,2019-10-17,
"'Trump, please save Hong Kong' - protesters",92,0.88,d1c9uw,https://www.bbc.co.uk/news/world-asia-china-49625233,12,2019-9-8,
"Burglary defendant yelling ""Its protein, it's good for you"" throws feces at judge during trial",93,0.95,c3hoz6,https://www.local10.com/news/local/miami/defendant-in-miami-dade-courtroom-throws-feces-at-judge-during-trial-misses,6,2019-6-22,
Two women hospitalized after trying to use vacuum hose to end their periods early,93,0.95,by71ep,https://meaww.com/seattle-nurse-two-women-hospitalized-use-vaccum-hose-stop-periods-early,10,2019-6-8,
"WOW NJ Again? WATCH: N.J. cop tells men during traffic stop: ‘I’m gonna knock you the f--- out’. During the course of the investigation, the Atlantic County Prosecutor’s Office impounded his police vehicle and found marijuana, narcotics prescribed to residents who allege Abrams stole them and guns.",90,0.93,bmf4c3,https://www.nj.com/news/2019/05/watch-nj-cop-tells-young-men-during-traffic-stop-im-gonna-knock-you-the-f-out.html,2,2019-5-9,
"A German family couldn't pay its bills, so the city took their dog and sold it on eBay",92,0.96,aw0doc,https://www.straitstimes.com/world/europe/a-german-family-couldnt-pay-its-bills-so-the-city-took-their-dog-and-sold-it-on-ebay?utm_medium=Social&utm_campaign=STFB&utm_source=Facebook,6,2019-3-1,
Woman Who Faked Breast Cancer Gets Prison Time,89,0.96,9lgipu,https://wwjnewsradio.radio.com/articles/brighton-woman-who-faked-breast-cancer-gets-prison-time,7,2018-10-5,
A satanic idol goes to the Arkansas Capitol building,91,0.95,98bzjr,https://www.washingtonpost.com/news/acts-of-faith/wp/2018/08/17/a-satanic-idols-3-year-journey-to-the-arkansas-capitol-building/,22,2018-8-18,
Colorado drags down national marijuana prices in first half of 2017,93,0.97,741uk2,http://www.thecannabist.co/2017/10/02/colorado-marijuana-prices-national-wholesale/88740/,6,2017-10-4,
"Cop pulls over Google self-driving car, finds no driver to ticket",90,0.95,600ocr,http://www.cnn.com/2015/11/13/us/google-self-driving-car-pulled-over/index.html,15,2017-3-18,
"Ohioan calls police to report the spider he swallowed must have been pregnant because he can feel the babies crawling around in his mouth. On the other hand, the acid he took might have something to do with something.",92,0.98,5y0o8c,http://www.theindychannel.com/news/national/man-on-lsd-calls-police-says-spider-gave-birth-in-his-stomach?,1,2017-3-7,
"World's tiniest cell phone is very popular with prison inmates, who are buying buttloads of them",90,0.93,4gy8wg,http://metro.co.uk/2016/04/19/this-is-the-worlds-tiniest-phone-and-its-unsurprisingly-popular-with-prisoners-5828253/,8,2016-4-29,
Oregon man smashes Buddhist monk’s head into a car while screaming about Muslims,91,0.95,49syf7,http://www.rawstory.com/2016/03/washington-man-smashes-buddhist-monks-head-into-a-car-while-screaming-about-muslims/,6,2016-3-10,
Australian petition to change currency to the 'dollarydoo' gathers force.,92,0.95,3p8kjj,https://sg.news.yahoo.com/blogs/daily-buzz/australian-petition-to-change-currency-to-172949200.html,1,2015-10-18,
8-year-old British girl diagnosed with terminal brain cancer becomes the first person in the world to beat the illness,89,0.94,27xur5,http://www.news.com.au/lifestyle/real-life/claudia-burkill-8-of-market-rasen-england-is-the-first-to-beat-brain-cancer/story-fnixwvgh-1226951290559,0,2014-6-12,
Taco Bell President Says Canada Will Get Breakfast 'When You Take Justin Bieber Back',89,0.83,21k039,http://www.huffingtonpost.com/foodbeast/taco-bell-president-says_b_5045279.html,11,2014-3-28,
"Policeman sues for being demoted after reporting a fellow officer was ogling Whitney Houston's naked, dead body.",94,0.99,204ttd,http://www.nbcnews.com/news/investigations/cop-i-was-demoted-reporting-ogling-whitney-houstons-body-n49526,6,2014-3-11,
Punk Band Shoots Porn Film on Front Lawn of Westboro Baptist Church,90,0.89,1no77a,http://gawker.com/punk-band-shoots-porn-film-on-front-lawn-of-westboro-ba-1440680143,7,2013-10-4,
US Midwest gets hurricane winds,88,0.94,ia3zoo,https://www.washingtonpost.com/outlook/2020/08/14/iowa-derecho-attention-aid/,10,2020-8-15,
Salmonella outbreak linked to onions expands to hundreds of people sickened in 43 states,93,0.95,i6me0o,https://www.wrcbtv.com/story/42471606/salmonella-outbreak-linked-to-onions-expands-to-hundreds-of-people-sickened-in-43-states,3,2020-8-10,
3 men rescued from Pacific island after writing SOS in sand,91,0.93,i43ij1,https://news.yahoo.com/3-men-rescued-pacific-island-052550910.html,4,2020-8-5,
Maria Carey's Sister Sues Mother (Accuses her of forcing her to attend late night 'Satanic' meetings),90,0.96,fgtmqt,https://meaww.com/mariah-carey-mother-patricia-10-year-old-sister-alison-sexual-assault-child-abuse-satanic-rituals,9,2020-3-11,
No one knows why rocks are exploding from asteroid Bennu - NASA’s OSIRIS-REx spacecraft spotted the asteroid spitting out rocks.,93,0.96,e7u7do,https://www.wired.com/story/no-one-knows-why-rocks-are-exploding-from-asteroid-bennu/,4,2019-12-8,
"Marietta woman accused of shooting into KFC after not receiving fork, napkins",92,0.97,e3jzts,https://www.ajc.com/news/crime--law/marietta-woman-accused-shooting-into-kfc-after-not-receiving-fork-napkins/qR7C8QmzQ8Ek1ZzpsMx54L/#,12,2019-11-30,
Man Blows Up Septic Tank & Spilled Poop In His Whole House After He Lit Cigarette In Toilet,92,0.97,dutc5s,https://www.lucisphilippines.press/2019/11/man-blows-up-septic-tank-spilled-poop.html?m=1,6,2019-11-11,
Personal Data Of Entire 16.6 Million Population Of Ecuador Leaked Online,88,0.97,d5yn2o,https://incyberdefense.com/news/personal-data-of-entire-16-6-million-population-of-ecuador-leaked-online/?fbclid=IwAR3D9WsPq0LmOMwffIpVD1owda3w2ZmPiAKwigHqnV9LYyiQVAXVCEF2R4A,2,2019-9-18,
"Police say woman tipped waitress $5,000 as revenge on boyfriend",94,0.95,c8wzt8,https://www.mychamplainvalley.com/news/national-news/police-say-woman-tipped-waitress-5000-as-revenge-on-boyfriend/,8,2019-7-4,
Garfield beach phone mystery solved after 30 years,93,0.96,b6xc51,https://news.yahoo.com/garfield-beach-phone-mystery-solved-30-years-023531370.html,2,2019-3-29,
Parents of dead West Point cadet wants to retrieve his sperm - raising ethical and legal questions,94,0.94,azueu6,https://www.nydailynews.com/news/national/ny-news-parents-sperm-retrieve-20190305-story.html,9,2019-3-11,
"Thieves steal railway tracks worth $30,000 in rural Queensland",91,0.97,akmwpf,https://www.brisbanetimes.com.au/national/queensland/thieves-steal-railway-sleepers-worth-30-000-in-rural-queensland-raid-20190128-p50u1g.html,12,2019-1-28,
Australian police pose as squeegee guys to nab drivers illegally on their phones. No word on how much they earned in tips.,88,0.95,9wt6fx,https://www.heraldsun.com.au/news/law-order/undercover-squeegee-cops-nab-dozens-of-drivers-on-phones/news-story/6c80242f6497b3a214cbee24cf812580?fbclid=IwAR3QS2E7ql8heR4IWGy5YLXjJ-i1MEvzcTUR-hmjdozcLHro3prW6XyiP34&nk=c348a27e4085682278cec1cf84db83fb-1542143337,19,2018-11-14,
"India: 2 Girls Call For Help After Bike Broke Down, 11 Came To Rape Them",88,0.91,98qwbc,https://www.ndtv.com/india-news/stranded-girls-called-for-help-man-sent-11-friends-to-rape-them-police-1902914,17,2018-8-20,
Drunk man breaks into Taco Bell to eat empty Doritos taco shells,91,0.95,8k46wd,http://www.foxnews.com/food-drink/2018/05/01/drunk-man-breaks-into-taco-bell-to-eat-empty-doritos-taco-shells.html,12,2018-5-17,
Astronaut Scott Kelly Spent a Year in Space and Now He Has Different DNA Than His Identical Twin Brother,88,0.96,840kqb,https://www.livescience.com/62000-scott-kelly-dna-twin-study.html,9,2018-3-13,
"Gambler hits $1.4M jackpot, casino says bingo machine “malfunctioned” - Gambler has no right to contest non-payment because casino is on tribal land.",91,0.96,73qwsa,https://arstechnica.com/tech-policy/2017/10/1-4-million-jackpot-is-voided-because-bingo-machine-malfunctioned/,13,2017-10-2,
Black man who lost penis in botched circumcision to have transplanted organ tattooed - because donor was white,93,0.95,6d1cuq,http://www.mirror.co.uk/news/weird-news/black-man-who-lost-penis-10483709,11,2017-5-24,
"Charlie Sheen Pledges $1,000 To Burger Joint Server Who Was Tipped 20 Cents By NFL Star",88,0.8,2gaduc,http://www.huffingtonpost.com/2014/09/12/charlie-sheen-offers-1000-to-waiter_n_5806410.html,17,2014-9-13,
"Woman selling positive pregnancy tests on Craigslist. Because, lies.",91,0.93,1fcm8k,http://www.thefrisky.com/2013-05-29/did-you-need-a-positive-pregnancy-test-because-this-womans-selling-them/,6,2013-5-31,
How NYC’s hottest sex club is doing socially distanced orgies,90,0.93,hduchz,https://nypost.com/2020/06/22/a-soho-sex-club-reopens-amid-coronavirus/,9,2020-6-22,
French Footballer suspended for biting opponents penis,88,0.96,gxowhc,https://siniteco.com/french-footballer-suspended-for-biting-opponents-penis/,4,2020-6-6,
53 year old Mike Tyson shows off toned physique and abs while throwing punches as he prepares for boxing comeback (Photos/video) - Newsday Ghana,86,0.86,gnyno1,https://www.newsdayghana.com/53-year-old-mike-tyson-shows-off-toned-physique-and-abs-while-throwing-punches-as-he-prepares-for-boxing-comeback-photos-video/,17,2020-5-21,
Man Faked Being “Handicapped” Teen to Get Diaper Changed: Cops,87,0.93,dxnx3c,https://nypost.com/2019/11/15/man-faked-being-handicapped-teen-to-get-diaper-changed-cops/,11,2019-11-17,
Feathers snag in Utah toddler's throat and come out through her neck,87,0.94,d6yii9,https://kutv.com/news/get-gephardt/feathers-snag-in-utah-toddlers-throat-and-come-out-through-her-neck,5,2019-9-21,
A contract programmer faces 10 years in jail for inserting a 'logic bomb' into a spreadsheet that caused the company to keep rehiring him,87,0.97,ciywsg,https://www.businessinsider.in/a-contract-programmer-faces-10-years-in-jail-for-inserting-a-logic-bomb-into-a-spreadsheet-that-caused-the-company-to-keep-rehiring-him/articleshow/70354739.cms,10,2019-7-29,
Florida Manatee Orgy Near Tampa Bay Highway Causes World's Most Awkward Traffic Jam,87,0.97,borjv7,https://www.thedrive.com/news/27980/florida-manatee-orgy-near-tampa-bay-highway-causes-worlds-most-awkward-traffic-jam,3,2019-5-15,
Elderly woman accused of training her 65 cats to steal from neighbors,91,0.85,9jwrsf,https://worldnewsdailyreport.com/elderly-woman-accused-of-training-her-65-cats-to-steal-from-neighbors/,8,2018-9-29,
Pizza delivery man gets $180K settlement after being crushed by 400 pounds of cheese,92,0.93,8n972b,http://www.wbaltv.com/article/pizza-delivery-man-gets-dollar180k-settlement-after-being-crushed-by-400-pounds-of-cheese/20083709,5,2018-5-30,
YouTube idiot cemented his head inside a microwave,91,0.95,7ieega,http://metro.co.uk/2017/12/08/youtube-idiot-cemented-head-inside-microwave-7142007/,9,2017-12-8,
Lead singer of punk band Bad Brains to undergo brain surgery,89,0.92,5ruk4n,https://www.theguardian.com/music/2017/feb/03/hr-bad-brains-surgery,3,2017-2-3,
"Dwayne 'The Rock' Johnson considers political career, White House run",94,0.88,5d0w2s,http://www.abc.net.au/news/2016-11-15/dwayne-the-rock-johnson-considering-white-house-run/8026474,21,2016-11-15,
McDonald’s Customers Complaining Because Mozzarella Sticks Should Contain Cheese,88,0.98,433fmp,http://consumerist.com/2016/01/27/mcdonalds-customers-complaining-because-mozzarella-sticks-should-contain-cheese/,25,2016-1-28,
"About That Palin Endorsement. The NY Daily News Nails It Again ""I am with STUPID!""",91,0.85,41vtu1,http://www.dailykos.com/stories/2016/1/19/1472283/-About-That-Palin-Endorsement-The-NY-Daily-News-Nails-It-Again?detail=email,8,2016-1-21,
Ukrainian astronomers name a star ‘Putin is a dickhead’,87,0.92,29w35c,http://www.dazeddigital.com/artsandculture/article/20683/1/ukrainian-astronomers-name-a-star-putin-is-a-dickhead,5,2014-7-5,
"Montréal woman thinks she's pregnant with 5 babies. 34 weeks later, she's told she was never pregnant.",90,0.94,22zlfx,http://www.torontosun.com/2014/03/20/dad-to-be-shocked-girlfriend-wasnt-even-expecting,14,2014-4-14,
New Jersey realtors caught on camera having sex in home of a client named Dick Weiner.,91,0.94,1tj7qt,http://gawker.com/new-jersey-realtors-caught-on-camera-having-sex-in-a-cl-1488323799,1,2013-12-23,
"Pelosi says she's receiving Trump health updates through the media, not briefings",92,0.92,j572ic,https://www.axios.com/pelosi-trump-health-updates-media-32f9a9b6-5f36-4b07-8499-0d82a8c3e67a.html,1,2020-10-5,
More than three tons of pot found in truckload of ketchup,87,0.94,hwikpy,https://cdllife.com/2020/more-than-three-tons-of-pot-found-in-truckload-of-ketchup/,12,2020-7-24,
Japanese Engineering Students Built A Perfectly Faithful Honda C100 Super Cub Replica Out Of Cardboard,87,0.92,ggkftz,https://jalopnik.com/japanese-engineering-students-built-a-perfectly-faithfu-1843296129,2,2020-5-10,
Rats are starving. Now cannibals,92,0.93,g3nazl,https://news.yahoo.com/starving-angry-cannibalistic-americas-rats-083044471.html,10,2020-4-18,
"Sea turtles are eating ocean plastic because it smells like food, study finds",87,0.93,ffyita,https://www.cnbc.com/2020/03/09/sea-turtles-are-eating-ocean-plastic-because-it-smells-like-food-study.html,0,2020-3-10,
Coronavirus: Plague Inc. Was banned in China,86,0.92,fb3dmx,https://www.bbc.com/news/technology-51673293,1,2020-2-29,
Stray Dog Named 'Sausage' Gets Appreciation Star For Helping Kindergartners Cross The Road,89,0.94,et4z41,https://www.sunnyskyz.com/good-news/3633/Stray-Dog-Named-039-Sausage-039-Gets-Appreciation-Star-For-Helping-Kindergartners-Cross-The-Road,5,2020-1-24,
Rare fatal wild hog attack spurs swine population control initiative in Chambers County park near Houston,92,0.96,edro6q,https://www.houstonchronicle.com/news/houston-texas/houston/article/Rare-wild-hog-attack-spurs-swine-population-14917054.php,6,2019-12-22,
Washington Governor signs bill to allow composting human bodies,88,0.93,btqk5a,https://arstechnica.com/tech-policy/2019/05/in-washington-its-now-legal-to-compost-your-body-after-death/,4,2019-5-28,
Teenager loses his driving license after 49 minutes,90,0.94,9z45mc,https://www.cnn.com/2018/11/21/europe/teenager-loses-driving-license-scli-grm-intl/index.html,3,2018-11-21,
Man run over by lawn mower while trying to kill son with chainsaw,87,0.94,9ns5xx,https://wreg.com/2018/10/12/man-run-over-by-lawn-mower-while-trying-to-kill-son-with-chainsaw/,6,2018-10-13,
Report Of 4-Foot Long Reptile In Lake Michigan Turns Out To Be True,90,0.96,9miz8f,https://wwjnewsradio.radio.com/articles/report-4-foot-long-reptile-lake-michigan-turns-out-be-true,5,2018-10-9,
Man sentenced to century in prison in Pennsylvania’s largest case of child porn,86,0.94,9h8vdp,https://edmontonsun.com/news/crime/man-sentenced-to-century-in-prison-in-pennsylvanias-largest-case-of-child-porn/wcm/cf4fba96-9a5a-463a-8b5e-dffa486c469c,17,2018-9-20,
A kindergarten in China got a pole dancer to perform for kids on their first day back at school,93,0.97,9cv8fw,https://www.msn.com/en-ca/news/offbeat/a-kindergarten-in-china-got-a-pole-dancer-to-perform-for-kids-on-their-first-day-back-at-school/ar-BBMR1yB,6,2018-9-4,
Ethan Sonneborn: 14-year-old boy uses legal quirk to run for Vermont governor,91,0.96,9798x0,https://www.cbsnews.com/news/vermont-governor-race-ethan-sonneborn-14-year-old-boy-uses-legal-quirk-to-run-for-governor/,10,2018-8-14,
Crocodile kills pastor during baptism,87,1.0,8owjlk,https://www.bbc.com/news/world-africa-44366360,13,2018-6-6,
Puppy stolen by Amazon delivery driver returned after Bezos emailed,85,0.96,8h0t17,https://www.usatoday.com/story/tech/news/2018/05/04/puppy-stolen-amazon-delivery-driver-returned-after-bezos-emailed/580206002/,6,2018-5-5,
Man has “world’s worst” super-gonorrhoea,85,0.95,87urni,http://www.bbc.com/news/health-43571120,9,2018-3-29,
Uzbek Imam Warns Fantasizing About Strangers During Sex Leads To Gay Babies,90,0.97,82ziqb,https://www.rferl.org/a/uzbekistan-imam-warns-fantasizing-about-strangers-sex-gay-babies/29086475.html,14,2018-3-9,
