title,score,upv_ratio,id,url,comms_num,created,body
Coronavirus hits Mexican cartels and leads to shortages of meth and fentanyl as chemicals can’t be sourced from China,385,0.98,fnpqr3,https://www.the-sun.com/news/567928/coronavirus-hits-mexican-cartels-and-leads-to-shortages-of-meth-and-fentanyl-as-chemicals-cant-be-sourced-from-china/,33,2020-3-24,
"Cops demand Uber driver turn off his camera, citing new law, threaten him with jail, say they will search his car with sniffer dogs. Driver refuses, because it turns out the driver is also an attorney and he knows no such law exists.",367,0.94,5yef39,http://www.wect.com/story/34695605/video-shows-wpd-sergeant-falsely-telling-citizen-to-stop-recording-him-because-of-state-law,30,2017-3-9,
Baltimore Mayor Begs Residents To Stop Shooting Each Other So Hospital Beds Can Be Used For Coronavirus Patients,330,0.99,fku2k7,https://www.7ummitmagazine.com/latest-news/2020/3/18/baltimore-mayor-begs-residents-to-stop-shooting-each-other-so-hospital-beds-can-be-used-for-coronavirus-patients,26,2020-3-19,
R.E.M. song 'It's the End of the World' re-enters charts amid coronavirus outbreak,330,0.96,fj6z90,https://consequenceofsound.net/2020/03/r-e-m-s-its-the-end-of-the-world-coronavirus/,22,2020-3-16,
West Virginians Are Campaigning to Replace Confederate Statues With Mothman,325,0.98,h9pasu,https://melmagazine.com/en-us/story/west-virginia-mothman-replace-confederate-statues?utm_source=digg,20,2020-6-16,
It turns out that Juggalo makeup blocks facial recognition technology,276,0.97,cb0aka,https://consequenceofsound.net/2019/07/juggalo-makeup-facial-recognition/amp/,20,2019-7-9,
Anti-LGBT politician resigns after being 'caught having sex with man in his office',266,0.97,7drfb1,https://www.yahoo.com/news/anti-lgbt-lawmaker-resigns-being-140200984.html,17,2017-11-18,
Hobby lobby owners wife has a “vision from god” to keep stores open,264,0.96,fmsu91,https://www.google.com/amp/s/www.rawstory.com/2020/03/hobby-lobby-to-stay-open-during-coronavirus-after-billionaire-owners-wife-had-a-vision-from-god-report/amp/,38,2020-3-22,
Surgeon General warns: Drinking every time Trump lies during debate could result in acute alcohol poisoning,262,0.84,54mcoc,http://usuncut.com/news/surgeon-general-warns-drinking-every-time-trump-lies-debate-result-acute-alcohol-poisoning/,14,2016-9-27,
"N.J. cop tried to lure 15-year-old girl for sex, but he was really chatting online with undercover detective, cops say",254,0.97,bebut2,https://www.nj.com/bergen/2019/04/nj-cop-accused-of-luring-15-year-old-girl-for-sex-but-he-was-chatting-online-with-undercover-detective-cops-say.html,13,2019-4-18,
Fox News host Pete Hegseth says he has not washed his hands in 10 years: 'Germs are not a real thing',250,0.95,api11m,https://www.newsweek.com/pete-hegseth-hand-washing-hygiene-fox-news-germs-1325989,54,2019-2-12,
Texas hunters accidentally shoot each other and try to blame undocumented immigrants,236,0.92,cjh051,https://www.independent.co.uk/news/world/americas/texas-hunters-blamed-immigrants-after-accidentally-shooting-each-other-a7591471.html?fbclid=IwAR2ZP9i96CGvk0BdcTsfbCDT0p_1Tjpw-Js5QR4CU1569b2c09ndth10i5A,8,2019-7-30,
Aussie couple ordered wine via drone on quarantined coronavirus cruise ship,239,0.97,f2r1ha,https://nypost.com/2020/02/10/aussie-couple-ordered-wine-via-drone-on-quarantined-coronavirus-cruise-ship/?utm_source=reddit.com,11,2020-2-12,
"Sending unsolicited dick pics is now illegal in Texas, and could result in a $500 fine and criminal record",235,0.97,czsxjx,https://www.businessinsider.com.au/unsolicited-dick-pic-sending-now-illegal-texas-500-fine-bumble-2019-9,29,2019-9-5,
"Cops shut down massive 3,000-person game of hide-and-seek at Ikea",233,0.99,d2v870,https://www.da-pulse.com/2019/09/11/news/dapulsenews/cops-shut-down-massive-3000-person-game-of-hide-and-seek-at-ikea/,15,2019-9-12,
"We found 85,000 cops who’ve been investigated for misconduct. Now you can read their records.",230,0.97,bhd16e,https://www.usatoday.com/in-depth/news/investigations/2019/04/24/usa-today-revealing-misconduct-records-police-cops/3223984002/,5,2019-4-26,
Georgia teacher on leave after saying Confederate flag means you 'intend to marry your sister',230,0.96,ddoh0n,https://www.foxnews.com/us/georgia-high-school-teacher-on-administrative-leave-after-saying-confederate-flag-means-you-intend-to-marry-your-sister,63,2019-10-5,
Authorities Repair Potholes After Local Hero Sprayed Penisses Around Them,231,0.96,ceh4hy,https://truththeory.com/2019/04/29/authorities-repair-potholes-after-local-hero-sprayed-penisses-around-them/,13,2019-7-18,
Pope Francis orders fired Archbishop's $40 million mansion turned into a soup kitchen for the poor,228,0.88,1pj9es,http://www.independent.co.uk/news/world/europe/german-bishop-of-blings-multimillion-euro-mansion-to-be-used-to-serve-needy-8907623.html,28,2013-10-30,
"She Loses Wedding Ring While Gardening, Finds It Wrapped Around A Carrot 13 Yrs Later",228,0.93,bnn8gw,https://www.somethingoneviral.in/she-loses-wedding-ring-while-gardening-finds-it-wrapped-around-a-carrot-13-yrs-later/,7,2019-5-12,
TIL Ted Nugent dodged the draft by pooping in his pants for a week,225,0.92,a2ob8d,https://tildalife.com/patriotic-american-ted-nugent-shit-his-pants-to-avoid-the-draft/,53,2018-12-3,
Marijuana Pepsi Refused To Change Her Name Earns Ph.D After Completing Dissertation On ‘Black-Sounding’ Names,219,0.95,drhqnp,https://theblackdetour.com/marijuana-pepsi-refused-to-change-her-name-earns-ph-d/,20,2019-11-4,
Petition To Add Anti-Vaxxers To Plague Inc. Reaches Its Goal; Developers Say They'll Do It,221,0.97,avk3qp,https://www.thegamer.com/petition-add-anti-vaxxers-plague-inc-reached-goal/,5,2019-2-28,
President of the United States recommends injecting disinfectants into human bodies,223,0.83,g76ltg,https://www.washingtonpost.com/nation/2020/04/24/disinfectant-injection-coronavirus-trump/?fbclid=IwAR39TR1CoTPF2fUWKA-G3FpKprRwvhFs3X55KtIcKI9cuR57ddnqxaxP3hU,83,2020-4-24,
"‘This is crazy,’ sobs Utah hospital nurse as cop roughs her up, arrests her for doing her job",216,0.97,6xes3b,https://www.washingtonpost.com/news/morning-mix/wp/2017/09/01/this-is-crazy-sobs-utah-hospital-nurse-as-cop-roughs-her-up-arrests-her-for-doing-her-job/?utm_term=.e2375c0f92ef#comments,24,2017-9-1,
"Parrots at a British zoo removed for telling visitors to 'f#ck off', calling some 'fat tw#ts'.",210,0.98,j2ar6i,https://www.cnn.com/travel/article/swearing-parrots-moved-park-scli-gbr-intl/index.html,2,2020-9-30,
"Man charged after deliberately farting during strip search, saying ""How do you like that?""",212,0.98,d7byyn,https://www.newsweek.com/deliberately-farting-strip-search-1460505?fbclid=IwAR01zWcpeyU7X6IyQNyyGiDGz4uH4t_ALEwg-963WcbixPLm9tZ1zrRbZoY,24,2019-9-21,
"Two people arrested in Oklahoma allegedly driving a stolen vehicle containing uranium, a rattlesnake, a gun, and an open bottle of Kentucky Deluxe",210,0.99,cbwtdj,https://kfor.com/2019/07/10/logan-co-man-allegedly-driving-stolen-vehicle-filled-with-uranium-a-rattlesnake-and-kentucky-deluxe/,25,2019-7-11,
Woman tells husband to water her plants after she passes away. Years later he discovers they're plastic,209,0.97,8ayww9,https://www.indy100.com/article/husband-plant-watering-plastic-adorable-twitter-moment-viral-antonia-nicol-phedre-fitton-8165446?,9,2018-4-9,
"Thanks to the artistic skills of sculptor Anne Coleman Ladd, who handcrafted early facial prosthetics for wounded World War 1 veterans, these young men were able to return to a fairly normal life.",208,0.97,dgoeqm,https://v.redd.it/sbl3mm9ve0s31,9,2019-10-12,
"Hand dryers suck in fecal bacteria and blow it all over your hands, study finds",209,0.96,e5yue8,https://www.cnbc.com/2018/04/13/hand-dryers-suck-in-fecal-bacteria-and-blow-it-all-over-your-hands-study-finds.html?__source=Facebook%7Cmain&fbclid=IwAR0TDfkNWv32oIikDYdcPgkPnzQBIrRzB-5zUc9_CbJJLWqqEYhV-zbyFes,20,2019-12-4,
Trump’s spiritual adviser commands ‘all satanic pregnancies to miscarry’ in prayer against impeachment,204,0.9,eu8lpc,https://deadstate.org/trumps-spiritual-adviser-commands-all-satanic-pregnancies-to-miscarry-to-protect-trump-against-impeachment/,47,2020-1-27,
Gospel-singing Brazilian politician conspired to murder her husband (who was formerly her adopted son) with the help of seven of her fifty-five (mostly adopted) children,205,0.99,ihlr0y,https://www.theguardian.com/world/2020/aug/26/brazil-flordelis-dos-santos-de-souza-calls-congress-husband-murder-charges?CMP=Share_AndroidApp_Other,15,2020-8-27,
"Vladimir Putin calls trans people ""transformers"".",201,0.96,cx1n6u,https://www.independent.co.uk/news/world/europe/putin-elton-john-russia-lgbt-rights-gay-trans-propaganda-law-a8980256.html,20,2019-8-29,
N.J. millionaire CEO who put his plane on autopilot to have sex with teen girl sentenced to 7 years,199,0.98,c23cj1,https://www.nj.com/somerset/2019/06/nj-millionaire-ceo-who-put-his-plane-on-autopilot-to-have-sex-with-teen-girl-sentenced-to-7-years.html,30,2019-6-18,
Composting human bodies to turn them into soil will soon be legal in one US state — part of a growing green death trend,204,0.98,bt6b2w,https://www.businessinsider.com/washington-state-human-compost-bodies-into-soil-2019-5?utm_content=bufferbe196&utm_medium=social&utm_source=facebook.com&utm_campaign=buffer-inventions,12,2019-5-26,
Donald Trump's Private Helicopter Worth over $1 Million up for Sale after Election Loss,201,0.93,jqz2b9,https://www.newsweek.com/donald-trumps-private-helicopter-worth-over-1-million-sale-after-election-loss-1545910,19,2020-11-9,
Petition Calls For Statue Of GWAR’s Oderus Urungus To Replace Robert E. Lee,204,0.93,hl6sr2,https://www.huffpost.com/entry/oderus-urungus-statue_n_5ee1b15fc5b65a7f2d98c3b5,8,2020-7-5,
Man who removed his condom during sex with prostitute has been jailed for rape,200,0.88,bgxrtt,https://metro.co.uk/2019/04/24/man-removed-condom-sex-prostitute-jailed-rape-9301174/,24,2019-4-25,
"University student awarded $265,000 after his girlfriend deleted an email awarding him a scholarship",200,0.99,8re0in,https://www.marketwatch.com/story/university-student-awarded-265000-after-his-girlfriend-deleted-an-email-awarding-him-a-scholarship-2018-06-15,4,2018-6-16,
"For 20 years, a Tennessee baby thief kidnapped more than 5,000 children from the streets, hospitals, and shanty towns of Memphis. Now, 70 years later, survivors of her 'house of horrors' are confronting the past.",197,0.98,e73wic,https://news.yahoo.com/20-years-tennessee-baby-thief-134448084.html,32,2019-12-7,
'Exotic' bird at Bucks Animal Hospital turns out to be a gull covered in curry or turmeric,202,0.96,ca897p,https://www.bucksfreepress.co.uk/news/17741769.exotic-bird-at-bucks-animal-hospital-turns-out-to-be-a-gull-covered-in-curry-or-turmeric/?ref=rss&utm_source=dlvr.it&utm_medium=twitter,9,2019-7-7,
Pablo Escobar's 'Cocaine Hippos' May Be Restoring Colombia's Ecosystem,196,0.97,foic0u,https://www.theguardian.com/environment/2020/mar/24/pablo-escobars-cocaine-hippos-show-how-invasive-species-can-restore-a-lost-world-aoe,9,2020-3-25,
Florida man prohibited from bringing cardboard cutout of Trump to dialysis clinic for emotional support,196,0.98,f3b2iz,https://www.rawstory.com/2020/02/florida-man-prohibited-from-bringing-cardboard-cutout-of-trump-to-dialysis-clinic-for-emotional-support/#.XkVh9_B_gIE.link,15,2020-2-13,
Marvel fans demand Danny DeVito be the next Wolverine,200,0.94,dzb24p,https://nypost.com/2019/05/22/marvel-fans-demand-danny-devito-be-the-next-wolverine-petition/,8,2019-11-21,
Priest Feeds Congregation Rat Poison To Prove They’re Above Death… They All Die,195,0.97,f697fk,https://www.unilad.co.uk/viral/priest-feeds-congregation-rat-poison-to-prove-theyre-above-death-they-all-die/?fbclid=IwAR1CGNN770fTXZBJvmnWhZ9CnHIxf7NKapfBfphKmxnYC3wAQBFdbV6Rpa4,23,2020-2-19,
A Pastor Arrested for impregnating 20 church members,194,0.99,bv76dl,https://www.grooda.com/2019/05/a-pastor-arrested-for-impregnating-20.html?m=1,17,2019-5-31,
Sex for the unmarried is now legal in Utah,193,0.97,b865eu,https://kutv.com/news/local/sex-for-the-unmarried-is-now-legal-in-utah,14,2019-4-2,
Ireland's Prime Minister Shows Up With His Boyfriend At Mike Pence's House,195,0.97,b1h386,https://www.huffpost.com/entry/mike-pence-irish-pm-leo-varadkar-partner_n_5c8b0b8ee4b0d7f6b0f17630,27,2019-3-16,
Texas high school senior threw a pizza party for the homeless instead of having a graduation party,192,0.96,bxhwy7,https://theblackdetour.com/texas-high-school-senior-threw-a-pizza-party-for-the-homeless/,3,2019-6-6,
"Texas dog accidentally shoots owner after its paw got stuck in trigger of gun, tucked in the man's waistband",188,0.99,js1s3n,https://www.insider.com/texas-dog-shoots-its-owner-in-the-leg-with-his-own-gun-2020-11,23,2020-11-11,
Incel Blows Off Hand Constructing DIY Bomb To Kill 'Hot Cheerleaders',192,0.95,h0xy58,https://allthatsinteresting.com/cole-carini-incel-hand-bomb,17,2020-6-11,
Man wants to sue his parents for giving birth to him 'without his consent',187,0.95,an0u2a,https://www.dailymail.co.uk/news/article-6664843/Man-wants-sue-parents-giving-birth-without-consent.html,35,2019-2-4,
"A stolen bottle of vodka thought to be the world's most expensive at $1.3m (£960,000) has been found empty on a construction site, Danish police say.",191,0.99,7oio7w,http://www.bbc.com/news/world-europe-42587038,6,2018-1-6,
"Hit the road: California legalizes eating roadkill | All you have to do is download an app and report you've struck and killed an animal, and the state will grant an instant ""salvage permit"" on your phone.",188,0.99,dod38x,https://newfoodeconomy.org/california-legalizes-eating-roadkill/,20,2019-10-29,
A man allegedly trying to kidnap a woman followed her when she ran for help: into a karate studio. It went about as well as you think,187,0.98,ackgon,https://www.cnn.com/2019/01/04/us/woman-kidnap-karate-studio-charlotte-trnd/index.html,12,2019-1-5,
"Mexican drug cartels struggle during coronavirus, hike prices as lab supplies from China dry up",186,0.98,g6gc49,https://www.foxnews.com/world/mexican-drug-cartels-struggle-lab-supplies-china-coronavirus,30,2020-4-23,
"After 6-Year Battle, Florida Couple Wins The Right To Plant Veggies In Front Yard",189,0.98,c8kyg8,https://www.npr.org/2019/07/02/738131948/after-6-year-battle-florida-couple-wins-the-right-to-plant-veggies-in-front-yard,6,2019-7-3,
Users lash out at Reddit boss for ‘deleting’ posts on hubby’s lawsuit,187,0.95,2zota1,http://www.news.com.au/finance/work/users-lash-out-at-reddit-boss-for-deleting-posts-on-hubbys-lawsuit/story-fn5tas5k-1227271600106?from=public_rss,12,2015-3-20,
Kazakhstan adopts Borat catchphrase 'Very nice!' as official tourism slogan,182,0.97,jipky3,https://ew.com/movies/kazakhstan-borat-very-nice-official-tourism-slogan/,13,2020-10-27,
"Woman crashes car in blood-soaked ‘Carrie’ costume, ‘freaks out’ good Samaritan and first responders",188,0.97,dqipvv,https://www.nydailynews.com/news/national/ny-woman-totals-car-in-carrie-costume-scares-good-samaritan-20191031-vb4tyftho5aedj4bu2arxnlcdm-story.html,3,2019-11-2,
'Mythical' mouse-deer thought to be extinct caught on camera trap,181,0.99,dv9hhi,https://www.abc.net.au/news/science/2019-11-12/silver-backed-chevrotain-extinct-mouse-deer-found/11692098?fbclid=IwAR1ceG62XgwwZkAado_iKMmmyNH9nThiu6KvP-zDtSWogAXRwzHjSfFlJ-Q,5,2019-11-12,
School bans bags so boy turns up carrying books in a microwave,184,0.95,9qcltt,https://metro.co.uk/2018/10/22/school-bans-bags-so-boy-turns-up-carrying-books-in-a-microwave-8062221/,20,2018-10-22,
Four Seasons Total Landscaping Just Dropped Branded Apparel,186,0.97,jqx1dn,https://www.forbes.com/sites/tanyaakim/2020/11/08/four-seasons-total-landscaping-just-dropped-branded-apparel/?sh=19be40614e62,5,2020-11-9,
'Transsexual Satanist anarchist' wins party nomination for sheriff in New Hampshire,186,0.97,irkm8z,https://www.foxnews.com/politics/transexual-satanist-anarchist-picks-up-gop-sheriff-nh-county,13,2020-9-13,
Government withholding 84-year-old grandmother’s Social Security Claiming She Owes $224K in College Debt,187,0.97,b6n0wx,https://theblackdetour.com/government-withholding-84-year-old-grandmothers-social-security/,28,2019-3-29,
Trump's Hollywood star smashed by someone in Hulk costume: report,183,0.94,j58wqk,https://thehill.com/blogs/in-the-know/in-the-know/519544-trumps-hollywood-star-smashed-by-someone-in-hulk-costume-report,20,2020-10-5,
Pentagon Ordered to Tell Congress If It Weaponized Ticks And Released Them Into the Public,185,0.94,cdvca5,https://gizmodo.com/pentagon-ordered-to-tell-congress-if-it-weaponized-tick-1836391549,21,2019-7-16,
US stops sending sniffer dogs to select foreign allies after seven died of 'negligence',182,0.99,efv2pq,https://www.middleeasteye.net/news/us-stops-sending-sniffer-dogs-egypt-jordan-over-negligence,23,2019-12-26,
"Parrot that was trained by drug dealers to alert them of police presence, wont speak after being detained",183,0.99,bi0cqb,https://www.ktvu.com/amp/news/now-trending/parrot-wont-talk-after-it-was-detained-for-warning-owners-of-law-enforcement-presence-in-drug-raid,10,2019-4-27,
Guy spends $4000 on a giant statue to give his entire town the middle finger,182,0.98,a5a2dq,http://vt.co/news/weird/guy-spends-4000-on-a-giant-statue-to-give-his-entire-town-the-middle-finger?utm_source=vt&utm_medium=junglecreations&utm_campaign=post&fbclid=IwAR1cg2uIDpDoXGWSc_CpK-szwadzohOhMqMmEa4Hz1NnEbMwPUa3-3wq2Bg,11,2018-12-12,
"Man paints his entire house pink, says neighbors can’t do anything about it.",180,0.97,ay59yq,http://www.wistv.com/2019/03/05/no-hoa-man-makes-entire-house-pink-says-neighbors-cant-do-anything-about-it/,38,2019-3-7,
"Boy, 8, drove sister to McDonald’s after learning to drive from YouTube",183,0.96,654pjq,http://metro.co.uk/2017/04/13/boy-8-drove-sister-to-mcdonalds-after-learning-to-drive-from-youtube-6571925/,22,2017-4-13,
"OKC jailers face cruelty charge; playing 'Baby Shark' on loop is 'inhuman,' prosecutor says",177,0.98,j6cj0x,https://tulsaworld.com/news/state-and-regional/okc-jailers-face-cruelty-charge-playing-baby-shark-on-loop-is-inhuman-prosecutor-says/article_923e0c3a-07db-11eb-b870-2ff6b9d67ab5.html#tracking-source=home-the-latest,14,2020-10-7,
"Militia group planned to kidnap Michigan Gov. Gretchen Whitmer, feds say",177,0.96,j7fue1,https://www.freep.com/story/news/local/michigan/2020/10/08/governor-gretchen-whitmer-kidnap-plot-militia/5921409002/,25,2020-10-9,
Indian man buys 28 tons of onions and drives 869 miles disguised as an onion seller to beat lockdown,174,0.97,g98lkt,https://www.cnn.com/world/live-news/coronavirus-pandemic-04-26-20-intl/h_385ed7b2f7cbbb1e9ae1bad1f9fc7da8,19,2020-4-28,
"House will vote on federal marijuana legalization for the first time, bill's future in Senate uncertain",180,0.97,imgy7n,https://www.usatoday.com/story/news/politics/2020/09/04/marijuana-house-vote-federal-legalization-first-time/5678068002/?fbclid=IwAR10ezP3O2n39zylHx2OGWnwY9sX8vOfGiuQvwZkY2Fwa1uaUMY__PAc7PI,30,2020-9-4,
Man who believes current air quality is 'too clean' named to US Environmental Protection Agency advisory board,177,0.95,7b08nr,https://www.independent.co.uk/news/world/americas/us-politics/robert-phalen-epa-advisory-board-air-too-clean-scott-pruitt-a8038091.html,10,2017-11-6,
Hasbro acquires gangster rap label Death Row Records as part of $4B deal,174,0.97,cvgzgw,https://nypost.com/2019/08/25/hasbro-acquires-gangster-rap-label-death-row-records-as-part-of-4b-deal/,15,2019-8-26,
Cat filter accidentally used in Pakistani minister’s live press conference,174,0.96,c1odcj,https://www.bbc.com/news/world-asia-48663289,4,2019-6-17,
"Man breaks into bank to heat up Hot Pocket, tells news getting arrested was ""f**king worth it. For a Hot Pocket, hell yeah!""",170,0.95,gs6m4h,https://96krock.com/2020/05/28/MAN-BREAKS-INTO-BANK-HEATS-UP-HOT-POCKET-TELLS-NEWS-GETTING-ARRESTED-WAS-FKING-WORTH-IT/,9,2020-5-28,
British Parrot Went Missing For Four Years Returns Speaking Spanish,172,0.97,f77rks,https://www.goodshomedesign.com/british-parrot-went-missing-for-four-years-returns-speaking-spanish/,5,2020-2-21,
Walmart greeter with cerebral palsy told he'll lose his job if he doesn't agree to new physical demands,169,0.96,atgdib,https://www.yahoo.com/lifestyle/walmart-greeter-cerebral-palsy-told-hell-lose-job-doesnt-agree-new-physical-demands-163741226.html,29,2019-2-22,
'Bomb threat' at a Home Depot turned out to be a man warning others about how badly he needed to use the restroom,173,0.96,aqqg8f,https://www.yahoo.com/lifestyle/bomb-threat-home-depot-turned-man-warning-others-badly-needed-use-restroom-212452328.html,8,2019-2-15,
Invasive giant hornets have been spotted in the US for the first time,169,0.97,gcpt6a,https://www.cnn.com/2020/05/03/us/washington-giant-murder-hornets/index.html,23,2020-5-3,
Billions of people are under coronavirus lockdowns – and now the upper crust of the Earth is shaking less,168,0.96,fuu2aw,https://www.cbsnews.com/news/coronavirus-lockdowns-earth-shaking-less-seismic-noise/,11,2020-4-4,
"At $75,560, housing a prisoner in California now costs more than a year at Harvard",169,0.95,6fnyti,http://www.latimes.com/local/lanow/la-me-prison-costs-20170604-htmlstory.html,7,2017-6-7,
"'Porch pirate' swipes Amazon box, but this is no Christmas gift; it was a box full of cat poop.",169,0.95,a6n3jj,https://www.pennlive.com/news/2018/12/surprise_porch_pirate_in_shamo.html?,6,2018-12-16,
Man orders 200 hash browns McDonald’s after being refused nuggets for breakfast,167,0.97,7dbwfp,http://metro.co.uk/2017/11/16/man-orders-200-hash-browns-mcdonalds-after-being-refused-nuggets-for-breakfast-7083328/,30,2017-11-16,
Mayors wife arrested at bar for not following quarantine orders,169,0.98,fwaxj9,http://www.altondailynews.com/mobile/news/details.cfm?clientid=17&id=301815#.XovPWFlOnqu,7,2020-4-7,
Immune cell which kills most cancers discovered by accident by British scientists in major breakthrough,170,0.98,erooxc,https://www.telegraph.co.uk/science/2020/01/20/immune-cell-kills-cancers-discovered-accident-british-scientists/,17,2020-1-21,
"FBI finds bucket of heads, cooler of penises, sewn 'Frankenstein' corpse at body donation center",166,0.96,ci8eu1,https://gizmodo.com/fbi-finds-bucket-of-heads-cooler-of-penises-sewn-fran-1836697819,16,2019-7-27,
Isis have been hacked by Anonymous again with lots of gay porn,165,0.97,6bgm4e,http://metro.co.uk/2017/05/15/isis-have-been-hacked-by-anonymous-again-with-lots-of-gay-porn-6637479/,12,2017-5-16,
Study confirms that painting eyes on cow butts helps ward off predators,164,0.99,icectk,https://arstechnica.com/science/2020/08/study-confirms-that-painting-eyes-on-cow-butts-helps-ward-off-predators/,11,2020-8-19,
"Gwyneth Paltrow's Goop is selling a vagina-scented candle, and it's already sold out",165,0.94,ennbbq,https://www.foxnews.com/lifestyle/gwyneth-paltrows-goop-vagina-scented-candle,21,2020-1-12,
"Government Generously Hands Back Two-Thirds Of The $626,000 It Stole From Two Men Driving Through Missouri",163,0.98,brpdgp,https://www.techdirt.com/articles/20190511/13433742188/government-generously-hands-back-two-thirds-626000-it-stole-two-men-driving-through-missouri.shtml,12,2019-5-22,
A song calling the British Prime Minister Theresa May a liar has skyrocketed into the UK top 10 music charts with all profits going to foodbanks to feed the children she has left in poverty,165,0.94,6dxxtp,https://www.google.co.uk/amp/www.dailyrecord.co.uk/news/theresa-mays-liar-song-overtakes-10520659.amp,19,2017-5-29,
Dad Buys Son Dinosaur Statue Online - Doesn't Realise It's Absolutely Massive,166,0.97,f1pcbu,https://www.ladbible.com/community/awesome-dad-buys-son-dinosaur-statue-online-doesnt-realise-its-massive-20200209,24,2020-2-10,
"Aurora police officer passes out drunk in car on duty, has to be broken out by firefighters, keeps his job",165,0.99,ebyois,https://therooster.com/blog/aurora-police-officer-passes-out-drunk-in-car-on-duty-has-to-be-broken-out-by-firefighters-keeps-his-job,5,2019-12-18,
"Trio of drag queens saves man from being bashed, then starts on the attackers",165,0.94,6uvpkn,http://www.news.com.au/national/nsw-act/crime/trio-of-drag-queens-saves-man-from-being-bashed-then-starts-on-the-attackers/news-story/e9f4b6e22d5445ea0841e186b2f63d13?,10,2017-8-20,
"When You Give a Tree an Email Address: The city of Melbourne assigned trees email addresses so citizens could report problems. Instead, people wrote thousands of love letters to their favorite trees.",164,0.99,3csrcf,http://www.theatlantic.com/technology/archive/2015/07/when-you-give-a-tree-an-email-address/398210/,6,2015-7-10,
"Could a Tree Help Find a Decaying Corpse Nearby? - On a “body farm,” researchers are exploring whether the nutrients from human cadavers can change the look of plants, which authorities might use to locate missing persons.",163,0.98,io9thm,https://www.wired.com/story/could-a-tree-signal-if-a-corpse-is-decaying/,4,2020-9-7,
Prince Andrew Allegedly Used a Puppet of Himself to Grope Victims at Jeffrey Epstein’s Home,164,0.98,i53psm,https://www.vanityfair.com/style/2020/08/prince-andrew-puppet-jeffrey-epstein-virginia-giuffre-assault-allegations#intcid=recommendations_vf-trending-legacy_b2df4015-5838-47b2-926a-112e517eb34a_popular4-1,25,2020-8-7,
First Chinese city bans consumption of cats and dogs,162,0.96,fu8avb,https://edition.cnn.com/2020/04/02/asia/shenzhen-cats-dogs-ban-scli-intl/index.html,15,2020-4-3,
Kansas City Health Department is facing backlash after pouring bleach on meals intended to feed the homeless,161,0.98,9ygsx7,https://theblackdetour.com/kansas-city-health-department-is-facing-backlash/,10,2018-11-19,
