title,score,upv_ratio,id,url,comms_num,created,body
Mod Announcement: We're considering banning all domains that require users to disable ad blockers and we'd like your input,41628,0.93,4if65h,https://www.reddit.com/r/technology/comments/4if65h/mod_announcement_were_considering_banning_all/,3384,2016-5-9,"It has come to our attention that many websites such as Forbes and Wired are now requiring users to disable ad blockers to view content. Because Forbes requires users to do this and has then served malware to them we see this as a security risk to you our community. There are also sites such as Wall Street Journal that have implemented pay-walls which we were are also considering banning. 

We would like all of your thoughts on whether or not we should allow domains such as Forbes here on /r/technology while they continue to resort to such  practices. 

Thank you for the input. "
"Facebook removes 200,000-strong QAnon group",41619,0.89,i5dipa,https://www.bbc.com/news/technology-53692545,1778,2020-8-7,
Chrome 66 arrives with autoplaying content blocked by default.,41576,0.92,8d1x5e,https://venturebeat.com/2018/04/17/chrome-66-arrives-with-autoplaying-content-blocked-by-default/,1050,2018-4-18,
China unveils 500 megapixel camera that can identify every face in a crowd of tens of thousands,41555,0.92,daihmr,https://www.telegraph.co.uk/news/2019/09/26/china-unveils-500-megapixel-camera-can-identify-every-face-crowd/,2899,2019-9-29,
Comcast to begin charging for data usage on home internet the same way cell phone companies are charging for data,41538,0.91,2mw2sw,https://customer.comcast.com/help-and-support/internet/data-usage-what-are-the-different-plans-launching?ref=1,7235,2014-11-21,
John McAfee arrested after DOJ indicts crypto millionaire for tax evasion,41511,0.95,j5vf9q,https://techcrunch.com/2020/10/05/john-mcafee-arrested-after-doj-indicts-crypto-millionaire-for-tax-evasion/,1831,2020-10-6,
Streaming Exclusives Will Drive Users Back To Piracy And The Industry Is Largely Oblivious,41504,0.93,9pk0y0,https://www.techdirt.com/articles/20181018/08242940864/streaming-exclusives-will-drive-users-back-to-piracy-industry-is-largely-oblivious.shtml,2980,2018-10-19,
Bernie Sanders applauds the gaming industry’s push for unionization,41467,0.8,c24drr,https://www.theverge.com/2019/6/18/18683690/bernie-sanders-video-game-industry-union-riot-games-electronic-arts-ea-blizzard-activision,2384,2019-6-19,
California passes strongest net neutrality law in the country,41452,0.9,9bybn3,https://www.theverge.com/2018/8/31/17805892/california-sb822-net-neutrality-law-vote,1642,2018-9-1,
Judge orders FCC to hand over IP addresses linked to fake net neutrality comments.,41450,0.96,gbqp9l,https://gizmodo.com/judge-orders-fcc-to-hand-over-ip-addresses-linked-to-fa-1843202071,985,2020-5-2,
"Forcing us to get consent before selling browser histories violates our free speech, US ISPs claim",41424,0.95,f6ucv6,https://www.theregister.co.uk/2020/02/20/maine_isp_lawsuit/,1754,2020-2-20,
"Comcast Admits It Incorrectly Debited $1,775 From Account, Tells Me To Sort It Out With Bank",41430,0.91,4pgy5s,https://consumerist.com/2016/06/22/comcast-admits-it-incorrectly-debited-1775-from-account-tells-me-to-sort-it-out-with-bank/,2759,2016-6-23,
"Android getting ""DNS over TLS"" support to stop ISPs from knowing what websites you visit",41378,0.92,781q39,https://www.xda-developers.com/android-dns-over-tls-website-privacy/,995,2017-10-23,
QAnon Website Shuts Down After N.J. Man Identified As Operator,41273,0.92,ir1a2c,https://www.bloomberg.com/news/articles/2020-09-11/qanon-website-shuts-down-after-n-j-man-identified-as-operator,2971,2020-9-12,
"US finds Huawei has backdoor access to mobile networks globally, report says",41247,0.94,f2l3o6,https://www.cnet.com/news/us-finds-huawei-has-backdoor-access-to-mobile-networks-globally-report-says/,2354,2020-2-12,
"Google, Microsoft, and Amazon’s Trade Group Joining Net Neutrality Court Challenge",41216,0.89,7oyctp,http://fortune.com/2018/01/06/google-microsoft-amazon-internet-association-net-neutrality/,1259,2018-1-8,
Anti-quarantine protesters are being kicked off Facebook and quickly finding refuge on a site loved by conspiracy theorists,41133,0.85,gctkqw,https://www.businessinsider.com/anti-quarantine-protesters-mewe-facebook-groups-conspiracy-theorists-social-media-2020-5?r=US&IR=T,1753,2020-5-4,
Reddit's Largest Pro-Trump Subreddit Appears To Have Been Targeted By Russian Propaganda For Years,41102,0.68,9ilzo1,https://www.buzzfeednews.com/article/ryanhatesthis/reddits-largest-pro-trump-subreddit-appears-to-have-been,5186,2018-9-25,
Reddit CEO: TikTok is ‘fundamentally parasitic’,41095,0.84,fablco,https://techcrunch.com/2020/02/26/reddit-ceo-tiktok-is-fundamentally-parasitic/,3065,2020-2-27,
"Google, Ting, Netflix Dare To Suggest That Maybe Giant, Anti-Competitive ISPs Shouldn't Be Writing State Telecom Laws",41042,0.92,5q3jbm,https://www.techdirt.com/articles/20170123/07582236547/google-ting-netflix-dare-to-suggest-that-maybe-giant-anti-competitive-isps-shouldnt-be-writing-state-telecom-laws.shtml,1220,2017-1-25,
Microsoft to permanently close nearly all of its retail stores,41012,0.95,hg7iiu,https://www.theverge.com/2020/6/26/21297400/microsoft-retail-stores-closing-cities-open?utm_campaign=theverge&utm_content=chorus&utm_medium=social&utm_source=twitter,2126,2020-6-26,
"Ex-Mozilla CTO: US border cops demanded I unlock my phone, laptop at SF airport – and I'm an American citizen - Techie says he was grilled for three hours after refusing to let agents search his devices",40967,0.94,b9c8hz,https://www.theregister.co.uk/2019/04/02/us_border_patrol_search_demand_mozilla_cto/,4250,2019-4-4,
Pelosi says Democrats to introduce bill to bring back net neutrality this week,40928,0.85,axcdd2,https://thehill.com/policy/technology/432519-pelosi-says-democrats-to-introduce-net-neutrality-bill-this-week,1129,2019-3-5,
Ajit Pai loses in court—FCC can’t kill broadband subsidy in Tribal areas,40913,0.91,9705yl,https://arstechnica.com/?post_type=post&p=1357875,548,2018-8-14,
'We're In. We're Out': The North Face becomes the first major company to boycott Facebook as the calls for advertisers to walk out of the platform in July intensify,40885,0.95,hc625g,https://www.businessinsider.com/the-north-face-boycotts-facebook-amid-pressure-from-several-organizations-2020-6,1134,2020-6-20,
Apple gives in: iPhone and iPad users can finally change their default mail app and web browser this fall,40838,0.94,heeh14,https://www.businessinsider.com.au/iphone-ipad-change-default-mail-app-web-browsers-2020-6,2052,2020-6-23,
More than 40 ISPs Across the Country Tell Chairman Pai to Not Repeal Network Neutrality and Maintain Title II Enforcement,40805,0.9,6k03j9,https://www.eff.org/deeplinks/2017/06/isps-across-country-tell-chairman-pai-not-repeal-network-neutrality,1699,2017-6-28,
Apple CEO Tim Cook: 'I Don't Think a Four-Year Degree is Necessary to Be Proficient at Coding',40794,0.9,bn1so2,https://www.macrumors.com/2019/05/10/apple-ceo-tim-cook-says-no-degree-needed-to-code/,3280,2019-5-11,
"‘Hey Siri, I’m getting pulled over’: iPhone feature will record police interaction, send location",40794,0.89,ha0t0l,https://www.fox29.com/news/hey-siri-im-getting-pulled-over-iphone-feature-will-record-police-interaction-send-location,1039,2020-6-16,
"If the FCC succeeds in dismantling net neutrality, it’ll be up to organisations like the EFF to mount a legal challenge. Now more than ever, it’s time to donate to the EFF!",40772,0.88,7enq2h,https://supporters.eff.org/donate,286,2017-11-22,
Complaints Against Police Officers With Body Cameras Drop 93 Percent,40767,0.86,57x12x,http://housely.com/complaints-against-police-officers-with-body-cameras-drop-93-percent/,3068,2016-10-17,
Facebook Reportedly Stymied Traffic to Left-Leaning News Outlets,40613,0.79,jdlpqm,https://gizmodo.com/with-zucks-blessing-facebook-quietly-stymied-traffic-t-1845403484,3216,2020-10-19,
Zuckerberg Hits Users with the Hard Truth: You Agreed to This,40556,0.88,87hfi2,https://www.vanityfair.com/news/2018/03/zuckerberg-hits-users-with-the-hard-truth-you-agreed-to-this?utm_source=quora,5068,2018-3-27,
"Tesla is now worth more than Toyota, Disney and Coke",40547,0.86,hjwm34,https://edition.cnn.com/2020/07/01/investing/tesla-market-value/index.html,2615,2020-7-2,
"Alexandria Ocasio-Cortez Among Us game watched by 400,000",40544,0.75,jfca5r,https://www.bbc.com/news/technology-54630330,2861,2020-10-21,
"2.6 million comments in, the FCC has changed almost nothing about its net neutrality proposal",40551,0.91,6d210m,https://www.theverge.com/2017/5/24/15682240/fcc-net-neutrality-proposal-sees-few-changes,1791,2017-5-24,
Lawmakers Have Snuck CISA Into a Bill That Is Guaranteed to Become a Law,40499,0.93,3x3cw6,http://motherboard.vice.com/read/lawmakers-have-snuck-cisa-into-a-bill-that-is-guaranteed-to-become-a-law,3841,2015-12-17,
"Fight for your right to fix your own iPhone: The ""Right-to-Repair"" movement fights corporate rules that keep you from fixing your own broken stuff",40442,0.88,6qhp4l,http://www.salon.com/2017/07/30/fight-for-your-right-to-fix-your-own-iphone/,1425,2017-7-30,
ISPs Gave 8X More Cash to Politicians That Axed FCC Privacy Rule,40420,0.89,65vg3p,http://www.dslreports.com/shownews/ISPs-Gave-8X-More-Cash-to-Politicians-That-Axed-FCC-Privacy-Rule-139377,1118,2017-4-17,
QAnon conspiracy kicked off Twitter as platform bans thousands of accounts,40324,0.9,hvvsbm,https://arstechnica.com/tech-policy/2020/07/qanon-conspiracy-kicked-off-twitter-as-platform-bans-thousands-of-accounts/,3612,2020-7-22,
"Facebook vowed to investigate horrific abuse by anti-vaxxers. Nine months later, no one was penalized",40266,0.91,hd59ko,https://edition.cnn.com/2020/06/20/health/facebook-anti-vaxxer-investigation-update/index.html,876,2020-6-21,
Court says net neutrality rules will go into effect today: Rules that treat the Internet like a public utility and prevent companies from blocking or slowing down some online traffic will go into effect today after a federal appeals court refused to delay them,40266,0.93,39ks2h,http://hosted.ap.org/dynamic/stories/U/US_NET_NEUTRALITY_STAY_DENIED?SITE=AP&SECTION=HOME&TEMPLATE=DEFAULT&CTIME=2015-06-11-18-51-15,1422,2015-6-12,
New Bill Would Stop Internet Service Providers From Screwing You With Hidden Fees,40248,0.95,deikwo,https://www.vice.com/en_us/article/j57ddb/new-bill-would-stop-internet-service-providers-from-screwing-you-with-hidden-fees,945,2019-10-7,
These are the 24 Senators that introduced a bill to let telecoms sell your private internet history,40224,0.91,5ysxrp,https://www.privateinternetaccess.com/blog/2017/03/24-senators-introduced-bill-let-telecoms-sell-private-internet-history/,2307,2017-3-11,
"China has started ranking citizens with a creepy 'social credit' system - here's what you can do wrong, and the embarrassing, demeaning ways they can punish you",40222,0.88,8aovfb,http://www.businessinsider.com/china-social-credit-system-punishments-and-rewards-explained-2018-4,4581,2018-4-8,
The Average U.S. Millennial Watches More Netflix Than TV,40128,0.88,b1dnyq,https://www.fool.com/investing/2019/03/14/the-average-us-millennial-watches-more-netflix-tha.aspx,4125,2019-3-15,
"“He doesn’t believe in it”: Mark Zuckerberg has never cared about your privacy, and he’s not going to change.",40067,0.89,9yy68r,https://www.vanityfair.com/news/2018/11/mark-zuckerberg-has-never-cared-about-your-privacy,1611,2018-11-21,
Democrat asks why FCC is hiding ISPs’ answers to net neutrality complaints: 'FCC apparently still hasn't released thousands of documents containing the responses ISPs made to net neutrality complaints.',40062,0.9,7hp6u0,https://arstechnica.com/tech-policy/2017/12/fcc-still-withholding-isps-responses-to-net-neutrality-complaints/,739,2017-12-5,
Rhode Island bill would charge $20 fee to unblock Internet porn,40052,0.91,82g0lz,https://www.upi.com/Top_News/US/2018/03/06/Rhode-Island-bill-would-charge-20-fee-to-unblock-Internet-porn/8441520319464/,3543,2018-3-6,
Reddit in uproar after staff sacking,40023,0.89,3bztob,http://www.bbc.com/news/technology-33379571,2659,2015-7-3,
Trump’s Cybersecurity Advisor Rudy Giuliani Thinks His Twitter Was Hacked Because Someone Took Advantage of His Typo,39997,0.85,a3o194,https://motherboard.vice.com/en_us/article/kzvndz/trumps-cybersecurity-advisor-rudy-giuliani-thinks-his-twitter-was-hacked-because-someone-took-advantage-of-his-typo,1761,2018-12-6,
Fourth Amendment Caucus defeats Patriot Act expansion in Congress,39971,0.92,4sys1l,https://www.privateinternetaccess.com/blog/2016/07/fourth-amendment-caucus-defeats-patriot-act-expansion-in-congress/,1616,2016-7-15,
Fight for your right... to repair - The Right to Repair is about restoring the power to repair products to the American people,39972,0.91,avdirp,https://www.salon.com/2019/02/27/fight-for-your-right-to-repair_partner/,970,2019-2-27,
The Coronavirus Is Forcing Techies To Work From Home. Some May Never Go Back To The Office.,39948,0.89,fdvr06,https://www.buzzfeednews.com/article/alexkantrowitz/the-coronavirus-is-forcing-techies-to-work-from-home-some,3010,2020-3-5,
"Calling for Reddit’s CEO to step down reaches 14,000 (now 18,000 plus)",39944,0.82,3c08mg,http://www.cnbc.com/id/102808806,2440,2015-7-4,
"Facebook Says InfoWars, Which Reported That NASA Has a Slave Colony on Mars, Is a Valid Source of “Opinion and Analysis”",39953,0.8,8yerfm,https://slate.com/news-and-politics/2018/07/facebook-says-infowars-valid-opinion-and-analysis-but-what-about-the-martian-slave-colony.html?via=recirc_recent,2354,2018-7-13,
FBI director says foreign disinformation campaigns 'never stopped' after 2016 elections,39948,0.89,ezitcb,https://thehill.com/policy/cybersecurity/481727-fbi-director-says-foreign-disinformation-campaigns-never-stopped-after,1125,2020-2-6,
"Police routinely misuse state and federal databases to stalk romantic interests, business partners, family, and even each other",39936,0.87,551w8r,https://www.privateinternetaccess.com/blog/2016/09/police-routinely-misuse-state-federal-databases-stalk-romantic-interests-business-partners-family-even/,2672,2016-9-29,
Google Has Finally Started Penalizing Mobile Websites With Intrusive Pop-Up Ads,39910,0.89,5oy3s0,https://www.scribblrs.com/google-now-penalizing-mobile-ads/,1164,2017-1-20,
Google admits to censoring the World Socialist Web Site,39906,0.77,jp4j76,https://www.wsws.org/en/articles/2020/11/04/goog-n04.html,2777,2020-11-6,
Calif. weighs toughest net neutrality law in US—with ban on paid zero-rating. Bill would recreate core FCC net neutrality rules and be tougher on zero-rating.,39901,0.9,84f39r,https://arstechnica.com/tech-policy/2018/03/att-and-verizon-data-cap-exemptions-would-be-banned-by-california-bill/,1674,2018-3-15,
"Obama didn't force FCC to impose net neutrality, investigation found",39867,0.83,7kuvfk,https://arstechnica.com/tech-policy/2017/12/obama-didnt-force-fcc-to-impose-net-neutrality-investigation-found/,1606,2017-12-20,
"It's Now Clear None of the Supposed Benefits of Killing Net Neutrality Are Real - Network investment is down, layoffs abound, and networks are falling apart. This isn’t the glorious future Ajit Pai promised.",39711,0.88,ajems2,https://motherboard.vice.com/en_us/article/gyab5m/its-now-clear-none-of-the-supposed-benefits-of-killing-net-neutrality-are-real,1214,2019-1-25,
"Every American town should do what Rockport, Maine and Chattanooga, Tennessee have done and build a publically-owned fiber-optic network. If they can't afford to do that, the state or federal government should step in and help them finish the job, just like we did with electric power in the 1930s",39708,0.88,2dx3mz,http://www.truth-out.org/opinion/item/25563-should-the-internet-be-like-the-public-library,1781,2014-8-19,
Hulu drops to just $5.99 per month after Netflix’s price hikes,39709,0.85,aj2hak,https://www.theverge.com/2019/1/23/18193539/hulu-price-change-subscription-ads-live-tv-2019,2719,2019-1-24,
Former Facebook employees forcefully join the chorus against Mark Zuckerberg,39695,0.91,gwbz0t,https://www.theverge.com/2020/6/3/21279671/facebook-former-employees-mark-zuckerberg-letter-trump,1042,2020-6-4,
AT&T CEO interrupted by a robocall during a live interview,39694,0.95,b3h2pf,https://www.theverge.com/2019/3/20/18274519/att-ceo-robocall-randall-stephenson-live-interview-fcc-ajit-pai,1408,2019-3-21,
HP is shipping audio drivers with a built-in keylogger,39693,0.88,6ajiyk,https://thenextweb.com/insider/2017/05/11/hp-is-shipping-audio-drivers-with-a-built-in-keylogger/,2067,2017-5-11,
Uninstalling Facebook app saves up to 20% of Android battery life,39663,0.94,43o3lf,http://gu.com/p/4g8ab?CMP=Share_AndroidApp_reddit_is_fun,3321,2016-2-1,
California court says Apple must pay retail workers for time spent waiting on bag searches,39571,0.95,f3yjm0,https://9to5mac.com/2020/02/13/apple-retail-bag-search-ruling/,1942,2020-2-15,
Twitter is bringing its ‘read before you retweet’ prompt to all users,39498,0.93,izi8t2,https://www.theverge.com/2020/9/25/21455635/twitter-read-before-you-tweet-article-prompt-rolling-out-globally-soon,954,2020-9-25,
AT&T just got hit with a $100 million fine after slowing down its ‘unlimited’ data,39433,0.95,3a6dko,http://www.washingtonpost.com/blogs/the-switch/wp/2015/06/17/att-just-got-hit-with-a-100-million-fine-after-slowing-down-its-unlimited-data/,2147,2015-6-18,
"Why China's Race For AI Dominance Depends On Math | Forget about “AI” itself: it’s all about the math, and America is failing to train enough citizens in the right kinds of mathematics to remain dominant.",39414,0.9,hlttg0,https://nationalinterest.org/feature/why-chinas-race-ai-dominance-depends-math-163809,2250,2020-7-6,
Why Wikipedia Decided to Stop Calling Fox a ‘Reliable’ Source | The move offered a new model for moderation. Maybe other platforms will take note.,39362,0.81,i81vck,https://www.wired.com/story/why-wikipedia-decided-to-stop-calling-fox-a-reliable-source/,2250,2020-8-12,
FCC should produce logs to prove ‘multiple DDoS attacks’ stopped net neutrality comments,39314,0.9,6a632m,http://www.networkworld.com/article/3195466/security/fcc-should-produce-logs-to-prove-multiple-ddos-attacks-stopped-net-neutrality-comments.html,1121,2017-5-9,
"Woman wins $10,000 judgment against Microsoft for forced Windows 10 upgrade",39317,0.87,4q37nn,http://www.extremetech.com/computing/230794-woman-wins-10000-judgment-against-microsoft-for-forced-windows-10-upgrade,3533,2016-6-27,
WordPress developer said Apple wouldn't allow updates to the free app until it added in-app purchases — letting Apple collect a 30% cut,39213,0.93,ieeaxm,https://www.businessinsider.com/apple-pressures-wordpress-add-in-app-purchases-30-percent-fee-2020-8,3015,2020-8-22,
Facebook removed from S&P list of ethical companies after data scandals,39184,0.95,c38kvj,https://www.telegraph.co.uk/technology/2019/06/13/facebook-gets-boot-sp-500-ethical-index/,1255,2019-6-21,
"Bell and other companys are working together to try and censor the internet in Canada, here's a link to were you can find more info on what's happening and how you can help stop them",39165,0.91,80a4dm,https://unfairplay.ca/,975,2018-2-26,
Google tracked his bike ride past a burglarized home. That made him a suspect.,39118,0.94,fev85o,https://www.nbcnews.com/news/us-news/google-tracked-his-bike-ride-past-burglarized-home-made-him-n1151761,2191,2020-3-7,
"Without Net Neutrality, Is It Time To Build Your Own Internet? Here's what you need to know about mesh networking.",39092,0.84,7lq76b,https://www.inverse.com/article/39507-mesh-networks-net-neutrality-fcc,1616,2017-12-24,
"Google says European politicians and government officials have used the ""right to be forgotten"" to delete 34000 articles about themselves from search results in Europe",39071,0.87,8mir22,http://fortune.com/2018/02/28/google-right-to-be-forgotten-europe-reasons-eu/,1902,2018-5-28,
"Elon Musk Beats Out Mark Zuckerburg, Steve Jobs As The Most Admired Tech Leader",39068,0.85,5g44hb,http://www.gospelherald.com/articles/68478/20161202/elon-musk-beats-out-mark-zuckerburg-steve-jobs-as-the-most-admired-tech-leader.htm,1950,2016-12-3,
"Pokémon Go loses its luster, sheds more than 10 million users. Engagement, downloads, and time spent in the app are fading fast.",39065,0.84,4z6fx3,http://arstechnica.com/gaming/2016/08/pokemon-go-sheds-more-than-10m-users/,5796,2016-8-23,
US offers $10 million bounty on hackers meddling in the presidential election,39046,0.9,i4qjjp,https://www.businessinsider.com/us-10-million-bounty-hackers-meddling-presidential-election-2020-8,2035,2020-8-6,
Reddit Is Now The 4th Most Popular Site In The US,39029,0.81,6jht97,http://www.alexa.com/topsites/countries/US,2403,2017-6-26,
"Comcast, AT&T Are Paying Minority Groups To Support Killing Net Neutrality",39029,0.89,5u7tm1,https://www.techdirt.com/blog/netneutrality/articles/20170213/14460536703/comcast-att-are-paying-minority-groups-to-support-killing-net-neutrality.shtml,2024,2017-2-15,
Congress introduces bipartisan legislation to permanently end the NSA’s mass surveillance of phone records,39029,0.95,b6zdnd,https://www.fightforthefuture.org/news/2019-03-29-congress-introduces-bipartisan-legislation-to/,877,2019-3-30,
2 students accused of jamming school's Wi-Fi network to avoid tests,39000,0.94,bajmq0,http://www.wbrz.com/news/2-students-accused-of-jamming-school-s-wi-fi-network-to-avoid-tests/,2030,2019-4-8,
"Trump Quietly Nominates Mass Surveillance Advocate To ""Protect"" Your Privacy Rights",38962,0.8,6y47l7,http://theantimedia.org/trump-mass-surveillance-privacy/amp/,2141,2017-9-5,
Trump pulls out of TPP trade deal,38946,0.86,5pq6h4,http://www.bbc.com/news/world-us-canada-38721056,5621,2017-1-24,
California Becomes 20th State to Introduce Right to Repair This Year,38813,0.95,b2ofhc,https://ifixit.org/blog/14429/california-right-to-repair-in-2019/,1100,2019-3-19,
"Will Ajit Pai's FCC Probe into Hawaii False Alarm Expose Role Telecom Giants Played in Blocking Emergency System Upgrades? '...it was telecom giants, including his former employer Verizon, that played a specific and outsized role in preventing the implementation of several key safeguards.'",38702,0.84,7qsux0,https://www.commondreams.org/news/2018/01/15/will-ajit-pais-fcc-probe-hawaii-false-alarm-expose-role-telecom-giants-played,854,2018-1-16,
"Seven cybersecurity members resign from Trump's advisory panel citing ""insufficient attention to the growing threats""",38686,0.79,6whho2,http://fortune.com/2017/08/26/trump-cybersecurity-advisors-resign/,2100,2017-8-28,
"Facebook is a global threat to public health, Avaaz report says. ""Superspreaders"" of health misinformation have no barriers to going viral on the social media giant",38690,0.91,idkwot,https://www.salon.com/2020/08/20/facebook-is-a-global-threat-to-public-health-avaaz-report-says/,1317,2020-8-21,
"Electronic patient records systems used by thousands of doctors were programmed to automatically suggest opioids at treatment, thanks to a secret deal between the software maker and a drug company",38655,0.97,evt5vz,https://www.bloomberg.com/news/articles/2020-01-29/health-records-company-pushed-opioids-to-doctors-in-secret-deal,1325,2020-1-30,
Comcast's attempt to bash Google Fiber on Facebook backfires hilariously as its own customers respond by hammering it with complaints,38653,0.92,3r7fu3,http://bgr.com/2015/11/02/comcast-vs-google-fiber-facebook-post/,2755,2015-11-2,
"People Aren’t Cancelling Netflix Because of Price Increases, They’re Cancelling Because the Library is Shrinking",38630,0.83,4u32tb,http://exstreamist.com/people-arent-cancelling-netflix-because-of-price-increases-theyre-cancelling-because-the-library-is-shrinking/,4900,2016-7-22,
Roger Stone Bought Hundreds of Fake Facebook Accounts to Promote His WikiLeaks Narrative,38615,0.88,gai7es,https://gizmodo.com/roger-stone-bought-hundreds-of-fake-facebook-accounts-t-1843161716,1301,2020-4-30,
Telecom's Latest Dumb Claim: The Internet Only Works During A Pandemic Because We Killed Net Neutrality,38586,0.92,g5g0i0,https://www.techdirt.com/articles/20200420/08133144330/telecoms-latest-dumb-claim-internet-only-works-during-pandemic-because-we-killed-net-neutrality.shtml,1363,2020-4-21,
"Guy Sucks At Photoshop, Spends 10 Years Mastering Microsoft Paint To Illustrate His Book",38566,0.85,6axnqn,http://www.boredpanda.com/microsoft-paint-ebook-illustrations-camp-redblood-pat-hines/,1598,2017-5-13,
Apple Reportedly Seeking to Move Significantly More Production From China to India,38570,0.93,ghm7xd,https://www.macrumors.com/2020/05/11/apple-moving-more-production-china-to-india/,2784,2020-5-11,
Tim Berners-Lee is trying to fix the web he invented with startup trying to let you control your data,38530,0.92,jqys6f,https://www.cnet.com/news/tim-berners-lee-startup-launches-privacy-focused-service-to-secure-your-data/,731,2020-11-9,
It's official. Humans are going to Mars. NASA has unveiled their plan.,38340,0.74,68is68,https://futurism.com/its-official-humans-are-going-to-mars-nasa-has-unveiled-their-mission/,2233,2017-5-1,
"Unhappy Customer: Comcast told my employer about my complaint, got me fired",38270,0.88,2ihy3x,http://consumerist.com/2014/10/06/unhappy-customer-comcast-told-my-employer-about-complaint-got-me-fired/,2766,2014-10-7,
Trump Cybersecurity Advisers Resign In ‘Moral’ Protest,38242,0.76,6w51pi,http://www.defenseone.com/politics/2017/08/trump-cybersecurity-advisers-resign-moral-protest/140535/,3457,2017-8-26,
1TB microSD cards are now a thing,38147,0.93,aujogu,https://www.theverge.com/circuitbreaker/2019/2/25/18239433/1tb-microsd-card-sandisk-micron-price-release,2063,2019-2-25,
