title,score,upv_ratio,id,url,comms_num,created,body
"Cops put GPS tracker on man’s car, charge him with theft for removing it",31777,0.95,dy9trg,https://arstechnica.com/tech-policy/2019/11/man-charged-with-theft-for-removing-police-gps-tracker-from-his-car/,1655,2019-11-19,
Mark Zuckerberg has been holding off-the-record dinners with influential conservatives including Tucker Carlson and Lindsey Graham,31728,0.87,dhuow7,https://www.businessinsider.com/mark-zuckerberg-holding-private-dinners-with-conservatives-2019-10,2221,2019-10-15,
FBI Director James Comey says 'absolute privacy' does not exist in the US,31707,0.89,5ybkpc,http://www.independent.co.uk/news/world/americas/fbi-director-james-comey-no-absolute-privacy-a7619621.html,2053,2017-3-9,
Facebook was repeatedly warned of security flaw that led to biggest data breach in its history - Exclusive: Employees described feeling remorse and 'guilt' that they 'could have prevented' the cyber attack that affected 29 million people,31658,0.94,f4sja8,https://www.telegraph.co.uk/technology/2020/02/09/facebook-repeatedly-warned-security-flaw-led-biggest-data-breach/,949,2020-2-16,
AVG anti virus just updated there privacy policy. it says that they can and will sell your browsing history to 3rd parties.,31638,0.9,3la3iz,https://np.reddit.com/r/privacy/comments/3l4apg/avg_anti_virus_just_updated_there_privacy_policy/,2648,2015-9-17,
When Will We Stop Screwing Poor and Rural Americans on Broadband?,31633,0.87,ehmy7q,https://washingtonmonthly.com/2019/12/30/when-will-we-stop-screwing-poor-and-rural-americans-on-broadband/,2816,2019-12-30,
Motorola Becomes First Smartphone Company to Sell DIY Repair Kits to Its Customers,31619,0.95,9qqrvn,https://motherboard.vice.com/en_us/article/bj4ez3/motorola-becomes-first-smartphone-company-to-sell-diy-repair-kits-to-its-customers,896,2018-10-24,
Facebook Groups Are Destroying America,31446,0.91,hawcjn,https://www.wired.com/story/facebook-groups-are-destroying-america/,2110,2020-6-18,
DEA tracked every opioid pill sold in the US. The data is out—and it’s horrific,31444,0.94,celwc1,https://arstechnica.com/science/2019/07/76-billion-opioid-pills-in-7-years-how-pharma-companies-drowned-us-in-drugs/,2825,2019-7-18,
Ajit Pai seems really upset about the California net neutrality bill that passed with bipartisan support,31446,0.9,9g41wq,https://www.fightforthefuture.org/news/2018-09-15-ajit-pai-seems-really-upset-about-the-california/,1186,2018-9-16,
"Mark Zuckerberg leveraged Facebook user data to fight rivals and help friends, leaked documents show",31415,0.93,bdsy1x,https://www.nbcnews.com/tech/social-media/mark-zuckerberg-leveraged-facebook-user-data-fight-rivals-help-friends-n994706,1329,2019-4-16,
"Unless congress stops it, the FBI wants to mass-hack computers, especially targeting Tor and Bitcoin users",31396,0.9,4zw6gj,https://news.bitcoin.com/update-bitcoiners-use-tor-warned/,2023,2016-8-28,
Malware found in Chinese tax software used by Australian businesses,31388,0.95,hv21i7,https://ia.acs.org.au/content/ia/article/2020/malware-found-in-chinese-tax-software.html?ref=newsletter,1167,2020-7-21,
"Robots should be fitted with an “ethical black box” to keep track of their decisions and enable them to explain their actions when accidents happen, researchers say.",31368,0.86,6o8r0z,https://www.theguardian.com/science/2017/jul/19/give-robots-an-ethical-black-box-to-track-and-explain-decisions-say-scientists?CMP=twt_a-science_b-gdnscience,1536,2017-7-19,
"DARPA Is Building a $10 Million, Open Source, Secure Voting System",31370,0.93,clgek9,https://www.vice.com/en_us/article/yw84q7/darpa-is-building-a-dollar10-million-open-source-secure-voting-system,2314,2019-8-3,
Huawei ousted from heart of EU as Nokia wins Belgian 5G contracts,31366,0.94,j7wm4u,https://uk.reuters.com/article/us-orange-nokia-security-5g/huawei-ousted-from-heart-of-eu-as-nokia-wins-belgian-5g-contracts-idUKKBN26U0YY,1482,2020-10-9,
"Hey, Just A Silly Thought: Maybe It's Time We Stop Letting Comcast And AT&T Write State Telecom Law?",31341,0.87,2tvgxt,https://www.techdirt.com/blog/netneutrality/articles/20150123/05191129787/hey-just-silly-thought-maybe-its-time-we-stop-letting-comcast-att-write-state-telecom-law.shtml,1188,2015-1-28,
Now Facebook is allowing anyone to look you up using your security phone number,31345,0.91,ax6cci,https://www.fastcompany.com/90314763/now-facebook-is-allowing-anyone-to-look-you-up-using-your-security-phone-number,1815,2019-3-4,
Ajit Pai touted false broadband data despite clear signs it wasn’t accurate,31234,0.95,immm3b,https://arstechnica.com/tech-policy/2020/09/ajit-pai-touted-false-broadband-data-despite-clear-signs-it-wasnt-accurate/,878,2020-9-5,
UPS will start using Toyota's zero-emission hydrogen semi trucks,31219,0.93,bgi9ow,https://www.cnet.com/roadshow/news/ups-toyota-project-portal-hydrogen-semi-trucks/,1344,2019-4-24,
Virginia is the first Southern state with a 100 percent carbon-free electricity goal,31216,0.93,fpaqir,http://www.hydrogenfuelnews.com/virginia-is-the-first-southern-state-with-a-100-percent-carbon-free-electricity-goal/8539593/,847,2020-3-26,
Five Republicans have opposed the FCC’s plan. We need to convince the rest of them.,31174,0.91,7jh6dp,https://medium.com/@jtabish/five-republicans-have-opposed-the-fccs-plan-we-need-to-tweet-the-rest-of-them-d7ade9df19bf,498,2017-12-13,
"Studies keep showing that the best way to stop piracy is to offer cheaper, better alternatives.",31171,0.94,av4r2a,https://motherboard.vice.com/en_us/article/3kg7pv/studies-keep-showing-that-the-best-way-to-stop-piracy-is-to-offer-cheaper-better-alternatives,1565,2019-2-27,
China 'launches an app that tells you if you are within 500 yards of someone in debt - and encourages you to report them if they seem capable of paying up',31156,0.89,aiyj5p,https://dailym.ai/2DstYb2,2067,2019-1-23,
"Congress Is Trying to Stop Ajit Pai from Taking Broadband Assistance Away from the Poor: ""The Lifeline program provides subsidized communications services to low-income Americans, many of whom rely on it as their only way to access the internet.""",31149,0.88,89qmbl,https://motherboard.vice.com/en_us/article/qvx3ep/whats-happening-with-lifeline-fcc-program,1514,2018-4-4,
Facebook closes in on $650 million settlement of a lawsuit claiming it illegally gathered biometric data,31125,0.96,id8vpm,https://www.businessinsider.com/facebook-wins-preliminary-approval-to-settle-facial-recognition-lawsuit-2020-8,929,2020-8-20,
Snowden warns: The surveillance states we’re creating now will outlast the coronavirus,31123,0.89,fp34ts,https://thenextweb.com/neural/2020/03/25/snowden-warns-the-surveillance-states-were-creating-now-will-outlast-the-coronavirus/,1157,2020-3-26,
"When it comes to political ads, it's time for Facebook and Google to be held to the same standards as ABC and CBS",31116,0.86,73jhqt,http://www.businessinsider.com/why-political-ads-should-be-regulated-online-2017-9?,1153,2017-10-1,
Google has slowed down YouTube on Firefox and Edge according to Mozilla exec,31114,0.75,92baxf,https://mybroadband.co.za/news/software/269659-google-has-slowed-down-youtube-on-firefox-and-edge-mozilla-exec.html,1593,2018-7-27,
KickassTorrents Brought Back to Life by Original Staffers,31094,0.92,5inc1b,https://torrentfreak.com/kickasstorrents-brought-back-to-life-by-original-staffers-161216/,1857,2016-12-16,
Facebook could face billion dollar fine for data breaches,31065,0.93,a69cu3,https://edition.cnn.com/2018/12/14/tech/facebook-billion-dollar-fine/index.html,905,2018-12-15,
NSA Inspector Who Criticized Snowden for Not Using 'Official' Channels Found Guilty of Retaliating Against Whistleblower Who Did Just That,30989,0.92,5iox6y,http://www.commondreams.org/news/2016/12/15/nsa-inspector-who-criticized-snowden-not-using-official-channels-found-guilty,667,2016-12-16,
The backlash that never happened: New data shows people actually increased their Facebook usage after the Cambridge Analytica scandal.,30980,0.84,8krbip,http://www.businessinsider.com/people-increased-facebook-usage-after-cambridge-analytica-scandal-2018-5,1924,2018-5-20,
"Tesla's price shock: Solar + battery as cheap as grid power -... ""The price per kWh stored and re-used has halved in less than a yea""",30937,0.87,5blwi0,http://reneweconomy.com.au/teslas-price-shock-solar-battery-as-cheap-as-grid-power-22265/,3143,2016-11-7,
"GOP leader accuses Twitter of censoring conservatives, finds out his user settings was hiding tweets",30901,0.78,98ok7f,https://www.salon.com/2018/08/19/gop-leader-accuses-twitter-of-censoring-conservatives-finds-out-his-user-settings-was-hiding-tweets/,2297,2018-8-20,
Airport police demanded activist’s passwords. He refused. Now faces prison in UK,30900,0.89,724vn1,https://theintercept.com/2017/09/23/police-schedule-7-uk-rabbani-gchq-passwords/,2697,2017-9-24,
Pirate bay founders acquitted in criminal copyright case,30873,0.92,3csq5d,https://torrentfreak.com/pirate-bay-founders-acquitted-in-criminal-copyright-case-150710/,1120,2015-7-10,
"As Hong Kong protesters switch to Telegram to protect identities, China launches massive cyber attack against it.",30825,0.96,c1fgoq,https://www.nbcnews.com/tech/mobile/chinese-cyberattack-hits-telegram-app-during-hong-kong-protest-n1017491,1453,2019-6-17,
Google wants to make wireless networks that will free you from AT&T and Verizon’s data caps,30813,0.94,2rjayl,http://bgr.com/2015/01/06/google-vs-verizon-att-wireless/,1781,2015-1-7,
Thousands of ships fitted with ‘cheat devices’ to divert poisonous pollution into sea,30795,0.95,db7rtw,https://www.independent.co.uk/environment/shipping-pollution-sea-open-loop-scrubber-carbon-dioxide-environment-a9123181.html,1157,2019-9-30,
Stop treating tech jerks like gods,30792,0.78,9c343o,https://nypost.com/2018/09/01/stop-treating-tech-jerks-like-gods/,2482,2018-9-1,
Republican tax plan kills electric vehicle credit,30784,0.82,7ajjah,https://arstechnica.com/?post_type=post&p=1198755,3857,2017-11-3,
Hong Kong Protestors Using Mesh Messaging App China Can't Block: Usage Up 3685% - [Forbes],30779,0.96,cz0sk1,https://www.forbes.com/sites/johnkoetsier/2019/09/02/hong-kong-protestors-using-mesh-messaging-app-china-cant-block-usage-up-3685/#7a8d82e1135a,793,2019-9-3,
North Korea accidentally leaks DNS for .kp: only 28 domains,30763,0.92,53mr05,https://github.com/mandatoryprogrammer/NorthKoreaDNSLeak,2234,2016-9-20,
"Reddit Admits Its Front Page Is Broken, Is Working on an Entirely New Algorithm",30750,0.9,3npc07,http://motherboard.vice.com/read/reddit-admits-its-front-page-is-broken-is-working-on-an-entirely-new-algorithm,2616,2015-10-6,
Facebook Cut Traffic To Leading Liberal Pages Just Before The Election,30730,0.82,jnj58m,https://www.buzzfeednews.com/article/craigsilverman/facebook-cut-traffic-liberal-pages-before-election,813,2020-11-4,
Reddit bans The_Donald forum as part of major hate speech purge,30715,0.82,hi3ukp,https://www.axios.com/reddit-bans-the_donald-forum-as-part-of-major-hate-speech-purge-fbc8a185-0f81-402a-8629-08bec50be4f9.html,3778,2020-6-30,
It's Official: Solar Is the Cheapest Electricity in History,30709,0.92,jg988w,https://www.popularmechanics.com/science/a34372005/solar-cheapest-energy-ever/,1486,2020-10-23,
HBO is now “seriously considering” whether to offer HBO Go without cable TV,30666,0.94,2g553d,http://qz.com/263950/hbo-is-now-seriously-considering-whether-to-offer-hbo-go-without-cable-tv/,1899,2014-9-12,
China banned 23 million people with poor social credit from transportation in 2018,30645,0.93,awb5dc,https://www.theverge.com/2019/3/1/18246297/china-transportation-people-banned-poor-social-credit-planes-trains-2018,2767,2019-3-2,
China’s first ‘fully homegrown’ web browser found to be Google Chrome clone,30643,0.93,9a5t6k,https://shanghai.ist/2018/08/16/chinas-first-fully-homegrown-web-browser-found-to-be-google-chrome-clone/,1965,2018-8-25,
All major U.S. carriers give your real-time location info to third parties,30621,0.94,8jhp3p,https://www.androidcentral.com/all-major-us-carriers-give-your-real-time-location-info-third-parties,1171,2018-5-15,
How Wikipedia volunteers became the web’s best weapon against misinformation,30614,0.86,ffn6id,https://www.fastcompany.com/90471667/how-wikipedia-volunteers-became-the-webs-best-weapon-against-misinformation,1298,2020-3-9,
AT&T more than doubles ‘admin fee’ for every wireless customer | Increase will net telecom giant $800 million a year,30602,0.94,8udtxm,https://www.theverge.com/2018/6/27/17511500/att-admin-fee-increase-wireless-bill-cover-costs,2149,2018-6-28,
Instagram ranked worst social network for young people's mental health,30585,0.91,8b0oem,https://www.telegraph.co.uk/news/2017/05/19/instagram-ranked-worst-social-network-young-peoples-mental-health/,1451,2018-4-10,
San Francisco proposal would ban government facial recognition use in the city,30555,0.93,al61e9,https://www.theverge.com/2019/1/29/18202602/san-francisco-facial-recognition-ban-proposal,539,2019-1-30,
"Trump Officials Tried To Rush Nuclear Technology To Saudis, House Panel Finds",30533,0.83,asenon,https://www.npr.org/2019/02/19/695954246/trump-officials-tried-to-rush-nuclear-technology-to-saudis-house-panel-finds,1815,2019-2-20,
Elon Musk confirms Russian hacking plot targeted Tesla factory,30516,0.93,ii4o12,https://www.zdnet.com/article/elon-musk-confirms-russian-hacking-plot-targeted-tesla-factory/,997,2020-8-28,
Investors argue against excessive pay package for Activision CEO,30514,0.95,gysah5,https://arstechnica.com/gaming/2020/06/shareholder-groups-say-activision-blizzard-ceo-bobby-kotick-is-overpaid/,1363,2020-6-8,
Netflix Now Allows You to Download Content for Offline Viewing,30496,0.84,5fptmh,http://www.streamingobserver.com/netflix-now-allows-download-programming/,1520,2016-11-30,
"Congress Introduces Bill to Ban Federal Agencies From Using Facial Recognition,The legislation would follow a handful of local governments that have already banned the use of the technology by police.",30488,0.95,hhvvia,https://www.vice.com/en_us/article/qj4jkx/congress-introduces-bill-to-ban-federal-agencies-from-using-facial-recognition,461,2020-6-29,
Court rejects FCC request to delay net neutrality case,30482,0.93,ah3ry9,https://thehill.com/policy/technology/425926-court-rejects-fcc-request-to-delay-net-neutrality-case,563,2019-1-18,
"No, Google, We Did Not Consent to This - The company knew about a privacy glitch and kept quiet. That has to stop.",30453,0.8,9nvxes,https://www.bloomberg.com/view/articles/2018-10-08/google-privacy-glitch-no-we-did-not-consent-to-this,708,2018-10-14,
1 in 5 companies say China stole their IP within the last year,30450,0.93,ckgisl,https://www.cnbc.com/2019/02/28/1-in-5-companies-say-china-stole-their-ip-within-the-last-year-cnbc.html?__source=sharebar|twitter&par=sharebar,1735,2019-8-1,
PornHub is crowdfunding $3.4M to shoot a sex tape in space,30449,0.72,39c979,http://venturebeat.com/2015/06/10/pornhub-is-crowdfunding-3-4m-to-explore-the-final-frontier/,2408,2015-6-11,
"US utilities seek sun as Trump sides with coal, fossil fuels | Solar growth is so extensive and has so much momentum behind it that we're at the point where you can't put the genie back in the bottle,"" said Jeffrey R.S. Brownson, a Pennsylvania State University professor who studies solar adoption",30430,0.8,5se9bv,http://customwire.ap.org/dynamic/stories/U/US_COMMUNITY_SOLAR_POWER?SITE=AP&SECTION=HOME&TEMPLATE=DEFAULT,1856,2017-2-6,
The TPP is the Most Brazen Corporate Power Grab in American History: It's worst than any of us feared,30435,0.84,3s0e64,http://www.alternet.org/economy/chris-hedges-tpp-most-brazen-corporate-power-grab-american-history,2052,2015-11-8,
"The FCC Has Fined Robocallers $208 Million. It’s Collected $6,790.",30413,0.97,dudaag,https://www.wsj.com/articles/the-fcc-has-fined-robocallers-208-million-its-collected-6-790-11553770803,734,2019-11-11,
"Study: U.S. adults who mostly rely on social media for news are less informed, exposed to more conspiracies",30409,0.93,i0rpcc,https://techcrunch.com/2020/07/30/study-u-s-adults-who-mostly-rely-on-social-media-for-news-are-less-informed-exposed-to-more-conspiracies/,1426,2020-7-31,
"There's A Blizzard Boycott Movement After A ""Hearthstone"" Player Was Suspended For Supporting Hong Kong Protesters",30385,0.95,dfnrl6,https://www.buzzfeednews.com/article/laurenstrapagiel/blizzard-boycott-hong-kong,971,2019-10-10,
"Germany Considers Fining Facebook $522,000 Per Fake News Item",30387,0.81,5kptng,http://heatst.com/tech/germany-considers-fining-facebook-522000-per-fake-news-item/,3255,2016-12-28,
Reddit brings down North Korea's entire internet after links to country's 28 websites are posted online,30360,0.83,53t5y6,http://www.mirror.co.uk/tech/reddit-brings-down-north-koreas-8881736,1444,2016-9-21,
"Please don’t take broadband away from poor people, Democrats tell FCC chair",30348,0.8,88cr8k,https://arstechnica.com/tech-policy/2018/03/please-dont-take-broadband-away-from-poor-people-democrats-tell-fcc-chair/,1875,2018-3-31,
Hacker says he'll livestream deletion of Zuckerberg's Facebook page,30352,0.92,9jm8b7,https://www.engadget.com/2018/09/28/zuckerberg-facebook-page-hacker-livestream/,1181,2018-9-28,
Revealed: Amazon told workers paid sick leave law doesn't cover warehouses,30334,0.94,gf4u7g,https://www.theguardian.com/technology/2020/may/07/amazon-warehouse-workers-coronavirus-time-off-california,1403,2020-5-7,
Google Fiber Scales Back TV Service To Focus Solely On High-Speed Internet,30323,0.91,7527do,https://hothardware.com/news/google-fiber-scales-back-tv-service-to-focus-solely-on-gigabit-internet,982,2017-10-8,
Poland has now officially filed a complaint against the European Union's 'upload filter',30268,0.95,bt6nqr,https://www.theverge.com/2019/5/25/18639963/poland-european-union-copyright-directive-filed-complaint-court-of-justice,1311,2019-5-26,
