title,score,upv_ratio,id,url,comms_num,created,body
These Fridges Won't Dispense Filtered Water Unless You Pay Extra for 'Official' Filters With RFID Chips,1473,0.98,etlok9,https://www.vice.com/en_us/article/akweaa/these-fridges-wont-dispense-filtered-water-unless-you-pay-extra-for-official-filters-with-rfid-chips,203,2020-1-25,
AT&T tells court: Customers can’t sue over sale of phone location data,1468,0.98,d7cjde,https://arstechnica.com/tech-policy/2019/09/att-tells-court-customers-cant-sue-over-sale-of-phone-location-data/,92,2019-9-22,
Wikipedia blames malicious ddos attack after site goes down across Europe and Middle East,1468,0.99,d18bfx,https://techcrunch.com/2019/09/07/wikipedia-blames-malicious-ddos-attack-after-site-goes-down-across-europe-middle-east/,61,2019-9-8,
Google Accidentally Shared Private Videos of Some Users With Others,1463,0.97,ez8oey,https://thehackernews.com/2020/02/google-photos-videos.html,108,2020-2-5,
Britain scraps algorithm for student exam grades after outcry over fairness,1459,0.98,ibmpop,https://www.euronews.com/2020/08/17/britain-scraps-algorithm-for-student-exam-grades-after-outcry-over-fairness,89,2020-8-18,
Netflix customers are being targeted by scammers through defraud emails,1457,0.98,dfxytj,https://www.screenbinge.com/blog/netflix-phishing-scams/,79,2019-10-10,
"China says Sweden should address its wrong decision on Huawei, ZTE",1458,0.95,jf8nr0,https://www.reuters.com/article/us-sweden-huawei-china/china-says-sweden-should-address-its-wrong-decision-on-huawei-zte-idUSKBN2760W1,253,2020-10-21,
Theranos founder Elizabeth Holmes will go on trial next summer,1451,0.98,c7h0g9,https://www.theverge.com/2019/6/30/20532321/theranos-founder-elizabeth-holmes-blood-testing-startup-trial-date-set-august-2020,156,2019-7-1,
MIT and NASA engineers demonstrate a new kind of airplane wing,1457,0.99,b835bq,http://news.mit.edu/2019/engineers-demonstrate-lighter-flexible-airplane-wing-0401,71,2019-4-1,
DHL Supply Chain has invested $300 million to modernize 60 percent of its warehouses in North America with the help of Artificial technology. This will reduce workflow interruptions in DHL and make logistics smoother.,1451,0.91,f7894k,https://www.alltheresearch.com/report/314/ai-in-logistics-and-supply-chain-ecosystem-market,173,2020-2-21,
Selling 911 location data is illegal—US carriers reportedly did it anyway,1438,0.98,aqkgxz,https://arstechnica.com/tech-policy/2019/02/att-t-mobile-sprint-reportedly-broke-us-law-by-selling-911-location-data/,35,2019-2-14,
"IBM confirms layoffs are happening, but won’t provide details",1437,0.98,gp46ku,https://techcrunch.com/2020/05/22/ibm-confirms-layoffs-are-happening-but-wont-provide-details/,84,2020-5-23,
Tesla owners are complaining that they were locked out of their cars and left 'stranded' after the app stopped working,1433,0.93,czh8uu,https://www.businessinsider.com/tesla-owners-left-stranded-app-down-for-maintenance-2019-9,238,2019-9-4,
AI can detect COVID-19 by listening to your coughs,1425,0.91,jm0e83,https://www.engadget.com/ai-covid-19-cough-detection-from-recordings-213858299.html,113,2020-11-1,
A Community-Run ISP Is the Highest Rated Broadband Company in America,1426,0.98,97ce90,https://motherboard.vice.com/en_us/article/ne5k5m/consumer-reports-broadband-company-ratings,59,2018-8-15,
Air Force to offer up a satellite to hackers at Defcon 2020,1425,0.99,d6fmid,https://nakedsecurity.sophos.com/2019/09/19/air-force-to-offer-up-a-satellite-to-hackers-at-defcon-2020/,72,2019-9-19,
Hacking Victims Seek Independent Audits of Facebook Data Security,1414,0.99,e3f9pu,https://www.courthousenews.com/hacking-victims-seek-independent-audits-of-facebook-data-security/,45,2019-11-29,
SpaceX Starlink internet-beaming satellite service takes next step for beta test,1409,0.98,hrosco,https://www.zdnet.com/article/spacex-starlink-internet-beaming-satellite-service-takes-next-step-for-beta-test/,83,2020-7-15,
US appeals court says California can set its own Low Carbon Fuel Standard,1411,0.98,aiz7yt,https://arstechnica.com/tech-policy/2019/01/us-appeals-court-says-california-can-set-its-own-low-carbon-fuel-standard/,55,2019-1-23,
"Tesla’s Autopilot Drives Better Than You, Statistically",1402,0.94,9lvwz1,https://gvwire.com/2018/10/06/teslas-autopilot-drives-better-than-you-statistically/,150,2018-10-6,
"Apple apologizes to WordPress, won’t force the free app to add purchases after all - The Verge",1403,0.98,iexb4t,https://www.theverge.com/2020/8/22/21397424/apple-wordpress-apology-iap-free-ios-app,80,2020-8-23,
Brace for controversy: Edward Snowden has written a memoir,1391,0.96,ckqnx4,https://arstechnica.com/tech-policy/2019/08/snowden-to-publish-memoir-on-his-crisis-of-conscience-leak-of-nsa-secrets/,155,2019-8-2,
BrainCo Prosthetic Hand Can Be Controlled Solely with Your Mind,1390,0.98,en07dc,https://interestingengineering.com/formidable-prosthetic-hand-can-be-controlled-solely-with-your-mind,101,2020-1-11,
US election: Twitter tightens rules on retweets and victory claims,1390,0.98,j874gu,https://www.bbc.com/news/technology-54485697,52,2020-10-10,
Researchers have created graphene amplifier which will unlock the elusive terahertz wavelengths and make revolutionary new technologies possible,1387,0.98,eyortk,https://phys.org/news/2020-02-graphene-amplifier-hidden-frequencies-electromagnetic.html,88,2020-2-4,
The UAE’s First Mars Mission Is a Robo-Meteorologist,1381,0.97,hm6gqo,https://www.wired.com/story/the-uaes-first-mars-mission-is-a-robo-meteorologist/,44,2020-7-6,
The Catholic Church and Pope Francis plan to fight back against AI,1375,0.9,fbda4z,http://pepsfeeder.com/the-catholic-church-and-pope-francis-plan-to-fight-back-against-ai/,230,2020-2-29,
U.S. and more than a dozen allies to condemn China for economic espionage,1378,0.98,a7yc70,https://www.washingtonpost.com/world/national-security/us-and-more-than-a-dozen-allies-to-condemn-china-for-economic-espionage/2018/12/20/cdfd0338-0455-11e9-b5df-5d3874f1ac36_story.html,103,2018-12-20,
Silicon Valley Pay Cuts Ignite Tech-Industry Covid-19 Tensions,1379,0.98,j9bj2v,https://www.wsj.com/articles/silicon-valley-pay-cuts-ignite-tech-industry-covid-19-tensions-11602435601?,209,2020-10-12,
North Korea Windows Hack Attack Confirmed As Microsoft Responds With Powerful Counterpunch,1377,0.97,ei8jzv,https://www.forbes.com/sites/daveywinder/2020/12/31/windows-hack-attack-confirmed-as-microsoft-responds-with-powerful-counterpunch/#306fcd527e01,69,2020-1-1,
Opera's Browser adds support for decentralized web by integrating .crypto domains.,1377,0.96,frr54x,https://www.coindesk.com/operas-android-web-browser-adds-access-to-crypto-domains-for-80m-users,125,2020-3-30,
Domino’s will start robot pizza deliveries in Houston this year,1362,0.97,c1p01w,https://arstechnica.com/cars/2019/06/dominoes-will-start-robot-pizza-deliveries-in-houston-this-year/,138,2019-6-17,
The first private mission to the Moon may launch Thursday night,1357,0.97,at41xo,https://arstechnica.com/science/2019/02/spacex-set-to-launch-israeli-private-mission-to-the-lunar-surface/,92,2019-2-21,
"Tesla announces $35,000 Model 3, is closing its stores to pay for it",1355,0.97,aw0251,https://arstechnica.com/cars/2019/02/tesla-announces-35000-model-3-is-closing-its-stores-to-pay-for-it/,190,2019-3-1,
Tesla mulls potential factory locations in Germany,1348,0.96,cvdm52,https://europe.autonews.com/automakers/tesla-mulls-potential-factory-locations-germany,106,2019-8-26,
Facebook’s Very Bad Month Just Got Worse,1349,0.97,a3njlw,https://www.newyorker.com/tech/annals-of-technology/facebooks-very-bad-month-just-got-worse,137,2018-12-6,
Reddit's r/technology goes offline for July 4 social media strike,1342,0.95,c937ti,https://www.cnet.com/news/reddits-rtechnology-goes-offline-for-july-4-social-media-strike/,61,2019-7-4,
Microsoft sees opportunity in old computers that still need to be upgraded from Windows 7,1342,0.96,fcvkxu,https://www.cnbc.com/2020/03/02/microsoft-cfo-hood-more-windows-7-opportunity-than-in-past-cycles.html,334,2020-3-3,
Apple loses more ground in smartphone market,1341,0.93,coki93,https://news.yahoo.com/apple-loses-more-ground-smartphone-market-211255070.html,330,2019-8-11,
Gmail is getting a massive redesign to work more like Slack,1338,0.97,htdm19,https://thenextweb.com/google/2020/07/16/gmail-is-getting-a-massive-redesign-to-work-more-like-slack/,178,2020-7-18,
"States reportedly plan monopoly investigation of Google, Facebook, Amazon",1341,0.99,ct7d7w,https://arstechnica.com/tech-policy/2019/08/states-reportedly-plan-monopoly-investigation-of-google-facebook-amazon/,68,2019-8-21,
A Decades-Old Computer Science Puzzle Was Solved in Two Pages,1337,0.98,clw77c,https://www.wired.com/story/a-decades-old-computer-science-puzzle-was-solved-in-two-pages/,57,2019-8-4,
Twitter admits hackers accessed DMs of dozens of high-profile accounts,1331,0.99,hwamf8,https://techcrunch.com/2020/07/22/twitter-admits-hackers-accessed-dms-of-dozens-of-high-profile-accounts/,57,2020-7-23,
French lawmakers approve 3% tax on online giants,1327,0.98,c9twae,https://www.apnews.com/fd16a5f8db154b48ab5de53c62617826,129,2019-7-6,
"Physics Nobel Laureate Charles K. Kao, the ""Father of Fibre Optics"", the ""Godfather of Broadband"" and the ""Father of Fiber Optic Communications"", Has Passed Away",1320,0.98,9idb64,https://www.scmp.com/news/hong-kong/education/article/2165405/nobel-prize-winner-and-hong-kong-native-charles-kao-dies-84,46,2018-9-24,
"Blizzard lost a big sponsor after the Hong Kong outcry: Mitsubishi - Blizzard lost the trust of its fans, and some money too",1314,0.97,dp411e,https://www.theverge.com/2019/10/29/20939236/blizzard-china-hong-kong-protests-mitsubishi-hearthstone-ban-sponsorship-pulled,55,2019-10-30,
Researchers have eliminated HIV in mice for the first time. Is a cure for humans next?,1312,0.98,c8y92g,https://www.usatoday.com/story/news/health/2019/07/02/researchers-cure-hiv-mice-first-time-breakthrough-study/1635072001/,72,2019-7-4,
GM plans to revive gas-guzzling Hummer as an electric truck and SUV,1312,0.97,enevwk,https://www.latimes.com/business/story/2020-01-10/electric-hummer,96,2020-1-12,
"It's time to terminate killer autonomous robots, UN told | Science & Tech News",1313,0.97,dlfl7f,https://news.sky.com/story/its-time-to-terminate-killer-autonomous-robots-un-told-11841696,92,2019-10-22,
Google Sued In Australia For Allegedly Misleading Consumers About Personal Data Usage,1305,0.99,hzab1a,https://www.rttnews.com/3114471/google-sued-in-australia-for-allegedly-misleading-consumers-about-personal-data-usage.aspx,10,2020-7-28,
State attorneys general to launch antitrust investigation into big tech companies,1314,0.98,csvw6r,https://techcrunch.com/2019/08/20/state-attorneys-general-to-launch-antitrust-investigation-into-big-tech-companies-reports-say/,54,2019-8-20,
New self-erasing chip could be used to detect counterfeit or tampered products,1304,0.97,j8o2a0,https://www.zdnet.com/article/new-self-erasing-chip-could-be-used-to-detect-counterfeit-or-tampered-products/,22,2020-10-11,
New Firefox service will generate unique email aliases to enter in online forms,1310,0.99,gbkyst,https://www.zdnet.com/article/new-firefox-service-will-generate-unique-email-aliases-to-enter-in-online-forms/,113,2020-5-2,
Victory: Pennsylvania Supreme Court Rules Police Can’t Force You to Tell Them Your Password,1302,0.99,dzroge,https://www.eff.org/deeplinks/2019/11/victory-pennsylvania-supreme-court-rules-police-cant-force-you-tell-them-your,42,2019-11-22,
Fitbit is reportedly planning to build ventilators to help treat COVID-19 patients,1298,0.96,gkty6o,https://www.theverge.com/2020/5/15/21260593/fitbit-emergency-ventilators-covid-19-james-park,83,2020-5-16,
Scientists have created a method for editing baby genes right in the womb,1294,0.94,fw7mzx,https://freenews.live/scientists-have-created-a-method-for-editing-baby-genes-right-in-the-womb/,198,2020-4-7,
Apps that allow you to take high interest loans disappear from Google Playstore,1295,0.98,dkw07i,https://www.ambalink.com/apps-that-allow-you-to-take-high-interest-loans-disappear-from-google-playstore/,77,2019-10-21,
Texas bill would ban throttling in disaster areas,1293,0.98,aosuw8,https://www.theverge.com/2019/2/9/18217608/texas-bill-hb-1426-throttle-verizon-att-net-neutrality-fcc-ajit-pai,33,2019-2-9,
"Feds avert Russian man’s $1 million plot to infect Nevada company’s network - The MO? If you can't hack a network, pay big money for an employee to infect it.",1292,0.99,ihm287,https://arstechnica.com/information-technology/2020/08/russian-man-offered-employee-1m-to-infect-company-network-feds-say/,58,2020-8-27,
Blizzard moves previously canceled Overwatch League games from China to Korea,1290,0.98,f5iufx,https://www.theverge.com/2020/2/14/21138432/blizzard-overwatch-league-games-china-korea-coronavirus-esports,40,2020-2-18,
TSMC plans to halt chip supplies to Huawei in 2 months,1285,0.97,hu29mj,https://asia.nikkei.com/Spotlight/Huawei-crackdown/TSMC-plans-to-halt-chip-supplies-to-Huawei-in-2-months,123,2020-7-19,
Cellphone monitoring is spreading with the coronavirus. So is an uneasy tolerance of surveillance.,1287,0.97,gd0yu7,https://www.msn.com/en-us/news/world/cellphone-monitoring-is-spreading-with-the-coronavirus-so-is-an-uneasy-tolerance-of-surveillance/ar-BB13waaL,132,2020-5-4,
Samsung's latest 8K TVs will include 4K over-the-air tuners - ATSC 3.0 will give you much sharper-looking free broadcasts.,1285,0.95,ekhiwc,https://www.engadget.com/2020/01/05/samsung-2020-8k-tv-atsc-3-tuners/,120,2020-1-6,
Facebook and Instagram boot close Trump ally Roger Stone for network of fake accounts,1282,0.98,hnuslt,https://techcrunch.com/2020/07/08/facebook-roger-stone-fake-account-network/,33,2020-7-9,
US government goes all in to expose new malware used by North Korean hackers,1275,0.98,f4dylb,https://arstechnica.com/tech-policy/2020/02/us-government-exposes-malware-used-in-north-korean-sponsored-hacking-ops/,66,2020-2-16,
911 emergency services go down across the US after CenturyLink outage,1283,0.98,aadfuj,https://techcrunch.com/2018/12/28/911-service-outage-centurylink/,117,2018-12-29,
Hubble captures cosmic fireworks in ultraviolet,1272,0.99,c8arm9,https://phys.org/news/2019-07-hubble-captures-cosmic-fireworks-ultraviolet.html,26,2019-7-2,
NASA hacked because of unauthorized Raspberry Pi connected to its network,1261,0.98,c3h193,https://www.zdnet.com/article/nasa-hacked-because-of-unauthorized-raspberry-pi-connected-to-its-network/,113,2019-6-22,
California reportedly launches antitrust investigation into Google,1260,0.99,holdj5,https://techcrunch.com/2020/07/09/california-reportedly-launches-antitrust-investigation-into-google/,39,2020-7-10,
The Planetary Society Deploys Solar Sail Spacecraft,1261,0.97,chobss,https://www.extremetech.com/extreme/295503-the-planetary-society-deploys-solar-sail-spacecraft,51,2019-7-25,
Firefox 66 to block automatically playing audible video and audio,1253,0.99,an3rxe,https://hacks.mozilla.org/2019/02/firefox-66-to-block-automatically-playing-audible-video-and-audio/,52,2019-2-5,
Apple rises as earnings and iPhone sales smash expectations,1252,0.93,evg3tl,https://www.cnbc.com/2020/01/28/apple-aapl-earnings-q1-2020.html,214,2020-1-29,
AT&T exempts HBO Max from data caps but still limits your Netflix use - AT&T-owned HBO Max gets special treatment on AT&T network.,1250,0.98,gvuy4n,https://arstechnica.com/tech-policy/2020/06/att-exempts-hbo-max-from-data-caps-but-still-limits-your-netflix-use/,65,2020-6-3,
"In the US, Support for Privacy Trumps Fear of Pandemic",1252,0.96,g786na,https://cybernews.com/privacy/report-among-americans-support-for-privacy-rights-trumps-fear-of-pandemic/,45,2020-4-24,
Employees say Google cut diversity programs to make conservatives happy,1251,0.89,gjiwjc,https://thenextweb.com/neural/2020/05/13/employees-say-google-cut-diversity-programs-to-make-conservatives-happy/,220,2020-5-14,
"NYC education department tells principals to stop using Zoom, citing privacy concerns",1250,0.97,fw428j,https://www.cnbc.com/2020/04/06/nyc-doe-tells-principals-to-switch-from-zoom-to-google-and-microsoft.html,60,2020-4-7,
Nigeria receives China-made armed reconnaissance drones,1253,0.97,jsim0x,https://www.globaltimes.cn/content/1206522.shtml,175,2020-11-12,
"Comcast incorrectly charged 2,000 customers for exceeding data cap - Comcast issues refunds after software bug caused inaccurate data-meter readings.",1242,0.99,dftegj,https://arstechnica.com/information-technology/2019/10/comcast-incorrectly-charged-2000-customers-for-exceeding-data-cap/,89,2019-10-10,
Hackers Using WAV Audio Files To Inject Malware and Cryptominers,1249,0.97,dj4h20,https://www.geeksgyaan.com/2019/10/wav-files-steganography.html,101,2019-10-17,
Carriers begin suspending internet data caps,1247,0.99,fhrhmg,https://www.cnet.com/news/carriers-begin-suspending-internet-data-caps-during-coronavirus/,85,2020-3-13,
Trump adds tarrifs to 550 billion of Chinese imports in trade war reprisal,1246,0.97,cupr1j,https://techcrunch.com/2019/08/23/trump-adds-tariffs-to-550-billion-of-chinese-imports-in-trade-war-reprisal/,251,2019-8-24,
"Brave web browser is hijacking links, and inserting affiliate codes",1240,0.96,gyc7ix,https://davidgerard.co.uk/blockchain/2020/06/06/the-brave-web-browser-is-hijacking-links-and-inserting-affiliate-codes/,145,2020-6-7,
Virginia’s ‘revenge porn’ laws now officially cover deepfakes,1243,0.98,c81yto,https://www.theverge.com/2019/7/1/20677800/virginia-revenge-porn-deepfakes-nonconsensual-photos-videos-ban-goes-into-effect,62,2019-7-2,
"US hits Iran with crippling cyberattacks, says a report",1235,0.97,c3vnit,https://www.cnet.com/news/us-hits-iran-with-crippling-cyberattack-says-a-report/,325,2019-6-23,
U.S. Calls On Social-Media Networks To Block Iranian Leader Accounts,1235,0.95,e0x9aq,https://www.rferl.org/a/us-urges-suspension-iranian-leaders-internet-social-media-accounts/30288947.html,140,2019-11-24,
Microsoft Admits That Windows 10 Update 1903 Knocks Out Wi-Fi,1232,0.98,d5nw2n,https://www.cbronline.com/news/windows-10-updated-1903,137,2019-9-18,
CRISPR Gene-Editing Tool: 1st Patient With Genetic Disorder Treated In U.S. : Shots,1228,0.99,cjmneh,https://www.npr.org/sections/health-shots/2019/07/29/744826505/sickle-cell-patient-reveals-why-she-is-volunteering-for-landmark-gene-editing-st,65,2019-7-30,
ISIS 'still evading detection on Facebook',1222,0.98,ht89ok,https://www.bbc.com/news/technology-53389657,66,2020-7-18,
Half of VPN Use Is for Accessing Geographically Restricted Movies and TV,1227,0.97,9bkjwc,https://www.pcmag.com/news/363422/half-of-vpn-use-is-for-accessing-restricted-movies-and-tv,104,2018-8-30,
Federal Judge in San Francisco Hears Motion to Block Trump’s Impending WeChat Ban,1223,0.94,iw6h6u,https://sanfrancisco.cbslocal.com/2020/09/19/hearing-federal-judge-wechat-motion/,41,2020-9-20,
Facebook ‘Unintentionally Uploaded’ 1.5 Million Users’ Contacts,1213,0.96,bejjug,https://www.inquisitr.com/5397913/facebook-unintentionally-uploaded-users-contacts/,67,2019-4-18,
TikTok to challenge U.S. order banning transactions with the video app,1210,0.93,iefq7y,https://www.reuters.com/article/us-usa-tiktok-trump-exclusive/exclusive-tiktok-to-challenge-u-s-order-banning-transactions-with-the-video-app-idUSKBN25H2QG,97,2020-8-22,
Justice Clarence Thomas regrets ruling that Ajit Pai used to kill net neutrality - Thomas says he was wrong in Brand X case that helped FCC deregulate broadband.,1213,0.96,f9x8hp,https://arstechnica.com/tech-policy/2020/02/clarence-thomas-regrets-ruling-that-ajit-pai-used-to-kill-net-neutrality/,60,2020-2-27,
Apple is suing its former lead chip designer for founding a startup,1211,0.94,e8uacc,https://insidetechworld.com/featured/nuvia-gerard-williams-sue-by-apple/,96,2019-12-11,
"Netflix-like pirate sites offered more video than the real Netflix, feds say",1215,0.97,cx1l5p,https://arstechnica.com/tech-policy/2019/08/jetflicks-offered-more-video-than-netflix-but-it-was-all-pirated-feds-say/,148,2019-8-29,
"While one Texas county shook off ransomware, small cities took full punch",1208,0.97,ctxehe,https://arstechnica.com/information-technology/2019/08/while-one-texas-county-shook-off-ransomware-small-cities-took-full-punch/,72,2019-8-22,
"CenturyLink still hasn’t met 2019 FCC deadline, now faces pandemic roadblocks",1207,0.98,geev9k,https://arstechnica.com/tech-policy/2020/05/centurylinks-slow-broadband-deployment-gets-even-slower-in-pandemic/,72,2020-5-6,
"Stolen NSA hacking tool now victimizing US cities, report says",1208,0.97,bt1jfd,https://www.cnet.com/news/stolen-nsa-hacking-tool-now-victimizing-us-cities-report-says/,70,2019-5-26,
Google to pay $1.1 billion in France following tax probe,1203,0.99,d3r1u9,https://www.engadget.com/2019/09/13/google-1-billion-fine-france/?guccounter=1&guce_referrer=aHR0cHM6Ly93d3cuZ29vZ2xlLmNvbS8&guce_referrer_sig=AQAAABnYDlaVocM4c9X-Ojr3aMcqjBwLBQ2gHowr8SSpPSO7loCObjXpaxKiUwnNbPkBp_og8i_jbhz10sLxJc-B1ZoCLvWTgXYS4o14yDClF5AziJDXtJgpXpDfK2nMRZDeQ_2s0ILgRGs-qaFERI487P8B_paj-U05wb1lGiDD9Z3t,32,2019-9-13,
"Twitter begins labelling ‘state-affiliated media’, including Chinese outlets",1194,0.99,i56xhs,https://www.scmp.com/news/world/united-states-canada/article/3096380/twitter-begin-labelling-state-affiliated-media,43,2020-8-7,
LightSail 2 mission declares success as it sets sail on sunlight,1188,0.98,cke3pp,https://www.cnet.com/news/lightsail-2-mission-declares-success-as-it-sets-sail-on-sunlight/,42,2019-8-1,
Tinder users still getting banned after showing support for Black Lives Matter,1186,0.95,hpbi2q,https://mashable.com/article/tinder-ban-black-lives-matter/,117,2020-7-11,
Cable industry fights plan to require robocall-detection technology,1183,0.98,cwgkh5,https://arstechnica.com/tech-policy/2019/08/cable-industry-fights-plan-to-require-robocall-detection-technology/,37,2019-8-28,
New DOJ Filing: TikTok's Owner Is 'A Mouthpiece' Of Chinese Communist Party,1185,0.96,j0hgfw,https://www.npr.org/2020/09/26/917134452/new-doj-filing-tiktoks-owner-is-a-mouthpiece-of-chinese-communist-party,91,2020-9-27,
Rice University engineers boost output of their solar desalination system by 50%,1180,0.98,c2hb2g,https://phys.org/news/2019-06-hot-efficiency-solar-desalination.html,22,2019-6-19,
"Mozilla launches its free, encrypted file-sharing service, Firefox Send",1183,0.98,b0j36r,https://techcrunch.com/2019/03/12/mozilla-launches-its-free-encrypted-file-sharing-service-firefox-send/,88,2019-3-13,
Company from Slovakia - KleinVision - developed Futuristic flying car 'AirCar' that can transform from a road vehicle into a plane in under 3 minutes,1182,0.98,jm6s2s,https://www.ndtv.com/offbeat/kleinvision-aircar-this-car-can-transform-into-an-airplane-watch-as-it-takes-flight-2317952,74,2020-11-2,
"Companies must let customers cancel subscriptions online, California law says",1174,0.99,8wux2k,https://www.cnet.com/news/companies-must-let-customers-cancel-subscriptions-online-california-law-says/,86,2018-7-8,
Large Redmond Collider: CERN reveals plan to shift from Microsoft to open-source code after tenfold license fee hike,1170,0.99,c0kupx,https://www.theregister.co.uk/2019/06/13/cern_microsoft/,106,2019-6-14,
Hacker group posts hundreds of law officer records,1169,0.97,bd810s,https://www.apnews.com/2ce455dee4f24ce3b3a0aa7f303a9d46,96,2019-4-15,
Tesla Model 3 Performance stealthily destroys Ford Mustang GT in drag race,1163,0.89,ad62p1,https://www.teslarati.com/tesla-model-3-performance-vs-ford-mustang-gt-drag-race/,99,2019-1-6,
Nintendo Switch is the fastest-selling console of the current generation — here's why Nintendo is dominating video games,1159,0.94,awumja,https://www.businessinsider.com/nintendo-winning-video-games-fastest-selling-console-2019-3,173,2019-3-3,
The fight over fuel economy rules is getting messy - Some in Congress want to investigate the Justice Department's investigators.,1153,0.98,d4xkf1,https://arstechnica.com/tech-policy/2019/09/the-fight-over-fuel-economy-rules-is-getting-messy/,41,2019-9-16,
Google pays $11 million to settle 227 age discrimination claims,1160,0.98,cggkol,https://arstechnica.com/tech-policy/2019/07/google-pays-11-million-to-settle-227-age-discrimination-claims/,154,2019-7-23,
Microsoft Office 365: Banned in German schools over privacy fears,1158,0.97,ccrd06,https://www.zdnet.com/article/microsoft-office-365-banned-in-german-schools-over-privacy-fears/,103,2019-7-14,
Facebook boss calls for rules on 'harmful content',1157,0.93,f4qjkg,https://www.bbc.com/news/technology-51518773,158,2020-2-16,
How a Decentralized Internet Can Power Latin America,1154,0.96,jjeg0d,https://www.coindesk.com/how-a-decentralized-internet-can-power-latin-americas-economy?,12,2020-10-28,
Facebook’s new chief lawyer helped write the Patriot Act,1156,0.97,bgdt4n,https://www.theverge.com/2019/4/22/18511633/facebook-general-counsel-patriot-act-jennifer-newstead,47,2019-4-23,
Apple hints at lower iPhone prices,1151,0.96,alencz,https://www.bbc.com/news/business-47047297,236,2019-1-31,
Elon Musk Claims Tesla Is Actually Building A Flying Car,1151,0.92,afvu27,https://www.esquire.com/uk/latest-news/a25885567/elon-musk-claims-tesla-is-actually-building-a-flying-car/,164,2019-1-14,
"SpaceX likely to win NASA’s crew competition by months, for billions less",1140,0.98,bb6wwy,https://arstechnica.com/science/2019/04/spacex-likely-to-win-nasas-crew-competition-by-months-for-billions-less/,66,2019-4-9,
Critical 'Sign in with Apple' Bug Could Have Let Attackers Hijack Anyone's Account,1139,0.96,gulkq9,https://thehackernews.com/2020/05/sign-in-with-apple-hacking.html,41,2020-6-1,
