title,score,upv_ratio,id,url,comms_num,created,body
"In order to avoid Comcast’s notorious “Unreturned Equipment” fees, I filmed myself properly returning all their equipment – I now owe $1320 in “Unreturned Equipment” and other fees.",53893,0.92,2dibwq,https://www.reddit.com/r/technology/comments/2dibwq/in_order_to_avoid_comcasts_notorious_unreturned/,5287,2014-8-14,"In order to preemptively avoid Comcast's notorious ""Unreturned Equipment"" fees, I recorded myself properly giving Comcast ALL of their equipment when I closed my account. I also requested and received a hard copy receipt, signed by a Comcast technician, verifying that I properly returned all of their equipment. Despite all that, I have been repeatedly billed for $360 in Unreturned Equipment fees. I have of course repeatedly and firmly disputed the fees but have not been able to get them removed.

Every single step of my Comcast Equipment Return process is well documented [HERE] (http://www.buzzfeed.com/dannfuria/definitive-proof-it-is-impossible-to-avoid-comcast-wji6) and includes yet another Comcast audio recording.

Comcast additionally slammed me with a $960 Termination Fee for closing my account.

Due to an enormity of issues with my Comcast account and customer service, I began thoroughly documenting and recording my interactions with Comcast back in January of 2014.  My Comcast story has gotten a little bit of coverage by Gawker and The Verge in the past three days.


**EDIT/UPDATE #1 – 8/17/14 (3.5 days after initial post)**
Dear Reddit.  You already know this but I’ll say it anyway - you are wonderful.  I feel very humbled by and sincerely grateful for your tremendous support.  I have paid close attention to your extraordinary and powerful commentary and I will continue to keep you informed of my story. Thank you again very much.

**EDIT/UPDATE #2** On 8/18/14 I posted a follow-up / update to this story [Here](http://www.reddit.com/r/technology/comments/2duzfi/comcasts_corporate_response_to_my_recent_reddit/) on Reddit.
"
"AT&T CEO pay rose to $32 million in 2019 while he cut 20,000 jobs",53864,0.91,fhm8ra,https://arstechnica.com/tech-policy/2020/03/att-ceo-pay-rose-to-32-million-in-2019-while-he-cut-20000-jobs/,2140,2020-3-13,
"I know you’re tired of hearing about net neutrality. I’m tired of writing about it. But the Senate is about to vote, and it’s time to pay attention",53859,0.74,8jmqn1,https://medium.com/@fightfortheftr/i-know-youre-tired-of-hearing-about-net-neutrality-ba2ef1c51939,1279,2018-5-16,
We posed as 100 Senators to run ads on Facebook. Facebook approved all of them.,53390,0.89,9sqwyh,https://news.vice.com/en_us/article/xw9n3q/we-posed-as-100-senators-to-run-ads-on-facebook-facebook-approved-all-of-them,1916,2018-10-31,
25 US Congress members urge President Donald Trump to follow India's lead and ban TikTok,53359,0.9,hskvad,https://www.livemint.com/news/world/25-us-congress-members-urge-president-donald-trump-to-follow-india-s-lead-and-ban-tiktok-11594882269517.html,2382,2020-7-17,
"FCC approves net neutrality rules, reclassifies broadband as a utility",53342,0.91,2x97c6,http://www.engadget.com/2015/02/26/fcc-net-neutrality/,2831,2015-2-27,
Are you aware? Comcast is injecting 400+ lines of JavaScript into web pages.,53324,0.91,7izns8,http://forums.xfinity.com/t5/Customer-Service/Are-you-aware-Comcast-is-injecting-400-lines-of-JavaScript-into/td-p/3009551,3525,2017-12-11,
"Oil Companies Are Collapsing, but Wind and Solar Energy Keep Growing",53200,0.88,fwlgim,https://www.nytimes.com/2020/04/07/business/energy-environment/coronavirus-renewable-energy.html,1592,2020-4-7,
Reddit CEO Pao Under Fire as Users Protest Removal of Executive,52761,0.83,3c7rvs,http://www.bloomberg.com/news/articles/2015-07-04/reddit-restores-most-of-site-after-moderator-led-blackouts,3398,2015-7-6,
Democrat Proposes Jail Time For Tech Companies Who Steal Your Data,52704,0.87,aookam,https://trofire.com/2019/02/08/democrat-proposes-jail-time-for-tech-companies-who-steal-your-data/,1193,2019-2-9,
Fancy That: Comcast's Network Holding Up Fine Without Usage Caps,52676,0.95,g946h2,https://www.techdirt.com/articles/20200420/06583844328/fancy-that-comcasts-network-holding-up-fine-without-usage-caps.shtml,1435,2020-4-28,
Leaked posts show Facebook employees asking the company to remove Trump’s threat of violence,52591,0.87,gt52qc,https://www.theverge.com/2020/5/29/21275044/facebook-trump-tweets-employee-reaction-criticism,2055,2020-5-30,
How Instagram closed my account and gave it to a football celebrity,52580,0.89,3dv3y0,https://medium.com/@ainiesta/how-instagram-closed-my-account-and-gave-it-to-a-football-celebrity-625a6a770eb3,2728,2015-7-20,
"With the recent Chinese company, Tencent, in the news about investing in Reddit, and possible censorship, it's amazing to me how so many people don't realize Reddit is already one of the most heavily censored websites on the internet.",52412,0.84,apu3oz,https://www.reddit.com/r/technology/comments/apu3oz/with_the_recent_chinese_company_tencent_in_the/,4550,2019-2-12,"I was looking through these recent /r/technology threads:

https://old.reddit.com/r/technology/comments/apcmtf/reddit_users_rally_against_chinese_censorship/

https://old.reddit.com/r/technology/comments/apgfu6/winnie_the_pooh_takes_over_reddit_due_to_chinese/

And it seems that there are a lot (probably most) of people completely clueless about the widespread censorship that already occurs on reddit. And in addition, they somehow think they'll be able to tell when censorship occurs! 


&#x200B;

I [wrote about this](https://old.reddit.com/r/undelete/comments/apig51/rtheoryofreddit_mods_remove_thread_and_all/) in a few different subs recently, which you can find in my submission history, but here are some main takeaways:

* Over the past 5+ years Reddit has gone from being the best site for extensive information sharing and lengthy discussion, to being one of the most censored sites on the internet, with many subs regularly secretly removing more than 40% of the content. With the Tencent investment it simply seems like censorship is officially a part of Reddit's business model. 

* A small amount of random people/mods who ""got there first"" control most of reddit. They are accountable to no one, and everyone is subject to the whims of their often capricious, self-serving, and abusive behavior. 


* Most of reddit is censored completely secretly. By default there is no notification or reason given when any content is removed. Mod teams have to make an effort to notify users and cite rules. Many/most mods do not bother with this. This can extend to bans as well, which can be done silently via automod configs. Modlogs are private by default and mod teams have to make an effort to make them public. 

* Reddit finally released the mod guidelines after years of complaints, but the admins do not enforce them. Many mods publicly boast about this fact. 

* The tools to see when censorship happens are ceddit.com, removeddit.com, revddit.com ([more info](https://old.reddit.com/r/technology/comments/apu3oz/with_the_recent_chinese_company_tencent_in_the/eq83p0a/)), and using ""open in new private window"" for all your comments and submissions. You simply replace the ""reddit.com/r/w.e"" in the address to ceddit.com/r/w.e""

/r/undelete tracks things that were removed from the front page, but most censorship occurs well before a post makes it to the front page. 

There are a number of /r/RedditAlternatives that are trying to address the issues with reddit. 

EDIT: Guess I should mention a few notables:

/r/HailCorporateAlt 

/r/shills

/r/RedditMinusMods

-

[Those irony icons](https://i.redd.it/c0dbx2p11h121.jpg)...

-

Also want to give a shoutout and thanks to the /r/technology mods for allowing this conversation. Most subs would have removed this, and above I linked to an example of just that."
"Verizon VP jokes at planting a 'brainwashed' FCC chairman, Ajit Pai says 'awesome'",52398,0.86,7imkxz,http://www.pcgamer.com/verizon-vp-jokes-at-planting-a-brainwashed-fcc-chairman-ajit-pai-says-awesome/,674,2017-12-9,
"FCC to seek total repeal of net neutrality rules, sources say",52346,0.91,7edm7k,https://www.politico.com/story/2017/11/20/net-neutrality-repeal-fcc-251824,2877,2017-11-21,
Twitter is considering warning users when politicians post misleading tweets: Leaked design plans reveal that the company is thinking about putting bright red and orange labels on false tweets by politicians and public figures.,52325,0.88,f75rph,https://www.vox.com/recode/2020/2/20/21146039/twitter-misleading-tweets-label-misinformation-social-media-2020-bernie-sanders,1163,2020-2-21,
Does the world really need a new iPhone every year?Apple and other tech firms have been criticized for deliberately making products with short life spans so consumers quickly find them obsolete and resort to buying the latest model.,52244,0.79,6zegb9,https://news.cgtn.com/news/7a49444d34557a6333566d54/share_p.html,7015,2017-9-11,
Apple is getting slammed by both Republicans and Democrats for pulling an app used by Hong Kong protesters to monitor police activity,52211,0.95,dg5h7e,https://www.businessinsider.com/apple-criticized-by-lawmakers-for-removing-hkmaplive-from-app-store-2019-10,1928,2019-10-11,
"Nearly 20 Million People Were Using Steam Today, Shattering Record.",52145,0.95,fjc382,https://www.ign.com/articles/steam-concurrent-user-player-record-coronavirus?sf119176844=1,1273,2020-3-16,
Say goodnight to net neutrality as AT&T just rolled out 'internet fast lanes',52069,0.86,8004x1,https://www.dailykos.com/stories/2018/2/23/1744321/-Say-goodnight-to-net-neutrality-as-AT-T-just-rolled-out-internet-fast-lanes,3448,2018-2-25,
Twitter says it will label misleading coronavirus tweets — even if they're from Trump,52068,0.85,ghxhs9,https://www.cnn.com/2020/05/11/tech/twitter-coronavirus-misinformation/index.html,2400,2020-5-12,
Apple agrees to $500 million settlement for throttling older iPhones.,51960,0.94,fcfci8,https://www.theverge.com/2020/3/2/21161271/apple-settlement-500-million-throttling-batterygate-class-action-lawsuit,2647,2020-3-3,
"Apple sues recycling partner for reselling more than 100,000 iPhones, iPads and Watches it was hired to dismantle",51833,0.94,j501ab,https://www.theverge.com/apple/2020/10/4/21499422/apple-sues-recycling-company-reselling-ipods-ipads-watches,2768,2020-10-4,
FCC Chairman Ajit Pai accused of cherry-picking data to repeal net neutrality,51755,0.91,747n3p,http://www.androidauthority.com/fcc-pai-cherry-picking-data-repeal-net-neutrality-803801/,1581,2017-10-4,
DoorDash Says It’s Very Sorry You Noticed Its Tip-Skimming Scheme,51746,0.95,ch9ay1,https://gizmodo.com/doordash-says-it-s-very-sorry-you-noticed-its-tip-skimm-1836652047,3216,2019-7-24,
US and UK have the slowest 5G speeds of 12 countries tested,51633,0.91,ijfbkz,https://9to5mac.com/2020/08/27/us-and-uk-have-the-slowest-5g-speeds-of-12-countries-tested/,2328,2020-8-31,
"A fired Facebook employee wrote a scathing 6,600-word memo detailing the company's failures to stop political manipulation around the world",51570,0.92,isvmus,https://www.businessinsider.com/facebook-fired-employee-memo-election-interference-9-2020,1439,2020-9-15,
A Florida Teen Shut Down Remote School With a DDoS Attack,51547,0.93,in1fwi,https://www.wired.com/story/florida-teen-ddos-school-amazon-labor-surveillance-security-news/,1949,2020-9-5,
"Mark Zuckerberg says TikTok is a threat to democracy, but didn't say he spent 6 months trying to buy its predecessor",51539,0.82,dvqegh,https://www.businessinsider.com/facebook-missed-out-on-buying-up-half-of-tiktok-and-now-it-says-its-a-threat-to-democracy-2019-11,2301,2019-11-13,
I salute the 1 million North Americans who ditched Facebook last quarter,51532,0.82,7usner,https://thenextweb.com/facebook/2018/02/01/i-salute-the-1-million-north-americans-who-ditched-facebook-last-quarter/,3088,2018-2-3,
Stop trying to kill the headphone jack,51518,0.8,6xnszo,https://thenextweb.com/gadgets/2017/08/31/stop-trying-to-kill-the-headphone-jack/#.tnw_gg3ed6Xc,7032,2017-9-3,
You Have a First Amendment Right to Record the Police,51382,0.94,gz6qlm,https://www.eff.org/deeplinks/2020/06/you-have-first-amendment-right-record-police,1201,2020-6-9,
TikTok confirms it will sue the Trump administration,51376,0.79,ieqs8k,https://www.theverge.com/2020/8/22/21397131/tiktok-lawsuit-president-trump-china-ban-executive-order,3003,2020-8-23,
I set up my Raspberry Pi to automatically tweet at Comcast Xfinity whenever my internet speeds drop significantly below what I pay for,51364,0.92,43fi39,https://www.reddit.com/r/technology/comments/43fi39/i_set_up_my_raspberry_pi_to_automatically_tweet/,3008,2016-1-31,"https://twitter.com/a_comcast_user

I pay for 150mbps down and 10mbps up. The raspberry pi runs a series of speedtests every hour and stores the data. Whenever the downspeed is below 50mbps the Pi uses a twitter API to send an automatic tweet to Comcast listing the speeds. 

I know some people might say I should not be complaining about 50mpbs down, but when they advertise 150 and I get 10-30 I am unsatisfied. I am aware that the Pi that I have is limited to ~100mbps on its Ethernet port (but seems to top out at 90) so when I get 90 I assume it is also higher and possibly up to 150.

Comcast has noticed and every time I tweet they will reply asking for my account number and address...usually hours after the speeds have returned to normal values. I have chosen not to provide them my account or address because I do not want to singled out as a customer; all their customers deserve the speeds they advertise, not just the ones who are able to call them out on their BS.

The Pi also runs a website server local to our network where with a graphing library I can [see the speeds over different periods of time](http://i.imgur.com/qdnnLzg.png).



EDIT: A lot of folks have pointed out that the results are possibly skewed by our own network usage. We do not torrent in our house; we use the network to mainly stream TV services and play PC and Xbone live games. I set the speedtest and graph portion of this up (without the tweeting part) earlier last year when the service was so constatly bad that Netflix wouldn't go above 480p and I would have >500ms latencies in CSGO. I service was constantly below 10mbps down. I only added the Twitter portion of it recently and yes, admittedly the service has been better.

Plenty of the drops were during hours when we were not home or everyone was asleep, and I  am able to download steam games or stream Netflix at 1080p and still have the speedtest registers its near its maximum of ~90mbps down, so when we gets speeds on the order of 10mpbs down and we are not heavily using the internet we know the problem is not on our end.

EDIT 2: People asked for the source code. PLEASE USE THE CLEANED UP CODE BELOW. I am by no means some fancy programmer so there is no need to point out that my code is ugly or could be better. http://pastebin.com/WMEh802V 

EDIT 3: Please consider using the code some folks put together to improve on mine (people who actually program.) One example: https://github.com/james-atkinson/speedcomplainer"
Solar energy breakthrough creates electricity from invisible light | Discoveries could lead to next-generation solar cells that are cheaper and more efficient than current commercial panels,51357,0.92,humvps,https://www.independent.co.uk/life-style/gadgets-and-tech/news/sun-solar-energy-renewable-environment-a9628246.html,1306,2020-7-20,
"Feds Can't Force You To Unlock Your iPhone With Finger Or Face, Judge Rules",51144,0.94,afxkza,https://www.forbes.com/sites/thomasbrewster/2019/01/14/feds-cant-force-you-to-unlock-your-iphone-with-finger-or-face-judge-rules/,1425,2019-1-15,
"These 9 Senators proposed a bill to kill net neutrality called the ""Restoring Internet Freedom Act""",51117,0.89,68t1xl,https://www.privateinternetaccess.com/blog/2017/05/9-senators-proposed-bill-kill-net-neutrality-called-restoring-internet-freedom-act/,3686,2017-5-2,
NASA astronauts safely drop into sea after pioneering SpaceX mission to International Space Station,50950,0.95,i2hlc9,https://www.independent.co.uk/life-style/gadgets-and-tech/news/nasa-spacex-return-landing-tv-capsule-splashdown-a9650646.html,1095,2020-8-3,
WhatsApp stops processing police requests for Hong Kong users' data amid protests,50803,0.93,hm6cjb,https://www.independent.co.uk/life-style/gadgets-and-tech/news/hong-kong-whatsapp-data-privacy-protests-national-security-law-china-facebook-a9603661.html,954,2020-7-6,
"Amazon jacked up Prime Day prices, misleading consumers, says vendor. We had an agreement that the suggested price of the product would be $9.99. On Amazon Prime Day the product was listed at $15.42 and then exed it out to put '$9.99 for Amazon Prime Day.'",50752,0.89,6pgkd9,http://www.foxbusiness.com/features/2017/07/24/amazon-jacked-up-prime-day-prices-misleading-consumers-says-vendor.html,3140,2017-7-25,
"Supreme Court Says You Can't Ban People From The Internet, No Matter What They've Done",50668,0.92,6iio0g,https://www.techdirt.com/articles/20170620/10455137631/supreme-court-says-you-cant-ban-people-internet-no-matter-what-theyve-done.shtml,1901,2017-6-21,
First Republican lawmaker to publicly oppose the FCC’s radical net neutrality repeal,50517,0.89,7fat34,https://www.fightforthefuture.org/news/2017-11-24-breaking-first-republican-lawmaker-to-publicly/,902,2017-11-25,
"Netflix could lose almost a quarter of its subscribers if it started running ads, study shows",50376,0.92,c9hzpi,https://www.cnbc.com/2019/07/05/netflix-users-dont-want-ads-23percent-would-consider-canceling-report.html,3607,2019-7-6,
Columnists in the Wall Street Journal and TIME are publishing anti-Net Neutrality op-eds without disclosing that they're taking money from ISP's,49996,0.93,2m6r7h,http://www.dailydot.com/politics/anti-net-neutrality-op-eds-time-wall-street-journal/,2241,2014-11-13,
Nearly 30 US states see renewables generate more power than either coal or nuclear,49933,0.87,jm1xib,https://www.energylivenews.com/2020/10/30/nearly-30-us-states-see-renewables-generate-more-power-than-either-coal-or-nuclear/,2490,2020-11-1,
"Fox dowloaded a game clip from YouTube, used it in Family Guy and DCMA'd the original.",49793,0.92,4k86mu,https://torrentfreak.com/fox-stole-a-game-clip-used-it-in-family-guy-dmcad-the-original-160520/,2928,2016-5-20,
Boston votes to ban government use of facial recognition,49774,0.95,hfllcb,https://www.cnet.com/news/boston-votes-to-ban-government-use-of-facial-recognition/,781,2020-6-25,
A New Bill Wants Jail Time for Execs Who Hide Data Breaches,49715,0.94,7h58cv,https://www.wired.com/story/a-new-bill-wants-jail-time-for-execs-who-hide-data-breaches/,632,2017-12-3,
It Begins: Trump’s FCC Launches Attack on Net Neutrality Transparency Rules,49656,0.79,5w3whj,https://motherboard.vice.com/en_us/article/it-begins-trumps-fcc-launches-attack-on-net-neutrality-transparency-rules,3024,2017-2-25,
Last-Minute Push to Restore Net Neutrality Stymied by Democrats Flush With Telecom Cash.,49649,0.76,a5hk0m,https://gizmodo.com/last-minute-push-to-restore-net-neutrality-stymied-by-d-1831023390,3045,2018-12-12,
"Facebook repeatedly overruled fact checkers in favor of conservatives | Officials thought punishing conservatives would be a ""PR risk.""",49621,0.82,i5o08y,https://www.engadget.com/facebook-overruled-fact-checkers-to-protect-conservatives-220229959.html,1238,2020-8-8,
"Washington state to sue Comcast for $100M. A news release says the lawsuit accuses Comcast of ""engaging in a pattern of deceptive practices.""",49621,0.92,4vn52b,http://komonews.com/news/local/washington-state-to-sue-comcast-for-100m,1856,2016-8-1,
"SF imposes new tax on firms that pay CEOs 100X more than median workers — businesses can either pay tax, reduce top executive salary, or pay workers more",49600,0.91,jpb7up,https://arstechnica.com/tech-policy/2020/11/overpaid-executive-tax-in-sf-hits-firms-that-pay-ceos-100x-more-than-workers/,2197,2020-11-7,
80% Cut the Cord Because Cable TV is Simply Too Expensive,49526,0.89,6helpp,https://www.dslreports.com/shownews/80-Cut-the-Cord-Because-Cable-TV-is-Simply-Too-Expensive-139758,5316,2017-6-15,
TikTok to be banned from US app stores from. Sunday,49502,0.92,iv4fob,https://on.ft.com/3iIZTpM,5112,2020-9-18,
Reddit Users Rally Against Chinese Censorship After the Site Receives a $150 Million Reported Investment,49226,0.81,apcmtf,http://time.com/5526128/china-reddit-tencent-censorship/,2333,2019-2-11,
A sneaky attempt to end encryption is worming its way through Congress,49168,0.95,fhe39k,https://www.theverge.com/interface/2020/3/12/21174815/earn-it-act-encryption-killer-lindsay-graham-match-group,2345,2020-3-12,
GOP senator says she’ll vote to restore net neutrality rules,48949,0.85,7pavzc,https://arstechnica.com/tech-policy/2018/01/gop-senator-says-shell-vote-to-restore-net-neutrality-rules/,1415,2018-1-10,
The 2020 Election Will Be a War of Disinformation,48901,0.87,f12a6y,https://www.theatlantic.com/magazine/archive/2020/03/the-2020-disinformation-war/605530/,2903,2020-2-9,
Why is no one talking about Net Neutrality?,48877,0.83,7c5vt7,https://www.reddit.com/r/technology/comments/7c5vt7/why_is_no_one_talking_about_net_neutrality/,2106,2017-11-11,"No one seems to be coordinating any efforts we can do in response to net neutrality disappearing...  If your thinking we can hash it out after it happens, you might be incorrect.  I honestly am worried this time that they might actually be able to get this through and if we have no plans pending, well say goodbye I guess since ISPs will then have the right to censor information.  How can this honestly be falling so short of ANY call to action?"
Facebook Has Been a Disaster for the World: How much longer are we going to allow its platform to foment hatred and undermine democracy?,48620,0.84,ivcgct,https://www.nytimes.com/2020/09/18/opinion/facebook-democracy.html,2549,2020-9-19,
"Comcast announced it's spending $10 billion annually on infrastructure upgrades, which is the same amount it spent before net neutrality repeal.",48559,0.85,7nfg9e,https://motherboard.vice.com/en_us/article/zmqmkw/comcast-net-neutrality-investment-tax-cut,2214,2018-1-1,
"Sorry, Comcast: Voters say “yes” to city-run broadband in Colorado",48541,0.9,7bmwwf,https://arstechnica.com/tech-policy/2017/11/voters-reject-cable-lobby-misinformation-campaign-against-muni-broadband/,1694,2017-11-9,
Amazon bans incentivized reviews tied to free or discounted products,48507,0.93,55pkdi,https://techcrunch.com/2016/10/03/amazon-bans-incentivized-reviews-tied-to-free-or-discounted-products/,2090,2016-10-4,
Twitch Suspends Trump’s Account For Violating ‘Hateful Conduct’ Rules,48432,0.85,hif117,https://www.huffpost.com/entry/trump-twitch-channel-suspended-hateful-conduct_n_5efa6820c5b6ca970913c299,2652,2020-6-30,
Largest union federation in the US demands apology from Mark Zuckerberg over new software feature that would allow employers blacklist words like 'unionize' in chats,48347,0.92,h7x376,https://www.businessinsider.com/afl-cio-blasts-facebook-over-software-would-limit-union-drives-2020-6,1211,2020-6-13,
Ivanka Trump used a personal email account to send hundreds of emails about government business last year,48329,0.73,9ymq0z,https://www.washingtonpost.com/politics/ivanka-trump-used-a-personal-email-account-to-send-hundreds-of-emails-about-government-business-last-year/2018/11/19/6515d1e0-e7a1-11e8-a939-9469f1166f9d_story.html,2196,2018-11-20,
Gamestop Business License Suspended by Pennsylvania Governor Amidst Coronavirus Pandemic,48261,0.84,fmln3o,https://www.dualshockers.com/gamestop-closed-pennsylvania-coronavirus/,1541,2020-3-22,
FBI: Hackers stole source code from US government agencies and private companies,48173,0.92,jpv2f1,https://www.zdnet.com/article/fbi-hackers-stole-source-code-from-us-government-agencies-and-private-companies/,1070,2020-11-8,
"Verizon, instead of apologizing, we have a better idea --stop throttling",48154,0.9,9abtoj,https://www.usatoday.com/story/tech/2018/08/25/verizon-and-t-worst-offenders-throttling-but-we-have-some-solutions/1089132002/,1307,2018-8-26,
New Bill Would Stop States From Banning Broadband Competition,48105,0.91,7s6jxi,https://www.dslreports.com/shownews/New-Bill-Would-Stop-States-From-Banning-Broadband-Competition-141088,1150,2018-1-22,
Internet to remain free and fair in India: Govt approves Net Neutrality,48048,0.9,8xzij6,https://timesofindia.indiatimes.com/business/india-business/internet-to-remain-free-and-fair-in-india-govt-approves-net-neutrality/articleshow/64948838.cms?from=mdr,1436,2018-7-11,
"Facebook apologizes to users, businesses for Apple’s monstrous efforts to protect its customers' privacy",48044,0.91,ihlw91,https://www.theregister.com/2020/08/27/facebook_ios_ads/,2564,2020-8-27,
"Microsoft's 'teen girl' AI, Tay, turns into a Hitler-loving sex robot within 24 hours",47976,0.9,4brgvm,http://www.telegraph.co.uk/technology/2016/03/24/microsofts-teen-girl-ai-turns-into-a-hitler-loving-sex-robot-wit/,3838,2016-3-24,
Netflix Has Almost 4x as Many Streaming Subscribers as Comcast has Cable Subscribers,47917,0.81,6904d5,http://exstreamist.com/netflix-has-almost-4x-as-many-streaming-subscribers-as-comcast-has-cable-subscribers/,2576,2017-5-3,
"John Oliver fights robocalls… by robocalling Ajit Pai and the FCC - Pai has helped robocallers by failing to issue strict rules, Oliver argues.",47893,0.87,azxnnz,https://arstechnica.com/tech-policy/2019/03/john-oliver-fights-robocalls-by-robocalling-ajit-pai-and-the-fcc/,1940,2019-3-12,
