title,score,upv_ratio,id,url,comms_num,created,body
"Amazon VP Resigns, Calls Company ‘Chickenshit’ for Firing Protesting Workers",56841,0.94,gdd9d8,https://www.vice.com/en_us/article/z3bjpj/amazon-vp-tim-bray-resigns-calls-company-chickenshit-for-firing-protesting-workers,1775,2020-5-4,
Twitter hides Trump tweet attacking Supreme Court’s decision on Pennsylvania ballots,28838,0.89,jn69ys,https://techcrunch.com/2020/11/02/twitter-trump-pennsylvania-tweet-mail-in-voting-supreme-court/,1277,2020-11-3,
MIT Posts Free Plans Online for an Emergency Ventilator That Can Be Built for $100,20065,0.98,fqq5w2,https://scitechdaily.com/mit-posts-free-plans-online-for-an-emergency-ventilator-that-can-be-built-for-100/,440,2020-3-29,
"Elon Musk Delivers 1,000 Ventilators to California Hospitals to Treat COVID-19 Patients",16985,0.92,foigfx,https://interestingengineering.com/elon-musk-delivers-1000-ventilators-to-california-hospitals-to-treat-covid-19-patients?_source=newsletter&_campaign=JeMmXErgJ3gnE&_uid=ELe31LvRb6&_h=8dbd61de296e2550ced97fc2451e844130ee7e83&utm_source=newsletter&utm_medium=mailing&utm_campaign=Newsletter-24-03-2020,830,2020-3-25,
US election: Bannon Twitter account banned amid clampdown,14580,0.95,jp5kw5,https://www.bbc.co.uk/news/technology-54838977,856,2020-11-6,
Facebook Lands In $500 Billion Trouble For Collecting User Data Through Instagram,12968,0.94,i8zaf4,https://www.wittyscoop.com/facebook-lands-in-500-billion-trouble-for-collecting-user-data-through-instagram/,423,2020-8-13,
South Park creators have a new political satire series with some of the best AI-generated deepfakes on the internet yet,12935,0.96,jn7j56,https://www.theregister.com/2020/11/02/in_brief_ai/,417,2020-11-3,
"Man builds free ""Amazon for buying local"" e-commerce tool to boost local businesses",12861,0.97,jc3763,https://www.myballard.com/2020/08/21/ballard-man-builds-e-commerce-tool-to-boost-local-businesses/?fbclid=IwAR3yg0pJO67oWPEICofjlEYPE8vxzxOKGTyflF_9f47Z-qRBXsFoH-ujIWA,226,2020-10-16,
Supreme Court upholds law banning cellphone robocalls,12608,0.98,hmgzpp,https://www.usatoday.com/story/news/politics/2020/07/06/supreme-court-wont-allow-political-robocalls-cellphones/3209646001/,385,2020-7-7,
Mary Jackson: NASA to name its headquarters after its first black engineer.,11794,0.95,hj73lf,https://www.bbcnewsalerts.com/2020/07/marie-jackson-nasa-will-name-its.html,431,2020-7-1,
An Audit Slams Facebook as a Home for Misinformation and Hate,11515,0.95,homtdr,https://www.wired.com/story/audit-slams-facebook-home-misinformation-hate/#intcid=recommendations_wired-homepage-right-rail_5a574487-25be-4a47-a69e-b67fa0f5429c_popular4-1,437,2020-7-10,
Google faces $5 billion lawsuit for allegedly tracking users even in incognito mode,11362,0.99,jejkja,https://mazech.com/2020/06/google-faces-5-billion-lawsuit-for-allegedly-tracking-users-even-in-incognito-mode/,529,2020-10-20,
Microsoft takes down massive hacking operation that could have affected the election,11141,0.96,j9qgpb,https://www.cnn.com/2020/10/12/tech/microsoft-election-ransomware/index.html,339,2020-10-12,
"Reddit updates hate speech policy, bans subreddits including The_Donald",10799,0.88,hi5uaw,https://thehill.com/policy/technology/505053-reddit-updates-hate-speech-policy-bans-subreddits-including-thedonald,1289,2020-6-30,
"Uber and Lyft lose appeal, ordered again to classify drivers as employees",10198,0.98,jggxqw,https://www.theverge.com/2020/10/22/21529644/uber-lyft-lose-appeals-court-driver-employees,627,2020-10-23,
"Lidar helps uncover an ancient, kilometer-long Mayan structure",10004,0.98,gxzhxb,https://techcrunch.com/2020/06/05/lidar-helps-uncover-an-ancient-kilometer-long-mayan-structure/,274,2020-6-7,
Comcast’s president of tech falls offline while boasting about how great cable is for connectivity,9902,0.98,jb0zdx,https://www.theregister.com/2020/10/14/comcast_internet_interview_fail/,305,2020-10-14,
Facebook's advertiser boycott is getting even bigger,9653,0.97,hgomit,https://www.engadget.com/facebook-advertiser-boycott-honda-hershey-unilever-coca-cola-005146173.html,493,2020-6-27,
"Trump could be banned from Twitter after he leaves office, company's rules indicate",9536,0.96,joseca,https://www.independent.co.uk/life-style/gadgets-and-tech/trump-twitter-account-suspended-election-rules-b1620154.html,506,2020-11-6,
Homescapes and Gardenscapes ads banned as misleading,9369,0.98,ja96tc,https://www.bbc.co.uk/news/technology-54509970,326,2020-10-13,
Steve Bannon Caught Running a Network of Misinformation Pages on Facebook,9113,0.96,js0b35,https://gizmodo.com/steve-bannon-caught-running-a-network-of-misinformation-1845633004,287,2020-11-11,
NVIDIA Uses AI to Slash Bandwidth on Video Calls,8847,0.98,j740yb,https://petapixel.com/2020/10/06/nvidia-uses-ai-to-slash-bandwidth-on-video-calls/,341,2020-10-8,
Ten-Minute Coronavirus Test for $1 Could Be Game Changer,8841,0.98,fk007e,https://www.bloomberg.com/news/articles/2020-03-16/ten-minute-coronavirus-test-could-be-game-changer-for-africa,280,2020-3-17,
"Artificial intelligence that mimics the brain needs sleep just like humans, study reveals",8743,0.95,i16dgu,https://www.independent.co.uk/life-style/gadgets-and-tech/news/artificial-intelligence-human-sleep-ai-los-alamos-neural-network-a9554271.html,429,2020-7-31,
"Reddit announces it will not cut pay for workers who move away from San Francisco, New York",8716,0.96,jmkyyv,https://www.cnbc.com/2020/10/28/reddit-wont-cut-pay-for-workers-who-leave-san-francisco-new-york.html?forYou=true,336,2020-11-2,
"First Habitable-Zone, Earth-Sized Exoplanet Discovered With Planet-Hunter TESS",8587,0.98,jica6b,https://scitechdaily.com/first-habitable-zone-earth-sized-exoplanet-discovered-with-planet-hunter-tess/,381,2020-10-26,
"Three years later, Facebook says it will ban QAnon",8485,0.96,j6f8w6,https://www.cnn.com/2020/10/06/tech/facebook-qanon/index.html,443,2020-10-7,
Apple fined record $1.23 billion in France for price-fixing scheme,8397,0.97,fjn6ji,https://venturebeat.com/2020/03/16/apple-fined-record-1-23-billion-in-france-for-price-fixing-scheme/,772,2020-3-16,
Facebook will tell you when you're about to share old news,8293,0.96,hfxod2,https://www.engadget.com/facebook-old-news-notification-164559620.html,247,2020-6-26,
Second person cured of HIV is still free of active virus two years on,8290,0.99,fgs5mb,https://www.cnn.com/2020/03/10/health/hiv-treatment-cure-london-intl-scli-gbr/index.html,104,2020-3-11,
Twitter starts aggressively fact-checking tweets linking 5G to COVID-19,8276,0.97,gzmjw7,https://www.theverge.com/2020/6/9/21284940/twitter-5g-coronavirus-covid-19-fact-check-disinformation-conspiracy-theories-label,293,2020-6-9,
"No Longer in Shadows, Pentagon’s U.F.O. Unit Will Make Some Findings Public (Senate briefings on unidentified objects)",8157,0.97,hwo9oj,https://www.nytimes.com/2020/07/23/us/politics/pentagon-ufo-harry-reid-navy.html,772,2020-7-24,
Fired Amazon worker says termination was retaliation for speaking out,8029,0.94,g7tx9j,https://www.cnet.com/news/fired-amazon-worker-says-termination-was-retaliation-for-speaking-out/,355,2020-4-25,
Zoom Faces Class Action Lawsuit for Sharing Data with Facebook,7887,0.98,fs9552,https://www.vice.com/en_us/article/pke4vb/zoom-faces-class-action-lawsuit-for-sharing-data-with-facebook,224,2020-3-31,
CNN: Tesla stock tanks after Musk tweets price is 'too high'.,7880,0.96,gc472n,https://www.cnn.com/2020/05/01/investing/musk-stock-too-high-tweet/index.html,792,2020-5-2,
AT&T’s current 5G is slower than 4G in nearly every city tested by PCMag,7883,0.98,ipgoh3,https://arstechnica.com/information-technology/2020/09/atts-current-5g-is-slower-than-4g-in-nearly-every-city-tested-by-pcmag/,386,2020-9-9,
Microsoft Flight Simulator players are flying into Hurricane Laura,7835,0.97,ijurru,https://www.theverge.com/2020/8/27/21403769/hurricane-laura-microsoft-flight-simulator,409,2020-8-31,
Facebook will pay $52 million to content moderators who developed PTSD on the job,7725,0.96,gij5a5,https://www.independent.co.uk/news/world/americas/facebook-content-moderators-ptsd-mark-zuckerberg-comments-a9511206.html,424,2020-5-13,
Tesla's giant home battery is paying for itself much faster than expected,7671,0.97,ewaoz4,https://www.techradar.com/in/news/worlds-first-tesla-powerwall-is-paying-itself-off-much-faster-than-expected,272,2020-1-31,
Bacteria have been genetically engineered to eat carbon dioxide,7621,0.98,hvrgpw,https://www.snippetscience.com/bacteria-have-been-engineered-to-eat-carbon-dioxide,314,2020-7-22,
Pentagon officially releases UFO videos,7587,0.95,g9mvce,https://edition.cnn.com/2020/04/27/politics/pentagon-ufo-videos/index.html,985,2020-4-28,
Tesla’s seven-day return policy has been quietly removed - The ‘no questions asked’ return policy is no more,7496,0.97,jczp5h,https://www.theverge.com/2020/10/16/21520086/tesla-full-refund-seven-day-return-policy-removed,335,2020-10-18,
Stanford researchers devise treatment that relieved depression in 90% of participants in small study,7252,0.97,fwly20,http://med.stanford.edu/news/all-news/2020/04/stanford-researchers-devise-treatment-that-relieved-depression-i.html,568,2020-4-7,
Harley-Davidson is getting into the electric bicycle business,7179,0.97,jjjd9i,https://techcrunch.com/2020/10/27/harley-davidson-is-getting-into-the-electric-bicycle-business/,431,2020-10-28,
Trump’s TikTok and WeChat order wipes $75bn off China tech stocks,7102,0.97,i5b3uz,https://www.ft.com/content/fb91a9f0-ecfb-4bfd-824b-5d6225a109ef,788,2020-8-7,
Google sets unprecedented goal to tap only renewable power by 2030,7106,0.97,isj9af,https://www.reuters.com/article/us-alphabet-climatechange/google-sets-unprecedented-goal-to-tap-only-renewable-power-by-2030-idUSKBN2651EP,150,2020-9-14,
Amazon and Big Tech cozy up to Biden camp with cash and connections,7062,0.91,j3adri,https://www.reuters.com/article/usa-election-tech-idUSKBN26M5NB,371,2020-10-1,
Elon Musk’s Australian Battery Farm Has Saved $116 Million AUD In Two Years,6906,0.97,fenuh0,https://www.unilad.co.uk/technology/elon-musks-australian-battery-farm-has-saved-them-116000000-in-two-years/,185,2020-3-7,
"YouTube bans David Duke, Richard Spencer, and other white nationalist personalities",6877,0.96,him6j8,https://mashable.com/article/youtube-bans-richard-spencer-david-duke-stefan-molyneux-white-nationalists/,373,2020-6-30,
"Facebook, Google, Apple and Amazon bosses grilled over having 'too much power'",6801,0.97,i0kyyi,https://news.sky.com/story/facebook-google-apple-and-amazon-bosses-grilled-over-having-too-much-power-12038791,324,2020-7-30,
"Tesla produces its 1,000,000th electric car",6708,0.97,fgbcqh,https://electrek.co/2020/03/09/tesla-produces-1000000th-electric-car/,213,2020-3-10,
Google and Facebook under pressure to ban children's ads,6661,0.99,ivmx4f,https://www.bbc.com/news/technology-54205229,152,2020-9-19,
Scientists Create a Prototype 'Air Plasma' Engine That Works Without Fossil Fuels,6384,0.98,gf5w2t,https://www.sciencealert.com/scientists-have-created-a-fossil-fuel-free-jet-engine-prototype,372,2020-5-7,
Amazon workers reportedly plan nationwide protest tied to coronavirus,6382,0.95,g5ps0k,https://www.cnet.com/news/amazon-workers-reportedly-plan-nationwide-protest-over-coronavirus/,363,2020-4-22,
SpaceX launches its third rocket in two weeks,6268,0.98,h85mot,https://arstechnica.com/science/2020/06/spacex-to-fly-its-first-starlink-rideshare-mission-early-saturday/,269,2020-6-13,
Facebook Accused of Watching Instagram Users Through Cameras,6210,0.98,iuzgl2,https://www.bloomberg.com/news/articles/2020-09-18/facebook-accused-of-watching-instagram-users-through-cameras,393,2020-9-18,
Facebook to halt political ads after US election,6198,0.96,j7wpwv,https://www.bbc.co.uk/news/technology-54463150,558,2020-10-9,
"T-Mobile details its plan to give free internet to 10 million homes - It's committed $10.7 billion to closing the ""homework gap"" for low-income students.",6117,0.98,in4yza,https://www.engadget.com/t-mobile-reveals-its-plan-to-give-free-internet-to-10-million-homes-103521899.html,151,2020-9-6,
"Student loan company that stole millions from consumers leaks sensitive phone calls, SSNs, tax records",6052,0.98,gwgfhb,https://cybernews.com/security/student-loan-company-stole-millions-leaks-phone-calls-ssns-tax-records/,93,2020-6-4,
Tesla shows how it’s building ventilators with car parts,5992,0.95,fvpmqd,https://techcrunch.com/2020/04/05/tesla-shows-how-its-building-ventilators-with-car-parts/,178,2020-4-6,
Facebook 'danger to public health' warns report,5978,0.97,iclxw0,https://www.bbc.co.uk/news/technology-53820225,275,2020-8-19,
"Japan to join forces with U.S., Europe in regulating Big Tech firms",5951,0.99,jdy10r,https://cybernews.com/news/japan-to-join-forces-with-u-s-europe-in-regulating-big-tech-firms/,112,2020-10-19,
MIT’s deep learning found an antibiotic for a germ nothing else could kill,5953,0.98,fj52rz,https://www.zdnet.com/article/mits-deep-learning-found-an-antibiotic-for-a-germ-nothing-else-could-kill/,148,2020-3-16,
Elon Musk's company SpaceX applies to offer high-speed internet service to Canadians,5905,0.96,hcnujv,https://www.cbc.ca/news/business/spacex-high-speed-internet-1.5618918,349,2020-6-20,
The EU is about to announce new rules for Big Tech — and there’s not much they can do about it,5888,0.98,joiqyk,https://www.cnbc.com/2020/11/05/digital-services-act-how-the-eu-is-going-after-big-tech.html,198,2020-11-5,
Discovery of new T-cell raises prospect of ‘universal’ cancer therapy,5868,0.98,ervfb3,https://www.cardiff.ac.uk/news/view/1749599-discovery-of-new-t-cell-raises-prospect-of-universal-cancer-therapy,173,2020-1-21,
Wisconsin report confirms Foxconn’s “LCD factory” isn’t real,5857,0.98,jg08lv,https://www.theverge.com/2020/10/21/21526765/foxconn-lcd-factory-not-real-confirmation-wisconsin-report-exclusive,336,2020-10-22,
‘A huge step forward.’ Mutant enzyme could vastly improve recycling of plastic bottles,5829,0.97,fzze5x,https://www.sciencemag.org/news/2020/04/huge-step-forward-mutant-enzyme-could-vastly-improve-recycling-plastic-bottles,140,2020-4-13,
Elon Musk Confirms You'll Be Able to Personalize Tesla Cybertruck With Custom Wraps,5794,0.91,g23pn4,https://interestingengineering.com/elon-musk-confirms-youll-be-able-to-personalize-tesla-cybertruck-with-custom-wraps?_source=newsletter&_campaign=1nJVMbdMMDAL4&_uid=ELe31LvRb6&_h=8dbd61de296e2550ced97fc2451e844130ee7e83&utm_source=newsletter&utm_medium=mailing&utm_campaign=Newsletter-15-04-2020,295,2020-4-16,
NASA Planet Hunting Satellite TESS Finds Earth-Sized World in 'Goldilocks Zone',5764,0.99,elo84m,https://gadgets.ndtv.com/science/news/nasa-planet-hunting-satellite-tess-finds-earth-sized-world-in-goldilocks-zone-2160467,504,2020-1-8,
Elon Musk says Starship is now SpaceX’s top priority,5761,0.96,gz12eu,https://techcrunch.com/2020/06/08/elon-musk-says-starship-is-now-spacexs-top-priority/,402,2020-6-8,
"Concorde 2.0: Supersonic jet with 1,700mph top speed readied for unveiling",5642,0.97,hprrum,https://www.express.co.uk/news/science/1308388/concorde-supersonic-jet-1700mph-top-speed-xb1-prototype,563,2020-7-12,
Boeing 747s still get critical updates via floppy disks,5621,0.96,i7sx6v,https://www.theverge.com/2020/8/11/21363122/boeing-747s-floppy-disc-updates-critical-software,374,2020-8-11,
"A Long-Lost Legendary Roman Fruit Tree Has Been Grown From 2,000-Year-Old Seeds",5596,0.99,f0yod6,https://www.sciencealert.com/scientists-have-grown-date-palms-from-2-000-year-old-seeds,178,2020-2-9,
Blizzard bans esports player who voiced support of Hong Kong protests,5504,0.97,dfd8rn,https://www.businessinsider.com/blizzard-bans-esports-player-blitzchung-supporting-hong-kong-protests-interview-2019-10,326,2019-10-9,
"Bill Gates Refers to Facebook, Google, And Says They ‘Deserve Rude, Unfair, Tough questions’",5494,0.98,iezpeo,https://www.wittyscoop.com/bill-gates-refers-facebook-google-and-says-they-deserve-rude-unfair-tough-questions/,406,2020-8-23,
Scientists developed living robots made from frog embryo cells that could swim inside your body. The new life-forms were designed using a supercomputer,5473,0.96,eo9tnf,https://www.independent.co.uk/life-style/gadgets-and-tech/news/living-robots-xenobots-living-cells-frog-embryos-a9282251.html,424,2020-1-14,
U.S. tech stocks are now worth more than the entire European stock market,5465,0.98,iisfv0,https://www.cnbc.com/2020/08/28/us-tech-stocks-are-now-worth-more-than-the-entire-european-stock-market.html,531,2020-8-29,
Tesla (TSLA) secures massive order of Tesla Semi electric trucks from Walmart - Electrek,5461,0.98,j2y21t,https://electrek.co/2020/09/29/tesla-tsla-secures-order-tesla-semi-electric-trucks-walmart/?utm_source=morning_brew,293,2020-10-1,
Facebook removes posts linking Oregon wildfires to activist groups,5412,0.96,irux3f,https://www.reuters.com/article/us-usa-wildfires-facebook/facebook-removes-posts-linking-oregon-wildfires-to-activist-groups-idUSKBN264013,456,2020-9-13,
Jet suit paramedic 'could save lives',5392,0.97,j1yo2i,https://www.bbc.co.uk/news/uk-england-54331994,361,2020-9-29,
TikTok tries to remove widely shared suicide clip,5388,0.95,iottcv,https://www.bbc.co.uk/news/technology-54069650,945,2020-9-8,
NASA Develops COVID-19 Prototype Ventilator in 37 Days,5377,0.98,g7839u,https://www.nasa.gov/feature/jpl/nasa-develops-covid-19-prototype-ventilator-in-37-days/,135,2020-4-24,
Facebook Removes Hundreds Of QAnon Groups,5318,0.96,idtxew,https://www.rttnews.com/3122932/facebook-removes-hundreds-of-qanon-groups.aspx,473,2020-8-21,
Wells Fargo reportedly bars employees from using TikTok on company mobile devices,5301,0.98,hpadmy,https://www.theverge.com/2020/7/11/21320935/wells-fargo-bans-tiktok-devices-amazon-pompeo,225,2020-7-11,
FBI nabs Nigerian business scammer who allegedly cost victims millions,5285,0.99,hmx4iy,https://arstechnica.com/tech-policy/2020/07/fbi-nabs-nigerian-business-scammer-who-allegedly-cost-victims-millions/,219,2020-7-7,
U.S. hatches plan to build a quantum Internet that might be unhackable,5270,0.94,hx77f6,https://www.washingtonpost.com/technology/2020/07/23/us-plan-quantum-internet/,410,2020-7-25,
Netflix stops charging thousands of dead accounts,5269,0.98,goqkmf,https://www.bbc.com/news/technology-52777365,244,2020-5-23,
FCC failed to monitor Chinese telecoms for almost 20 years: Senate report,5274,0.97,h0epj2,https://arstechnica.com/tech-policy/2020/06/fcc-failed-to-monitor-chinese-telecoms-for-almost-20-years-senate-report/,239,2020-6-11,
SpaceX’s astronaut-riding Dragon arrives at Space Station,5266,0.93,gu0z3n,https://www.qnacity.com/2020/05/31/technology/spacexs-astronaut-riding-dragon-arrives-at-space-station/,95,2020-5-31,
Elon Musk Reveals Arrested Russian Hacker Targeted Tesla's Nevada Gigafactory with Malware Attack,5233,0.97,ii2g7w,https://www.ibtimes.sg/elon-musk-reveals-arrested-russian-hacker-targeted-teslas-nevada-gigafactory-malware-attack-50774,134,2020-8-28,
Google Sued for Secretly Amassing Vast Trove of Users Private Data,5216,0.98,gvoi7g,https://www.qnacity.com/2020/06/03/technology/google-sued-for-secretly-amassing-vast-trove-of-users-private-data/,170,2020-6-3,
Elon Musk’s Boring Company is setting up operations in Austin,5203,0.94,jrh23e,https://techcrunch.com/2020/11/09/elon-musks-boring-company-is-setting-up-operations-in-austin/,434,2020-11-10,
"Google, Amazon, and Apple have decided to collaborate on a universal smart home ecosystem.",5135,0.97,ed900i,https://businessinsider.com/apple-amazon-google-partner-on-smart-home-tech-2019-12,304,2019-12-20,
Tesla overtakes Volkswagen as world's second most valuable carmaker,5053,0.97,esweyg,https://www.reuters.com/article/us-tesla-stocks-graphic/tesla-overtakes-volkswagen-as-worlds-second-most-valuable-carmaker-idUSKBN1ZM23E,477,2020-1-24,
Microsoft’s operations will be zero waste by 2030,5037,0.98,i3ertt,https://www.theverge.com/2020/8/4/21353385/microsoft-operations-zero-waste-2030,131,2020-8-4,
"Russia, China and Iran hackers target Trump and Biden, Microsoft says",5010,0.97,iqns80,https://www.bbc.com/news/world-us-canada-54110457,307,2020-9-11,
Australia to make Facebook and Google pay for circulating news by imposing new law.,4999,0.98,ieyi76,https://www.theindianwire.com/business/controversy-ensues-as-austrailia-announces-tax-on-google-and-facebook-former-publishes-open-letter-in-a-bid-to-oppose-legislation-285518/,166,2020-8-23,
Reddit Ireland turns off at midnight to stop trolls,4983,0.95,h7k37g,https://www.bbc.com/news/technology-52992676,396,2020-6-12,
"For the first time, the US Space Force will actually go to space today",4972,0.92,fpbqku,https://arstechnica.com/science/2020/03/the-first-launch-for-the-us-space-force-is-set-for-today-from-florida/,450,2020-3-26,
"Feds can’t ask Google for every phone in a 100-meter radius, court says",4971,0.99,iljt97,https://arstechnica.com/tech-policy/2020/09/feds-cant-ask-google-for-every-phone-in-a-100-meter-radius-court-says/,79,2020-9-3,
Google says its carbon footprint is now zero,4933,0.92,it6x2t,https://www.bbc.com/news/technology-54141899?utm_campaign=The%20Interface&utm_medium=email&utm_source=Revue%20newsletter,472,2020-9-15,
Apple makes 2030 carbon-neutral pledge,4911,0.96,hv7elx,https://www.bbc.co.uk/news/technology-53485560,204,2020-7-21,
BitTorrent CEO Announces $1 Million Bounty in Exchange for Twitter Hackers,4855,0.97,hs9yut,https://www.investing.com/news/cryptocurrency-news/justin-sun-offers-1-million-bounty-in-exchange-for-twitter-hackers-2230730,310,2020-7-16,
Facebook bans deepfake videos ahead of the 2020 election,4835,0.97,elakdf,https://www.theverge.com/2020/1/7/21054504/facebook-instagram-deepfake-ban-videos-nancy-pelosi-congress,268,2020-1-7,
"A computer made from DNA can compute the square root of 900. University of Rochester researchers developed a computer that uses 32 strands of DNA to store and process information. It can calculate the square root of square numbers 1, 4, 9, 16, 25 and so on up to 900",4786,0.98,eizhop,https://www.newscientist.com/article/2228461-a-computer-made-from-dna-can-compute-the-square-root-of-900/,298,2020-1-2,
Four of the most powerful tech CEOs to defend against accusations of monopoly,4767,0.98,hzy133,https://cybernews.com/news/four-of-the-most-powerful-tech-ceos-to-defend-against-accusations-of-monopoly/,442,2020-7-29,
Apple gave the FBI access to the iCloud account of a protester accused of setting police cars on fire,4770,0.95,itz4ix,https://www.msn.com/en-us/news/technology/apple-gave-the-fbi-access-to-the-icloud-account-of-a-protester-accused-of-setting-police-cars-on-fire/ar-BB196sgw,496,2020-9-17,
Bill That Would Restore Net Neutrality Moves Forward Despite Telecom’s Best Efforts to Kill it,4735,0.97,b60q00,https://motherboard.vice.com/en_us/article/qvyqvm/bill-that-would-restore-net-neutrality-moves-forward-despite-telecoms-best-efforts-to-kill-it,203,2019-3-27,
Enigmatic fast radio burst pinned on magnetised dead star,4733,0.98,jnznt3,https://www.bbc.co.uk/news/science-environment-54815687,132,2020-11-5,
"Google Maps prepares to add a ""Lighting"" layer to highlight brightly lit streets for safer night travel",4703,0.99,e6duve,https://www.xda-developers.com/google-maps-prepares-lighting-layer-highlight-brightly-lit-streets-night-travel/?fbclid=IwAR0ouh-kJvF1qr6zBJZntpLL9s-xhZ4u-2nC8RkeVxOQ4FSjB0Xxq0XlsXo,114,2019-12-5,
Microsoft is giving parents 12 weeks’ paid parental leave so that they can take care of kids who are at home due to Covid 19,4673,0.98,fzesnq,https://www.fastcompany.com/90489239/microsoft-is-giving-parents-12-weeks-paid-parental-leave,185,2020-4-12,
Mayor of Tulsa suggests police will use Tesla Cybertrucks if Elon Musk moves factory there,4668,0.95,gmxq7d,https://www.cbsnews.com/news/tulsa-oklahoma-mayor-tesla-plant-cybertruck-police-elon-musk/,452,2020-5-20,
Search for Coronavirus Vaccine Becomes a Global Competition,4655,0.99,flw5fj,https://www.nytimes.com/2020/03/19/us/politics/coronavirus-vaccine-competition.html,403,2020-3-20,
Twitter may slow down users’ ability to ‘like’ tweets containing misinformation,4648,0.95,jrh2i7,https://techcrunch.com/2020/11/09/twitter-may-slow-down-users-ability-to-like-tweets-containing-misinformation/,362,2020-11-10,
New Perovskite Solar Cell Puts Another Nail In The Natural Gas Coffin,4595,0.98,i2cie5,https://cleantechnica.com/2020/08/01/new-perovskite-solar-cell-puts-another-nail-in-the-natural-gas-coffin/,180,2020-8-2,
"Gmail is down globally, Google confirms",4591,0.97,id6iqo,https://www.livemint.com/technology/tech-news/gmail-is-down-globally-google-confirms-11597906122942.html,236,2020-8-20,
FCC: Phone carriers that profit from robocalls could have all calls blocked,4578,0.99,htgozl,https://arstechnica.com/tech-policy/2020/07/fcc-phone-carriers-that-profit-from-robocalls-could-have-all-calls-blocked/,118,2020-7-18,
TikTok responds to Trump's proposed ban: 'We're not planning on going anywhere',4566,0.91,i234hi,https://www.usatoday.com/story/tech/2020/08/01/tiktok-app-ban-president-trump-threatens-video-app/5562524002/,959,2020-8-2,
"Google's Zoom rival, called Meet, is now free to consumers",4537,0.95,gaago4,https://www.cnet.com/news/googles-zoom-rival-called-meet-is-now-free-to-consumers/,362,2020-4-29,
"With the WHO endorsing gaming in these times, video games like Minecraft seems to be taking over.",4526,0.96,fx8m6e,https://submarinechannel.com/social-life-on-planet-minecraft/,169,2020-4-8,
"AT&T, Comcast, Verizon and others agree not to overcharge customers during coronavirus",4518,0.96,fifmne,https://www.theverge.com/2020/3/13/21178451/fcc-coronavirus-keep-americans-connected-pledge-att-comcast-charter-att,348,2020-3-14,
