title,score,upv_ratio,id,url,comms_num,created,body
U.S. to leave global postal union next month barring last-minute action; exit could send global parcel rates soaring,1134,0.98,d4nu47,https://www.freightwaves.com/news/us-to-leave-global-postal-union-next-month,133,2019-9-16,
Samsung Made A Galaxy S20 Tactical Edition For The Military,1136,0.96,gnoh0g,https://www.engadget.com/samsung-galaxy-s20-tactical-edition-190334467.html,125,2020-5-21,
Britain's Johnson on Huawei: We will do 5G without hurting security,1134,0.95,eupcih,https://www.reuters.com/article/us-britain-usa-huawei/britains-johnson-on-huawei-we-will-do-5g-without-hurting-security-idUSKBN1ZQ1OQ?il=0,71,2020-1-27,
Apple shuts down its Walkie Talkie app on Apple Watches after mysterious security flaw allowed people to listen in to your iPhone,1132,0.98,cc9etj,https://www.businessinsider.com/apple-disables-walkie-talkie-app-over-iphone-security-flaw-2019-7?r=US&IR=T,75,2019-7-12,
"China wants to decouple from US tech, too",1134,0.96,inyz4o,https://www.ft.com/content/371e139e-df4d-4ef8-9ed9-a92b97543af6,148,2020-9-7,
"Redditor allowed to stay anonymous, court rules",1122,0.99,bs557h,https://www.cnet.com/news/redditor-allowed-to-stay-anonymous-court-rules/,112,2019-5-24,
Renowned Stanford theoretical physicist Shoucheng Zhang who discovered a new state of matter called topological insulator that is set to revolutionize semiconductors and founded venture capital firm Danhua Capital dies at 55,1116,0.97,a49onc,https://news.stanford.edu/2018/12/06/shoucheng-zhang-obituary/,53,2018-12-8,
Ring's Neighbors Data Let Us Map Amazon's Home Surveillance Network,1117,0.98,e8rgvq,https://gizmodo.com/ring-s-hidden-data-let-us-map-amazons-sprawling-home-su-1840312279,127,2019-12-10,
Jazz Study Looks for the Source of Creativity in the Brain,1112,0.97,fz6sx4,https://www.technologynetworks.com/neuroscience/news/jazz-study-looks-for-the-source-of-creativity-in-the-brain-332828,62,2020-4-11,
Lenovo begins selling OEM Ubuntu PCs to the general public,1109,0.98,iybmbz,https://arstechnica.com/gadgets/2020/09/lenovo-launches-new-oem-linux-thinkpad-and-thinkstation-pcs/,88,2020-9-23,
YouTube’s Dangerous Role in Climate Change Miseducation Revealed in Study,1112,0.96,chpzuc,https://www.inverse.com/article/58018-youtube-climate-change-conspiracy-spread,86,2019-7-26,
Google wins in 'right to be forgotten' fight with France,1105,0.97,d8md32,https://www.reuters.com/article/us-eu-alphabet-privacy/google-wins-in-right-to-be-forgotten-fight-with-france-idUSKBN1W90R5,84,2019-9-24,
Donald Daters App Leaks User Data Hours After Launch,1107,0.95,9pm6b7,https://digit.fyi/donald-daters-app-data-leak-trump/,185,2018-10-20,
Researchers warns hackers can steal your password by hearing you type.,1107,0.93,ctfrvx,https://digit.fyi/researchers-warn-hackers-steal-passwords-by-hearing-you-type/,150,2019-8-21,
Bosch is working on a glasses free 3D display for your car...,1101,0.97,cpc4x5,https://techcrunch.com/2019/08/12/bosch-is-working-on-glasses-free-3d-displays-for-in-car-use/,71,2019-8-12,
AT&T is getting sued for selling customers’ location data,1102,0.99,ce0w2w,https://www.theverge.com/2019/7/16/20696222/att-location-data-tracking-lawsuit-electronic-frontier-foundation,35,2019-7-17,
Craigslist is Silicon Valley's most profitable unicorn,1101,0.97,b6xt3g,https://thespring.io/investing/silicon-valleys-forgotten-unicorn/,145,2019-3-29,
‘Barbaric use of technology’: South Sudanese child bride auctioned off on Facebook,1093,0.96,9zdy2d,https://globalnews.ca/news/4687568/south-sudan-child-bride-auction-facebook/,80,2018-11-22,
"Apple, Samsung fined in Italy for ‘planned obsolescence’ of phones",1092,0.96,9s6h5b,https://borneobulletin.com.bn/apple-samsung-fined-in-italy-for-planned-obsolescence-of-phones/,114,2018-10-29,
"Samsung poised to benefit from China virus woes afflicting Apple, other rivals",1087,0.97,f5q28a,https://www.reuters.com/article/us-china-health-apple-samsung-analysis/samsung-poised-to-benefit-from-china-virus-woes-afflicting-apple-other-rivals-idUSKBN20C0GD,104,2020-2-18,
Tesla Semi secures another order for electric trucks ahead of launch,1081,0.96,9y7dzf,https://electrek.co/2018/11/18/tesla-semi-order-electric-trucks-launch/,61,2018-11-19,
"More than 1,000 Android apps harvest data even after you deny permissions",1079,0.98,cam3gp,https://www.cnet.com/news/more-than-1000-android-apps-harvest-your-data-even-after-you-deny-permissions/,93,2019-7-8,
China says it plans to build first artificial intelligence colony on Earth. Robotic 'deep sea Atlantis' built by China will be the world's first fully automated underwater research station.,1076,0.96,a2ekib,https://www.dailymail.co.uk/sciencetech/article-6429377/China-says-plans-build-artificial-intelligence-colony-Earth.html,83,2018-12-3,
Twitter will finally let you turn on two-factor authentication without giving it a phone number,1082,0.97,dzz60g,https://techcrunch.com/2019/11/21/twitter-will-finally-let-you-turn-on-two-factor-authentication-without-giving-it-a-phone-number/,36,2019-11-22,
Japan's Fugaku rated world's fastest supercomputer | NHK WORLD-JAPAN News,1077,0.98,he7o2z,https://www3.nhk.or.jp/nhkworld/en/news/20200623_10/,88,2020-6-23,
Google uses Gmail to track a history of things you buy — and it’s hard to delete,1075,0.97,c9joc9,https://www.cnbc.com/2019/05/17/google-gmail-tracks-purchase-history-how-to-delete-it.html,101,2019-7-6,
Foxconn finally admits its empty Wisconsin ‘innovation centers’ aren’t being developed,1076,0.98,dmet8y,https://www.theverge.com/2019/10/23/20929453/foxconn-innovation-centers-on-hold-wisconsin-mount-pleasant-trump-deal,73,2019-10-24,
Trump attacks Sundar and Google in morning tweets,1078,0.91,cnk0w0,https://techcrunch.com/2019/08/06/trump-attacks-google-and-sundar-pichai-in-morning-tweets,252,2019-8-8,
Apple now offers iPhone repairs in the comfort of your home,1074,0.95,ey66cn,https://www.theverge.com/2020/2/3/21119908/apple-onsite-repair-go-tech-mobile-services-support-iphone-screen-replacement,187,2020-2-3,
Digital exchange loses $137 million as founder takes passwords to the grave,1077,0.98,amlt6i,https://arstechnica.com/information-technology/2019/02/digital-exchange-loses-137-million-as-founder-takes-passwords-to-the-grave/,110,2019-2-3,
NASA needs your help teaching its Curiosity rover how to drive on Mars,1074,0.99,hbx3sn,https://www.space.com/mars-rover-curiosity-driving-artificial-intelligence.html,52,2020-6-19,
FCC approves SpaceX’s plans to fly internet-beaming satellites in a lower orbit,1070,0.97,bict1m,https://www.theverge.com/2019/4/27/18519778/spacex-starlink-fcc-approval-satellite-internet-constellation-lower-orbit,79,2019-4-29,
Apple reportedly developing own search engine to challenge Google's dominance,1071,0.95,ijrlla,https://www.moneycontrol.com/news/technology/apple-gets-ready-to-take-on-google-with-its-own-search-engine-report-5769471.html,206,2020-8-31,
Raspberry Pi Foundation announces the cute little Raspberry Pi 400,1066,0.97,jmki9h,https://techcrunch.com/2020/11/02/raspberry-pi-foundation-announces-the-cute-little-raspberry-pi-400/,44,2020-11-2,
India’s logistics aggregator Shiprocket raises $13M to expand overseas,1065,0.97,ghm5ny,https://techcrunch.com/2020/05/11/indias-logistics-aggregator-shiprocket-raises-13m-to-expand-overseas/,17,2020-5-11,
"To replace gas taxes, Oregon and Utah ask EVs to pay for road use - Gas taxes pay for the upkeep of our roads, but electric cars don't use gasoline.",1069,0.96,ejrq88,https://arstechnica.com/cars/2020/01/to-replace-gas-taxes-oregon-and-utah-ask-evs-to-pay-for-road-use/,223,2020-1-4,
"Senator Elizabeth Warren Announces Plan To Break Up Amazon, Google And Facebook",1062,0.87,ayrbhk,https://www.huffpost.com/entry/elizabeth-warren-amazon-google-facebook_n_5c827b6ae4b0d93616273346,229,2019-3-8,
Caterpillar Inc. is trying to stop a tiny café from using the word cat,1067,0.96,c0ynal,https://www.fastcompany.com/90361041/caterpillar-inc-threatens-a-tiny-cafe-over-cat-trademark,80,2019-6-15,
Google is investing €3B to build clean data centers in Europe,1069,0.98,d6w4hi,https://techcrunch.com/2019/09/20/google-is-investing-3-3b-to-build-clean-data-centers-in-europe/,23,2019-9-20,
Google is acquiring Fitbit for $2.1 billion,1067,0.95,dq47vl,https://techcrunch.com/2019/11/01/google-is-acquiring-fitbit/,113,2019-11-1,
Scientists 3D-print human skin and bone for Mars astronauts,1058,0.99,cb7ivn,https://www.cnet.com/news/scientists-3d-print-human-skin-and-bone-for-mars-astronauts/,67,2019-7-10,
SpaceX may begin testing its Starship spacecraft this week,1059,0.97,b2kuvb,https://arstechnica.com/science/2019/03/spacex-may-begin-testing-its-starship-spacecraft-this-week/,38,2019-3-19,
"Former Missouri Pharma Professor Ashim Mitra Stole Student’s Research to Sell New Drug, Lawsuit Alleges",1060,0.98,awa8ho,https://www.nytimes.com/2019/03/01/us/university-missouri-cequa-lawsuit.html,38,2019-3-2,
Chinese Citizens Will Have to Scan Their Faces to Access The Internet,1047,0.97,dffbvj,https://www.geeksgyaan.com/2019/10/chinese-citizens-internet-access.html,145,2019-10-9,
T-Mobile and Sprint get FCC approval to merge in 3-2 party-line vote,1046,0.98,dj10hc,https://arstechnica.com/tech-policy/2019/10/t-mobile-and-sprint-get-fcc-approval-to-merge-in-3-2-party-line-vote/,137,2019-10-17,
Intel is teaching a computer chip to smell,1042,0.97,fkbtar,https://www.zdnet.com/article/intel-is-teaching-a-computer-chip-to-smell/,105,2020-3-18,
Type A blood converted to universal donor blood with help from bacterial enzymes,1041,0.99,bz8iod,https://www.sciencemag.org/news/2019/06/type-blood-converted-universal-donor-blood-help-bacterial-enzymes,19,2019-6-11,
Google adds dark theme toggle to the Play Store,1038,0.87,fbt9wk,https://www.androidpolice.com/2020/02/28/google-adds-dark-theme-toggle-to-the-play-store/,60,2020-3-1,
Google Chrome will warn you before you fall for a phone subscription scam,1044,0.97,9vu3rj,https://mashable.com/article/google-chrome-subscription-scam/,20,2018-11-10,
AT&T promised lower prices after Time Warner merger—it’s raising them instead,1040,0.97,8vrvtc,https://arstechnica.com/information-technology/2018/07/att-promised-lower-prices-after-time-warner-merger-its-raising-them-instead/,91,2018-7-3,
Elon Musk: the Tesla Cybertruck isn’t getting any smaller,1036,0.91,gpj1gs,https://techcrunch.com/2020/05/23/elon-musk-the-tesla-cybertruck-isnt-getting-any-smaller/,160,2020-5-24,
Fred Rogers wouldn't have wanted to appear in a Google ad,1043,0.97,9u8yqq,http://www.latimes.com/opinion/op-ed/la-oe-linn-fred-rogers-google-20181104-story.html,21,2018-11-5,
Tesla has decided to keep stores open and raise prices instead,1031,0.93,azt8go,https://www.techkrest.com/2019/03/tesla-has-decided-to-keep-stores-open.html,112,2019-3-11,
"NYPD Pulls Nearly 3K Body Cameras After One Smokes, Explodes",1032,0.95,9qfvu2,https://www.nbcnewyork.com/news/local/NYPD-Pulls-Nearly-3000-Body-Cameras-After-One-Starts-Smoking-Explodes-498152731.html,132,2018-10-23,
Air Force X-37B spaceplane returns to Earth after 780-day mission,1034,0.98,dnw318,https://www.cbsnews.com/news/air-force-x-37b-spaceplane-returns-to-earth-after-780-day-mission/,58,2019-10-28,
New cause of cell aging discovered: Findings have huge implications for cancer and age-related health conditions,1028,0.99,ciivjd,https://www.sciencedaily.com/releases/2019/07/190725151018.htm,97,2019-7-27,
A third prototype of SpaceX’s Starship rocket bursts on the test stand,1029,0.97,fu96uc,https://www.theverge.com/2020/4/3/21206662/spacex-starship-deep-space-rocket-failure-test-stand-texas-prototype,75,2020-4-3,
IMDb has launched an ad-supported movie streaming service,1025,0.97,aeu19h,https://www.theverge.com/2019/1/10/18177321/imdb-freedive-ad-supported-free-movie-streaming-service,103,2019-1-11,
"Accessibility, the future, and why Domino’s matters - Is the Web subject to the ADA? ""Of course,"" says congressman who wrote the ADA.",1016,0.97,dl1gl0,https://arstechnica.com/tech-policy/2019/10/accessibility-the-future-and-why-dominos-matters/,144,2019-10-21,
Space station astronauts have a new floating AI robot companion,1024,0.97,a1vrwc,https://boingboing.net/2018/11/30/space-station-astronauts-have.html,122,2018-12-1,
BBC Launches Anti-cyberbullying App Aimed at Kids,1014,0.96,d6s19r,https://digit.fyi/bbc-launches-anti-cyberbullying-own-it-app/,50,2019-9-20,
Tesla car hacked at Pwn2Own contest,1019,0.97,b4tgun,https://www.zdnet.com/article/tesla-car-hacked-at-pwn2own-contest/,101,2019-3-24,
Rumor: Apple developing 'AirPods Pro Lite' headphone model,1018,0.9,f2nsqm,https://appleinsider.com/articles/20/02/12/rumor-apple-developing-airpods-pro-lite-headphone-model,226,2020-2-12,
FTC tells ISPs to disclose exactly what information they collect on users and what it’s for,1010,0.99,b8mitx,https://techcrunch.com/2019/03/26/ftc-tells-isps-to-disclose-exactly-what-information-they-collect-on-users-and-what-its-for/,43,2019-4-3,
Scientists create device that cuts desalination costs by 90%,1006,0.98,djqq2c,https://tass.com/science/1083191,63,2019-10-19,
"U.S., U.K. sign deal to access data from tech companies like Facebook and Google",1001,0.97,di7xp1,https://www.nbcnews.com/tech/security/u-s-u-k-sign-deal-access-data-tech-companies-n1062361,95,2019-10-15,
"Hackers breach FSB contractor, expose Tor deanonymization project and more",1000,0.98,cfmdgj,https://www.zdnet.com/article/hackers-breach-fsb-contractor-expose-tor-deanonymization-project/,63,2019-7-20,
Study finds that a GPS outage would cost $1 billion per day,1002,0.98,c1bale,https://arstechnica.com/science/2019/06/study-finds-that-a-gps-outage-would-cost-1-billion-per-day/,54,2019-6-16,
SpaceX gets $300 million from Defense Department,998,0.98,asj3j1,https://www.cnet.com/news/spacex-just-received-300-million-from-the-department-of-defence/,75,2019-2-20,
"Stop tracking me, Google: Austrian citizen files GDPR legal complaint over Android Advertising ID",997,0.99,gjy6xk,https://www.theregister.co.uk/2020/05/13/google_android_gdpr_complaint/,33,2020-5-15,
"Tesla hasn’t been given the ‘green light’ to reopen Fremont factory, health official says",997,0.97,gge7iu,https://techcrunch.com/2020/05/08/tesla-has-not-been-given-a-green-light-to-open-fremont-factory-health-official-says/,98,2020-5-9,
China’s CRISPR twins might have had their brains inadvertently enhanced,990,0.94,atid77,https://www.technologyreview.com/s/612997/the-crispr-twins-had-their-brains-altered/,191,2019-2-22,
"Bill Gates: If I were starting a company today, it would use AI to teach computers how to read",995,0.96,c51po1,https://www.cnbc.com/2019/06/24/bill-gates-says-hed-start-an-ai-company-today.html,132,2019-6-25,
Elon Musk tried to bring Mario Kart to your Tesla Model 3,985,0.87,a222yl,https://futurism.com/the-byte/elon-musk-mario-kart-every-tesla,36,2018-12-1,
Eight parliaments want to talk to Mark Zuckerberg,982,0.98,9yk7zd,https://techcrunch.com/2018/11/19/now-eight-parliaments-are-demanding-zuckerberg-answers-for-facebook-scandals/,73,2018-11-20,
Cosmic Crisp apple: New variety 'keeps in the fridge for up to a year' | US News,985,0.94,e4zhki,https://news.sky.com/story/cosmic-crisp-apple-new-variety-keeps-in-the-fridge-for-up-to-a-year-11875167,93,2019-12-2,
'China's Netflix' is being investigated by the SEC for alleged fraud,980,0.97,iaoh3m,https://edition.cnn.com/2020/08/14/tech/iqiyi-baidu-sec-investigation-intl-hnk/index.html,125,2020-8-16,
'Made in Japan' goods to make US blitz through Amazon,982,0.98,arq0v9,https://asia.nikkei.com/Business/Business-Trends/Made-in-Japan-goods-to-make-US-blitz-through-Amazon,98,2019-2-18,
French police takedown botnet infections,981,0.98,cyknkh,https://techcrunch.com/2019/09/01/police-botnet-takedown-infections/,18,2019-9-2,
China has 219 of the world’s fastest supercomputers,979,0.96,c247cu,https://venturebeat.com/2019/06/17/top500-china-has-219-of-the-worlds-fastest-supercomputers/,140,2019-6-19,
Google seeks permission to listen to users' audio,979,0.93,d86jo1,https://www.bbc.co.uk/news/technology-49796207,76,2019-9-23,
Hacker says he'll livestream deletion of Zuckerberg's Facebook page (updated),982,0.94,9jt9rh,https://www.engadget.com/2018/09/28/zuckerberg-facebook-page-hacker-livestream/,71,2018-9-29,
Form Energy claims aqueous air battery provides 150 hours of storage,976,0.95,gjmqk7,https://www.pv-magazine.com/2020/05/08/form-energy-claims-its-aqueous-air-battery-provides-150-hour-duration-storage/,57,2020-5-14,
Elon Musk has lost $4 billion of his personal fortune during Tesla scandal,971,0.89,9k6urh,https://www.thesouthafrican.com/elon-musk-net-worth-money-lost-tesla/,185,2018-9-30,
Iconic 80s computer The Commodore 64 to return with fully-functional keyboard,964,0.98,ca8mpo,https://edition.cnn.com/2019/06/26/tech/commodore-64-retro-console-trnd/index.html,119,2019-7-8,
Tesla's mass layoffs and reduced car production have Wall Street 'waking up from the dream',970,0.9,ak0owl,https://www.dailyherald.com/business/20190126/teslas-mass-layoffs-and-reduced-car-production-have-wall-street-waking-up-from-the-dream,190,2019-1-26,
A new ‘DNA microscope’ peers deep inside living cells,964,0.99,c474i0,https://www.statnews.com/2019/06/20/dna-microscope-shows-cells-genetic-material/,29,2019-6-24,
CIA warns Britain over China's secret funding of Huawei,966,0.95,bfjsv7,https://www.dailymail.co.uk/news/article-6942331/CIA-warns-telecom-Huawei-funded-Chinese-state-security-amid-allegations-tech-company.html,108,2019-4-21,
"US, UK sign pact to share electronic evidence in criminal cases",963,0.97,de4j4u,https://www.cnet.com/news/us-uk-sign-pact-to-share-electronic-evidence-in-criminal-cases/,38,2019-10-6,
Russia and China Stock Up on Gold Amid Rumors of Creating Gold-Backed Cryptocurrency,958,0.95,bcdh5r,https://beincrypto.com/russia-and-china-stock-up-on-gold-amid-rumors-of-creating-gold-backed-cryptocurrency/?utm_source=reddit&utm_medium=social&utm_campaign=politics&utm_content=crls,101,2019-4-12,
Raspberry Pi 4 can handle a wider range of USB adapters thanks to revised design,964,0.98,f8ds9y,https://www.theregister.co.uk/2020/02/21/pi_4_fixed/,35,2020-2-24,
Twitter CEO's hacked account sends racist tweets before being secured,962,0.97,cy97b9,https://www.theinforadar.com/2019/09/twitter-ceos-hacked-account-sends.html,126,2019-9-1,
AT&T CEO interrupted by a robocall during a live interview,956,0.98,b3jbof,https://www.theverge.com/2019/3/20/18274519/att-ceo-robocall-randall-stephenson-live-interview-fcc-ajit-pai,39,2019-3-21,
RadioShack Sued for Alleged ADA Website Accessibility Violation,962,0.95,j05u2k,https://lawstreetmedia.com/tech/radioshack-sued-for-ada-website-accessibility-violation/,173,2020-9-26,
"GitHub went down for two hours, affecting thousands of software developers",963,0.97,hhygmt,https://www.theverge.com/2020/6/29/21306674/github-down-errors-outage-june-2020,46,2020-6-29,
Amazon stores Alexa transcripts indefinitely,956,0.96,c8oj6u,https://www.iafrikan.com/2019/07/03/amazon-alexa-privacy-keeps-recordings-indefinitely/,83,2019-7-3,
The Most Clever 'Zip Bomb' Ever Made Explodes a 46MB File to 4.5 Petabytes,953,0.98,cbvw0a,https://www.vice.com/en_us/article/597vzx/the-most-clever-zip-bomb-ever-made-explodes-a-46mb-file-to-45-petabytes,79,2019-7-11,
"Environmental impact of Bitcoin is far worse than previously thought, and renewable energy is not even the solution",948,0.94,b25jgd,https://beincrypto.com/new-report-says-bitcoin-cant-go-green-yet-more-research-needed/?utm_source=reddit&utm_medium=social&utm_campaign=green&utm_content=sne,186,2019-3-17,
FEMA 'unnecessarily' shared data of 2.3 million disaster victims with contractor,953,0.96,b4jr3e,https://www.zdnet.com/article/fema-unnecessarily-shared-data-of-2-3-million-disaster-victims-with-contractor/,43,2019-3-23,
Net neutrality battle heads to court in 2019. The next chapter in the ongoing struggle for an open internet will unfold in the US Court of Appeals.,951,0.97,aa51ta,https://www.cnet.com/news/net-neutrality-battle-heads-to-court-in-2019/,75,2018-12-28,
Koenigsegg aims to build a 'CO2 neutral' combustion supercar,952,0.97,amzt1u,https://www.engadget.com/2019/02/04/koenigsegg-carbon-neutral-supercar/,66,2019-2-4,
Ohio becomes the first state to accept bitcoin for tax payments,945,0.94,a0co9c,https://techcrunch.com/2018/11/25/ohio-becomes-the-first-state-to-accept-bitcoin-for-tax-payments/,82,2018-11-26,
Tesla Sentry Mode Causes Awe And Fury In Spanish Parking Lot,942,0.92,dxsqaw,https://insideevs.com/news/382463/sentry-mode-awe-fury-catalonia/,164,2019-11-18,
Windows 10's Latest Update Messes With Printing,935,0.97,dcrt45,"https://www.tomshardware.co.uk/windows-10-kb4517211-update-breaks-printing,news-61782.html",121,2019-10-3,
Putin signs law for independent Russian internet,926,0.95,bjx1cu,https://edition.cnn.com/2019/05/01/europe/vladimir-putin-russian-independent-internet-intl/,216,2019-5-3,
Firefox to add Tor Browser anti-fingerprinting technique called letterboxing | ZDNet,930,0.99,ayggsr,https://www.zdnet.com/article/firefox-to-add-tor-browser-anti-fingerprinting-technique-called-letterboxing/,65,2019-3-8,
General Motors starts taking orders for its first e-bike,925,0.96,aqw8lu,https://www.theverge.com/2019/2/14/18224778/gm-ebike-ariv-specs-price-europe,115,2019-2-15,
Facebook scans some of the contents of your private Messenger texts,927,0.97,dn9tfw,https://www.dailymail.co.uk/sciencetech/article-5578619/Facebook-scans-contents-private-Messenger-texts.html?ito=social-facebook&fbclid=IwAR22mw8HWI5k7zQ8lxtoJnU5EoLZTOEx3LXBYZWrID5bTtV_QVoMh6I5Yp0,150,2019-10-26,
Microsoft developed an AI that creates amazing caricatures,926,0.88,a2q88h,https://thenextweb.com/artificial-intelligence/2018/11/20/microsoft-developed-an-ai-that-creates-amazing-caricatures,67,2018-12-4,
Flaws in LTE can allow hackers to easily spoof presidential alerts,927,0.98,c4naiv,https://www.techspot.com/news/80633-flaws-lte-can-allow-hackers-easily-spoof-presidential.html,37,2019-6-24,
Tesla Model 3 = #6 Top Selling Car In USA In November | CleanTechnica,922,0.95,a3bq7b,https://cleantechnica.com/2018/12/05/tesla-model-3-6-top-selling-car-in-usa-in-november-cleantechnica-report/,155,2018-12-5,
Amazon Reportedly Employs Thousands of People to Listen to Your Alexa Conversations,924,0.95,bc28q9,https://us.cnn.com/2019/04/11/tech/amazon-alexa-listening/index.html,181,2019-4-12,
"Best Buy, Staples accused of 'urging' customers to pirate TV shows with devices sold in stores",924,0.94,d4ljbk,https://www.cbc.ca/news/business/best-buy-staples-canada-computers-london-drugs-piracy-android-boxes-1.5283504,127,2019-9-15,
A new dimension to marine restoration: 3D printing coral reefs,922,0.97,9atkhe,https://news.mongabay.com/wildtech/2018/08/a-new-dimension-to-marine-restoration-3d-printing-coral-reefs/,30,2018-8-28,
NASA agrees to work with SpaceX on orbital refueling technology,921,0.98,ck9vx0,https://arstechnica.com/science/2019/07/nasa-agrees-to-work-with-spacex-on-orbital-refueling-technology/,50,2019-7-31,
SpaceX's Starship SN4 prototype fires rocket engine for 1st time,914,0.95,ggfi01,https://www.space.com/spacex-starship-sn4-engine-static-fire-test.html,35,2020-5-9,
"Uber, Lyft drivers plan to strike in more than a dozen major cities",911,0.97,bm39zz,https://edition.cnn.com/2019/05/07/tech/uber-driver-strike-ipo/index.html,210,2019-5-8,
Office Depot rigged PC malware scans to sell unneeded $300 tech support,916,0.98,b6mjjr,https://arstechnica.com/tech-policy/2019/03/office-depot-tricked-people-into-buying-pc-support-with-fake-virus-scans/,76,2019-3-29,
NASA's Opportunity rover celebrates 15 years on Mars – by staying as dead as a doornail,912,0.86,ak0sr2,https://www.theregister.co.uk/2019/01/26/opportunity_rover_anniversary/,56,2019-1-26,
"YouTube moves to ban neo-Nazi, Holocaust-denying videos",914,0.95,bxgajt,https://www.cbc.ca/amp/1.5163265,325,2019-6-6,
US officials launch bid to change PM's mind over allowing Huawei to build 5G network,906,0.96,bh6ab1,https://www.dailymail.co.uk/news/article-6956977/US-officials-launch-bid-change-PMs-mind-allowing-Hauwei-build-5G-network.html,324,2019-4-25,
A hotspot finder app exposed 2 million Wi-Fi network passwords,903,0.98,bg2sr5,https://techcrunch.com/2019/04/22/hotspot-password-leak/,36,2019-4-22,
"Axon, formerly Taser, plans to put automatic license plate readers on police dashboards",899,0.96,dm1ht8,https://www.theverge.com/2019/10/23/20925180/axon-taser-automatic-license-plate-reader-ethics-surveillance,224,2019-10-24,
A huge database of Facebook users’ phone numbers found online,900,0.97,d012p0,https://techcrunch.com/2019/09/04/facebook-phone-numbers-exposed/,90,2019-9-5,
Huawei partners with TomTom for Google Maps alternative,901,0.92,erf38c,http://www.techradar.com/news/huawei-partners-with-tomtom-for-google-maps-alternative,151,2020-1-21,
"South Korea first to roll out 5G services, beating U.S. and China",903,0.97,b8zfrf,https://www.reuters.com/article/us-southkorea-5g/south-korea-first-to-roll-out-5g-services-beating-u-s-and-china-idUSKCN1RF0MF,134,2019-4-3,
Hackers have been holding the city of Baltimore’s computers hostage for 2 weeks,890,0.98,brlxzw,https://www.vox.com/recode/2019/5/21/18634505/baltimore-ransom-robbinhood-mayor-jack-young-hackers,86,2019-5-22,
Apple CEO Tim Cook: ‘We have to admit when the free market is not working’,897,0.93,9z00vz,https://www.washingtonpost.com/technology/2018/11/19/apple-ceo-tim-cook-we-have-admit-when-free-market-is-not-working/?noredirect=on&utm_term=.bec8a2a17265,107,2018-11-21,
The Link Between Air Pollution and Mental Illness,887,0.97,cwc0yx,https://i-d.vice.com/en_us/article/ywad85/a-recent-study-links-air-pollution-and-mental-illness?ref=vice,26,2019-8-28,
