title,score,upv_ratio,id,url,comms_num,created,body
Congress has set out a bill to stop the FCC taking away our internet. PLEASE SPREAD THIS AS MUCH AS YOU CAN.,140035,0.88,7j6kn4,https://www.congress.gov/bill/115th-congress/house-bill/4585,1558,2017-12-12,
California-based game company Blizzard bans pro esports player and confiscates his prize money after he voices support for Hong Kong protesters,129865,0.95,df1g3g,https://www.businessinsider.com/blizzard-bans-esports-player-blitzchung-supporting-hong-kong-protests-interview-2019-10,7043,2019-10-8,
"Joe Biden calls game developers ""little creeps"" who make titles that ""teach you how to kill""",128360,0.85,erd274,https://www.techspot.com/news/83623-joe-biden-calls-game-developers-little-creeps-who.html,10414,2020-1-20,
"If Reddit was half as verbal about net neutrality as they are about Star Wars Battlefront II, then we could stop ISP's and the FCC",121063,0.8,7dwqv6,https://www.reddit.com/r/technology/comments/7dwqv6/if_reddit_was_half_as_verbal_about_net_neutrality/,2577,2017-11-19,"All it takes is one call. It's our internet. 

**https://www.battleforthenet.com/**

**https://www.battleforthenet.com/**

**https://www.battleforthenet.com/**

**https://www.battleforthenet.com/**

**https://www.battleforthenet.com/**

**https://www.battleforthenet.com/**

**https://www.battleforthenet.com/**

EDIT: thank you for my first gold(s) kind strangers. All I want is for people to be aware and take action, not spend money on me."
Comcast is trying to censor our pro-net neutrality website that calls for an investigation into fake FCC comments potentially funded by the cable lobby,114344,0.93,6cvg82,https://www.reddit.com/r/technology/comments/6cvg82/comcast_is_trying_to_censor_our_pronet_neutrality/,2496,2017-5-23,"Fight for the Future has received [a cease and desist order](http://imgur.com/a/BI7YZ) from Comcast’s lawyers, claiming that [Comcastroturf.com](http://comcastroturf.com) - a pro-net neutrality site encouraging Internet users to investigate an astroturfing campaign possibly funded by the cable lobby - violates Comcast’s ""valuable intellectual property."" The letter threatens legal action if the domain is not transferred to Comcast’s control.

The notice is ironic, in that it’s a perfect example of why we need Title II based net neutrality protections that ban ISPs from blocking or throttling content. 

**If the FCC’s current proposal is enacted, there would be nothing preventing Comcast from simply censoring this site -- or other sites critical of their corporate policies -- without even bothering with lawyers.**

The legal notice can be viewed [here](http://imgur.com/a/BI7YZ). It claims that [Comcastroturf.com](http://comcastroturf.com) violates the Anticybersquatting Consumer Protection Act and infringes on Comcast’s trademarks. Of course, these claims are legally baseless, since the site is clearly a form of First Amendment protected political speech and makes no attempt to impersonate Comcast. (See the case ""[Bosley Medical Institute vs. Kremer](https://en.wikipedia.org/wiki/Bosley_Medical_Institute,_Inc._v._Kremer)"" which held that a site critical of a company’s practices could not be considered trademark infringement, or the case Taubman vs. Webfeats, which decided that *sucks.com domain names—in this case taubmansucks.com—were free speech)

[Comcastroturf.com](http://comcastroturf.com) criticizes the cable lobby and encourages Internet users to search the Federal Communication Commission (FCC)’s docket to check if a fake comment was submitted using their name and address to attack Title II based net neutrality protections. It has been [widely reported](https://www.bna.com/fcc-set-move-n73014451155/) that more than 450,000 of these comments have been submitted to the FCC -- and as a result of the site at [Comcastroturf.com](http://comcastroturf.com), Fight for the Future [has heard](https://www.fightforthefuture.org/news/2017-05-18-fcc-ignores-growing-evidence-of-fraud-moves-ahead/) from dozens of people who say that anti-net neutrality comments were submitted using their personal information without their permission. We have connected individuals with Attorneys Generals and have called for the FCC act immediately to investigate this potential fraud.

Companies like Comcast have a long history of funding shady astroturfing operations like the one we are trying to expose with [Comcastroturf.com](http://comcastroturf.com), and also a long history of engaging in censorship. This is exactly why we need net neutrality rules, and why we can’t trust companies like Comcast to just ""behave"" when they have abused their power time and time again.

Fight for the Future has no intention of taking down [Comcastroturf.com](http://comcastroturf.com), and we would be happy to discuss the matter with Comcast in court.
"
"Bernie Sanders unveils plan to boost broadband access, break up internet and cable titans: “We are going to take on the greedy internet, telecom, and cable monopolies and put an end to their absurd price gouging”",112298,0.84,e6z7k6,https://www.cnbc.com/2019/12/06/bernie-sanders-releases-broadband-plan-targets-comcast-att-verizon.html,6182,2019-12-6,
Reddit just passed Facebook as #3 most popular website in US,110089,0.9,8n959q,https://www.alexa.com/topsites/countries/US,5527,2018-5-30,
"SpaceX successfully launches first crew to orbit, ushering in new era of spaceflight",109125,0.91,gtka43,https://www.theverge.com/2020/5/30/21269703/spacex-launch-crew-dragon-nasa-orbit-successful,3842,2020-5-31,
"Congressmen demand investigation of FCC Chairman Ajit Pai, Sinclair Broadcast Group",104655,0.9,7eqmci,http://static.techspot.com/news/71865-congressmen-demand-investigation-fcc-chairman-ajit-pai-sinclair.html,2054,2017-11-22,
"SOPA, PIPA, CISPA, ACTA, TPP, ITU, CISPA again, TAFTA. We won them all. In 2015 Net Neutrality, for free access to our Internets. The FCC just signalled the death knell for that hard-won fight. We need to have a serious conversation and fight this, and time is short. Let's have that conversation.",104101,0.9,6bytpx,https://www.reddit.com/r/technology/comments/6bytpx/sopa_pipa_cispa_acta_tpp_itu_cispa_again_tafta_we/,3921,2017-5-19,"Via the wonderful /u/vriska1

If you want to help protect NN you can support groups like the Electronic Frontier Foundation and the ACLU and Free Press who are fighting to keep Net Neutrality.

https://contactingcongress.org - Contact your member of Congress

https://www.eff.org/

https://www.aclu.org/

https://www.freepress.net/

https://www.fightforthefuture.org/

https://www.publicknowledge.org/

https://demandprogress.org/

also you can set them as your charity on
https://smile.amazon.com/

also write to your House Representative and senators

http://www.house.gov/representatives/find/

https://www.senate.gov/general/contact_ ... erBy=state

and the FCC
https://www.fcc.gov/about/contact

You can now add a comment to the repeal here

https://www.fcc.gov/ecfs/search/filings ... nated,DESC

here a easier URL you can use thanks to John Oliver

www.gofccyourself.com

(its down right now but will likely be back up after today)

you can also use this that help you contact your house and congressional reps, its easy to use and cuts down on the transaction costs with writing a letter to your reps.

https://resistbot.io/

also check out https://democracy.io/#!/

which was made by the EFF and is a low transaction​cost tool for writing all your reps in one fell swoop

[Major tech companies are for Net Neutrality](https://www.washingtonpost.com/news/the-switch/wp/2017/04/12/tech-companies-are-teeing-up-another-fcc-fight-on-net-neutrality/?utm_term=.cedc03fc38c3) (open in incognito mode to skip wall),  And [Senate Democrats are for Net Neutrality.](https://www.theverge.com/2017/5/17/15654496/senate-democrats-open-letter-net-neutrality)"
Verizon throttled fire department’s “unlimited” data during Calif. wildfire,102552,0.93,996ep8,https://arstechnica.com/tech-policy/2018/08/verizon-throttled-fire-departments-unlimited-data-during-calif-wildfire/,4776,2018-8-22,
Massive Fraud in Net Neutrality Process is a Crime Deserving of Justice Department Attention,100691,0.86,7l0whi,https://townhall.com/columnists/bobbarr/2017/12/20/massive-fraud-in-net-neutrality-process-is-a-crime-deserving-of-justice-department-attention-n2424724,3036,2017-12-20,
"Apple's new iPhone operating system is making it harder for Facebook to track people, and Facebook warns it will decimate part of its business",98886,0.94,ih6w0m,https://www.businessinsider.com.au/facebook-apple-ios-14-damage-audience-network-ad-business-2020-8,5761,2020-8-27,
"A lawsuit against Apple is launched in France, one of the only countries where planned obsolescence is explicitly illegal",97388,0.9,7mmjij,https://www.thelocal.fr/20171228/french-lawsuit-launched-against-apple-for-alleged-crime-of-slowing-down-iphones,6158,2017-12-28,
Apple Being Sued for 'Purposefully Slowing Down Older iPhone Models',94358,0.88,7ldqzm,https://www.macrumors.com/2017/12/21/apple-lawsuit-slowing-down-old-iphone-models/,5901,2017-12-22,
Senate votes in favor of overturning FCC on Net Neutrality,92980,0.88,8jxxxn,https://www.c-span.org/video/?445642-1/us-senate-vote-reinstating-net-neutrality-rules-3pm&live=,3728,2018-5-17,
Hackers just leaked sensitive files from over 200 police departments that are searchable by badge number,91036,0.87,hdvac7,https://www.businessinsider.com/blueleaks-hackers-publish-sensitive-files-from-200-police-departments-2020-6,2657,2020-6-23,
"Hacktivist Group Anonymous Takes Down Minneapolis PD Website, Releases Video Threatening To Expose Corrupt Police Officers",91021,0.86,gttccz,https://brobible.com/culture/article/hacktivist-group-anonymous-minneapolis-pd-george-floyd/,2940,2020-5-31,
"PornHub, OK Cupid, Imgur, DuckDuckGo, Namecheap, Bittorrent, and a bunch of other big sites have joined the Internet-Wide Day of Action for Net Neutrality on July 12 (Amazon, Kickstarter, Etsy, Mozilla, and Reddit were already on board.)",90547,0.91,6h82ji,https://www.reddit.com/r/technology/comments/6h82ji/pornhub_ok_cupid_imgur_duckduckgo_namecheap/,2905,2017-6-14,"Hey reddit, I wanted to give a quick update on the **[Internet-Wide Day of Action to Save Net Neutrality](https://www.battleforthenet.com/july12)** that lots of us are planning for July 12th.

There's a huge amount of momentum. This morning PornHub (with 75 million daily visitors) [announced](https://motherboard.vice.com/en_us/article/pornhub-will-show-its-75-million-daily-visitors-why-net-neutrality-matters) that they will be participating. Since we announced earlier this month a ton of other high-traffic sites have signed on including Imgur, Amazon, Namecheap, OK Cupid, Bittorrent, Mozilla, Kickstarter, Etsy, GitHub, Vimeo, Chess.com, Fark, Checkout.com, Y Combinator, and Private Internet Access. 

Reddit itself has also joined, [along with](https://www.reddit.com/r/technology/comments/6g9pkl/reddit_lets_get_organized_more_than_30_subreddits/) more than 30 subreddits!

Net neutrality is the basic principle that prevents Internet Service Providers like Comcast and Verizon from charging us extra fees to access the content we want -- or throttling, blocking, and censoring websites and apps. Title II is the legal framework for net neutrality, and the FCC is trying to get rid of it, under immense pressure for the Cable lobby.

This day of action is an incredibly important moment for the Internet to come together -- across political lines -- and show that we don't want our Cable companies controlling what we can do online, or picking winners and losers when it comes to streaming services, games, and online content.

The current FCC chairman, Ajit Pai, is a former Verizon lawyer and seems intent on getting rid of net neutrality and misleading the public about it. But the FCC has to answer to Congress. If we can create another moment of massive online protest like the SOPA Blackout and the Internet Slowdown, we have a real chance of stopping the FCC in its tracks, and protecting the Internet as a free and open platform for creativity, innovation, and exchange of ideas. 

So! If you've got a website, blog, Tumblr, or any kind of social media following, or if you are a subreddit mod or active in an online community or forum, please get involved! There's so much we as redditors can do, from blacking out our sites to drive emails and phone calls to organizing in-person meetings with our lawmakers. Feel free to message me directly or email team (at) fightforthefuture (dot) org to get involved, and **[learn more here.](https://www.battleforthenet.com/july12)**

**EDIT:** Oh hai, everyone! Very glad you're here. Lots of awesome brainstorming happening in the comments. Keep it coming. A lot of people are asking what sites will be doing on July 12. We're still encouraging brainstorming and creativity, but the basic idea is that sites will have a few options of things they can do to their homepage to show what the web would be like without net neutrality, ie a slow loading icon to show they are stuck in the slow lane, a ""site blocked"" message to show they could be censored, or an ""upgrade your Internet service to access this site"" fake paywall to show how we could be charged special fees to access content. Love all your ideas! Keep sharing, and **[go here for more info about the protest.](https://www.battleforthenet.com/july12)**

**EDIT 2:** It's worth noting that given the current chairman of the FCC's political orientation, it's extra important that conservatives, libertarians, and others to the right of center speak out on this issue. The cable lobby is working super hard to turn this technological issue into a partisan circus. We can't let them. Net neutrality protects free speech, free markets, innovation, and economic opportunity. We need people and sites from all across the political spectrum to be part of this. "
"The rise of Netflix competitors has pushed consumers back toward piracy - BitTorrent usage has bounced back because there's too many streaming services, and too much exclusive content.",89857,0.94,9kt7un,https://motherboard.vice.com/en_us/article/d3q45v/bittorrent-usage-increases-netflix-streaming-sites,7615,2018-10-3,
74% of Netflix Subscribers Would Rather Cancel Their Subscription Than See Ads,90473,0.91,4p65hq,https://www.allflicks.net/74-of-netflix-subscribers-would-rather-cancel-their-subscription-than-see-ads/,6453,2016-6-22,
"Reddit’s The_Donald Was One Of The Biggest Havens For Russian Propaganda During 2016 Election, Analysis Finds",89005,0.71,7y979i,https://www.inquisitr.com/4790689/reddits-the_donald-was-one-of-the-biggest-havens-for-russian-propaganda-during-2016-election-analysis-finds/,9463,2018-2-18,
White House must now respond to the people asking for FCC Chairman Ajit Pai’s resignation over net neutrality,87249,0.79,7ggxby,https://www.dailydot.com/layer8/ajit-pai-resign-petition-white-house-we-the-people/,2495,2017-11-30,
Nobody reads privacy policies. This senator wants lawmakers to stop pretending we do. - Sen. Sherrod Brown wants to upend years of debate over a potential federal privacy law by shifting the burden away from consumers and onto companies.,86511,0.96,hc16oq,https://www.washingtonpost.com/technology/2020/06/18/data-privacy-law-sherrod-brown/,1157,2020-6-19,
Dead People Mysteriously Support The FCC's Attack On Net Neutrality,85630,0.91,7a3stk,https://www.techdirt.com/articles/20171030/11255938512/dead-people-mysteriously-support-fccs-attack-net-neutrality.shtml,3357,2017-11-1,
Reports: Facebook Fires Employee Who Shared Proof of Right Wing Favoritism,84602,0.76,ja0oi4,https://sanfrancisco.cbslocal.com/2020/08/07/reports-facebook-fires-employee-who-shared-proof-of-right-wing-favoritism/?fbclid=IwAR2L-swaj2hRkZGLVeRmQY53Hn3Um0qo9F9aIvpWbC5Rt05j4Y7VPUA5hwA#.X0PHH6Gblmu.facebook,3591,2020-10-13,
‘Cards Against Humanity’ Creator Just Pledged To Buy and Publish Congress’s Browser History,84339,0.86,62as53,http://resistancereport.com/news/cards-humanity-creator-just-pledged-buy-publish-congresss-browser-history/,2446,2017-3-30,
F.C.C. Repeals Net Neutrality Rules,83531,0.84,7jtf4m,https://www.nytimes.com/2017/12/14/technology/net-neutrality-repeal-vote.html,5375,2017-12-15,
Nine in 10 adults think buying latest smartphone is ‘waste of money’,83452,0.76,j8k1jb,https://www.independent.co.uk/life-style/gadgets-and-tech/latest-smartphone-iphone-mobile-waste-of-money-report-b837371.html,5323,2020-10-10,
FCC admits it was never actually hacked.,83042,0.92,955aty,https://techcrunch.com/2018/08/06/fcc-admits-it-was-never-actually-hacked/,2678,2018-8-7,
California just passed a major privacy law that will make it harder for Facebook and Google to track people and gather data,82515,0.78,jo29e3,https://www.businessinsider.com/prop-24-privacy-california-data-tracking-facebook-google-2020-11,1016,2020-11-5,
Stephen Hawking has passed away at 76 years old,81953,0.85,84af02,https://news.sky.com/story/scientist-stephen-hawking-has-died-aged-76-11289119,827,2018-3-14,
FCC Plan To Use Thanksgiving To 'Hide' Its Attack On Net Neutrality Vastly Underestimates The Looming Backlash,80979,0.92,7ehli9,https://www.techdirt.com/articles/20171120/11253438653/fcc-plan-to-use-thanksgiving-to-hide-attack-net-neutrality-vastly-underestimates-looming-backlash.shtml,2532,2017-11-21,
Steve Bannon Caught Running Facebook Misinformation Network,80498,0.84,jrtlqr,https://gizmodo.com/steve-bannon-caught-running-a-network-of-misinformation-1845633004,2221,2020-11-11,
Mark Zuckerberg Loses $7 Billion as Companies Boycott Facebook Ads,80343,0.86,hgnngp,https://www.bloomberg.com/news/articles/2020-06-27/mark-zuckerberg-loses-7-billion-as-companies-drop-facebook-ads,3370,2020-6-27,
FCC Has Reportedly Been Using Dead People’s Social Media Accounts To Spread Propaganda: The FCC might be making pro-repeal comments on your or even your dead relatives' behalf.,79963,0.84,7kefi0,https://www.inquisitr.com/4685704/fcc-has-reportedly-been-using-dead-peoples-social-media-accounts-to-spread-propaganda/,2519,2017-12-17,
"FCC Releases Net Neutrality Killing Order, Hopes You're Too Busy Cooking Turkey To Read It",79892,0.89,7f2r7k,https://www.techdirt.com/articles/20171122/09473038669/fcc-releases-net-neutrality-killing-order-hopes-youre-too-busy-cooking-turkey-to-read-it.shtml,2597,2017-11-24,
"Talkspace CEO says he’s pulling out of six-figure deal with Facebook, won’t support a platform that incites ‘racism, violence and lies’",79711,0.85,gurezn,https://www.cnbc.com/2020/06/01/talkspace-pulls-out-of-deal-with-facebook-over-violent-trump-posts.html,2313,2020-6-2,
"Netflix comes out for net neutrality, tells FCC 'We will see you in court'.",79293,0.88,7odw1g,https://www.thewrap.com/netflix-comes-out-in-support-for-net-neutrality-tells-fcc-we-will-see-you-in-court/,1935,2018-1-6,
A Facebook software engineer publicly resigned in protest over the social network's 'propagation of weaponized hatred',78771,0.86,gvd6fk,https://www.businessinsider.com/facebook-engineer-resigns-trump-shooting-post-2020-6,2202,2020-6-3,
The new chairman of the FCC was a top lawyer at Verizon. Now he's calling for a vote to kill net neutrality. We’re protesting at retail stores across the U.S. to demand that Congress stop Verizon’s FCC from destroying the Internet as we know it.,78492,0.9,7ei4v9,http://www.verizonprotests.com,1257,2017-11-21,
"Medical company threatens to sue volunteers that 3D-printed valves for life-saving coronavirus treatments - The valve typically costs about $11,000 — the volunteers made them for about $1",78305,0.92,fkorbz,https://www.theverge.com/2020/3/17/21184308/coronavirus-italy-medical-company-threatens-sue-3d-print-valves-treatments,1722,2020-3-18,
Mitch McConnell is pushing the Senate to pass a law that would let the FBI collect Americans' web browsing history without a warrant,77490,0.91,gj70me,https://www.businessinsider.com/mcconnell-patriot-act-renewal-fbi-web-browsing-history-2020-5,3330,2020-5-14,
AT&T fined $60 million for throttling ‘unlimited’ data plans.,77412,0.96,ds2rsq,https://www.theverge.com/2019/11/5/20949850/att-fine-unlimited-data-plan-fake-throttling,3158,2019-11-6,
"Ajit Pai calls California’s net neutrality rules “illegal” - California senator replies: The rules are ""necessary and legal because Chairman Pai abdicated his responsibility to ensure an open Internet""",77261,0.87,9gobal,https://arstechnica.com/tech-policy/2018/09/ajit-pai-calls-californias-net-neutrality-rules-illegal/,2549,2018-9-18,
Congress introduces ‘Save the Internet Act’ to overturn Ajit Pai’s disastrous net neutrality repeal and help keep the Internet 🔥,76782,0.82,ay0vwy,https://www.fightforthefuture.org/news/2019-03-06-congress-introduces-save-the-internet-act-to/,2400,2019-3-7,
The FCC is expected to announce a vote to gut net neutrality rules the day before Thanksgiving. This could be the last chance for Internet users to make their voices heard.,76615,0.91,7779es,https://www.reddit.com/r/technology/comments/7779es/the_fcc_is_expected_to_announce_a_vote_to_gut_net/,3240,2017-10-18,"Hey reddit, I wanted to give everyone a heads up that Ajit Pai, former Verizon lawyer and current chairman of the FCC, is expected to circulate the text of his rule and announce a vote to gut net neutrality protections on November 22, the day before Thanksgiving.

**[That means these next few weeks could be our last chance to speak out to defend net neutrality. You can use this tool to call your lawmakers.](https://www.battleforthenet.com)**

Once the FCC announces a vote (which would likely be at its open meeting in December), it will become much, much harder to stop them from gutting the rules that prevent companies like Comcast, Verizon, and AT&T from charging us all extra fees to access sites like reddit, and controlling what we see and do online by throttling, blocking, and censoring websites, apps, games, and streaming services. 

The good news is that we are hearing from people who are meeting with Congress that there are key lawmakers who are sympathetic to the cause, and considering stepping in to slow down the FCC. **But they need to be getting a lot more phone calls from constituents in order to act.**

The groups behind the big Net Neutrality [day of action](https://www.battleforthenet.com/july12) that happened back on July 12 are calling on all Internet users, websites, apps, subreddits, and online communities to do everything they can to drive as many phone calls to Congress as possible between now and November 22. 

**There's an easy click-to-call tool set up at https://www.battleforthenet.com**

**We have ready-made banners, modals, and graphics of various sizes here: https://www.battleforthenet.com/#join**

Our best shot at saving net neutrality is if we can get phones ringing off the hook in Washington, DC right NOW. It's a long shot, but it's our best shot. Please spread the word, and message me if you want to learn more or get involved. "
"After Years Of Claiming It Doesn't Use Facial Recognition Software, The LAPD Admits It Has Used It 30,000 Times Since 2009",76398,0.95,j6ojep,https://www.techdirt.com/articles/20200927/11441345393/after-years-claiming-it-doesnt-use-facial-recognition-software-lapd-admits-it-has-used-it-30000-times-since-2009.shtml,1677,2020-10-7,
Group of 27 Dem senators calls on FCC to delay net neutrality vote,76099,0.88,7hib60,http://thehill.com/policy/technology/363110-group-of-senators-calls-on-fcc-to-delay-net-neutrality-vote,3414,2017-12-5,
Two Separate Studies Show That The Vast Majority Of People Who Said They Support Ajit Pai's Plan... Were Fake,75584,0.85,7jzgnn,https://www.techdirt.com/articles/20171214/09383738811/two-separate-studies-show-that-vast-majority-people-who-said-they-support-ajit-pais-plan-were-fake.shtml,2868,2017-12-15,
Facebook boycott gains momentum,75399,0.89,heyt73,https://thehill.com/policy/technology/504225-facebook-boycott-gains-momentum,3833,2020-6-24,
Facebook responsible for 94% of 69 million child sex abuse images reported by US tech firms,75184,0.79,j95zzj,https://news.sky.com/story/facebook-responsible-for-94-of-69-million-child-sex-abuse-images-reported-by-us-tech-firms-12101357,2373,2020-10-11,
"I know you’re tired of hearing about net neutrality. I’m tired of writing about it. But the Senate is about to vote, and it’s time to pay attention",74763,0.8,8h7ms2,https://medium.com/@fightfortheftr/i-know-youre-tired-of-hearing-about-net-neutrality-ba2ef1c51939,1739,2018-5-5,
Twitter Pulls Down Trump Campaign Video About George Floyd’s Death Over Copyright-Infringement Claim,74549,0.87,gx23bu,https://variety.com/2020/digital/news/twitter-trump-copyright-infringement-george-floyd-video-1234625976/,2545,2020-6-5,
New York attorney general slams the FCC for 'refusal to assist' investigation into fake comments about net neutrality,74349,0.89,7ffcsk,https://www.cnbc.com/2017/11/22/n-y-attorney-general-slams-the-fcc-over-net-neutrality-investigation.html,1640,2017-11-25,
"Due to excessive lobbying from FPL, Florida residents without power due to the hurricane are not permitted to use their own solar panels",74248,0.86,70ni9a,http://www.miaminewtimes.com/news/miami-frustrated-with-fpl-after-hurricane-irma-9666311,5310,2017-9-17,
Musician uses algorithm to generate 'every melody that's ever existed and ever can exist' in bid to end absurd copyright lawsuits,73710,0.93,fbsf7o,https://www.independent.co.uk/life-style/gadgets-and-tech/news/music-copyright-algorithm-lawsuit-damien-riehl-a9364536.html,1656,2020-3-1,
49% Facebook Employees Don’t Believe It Had Positive Impact On World,72233,0.9,jodpse,https://fossbytes.com/49-facebook-employees-disagree-that-it-has-positive-impact-on-world/,1955,2020-11-5,
