title,score,upv_ratio,id,url,comms_num,created,body
Hackers Leak Thousands of Coronavirus Research Papers,2866,0.94,g1kmbc,https://www.freethink.com/videos/coronavirus-research,181,2020-4-15,
"PayPal to offer Bitcoin, Ripple (XRP) and others to 346 million customers",2849,0.97,jfcysk,https://www.crypto-news-flash.com/breaking-paypal-to-offer-bitcoin-ethereum-iota-and-others-to-326-million-customers/,158,2020-10-21,
House votes to reinstate Obama-era net neutrality rules,2853,0.97,bbquwb,https://thehill.com/homenews/house/438100-house-votes-to-reinstate-obama-era-net-neutrality-rules,96,2019-4-11,
Robot boat completes three-week Atlantic mission,2831,0.99,iaoq79,https://www.bbc.co.uk/news/science-environment-53787546,82,2020-8-16,
Drone delivers wine to couple on quarantined coronavirus cruise ship,2835,0.98,f1i2nw,https://dronedj.com/2020/02/09/drone-delivers-wine-couple-quarantined-coronavirus-cruise-ship/,143,2020-2-10,
"No cookie consent walls — and no, scrolling isn’t consent, says EU data protection body",2821,0.99,gelphv,https://techcrunch.com/2020/05/06/no-cookie-consent-walls-and-no-scrolling-isnt-consent-says-eu-data-protection-body/,183,2020-5-6,
"Folding@Home Now More Powerful Than World's Top 7 Supercomputers, Combined",2794,0.98,fn4cf9,https://www.tomshardware.com/news/folding-at-home-worlds-top-supercomputers-coronavirus-covid-19,181,2020-3-23,
Twitter beefs up security for US election candidates,2791,0.98,iwan9a,https://www.bbc.com/news/technology-54204827,56,2020-9-20,
Experiment finds that gravity still works down to 50 micrometers,2784,0.98,fw7qrn,https://arstechnica.com/science/2020/04/gravitys-inverse-square-law-tested-at-scale-of-a-human-hair-and-passes/,186,2020-4-7,
Indian Government bans PUBG.,2785,0.96,il5oxq,https://www.hindustantimes.com/india-news/govt-bans-118-more-mobile-apps-including-pubg/story-BJqtksETjNxMLJbBLrodPP.html,229,2020-9-2,
Harvard created a wool-like 3D-printable material that can shape shift,2774,0.98,imov8b,https://www.engadget.com/harvard-programmable-material-3d-printed-183939765.html,113,2020-9-5,
"AI Could Overtake Humans in 5 Years, Says Elon Musk, Whose 'Top Concern' is Google-Owned DeepMind",2768,0.82,i01ggh,https://www.ibtimes.sg/ai-could-overtake-humans-5-years-says-elon-musk-whose-top-concern-google-owned-deepmind-49250,771,2020-7-29,
Bing loses out to DuckDuckGo in Google’s new Android search engine ballot,2763,0.98,ema9ip,https://www.theverge.com/2020/1/9/21058120/google-android-search-engine-choice-duckduckgo-bing-default-eu-antitrust-ruling,174,2020-1-9,
We are nearing ‘longevity escape velocity’ — where science can extend your life for more than a year for every year you are alive,2756,0.94,f95usj,https://www.marketwatch.com/story/we-are-nearing-longevity-escape-velocity-where-science-can-extend-your-life-for-more-than-a-year-for-every-year-you-are-alive-2020-02-24,373,2020-2-25,
"Using AI, people who are blind are able to find familiar faces in a room",2739,0.98,evn4rg,https://news.microsoft.com/innovation-stories/project-tokyo/,40,2020-1-29,
NASA fixes Hubble gyroscope by turning it off and on again,2733,0.97,9r27tl,https://www.engadget.com/2018/10/24/nasa-hubble-gyroscope-fix/,139,2018-10-25,
Google to auto-delete users' records by default,2726,0.99,hfjw1m,https://www.bbc.com/news/technology-53165566,125,2020-6-25,
Lunar Crater Radio Telescope (LCRT) on the Far-Side of the Moon,2731,0.99,fyv6s6,https://www.nasa.gov/directorates/spacetech/niac/2020_Phase_I_Phase_II/lunar_crater_radio_telescope,234,2020-4-11,
Washington aims Clean Network program directly at stopping China and Huawei,2725,0.97,i5wh5u,https://www.zdnet.com/article/washington-aims-clean-network-program-directly-at-stopping-china-and-huawei/,201,2020-8-8,
First-ever photo proof of powerful jet emerging from colliding galaxies,2723,0.98,fyirx9,https://phys.org/news/2020-04-first-ever-photo-proof-powerful-jet.html,185,2020-4-11,
"In Race for a Coronavirus Vaccine, an Oxford Group Leaps Ahead",2724,0.97,g97ab9,https://www.nytimes.com/2020/04/27/world/europe/coronavirus-vaccine-update-oxford.html,220,2020-4-28,
Facebook bans face mask ads to curb coronavirus exploitation,2721,0.97,ffihgo,https://www.cnet.com/news/facebook-bans-face-mask-ads-to-curb-coronavirus-exploitation/,129,2020-3-9,
YouTube rejects about 78% of appeals to get removed videos put back up,2708,0.98,fb2gy5,https://www.cnet.com/news/youtube-creators-about-78-percent-of-their-appeals-to-get-removed-videos-reinstated/,100,2020-2-29,
Publishers worry as ebooks fly off libraries’ virtual shelves - Checkouts of digital books from a popular service are up 52% since March.,2705,0.97,j4faer,https://www.wired.com/story/publishers-worry-ebooks-libraries-virtual-shelves/,160,2020-10-3,
A falling rocket booster just completely flattened a building in China,2690,0.98,e323id,https://www.technologyreview.com/s/614769/a-falling-rocket-booster-just-completely-flattened-a-building-in-china/,179,2019-11-29,
"Twitter bans 32k accounts pushing Chinese, Russian, and Turkish propaganda",2659,0.98,h7ftqc,https://www.zdnet.com/article/twitter-bans-32k-accounts-pushing-chinese-russian-and-turkish-propaganda/,64,2020-6-12,
Facebook moderators break their NDAs to expose desperate working conditions,2645,0.98,cw2alb,https://www.theverge.com/2019/6/19/18681845/facebook-moderator-interviews-video-trauma-ptsd-cognizant-tampa,224,2019-8-27,
New Orleans declares state of emergency following ransomware attack,2640,0.98,eaztvh,https://techcrunch.com/2019/12/14/new-orleans-declares-state-of-emergency-following-ransomware-attack/,153,2019-12-15,
NASA is suspending development of its future deep-space rocket during coronavirus pandemic,2630,0.99,flxoz5,https://www.theverge.com/2020/3/20/21187671/nasa-space-launch-system-rocket-development-testing-shutdown-coronavirus,98,2020-3-21,
"In a landmark decision, FDA greenlights a video game for kids with ADHD",2615,0.98,hagblr,https://www.statnews.com/2020/06/15/fda-akili-adhd-endeavorrx/,140,2020-6-17,
College backlash against facial-recognition technology grows,2610,0.99,fajwar,https://fortune.com/2020/02/27/college-facial-recognition-technology-backlash/,96,2020-2-28,
The California Consumer Privacy Act officially takes effect today,2594,0.99,eiirnd,https://techcrunch.com/2020/01/01/the-california-consumer-privacy-act-officially-takes-effect-today/,160,2020-1-1,
YouTuber turns the GameCube Switch Joy-Cons of our dreams into reality,2599,0.96,eq7umw,https://www.theverge.com/circuitbreaker/2020/1/17/21070865/youtuber-shank-mod-gamecube-switch-joy-cons-concept-reality-hardware-custom-smash-bros,62,2020-1-18,
Twitter is rolling out Tweet Scheduling Feature,2576,0.96,gggnc2,https://wiraltech.com/twitter-is-rolling-out-tweet-scheduling-feature/,125,2020-5-9,
"New technique increases 3-D printing speed by 1,000 to 10,000 times",2582,0.99,ee44hs,https://phys.org/news/2019-12-technique-d.html,54,2019-12-22,
Apple now accepts Mac trade-ins in its US stores,2566,0.98,hbz7wb,https://www.theverge.com/2020/6/19/21295389/apple-now-accepts-mac-trade-ins-in-its-us-stores,179,2020-6-19,
'They are trying to steal everything.' US coronavirus response hit by foreign hackers,2552,0.96,g8d4nz,https://www.cnn.com/2020/04/25/politics/us-china-cyberattacks-coronavirus-research/index.html,250,2020-4-26,
PayPal to acquire shopping and rewards platform Honey for $4B,2546,0.98,dzhkgo,https://techcrunch.com/2019/11/20/paypal-to-acquire-shopping-and-rewards-platform-honey-for-4-billion/,145,2019-11-21,
"Anti-solar panel can generate electricity at night, researchers say",2538,0.87,f1ezab,https://www.inverse.com/innovation/researchers-have-a-counterintuitive-concept-for-solar-panels-that-work-at-night,150,2020-2-10,
Google just published 25 million free datasets,2536,0.95,eton89,https://towardsdatascience.com/google-just-published-25-million-free-datasets-d83940e24284,88,2020-1-25,
Trump's crackdown on H1-B visas may benefit Indian outsourcing firms,2530,0.97,j60x5k,https://www.nytimes.com/2020/10/02/technology/trump-india-hib-visas.html,243,2020-10-6,
Elon Musk has two Las Vegas casinos asking for Boring Company tunnels,2531,0.97,h8be3l,https://www.theverge.com/2020/6/12/21285741/elon-musk-boring-company-las-vegas-wynn-encore-resorts-world-casinos,133,2020-6-14,
Video games aren't corrupting young minds — they may be building them,2520,0.96,bwo8sc,https://www.cbc.ca/radio/quirks/june-1-the-benefits-of-video-games-composting-corpses-brewing-ancient-beer-and-more-1.5155492/video-games-aren-t-corrupting-young-minds-they-may-be-building-them-1.5155505,165,2019-6-4,
Swoop Aero remotely piloting drones with critical medical supplies for African villages | ZDNet,2504,0.98,fpx0gs,https://www.zdnet.com/article/swoop-aero-remotely-piloting-drones-with-critical-medical-supplies-for-african-villages/,44,2020-3-27,
California student's lawsuit accuses TikTok of sharing data with China,2505,0.98,e5jf7a,https://thehill.com/policy/technology/472779-california-students-lawsuit-accuses-tiktok-of-sharing-data-with-china,111,2019-12-4,
Lyft Pledges All-Electric Fleet By 2030,2499,0.96,hayi6z,https://www.thetechie.de/2020/06/lyft-pledges-all-electric-fleet-by-2030.html,148,2020-6-18,
Facebook to ban ads that discourage vaccines,2497,0.98,jaj8hp,https://www.aljazeera.com/news/2020/10/13/facebook-to-ban-ads-that-discourage-vaccines,56,2020-10-14,
Disney Plus Crack Down On VPN Services,2487,0.93,e1h420,https://www.screenbinge.com/news/disney-plus-vpn-issue/,565,2019-11-25,
Mark Zuckerberg struggles to explain why Breitbart belongs on Facebook News,2487,0.93,dnh6ky,https://www.theverge.com/2019/10/25/20932653/facebook-news-breitbart-mark-zuckerberg-statement-bias,450,2019-10-27,
Google parent Alphabet is now a $1 trillion company,2476,0.96,eqncg7,https://www.theverge.com/2020/1/16/21069458/google-alphabet-trillion-dollar-market-cap-apple-microsoft,204,2020-1-19,
Elon Musk sends a tweet through SpaceX's Starlink broadband satellite,2476,0.97,dm5tz3,https://www.cnet.com/news/elon-musk-sends-a-tweet-through-spacexs-starlink-broadband-satellite/,95,2019-10-24,
Motorola Wins $765 Million Over Theft by Chinese Radio Rival,2467,0.98,f479kp,https://www.bloomberg.com/news/articles/2020-02-14/motorola-solutions-wins-764-6-million-in-trial-against-hytera,106,2020-2-15,
"Backdoors won't weaken your encryption, wails FBI boss. And he's right. They won't – they'll fscking torpedo it",2451,0.97,ci48ai,https://www.theregister.co.uk/2019/07/25/encryption_fbi_boss/,130,2019-7-26,
Gigantic Chinese telescope opens to astronomers worldwide,2447,0.97,d8t7sx,https://www.nature.com/articles/d41586-019-02790-3,187,2019-9-25,
"With Jerusalem locked down, holy site pilgrims turn to virtual reality",2444,0.97,g45ne5,https://www.timesofisrael.com/with-jerusalem-locked-down-holy-site-pilgrims-turn-to-virtual-reality/,108,2020-4-19,
NASA’s Next Mars Rover Will Carry a Tiny Helicopter,2438,0.99,hgc613,https://spectrum.ieee.org/aerospace/robotic-exploration/nasas-next-mars-rover-will-carry-a-tiny-helicopter,142,2020-6-27,
Elon Musk’s Boring Company lands $48.7M contract for underground “people mover” in Las Vegas – TechCrunch,2436,0.97,bs11tj,https://techcrunch.com/2019/05/22/elon-musks-boring-company-lands-48-7m-contract-for-underground-people-mover-in-las-vegas/,194,2019-5-23,
Laser Destroys Cancer Cells Circulating in the Blood,2427,0.99,c018nu,https://spectrum.ieee.org/the-human-os/biomedical/diagnostics/laser-destroys-cancer-cells-circulating-in-the-blood,84,2019-6-13,
Special Paint Could Cut Emissions By Cooling Buildings,2415,0.99,jfu1vw,https://reterraform.com/special-paint-could-cut-emissions-by-cooling-buildings/,51,2020-10-22,
"It's 2019, and one third of businesses still have active Windows XP deployments",2410,0.98,cjza4s,https://www.techrepublic.com/article/its-2019-and-one-third-of-businesses-still-have-active-windows-xp-deployments/,223,2019-7-31,
China is now blocking all encrypted HTTPS traffic that uses TLS 1.3 and ESNI,2415,0.97,i6qnqk,https://www.zdnet.com/google-amp/article/china-is-now-blocking-all-encrypted-https-traffic-using-tls-1-3-and-esni/,135,2020-8-10,
"Before Clearview Became a Police Tool, It Was a Secret Plaything of the Rich",2408,0.96,fi3gfj,https://www.nytimes.com/2020/03/05/technology/clearview-investors.html,142,2020-3-14,
AI algorithms are puzzled by our online behavior during the coronavirus pandemic,2406,0.98,gs4a7i,https://thenextweb.com/neural/2020/05/28/ai-algorithms-are-puzzled-by-our-online-behavior-during-the-coronavirus-pandemic-syndication/,91,2020-5-28,
"Apple sues recycling firm for stealing and reselling 100,000 iPhones, iPads and Watches",2405,0.96,j5eglj,https://www.theverge.com/apple/2020/10/4/21499422/apple-sues-recycling-company-reselling-ipods-ipads-watches,158,2020-10-5,
Google employee breaks record for calculating pi,2396,0.95,b1c8od,https://www.businessinsider.com/google-employee-woman-breaks-record-for-calculating-pi-2019-3?r=US&IR=T,195,2019-3-15,
NASA telescope captured the most detailed images of the Sun ever taken,2390,0.99,exgzm0,https://interstellarspecies.blogspot.com/2020/02/nasa-telescope-captured-most-detailed.html,119,2020-2-2,
Facebook takes EU to court over employees' private information,2384,0.97,hzcfcv,https://www.telegraph.co.uk/technology/2020/07/27/facebook-takes-eu-court-stop-taking-employees-private-information/,94,2020-7-28,
"Chrome to block intrusive video ads starting August 5, 2020",2381,0.99,ezjget,https://www.zdnet.com/article/chrome-to-block-intrusive-video-ads-starting-august-5-2020/,116,2020-2-6,
Osso VR raises $14 million to bring virtual reality to surgical and medical device training – TechCrunch,2383,0.98,ixoemw,https://techcrunch.com/2020/09/21/osso-vr-raises-14-million-to-bring-virtual-reality-to-surgical-and-medical-device-training/,22,2020-9-22,
"Hackers, farmers, and doctors unite! Support for Right to Repair laws slowly grows",2369,0.99,c2vd2k,https://arstechnica.com/gadgets/2019/06/hackers-farmers-and-doctors-unite-support-for-right-to-repair-laws-slowly-grows/,63,2019-6-20,
Almost half of Indian startups don’t hire women to save on maternity costs,2368,0.97,fftm7f,https://thenextweb.com/growth-quarters/2020/03/09/almost-half-of-indian-startups-dont-hire-women-to-save-on-maternity-costs/,259,2020-3-9,
Suspected Internet Cable Spy Ship Operating In Americas For Over A Month,2364,0.98,e4zmcg,https://www.forbes.com/sites/hisutton/2019/12/01/suspected-internet-cable-spy-ship-operating-in-americas/#4bb116f032ae,174,2019-12-2,
Microsoft to build hub for cloud services in Greece,2352,0.97,j5jp30,https://www.reuters.com/article/us-greece-microsoft/microsoft-to-build-hub-for-cloud-services-in-greece-idUSKBN26Q155,45,2020-10-5,
Honeywell says it has the world's fastest quantum computer,2354,0.98,hdhhib,https://www.newserector.com/honeywell-says-it-has-the-worlds-fastest-quantum-computer,224,2020-6-22,
PlayStation 4 was the best-selling hardware of the decade,2346,0.97,epw9iy,https://venturebeat.com/2020/01/16/ps4-hardware-of-the-decade/,213,2020-1-17,
"Spectrum Kills Home Security Business, Refuses Refunds for Owners of Now-Worthless Equipment",2333,0.98,enabdc,https://gizmodo.com/spectrum-kills-home-security-business-refuses-refunds-1840931761,218,2020-1-12,
Nvidia’s RTX 3080 and 3090 graphics cards are leaked with pics and reported specs,2329,0.97,ijdo1y,https://www.techradar.com/uk/news/nvidias-rtx-3080-and-3090-graphics-cards-are-leaked-with-pics-and-reported-specs,306,2020-8-30,
Brexit-backer Arron Banks sees his Twitter account hacked - with private messages leaked | Science & Tech News,2324,0.97,dz1iv9,https://news.sky.com/story/brexit-backer-arron-banks-sees-his-twitter-account-hacked-with-private-messages-leaked-11865045,133,2019-11-20,
Judge Approves T-Mobile Merger With Sprint,2313,0.96,f29fxd,https://www.nytimes.com/2020/02/11/business/media/t-mobile-sprint-merger.html,330,2020-2-11,
Elon Musk threatens to pull Tesla operations out of California and into Texas or Nevada,2316,0.94,ggsmg0,https://techcrunch.com/2020/05/09/elon-musk-threatens-to-pull-tesla-operations-out-of-california/,683,2020-5-10,
Amazon's Jeff Bezos called to testify before House antitrust panel,2306,0.98,gbz9gn,https://www.nbcnews.com/business/business-news/amazon-s-jeff-bezos-called-testify-house-antitrust-panel-n1197751,209,2020-5-2,
"Bot orders $18,752 of McSundaes every 30 min. to find if machines are working - Know before you go... drive-through milkshake style.",2302,0.97,jhbh5e,https://arstechnica.com/information-technology/2020/10/is-mcdonalds-ice-cream-machine-working-near-you-theres-a-bot-for-that/,146,2020-10-25,
TikTok CEO Kevin Mayer quits following Trump's threat to ban the app,2303,0.97,ihf446,https://www.cnn.com/2020/08/27/tech/tiktok-kevin-mayer-quits-hnk-intl/index.html,214,2020-8-27,
The Number of People Without Broadband Is Double the Government Estimate,2293,0.98,f1t5p3,https://www.pcmag.com/news/people-without-broadband-is-double-the-government-estimate,88,2020-2-11,
Apple reportedly steps up effort to build Google search alternative,2280,0.98,jk8ido,https://www.cnbc.com/2020/10/28/apple-steps-up-effort-to-build-google-search-alternative.html,234,2020-10-29,
Clearview AI has billions of our photos. Its entire client list was just stolen,2278,0.98,fdhu8u,https://edition.cnn.com/2020/02/26/tech/clearview-ai-hack/index.html,145,2020-3-5,
"Chrome will block annoying, spammy ads globally starting July 9",2271,0.98,aejc6h,https://www.cnet.com/news/chrome-will-block-intrusive-ads-globally-starting-july-9/,148,2019-1-10,
Facebook dating app controversy disrupts Zuckerberg’s upcoming trip to woo Europeans,2275,0.96,f3aaj3,https://venturebeat.com/2020/02/13/facebook-dating-app-controversy-disrupts-zuckerbergs-upcoming-trip-to-woo-europeans/,180,2020-2-13,
Scientists create contact lenses that zoom when you blink twice,2273,0.99,cj54rw,https://www.cnet.com/news/scientists-create-contact-lenses-that-zoom-when-you-blink-twice/,217,2019-7-29,
Department of Justice is attempting to force Google to sell their Chrome browser in antitrust case,2268,0.96,jaq0na,https://www.androidpolice.com/2020/10/13/google-could-be-forced-to-sell-chrome-if-the-justice-department-gets-its-way/,291,2020-10-14,
Pentagon says Microsoft still deserves $10 billion JEDI cloud contract,2237,0.98,io6v37,https://www.engadget.com/pentagon-microsoft-dod-jedi-defense-094536689.html,166,2020-9-7,
New Russian weapon can travel 27 times the speed of sound,2230,0.96,egn54l,https://apnews.com/597e7f2b20b21af959e4c6983b255c37,384,2019-12-28,
The world's largest offshore wind farm is nearly complete. It can power 1 million homes,2227,0.98,d95alo,https://www.cnn.com/2019/09/25/business/worlds-largest-wind-farm/index.html,102,2019-9-25,
Elon Musk’s Tunnel Under Las Vegas for Self-Driving Cars Is Almost Complete,2219,0.89,iuqkoa,https://observer.com/2020/09/elon-musk-boring-company-tunnel-las-vegas-near-completion/,206,2020-9-18,
FTC hits Facebook with $5 billion fine and new privacy checks,2219,0.98,ch7wu6,https://www.theverge.com/2019/7/24/20707013/ftc-facebook-settlement-data-cambridge-analytica-penalty-privacy-punishment-5-billion,163,2019-7-24,
Greyparrot bags $2.2M seed to scale its AI for waste management,2212,0.93,gsusd0,https://techcrunch.com/2020/05/28/greyparrot-bags-2-2m-seed-to-scale-its-ai-for-waste-management/,98,2020-5-29,
US sanctions China’s biggest chipmaker,2208,0.95,j07q7i,https://www.ft.com/content/7325dcea-e327-4054-9b24-7a12a6a2cac6,132,2020-9-26,
"Coronavirus is slowing LCD production, and TV and monitor prices are expected to climb as a result",2200,0.94,exsdbe,https://www.pcworld.com/article/3518889/coronavirus-is-slowing-lcd-production-and-tv-and-monitor-prices-are-expected-to-climb.html,198,2020-2-3,
"Oracle's New Supercomputer Has 1,060 Raspberry Pis",2199,0.97,d5zz20,"https://www.tomshardware.com/news/oracle-raspberry-pi-supercomputer,40412.html",135,2019-9-19,
Uber argues 'fraud' absolves it from paying star engineer's $179M fine to Google,2194,0.97,g5ai6i,https://www.yahoo.com/news/uber-argues-fraud-absolves-paying-211058355.html,59,2020-4-21,
Siren raises $11.8M for its limb-saving smart socks,2182,0.98,grrn7l,https://techcrunch.com/2020/05/27/siren-raises-11-8m-for-its-limb-saving-smart-socks/,75,2020-5-28,
AI Trained on Old Scientific Papers Makes Discoveries Humans Missed,2186,0.98,cbgty2,https://www.vice.com/en_us/article/neagpb/ai-trained-on-old-scientific-papers-makes-discoveries-humans-missed,181,2019-7-10,
Chevrolet readies an electric crate motor for homebuilt EV hotrods,2178,0.99,jkb0wh,https://arstechnica.com/cars/2020/10/chevrolet-readies-an-electric-crate-motor-for-homebuilt-ev-hotrods/,139,2020-10-29,
Amputee can feel objects again with prosthetic arm inspired by Luke Skywalker,2176,0.98,ciwq4w,https://www.cnn.com/2019/07/25/health/luke-skywalker-prosthetic-arm-scn-trnd/index.html,48,2019-7-28,
"Tesla's next factory is going to be in Austin, Texas and it's going to happen quickly",2169,0.94,gkfjei,https://electrek.co/2020/05/15/tesla-factory-austin-texas/,463,2020-5-16,
Google Search prepares for better package tracking integration,2167,0.97,e6vjx9,https://news.google.com/articles/CAIiENqUe9MjGzKHyX9AXIrFJaUqFwgEKg4IACoGCAowu5gUMNLMAjCg7LUG?hl=en-US&gl=US&ceid=US%3Aen,75,2019-12-6,
Ring Mailbox Sensor: Amazon quietly introduces mail surveillance. The $30 Mailbox Sensor snuck in with Ring's other news on an under-the-radar announcement page.,2139,0.97,j0rsy4,https://www.cnet.com/news/amazon-ring-mailbox-sensor-announced-quietly-amazon-sidewalk/,162,2020-9-27,
14-Year-Old Genius Solves Car Blind Spots,2134,0.87,ds11w8,https://gizmodo.com/14-year-old-genius-solves-blind-spots-1839540078,217,2019-11-5,
Mother finds fake Facebook ad claiming her family died from coronavirus,2132,0.98,g2bcg0,https://www.13abc.com/content/news/Mother-finds-fake-Facebook-ad-claiming-her-family-died-from-coronavirus-569652591.html,109,2020-4-16,
Facebook warns Apple's iOS 14 could shave more than 50% from Audience Network revenue,2130,0.98,ihh09x,https://www.cnbc.com/2020/08/26/facebook-apple-ios-14-could-cut-audience-network-revenue-in-half.html,147,2020-8-27,
FTC Head Says He's Willing to Break Up Big Tech,2115,0.97,cpz7z0,https://www.bloomberg.com/news/articles/2019-08-13/ftc-chief-says-willing-to-break-up-companies-amid-big-tech-probe,169,2019-8-14,
"UN backs Russia on internet convention, alarming rights advocates",2113,0.97,egyrvr,https://news.yahoo.com/un-backs-russia-internet-convention-alarming-rights-advocates-011310327.html,123,2019-12-29,
"In world first, Japan's Hayabusa2 probe collects samples from distant asteroid after second successful touchdown",2105,0.99,cbvwk4,https://www.japantimes.co.jp/news/2019/07/11/national/science-health/japans-hayabusa2-probe-makes-second-touchdown-distant-asteroid/#.XSaxrZNKi9s,68,2019-7-11,
Australia targeted by 'state-based' cyber attacks,2102,0.98,hbwwhl,https://www.bbc.com/news/world-australia-46096768,68,2020-6-19,
Cluster of 295 Chrome extensions caught hijacking Google and Bing search results,2102,0.99,i411h6,https://www.zdnet.com/article/cluster-of-295-chrome-extensions-caught-hijacking-google-and-bing-search-results/#ftag=RSSbaffb68,137,2020-8-5,
"SpaceX launches, destroys rocket in astronaut escape test",2094,0.96,er1lwd,https://apnews.com/53ad7f87533f9a1de5e59e413367b689,80,2020-1-20,
Boeing spacecraft lands safely despite wrongly set clock that shortened mission | Science & Tech News,2096,0.99,ef3dsf,https://news.sky.com/story/boeing-spacecraft-lands-safely-despite-wrongly-set-clock-that-shortened-mission-11893735,96,2019-12-25,
Experts warn of 'mass violation of rights' as contact-tracing data collected in pubs sold on,2087,0.97,j9hmzx,https://sg.news.yahoo.com/contact-tracing-data-sold-on-coronavirus-141855189.html,63,2020-10-12,
3D-printing organs moves a few more steps closer to commercialization,2078,0.99,cpc5i0,https://techcrunch.com/2019/08/11/3d-printing-organs-moves-a-few-more-steps-closer-to-commercialization,97,2019-8-12,
Grant Imahara has died at 49,2079,0.97,hqw2zh,https://www.cnn.com/2020/07/14/celebrities/grant-imahara-dead/index.html,48,2020-7-14,
Facebook bowed to a Singapore government order to brand a news post as false,2072,0.96,e4iflm,https://techcrunch.com/2019/11/30/facebook-bowed-to-a-singapore-government-order-to-brand-a-news-post-as-false/,119,2019-12-1,
E Ink demos a folding e-reader that can also take notes,2065,0.98,i72d0u,https://www.theverge.com/2020/8/10/21361545/folding-e-ink-reader-prototype-note-taking,125,2020-8-10,
Intel's Mobileye will test self-driving cars at up to 80 MPH in Germany,2066,0.98,hsuk1t,https://www.engadget.com/mobileye-testing-autonomous-cars-germany-104521486.html,95,2020-7-17,
Toshiba Wraps Up Its Laptop Business,2059,0.98,i6d2vk,https://www.theindianwire.com/business/the-fall-of-a-giant-toshiba-wraps-up-its-laptop-business-281985/,174,2020-8-9,
Fitbit’s ventilator gets emergency FDA approval,2054,0.98,gwfxu2,https://www.theverge.com/2020/6/4/21280132/fitbit-flow-ventilator-coronavirus-shortage-fda-emergency-use-authorization-hospitals,81,2020-6-4,
ISPs Ignore Toothless FCC Demand To Not Kick Users Offline During COVID-19,2050,0.98,g34mrg,https://www.techdirt.com/articles/20200416/08145144311/isps-ignore-toothless-fcc-demand-to-not-kick-users-offline-during-covid-19.shtml,145,2020-4-17,
AT&T shelving DSL may leave hundreds of thousands hanging by a phone line,2037,0.97,j4whb5,https://www.usatoday.com/story/tech/columnist/2020/10/03/att-dsl-internet-digital-subscriber-line-outdated/5880219002/,206,2020-10-4,
Thieves Are Emptying ATMs Using a New Form of Jackpotting,2017,0.98,hwfisf,https://www.wired.com/story/thieves-are-emptying-atms-using-a-new-form-of-jackpotting/,214,2020-7-23,
