title,score,upv_ratio,id,url,comms_num,created,body
Three Men Indicted On Murder Charges For Killing Of Ahmaud Arbery - Ahmaud Arbery’s death and trial has reached global attention and is one of the most recent racially-motivated murder cases to fuel anti-racism protests in the US and abroad,93,0.97,hgsw55,https://muslim.co/three-men-indicted-on-murder-charges-for-killing-of-ahmaud-arbery/,4,2020-6-27,
Dallas salon owner who reopened in defiance of Texas' coronavirus restrictions sentenced to 7 days in jail,91,0.97,geiaup,https://www.usatoday.com/story/news/nation/2020/05/05/coronavirus-dallas-salon-owner-jail-texas-restrictions/5173426002/,58,2020-5-6,
"Trump removes independent watchdog for coronavirus funds, upending oversight panel",92,0.96,fworl3,https://www.politico.com/news/2020/04/07/trump-removes-independent-watchdog-for-coronavirus-funds-upending-oversight-panel-171943,10,2020-4-8,
Paul Ryan: 'You cannot end birthright citizenship with an executive order',93,0.94,9srsmu,https://www.click2houston.com/news/politics/paul-ryan-you-cannot-end-birthright-citizenship-with-an-executive-order,10,2018-10-31,
Multiple victims in shooting at San Bernardino elementary school,93,0.81,64lbh6,https://www.rt.com/usa/384255-san-bernardino-school-shooting/,12,2017-4-11,
Armed man arrested at Charlotte polling site after being banned,91,0.99,jnmt8x,https://www.wect.com/2020/11/03/armed-man-arrested-charlotte-polling-site-after-being-banned/,2,2020-11-4,
"Video surfaces showing Philadelphia police bashing SUV windows, then beating driver while child was in backseat",93,0.99,jl1bse,https://www.inquirer.com/news/philadelphia-police-car-video-west-unrest-child-backseat-20201028.html,13,2020-10-31,
Donald Trump calls for AG Barr to indict Joe Biden with 26 days until election,89,0.95,j7grg8,https://www.newsweek.com/donald-trump-calls-ag-barr-indict-joe-biden-26-days-until-election-1537518,32,2020-10-9,
Voters in North Carolina have received absentee ballot request forms in the mail with Trump's face on them,88,0.96,ib3wx2,https://amp-cnn-com.cdn.ampproject.org/v/s/amp.cnn.com/cnn/2020/08/16/politics/postal-service-trump-absentee-ballot-request-mail-usps/index.html?amp_js_v=a3&amp_gsa=1&usqp=mq331AQFKAGwASA%3D#aoh=15976235589958&referrer=https%3A%2F%2Fwww.google.com&amp_tf=From%20%251%24s&ampshare=https%3A%2F%2Fwww.cnn.com%2F2020%2F08%2F16%2Fpolitics%2Fpostal-service-trump-absentee-ballot-request-mail-usps%2Findex.html,24,2020-8-17,
New ‘wall’ of military veterans protect protesters in Portland,89,0.94,hxtmwf,https://nypost.com/2020/07/25/new-wall-of-military-veterans-protect-protesters-in-portland/,18,2020-7-26,
Trump Admin Scales Back Mandate That Health Insurers Cover COVID Tests,93,0.95,hjlk29,https://talkingpointsmemo.com/muckraker/trump-admin-scales-back-mandate-that-health-insurers-cover-covid-tests,9,2020-7-2,
"Anonymous hacktivists hack and deface United Nations website, leak Jeffery Epstein's Black Book",90,0.97,guf1rf,https://androidrookies.com/anonymous-hacktivists-hack-and-deface-united-nations-website-leak-jeffery-epsteins-black-book/,9,2020-6-1,
Trump deletes tweets after ridicule at rant over 'Noble' prize and 'hambergers',87,0.91,g9s6rj,https://www.independent.co.uk/news/world/americas/us-politics/donald-trump-latest-tweets-noble-prize-hambergers-twitter-a9486716.html,26,2020-4-29,
"Former Wells Fargo CEO wants Americans back to work next month: 'Some may even die, I don't know'",92,0.93,fu7874,https://www.rawstory.com/2020/03/former-wells-fargo-ceo-wants-americans-back-to-work-next-month-some-may-even-die-i-dont-know/,16,2020-4-3,
Trump congratulates wrong state for Kansas City Chiefs' Super Bowl win,89,0.88,ey51e5,https://www.theguardian.com/sport/2020/feb/02/trump-kansas-city-missouri-super-bowl-tweet,44,2020-2-3,
"Postal workers union with 200,000 members endorses Sanders",92,0.92,ew8g3m,https://apnews.com/416a6f217c28d58fb11828bb4e3bf825,13,2020-1-31,
Facial Recognition Bill Would Ban Companies From Sharing Your Face Without Consent,91,0.98,b1g7h9,https://www.nextgov.com/emerging-tech/2019/03/facial-recognition-bill-would-ban-companies-sharing-your-face-without-consent/155590/,2,2019-3-15,
"After Dakota Access CEO gave $10M, Trump pushed secret pipeline permits",89,0.95,j39joh,https://therealnews.com/after-dakota-access-ceo-gave-10m-trump-pushed-secret-pipeline-permits,0,2020-10-1,
"Grand juror sues for release of transcript, permission to speak about Breonna Taylor case",90,0.98,j1omvu,https://www.courier-journal.com/story/news/local/breonna-taylor/2020/09/28/grand-juror-files-suit-seeking-release-transcript-breonna-taylor-case/3568388001/,4,2020-9-29,
"Pa. cop went on $5,500 tire-slashing tirade after being denied booze at restaurant: state police",89,0.98,izidb7,https://www.pennlive.com/crime/2020/09/pa-cop-went-on-5500-tire-slashing-tirade-after-being-denied-booze-at-restaurant-state-police.html,7,2020-9-25,
"Woman sues police department after officers allegedly stomp her stomach, leading to a miscarriage",85,0.94,ix7ror,https://www.newsweek.com/woman-sues-police-department-after-officers-allegedly-stomp-her-stomach-leading-miscarriage-1506688?fbclid=IwAR1hYpg6BY587U4qsPMABBjX5noGYSHDen8AlIHgUGBzoVBVAcWRpz2WtsM,17,2020-9-22,
Fauci says U.S. won't get back to normal until late 2021,87,0.96,iqwiji,https://www.nbcnews.com/health/health-news/fauci-says-us-won-t-get-back-normal-until-late-n1239882,14,2020-9-12,
University of North Carolina reverses plans for in-person classes after 130 students test positive for COVID-19,89,1.0,ibmr3k,https://ktla.com/news/nationworld/some-u-s-universities-that-have-reopened-report-clusters-of-coronavirus-cases/?utm_source=t.co&utm_medium=referral&utm_campaign=socialflow,8,2020-8-18,
A Navy veteran says he was beaten and pepper sprayed by authorities while attending his first protest in Portland,87,0.94,huqelh,https://www.cnn.com/2020/07/20/us/portland-protester-navy-veteran-beaten/index.html,4,2020-7-21,
Judge Who Read Unredacted Mueller Report Has a Spreadsheet Full of Questions for the DOJ to Answer,85,0.97,hn2b5a,https://lawandcrime.com/high-profile/judge-who-read-unredacted-mueller-report-has-a-spreadsheet-full-of-questions-for-the-doj-to-answer/,4,2020-7-8,
"States reverse openings, require masks amid virus resurgence",88,0.99,hie8ya,https://apnews.com/3838b5b207c68546b22f9bd9d62e2e36,7,2020-6-30,
Atlanta mayor: Two police officers fired over excessive use of force during George Floyd protest,86,0.98,guibvj,https://www.usatoday.com/story/news/nation/2020/05/31/george-floyd-protests-2-atlanta-cops-fired-over-use-force/5303292002/,2,2020-6-1,
Trump tweets election fraud conspiracy before marking Veterans Day,87,0.96,jsg8n2,https://www.independent.co.uk/news/world/americas/us-election-2020/trump-election-voter-fraud-veterans-day-b1721125.html,20,2020-11-12,
Fauci says he will take new Pfizer vaccine if FDA approves it,88,0.98,jrudwx,https://www.reuters.com/article/us-health-coronavirus-usa-fauci-idUSKBN27Q2SU,0,2020-11-11,
"L.A. Sheriff's Deputies Assault Reporter, Then Attempt To Mislead Public About It",87,0.95,ith2gy,https://reason.com/2020/09/14/l-a-sheriffs-deputies-assault-reporter-then-attempt-to-mislead-public-about-it/,3,2020-9-16,
Police Tackled and Arrested an NPR Reporter While She Was Doing Her Job,87,0.95,iswcc6,https://www.vice.com/en_us/article/889jk4/police-tackled-and-arrested-an-npr-reporter-to-the-ground-while-she-was-doing-her-job?utm_source=reddit.com,7,2020-9-15,
Mississippi lawmakers move to eliminate Confederate emblem from flag; governor vows to sign bill,86,0.96,hh34d8,https://ktla.com/news/nationworld/mississippi-lawmakers-move-to-eliminate-confederate-emblem-from-flag-governor-vows-to-sign-bill/?taid=5ef7c1da4ce841000146767f&utm_campaign=trueAnthem%3A+Trending+Content&utm_medium=trueAnthem&utm_source=twitter,18,2020-6-28,
"California: Vallejo police kill unarmed 22-year-old, who was on his knees with his hands up | California | The Guardian",87,0.99,gwzach,https://amp.theguardian.com/us-news/2020/jun/04/vallejo-police-kill-unarmed-man-california,6,2020-6-5,
Coronavirus: US will not participate in WHO vaccine project after Trump turned against it,90,0.95,g950gi,https://news.yahoo.com/coronavirus-us-not-participate-vaccine-194339848.html,13,2020-4-28,
14-year-old girl installs cameras to record proof of alleged abuse when no one would believe her,88,0.98,ep2wm6,https://abcnews.go.com/US/14-year-girl-installs-cameras-record-proof-alleged/story?id=68269840,12,2020-1-15,
BBC News: Trump impeachment: Second whistleblower emerges,87,0.92,de49pq,https://www.bbc.co.uk/news/world-us-canada-49953225,4,2019-10-6,
Dozens of black partygoers were arrested over less than an ounce of marijuana. Now they’re suing.,88,0.97,b2imt1,https://www.vox.com/identities/2019/3/15/18267260/cartersville-70-lawsuit-georgia-arrests-searches-detention-marijuana,4,2019-3-18,
Alexandria Ocasio-Cortez says lawmakers should lose their salaries too when they shut down the government,88,0.97,aa4wil,https://www.newsweek.com/alexandria-ocasio-cortez-says-lawmaker-should-lose-salaries-too-during-1269591,14,2018-12-28,
Report: Police major in charge of Breonna Taylor officers pressured investigators,87,0.99,jfr0s9,https://www.courier-journal.com/story/news/local/breonna-taylor/2020/10/09/report-lmpd-major-over-breonna-taylor-officers-pressured-investigators/5912650002/,0,2020-10-22,
"USPS will stop removing letter collection boxes in Western states until after the election, spokesman says",85,0.96,iavgok,https://amp.cnn.com/cnn/2020/08/14/politics/usps-removes-letter-collection-boxes-reduces-post-office-operating-hours/index.html,6,2020-8-17,
Police: 'Umbrella Man' was a white supremacist trying to incite George Floyd rioting,91,0.96,hzspoo,https://www.startribune.com/police-umbrella-man-was-a-white-supremacist-trying-to-incite-floyd-rioting/571932272/,7,2020-7-29,
"Black Teenager AWARDED A 2004 Mustang Convertible, FREE INSURANCE and A COLLEGE SCHOLARSHIP For Voluntarily Cleaning The Streets For 10 HOURS After A Protest",90,0.95,gyxyvj,https://www.thedailyfodder.com/2020/06/black-teenager-awarded-2004-mustang.html,9,2020-6-8,
Pence's office blocks public health officials from appearing on CNN,87,0.96,fxx75f,https://www.cnn.com/2020/04/09/media/pence-office-tv-bookings-coronavirus/index.html,15,2020-4-10,
Bernie Sanders' Fundraising Is Crushing All the Other Democratic Presidential Candidates,87,0.91,axlgp9,https://finance.yahoo.com/news/bernie-sanders-apos-fundraising-crushing-202744906.html?soc_src=community&soc_trk=fb&fbclid=IwAR3iqLwLLG6ZOnV4GQ97eODx2sLTlBHnWSolbk-bh4C6jkVMxV8NbBp1AeY,26,2019-3-5,
Federal Government Acknowledges U.S. Betrayed Terms Of Treaty With 2 Oregon Tribes,88,0.98,j4h1na,https://www.npr.org/2020/10/03/919831102/federal-government-acknowledges-u-s-betrayed-terms-of-treaty-with-2-oregon-tribe,2,2020-10-3,
The reviews are in: The first presidential debate was a disaster,84,0.96,j2m2hs,https://huntsvilletribune.com/the-reviews-are-in-the-first-presidential-debate-was-a-disaster/,41,2020-9-30,
GOP Rep. Louis Gohmert tests positive for coronavirus,86,0.96,i024lg,https://www.axios.com/louis-gohmert-coronavirus-f34719b4-79da-4ae7-970d-1b3c73a80c16.html,21,2020-7-29,
New York mayor Bill de Blasio helps paint Black Lives Matter mural in front of Trump Tower,89,0.94,holdn4,https://www.independent.co.uk/news/world/americas/us-politics/trump-tower-black-lives-matter-mural-new-york-bill-de-blasio-a9609546.html,5,2020-7-10,
Texas pauses reopening plan and elective surgeries as coronavirus cases and hospitalizations rise,83,0.98,hfvupc,https://www.cnbc.com/2020/06/25/texas-gov-abbott-pauses-states-reopening-plan-as-coronavirus-cases-hospitalizations-rise.html,4,2020-6-26,
"New York barber who defied stay-at-home orders and continued to ""illicitly"" cut hair tests positive for coronavirus",86,0.94,gkb63d,https://www.cbsnews.com/news/new-york-barber-diagnosed-coronavirus-kingston-stay-open-illicitly-cut-hair/?ftag=CNM-00-10aab7e&linkId=88703333,18,2020-5-15,
"Black woman shot and killed after Kentucky police entered her home as she slept, family says.",84,0.96,gipetc,https://www.google.com/amp/s/www.nbcnews.com/news/amp/ncna1205651,6,2020-5-13,
Trump threatened to veto stimulus package if it contained bailout money for USPS: report,88,0.95,fzsajr,https://thehill.com/homenews/administration/492377-trump-threatened-to-veto-stimulus-package-if-it-contained-bailout,30,2020-4-12,
Uninsured U.S. cancer patient with COVID-19 says $50K hospital bill might bankrupt her,87,0.93,fqzo2k,https://www.cbc.ca/radio/asithappens/uninsured-u-s-cancer-patient-with-covid-19-says-50k-hospital-bill-might-bankrupt-her-1.5509569,11,2020-3-29,
‘He Penetrated Me With His Fingers’: Joe Biden Accused of Sexual Assault,83,0.78,fpw4nr,https://lawandcrime.com/high-profile/he-penetrated-me-with-his-fingers-joe-biden-accused-of-sexual-assault/,87,2020-3-27,
Conspiracy Theorist Alex Jones Arrested on DWI Charge,90,0.97,fglwmj,https://www.thedailybeast.com/conspiracy-theorist-alex-jones-arrested-on-dwi-charge,8,2020-3-11,
"President Trump has been impeached under two different charges, making him the third president to have been impeached in US history.",86,0.94,ecmuip,https://www.cnn.com/2019/12/18/politics/house-impeachment-vote/index.html,37,2019-12-19,
"$16.8 Million In Campaign Funds Went To Trump Businesses, Latest Records Reveal",87,0.95,dor2c7,https://www.huffpost.com/entry/poliltical-campaigns-18-million-trump-properties_n_5db7837be4b0bd61024fe1f1?ncid=APPLENEWS00001&guccounter=1,8,2019-10-29,
'This Is a Coup': Protests Engulf Wisconsin Capitol as Outgoing Scott Walker and GOP Move to Cripple Democratic Power,88,0.94,a32388,https://www.commondreams.org/news/2018/12/04/coup-protests-engulf-wisconsin-capitol-outgoing-scott-walker-and-gop-move-cripple,0,2018-12-5,
A New Bill Would Make President Trump Pay For Travel To His Resorts,89,0.89,6c1eh6,http://www.newsy.com/stories/new-bill-wants-trump-to-pay-for-travel-to-his-properties/?utm_content=buffer6723d&utm_medium=social&utm_source=facebook.com&utm_campaign=buffer,8,2017-5-19,
Orlando nightclub shooting: About 20 killed in ‘domestic terror incident’ at gay club; gunman identified,85,0.92,4nqekd,https://www.washingtonpost.com/news/post-nation/wp/2016/06/12/orlando-nightclub-shooting-about-20-dead-in-domestic-terror-incident-at-gay-club/?hpid=hp_hp-top-table-high_orlando-banner%3Ahomepage%2Fstory&utm_term=.1d0a540acee1,5,2016-6-12,
Bald eagle takes down Michigan government drone,81,0.98,i9l8kn,https://www.nbcnews.com/news/amp/ncna1236687,10,2020-8-14,
Trump lashes out at social media companies after Twitter labels tweets with fact checks,85,0.93,grs8rx,https://news.google.com/articles/CAIiEAf6qMTc_Q8XZKMb8cYR9soqGAgEKg8IACoHCAowjtSUCjC30XQwzqe5AQ?hl=en-US&gl=US&ceid=US%3Aen,11,2020-5-28,
Trump falsely claims he never said US could test 5m a day for Covid-19 ‘very soon’,84,0.92,gayf24,https://www.independent.co.uk/news/world/americas/us-politics/donald-trump-latest-coronavirus-tests-us-how-many-update-a9491011.html,13,2020-5-1,
"‘Zero respect’: Trump points, mimes during U.S. anthem in Super Bowl video",83,0.91,eyzuet,https://globalnews.ca/news/6503805/donald-trump-national-anthem-video/,20,2020-2-5,
Uncovered emails reportedly show FCC made up DDoS claim and lied to reporters to cover it up,85,0.99,8pt4st,https://www.techspot.com/news/74987-uncovered-emails-reportedly-show-fcc-made-up-ddos.html,1,2018-6-9,
People are identifying the Charlottesville Nazis and getting them fired,84,0.97,6tj8c7,http://reverepress.com/news/charlottesville-nazis-getting-fired/,60,2017-8-14,
"Tape Released of Trump Saying He Spies on Naked Girls Back Stage, “Because I'm The Owner of The Pageant”",81,0.82,6jj9rr,http://www.bluedotdaily.com/trump-saying-he-spies-on-naked-girls-back-stage-because-im-the-owner-of-the-pageant/,23,2017-6-26,
Trump met with chants of protest as he pays respects to Ruth Bader Ginsburg,85,0.9,iyy8u3,https://thehill.com/homenews/administration/517974-trump-met-with-chants-of-protest-as-he-pays-respects-to-ruth-bader,27,2020-9-24,
A North Carolina racetrack lost nearly all of its sponsors and races after the owner placed a 'Bubba rope' for sale on Facebook,87,0.94,hivac2,https://news.yahoo.com/north-carolina-racetrack-lost-nearly-160635654.html,7,2020-7-1,
Left-Libertarian Alliance Introduces House Bill to End Qualified Immunity for Police Officers,84,0.99,gy4rvn,http://dagblog.com/link/left-libertarian-alliance-introduces-house-bill-end-qualified-immunity-police-officers-31501,0,2020-6-7,
FBI seizes GOP senator's cellphone in probe over stock sales after coronavirus briefing,80,0.96,gjk9kj,https://www.nbcnews.com/politics/justice-department/fbi-seizes-sen-richard-burr-s-cell-phone-probe-over-n1206726,10,2020-5-14,
Judge Gives Black Man 12 Years in Prison for Using Cell Phone While in Jail for Misdemeanor,85,0.93,eoif4f,https://www.deepsouthvoice.com/index.php/2020/01/11/black-man-sentenced-to-12-years-in-prison-for-using-his-cell-phone-while-in-jail-for-a-misdemeanor-mississippi-supreme-court-upholds-sentence,10,2020-1-14,
"Sen. Mitch McConnell trips, breaks shoulder in Kentucky",84,0.97,cm1q60,https://www.baltimoresun.com/news/nation-world/ct-nw-mitch-mcconnell-broken-shoulder-20190804-f2r7aphoqbfcxcukgficxqpcrq-story.html,18,2019-8-5,
Supreme Court appears to signal Obamacare will survive latest GOP challenge,79,0.96,jrqu00,https://www.cnn.com/2020/11/10/politics/supreme-court-obamacare-oral-arguments/index.html,5,2020-11-11,
Oregon Can’t Fight Wildfires Because Its Helicopters Were Sent To Afghanistan | Many of Oregon’s largest firefighting aircraft are not available because the Department of Defense has sent them to Afghanistan to fight in the 20-year-old war.,85,0.96,ir1v9c,https://archive.is/kMXMa,3,2020-9-12,
NY attorney general files lawsuit against Trump Organization: court records,83,0.94,iftqgo,https://www.reuters.com/article/us-usa-trump-new-york-lawsuit/ny-attorney-general-files-lawsuit-against-trump-organization-court-records-idUSKBN25K1XG?il=0,3,2020-8-25,
"Police shot Los Angeles security guard in the back five times, autopsy shows",85,0.96,hp73po,https://www.theguardian.com/us-news/2020/jul/10/andres-guardado-los-angeles-security-guard-shot-police-autopsy,0,2020-7-11,
Afghan translator who saved US lives and helped fellow translators escape danger becomes an American citizen,82,0.97,hl5m5b,https://www.cnn.com/2020/07/04/us/july-4-afghan-translator-american-citizen-cnnheroes-trnd/index.html,5,2020-7-4,
"Amid pandemic, Trump administration asks Supreme Court to overturn Obamacare",82,0.96,hg3jbk,https://abcnews.go.com/US/amid-pandemic-trump-administration-asks-supreme-court-overturn/story?id=71466593,22,2020-6-26,
"Second wave of coronavirus hits Florida, Texas, Arizona after reopenings",84,0.97,h0wuyn,https://nypost.com/2020/06/10/second-wave-of-coronavirus-hits-us-after-state-reopenings/,32,2020-6-11,
Ahmaud Arbery shooters arrested & charged,83,0.95,gfjhd9,https://reut.rs/3bezLyu,5,2020-5-8,
FDA issues warnings on chloroquine and hydroxychloroquine after ‘serious poisoning and death’ reported,83,0.96,g7a0du,https://www.cnbc.com/2020/04/24/fda-issues-warnings-on-chloroquine-and-hydroxychloroquine-after-serious-poisoning-and-death-reported.html,14,2020-4-24,
Postal Workers Union Leader Warns the USPS Could Be Dead in Three Months,80,0.95,g4a1xr,https://truthout.org/articles/postal-workers-union-leader-warns-the-usps-could-be-dead-in-three-months/,24,2020-4-20,
"Calls to US helpline jump 891%, as White House is warned of mental health crisis",85,1.0,fx24l9,https://abcnews.go.com/Politics/calls-us-helpline-jump-891-white-house-warned/story?id=70010113,3,2020-4-8,
“An Open License to Pollute”: The EPA Has Halted Enforcement Due to COVID-19,79,0.92,fq5r5o,https://www.motherjones.com/environment/2020/03/environmental-protection-agency-enforcement-coronavirus/,3,2020-3-28,
E. Jean Carroll who says Trump raped her seeks his DNA to test against sample from her dress: Carroll’s lawyers served notice to a Trump attorney Thursday for Trump to submit a sample March 2 in Washington for “analysis and comparison against unidentified male DNA present on the dress.”,82,0.95,ewechp,https://www.nbcnews.com/news/us-news/e-jean-carroll-who-says-trump-raped-her-seeks-his-n1126796,22,2020-1-31,
Forbes: New Congressional Marijuana Bill Is Actually Numbered H.R. 420,85,1.0,aejw1e,https://www.forbes.com/sites/tomangell/2019/01/09/new-congressional-marijuana-bill-is-actually-numbered-h-r-420/,3,2019-1-10,
Police commissioner to launch investigation after officer kills dog in fenced yard,79,0.96,ih06yt,https://www.whio.com/news/trending/police-commissioner-launch-investigation-after-officer-kills-dog-fenced-yard/XBEP7E7B65HNHK7DQFVM7ZIDIA/,21,2020-8-26,
"Target to Close on Thanksgiving, Ending Black Friday Kickoff",84,0.97,hyud99,https://www.nbclosangeles.com/news/national-international/target-to-close-on-thanksgiving-ending-black-friday-kickoff/2402969/?_osource=SocialFlowTwt_LABrand,8,2020-7-27,
White House seeks to discredit Fauci in memo leaked to reporters,82,0.98,hqjjox,https://abcnews.go.com/US/white-house-seeks-discredit-fauci-memo-leaked-reporters/story?id=71745265&cid=clicksource_4380645_4_three_posts_card_hed,26,2020-7-14,
Trump ambassadors sold stocks as president downplayed pandemic and virus was spreading,82,0.95,hmtd17,https://www.cnbc.com/2020/07/02/coronavirus-update-trump-ambassadors-sold-stocks-as-president-downplayed-pandemic.html,1,2020-7-7,
US Judge Cancels Permit for Keystone XL Pipeline,82,0.96,g247i0,https://apnews.com/89e3f21d344db86b8743665ea66b892c,0,2020-4-16,
Hospitals say feds are seizing masks and other coronavirus supplies without a word,81,0.94,fxcmnn,https://www.latimes.com/politics/story/2020-04-07/hospitals-washington-seize-coronavirus-supplies?utm_source=digg,5,2020-4-9,
"A Florida cop planted meth on random drivers, police say. One lost custody of his daughter.",83,0.99,cbzn9a,https://www.washingtonpost.com/nation/2019/07/11/florida-cop-meth-drugs-arrests-scandal/?utm_source=reddit.com&utm_term=.d272ae4f98b8,8,2019-7-12,
"Guess who Trump just called ""a rat""? John Dean, the White House counsel who cooperated with the Watergate Investigation and exposed the serious misconduct of Nixon that led to his impeachment and resignation.",80,0.9,98lrr7,https://abcnews.go.com/Politics/wireStory/trump-wh-lawyer-mcgahn-john-dean-type-rat-57268504,4,2018-8-20,
Puerto Ricans have voted in favor of statehood. Now it’s up to Congress.,82,0.98,jooqzg,https://www.vox.com/policy-and-politics/2020/11/4/21536603/puerto-rico-status-referendum-statehood-results,7,2020-11-6,
North Carolina says no to international observers at election polling sites,82,0.99,jk8si0,https://www.mcclatchydc.com/news/politics-government/election/article246754851.html,6,2020-10-29,
"Officer hit by bullet during ""ambush"" actually shot himself, say police",80,0.97,izhta2,https://www.newsweek.com/officer-hit-bullet-ambush-shot-himself-police-1533849,5,2020-9-25,
21 states sue White House over rollback of bedrock environmental law,80,0.96,iidy5j,https://thehill.com/policy/energy-environment/514160-21-states-sue-white-house-over-rollback-of-bedrock-environmental,4,2020-8-29,
Teen’s jaw smashed after asking guest to wear mask at Sesame Place,79,0.97,idi4q8,https://www.ajc.com/news/teens-jaw-smashed-after-asking-guest-to-wear-mask-at-sesame-place/JZUWGMRKEVGANE2MXPPDTQQ4KU/(ViaAJC),21,2020-8-21,
"Teen who shared photo of packed high school hallway says she's receiving threats. ""They kind of sent us to school and used us as guinea pigs to see what would happen later on.""",85,0.97,i75zyp,https://www.cnn.com/2020/08/10/us/paulding-school-crowded-halls-threats/index.html,8,2020-8-10,
3 charged in death of black teen who died after being restrained at youth facility,79,0.96,hfm5ir,https://www.cbsnews.com/news/cornelius-fredericks-death-lakeside-academy-staffers-charged-today/?ftag=CNM-00-10aab7e&linkId=91826760,3,2020-6-25,
Teenage boy whose death was linked to coronavirus turned away from urgent care for not having insurance,81,0.89,fqfaog,https://www.independent.co.uk/news/world/americas/coronavirus-teenager-death-california-health-insurance-care-emergency-room-covid-19-a9429946.html,7,2020-3-28,
Pastor who railed against 'gun-free zones' shot woman in the head after she refused sex with him: police,79,0.9,a1i2ds,https://www.rawstory.com/2018/11/pastor-railed-gun-free-zones-shot-woman-head-refused-sex-police/,14,2018-11-29,
More than 120 missing children found in Michigan human trafficking sting,81,0.97,9n46jr,https://www.wmur.com/article/more-than-120-missing-children-found-in-michigan-human-trafficking-sting/23679022,6,2018-10-11,
Evacuations ordered in Colorado and Utah as crews battle new blazes,79,0.98,jdk5dz,https://www.cnn.com/2020/10/18/us/colorado-utah-fires-evacuation/index.html?utm_content=2020-10-18T17%3A15%3A03&utm_term=link&utm_source=twCNN&utm_medium=social,0,2020-10-19,
Top intelligence office informs congressional committees it'll no longer brief on election security,82,0.99,iixe2c,https://www.cnn.com/2020/08/29/politics/office-of-director-of-national-intelligence-congress-election-security/index.html,10,2020-8-30,
White House seeks to block funds for coronavirus testing and tracing in relief bill,82,0.96,hu1wch,https://www.cnbc.com/2020/07/18/white-house-seeks-to-block-funds-for-testing-in-coronavirus-relief-bill-report.html,30,2020-7-19,
Three officers fired over selfie that reenacted chokehold on Elijah McClain,79,0.97,hkufb4,https://www.cbsnews.com/news/elijah-mcclain-police-fired-over-chokehold-reenacting-smile-aurora-colorado/,7,2020-7-4,
