title,score,upv_ratio,id,url,comms_num,created,body
"Former Minneapolis Cop Thomas Lane, One Of Four Officers Charged With George Floyd's Death, Leaves Jail",1405,0.94,h0yx7b,https://www.unilad.co.uk/news/former-cop-thomas-lane-one-of-four-officers-charged-with-george-floyds-death-leaves-jail/,1267,2020-6-11,
Car Plows Into Crowd After White Nationalist Protest In Virginia (GRAPHIC),383,0.85,6ta4wp,http://www.npr.org/sections/thetwo-way/2017/08/12/542982015/home-to-university-of-virginia-prepares-for-violence-at-white-nationalist-rally,36,2017-8-13,
Joe Biden elected president of the United States,208,0.94,jptro4,https://apnews.com/article/election-2020-joe-biden-north-america-national-elections-elections-7200c2d4901d8e47f1302954685a737f,33,2020-11-8,
Alexandria Ocasio-Cortez to co-sponsor House bill banning members of Congress from trading stocks,201,0.97,fo3ow1,https://www.newsweek.com/alexandria-ocasio-cortez-co-sponsor-house-bill-banning-members-congress-trading-stocks-1493851,21,2020-3-24,
U.S. lawmaker prepares bill aiming to end court protection for police,194,1.0,gusgjy,https://www.reuters.com/article/us-minneapolis-police-congress-idUSKBN23831W?taid=5ed56683842569000110c3e2&utm_campaign=trueAnthem:+Trending+Content&utm_medium=trueAnthem&utm_source=twitter,22,2020-6-2,
Kamala Harris asks Trump if any of his reported $421 million in debt is owed to a foreign nation,186,0.95,j228yr,https://news.yahoo.com/kamala-harris-trump-his-reported-421-million-debt-owed-foreign-nation-063158909.html,14,2020-9-30,
"Americans Overwhelmingly Want CDC and Not Trump or Congress to Lead Covid-19 Response, Yale Study Finds",178,0.97,g4vwmm,https://www.latestresearchnews.com/2020/04/20/coronavirus-response-america/,23,2020-4-21,
A New Bill is Filed to Federally Legalize Marijuana and Regulate it Like Tobacco,171,1.0,i2kvg5,https://www.mjtoday.org/2020/08/a-new-bill-is-filed-to-federally-legalize-marijuana.html,27,2020-8-3,
RESIST: Nearly 1 Million Join Movement to Strip Congress of Their Healthcare. Do You Support Them?,171,0.86,69xivf,http://www.learnprogress.org/strip-congress-healthcare/,4,2017-5-8,
Senator Files New Bill To Federally Legalize Marijuana And Regulate It Like Tobacco,170,0.99,i1xomr,https://www.marijuanamoment.net/senator-files-new-bill-to-federally-legalize-marijuana-and-regulate-it-like-tobacco/,11,2020-8-2,
Former US Defense chief tears into Trump: 'We are witnessing the consequences of three years without mature leadership',166,0.95,gwgjcx,https://cnnphilippines.com/world/2020/6/4/mattis-statement-trump.html,7,2020-6-4,
President Trump tried to register to vote in Florida using an out-of-state address,165,0.98,gvzxx4,https://www.washingtonpost.com/lifestyle/style/president-trump-tried-to-register-to-vote-in-florida-using-an-out-of-state-address/2020/06/03/687d0014-a4f2-11ea-b473-04905b1af82b_story.html,17,2020-6-4,
"Sen. Richard Burr, who sold stock before pandemic, voted in 2012 against banning insider trading for Congress",167,0.98,flvnxq,https://www.washingtonpost.com/nation/2020/03/20/coronavirus-richard-burr-stock/,9,2020-3-20,
"Federal judge rejects GOP effort to throw out 127,000 early ballots in Texas",164,0.98,jmvk6m,https://www.axios.com/texas-harris-county-drive-thru-voting-5a874c81-b927-48e7-8dcb-3bc1d5d76f6b.html,27,2020-11-3,
Trump loses legal bid to stop count in Michigan,160,0.98,jooj5p,https://news.sky.com/story/us-election-2020-live-donald-trump-and-joe-biden-making-final-pleas-to-us-voters-12121686,8,2020-11-6,
Washington state radio station won't air Trump briefings because of 'false or misleading information',153,0.95,foy1fy,https://thehill.com/blogs/news/blog-briefing-room/489439-seattle-radio-station-wont-air-trump-briefings-because-of-false-or,14,2020-3-26,
Pentagon confirms $35 million in aid still being withheld from Ukraine despite impeachment inquiry,152,0.96,dz694n,https://www.salon.com/2019/11/20/pentagon-confirms-35-million-in-aid-still-being-withheld-from-ukraine-despite-impeachment-inquiry/,10,2019-11-21,
"The Minneapolis police officer who knelt on George Floyd's neck had 18 previous complaints against him, police department says",151,0.99,gsjrx6,https://amp.cnn.com/cnn/2020/05/28/us/minneapolis-officer-complaints-george-floyd/index.html,7,2020-5-29,
"Grand Rapids Jewish cemetery vandalized with 'MAGA,' 'TRUMP'",144,0.97,jnarm4,https://www.detroitnews.com/story/news/local/michigan/2020/11/02/grand-rapids-jewish-cemetery-vandalized-maga-trump/6134776002/,13,2020-11-3,
"Steve King, House Republican With a History of Racist Remarks, Loses Primary",147,0.99,gvodr1,https://www.nytimes.com/2020/06/03/us/politics/steve-king-iowa-primary.html,15,2020-6-3,
Supreme Court rules electoral college representatives must honor choice of state’s voters,146,0.99,hm9e35,https://www.latimes.com/politics/story/2020-07-06/supreme-court-electoral-college-states-voters,42,2020-7-6,
FBI launches an investigation after billionaire pedophile Jeffrey Epstein committed suicide by hanging himself in prison a day after lawsuit by his 'sex slave' was unsealed and named a host of his powerful friends including Prince Andrew,144,0.99,cok8xd,https://www.dailymail.co.uk/news/article-7344181/Billionaire-Jeffrey-Epstein-dies-suicide-inside-Manhattan-jail-cell.html,34,2019-8-11,
A man who was sentenced to life in prison for selling $30 worth of marijuana will be freed,142,0.99,i6jss2,https://www.cnn.com/2020/08/08/us/man-freed-life-sentence-marijuana-trnd/index.html,2,2020-8-9,
44 people rendered unconscious from neck constraints by Minneapolis PD over past five years (60% were African Americans). The remainder were white or Native Americans.,145,0.99,guljpw,https://www.cnbc.com/2020/06/01/minneapolis-police-rendered-44-people-unconscious-with-neck-restraints-in-five-years.html,4,2020-6-1,
United Nations calls on US police to halt use of force against journalists covering protests,142,0.98,hxn4lc,https://www.independent.co.uk/news/world/americas/united-nations-journalism-protests-portland-oregon-donald-trump-press-freedom-a9637046.html,28,2020-7-25,
Trump admits he is undermining USPS to make it harder to vote by mail - The president says he opposes providing additional money to the postal service to help it deliver mail-in ballots,134,0.96,i95m9q,https://www.theguardian.com/us-news/2020/aug/13/donald-trump-usps-post-office-election-funding?CMP=Share_AndroidApp_Add_to_Firefox,11,2020-8-14,
GOP senator introduces bill to block lawmakers convicted of felonies from receiving pensions,138,1.0,fhfbii,https://thehill.com/homenews/senate/487169-gop-senator-introduces-bill-to-block-lawmakers-convicted-of-felonies-from,8,2020-3-12,
Irish people help raise 1.8 million dollars for Native American tribe badly affected by Covid-19 as payback for a $150 donation by the Choctaw tribe in 1847 during the Irish Potatoe famine,137,1.0,gdo764,https://www.independent.ie/world-news/coronavirus/grateful-irish-honour-their-famine-debt-to-choctaw-tribe-39178123.html,1,2020-5-5,
Ex-Navy SEAL who claimed he killed Osama bin Laden banned from Delta after maskless selfie,135,0.98,idy9cq,https://www.cbsnews.com/news/navy-seal-robert-oneill-delta-airlines-bans-face-mask/?ftag=CNM-00-10aab7e&linkId=97801254,26,2020-8-21,
North Face Becomes First Big Brand To Join Facebook Boycott,133,0.99,hcahqc,https://www.forbes.com/sites/jemimamcevoy/2020/06/19/north-face-becomes-first-big-brand-to-join-facebook-boycott/,19,2020-6-20,
Bernie Sanders leads Donald Trump by widest margin of all 2020 candidates: Election poll,137,0.93,esd2ya,https://www.newsweek.com/bernie-sanders-trump-poll-election-2020-biden-bloomberg-1483423,13,2020-1-22,
"DeLand, FL police fires new officer who complained superior was abusive to homeless person",135,0.98,hsasw5,https://www.news-journalonline.com/news/20180802/deland-police-fires-new-officer-who-complained-superior-was-abusive-to-homeless-person,22,2020-7-16,
Donald Trump impeachment rallies to take place across US on 'President's Day' national holiday,133,0.76,5uzr8q,http://www.independent.co.uk/news/world/americas/donald-trump-faces-not-my-presidents-day-impeachment-rallies-on-national-holiday-a7588046.html,17,2017-2-20,
Trump Moves To Withold Federal Funds From Left Leaning Cities,133,0.98,ilqyc6,https://nypost.com/2020/09/02/trump-orders-review-to-defund-nyc-other-anarchist-cities/,35,2020-9-3,
Baltimore Mayor Begs Residents To Stop Shooting Each Other So Hospital Beds Can Be Used For COVID-19 Patients,133,1.0,fkx73u,https://baltimore.cbslocal.com/2020/03/18/we-need-those-beds-baltimore-mayor-urges-people-to-put-down-guns-after-violence-continues-during-covid-19-pandemic/,9,2020-3-19,
House Democrat files criminal referral accusing Trump of subverting election,129,0.95,iae9rx,http://thehill.com/homenews/house/512135-house-democrat-files-criminal-referral-accusing-trump-of-subverting-election,15,2020-8-16,
Washington State Group Is 1st to Sue Fox News for Calling Coronavirus a 'Hoax',134,0.96,fv3hok,https://timesofsandiego.com/business/2020/04/02/washington-state-group-is-1st-to-sue-fox-news-for-calling-coronavirus-a-hoax/,12,2020-4-5,
Betsy DeVos could face jail after judge rules she violated 2018 order on student loans,131,0.98,dkm3wk,https://www.newsweek.com/betsy-devos-could-face-jail-after-judge-rules-violated-2018-order-1463764,5,2019-10-21,
Ghislaine Maxwell loses appeal to stop 'embarrassing documents' from being released,132,0.99,i0xedt,https://www.newshub.co.nz/home/world/2020/07/ghislaine-maxwell-loses-appeal-to-stop-embarrassing-documents-from-being-released.html,9,2020-7-31,
A New York Police Officer Was Caught on Camera Apparently Planting Marijuana in a Car — for the Second Time,128,1.0,fl22s9,https://theintercept.com/2020/03/18/nypd-misconduct-body-cameras-marijuana/,15,2020-3-19,
Man Kills Son And Wounds Husband of Judge Assigned Epstein Case,129,1.0,hugpg6,https://thesaintlouistimes.com/man-kills-son-and-wounds-husband-of-judge-assigned-epstein-case/,17,2020-7-20,
Prime minister calls for investigation into alleged police attack on Australian news crew outside White House,130,0.99,gv6i6g,https://thehill.com/homenews/media/500610-prime-minister-calls-for-investigation-into-alleged-police-attack-on,21,2020-6-2,
Coronavirus: White House considering scaling back Donald Trump’s role in daily virus briefings,129,0.97,g7xs1n,https://www.news.com.au/world/coronavirus/global/coronavirus-white-house-considering-scaling-back-donald-trumps-role-in-daily-virus-briefings/news-story/b5c1d3534f49d4707be2531feece499d,26,2020-4-26,
I archived all of MAGA Bomber Cesar Sayoc's tweets for when the account is inevitably removed,129,0.96,9rnauc,https://www.dropbox.com/s/hi7eomcyl2no3qh/HardRock2016.pdf?dl=0,11,2018-10-27,
"Federal Judge Rules Trump and Louis DeJoy Waged ‘Politically Motivated Attack’ Against USPS, Will Rescind Recent Changes",126,0.96,iv4laj,https://lawandcrime.com/2020-election/federal-judge-rules-trump-and-louis-dejoy-waged-politically-motivated-attack-against-usps-will-rescind-recent-changes/,19,2020-9-18,
"US President Donald Trump has ordered federal agencies to stop racial sensitivity training, labelling it ""divisive, anti-American propaganda"".",124,0.98,in4fqo,https://www.yahoo.com/news/trump-bans-anti-american-diversity-042400568.html,32,2020-9-6,
Utahns vote to remove slavery as a punishment for a crime from constitution,126,1.0,jo69rn,https://www.abc4.com/news/election/utahns-vote-to-remove-slavery-as-a-punishment-for-a-crime-from-constitution/,17,2020-11-5,
Colin Powell says he’s voting for Biden. Other top Republicans may soon follow.,127,0.97,gyjx7j,https://www.vox.com/2020/6/7/21283083/colin-powell-voting-biden-other-republicans-trump,7,2020-6-8,
"Officer on video saying he'll 'choke you out' before man dies is charged with ""involuntary"" manslaughter",125,0.95,h0own1,https://www.yahoo.com/news/officer-video-saying-hell-choke-010834242.html,9,2020-6-11,
Trump administration rejects California's disaster assistance request for wildfires,123,0.98,jc6hcf,https://edition.cnn.com/2020/10/15/politics/trump-california-fire-disaster-assistance/index.html,25,2020-10-16,
Poll shows majority of Americans want vacant Supreme Court Justice seat filled after election,122,0.89,j1esk9,https://www.foxnews.com/politics/poll-majority-americans-supreme-court-justice-election.amp,66,2020-9-29,
"Trump campaign fails to show evidence of vote-by-mail fraud, filing reveals",122,0.97,iep593,https://www.theguardian.com/us-news/2020/aug/21/trump-campaign-voter-fraud-pennsylvania,12,2020-8-23,
Ocasio-Cortez asks why US pays for 'unlimited war' but not Medicare-for-all,126,0.95,9yto9m,https://www.cnn.com/2018/08/08/politics/alexandria-ocasio-cortez-cnntv/index.html?sr=twCNN080818alexandria-ocasio-cortez-cnntv0906PMStory,21,2018-11-21,
Jeff Sessions says he’s ‘surprised’ Americans aren’t embracing his anti-marijuana stance,124,0.89,65v5wl,http://m.washingtontimes.com/news/2017/apr/13/jeff-sessions-surprised-americans-marijuana/,25,2017-4-17,
Bodycam video shows officer punching Alabama store owner who called 911 to report robbery,125,1.0,gzkqng,https://www.nbcnews.com/news/us-news/body-cam-footage-shows-officer-punching-alabama-store-owner-who-n1228006,26,2020-6-9,
Bernie Sanders jumps past Joe Biden in new national poll,121,0.95,ewv54x,https://theweek.com/speedreads-amp/892893/bernie-sanders-jumps-past-joe-biden-new-national-poll,8,2020-2-1,
Florida judge resigns from vote-counting board after donations to Trump campaign uncovered,121,0.98,jkmi8q,https://www.usatoday.com/story/news/politics/elections/2020/10/29/judge-brent-shore-florida-duval-county-vote-counting-head-trump-donations/6068234002/,8,2020-10-30,
"President Trump must turn over taxes to prosecutor, appeals court rules",122,0.99,j6u8mz,https://abc7.com/politics/trump-must-turn-over-taxes-to-prosecutor-appeals-court/6839939/,7,2020-10-8,
"White supremacists and militias have infiltrated police across US, report says",125,0.88,ihp2b1,https://www.theguardian.com/us-news/2020/aug/27/white-supremacists-militias-infiltrate-us-police-report,45,2020-8-28,
Portland mayor tear gassed after speaking with protesters on presence of federal agents,119,0.99,hwdlga,https://news.google.com/articles/CAIiEPhuSkVyji6a4m5DNGKXflQqGQgEKhAIACoHCAowocv1CjCSptoCMIrUpgU?hl=en-US&gl=US&ceid=US%3Aen,13,2020-7-23,
"Trump calls tear gas reports 'fake news,' but protesters' eyes burned just the same | The White House denies it was used to clear protesters before his photo op.",126,0.97,gx1czu,https://abcnews.go.com/Politics/trump-calls-tear-gas-reports-fake-news-protesters/story?id=71052769,11,2020-6-5,
Alex Trebek dead at 80,122,0.96,jqfqzn,https://www.nydailynews.com/snyde/ny-jeopardy-host-alex-trebek-dead-20201108-yxqn7dgnv5dsjj4e6uqte3twee-story.html?outputType=amp,15,2020-11-9,
Secret Service now says it did use pepper spray to clear protesters during the Trump church photo op,124,0.99,h8ipcw,https://www.nbcnews.com/politics/white-house/secret-service-now-says-it-did-use-pepper-spray-clear-n1231022,7,2020-6-14,
NYPD officer caught shoving female protester charged with assault,120,0.98,gzoxg7,https://nypost.com/2020/06/09/nypd-officer-caught-shoving-protester-charged-with-assault/,34,2020-6-9,
"Steve Bannon, three others charged with fraud in border wall fundraising campaign",121,0.98,idasa6,https://www.cnn.com/2020/08/20/politics/bannon-build-the-wall-indictment/index.html,23,2020-8-20,
Rolling Stones threaten to sue Trump over using their songs,120,0.97,hhisbk,https://apnews.com/9db607182deeb796c73612819a55afb5,2,2020-6-29,
"Judge temporarily bars federal officers from using force, threats, dispersal orders against journalists, legal observers",120,0.96,hx1ywc,https://www.oregonlive.com/portland/2020/07/judge-inclined-to-restrain-federal-law-enforcement-from-using-force-threats-dispersal-orders-against-journalists-legal-observers.html,9,2020-7-24,
Michigan sheriff joins protestors marching over George Floyd death,121,0.98,gu5r5c,https://a.msn.com/r/2/BB14QqtR?m=en-us&referrerID=InAppShare,3,2020-6-1,
DeVos sued for seizing student loan borrowers' wages during pandemic,119,0.98,gbsvix,https://www.politico.com/news/2020/05/01/devos-sued-for-seizing-student-loan-borrowers-wages-during-pandemic-228519,7,2020-5-2,
Members of Congress took small-business loans — and the full extent is unknown,119,0.98,har2r4,https://www.politico.com/news/2020/06/16/congress-small-business-loan-320625,7,2020-6-17,
"23 Year old Robert Fuller found hanging from tree in Palmdale, CA near City Hall. Investigators state ‘evidence points to suicide’",120,0.98,h7u6jn,http://theavtimes.com/2020/06/11/suspected-suicide-body-found-hanging-from-tree-in-poncitlan-square-palmdale-issues-statement/,39,2020-6-13,
Judge Rules All Three Men Charged in Ahmaud Arbery Killing Will Face Trial,117,1.0,gws75t,https://lawandcrime.com/live-trials/live-trials-current/ahmaud-arbery/judge-rules-all-three-men-charged-in-ahmaud-arbery-killing-will-face-trial/,1,2020-6-5,
Keystone Pipeline Shut Down After Leaking Oil in North Dakota and Nobody’s Talking About It: An unknown amount of crude oil has been leaked across the state of North Dakota.,119,0.97,dqiw2p,https://themindunleashed.com/2019/10/keystone-pipeline-shut-down.html,7,2019-11-2,
Virginia man who drove through group of protesters is leader of KKK,117,0.98,gz49mu,https://www.nbc12.com/2020/06/08/commonwealths-attorney-man-who-drove-through-group-protesters-is-leader-kkk/,15,2020-6-9,
Texas Woman Who Claimed COVID-19 Was ‘Media Driven’ Hoax Dies From Virus,117,0.96,fwe9o5,https://www.patheos.com/blogs/progressivesecularhumanist/2020/04/texas-woman-who-claimed-covid-19-was-media-driven-hoax-dies-from-virus/,29,2020-4-7,
"Kentucky mayor: ‘Listen up dips---s,’ coronavirus is ‘a big f---ing deal’",119,0.98,fokjpb,https://www.nydailynews.com/coronavirus/ny-coronavirus-kentucky-mayor-profane-facebook-post-20200324-ffabqggptnhq5cczp66dwscdkq-story.html,3,2020-3-25,
"Blue Lives Matter supporters arrested with slew of firearms outside Kenosha after police received tip about possible shooting, DOJ says",115,0.96,imkvkb,https://abcnews.go.com/US/blue-lives-matter-supporters-arrested-slew-firearms-kenosha/story?id=72808923,22,2020-9-5,
US Supreme Court unanimously rules that States can no longer impose excess fines or use Asset Forfeiture to raise money,115,0.99,asr1ng,https://www.usatoday.com/story/news/politics/2019/02/20/supreme-court-states-cant-impose-excessive-fees-fines-forfeitures/2919411002/,13,2019-2-21,
Fauci calls 'herd immunity' declaration embraced by White House 'ridiculous',114,0.97,jc687n,https://abcnews.go.com/Health/live-updates/coronavirus/?id=73623859,2,2020-10-16,
RNC chair Ronna McDaniel tested positive for coronavirus,117,1.0,j3vy3y,https://www.axios.com/rnc-chair-ronna-mcdaniel-coronavirus-positive-d361fcf6-061c-4af2-ad1d-55eeadba50d9.html?utm_source=twitter&utm_medium=social&utm_campaign=organic&utm_content=1100,6,2020-10-2,
US medical experts urge leaders to shut down the country and start over to contain Covid-19,115,0.93,hwqgzn,https://www.cnn.com/world/live-news/coronavirus-pandemic-07-23-20-intl/h_888b0f983d42b46d73b8e0d336b9721b,29,2020-7-24,
Ghislaine Maxwell prepared to snitch on ‘big names’ to save herself,114,1.0,hlkzyw,https://pagesix.com/2020/07/04/ghislaine-maxwell-prepared-to-snitch-on-big-names-to-save-herself/,49,2020-7-5,
Most believe stopping virus is larger priority than saving economy: poll,113,0.97,fu7y37,https://thehill.com/homenews/state-watch/490970-most-believe-stopping-virus-is-larger-priority-than-saving-economy-poll,9,2020-4-3,
Sacha Baron Cohen turned over a clip intended to be part of his controversial show “Who is America” to the FBI after accidentally exposing a pedophile ring during the filming process.,112,0.99,bzjyd5,https://www.vanityfair.com/hollywood/2018/12/sacha-baron-cohen-vegas-pedophile-ring?verso=true,14,2019-6-12,
Former MPD Officer Derek Chauvin Has Been Taken Into Custody In George Floyd's Death,113,1.0,gsxhda,https://minnesota.cbslocal.com/2020/05/29/derek-chauvin-arrested-george-floyd-death-minneapolis-police-officer/,19,2020-5-30,
A Teenager Posted About Her COVID-19 Infection on Instagram. A Deputy Threatened To Arrest Her If She Didn't Delete It.,111,0.98,g3tx67,https://reason.com/2020/04/17/a-teenager-posted-about-her-covid-19-infection-on-instagram-a-deputy-threatened-to-arrest-her-if-she-didnt-delete-it/,23,2020-4-19,
Virginia just decriminalized marijuana | The state is the 27th to decriminalize or legalize marijuana.,115,1.0,g0m1rz,https://www.vox.com/policy-and-politics/2020/4/13/21158103/virginia-marijuana-legalization-decriminalization,6,2020-4-14,
Oregon becomes first state to decriminalize hard drugs like heroin and cocaine,113,0.98,jo03j1,https://www-foxnews-com.cdn.ampproject.org/v/s/www.foxnews.com/us/oregon-first-state-decriminalize-hard-drugs-heroin-cocaine.amp?amp_js_v=a6&amp_gsa=1&usqp=mq331AQFKAGwASA%3D#aoh=16045061653478&referrer=https%3A%2F%2Fwww.google.com&amp_tf=From%20%251%24s&ampshare=https%3A%2F%2Fwww.foxnews.com%2Fus%2Foregon-first-state-decriminalize-hard-drugs-heroin-cocaine,4,2020-11-5,
Supreme Court votes 5-4 to let Gov. Newsom restrict attendance at religious services,111,0.99,gtdv07,https://www.sfchronicle.com/news/article/Supreme-Court-votes-5-4-to-let-Gov-Newsom-15304978.php,35,2020-5-30,
Rand Paul becomes first senator to test positive for coronavirus,114,0.98,fn3vmm,https://thehill.com/homenews/senate/488892-rand-paul-becomes-first-senator-to-test-positive-for-coronavirus,11,2020-3-23,
"Four Seasons Total Landscaping, the suburban garden center where Rudy Giuliani held a bizarre post-election press conference, is now selling merchandise to cash in",115,0.98,jqzhex,https://www.msn.com/en-us/news/politics/four-seasons-total-landscaping-the-suburban-garden-center-where-rudy-giuliani-held-a-bizarre-post-election-press-conference-is-now-selling-merchandise-to-cash-in/ar-BB1aPEY6?li=BBnb7Kz,7,2020-11-9,
U.S. Supreme Court Justice Ruth Bader Ginsburg dies of pancreatic cancer at age 87 | CBC News,114,0.94,ivhc2l,https://www.cbc.ca/news/world/supreme-court-justice-ruth-bader-ginsburg-dead-1.5730809,59,2020-9-19,
Deutsche Bank slammed with $150 million fine for failing to flag Jeffrey Epstein's shady transactions,110,0.99,ht8jdg,https://www.cnn.com/2020/07/07/business/jeffrey-epstein-deutsche-bank-fine/?iid=ob_article_organicsidebar_expansion,9,2020-7-18,
Lifetime Ban: JetBlue Bans Coronavirus Passenger Who Flew With The Virus,112,0.98,fj1zl9,https://www.techapis.in/2020/03/jetblue-airways-imposed-lifetime-ban-passenger-flew-with-infected-coronavirus.html,9,2020-3-15,
"A NYPD officer Michael Reynolds goes to Nashville for a bachelor party, breaks into Black family's home while blackout drunk, threatens to kill mother and her small children, &amp; calls them “fucking nig***s.” He only got 2 weeks in jail &amp; he's still employed by the NYPD.",111,0.98,eemg3d,https://twitter.com/KerrrryC/status/1208514877003710464,6,2019-12-24,
Michigan sheriff who appeared on stage with militia members facing calls to resign,112,0.99,jacl1d,https://thehill.com/homenews/state-watch/520723-michigan-sheriff-who-appeared-on-stage-with-militia-members-facing-calls,17,2020-10-13,
"USPS lost Army veteran's remains, delaying delivery, family says",114,0.95,if846r,https://thehill.com/homenews/news/513250-usps-lost-army-veterans-remains-family-says?amp&__twitter_impression=true,14,2020-8-24,
"Top DHS officials Wolf and Cuccinelli are not legally eligible to serve in their current roles, according to Government Accountability Office",114,0.97,i9pm1w,https://www.msn.com/en-us/news/politics/top-dhs-officials-wolf-and-cuccinelli-are-not-legally-eligible-to-serve-in-their-current-roles-congressional-watchdog-agency-finds/ar-BB17XOZ9,4,2020-8-15,
Federal agent kneels on Portland protester’s back as she screams ‘I can’t breathe’,114,0.93,hyzh3d,https://nypost.com/2020/07/27/federal-agent-kneels-on-portland-protesters-back-as-she-screams-i-cant-breathe/,13,2020-7-28,
Seattle protests: Nurse hit with pepper spray while trying to help man pushed over by police,109,0.95,hybtur,https://www.independent.co.uk/news/world/americas/seattle-black-lives-matter-protests-nurse-tear-gas-police-a9638626.html,8,2020-7-27,
Protests after Detroit teen detained over missed homework,112,0.98,hssvbj,https://www.bbc.co.uk/news/world-us-canada-53442474,7,2020-7-17,
White Woman Who Called Police On Black Bird Watcher In Central Park Placed On Leave | NPR,110,1.0,gr2ad8,https://www.npr.org/2020/05/26/862230724/white-woman-who-called-police-on-black-bird-watcher-in-central-park-placed-on-le,43,2020-5-27,
Washington Post: US intelligence warned Trump in January and February as he dismissed coronavirus threat,113,0.92,fmb782,https://edition.cnn.com/2020/03/20/politics/us-intelligence-reports-trump-coronavirus/index.html,8,2020-3-21,
Louisville TV Reporter Shot By Police During Live Broadcast,114,0.92,gtpo80,https://deadline.com/2020/05/louisville-reporter-shot-by-police-during-live-broadcast-1202947275/,11,2020-5-31,
Four officers fired following death of unarmed black man who had neck knelt on during arrest,108,0.99,grfeef,https://www.independent.co.uk/news/world/americas/police-arrest-black-man-neck-video-minneapolis-a9533796.html,14,2020-5-27,
"Joe Biden inches closer to Victory, Trump’s chances now very ‘slim’",108,0.95,jp6fu3,https://www.thesubsequent.com/world-news/joe-biden-inches-closer-to-victory-trumps-chances-now-very-slim/,24,2020-11-6,
"Fauci says ""anti-science bias"" is a problem in the US",109,0.98,hbo6ss,https://www.cnn.com/world/live-news/coronavirus-pandemic-06-18-20-intl/h_fcadb4e9f7cc9f3461c4a20c8074596a,6,2020-6-19,
