title,score,upv_ratio,id,url,comms_num,created,body
35 vintage photos taken by the EPA reveal what American cities looked like before pollution was regulated,57,1.0,crpcn4,https://www.businessinsider.com/what-us-cities-looked-like-before-epa-regulated-pollution-2019-8?fbclid=IwAR2sNi0ZOyoAWrCMS9TLjgW599nQUt0M0DCR3qZIpQZH49n83Jh08AUm0So&utm_source=fark&utm_medium=website&utm_content=link&ICID=ref_fark#baltimore-city-did-have-some-simple-techniques-to-keep-the-harbor-clean-here-a-screen-has-been-placed-across-the-water-to-trap-trash-a-heavy-rain-could-break-it-but-it-was-effective-when-cleaned-often-2,5,2019-8-18,
"White House Destroyed 5 Boxes of Documents Requested by FBI, Believes Former Trump Aid",55,0.89,blhq1s,https://hillreporter.com/former-trump-aide-alleges-white-house-destroyed-documents-requested-by-fbi-34227,9,2019-5-7,
Pharma & Insurance Gave $43M To 130 House Democrats Not Backing Medicare For All,53,0.91,b1xb2s,https://popularresistance.org/pharma-insurance-gave-43m-to-130-house-democrats-not-backing-medicare-for-all/,4,2019-3-17,
Judge’s Report Lays Out Extensive Evidence Of Abuse In Man’s Death In For-Profit Jail,54,0.94,az2kid,https://www.huffpost.com/entry/jail-death-cant-breathe-michael-sabbie_n_5c829bece4b08d5b78613f82,1,2019-3-9,
F.B.I. Opened Inquiry Into Whether Trump Was Secretly Working on Behalf of Russia,59,0.84,af2mte,https://www.nytimes.com/2019/01/11/us/politics/fbi-trump-russia-inquiry.html,40,2019-1-12,
U.S. judge halts Keystone XL pipeline construction,57,0.92,9vkia9,https://www.cbc.ca/news/canada/calgary/keystone-xl-pipeline-halt-construction-judge-1.4898539,0,2018-11-9,
"Verizon Lays Off 44,000, Transfers 2,500 More IT Jobs To Indian Outsourcer Infosys",59,0.92,9m5n75,https://www.forbes.com/sites/jeanbaptiste/2018/10/05/verizon-lays-off-44000-transfers-2500-more-it-jobs-to-indian-outsourcer-infosys/#6779bf5646f5,15,2018-10-7,
Dr. Ford came forward to report the attempted rape before Kavanaugh was nominated to the Supreme Court.,58,0.87,9jix36,http://www.chicagotribune.com/news/nationworld/politics/ct-brett-kavanaugh-christine-blasey-ford-hearing-20180927-story.html,22,2018-9-28,
Michael Cohen was in the room when Trump gave Don Jr. the go-ahead to collude with the Russians,58,0.87,92h9gj,https://www.usatoday.com/story/news/politics/2018/07/26/michael-cohen-mueller-approved-trump-tower-meeting/846902002/,7,2018-7-28,
A 28-year-old woman walked away with a fractured skull after managing to fight off a grizzly bear in the US state of Montana.,58,0.94,8luan1,http://www.bbc.com/news/world-us-canada-44243418,5,2018-5-25,
Nation That Says It Can't Afford Medicare for All Has Spent $5.6 Trillion on War Since 9/11,54,0.93,7cbt7f,https://www.commondreams.org/news/2017/11/08/nation-says-it-cant-afford-medicare-all-has-spent-56-trillion-war-911,6,2017-11-12,
Tough-on-crime Jeff Sessions lets Citigroup off with fine for money laundering across the border,56,0.92,6djuyw,http://www.dailykos.com/story/2017/5/25/1666046/-Tough-on-crime-Jeff-Sessions-lets-Citigroup-off-with-fine-for-money-laundering-across-the-border,4,2017-5-27,
"11 Officers Shot, 3 Fatally, by Snipers in Dallas",56,0.9,4rst8m,http://abcnews.go.com/US/shots-fired-dallas-amid-protest-recent-police-killings/story?id=40422456,8,2016-7-8,
Report: Video refutes trooper who denied unmasking protester,60,0.97,iyecqm,https://abcnews.go.com/US/wireStory/report-video-refutes-trooper-denied-unmasking-protester-73187229,1,2020-9-24,
"California church defying shutdown order got PPP loan of at least $350,000 in April",59,0.95,hv6ssu,https://www.sacbee.com/news/california/article244351182.html,3,2020-7-21,
Video Shows Law Enforcement Officers Slashing Tires at Minneapolis Protests,53,0.95,gyhxo7,https://slate.com/news-and-politics/2020/06/video-officers-slashing-tires-minneapolis-protests.html,4,2020-6-8,
Michigan Man Completing a 44-Year Life Sentence Dies From Coronavirus Just Weeks Away From Release,53,0.86,g5enny,https://www.theroot.com/michigan-man-completing-a-44-year-life-sentence-dies-fr-1842962879,8,2020-4-21,
New Data Shows New Swine Inspection System So Dangerous It Could Spur Another Zoonotic Pandemic,54,0.95,fwix3y,https://www.foodandwaterwatch.org/news/new-data-shows-new-swine-inspection-system-so-dangerous-it-could-spur-another-zoonotic-pandemic#.XouqwclMIf4.twitter,3,2020-4-7,
Trumps net worth drops from 3.1 billion to 2.1 billion amidst the coronavirus,56,0.92,fu0ne9,https://www.google.com/amp/s/www.forbes.com/sites/danalexander/2020/04/02/trumps-net-worth-drops-1-billion-as-coronavirus-infects-the-presidents-business/amp/,12,2020-4-3,
Cuomo on tri-state area 'enforced quarantine': 'I don't believe it would be legal',58,0.99,fqurbm,https://thehill.com/homenews/state-watch/490014-cuomo-on-tri-state-area-enforced-quarantine-i-dont-believe-it-would-be-legal,1,2020-3-29,
Sanders tops survey of young voters that shows Buttigieg trailing,56,0.87,estkq2,https://thehill.com/homenews/campaign-polls/479510-sanders-tops-survey-of-young-voters-that-shows-buttigieg-trailing,7,2020-1-23,
End of an era: Last Pearl Harbor veteran to be interred at USS Arizona Memorial,53,0.92,e7jw8r,https://www.latimes.com/california/story/2019-12-07/pearl-harbor-survivor-last-interment-hawaii,1,2019-12-8,
"‘A black vote for Trump is mental illness,’ Baptist church sign says",55,0.85,cxm6zv,https://www.mystateline.com/news/national/a-black-vote-for-trump-is-mental-illness-baptist-church-sign-says/,25,2019-8-31,
Insect 'apocalypse' in U.S. driven by 50x increase in toxic pesticides,55,0.95,cmwu9e,https://www.nationalgeographic.com/environment/2019/08/insect-apocalypse-under-way-toxic-pesticides-agriculture/,5,2019-8-7,
John Waters Responds to Trump: 'Give Me the Rats and Roaches of Baltimore' Over 'The Lies and Racism of Your Washington',60,0.93,cixg4v,https://www.mediaite.com/tv/john-waters-responds-to-trump-give-me-the-rats-and-roaches-of-baltimore-over-the-lies-and-racism-of-your-washington/,0,2019-7-28,
'I Felt Americans Needed to Know': Insurance Industry Whistleblower Gives Glimpse of Effort to Crush Medicare for All,58,0.91,bcju71,https://www.commondreams.org/news/2019/04/12/i-felt-americans-needed-know-insurance-industry-whistleblower-gives-glimpse-effort,5,2019-4-13,
Multiple Whistleblowers Raise Grave Concerns with White House Efforts to Transfer Sensitive U.S. Nuclear Technology to Saudi Arabia,57,0.94,asd1ma,https://oversight.house.gov/news/press-releases/multiple-whistleblowers-raise-grave-concerns-with-white-house-efforts-to,1,2019-2-20,
Cleaning New York's filthy harbor with one billion oysters,56,0.96,ainr07,https://www.cnn.com/2019/01/16/tech/billion-oyster-project/index.html,5,2019-1-22,
"With Deadline to Save Net Neutrality Days Away, Here Are the 18 Democrats Still Siding With Telecom Donors Over Open Internet",57,0.95,a3hd2u,https://www.commondreams.org/news/2018/12/05/deadline-save-net-neutrality-days-away-here-are-18-democrats-still-siding-telecom,2,2018-12-6,
"Mitch McConnell says deficit ballooned because of Social Security, Medicare, not Republican Tax Cuts",59,0.88,9ounmh,https://www.newsweek.com/deficit-budget-tax-plan-social-security-medicaid-medicare-entitlement-1172941,8,2018-10-17,
Nikki Haley resigns as US Ambassador to the United Nations,57,0.93,9mpoa6,https://71republic.com/2018/10/09/nikki-haley-resigns-as-u-s-envoy-to-the-united-nations/,7,2018-10-9,
"New York Times: Trump engaged in 'outright fraud' to avoid taxes, including on more than 400 million dollars that his father transferred to him.",54,0.91,9kwjmj,https://www.businessinsider.com/new-york-times-trump-tax-fraud-father-fred-inheritance-2018-10,2,2018-10-3,
"Fifth Circuit Says No, You Fucking May Not Strip Search A Classful Of Female Students To Find $50",52,0.91,8vkyi5,https://www.techdirt.com/articles/20180628/16330840134/fifth-circuit-says-no-you-fucking-may-not-strip-search-classful-female-students-to-find-50.shtml,6,2018-7-3,
Michigan college student who lied about campus rape sentenced to jail,56,0.88,8sop0q,http://www.foxnews.com/us/2018/06/19/michigan-woman-who-lied-about-being-raped-on-college-campus-sentenced-to-jail.html,4,2018-6-21,
FCC fines robocall spammer $120 million for illegal spoofing,54,0.96,8il5wb,https://www.yahoo.com/finance/news/fcc-fines-robocall-spammer-120-023200706.html,7,2018-5-11,
"Retired four-star Army general: Trump ""serious threat to US national security"" who is ""is refusing to protect vital US interests from active Russian attacks"" and is ""under the sway of [Vladimir] Putin.""",55,0.87,851d6v,http://thehill.com/blogs/blog-briefing-room/news/378884-retired-four-star-army-general-trump-serious-threat-to-us,0,2018-3-17,
Democrat Conor Lamb Declares Victory In Pennsylvania Special Election,59,0.99,84b2ni,https://71republic.com/2018/03/14/lamb-wins-special-election/,9,2018-3-14,
229 Republicans Voted Last Night to Prevent You from Ever Seeing Donald Trump's Tax Returns,52,0.88,5x9925,http://www.foxnews.com/politics/2017/02/28/house-republicans-block-democrats-pursuit-trumps-tax-returns.html,6,2017-3-3,
Rowan Co. Clerk Jailed In Contempt,57,0.97,3jiht8,http://www.lex18.com/story/29953141/rowan-co-clerk-jailed-in-contempt,9,2015-9-4,
DOJ's election crimes chief resigns after Barr allows prosecutors to probe voter fraud claims,54,0.93,jrk0xg,https://www.nbcnews.com/politics/2020-election/doj-s-election-crimes-chief-resigns-after-barr-directs-prosecutors-n1247220,26,2020-11-10,
Trump White House blocks FDA’s updated guideline for vaccine approval,53,0.93,j657rl,https://www.marketwatch.com/story/white-house-nixes-updated-fda-guidelines-on-vaccine-approval-01601981669?mod=home-page,11,2020-10-6,
Mother and six children removed from flight after 2-year-old wouldn't wear mask,53,0.9,iej508,https://www.cbsnews.com/news/mother-flying-six-children-removed-2-year-old-face-mask/?ftag=CNM-00-10aab7e&linkId=97841992,37,2020-8-22,
Nebraska school district cancels classes as staff catch coronavirus,59,0.97,iasx0y,https://www.reuters.com/article/us-coronavirus-health-education-nebraska/nebraska-school-district-cancels-classes-as-staff-catch-coronavirus-idUSKCN25C067,2,2020-8-16,
National debt surpasses $26 trillion,58,0.99,i68edi,https://www.erienewsnow.com/story/42238586/national-debt-surpasses-dollar26-trillion,6,2020-8-9,
Trump moves to pull US out of WHO amid pandemic,54,0.95,hneuyu,https://www.bbc.com/news/world-us-canada-53327906,11,2020-7-8,
FBI director: China is 'greatest threat' to US,57,0.94,hneb78,https://www.bbc.com/news/world-us-canada-53329755,11,2020-7-8,
"Study confirms new version of coronavirus spreads faster, but doesn't make people sicker",56,0.97,hkc19x,https://www.cnn.com/2020/07/02/health/coronavirus-mutation-spread-study/index.html,10,2020-7-3,
Most Americans think young adults should be financially independent by 22—but only 24% are,57,0.96,gl1jvw,https://www.cnbc.com/2019/10/26/only-24percent-of-young-adults-are-financially-independent-by-22-per-pew.html,8,2020-5-17,
Trump order to paint border wall black could drive up cost $500 million or more,52,0.93,ges4bf,https://www.washingtonpost.com/immigration/trump-border-wall-black-paint/2020/05/06/dbda8ae4-8eff-11ea-8df0-ee33c3f5b0d6_story.html,11,2020-5-7,
"Outbid and left hanging, U.S. states scramble for ventilators",57,0.96,fzo3td,https://www.reuters.com/article/us-health-coronavirus-usa-ventilators/outbid-and-left-hanging-u-s-states-scramble-for-ventilators-idUSKCN21S20D,0,2020-4-12,
MGM ordered to turn over unaired Celebrity Apprentice footage in suit against Trump and family,54,0.86,fy2b4c,https://www.dailymail.co.uk/news/article-8206357/MGM-ordered-turn-unaired-Celebrity-Apprentice-footage-suit-against-Trump-family.html,2,2020-4-10,
Unemployment benefit claims skyrocket to 3.283 million,56,0.98,fpb3x9,https://finance.yahoo.com/news/coronavirus-weekly-initial-unemployment-claims-march-21-153036254.html,1,2020-3-26,
Trump admin discusses possible encouragement of nationwide curfew in response to COVID-19 pandemic,54,0.94,fjqixr,https://ktla.com/news/coronavirus/trump-admin-discusses-possible-encouragement-of-nationwide-curfew-in-response-to-covid-19-pandemic/?taid=5e6fcd50e6e3ff000140079f&utm_campaign=trueAnthem%3A+Trending+Content&utm_medium=trueAnthem&utm_source=twitter,12,2020-3-17,
The highly secretive American founder of white supremacist group The Base has been tracked to Russia,56,0.95,eww4fk,https://www.bbc.com/news/world-51236915,5,2020-2-1,
"US suicide rate rises 40% over 17 years, with blue-collar workers at highest risk, CDC finds",58,0.95,eu4see,https://www.cnbc.com/2020/01/23/us-suicide-rates-rise-40percent-over-17-years-with-blue-collar-workers-at-highest-risk-cdc-finds.html,6,2020-1-26,
Trump loses bid to dismiss rape accuser's defamation lawsuit in New York,57,0.96,emuimd,https://www.reuters.com/article/us-usa-trump-defamation-lawsuit/trump-loses-bid-to-dismiss-rape-accusers-defamation-lawsuit-in-new-york-idUSKBN1Z82RT,0,2020-1-11,
"Sending unsolicited dick pics is now illegal in Texas, and could result in a $500 fine",58,0.95,d08b91,https://www.insider.com/unsolicited-dick-pic-sending-now-illegal-texas-500-fine-bumble-2019-9,15,2019-9-6,
AP news: Cop makes plea deal for beating Army Vet unconscious. They called him a false American. This is the face of racism in the US.,54,0.91,co72vb,https://apnews.com/7afdda25e96a46fea8d6285ff55f9f2a,16,2019-8-10,
Vehicle plows through crowd of peaceful protesters gathered at anti-violence rally in Wisconsin,55,0.91,clvroa,https://www.newsweek.com/vehicle-plows-through-crowd-gathered-anti-violence-rally-wisconsin-1452479,9,2019-8-4,
Not blowing smoke: Wind has overtaken 'risky' coal for energy use in Texas for the first time,55,0.92,chnb72,https://news.yahoo.com/not-blowing-smoke-wind-overtaken-013304447.html,0,2019-7-25,
Ocasio-Cortez Not Apologizing to Kevin McCarthy: “He Should Apologize to the Children That Have Been Separated From Their Parents”,55,0.87,c49lir,https://theintercept.com/2019/06/21/aoc-concentration-camps-immigration/,7,2019-6-24,
Elizabeth Warren vows to pass law if elected allowing for presidents to be indicted,57,0.94,bw6jem,https://www.cnn.com/2019/05/31/politics/elizabeth-warren-law-presidents-trump-indictment/index.html?utm_content=2019-06-02T12%3A04%3A04&utm_term=image&utm_medium=social&utm_source=twCN,18,2019-6-3,
"The average millennial has an average net worth of $8,000. That’s far less than previous generations.",53,0.91,bvn2go,https://www.washingtonpost.com/business/2019/05/31/millennials-have-an-average-net-worth-thats-significantly-less-than-previous-generations/?noredirect=on,13,2019-6-2,
Colorado becomes First State in the Nation to put a Cap on the Price of Insulin,54,0.95,bu159j,https://www.vaildaily.com/news/colorado-becomes-first-state-in-nation-to-cap-price-of-insulin/,3,2019-5-28,
Jared Kushner identified as senior White House official whose security clearance was denied by career officials,56,0.93,b9g11q,https://www.washingtonpost.com/politics/jared-kushner-identified-as-senior-white-house-official-whose-security-clearance-was-denied-by-career-officials/2019/04/03/fefa8dbe-5623-11e9-814f-e2f46684196e_story.html,1,2019-4-5,
Martin Shkreli Is Reportedly in Solitary Confinement After Trying to Run a Company From Prison,57,0.98,b8gzx3,https://gizmodo.com/martin-shkreli-is-reportedly-in-solitary-confinement-af-1833733012,1,2019-4-2,
Trump Has Slapped His Brand On Images Of The White House To Sell At His Trump Store,52,0.9,b5agjz,https://www.huffpost.com/entry/donald-trump-hotel-trump-store-white-house-ethics_n_5c95b983e4b057f7330b04e2,18,2019-3-25,
"Bipartisan effort underway to control how Trump grants, revokes security clearances",55,0.98,b10ddk,https://www.nbcnews.com/politics/congress/dem-republican-join-effort-control-how-trump-grants-revokes-security-n982941,5,2019-3-14,
Passenger gets gun through TSA checkpoint on Atlanta to Tokyo flight,58,0.95,afxh8h,https://www.nbcnews.com/news/us-news/passenger-gets-gun-through-tsa-checkpoint-atlanta-tokyo-flight-n958331?cid=public-rss_20190114,2,2019-1-15,
The Pentagon’s Massive Accounting Fraud Exposed,56,0.93,a2qa2f,https://www.thenation.com/article/pentagon-audit-budget-fraud/,1,2018-12-4,
Science academies urge paper ballots for all US elections,54,0.97,9dxgzu,https://www.nature.com/articles/d41586-018-06611-x,2,2018-9-8,
"Woman who alleges Mormon MTC president raped her is filmed testifying about him in church. Before she is forcibly removed from the pulpit, she warns the congregation that the church is harboring and protecting a rapist.",57,0.93,9cxt3b,https://kutv.com/news/local/woman-who-alleges-mtc-president-raped-her-filmed-testifying-about-rape-in-church,1,2018-9-5,
"White House puts out fabricated video and transcript of Helsinki press conference, omitting Putin's admission that he wanted Trump to win and directed his top officials to help him do that",52,0.88,91rcxj,https://www.dailykos.com/stories/2018/7/24/1783274/-White-House-rewrites-history-in-real-time-edits-out-question-about-election-interference,1,2018-7-25,
"Trump says North Korea's beaches would be good for hotels and condo, ignoring that half the population is starving",55,0.83,8qml13,http://www.businessinsider.com/trump-says-north-korea-beaches-great-place-for-hotels-condos-2018-6,21,2018-6-13,
This creep running for senate says it’s ‘normal’ to have sex with 12-year-old girls,51,0.91,8nmh78,https://babe.net/2018/05/29/mike-saari-62538,9,2018-6-1,
Poll: CNN Earns Title Of Least Trusted Cable News Network,56,0.79,5mliop,http://www.westernjournalism.com/poll-cnn-earns-title-of-least-trusted-cable-news-network/,21,2017-1-8,
"Hank Paulson, George W. Bush’s treasury secretary, who presided over both the meltdown of the U.S. economy and the subsequent bailout of his close friends and associates, has endorsed Hillary Clinton",56,0.86,4q1en8,http://www.breitbart.com/2016-presidential-race/2016/06/25/hank-paulson-cites-hillarys-globalist-platform-reason-endorsement/,0,2016-6-27,
Honda confirms 17th U.S. death in Takata air bag rupture,52,0.93,j4s6m6,https://www.reuters.com/article/us-honda-takata/honda-confirms-17th-u-s-death-in-takata-air-bag-rupture-idUSKBN26O10G,1,2020-10-4,
Federal government unveils plans to make coronavirus vaccine free for all Americans,58,0.94,iu3hr5,https://www.foxnews.com/politics/government-coronavirus-vaccine-plan-free-for-all-americans,13,2020-9-17,
US debt set to exceed size of its economy - first time since WWII. The expected budget deficit of $3.3 trillion would be more than triple the shortfall recorded in 2019.,56,0.94,ilgx2l,https://www.aljazeera.com/ajimpact/debt-set-exceed-size-economy-time-wwii-200902185303690.html,18,2020-9-3,
Kenosha police officers shot an individual after responding to domestic incident,53,0.96,ifhkxx,https://fox6now.com/news/kenosha-police-officers-shot-an-individual-after-responding-to-domestic-incident,35,2020-8-24,
YouTube prank stars Stokes Twins charged with felony after fake bank robbery video,58,0.93,i4h5lf,https://www.theverge.com/2020/8/5/21356403/stokes-twins-youtube-felony-charge-bank-robbery-prank-video,9,2020-8-6,
Exclusive: Gov. Ron DeSantis Acknowledges State’s Unemployment System Was Built With ‘Pointless Roadblocks’ To Pay Out ‘Least Number Of Claims’ – CBS Miami,55,0.94,i3xss1,https://miami.cbslocal.com/2020/08/04/exclusive-governor-ron-desantis-acknowledges-florida-unemployment-system-designed-frustrate/amp/?__twitter_impression=true,2,2020-8-5,
Donald Trump Says US Will Ban Chinese App TikTok - NDTV,56,0.95,i1m2et,https://www.ndtv.com/world-news/donald-trump-tiktok-ban-donald-trump-says-us-will-ban-chinese-app-tiktok-2272351,14,2020-8-1,
"Louisville police chief fired after officer bodycams found to be off during fatal shooting | The two officers involved, who were either not wearing or did not have their cameras activated, have been placed on administrative leave.",58,0.97,guujsi,https://www.nbcnews.com/news/us-news/louisville-police-chief-fired-after-officer-bodycams-found-be-during-n1221351,3,2020-6-2,
"On first day, small business loan application process plagued with problems",55,0.97,fuvsmf,https://abcnews.go.com/Politics/day-small-business-loan-application-process-plagued-problems/story?id=69965976,4,2020-4-4,
Rep. Jim Jordan accused of participating in OSU sexual abuse cover-up by ex-wrestler,57,0.94,f32n93,https://sports.yahoo.com/rep-jim-jordan-accused-of-participating-in-osu-sexual-abuse-coverup-by-exwrestler-165329175.html,10,2020-2-13,
Report alleges Amazon worked with Indiana to downplay warehouse worker’s death and safety concerns,52,0.96,e2ikrj,https://techcrunch.com/2019/11/26/report-alleges-amazon-worked-with-indiana-to-downplay-warehouse-workers-death-and-safety-concerns/,0,2019-11-28,
17 people were were busted in a child pornography sting in Florida. 2 of them were Disney employees,57,0.96,dtoa1h,https://www.cnn.com/2019/11/08/us/disney-employees-child-porn-sting/index.html,1,2019-11-9,
An Alabama Mayor Was Arrested for Slapping a Female Staffer in the Face,52,0.97,drc1e7,https://www.vice.com/en_us/article/wjwymx/an-alabama-mayor-was-arrested-for-slapping-a-female-staffer-in-the-face,5,2019-11-4,
New Trump plan to privatize national parks.,56,0.96,dibvrp,https://news.yahoo.com/campgrounds-in-national-parks-set-to-be-privatized-in-new-trump-plan-090019066.html,13,2019-10-16,
Texas officer who fatally shot woman in her home arrested on murder charges,55,0.97,di4bbn,https://abcnews.go.com/US/demand-justice-family-texas-woman-fatally-shot-home/story?id=66261203,5,2019-10-15,
"Woman dies at 102, DirecTV charges early termination fee",52,0.94,dcbhke,https://abc7news.com/society/woman-dies-at-102-directv-charges-early-termination-fee/5583488/,9,2019-10-2,
"This Utah woman was charged for being topless in her own home. Now, she’s arguing the lewdness law is unconstitutional.",54,0.94,dbtj8e,https://www.sltrib.com/news/2019/09/30/this-utah-woman-was/,14,2019-10-1,
"Autopsy finds broken bones in Jeffrey Epstein’s neck, deepening questions around his death",56,0.99,cqox0g,https://www.washingtonpost.com/politics/autopsy-finds-broken-bones-in-jeffrey-epsteins-neck-deepening-questions-around-his-death/2019/08/14/d09ac934-bdd9-11e9-b873-63ace636af08_story.html,12,2019-8-15,
"Arlington police officer shoots, kills woman while firing at loose dog",54,1.0,cl4kze,https://www.cbsnews.com/news/arlington-texas-police-officer-shoots-kills-woman-while-firing-at-loose-dog/,12,2019-8-2,
Alabama just passed a near-total abortion ban with no exceptions for rape or incest,56,0.97,bortjb,https://www.cbsnews.com/news/alabama-abortion-law-passed-alabama-passes-near-total-abortion-ban-with-no-exceptions-for-rape-or-incest-2019-05-14/,22,2019-5-15,
"Democrats in the U.S. House of Representatives want to bring back Congress’s long-dead science advice office. A draft funding bill released today calls for providing $6 million to re-establish the Office of Technology Assessment (OTA), which Republican lawmakers killed in 1995.",57,0.95,bjg2ye,https://www.sciencemag.org/news/2019/04/house-democrats-move-resurrect-congress-s-science-advisory-office,0,2019-5-1,
His 'swatting' call led to the death of a man. Now he is going to prison for 20 years.,54,0.97,b74krm,https://www.cnn.com/2019/03/29/us/swatting-suspect-20-year-sentence/index.html,13,2019-3-30,
Ex-Baylor frat president indicted on 4 counts of sex assault won't go to prison,53,0.9,azfzxk,https://www.cnn.com/2018/12/11/us/baylor-ex-frat-president-rape-allegation/index.html?fbclid=IwAR0lJ3HNXmqalnkz0GMqkKEWg6l2uqL82aOUs5ityNzLwsZLLUpcjSx6GAA,4,2019-3-10,
Porn Viewership Rises in Washington D.C. During Government Shutdown,56,0.89,ai1dky,https://www.thedailybeast.com/porn-viewership-rises-in-washington-dc-during-government-shutdown,0,2019-1-21,
Trump administration officials weighed speeding up the deportation of migrant children by denying them their legal right to asylum hearings,54,0.88,aha68h,https://www.nbcnews.com/politics/immigration/trump-admin-weighed-targeting-migrant-families-speeding-deportation-children-n958811,0,2019-1-18,
"“No wall.” Democrats approved the financing of the US government, despite the threat of the White House veto",56,0.87,acg9sa,https://freenews.live/no-wall-democrats-approved-the-financing-of-the-us-government-despite-the-threat-of-the-white-house-veto/,7,2019-1-4,
Only 19% of Americans want Trump setting national policy.,52,0.87,a71sdn,https://www.nbcnews.com/politics/meet-the-press/poll-62-percent-say-trump-isn-t-telling-truth-russia-n948226,4,2018-12-18,
White Woman fired after video of her blocking Black man from entering his downtown loft goes viral,57,0.92,9o9gpu,https://www.kmov.com/news/woman-confronts-blocks-man-from-entering-his-luxury-downtown-st/article_f40f212e-cf57-11e8-90b6-dfba9a0bf0c7.html,12,2018-10-15,
Woman's home shot up after she leaves negative Facebook review about restaurant,57,0.97,9cg7dw,https://www.actionnewsjax.com/news/trending-now/report-florida-woman-s-home-shot-up-after-she-leaves-negative-facebook-review-about-restaurant/825811025,4,2018-9-3,
Man accused of killing 3 after judge denies ex-wife’s request to have his guns taken away,55,0.93,8w2c05,http://thehill.com/homenews/395421-man-allegedly-kills-3-after-judge-denies-ex-wifes-request-to-have-his-guns-taken,2,2018-7-4,
Report: DeVos dismantles team probing fraud at for-profit colleges,53,0.98,8jczs1,https://www.axios.com/betsy-devos-education-department-fraud-for-profits-colleges--df336bd2-89be-471f-84fd-6f37aad1b943.html,2,2018-5-14,
Trump asked White House Counsel to lie to Mueller by falsely denying that Trump attempted to fire Mueller,56,0.86,82zk0o,http://nymag.com/daily/intelligencer/2018/03/trump-asked-mcgahn-to-lie-or-forgot-trying-to-fire-mueller.html,6,2018-3-9,
