title,score,upv_ratio,id,url,comms_num,created,body
"Trump backs off reopening as nation's coronavirus death toll nears 3,000",70,0.93,fs9yx7,https://www.msnbc.com/11th-hour/watch/trump-backs-off-reopening-as-nation-s-coronavirus-death-toll-nears-3-000-81404485619,12,2020-3-31,
Michael Bloomberg sees congregants turn their backs on him in historically black church in Selma,76,0.97,fc1st7,https://www.independent.co.uk/news/world/americas/us-election/michael-bloomberg-us-election-black-voters-stop-and-frisk-a9367696.html,3,2020-3-2,
Julian Assange says he was promised a Trump pardon if he would lie about Russia’s DNC hacking,72,0.87,f6e0kl,https://www.rawstory.com/2020/02/julian-assange-says-he-was-promised-a-trump-pardon-if-he-would-lie-about-russias-dnc-hacking/,6,2020-2-20,
"People no longer believe working hard will lead to a better life, survey shows",75,0.93,eubdkn,https://www.abc.net.au/triplej/programs/hack/2020-edelman-trust-barometer-shows-growing-sense-of-inequality/11883788,13,2020-1-27,
"Mormon Church accused of stockpiling billions, avoiding paying taxes",74,0.94,ece0k0,https://edition.cnn.com/2019/12/18/us/latter-day-saints-charity-funds-complaint/index.html,11,2019-12-18,
High school girl files federal complaint for having to race boys who identify as ‘girls’,72,0.87,e6g0u9,https://www.lifesitenews.com/news/high-school-girl-files-federal-complaint-for-having-to-race-boys?utm_content=buffered3ae&utm_medium=WCDM%2BBuffer&utm_source=facebook&utm_campaign=WCDM&fbclid=IwAR1Z58V12qzz5hG8Rh0_Oq8bwSzSecXyOuuk0u829pzTsugWjzA-ISucfDM,29,2019-12-5,
"A Michigan Man Underpaid His Property Taxes By $8.41. The County Seized His Property, Sold It—and Kept the Profits.",71,0.93,duceo3,https://reason.com/2019/11/06/a-michigan-man-underpaid-his-property-taxes-by-8-41-the-county-seized-his-property-sold-it-and-kept-the-profits/?fbclid=IwAR1wfwiEqMRCHtaZAzhBXlh5YWmk1cvnOngAB3r5oM7gMU0gEWxGK7kncuo,4,2019-11-10,
Psychedelic Mushroom Trials Approved By FDA,74,0.98,99yfyk,https://71republic.com/2018/08/24/psychedelic-mushroom-trials-approved/,8,2018-8-24,
"McCain: Trump ""abased himself ... abjectly before a tyrant."" ""The damage inflicted by President Trump’s naiveté, egotism, false equivalence, and sympathy for autocrats is difficult to calculate.""",76,0.93,8ze52j,https://www.cnbc.com/2018/07/16/john-mccain-says-trump-abased-himself-before-putin-at-summit.html,2,2018-7-17,
Militarized police firing tear gas at Standing Rock protesters; mainstream media nowhere in sight,76,0.89,5e1usx,https://www.reddit.com/r/USNEWS/comments/5e1usx/militarized_police_firing_tear_gas_at_standing/,5,2016-11-21,"Check Facebook, Bernie Sanders has shared the live stream "
Biden moves ahead by announcing transition teams despite Trump's efforts to block process,69,0.93,jrwgpq,https://us.cnn.com/2020/11/10/politics/transition-teams-biden/index.html,3,2020-11-11,
"Flomaton Police captain placed on administrative leave, could be fired after “put a bullet in their skull” comment about elections",76,0.99,jozk66,https://www.cbs42.com/alabama-news/put-a-bullet-in-their-skull-calls-to-fire-flomaton-police-captain-over-election-social-media-comments/,7,2020-11-6,
Vaccine skeptic Robert Kennedy Jr. says Trump asked him to lead commission on ‘vaccine safety’,72,0.96,jjsq2h,https://www.washingtonpost.com/politics/trump-to-meet-with-proponent-of-debunked-tie-between-vaccines-and-autism/2017/01/10/4a5d03c0-d752-11e6-9f9f-5cdb4b7f8dd7_story.html,9,2020-10-29,
"Analysis Finds True Pandemic Death Toll Is Much Higher Than 200,000 in US",76,0.91,j9fw64,https://www.bu.edu/articles/2020/analysis-finds-true-pandemic-death-toll-is-much-higher-than-200000-in-us/,19,2020-10-12,
Coronavirus infected hundreds of children at US summer camp,73,0.95,i1ek7l,https://news.yahoo.com/coronavirus-infected-hundreds-children-us-summer-camp-180016608.html?soc_src=community&soc_trk=fb,11,2020-8-1,
Rite Aid deployed facial recognition system in hundreds of U.S. stores,73,0.96,hzej3j,https://www.reuters.com/investigates/special-report/usa-riteaid-software/?utm_source=reddit.com,7,2020-7-28,
HHS confirms coronavirus hospital data will now be sent to DC instead of CDC,70,0.96,hrk4cm,https://www.cnn.com/2020/07/14/politics/trump-administration-coronavirus-hospital-data-cdc/index.html,15,2020-7-15,
‘You Do Not Deserve to Be Here’: Florida Man ID’d as DHS Employee Accosts Black Teen and Friends in Gated Community,75,0.97,hbyjje,https://lawandcrime.com/high-profile/you-do-not-deserve-to-be-here-florida-man-accosts-black-teen-and-friends-in-gated-community/,14,2020-6-19,
‘Light ‘em up!’: Police shoot paintballs at Minneapolis residents standing on their porch,71,0.93,gu73h3,https://www.independent.co.uk/news/world/americas/minneapolis-police-national-guard-paintball-shooting-porch-a9541016.html,18,2020-6-1,
Federal Government Revoking Reservation Status for Mashpee Wampanoag Tribe's 300 Acres,70,0.98,fymvex,https://time.com/5812813/mashpee-wampanoag-revoking-reservation-status/,6,2020-4-11,
"The FTC and New York attorney general are suing 'Pharma Bro' Martin Shkreli, claiming he created an illegal monopoly by raising a drug price by over 4,000%",70,0.97,ev3i7w,https://www.insider.com/ftc-new-york-attorney-general-sue-martin-shkreli-drug-pricing-2020-1,14,2020-1-28,
91 Fortune 500 companies paid no federal income tax in 2018,71,0.94,efjqrg,https://www.axios.com/fortune-500-companies-corporate-income-tax-7a7d3d36-0c48-4098-b352-deb93be1e4c0.html,4,2019-12-26,
Omar vows to continue being Trump's 'nightmare' as hundreds greet her in Minnesota,68,0.88,cf93cl,https://www.foxnews.com/politics/omar-pledges-to-continue-being-trumps-nightmare-as-hundreds-of-supporters-greet-her-in-minnesota,6,2019-7-19,
Ikea to use mushroom packaging that will decompose in a garden within weeks: ‘American company Ecovative is responsible for developing the alternative styrofoam.’,69,0.97,bkl1zq,https://www.globalcitizen.org/en/content/mushroom-fungi-packaging-ikea-decompose-ecovative/,2,2019-5-4,
Trump to visit Pittsburgh after shooting — but 65K people sign letter saying he’s not welcome,74,0.91,9smyi4,https://globalnews.ca/news/4610088/donald-trump-pittsburgh-shooting-letter-not-welcome/,18,2018-10-30,
NY Attorney General Investigating Why Dead People Supported The FCC's Attack On Net Neutrality,72,0.97,7fzq62,https://www.techdirt.com/articles/20171121/12153338664/ny-attorney-general-investigating-why-dead-people-supported-fccs-attack-net-neutrality.shtml,0,2017-11-28,
"Nobody 'stealing' your jobs, you spend too much on wars, Alibaba founder tells US",73,0.91,5pvlrl,https://www.minds.com/blog/view/670362523135909905,6,2017-1-24,
"Coronavirus case increase sets new U.S. record, rising to over 77K in one day",73,0.94,jgleze,https://www.nbcnews.com/news/us-news/coronavirus-case-increase-sets-new-u-s-record-rising-over-n1244490,12,2020-10-23,
Pennsylvania second lady films woman calling her a racial slur at the grocery store,69,0.94,j9rzk7,https://thehill.com/homenews/news/520589-pennsylvania-second-lady-films-racist-attack-on-her-in-grocery-store,9,2020-10-12,
Confidential U.S. government documents show big banks moved allegedly illicit funds,71,0.99,iwxukm,https://www.cnbc.com/2020/09/20/confidential-documents-reportedly-show-banks-moved-illicit-funds.html,4,2020-9-21,
Robert Mueller breaks his silence and condemns MAGA chief Trump for commuting Roger Stone's sentence,73,0.86,hprnzd,https://www.theguardian.com/us-news/2020/jul/12/robert-mueller-breaks-his-silence-and-condemns-trump-for-commuting-roger-stones-sentence,4,2020-7-12,
EU excludes United States from 'safe' travel list,70,0.93,hiqp55,https://www.reuters.com/article/us-health-coronavirus-eu-travel/eu-excludes-united-states-from-safe-travel-list-idUSKBN2410WJ,3,2020-7-1,
Leaked audio: Trump adviser says Republicans 'traditionally' rely on voter suppression,72,0.94,edjq7x,https://www.ctvnews.ca/world/leaked-audio-trump-adviser-says-republicans-traditionally-rely-on-voter-suppression-1.4739219,0,2019-12-21,
Pentagon Caught Paying PR Firm $540 Million to Make Fake Terrorist Videos,67,0.86,drpr2r,https://thefreethoughtproject.com/pentagon-fake-terrorist-videos/,5,2019-11-5,
"Keystone Pipeline Does as Experts Predicted, Spills 383,000 Gallons of Oil in North Dakota",71,0.92,dpxoc3,https://www.commondreams.org/newswire/2019/10/31/keystone-pipeline-does-experts-predicted-spills-383000-gallons-oil-north-dakota,10,2019-11-1,
Incarceration vs. education: America spends more on its prison system than it does on public schools,68,0.95,cp3qxd,https://www.dailymail.co.uk/news/article-6317783/Incarceration-vs-education-America-spends-prison-does-public-schools.html?fbclid=IwAR1ifzuxLio9onYYXwWsc-63EdIx4vxD6iclpozFMNIJd-9exQncSE2nbbA,6,2019-8-12,
Mueller Says Trump Could Be Criminally Charged After Presidency,72,0.87,cha11f,https://www.motherjones.com/politics/2019/07/mueller-says-trump-could-be-criminally-charged-after-presidency/?fbclid=IwAR3Gyn5JGezRzfigNyEK9cB_ovPTWx5gLw0IojGBZlwhABfLMf6gc3uZkFI,13,2019-7-24,
Teacher says she discovered ballot box left behind at Florida polling site,69,0.91,9vg6w0,https://thehill.com/blogs/blog-briefing-room/news/415837-teacher-says-she-discovered-ballot-box-left-behind-at-florida,11,2018-11-9,
"Doug Jones Pulls Off Electoral Miracle, Beats Alleged Child Molester Roy Moore",71,0.86,7jgfjd,https://www.thedailybeast.com/doug-jones-pulls-off-electoral-miracle-beats-alleged-child-molester-roy-moore,4,2017-12-13,
Bernie Sanders leads Democrats calling for Donald Trump to resign over sexual harassment allegations,72,0.92,7j3mpr,http://www.independent.co.uk/news/world/americas/donald-trump-sexual-harassment-allegations-bernie-sanders-democrats-resignation-call-protest-a8102991.html,22,2017-12-12,
"DNC destroyed Bernie Sanders' shot at the presidency, lawsuit claims",69,0.96,6lpfmv,http://www.newsweek.com/bernie-sanders-rigged-hillary-clinton-dnc-lawsuit-donald-trump-president-609582,5,2017-7-7,
Ex- GOP lawmaker charged with assaulting poll worker,70,0.96,jcrhb0,https://abcnews.go.com/Politics/wireStory/gop-lawmaker-charged-assaulting-poll-worker-73661368,12,2020-10-17,
Bodycam shows Salt Lake City police shooting 13-year-old boy with autism,73,0.94,iy0x2r,https://www.sltrib.com/news/2020/09/21/bodycam-shows-salt-lake/?fbclid=IwAR0Mk9OlGNA7rlxWpCOBioJWUi__QjT-IYkFr4DWfvDboM8COOwz5Qw3sOA&fbclid=IwAR2yQP5ANTkqej63QjHU8Gv7mAimtXSElBMR3_TXJTWrlzdcKAaOfnn0opY,10,2020-9-23,
Former DHS official says Trump 'throwing fuel on the fire' of far-right extremism,70,0.9,ilcw0y,https://thehill.com/policy/national-security/514791-former-dhs-official-says-trump-throwing-fuel-on-the-fire-of-far,6,2020-9-3,
College track star warned police about her ex-boyfriend 6 times in the 10 days before he killed her,70,0.98,gxnzpy,https://archive.thinkprogress.org/mccluskey-university-of-utah-warned-police-about-ex-boyfriend-6-times-bc08aed0fad5/,4,2020-6-6,
Man refusing to wear mask breaks arm of Target employee,71,0.93,gj2xli,https://www.cnn.com/videos/us/2020/05/12/target-store-mask-fight-orig-mg.cnn,17,2020-5-14,
"In four U.S. state prisons, nearly 3,300 inmates test positive for coronavirus -- 96% without symptoms",70,0.97,gamyjm,https://www.reuters.com/article/us-health-coronavirus-prisons-testing-in/in-four-u-s-state-prisons-nearly-3300-inmates-test-positive-for-coronavirus-96-without-symptoms-idUSKCN2270RX?fbclid=IwAR1set_LQXGXCzj5ReusxbasikE9zz3hm3oCuuI6lylum0_dOFm2xaeGgUQ&utm_source=reddit.com,9,2020-4-30,
Tampa megachurch pastor arrested after leading packed services despite 'safer-at-home' orders,72,0.94,fry4d5,https://www.fox13news.com/news/tampa-megachurch-pastor-arrested-after-leading-packed-services-despite-safer-at-home-orders,8,2020-3-31,
First cases of coronavirus in the federal prison system identified,73,0.98,fktefe,https://www.cnn.com/world/live-news/coronavirus-outbreak-03-18-20-intl-hnk/h_a54cf26ba807b067b5118719ea785eb5?utm_medium=social&utm_content=2020-03-18T17%3A20%3A42&utm_term=link&utm_source=twCNN,5,2020-3-19,
Stone juror: Trump 'attacking citizens for performing their civic duty',71,0.91,f9tw8p,https://thehill.com/homenews/administration/484676-stone-juror-trump-attacking-citizens-for-performing-their-civic-duty,3,2020-2-26,
‘Eye-popping’ study: Colorado River down 2 billion tons of water due to climate change,69,0.95,f8sa2e,https://tucson.com/news/local/eye-popping-study-colorado-river-down-billion-tons-of-water/article_f90dd5d8-d90b-5deb-bb6e-4c76613c2f02.html,7,2020-2-24,
"Trump's Trade War Will Cost Average Family $1,277 This Year, Budget Office Reveals",70,0.88,f17wou,https://www.huffpost.com/entry/cbo-1277-trump-trade-war-cost_n_5e3f5db1c5b6f1f57f125dfe,26,2020-2-9,
Trump threatens SNL with federal investigation for mocking him,73,0.91,b2azsd,https://www.msn.com/en-us/tv/humor/trump-threatens-snl-with-federal-investigation-for-mocking-him/ar-BBUT4g5?li=BBnb7Kz,16,2019-3-18,
"Senate defies Trump, passes historic resolution to end US support for Saudi Arabia in Yemen war",70,0.96,b0sjdj,https://www.businessinsider.com/senate-passes-new-resolution-to-end-us-support-for-saudis-in-yemen-2019-3,1,2019-3-14,
Congress banned Trump to withdraw from NATO,70,0.87,aiy45n,https://freenews.live/congress-banned-trump-to-withdraw-from-nato/?utm_source=reddit&utm_medium=ads&utm_campaign=engagement,13,2019-1-23,
Lady Gaga blasts Pence as ‘worst representation of what it means to be Christian’,69,0.84,ai6p91,https://thehill.com/blogs/blog-briefing-room/news/426267-lady-gaga-blasts-pence-as-worst-representation-of-what-it-means,5,2019-1-21,
Attorney General Jeff Sessions Resigns Following Midterms,70,0.93,9v2seh,https://www.nbcnews.com/politics/white-house/attorney-general-jeff-sessions-resigns-following-midterms-n933626,11,2018-11-8,
Sandy Hook parents sue conspiracy theorist Alex Jones for defamation,72,0.95,8cy5k4,https://www.reuters.com/article/us-texas-lawsuit-alexjones/sandy-hook-parents-sue-conspiracy-theorist-alex-jones-for-defamation-idUSKBN1HO2FU?feedType=RSS&feedName=domesticNews,5,2018-4-18,
Mooch out as Communications Director,66,0.83,6qqiv3,http://abcnews.go.com/Politics/anthony-scaramucci-white-house-communications-director/story?id=48952277,7,2017-8-1,
Debbie Wasserman Schultz Uses Voice Changer To Call Law Firm Suing DNC – Forgets To Disable Caller ID,70,0.85,6euhap,http://ibankcoin.com/zeropointnow/2017/06/01/debbie-wasserman-schultz-uses-voice-changer-to-call-law-firm-suing-dnc-forgets-to-disable-caller-id/,3,2017-6-2,
Chinese billionaire Jack Ma says the US wasted trillions on warfare instead of investing in infrastructure,70,0.93,5otudm,http://finance.yahoo.com/news/chinese-billionaire-jack-ma-says-190745392.html,7,2017-1-19,
Hillary Clinton is currently under investigation by the FBI’s Counterintelligence Division after classified information was found in some of Clinton’s emails,70,0.89,4qxq6v,http://www.mcclatchydc.com/news/politics-government/election/article87312972.html,1,2016-7-2,
"Fauci: As many as 400,000 Americans could die from coronavirus",68,0.9,j6p8s9,https://thehill.com/policy/healthcare/519935-fauci-as-many-as-400000-americans-could-die-from-coronavirus,12,2020-10-7,
"FBI investigating Ahmaud Arbery shooting as possible hate crime, lawyer says",69,0.97,gqsmy5,https://www.theguardian.com/us-news/2020/may/25/ahmaud-arbery-shooting-hate-crime-fbi,2,2020-5-26,
"Coronavirus pandemic may lead to 75,000 ""deaths of despair"" from suicide, drug and alcohol abuse, study says",68,0.91,gg7doa,https://www.cbsnews.com/news/coronavirus-deaths-suicides-drugs-alcohol-pandemic-75000/,13,2020-5-9,
Redacted FBI document hints at Israeli efforts to help Trump in 2016 campaign,65,0.91,gbj483,https://www.timesofisrael.com/redacted-fbi-document-hints-at-israeli-efforts-to-help-trump-in-2016-campaign/,0,2020-5-1,
Navy's top admiral recommends reinstating captain fired over virus warning,68,0.96,g7i2o7,https://abcnews.go.com/Politics/navys-top-admiral-recommends-reinstating-captain-fired-virus/story?id=70242413,1,2020-4-25,
Pence says there's been 'irresponsible rhetoric' from people downplaying coronavirus,65,0.96,fhv0jh,https://www.nbcnews.com/news/amp/ncna1156371,14,2020-3-13,
Army Veteran Has Prosthetic Legs Repossessed After VA Refuses to Pay for Them,69,0.91,eobpzx,https://www.newsweek.com/army-veteran-has-prosthetic-legs-repossessed-after-va-refuses-pay-them-1481390,11,2020-1-14,
Guess who paid for Donald Trump's crazy-corrupt Mar-a-Lago Christmas party? We did,68,0.88,eexg7f,https://www.salon.com/2019/12/23/guess-who-paid-for-donald-trumps-crazy-corrupt-mar-a-lago-christmas-party-we-did/,12,2019-12-24,
US Congress launches first Trump impeachment hearing as polls show president losing in key swing states - follow live,72,0.91,d5n083,https://www.independent.co.uk/news/world/americas/us-politics/trump-news-live-impeachment-hearing-la-today-california-twitter-bay-area-tax-returns-a9108946.html,2,2019-9-18,
Bernie Sanders Calls for a National Right-to-Repair Law for Farmers,70,1.0,bl9upu,https://motherboard.vice.com/en_us/article/8xzqmp/bernie-sanders-calls-for-a-national-right-to-repair-law-for-farmers,3,2019-5-6,
Denver may become the first US city to decriminalize psychedelic mushrooms,72,0.95,bejk2d,https://www.vox.com/policy-and-politics/2019/4/17/18412081/denver-psilocybin-magic-mushrooms-decriminalization-ballot-initiative,4,2019-4-18,
Judge rules all-male military draft unconstitutional,71,0.95,aul547,https://thehill.com/policy/defense/431334-judge-rules-all-male-military-draft-unconstitutional,12,2019-2-25,
Judge refuses to free Coast Guard officer accused of mass murder plot,68,0.98,ath703,https://www.nbcnews.com/news/crime-courts/judge-denies-request-free-coast-guard-officer-accused-mass-murder-n973946,5,2019-2-22,
FBI arrests 3 White terrorists planning to bomb Black community in Kansas,68,0.91,9poodd,http://rollingout.com/2016/10/15/fbi-arrests-3-white-terrorists-planning-bomb-black-community-kansas/?fbclid=IwAR12PuOk4eh5IZ4u0MYlwPjiFYK6AJVfWq1jm9mOgby6nd6X_SzQlWrn5HA,4,2018-10-20,
Virginia restaurant refused to serve Sarah Huckabee Sanders because she works for Trump.,72,0.92,8tbazu,https://thinkprogress.org/virginia-restaurant-refused-to-serve-sarah-huckabee-sanders-d1ff5258d9cf/,43,2018-6-24,
Steve Bannon personally overruled DHS decision not to include green card holders in travel ban.,73,0.93,5qu8fh,http://www.rawstory.com/2017/01/steve-bannon-personally-overruled-dhs-decision-not-to-include-green-card-holders-in-travel-ban-cnn/,5,2017-1-29,
"Deadly shooting reported at Sandy Hook Elementary School in Newtown, Connecticut",71,0.93,14uivl,http://www.nydailynews.com/new-york/deadly-shooting-reported-conn-elementary-school-article-1.1220164,51,2012-12-15,
"U.S. Coronavirus deaths pass 190,000",69,0.92,ipp0my,https://www.reuters.com/article/us-health-coronavirus-usa/u-s-covid-19-deaths-near-190000-iowa-and-south-dakota-emerge-as-new-hotspots-idUSKBN2601HS,12,2020-9-10,
New Tennessee law penalizes protesters who camp on state property with felony and loss of voting rights,66,0.97,ikdl80,https://www.cnn.com/2020/08/22/politics/tennessee-felony-camping-law-right-to-vote/index.html,12,2020-9-1,
"U.S. reports a record 60,000 new coronavirus cases in one day",67,0.97,hnzuvo,https://www.cbsnews.com/news/coronavirus-united-states-60000-cases-daily-high/,30,2020-7-9,
Neil Young 'NOT ok' with Trump playing his music at Mount Rushmore event,66,0.89,hlef0n,http://www.fordental.xyz/2020/07/neil-young-not-ok-with-trump-playing.html,6,2020-7-5,
Trump supporters burn Michigan absentee ballot applications,70,0.92,h8v5o6,https://www.detroitnews.com/story/news/michigan/2020/06/13/trump-supporters-burn-michigan-absentee-ballot-applications/111958524/,11,2020-6-14,
Washington troops hit with COVID-19 after George Floyd protests,68,0.99,h023cl,https://www.channelnewsasia.com/news/world/george-floyd-protests-covid-19-military-12821600,3,2020-6-10,
A sneaky attempt to end encryption is worming its way through Congress,68,0.98,fiwkoj,https://www.theverge.com/interface/2020/3/12/21174815/earn-it-act-encryption-killer-lindsay-graham-match-group,1,2020-3-15,
Colt to Stop Manufacturing AR-15 Rifles for Consumers,71,0.9,d6iwue,https://ktla.com/2019/09/19/colt-to-stop-manufacturing-ar-15-rifles-for-consumers/,11,2019-9-20,
"Investigators Seize 'Enough Fentanyl to Kill Over 14 Million People,' Say It's Coming From China",71,0.96,cy5cbo,https://www.theepochtimes.com/investigators-seize-enough-fentanyl-to-kill-over-14-million-people-say-its-coming-from-china_3063846.html,8,2019-9-1,
Mother of maggot-infested baby sentenced to life in prison,69,0.92,ayfk0u,https://wsbt.com/news/nation-world/mother-of-maggot-infested-baby-sentenced-to-life-in-prison?utm_source=taboola&utm_medium=referral&utm_campaign=internal,9,2019-3-8,
Oregon on track to be 1st state with mandated rent controls,71,0.97,at2jy0,https://www.apnews.com/5852bf92518d4502acb0270099066d73,17,2019-2-21,
"Trump met with Democrats on the “shutdown”, asked one question and left",65,0.93,aeiuk4,https://freenews.live/trump-met-with-democrats-on-the-shutdown-asked-one-question-and-left/,13,2019-1-10,
BBC News: US Senator John McCain dies aged 81,68,0.9,9abjf9,http://www.bbc.co.uk/news/world-us-canada-45312217,3,2018-8-26,
Mueller indictment: Russians began hacking Clinton emails right after Trump asked them to.,68,0.9,8ym3tx,http://media1.s-nbcnews.com/i/today/z_creative/netyksho_et_al_indictment.pdf,8,2018-7-14,
Ivanka Trump’s Clothing Line Is Made in a Chinese Factory Where Workers Earn $1 an Hour,69,0.93,67nvfr,http://www.slate.com/blogs/the_slatest/2017/04/25/ivanka_trump_s_clothing_line_made_by_chinese_factory_workers_earning_1_an.html,5,2017-4-26,
ACLU files lawsuit over federal agents in Portland,63,0.89,hu0txd,https://thehill.com/regulation/court-battles/507922-aclu-files-lawsuit-over-federal-agents-in-portland,10,2020-7-19,
Son of slain California doctor said dad was asking for directions when he was shot,66,0.98,honp9m,https://nypost.com/2020/07/09/son-of-slain-california-doctor-said-dad-was-asking-for-directions/,3,2020-7-10,
"'Shattered the previous record': Florida records more than 11,000 coronavirus cases in one day",67,0.97,hllur8,https://www.msnbc.com/weekends-with-alex-witt/watch/-shattered-the-previous-record-florida-records-more-than-11-000-coronavirus-cases-in-one-day-87018565692,20,2020-7-5,
"William Bryan Jr. -- the man who recorded the fatal shooting of Ahmaud Arbery -- has been arrested, GBI says",67,0.95,go7ivl,https://www.cnn.com/2020/05/21/us/roddie-bryan-arrested-ahmaud-arbery-case/index.html,24,2020-5-22,
Amazon suspends all warehouse shipments except medical supplies and ‘high-demand’ products,70,0.93,fk9g3i,https://www.independent.co.uk/news/world/americas/coronavirus-amazon-suspends-delivery-shipments-stock-price-a9406951.html,10,2020-3-18,
Trump Moves to Strip Hundreds of Thousands of Social Security Benefits,67,0.93,ebo1dd,https://www.truthdig.com/articles/trump-moves-to-strip-hundreds-of-thousands-of-social-security-benefits/,13,2019-12-17,
An Oklahoma man was given 15 years for cocaine possession. The substance was powdered milk,69,0.98,dmid15,https://nationalpost.com/news/world/an-oklahoma-man-was-given-15-years-for-cocaine-possession-the-substance-was-powdered-milk,8,2019-10-24,
"Montana Man Slams 13-Year-Old to Ground, Fracturing His Skull, for Not Removing Hat During Anthem",64,0.9,cn8anp,https://slate.com/news-and-politics/2019/08/montana-man-slams-13-year-old-breaks-skull-hat-national-anthem.html?fbclid=IwAR1FmEzfDzP9XWwpQZuDJFB-zezL2PSuexSyZTQAnCyIzZkbbJ15aWDgyFg,15,2019-8-8,
Trump Foundation agrees to dissolve under court supervision,67,0.94,a7cr1q,https://www.cnn.com/2018/12/18/politics/trump-foundation-dissolve/index.html,3,2018-12-19,
Papa John's founder apologizes for using N-word on conference call,69,0.94,8y3gqx,https://money.cnn.com/2018/07/11/news/companies/papa-johns-pizza-john-schnatter/index.html,37,2018-7-12,
Pandemic expected to push poorer Americans out of banking system: regulator,67,0.95,je8b9k,https://www.reuters.com/article/us-usa-fdic-unbanked-idUSKBN27427R?taid=5f8ddda626f6750001eb774c&utm_campaign=trueAnthem:+Trending+Content&utm_medium=trueAnthem&utm_source=twitter,2,2020-10-20,
Poll: 82 percent of voters support a national face mask mandate,67,0.95,i3w0yr,https://thehill.com/hilltv/what-americas-thinking/510317-poll-82-percent-of-voters-support-a-national-mask-mandate,3,2020-8-5,
Denver cop fired for ‘let’s start a riot’ post amid George Floyd protests,69,0.97,gvway4,https://nypost.com/2020/06/03/denver-cop-fired-for-lets-start-a-riot-post-amid-protests/,2,2020-6-3,
"Israeli bank fined nearly $1 billion in U.S. tax evasion, money laundering cases",68,0.99,gbo2p0,https://www.washingtonpost.com/world/israeli-bank-fined-nearly-1-billion-in-us-tax-evasion-money-laundering-cases/2020/05/01/855bc218-8b72-11ea-9dfd-990f9dcc71fc_story.html,2,2020-5-2,
FDA suspends most domestic food inspections,68,0.95,fop8ol,https://www.eater.com/2020/3/23/21191632/fda-routine-food-surveillance-inspections-suspended-coronavirus-covid-19-pandemic,11,2020-3-25,
Pennsylvania Governor orders non essential businesses closed.,70,0.98,flk466,https://pittsburgh.cbslocal.com/2020/03/19/gov-wolf-orders-all-non-life-sustaining-businesses-to-close-in-pennsylvania/,2,2020-3-20,
City refuses to let veterans be homeless builds them a tiny home village for free,69,0.95,f4i2hx,https://www.jumblejoy.com/city-refuses-to-let-veterans-be-homeless-builds-them-a-tiny-home-village-for-free-2,5,2020-2-16,
